ID,EN_TITLE,JP_TITLE,CLEAN_TITLE,LANGUAGE,ARTIST,GROUP_NAME,CATEGORY,PARODY,CHARACTER,TAGS,PAGES,UPLOAD_DATE,FORMATTED_DATE,SCRAPED_DATE
116415,"(C83) [PNO Group (Hase Yuu, Hikawa Yuuki, Yamamoto Ryuusuke)] Carni☆Phan tic factory 3 (Fate/zero,TYPE-MOON)","(C83) [PNOグループ (はせ☆裕, 斐川悠希, 山本竜助)] Carni☆Phanちっくふぁくとりぃ 3 (Fate/zero,TYPE-MOON)",Carni☆Phan tic factory 3,japanese,"yamamoto ryuusuke, hase yuu, hikawa yuuki",pno group,doujinshi,fate zero,"illyasviel von einzbern, irisviel von einzbern, shirou emiya, taiga fujimura","group, harem, lolicon, x-ray, bloomers, school swimsuit",46,2014-09-17 00:36:12,2014-09-17 07:36:12,2025-03-01 20:39:26
116416,"(C84) [PNO Group (Hase Yuu, Hikawa Yuuki, Yamamoto Ryuusuke)] Carni☆Phan tic Factory 4 (Fate/stay night, Fate/zero)","(C84) [PNOグループ (はせ☆裕, 斐川悠希, 山本竜助)] Carni☆Phanちっくふぁくとりぃ 4 (Fate/stay night, Fate/zero)",Carni☆Phan tic Factory 4,japanese,"yamamoto ryuusuke, hase yuu, hikawa yuuki",pno group,doujinshi,"fate stay night, fate zero","illyasviel von einzbern, irisviel von einzbern, shirou emiya, taiga fujimura","group, harem, lolicon, incest",22,2014-09-17 00:36:13,2014-09-17 07:36:13,2025-03-01 20:39:27
116417,[Ikamatsu] Pahpuru Manshon,[烏賊松] パープルマンション,Pahpuru Manshon,japanese,ikamatsu,,manga,,,,15,2014-09-17 00:36:13,2014-09-17 07:36:13,2025-03-01 20:39:28
116418,[Ikamatsu] Madonna Dorobou,[烏賊松] マドンナ泥棒,Madonna Dorobou,japanese,ikamatsu,,manga,,,,15,2014-09-17 00:36:13,2014-09-17 07:36:13,2025-03-01 20:39:29
116419,"(C85) [PNO Group (Hase Yuu, Hikawa Yuuki, Yamamoto Ryuusuke)] Carni☆Phan tic factory 5 (Fate/stay night, Fate/zero)","(C85) [PNOグループ (はせ☆裕, 斐川悠希, 山本竜助)] Carni☆Phanちっく ふぁくとりぃ5 (Fate/stay night, Fate/zero)",Carni☆Phan tic factory 5,japanese,"yamamoto ryuusuke, hase yuu, hikawa yuuki",pno group,doujinshi,"fate stay night, fate zero","rin tosaka, illyasviel von einzbern, irisviel von einzbern, shirou emiya, saber, taiga fujimura","group, harem, lolicon, bloomers",32,2014-09-17 00:36:14,2014-09-17 07:36:14,2025-03-01 20:39:29
116420,"[Toko-ya (HEIZO, Kitoen)] Saint Foire Festival/eve Nest [Digital]","[床子屋 (HEIZO, 鬼頭えん)] Saint Foire Festival/eve Nest [DL版]",Saint Foire Festival/eve Nest,japanese,"heizo, kitoen",toko-ya,doujinshi,,,anal,77,2014-09-17 00:36:15,2014-09-17 07:36:15,2025-03-01 20:39:30
116423,[Ashiomi Masato] Pink Links (PINKS LINKS) [Chinese] [2DJ汉化组],[アシオミマサト] PINKS LINKS (PINKS LINKS) [中国翻訳],Pink Links,"translated, chinese",ashiomi masato,,manga,,,"twins, schoolboy uniform, masturbation, schoolgirl uniform, incest, sister",43,2014-09-17 00:36:17,2014-09-17 07:36:17,2025-03-01 20:39:33
116424,[ここのき奈绪] あねかた2.5 [2DJ汉化组],,あねかた2.5,"translated, chinese",kokonoki nao,,manga,,,"big breasts, incest, apron, paizuri, sister",19,2014-09-17 00:36:17,2014-09-17 07:36:17,2025-03-01 20:39:34
116425,[ここのき奈绪] あねかた3 [2DJ汉化组],,あねかた3,"translated, chinese",kokonoki nao,,manga,,,"incest, sister",19,2014-09-17 00:36:18,2014-09-17 07:36:18,2025-03-01 20:39:35
116426,[タマイシキネ] 歪んだ性教育 [2DJ汉化组],,歪んだ性教育,"translated, chinese",tamai shikine,,manga,,,"incest, stockings, sister, shotacon",23,2014-09-17 00:36:18,2014-09-17 07:36:18,2025-03-01 20:39:35
116427,[Nagare Ippon] Ane Buri (COMIC AUN 2014-04-05) [Chinese] [2DJ汉化组],[流一本] あね・ぶり (COMIC 阿吽 2014年4・5月号) [中国翻訳],Ane Buri,"translated, chinese",nagare ippon,,manga,,,"big breasts, nakadashi, x-ray, incest, sister, impregnation, shotacon",27,2014-09-17 00:36:18,2014-09-17 07:36:18,2025-03-01 20:39:36
116429,[焼肉キング] オフ·レコでおねがい [2DJ汉化组],,オフ·レコでおねがい,"translated, chinese",yakiniku king,,manga,,,"nurse, incest, stockings, sister",16,2014-09-17 00:36:19,2014-09-17 07:36:19,2025-03-01 20:39:38
116431,[Yuuki Homura] Onee-chan! Tengoku 8 Ane (COMIC Anthurium 015 2014-07) [Chinese] [2DJ汉化组],[結城焔] お姉ちゃん！天国♥ 8姉 (COMIC アンスリウム 015 2014年7月号) [中国翻訳],Onee-chan! Tengoku 8 Ane,"translated, chinese",yuuki homura,,manga,,,"big breasts, incest, sister, bloomers, shotacon",9,2014-09-17 00:36:20,2014-09-17 07:36:20,2025-03-01 20:39:39
116433,[Kabuttari Kaburanakattari (Seihoukei)] Sekai ga Dou toka Icchau Otokonoko wa Denpa Kawaii.  [Chinese] [阿良良木刷牙子X月影姬 汉化],[かぶったりかぶらなかったり (せいほうけい)] セカイがどうとか言っちゃう男の娘は電波かわいい。 [中国翻訳],Sekai ga Dou toka Icchau Otokonoko wa Denpa Kawaii.,"translated, chinese",seihoukei,kabuttari kaburanakattari,doujinshi,,,"schoolgirl uniform, anal, crossdressing, males only, yaoi, shotacon",22,2014-09-17 00:36:32,2014-09-17 07:36:32,2025-03-01 20:39:41
116434,(C80) [pinvise (Suzutsuki Kurara)] Tennen Tenshi no XX Ressun (Sora no Otoshimono) [English] [Decensored] [Colorized],(C80) [pinvise (涼月くらら)] 天然天使の××れっすん (そらのおとしもの) [英訳] [無修正] [カラー化],Tennen Tenshi no XX Ressun,"english, translated",suzutsuki kurara,pinvise,doujinshi,sora no otoshimono,"astraea, mikako satsukitane","big breasts, strap-on, group, glasses, uncensored, anal, ffm threesome, femdom, bondage, full color, angel, stockings, collar",21,2014-09-17 00:36:33,2014-09-17 07:36:33,2025-03-01 20:39:42
116435,[Takasugi Kou] Crazy For You Kouhen (Ketsuen Jyukujo) [Chinese] [不觉晓个人汉化],[タカスギコウ] Crazy for You 後編 (けつえん熟女) [中国翻訳],Crazy For You Kouhen,"translated, chinese",takasugi kou,,manga,,,"milf, big breasts, group, ffm threesome, mother, defloration, incest, aunt",26,2014-09-17 00:36:34,2014-09-17 07:36:34,2025-03-01 20:39:43
116436,(Gakuen Trial) [ZCC (Zakiko)] Kuitsuku wa retsu (Super Danganronpa 2) [Chinese],(学園トライアル) [ZCC (ザキコ)] くいつくわれつ (スーパーダンガンロンパ2) [中国翻訳],Kuitsuku wa retsu,"translated, chinese",zakiko,zcc,doujinshi,danganronpa,"hajime hinata, nagito komaeda","scanmark, males only, yaoi",59,2014-09-17 00:36:34,2014-09-17 07:36:34,2025-03-01 20:39:44
116437,(C86) [KOTSU (KOTSU)] Shana no Kiss de okita. (Shakugan no Shana),(C86) [KOTSU (こつ)] シャナのキスで起きた。 (灼眼のシャナ),Shana no Kiss de okita.,japanese,,kotsu,doujinshi,shakugan no shana,shana,"lolicon, full color, blowjob",18,2014-09-17 00:36:38,2014-09-17 07:36:38,2025-03-01 20:39:45
116438,(C86) [Ice Sugar (Utano)] Onii-chan ni Otona ni Shite Moraou!,(C86) [Ice Sugar (うた乃)] お兄ちゃんにオトナにして貰おう!,Onii-chan ni Otona ni Shite Moraou!,japanese,utano,ice sugar,doujinshi,,,"schoolgirl uniform, defloration, incest, stockings, sister",18,2014-09-17 00:36:41,2014-09-17 07:36:41,2025-03-01 20:39:46
116439,(C86) [@ism (Aono Ribbon)] Ringo-iro (Atelier Series),(C86) [@ism (青野りぼん)] リンゴイロ (アトリエシリーズ),Ringo-iro,japanese,aono ribbon,at ism,doujinshi,atelier series,,"defloration, stockings",17,2014-09-17 00:36:44,2014-09-17 07:36:44,2025-03-01 20:39:46
116440,(SUPERKansai20) [solafana (Nanai)] Hitonatsu Musubite (Free!) [English],(SUPER関西20) [solafana (ナナイ)] ひと夏結びて (Free!) [英訳],Hitonatsu Musubite,"english, translated",nanai,solafana,doujinshi,free,"haruka nanase, rin matsuoka","males only, yaoi",23,2014-09-17 00:36:45,2014-09-17 07:36:45,2025-03-01 20:39:47
116441,(SUPER23) [BucketMilker (Ayahara)] Hot Candy Dolly (Free!),(SUPER23) [バケットミルカー (絢原)] Hot Candy Dolly (Free!),Hot Candy Dolly,japanese,ayahara,bucketmilker,doujinshi,free,"haruka nanase, rin matsuoka","unusual teeth, anal, crossdressing, males only, yaoi",20,2014-09-17 00:36:46,2014-09-17 07:36:46,2025-03-01 20:39:48
116442,"(C86) [ALMISM (Minatsuki Alumi)] Bitter na Coffee to Sugar na Milk ""Samishigariya no Koneko""",(C86) [ALMISM (水月あるみ)] ビターなコーヒーとシュガーなミルク「さみしがりやのこねこ」,"Bitter na Coffee to Sugar na Milk ""Samishigariya no Koneko""",japanese,minatsuki alumi,almism,doujinshi,,,"leg lock, stockings, catgirl",26,2014-09-17 00:36:47,2014-09-17 07:36:47,2025-03-01 20:39:49
116443,[3745HOUSE (MIkami Takeru)] ONE AND ONLY (Gintama) [English],[3745HOUSE (ミカミタケル)] ONE AND ONLY (銀魂) [英訳],ONE AND ONLY,"english, translated",mikami takeru,3745house,doujinshi,gintama,"toshiro hijikata, gintoki sakata","anal, males only, yaoi",25,2014-09-17 00:36:49,2014-09-17 07:36:49,2025-03-01 20:39:50
116444,[3745HOUSE (Mikami Takeru)] Dance on a SultryDay (Gintama) [English],[3745HOUSE (ミカミタケル)] Dance on a SultryDay (銀魂) [英訳],Dance on a SultryDay,"english, translated",mikami takeru,3745house,doujinshi,gintama,"toshiro hijikata, gintoki sakata","anal, males only, yaoi",24,2014-09-17 00:36:51,2014-09-17 07:36:51,2025-03-01 20:39:51
116445,"(SPARK8) [3745HOUSE, tekkaG (Mikami Takeru, Haru)] No Talking Man (Gintama) [English]",(SPARK8) [3745HOUSE、鉄火G (ミカミタケル、貼)] NO TALKING MAN (銀魂) [英訳],No Talking Man,"english, translated","haru, mikami takeru","tekkag, 3745house",doujinshi,gintama,"toshiro hijikata, gintoki sakata","anal, kimono, males only, yaoi",40,2014-09-17 00:36:52,2014-09-17 07:36:52,2025-03-01 20:39:51
116446,(HaruCC19) [3745HOUSE (MIkami Takeru)] Like cat and dog (Gintama) [English],(HARUCC19) [3745HOUSE (ミカミタケル)] LIKE CAT AND DOG (銀魂) [英訳],Like cat and dog,"english, translated",mikami takeru,3745house,doujinshi,gintama,"toshiro hijikata, gintoki sakata","catboy, full censorship, anal, males only, yaoi",28,2014-09-17 00:36:54,2014-09-17 07:36:54,2025-03-01 20:39:52
116447,[Zen9] Taikutsu na Gogo no Sugoshikata | A Way to Spend a Boring Afternoon [English] [Lazarus H],[zen9] 退屈な午後の過ごし方 第1-6章 [英訳],Taikutsu na Gogo no Sugoshikata | A Way to Spend a Boring Afternoon,"english, translated",zen9,,manga,,,"milf, virginity, underwater, group, full censorship, story arc, big ass, cheating, prostate massage, freckles, femdom, harem, pantyhose, lingerie",173,2014-09-17 00:36:55,2014-09-17 07:36:55,2025-03-01 20:39:53
116448,(C85) [Galley (ryoma)] Matomemonogatari (Bakemonogatari),(C85) [Galley (ryoma)] 纏物語 (化物語),Matomemonogatari,japanese,ryoma,galley,doujinshi,bakemonogatari,"koyomi araragi, shinobu oshino, tsukihi araragi, suruga kanbaru, karen araragi, mayoi hachikuji, nadeko sengoku, hitagi senjougahara, tsubasa hanekawa","sundress, big breasts, armpit sex, group, glasses, schoolgirl uniform, anal, sex toys, ffm threesome, femdom, bondage, ghost, kimono, lolicon, x-ray, footjob, defloration, bike shorts, incest, double penetration, stockings, small breasts, rape, sister, blindfold",146,2014-09-17 00:37:14,2014-09-17 07:37:14,2025-03-01 20:39:54
116449,(C82) [goo-paaa (Ocha)] Miiina (DARKER THAN BLACK),(C82) [goo-paaa (おちゃ)] Miiina (ダーカーザンブラック),Miiina,japanese,ocha,goo-paaa,doujinshi,darker than black,mina hazuki,"business suit, bdsm, big breasts, gag, anal, sex toys, bondage, kimono, x-ray, latex, pantyhose, rape, catgirl, deepthroat",201,2014-09-17 00:37:52,2014-09-17 07:37:52,2025-03-01 20:39:55
116450,(C85) [Xpanda (Zasha)] Yuli Magnetixx,(C85) [Xpanda (ザシャ)] ゆりまぐねてぃっくす,Yuli Magnetixx,japanese,zasha,xpanda,doujinshi,,,"females only, masturbation, yuri",22,2014-09-17 00:38:27,2014-09-17 07:38:27,2025-03-01 20:39:55
116451,(C85) [Bocchi Koubou (Rutubo)] Hebigami Nadeko-chan ga Futanari Shinobu-chan no Ochinchin de Onanii Suru Hon (Bakemonogatari),(C85) [ぼっち工房 (るつぼ)] 蛇神撫子ちゃんがふたなり忍ちゃんのおちんちんでオナニーする本 (化物語),Hebigami Nadekochan no Ochinchin de Onanii Suru Hon,japanese,rutubo,bocchi koubou,doujinshi,bakemonogatari,"shinobu oshino, nadeko sengoku","sundress, futanari, schoolgirl uniform, femdom, bondage, lolicon, x-ray, inflation, orgasm denial, big penis, stomach deformation",21,2014-09-17 00:38:31,2014-09-17 07:38:31,2025-03-01 20:39:56
116452,(C86) [Hacchakesou (PONPON)] Sword Art Online Hollow Sensual 2 (Sword Art Online),(C86) [はっちゃけ荘 (PONPON)] ソードアート・オンライン ホロウ・センシュアル 2 (ソードアート・オンライン),Sword Art Online Hollow Sensual 2,japanese,ponpon,hacchakesou,doujinshi,sword art online,"asuna yuuki, kazuto kirigaya, yuuki konno","group, ffm threesome",22,2014-09-17 00:38:35,2014-09-17 07:38:35,2025-03-01 20:39:57
116453,(C86) [Studio Tar (Kyouichirou)] Kojuto Nebaneba Dai Sakusen (Mikakunin de Shinkoukei) [English],(C86) [スタジオた～ (狂一郎)] 小姑ネバネバ大作戦 (未確認で進行形) [英訳],Kojuto Nebaneba Dai Sakusen,"english, translated",kyouichirou,studio tar,doujinshi,mikakunin de shinkoukei,"hakuya mitsumine, mashiro mitsumine","group, emotionless sex, anal, ffm threesome, mother, lolicon, footjob, incest, pantyhose, sister, blowjob, sole male",27,2014-09-17 00:38:38,2014-09-17 07:38:38,2025-03-01 20:39:58
116454,(C81) [Shimekiri Sanpunmae (Tukimi Daifuku)] Ecchi wa Shutsugeki no Mae ni… (Neon Genesis Evangelion) [English] [Team Koinaka],(C81) [〆切り3分前 (月見大福)] エッチは出撃のまえに… (新世紀エヴァンゲリオン) [英訳],Ecchi wa Shutsugeki no Mae ni…,"english, translated",tukimi daifuku,shimekiri sanpunmae,doujinshi,neon genesis evangelion,"shinji ikari, asuka langley soryu","schoolboy uniform, schoolgirl uniform",19,2014-09-17 00:38:44,2014-09-17 07:38:44,2025-03-01 20:39:59
116455,[Yomosugara (Yomogi Ringo)] Matane. (Vocaloid),[よもすがら (よもぎりんご)] またネ。 (VOCALOID),Matane.,japanese,yomogi ringo,yomosugara,doujinshi,vocaloid,len kagamine,"catboy, anal, yaoi, shotacon",16,2014-09-17 00:38:48,2014-09-17 07:38:48,2025-03-01 20:40:00
116456,(C86) [MOZUCHICHI (Mozuya Murasaki)] Kekkon Kakkosumi (Kantai Collection -KanColle-) [Chinese] [空気系☆漢化],(C86) [MOZUCHICHI (もずや紫)] ケッコンカッコスミ (艦隊これくしょん -艦これ-) [中国翻訳],Kekkon Kakkosumi,"translated, chinese",mozuya murasaki,mozuchichi,doujinshi,kantai collection,"takao, atago","big breasts, garter belt, bbw, group, ffm threesome, footjob, stockings",32,2014-09-17 00:38:52,2014-09-17 07:38:52,2025-03-01 20:40:01
116457,(C86) [MOZUCHICHI (Mozuya Murasaki)] Kekkon Kakko Sumi (Kantai Collection -KanColle-),(C86) [MOZUCHICHI (もずや紫)] ケッコンカッコスミ (艦隊これくしょん -艦これ-),Kekkon Kakko Sumi,japanese,mozuya murasaki,mozuchichi,doujinshi,kantai collection,"takao, atago","big breasts, garter belt, bbw, group, big ass, ffm threesome, foot licking, footjob, stockings, paizuri",30,2014-09-17 00:38:57,2014-09-17 07:38:57,2025-03-01 20:40:02
116458,(C86) [Kusari Caterpillar (Yoshiron)] KOWAREMONO [Chinese] [空気系☆漢化],(C86) [鎖キャタピラ (よしろん)] 娘ワレモノ [中国翻訳],KOWAREMONO,"translated, chinese",yoshiron,kusari caterpillar,doujinshi,,,"glasses, schoolgirl uniform, condom, defloration, multi-work series, incest, dilf, daughter, sole female, sole male",28,2014-09-17 00:39:00,2014-09-17 07:39:00,2025-03-01 20:40:02
116459,(C86) [Gainamon (Natsu no Koucha)] Hi Nichijou Seikatsu -Tanabatahen- (Touhou Project) [Chinese] [无毒汉化组],(C86) [がいなもん (夏の紅茶)] 非日常性活 -七夕編- (東方Project) [中国翻訳],Hi Nichijou Seikatsu,"translated, chinese",natsu no koucha,gainamon,doujinshi,touhou project,rumia,"kimono, lolicon, sole female, sole male",17,2014-09-17 00:39:03,2014-09-17 07:39:03,2025-03-01 20:40:03
116460,[Hyakumangoku (Various)] NEO-QUEENDOM Vol. 1,[百萬石 (よろず)] NEO-QUEENDOM 創刊号,NEO-QUEENDOM Vol. 1,japanese,"boss chin, purukogi, bash, honjou hideaki, dairoku tenmaou great, zunta, ifpark","nwa, double-h, hyakumangoku, bash-inc",doujinshi,,,"big breasts, anthology, femdom, dark skin, tall girl, muscle",74,2014-09-17 00:39:03,2014-09-17 07:39:03,2025-03-01 20:40:04
116461,[DBH (Rokusuke)] Distortion (BlazBlue),,Distortion,japanese,rokusuke,dbh,doujinshi,blazblue,"ragna the bloodedge, hazama",yaoi,32,2014-09-17 00:39:05,2014-09-17 07:39:05,2025-03-01 20:40:05
116462,[Hidemaru] Life with Married Women Just Like a Manga 2 - Ch. 1-7 [English] {Tadanohito},,Life with Married Women Just Like a Manga 27,"english, translated",hidemaru,,manga,,,"milf, big breasts, full censorship, glasses, story arc, cheating, femdom, exhibitionism, pantyhose, apron",145,2014-09-17 00:39:05,2014-09-17 07:39:05,2025-03-01 20:40:07
116463,[Millefeuille] Passion Packed Ch. 1-5 [English] {Tadanohito},[ミル･フィーユ] 情熱満ち満ち 第1-5話 [英訳],Passion Packed Ch. 1-5,"english, translated",millefeuille,,manga,,,"garter belt, swimsuit, mmf threesome, group, bikini, stockings, blowjob, collar",149,2014-09-17 00:39:08,2014-09-17 07:39:08,2025-03-01 20:40:08
116465,[RPG COMPANY 2 (Toumi Haruka)] MOVIE STAR IIb (Ah! My Goddess) [English] [EHCOVE] [Incomplete],[RPGカンパニー2 (遠海はるか)] MOVIE STAR IIb (ああっ女神さまっ) [英訳] [ページ欠落],MOVIE STAR IIb,"english, translated",toumi haruka,rpg company 2,doujinshi,ah my goddess,skuld,"masturbation, full color, incest",12,2014-09-17 00:39:12,2014-09-17 07:39:12,2025-03-01 20:40:09
116466,[Mayonnaise Bakufu (Sekihan)] YELLOW HONEY TRAP (HappinessCharge PreCure!) [Digital],[マヨネーズ幕府 (せきはん)] YELLOW HONEY TRAP (ハピネスチャージプリキュア！) [DL版],YELLOW HONEY TRAP,japanese,sekihan,mayonnaise bakufu,doujinshi,happinesscharge precure,"megumi aino, yuko omori, cure honey, cure lovely","magical girl, group, full censorship, anal, lolicon, yuri, double penetration, stockings, bukkake",32,2014-09-17 00:39:13,2014-09-17 07:39:13,2025-03-01 20:40:10
116467,(C86) [UROBOROS (Utatane Hiroyuki)] CLIME THE MOUNTAIN (Yama no Susume) [English] [KAKI],(C86) [UROBOROS (うたたねひろゆき)] CLIME THE MOUNTAIN (ヤマノススメ) [英訳],CLIME THE MOUNTAIN,"english, translated",utatane hiroyuki,uroboros,doujinshi,yama no susume,"aoi yukimura, hinata kuraue, kaede saitou","group, glasses, schoolgirl uniform, anal, ffm threesome, lolicon, incest, daughter",27,2014-09-17 00:39:15,2014-09-17 07:39:15,2025-03-01 20:40:11
116469,[MGW (Isou Doubaku)] YUNASTA DL (Saint Seiya Ω),[MGW (位相同爆)] ユナスタDL (聖闘士星矢Ω),YUNASTA DL,japanese,isou doubaku,mgw,doujinshi,saint seiya,aquila yuna,"nakadashi, stockings, mosaic censorship",32,2014-09-17 00:39:23,2014-09-17 07:39:23,2025-03-01 20:40:13
116470,[MGW (Isou Doubaku)] Shooby Dooby Head DL (Kantai Collection -KanColle-),[MGW (位相同爆)] シュビドゥビヘッドDL (艦隊これくしょん-艦これ-),Shooby Dooby Head DL,japanese,isou doubaku,mgw,doujinshi,kantai collection,"nagato, shimakaze","schoolgirl uniform, nakadashi, stockings, mosaic censorship, mecha girl",30,2014-09-17 00:39:28,2014-09-17 07:39:28,2025-03-01 20:40:14
116471,[Shioya (Shioya Maico)] CureCure Happiness! Honey to Asobou Hen (HappinessCharge PreCure!) [Digital],[塩屋 (塩屋舞子)] きゅあきゅあはっぴねす!○ニーと遊ぼう編 (ハピネスチャージプリキュア！) [DL版],CureCure Happiness! Honey to Asobou Hen,japanese,shioya maico,shioya,doujinshi,happinesscharge precure,"cure princess, cure honey","magical girl, group, full censorship, nakadashi, anal, full color, double penetration",16,2014-09-17 00:39:30,2014-09-17 07:39:30,2025-03-01 20:40:15
116472,"[Herohero Hospital (Herohero Tom, Isaki)] Class Me! [English] =SW= [Digital]","[へろへろHospital (へろへろTom, 伊佐木)] Class Me! [英訳] [DL版]",Class Me!,"english, translated","isaki, herohero tom",herohero hospital,doujinshi,,,"futanari, big breasts, bbw, schoolboy uniform, group, glasses, schoolgirl uniform, urination, breast feeding, huge breasts, anal, femdom, incest, lactation, stockings, ttm threesome, tall girl, bukkake, mind break, mosaic censorship, rape, teacher, blowjob, piss drinking, shotacon, slave, dickgirl on male, dickgirl on dickgirl, male on dickgirl",75,2014-09-17 00:39:32,2014-09-17 07:39:32,2025-03-01 20:40:16
116474,(C85) [Type-G (Ishigaki Takashi)] NANO. -Lyrical Nanoha Soushuuhen- (Mahou Shoujo Lyrical Nanoha) [English] [HZTL] [Incomplete],(C85) [Type-G (イシガキタカシ)] NANO. -リリカルなのは総集編- (魔法少女リリカルなのは) [英訳] [ページ欠落],NANO.,"english, translated",ishigaki takashi,type-g,doujinshi,mahou shoujo lyrical nanoha,fate testarossa,"big breasts, pregnant, stockings, incomplete",13,2014-09-17 00:39:37,2014-09-17 07:39:37,2025-03-01 20:40:17
116476,(C81) [Tenburi (Amei Sumeru)] 2Y (One Piece) [English] {doujin-moe.us},(C81) [てんぶり (あめいすめる)] 2Y (ワンピース) [英訳],2Y,"english, translated",amei sumeru,tenburi,doujinshi,one piece,"nami, usopp","swimsuit, dark skin, bikini, full color",12,2014-09-17 00:39:39,2014-09-17 07:39:39,2025-03-01 20:40:18
116477,(C79) [Status Doku (Isawa Nohri)] Usagi no Panyac (Anyamaru Tantei Kiruminzoo),(C79) [ステータスどく (いさわのーり)] ウサギのぱにゃっく (あにゃまる探偵 キルミンずぅ),Usagi no Panyac,japanese,isawa nohri,status doku,doujinshi,anyamaru tantei kiruminzoo,rimu mikogami,"glasses, bondage, lolicon, bunny girl, shotacon",17,2014-09-17 00:39:41,2014-09-17 07:39:41,2025-03-01 20:40:19
116478,[Tick (Tickzou)] Kusuguri Goumon Taikyuu Hon ~Dark Elf Zokuchou Hen~ [Chinese] [狂笑汉化组] [Digital],[擽—Tick— (てぃくぞー)] くすぐり拷問耐久本～ダークエルフ族長編～ [中国翻訳] [DL版],Kusuguri Goumon Taikyuu Hon,"translated, chinese",tickzou,tick,doujinshi,,,"elf, ahegao, bondage, tickling, dark skin, muscle",33,2014-09-17 00:39:42,2014-09-17 07:39:42,2025-03-01 20:40:20
116479,"(Anata to Love Live! 4) [""Tsu"" ga Mittsu. (Tsuttsu)] Chijo Live ! (Love Live!) [Chinese] [佳奈助个人汉化]",(あなたとラブライブ! 4) [「つ」がみっつ。 (つっつ)] チジョライブ！ (ラブライブ!) [中国翻訳],Chijo Live !,"translated, chinese",tsuttsu,tsu ga mittsu.,doujinshi,love live,umi sonoda,"group, schoolgirl uniform, nakadashi, double penetration, filming, mind break, dilf, chikan",17,2014-09-17 00:39:44,2014-09-17 07:39:44,2025-03-01 20:40:21
116480,(C86) [Botugo (RYO)] Koakuma (Hatsukoi) Girlfriend,(C86) [没後 (RYO)] 小悪魔(初恋)ガールフレンド,KoakumaGirlfriend,japanese,ryo,botugo,doujinshi,hatsukoi,koakuma,"full censorship, schoolgirl uniform, femdom, crossdressing, shotacon",26,2014-09-17 00:39:45,2014-09-17 07:39:45,2025-03-01 20:40:23
116481,(C86) [Shiratamaco (Shiratama)] Usagi Syndrome (Gochuumon wa Usagi desu ka?),(C86) [しらたまこ (しらたま)] うさぎシンドローム (ご注文はうさぎですか?),Usagi Syndrome,japanese,shiratama,shiratamaco,doujinshi,gochuumon wa usagi desu ka,chino kafuu,"females only, masturbation, solo action, lolicon, mosaic censorship",18,2014-09-17 00:39:47,2014-09-17 07:39:47,2025-03-01 20:40:24
116482,(C86) [4season (Saeki Nao)] school love festival2 (Love Live!),(C86) [4season (彩季なお)] school love festival2 (ラブライブ!),school love festival2,japanese,saeki nao,4season,doujinshi,love live,"hanayo koizumi, kotori minami",full censorship,22,2014-09-17 00:39:48,2014-09-17 07:39:48,2025-03-01 20:40:24
116483,(C86) [Singleton (Azuma Yuki)] Natsuyasumi no Jiyuu Kenkyuu - Yousei no Yuuwaku 2,(C86) [Singleton (あずまゆき)] 夏休みの自由研究 幼性の誘惑2,Natsuyasumi no Jiyuu Kenkyuu - Yousei no Yuuwaku 2,japanese,azuma yuki,singleton,doujinshi,,,"glasses, lolicon, teacher",24,2014-09-17 00:39:50,2014-09-17 07:39:50,2025-03-01 20:40:25
116484,(C86) [Singleton (Azuma Yuki)] adolescence,(C86) [Singleton (あずまゆき)] adolescence,adolescence,japanese,azuma yuki,singleton,doujinshi,,,"lolicon, randoseru, shotacon",25,2014-09-17 00:39:52,2014-09-17 07:39:52,2025-03-01 20:40:26
116485,(C86) [KOKIKKO (Sesena Yau)] Onsen Sube-sube Kanojo,(C86) [KOKIKKO (せせなやう)] 温泉 すべすべ彼女,Onsen Sube-sube Kanojo,japanese,sesena yau,kokikko,doujinshi,,,big breasts,23,2014-09-17 00:39:57,2014-09-17 07:39:57,2025-03-01 20:40:27
116486,(C86) [PINK CHUCHU (Mikeou)] Chino-chan no Pantsu (Gochuumon wa Usagi desu ka?),(C86) [PINK CHUCHU (みけおう)] チノちゃんのパンツ (ご注文はうさぎですか?),Chino-chan no Pantsu,japanese,mikeou,pink chuchu,doujinshi,gochuumon wa usagi desu ka,"kokoa hoto, chino kafuu","females only, masturbation, lolicon, yuri",25,2014-09-17 00:40:02,2014-09-17 07:40:02,2025-03-01 20:40:28
116489,[Ozaki Akira] MAMA ga IDOL!? Ch. 4-6 [Chinese],[尾崎晶] ママがアイドル！？ 第4-6話 [中国翻訳],MAMA ga IDOL!? Ch. 4-6,"translated, chinese",ozaki akira,,manga,,,"big breasts, group",54,2014-09-17 01:34:27,2014-09-17 08:34:27,2025-03-01 20:40:30
116490,[Teruwo] Boutaikko Rakugaki 3,[てるを] 膨体っ子ラクガキ3,Boutaikko Rakugaki 3,japanese,teruwo,,doujinshi,,,"big breasts, replaced, huge breasts, breast expansion, ass expansion, chikan",10,2014-09-17 01:49:25,2014-09-17 08:49:25,2025-03-01 20:40:31
116491,(C84) [N.S Craft (Simon)] DE (Mahou Shoujo Lyrical Nanoha),(C84) [N.S Craft (さいもん)] DE (魔法少女リリカルなのは),DE,japanese,simon,n.s craft,doujinshi,mahou shoujo lyrical nanoha,"erio mondial, fate testarossa, caro ru lushe, teana lanster",stockings,31,2014-09-17 01:49:30,2014-09-17 08:49:30,2025-03-01 20:40:32
