ID,EN_TITLE,JP_TITLE,CLEAN_TITLE,LANGUAGE,ARTIST,GROUP_NAME,CATEGORY,PARODY,CHARACTER,TAGS,PAGES,UPLOAD_DATE,FORMATTED_DATE,SCRAPED_DATE
115909,(C78) [Rampant (Dodai Shouji)] TRAP TOOL (Monster Hunter) [English] [Tonigobe],(C78) [Rampant (土代昭治)] TRAP TOOL (モンスターハンター) [英訳],TRAP TOOL,"english, translated",dodai shouji,rampant,doujinshi,monster hunter,,"futanari, sex toys, military, mosaic censorship, rape",23,2014-09-07 22:32:30,2014-09-08 05:32:30,2025-03-01 20:31:55
115911,"(C86) [TwinBox (Sousouman, Hanahanamaki)] Sex Friend (Black Bullet)","(C86) [TwinBox (草草饅, 花花捲)] セックスフレンド (ブラック・ブレット)",Sex Friend,japanese,"sousouman, hanahanamaki",twinbox,doujinshi,black bullet,"kisara tendou, enju aihara","group, schoolgirl uniform, ffm threesome, lolicon, defloration, stockings",24,2014-09-07 23:06:44,2014-09-08 06:06:44,2025-03-01 20:31:56
115912,(C86) [Genei Teito (Chouzetsu Yarou)] Seifuku wa Pii no Ato de (Sekai Seifuku ~Bouryaku no Zvezda~),(C86) [幻影帝都 (超絶野朗)] 征服はピーの後で (世界征服〜謀略のズヴィズダー〜),Seifuku wa Pii no Ato de,japanese,chouzetsu yarou,genei teito,doujinshi,sekai seifuku bouryaku no zvezda,"asuta jimon, kate hoshimiya","femdom, eyemask, lolicon, footjob, mosaic censorship",23,2014-09-07 23:06:44,2014-09-08 06:06:44,2025-03-01 20:31:57
115913,(C86) [AMAGI AN IRONWORKS (Ebisu)] HOBBY`S BLOCK!! 19 (No Game No Life),(C86) [天城製鉄所 (えびす)] HOBBY`S BLOCK!!19 (ノーゲーム・ノーライフ),HOBBY`S BLOCK!! 19,japanese,ebisu,amagi an ironworks,doujinshi,no game no life,shiro,"group, netorare, ahegao, lolicon, defloration, double penetration, stockings, mind break, mosaic censorship, rape",26,2014-09-07 23:06:45,2014-09-08 06:06:45,2025-03-01 20:31:58
115914,(C86) [Natsuiro Terrace (Kishimasa)] Innyuu Futanari Bourei Shoujo ~ Ochite Chirasu wa Sumizome Sakura (Touhou Project),(C86) [夏色テラス (きしまさ)] 淫乳ふたなり亡霊少女 ～堕ちて散らすは墨染桜～ (東方Project),Innyuu Futanari Bourei Shoujo ~ Ochite Chirasu wa Sumizome Sakura,japanese,kishimasa,natsuiro terrace,doujinshi,touhou project,yuyuko saigyouji,"business suit, futanari, handjob, big breasts, big nipples, ahegao, bondage, drugs, breast expansion, lactation, rape, dick growth, male on dickgirl",32,2014-09-07 23:06:45,2014-09-08 06:06:45,2025-03-01 20:31:59
115915,(C86) [STUDIO TRIUMPH (Mutou Keiji)] Astral Bout Ver.29 (Sabagebu!),(C86) [STUDIO TRIUMPH (むとうけいじ)] アストラルバウト Ver.29 (さばげぶっ!),Astral Bout Ver.29,japanese,mutou keiji,studio triumph,doujinshi,sabagebu,,"mmf threesome, group",28,2014-09-07 23:06:45,2014-09-08 06:06:45,2025-03-01 20:31:59
115916,"[AYUEST, slice slime (Bankoku Ayuya, 108 Gou)] Gentei Hon (Various)","[AYUEST, slice slime (万国あゆや, 108号)] 限定本 (よろず)",Gentei Hon,japanese,"ayuya, 108 gou","slice slime, ayuest",doujinshi,,"yuno gasai, ika musume, nyaruko, saber","lolicon, bankoku ayuya",13,2014-09-07 23:06:46,2014-09-08 06:06:46,2025-03-01 20:32:00
115917,(C86) [Jido-Hikki (Kokekokko Coma)] Hatsu Miuna (Nagi no Asukara),(C86) [じどー筆記 (こけこっこ☆こま)] 初美海 (凪のあすから),Hatsu Miuna,japanese,kokekokko coma,jido-hikki,doujinshi,nagi no asukara,"hikari sakishima, miuna shiodome","niece, lolicon, incest, shotacon",25,2014-09-08 00:02:06,2014-09-08 07:02:06,2025-03-01 20:32:01
115918,[Ruuen Rouga] Reader Ch. 2 (Trans Switch 2014 spring) [English] [Albedo/Chilla],[龍炎狼牙] リーダー 第2章 (トランススイッチ 2014 spring) [英訳],Reader Ch. 2,"english, translated",ruuen rouga,,manga,,,"glasses, schoolgirl uniform, non-h, pantyhose, possession, gender bender",17,2014-09-08 00:02:06,2014-09-08 07:02:06,2025-03-01 20:32:02
115919,[Kobayashi Oukei] Naked Girl Ch. 1-6 [English] {Mistvern},[小林王桂] ネイキッド☆ガ-ル 第1-6章 [英訳],Naked Girl Ch. 1-6,"english, translated",kobayashi oukei,,manga,,,"schoolboy uniform, glasses, story arc, schoolgirl uniform, ahegao, lolicon, incest, stockings, sister",127,2014-09-08 01:43:29,2014-09-08 08:43:29,2025-03-01 20:32:03
115921,(C83) [Arcon (Meiya)] Shiawase no Uta C83 Muryou Haifu Bon (NARUTO) [Chinese] [黑条汉化],(C83) [あるこん (メイヤ)] しあわせのうた C83無料配布本 (NARUTO -ナルト-) [中国翻訳],Shiawase no Uta C83 Muryou Haifu Bon,"translated, chinese",meiya,arcon,doujinshi,naruto,"sasuke uchiha, itachi uchiha","big breasts, kimono, incest, sister, gender bender",8,2014-09-08 01:43:35,2014-09-08 08:43:35,2025-03-01 20:32:04
115922,[Saigado] Hitoduma Onnakyoshi Main-san Ch. 11 (Action Pizazz 2014-10) [Chinese] [空気系☆漢化],[彩画堂] 人妻女教師まいんさん 第11話 (アクションピザッツ 2014年10月号) [中国翻訳],Hitoduma Onnakyoshi Main-san Ch. 11,"translated, chinese",saigado,,manga,,,"full censorship, glasses, teacher",21,2014-09-08 01:43:38,2014-09-08 08:43:38,2025-03-01 20:32:05
115923,[Takeuma no Tomo (Takeuma)] Harem Keikaku Nana-hen (To LOVE-Ru Darkness),[竹馬の友 (たけうま)] ハーレム計画ナナ編 (ToLOVEる ダークネス),Harem Keikaku Nana-hen,japanese,takeuma,takeuma no tomo,doujinshi,to love-ru,"momo velia deviluke, nana asta deviluke, rito yuuki","group, ffm threesome, demon girl, lolicon",34,2014-09-08 02:02:08,2014-09-08 09:02:08,2025-03-01 20:32:06
115925,[Execio] Special Hypnotism class,[エクセシオ] 特別催眠学級,Special Hypnotism class,japanese,butte,execio,doujinshi,,,"big breasts, strap-on, group, glasses, anal, harem, lolicon, defloration, mind control, double penetration, mosaic censorship, teacher, school swimsuit",82,2014-09-08 02:33:56,2014-09-08 09:33:56,2025-03-01 20:32:07
115926,(C82) [VALIANT (Shijima Kiri)] Ore no Shinyuu no Musume ga Konna ni Kawaii Wake ga Nai (Fire Emblem Awakening) [English] [CGrascal],(C82) [VALIAN党 (しじま嬉吏)] 俺の親友の娘がこんなに可愛いわけがない (ファイアーエムブレム 覚醒) [英訳],Ore no Shinyuu no Musume ga Konna ni Kawaii Wake ga Nai,"english, translated",shijima kiri,valiant,doujinshi,fire emblem awakening,"robin, lucina",impregnation,26,2014-09-08 02:33:58,2014-09-08 09:33:58,2025-03-01 20:32:08
115930,(C86) [candy paddle (nemunemu)] OTOKONOKO FU♥ZOKU [Chinese] [无毒汉化组],(C86) [candy paddle (ネムネム)] 男の娘風俗♥ [中国翻訳],OTOKONOKO FU♥ZOKU,"translated, chinese",nemunemu,candy paddle,doujinshi,,,"group, prostitution, anal, sex toys, crossdressing, males only, yaoi, stockings, lingerie, mosaic censorship, school swimsuit, shotacon",18,2014-09-08 07:00:55,2014-09-08 14:00:55,2025-03-01 20:32:11
115931,(C85) [Happiness Milk (Obyaa)] Nikuyokugami Gyoushin - We are semen addict - | Faith in the God of Carnal Desires - We Are Semen Addict - (Touhou Project) [English] {Sharpie Translations},(C85) [はぴねすみるく (おびゃー)] 肉欲神仰信 - We are semen addict - (東方Project) [英訳],Nikuyokugami Gyoushin| Faith in the God of Carnal Desires,"english, translated",obyaa,happiness milk,doujinshi,touhou project,"sanae kochiya, reimu hakurei","cum swap, triple penetration, double anal, vomit, group, nakadashi, ahegao, anal, vaginal sticker, lolicon, x-ray, multi-work series, inflation, double penetration, oppai loli, gokkun, bukkake, dilf, bbm",38,2014-09-08 07:34:20,2014-09-08 14:34:20,2025-03-01 20:32:12
115932,(SC60) [Korisuya (Korisu)] Houkago x Jii x Taiiku Souko [Chinese] [脸肿汉化组],(サンクリ60) [こりすや (こりす)] 放課後×自慰×体育倉庫 [中国翻訳],Houkago x Jii x Taiiku Souko,"translated, chinese",korisu,korisuya,doujinshi,,,"mmf threesome, schoolboy uniform, group, masturbation, schoolgirl uniform, lolicon, sole female",32,2014-09-08 07:34:21,2014-09-08 14:34:21,2025-03-01 20:32:13
115934,(C86) [Atariya Kyoushitsu (Mokumokuren)] Youmu-chan Love Love Sex (Touhou Project) [Chinese] [CE家族社],(C86) [アタりや教室 (目目蓮)] 妖夢ちゃんラブラブせっくす (東方Project) [中国翻訳],Youmu-chan Love Love Sex,"translated, chinese",mokumokuren,atariya kyoushitsu,doujinshi,touhou project,youmu konpaku,"pantyjob, condom, x-ray, paizuri",27,2014-09-08 08:01:05,2014-09-08 15:01:05,2025-03-01 20:32:15
115936,COMIC Masyo 2014-09,コミック・マショウ 2014年9月号,COMIC Masyo 2014-09,japanese,"yuuki ray, murata., shiden akira, haru, kizuki rei, hal, nozarashi satoru, asahina makoto, yanagawa rio, nitta jun, shinozaki rei, miito shido, juan gotoh",,manga,,,"maid, birth, milf, big breasts, spanking, bbw, group, glasses, netorare, big ass, schoolgirl uniform, anthology, ahegao, anal, sex toys, ffm threesome, femdom, bondage, crossdressing, mother, sleeping, lolicon, defloration, incest, double penetration, tanlines, chloroform, stockings, small breasts, mosaic censorship, sister, dilf, impregnation, tomboy, muscle, big penis, collar, bbm, shotacon",264,2014-09-08 10:11:13,2014-09-08 17:11:13,2025-03-01 20:32:16
115938,[Motsu Ryouri (Motsu)] Tousou Next (Dragon Quest III) [Digital],[もつ料理 (もつ)] 闘双next (ドラゴンクエストIII) [DL版],Tousou Next,japanese,motsu,motsu ryouri,doujinshi,dragon quest iii,"warrior, hero, cleric, sage","futanari, swimsuit, group, metal armor, ahegao, bikini, bodysuit, tiara, leotard, male on dickgirl",26,2014-09-08 12:01:11,2014-09-08 19:01:11,2025-03-01 20:32:18
115939,(C86) [Mochi-ya (Karochii)] Koisuru Ryuujou-chan to Hentai Teitoku (Kantai Collection -KanColle-),(C86) [餅屋 (かろちー)] 恋する龍驤ちゃんとヘンタイ提督(艦隊これくしょん-艦これ-),Koisuru Ryuujou-chan to Hentai Teitoku,japanese,karochii,mochi-ya,doujinshi,kantai collection,ryuujou,"glasses, bondage, military, lolicon, multi-work series, chloroform, rape, dilf",22,2014-09-08 12:30:50,2014-09-08 19:30:50,2025-03-01 20:32:18
115941,"(C86) [A.S.G Group (Misonou)] ""Hagane no Tsurugi Chokin"" Jikkou Chuu. (Dragon Quest III)","(C86) [A・S・Gグループ (みそのう)] ""はがねのつるぎ貯金""実行中。 (ドラゴンクエストIII)","""Hagane no Tsurugi Chokin"" Jikkou Chuu.",japanese,misonou,a.s.g group,doujinshi,dragon quest iii,"warrior, cleric","scar, urethra insertion, metal armor, anal, sex toys, femdom, dark skin, stockings, bodysuit, rimjob, tiara, muscle, shotacon",30,2014-09-08 15:07:27,2014-09-08 22:07:27,2025-03-01 20:32:20
115942,"(C86) [VOLVOX (Kizaki, Chirima, O/p.com)] Narazumono no Utage - Feast of rogue (Dragon Quest)",(C86) [VOLVOX (キザキ チリマ オポコム)] ならずものの宴 (ドラゴンクエスト),Narazumono no Utage - Feast of rogue,japanese,"kizaki, chirimaya",volvox,doujinshi,"dragon quest, dragon quest iv, dragon quest v","bianca whitaker, alena","milf, big breasts, piercing, group, anal, tall man, femdom, mother, x-ray, full color, masked face, incest, double penetration, mosaic censorship, rape, muscle, shotacon, stomach deformation",27,2014-09-08 15:07:33,2014-09-08 22:07:33,2025-03-01 20:32:21
115943,(FF22) [Pencil box] I FEEL YOUR FEAR (League of Legends) [English],(FF22) [鉛筆盒] I FEEL YOUR FEAR (League of Legends) [英訳],I FEEL YOUR FEAR,"english, translated",,pencilbox,doujinshi,league of legends,,"zombie, monster girl, femdom, paizuri",28,2014-09-08 15:07:34,2014-09-08 22:07:34,2025-03-01 20:32:22
115944,(C86) [Hi-Per Pinch (clover)] Seisai wa Gomu-nashi Sex (Sword Art Online),(C86) [ハイパーピンチ (clover)] 正妻はゴム無しセックス (ソードアート・オンライン),Seisai wa Gomu-nashi Sex,japanese,clover,hi-per pinch,doujinshi,sword art online,"asuna yuuki, suguha kirigaya, kazuto kirigaya, rika shinozaki, keiko ayano","group, condom, harem, cousin, lolicon, x-ray, incest, impregnation",26,2014-09-08 15:07:37,2014-09-08 22:07:37,2025-03-01 20:32:23
115945,(C86) [Arsenothelus (Rebis)] RinChina Icha Love Netori Futanari Hen (Gundam Build Fighters),(C86) [アルセノテリス (Rebis)] リンチナ イチャラブ寝取り ふたなり編 (ガンダムビルドファイターズ),RinChina Icha Love Netori Futanari Hen,japanese,rebis,arsenothelus,doujinshi,gundam build fighters,"china kousaka, rinko iori","futanari, milf, big breasts, group, glasses, big ass, cheating, full color, mosaic censorship, impregnation, big clit, dickgirl on dickgirl, male on dickgirl",18,2014-09-08 15:07:38,2014-09-08 22:07:38,2025-03-01 20:32:24
115946,(C86) [Hi-Per Pinch (clover)] Rizerotta's chocolate (Dragon Quest X),(C86) [ハイパーピンチ (clover)] Rizerotta's chocolate (ドラゴンクエストX),Rizerotta's chocolate,japanese,clover,hi-per pinch,doujinshi,dragon quest x,,"scat, anal, lolicon, shotacon",30,2014-09-08 15:07:38,2014-09-08 22:07:38,2025-03-01 20:32:25
115947,(C86) [LOFLAT (Prime)] Hishokan Kaga no Natsuyasumi (Kantai Collection -KanColle-) [Chinese] [空気系☆漢化],(C86) [LOFLAT (Prime)] 秘書艦加賀の夏休み (艦隊これくしょん -艦これ-) [中国翻訳],Hishokan Kaga no Natsuyasumi,"translated, chinese",prime,loflat,doujinshi,kantai collection,kaga,"dougi, military, stockings",25,2014-09-08 15:07:38,2014-09-08 22:07:38,2025-03-01 20:32:26
115948,(C86) [Null Mayu (Chimosaku)] Oatsui no wa I-Kaga? (Kantai Collection),(C86) [NULLまゆ (ちもさく)] お熱いのはイ加賀？ (艦隊これくしょん-艦これ-),Oatsui no wa I-Kaga?,japanese,chimosaku,null mayu,doujinshi,kantai collection,"houshou, kaga","chastity belt, piercing, netorare, prostate massage, nakadashi, ahegao, anal, femdom, bondage, drugs, stockings, mind break, impregnation, collar, shotacon",30,2014-09-08 15:35:33,2014-09-08 22:35:33,2025-03-01 20:32:27
115949,(C86) [LOFLAT (Prime)] Hishokan Kaga no Natsuyasumi (Kantai Collection -KanColle-),(C86) [LOFLAT (Prime)] 秘書艦加賀の夏休み (艦隊これくしょん-艦これ-),Hishokan Kaga no Natsuyasumi,japanese,prime,loflat,doujinshi,kantai collection,kaga,"dougi, military, stockings",23,2014-09-08 15:35:34,2014-09-08 22:35:34,2025-03-01 20:32:28
115950,(C86) [GADGET (A-10)] Futanari Sketch (Hidamari Sketch),(C86) [ガジェット工房 (A-10)] ふたなりスケッチ (ひだまりスケッチ),Futanari Sketch,japanese,a-10,gadget,doujinshi,hidamari sketch,"nazuna, miyako, yuno","futanari, urethra insertion, schoolgirl uniform, ahegao, anal, sex toys, lolicon, footjob, yaoi, stockings",42,2014-09-08 15:35:34,2014-09-08 22:35:34,2025-03-01 20:32:28
115951,(C86) [Daihonei (TYPE.90)] EMPIRE HARD CORE 2014 SUMMER (Captain Earth),(C86) [大本営(TYPE.90)] EMPIRE HARD CORE 2014 SUMMER (キャプテン・アース),EMPIRE HARD CORE 2014 SUMMER,japanese,type.90,daihonei,doujinshi,captain earth,hana mutou,"business suit, big breasts, glasses, ahegao, anal, sex toys, bondage, lolicon, minigirl, double penetration, mosaic censorship, shibari",27,2014-09-08 15:35:35,2014-09-08 22:35:35,2025-03-01 20:32:29
115952,(C86) [Daihonei (TYPE.90)] E.H. C2014 Natsu Omake Hon (Sidonia no Kishi),(C86) [大本営(TYPE.90)] E・H・C2014夏 おまけ本 (シドニアの騎士),E.H. C2014 Natsu Omake Hon,japanese,type.90,daihonei,doujinshi,knights of sidonia,shizuka hoshijiro,"anal, mosaic censorship, inverted nipples",7,2014-09-08 16:00:18,2014-09-08 23:00:18,2025-03-01 20:32:30
115953,(C86) [micro page (Kuromotokun)] Loli Kotegawa o Suki Houdai Shichau Hon (To LOVE-Ru) [Chinese] [E个人汉化],(C86) [みくろぺえじ (黒本君)] ロリ古手川を好き放題しちゃうほん (To LOVEる -とらぶる-) [中国翻訳],Loli Kotegawa o Suki Houdai Shichau Hon,"translated, chinese",kuromotokun,micro page,doujinshi,to love-ru,yui kotegawa,"glasses, bondage, lolicon, defloration, rape, bbm, sole female, sole male",32,2014-09-08 17:03:39,2014-09-09 00:03:39,2025-03-01 20:32:30
115954,(C86) [Aodouhu (Neromashin)] Recycle -Shizai wo Umu tame no Bakemono-tachi- (Kantai Collection -KanColle-) [Chinese] [无毒汉化组],(C86) [青豆腐 (ねろましん)] リサイクル-資材を産むための深海棲艦達- (艦隊これくしょん -艦これ-) [中国翻訳],Recycletachi-,"translated, chinese",neromashin,aodouhu,doujinshi,kantai collection,"seaport hime, battleship-symbiotic hime","birth, oni, big breasts, pregnant, ahegao, bondage, military, drugs, lactation, mind break, rape, impregnation",28,2014-09-08 17:03:42,2014-09-09 00:03:42,2025-03-01 20:32:32
115956,[Houkago Paradise (Sasorigatame)] 151cm (Prince Of Tennis),[放課後パラダイス (さそりがため] 151cm (テニスの王子様),151cm,japanese,sasorigatame,houkago paradise,doujinshi,prince of tennis,ryoma echizen,"anal, tracksuit, yaoi, shotacon",21,2014-09-08 19:03:38,2014-09-09 02:03:38,2025-03-01 20:32:33
115958,(Prince Of Tennis)Boku_no_TezukaKunimitsu,[テニスの王子様]僕の手塚国光,Boku_no_TezukaKunimitsu,japanese,,,doujinshi,prince of tennis,,"glasses, ahegao, anal, yaoi",23,2014-09-08 19:37:29,2014-09-09 02:37:29,2025-03-01 20:32:35
115959,(C86) [Rei no Tokoro (Kuroarama Soukai)] Anna Dramatics! (Yu-Gi-Oh! ZEXAL),(C86) [例の所 (黒荒馬双海)] アンナ・ドマラックス! (遊☆戯☆王ZEXAL),Anna Dramatics!,japanese,kuroarama soukai,rei no tokoro,doujinshi,yu-gi-oh zexal,anna kouzuki,"futanari, big breasts, urethra insertion, anal, sex toys, femdom, bondage, shemale, big balls, prolapse, yaoi, big penis, fisting, dickgirl on male, dickgirl on dickgirl, male on dickgirl",30,2014-09-08 19:37:33,2014-09-09 02:37:33,2025-03-01 20:32:36
115960,(C86) [Arsenothelus (Rebis)] RinChina Icha Love Netori ♂×♀Hen (Gundam Build Fighters),(C86) [アルセノテリス (Rebis)] リンチナ イチャラブ寝取り ♂×♀編 (ガンダムビルドファイターズ),RinChina Icha Love Netori ♂×♀Hen,japanese,rebis,arsenothelus,doujinshi,gundam build fighters,"china kousaka, rinko iori","milf, big breasts, unusual pupils, bbw, group, glasses, netorare, big ass, ahegao, ffm threesome, harem, full color, mosaic censorship, impregnation",18,2014-09-08 19:37:34,2014-09-09 02:37:34,2025-03-01 20:32:37
115961,[Anthology] b-Boy Petit 3,[アンソロジー] b-Boy ぷち 3,b-Boy Petit 3,japanese,"atou serina, cj michalski, dr. ten, kanzaki takashi, akiba jiro, kyouya ayumi, kasama rumi, enomoto tsubaki, takamatsu yoshiaki, hoshizaki ryuu",,manga,,,"glasses, anthology, anal, kimono, yaoi, shotacon",217,2014-09-08 19:37:34,2014-09-09 02:37:34,2025-03-01 20:32:38
115962,(Shota Scratch 22) [Atelier Dr.HEAD'S (Katou Chakichi)] Jonah Bitch (Jormungand),(ショタスクラッチ22) [アトリエDr.HEAD'S (加藤茶吉)] ヨナビッチ (ヨルムンガンド),Jonah Bitch,japanese,katou chakichi,atelier dr.heads,doujinshi,jormungand,jonathan mar,"chastity belt, group, nakadashi, anal, dark skin, males only, yaoi, rape, muscle, shotacon",28,2014-09-08 21:40:20,2014-09-09 04:40:20,2025-03-01 20:32:39
115963,[Zucchini] Misao - Sex Slave Ninpo Legend [Eng] {doujin-moe.us},,Misao - Sex Slave Ninpo Legend,"english, translated",zucchini,lilith,manga,,,"bandages, big breasts, bondage, mind break, rape, kunoichi, slave",15,2014-09-08 21:40:23,2014-09-09 04:40:23,2025-03-01 20:32:40
115964,(C83) [Yuugai Tosho Kikaku (Tanaka Naburu)] Goumon Kan Kaname Hen | Torture Dungeon: Kaname Volume (Puella Magi Madoka Magica) [English] [B.E.C. Scans],(C83) [有害図書企画 (たなかなぶる)] 拷問館 鹿目篇 (魔法少女まどか☆マギカ) [英訳],Goumon Kan Kaname Hen | Torture Dungeon: Kaname Volume,"english, translated",tanaka naburu,yuugai tosho kikaku,doujinshi,puella magi madoka magica,,"torture, group, schoolgirl uniform, bondage, eye penetration, guro, rape",27,2014-09-08 22:04:13,2014-09-09 05:04:13,2025-03-01 20:32:40
115965,(Reitaisai 10) [Happiness Milk (Obyaa)] Nikuyokugami Gyoushin - tentacle and hermaphrodite and two girls - (Touhou Project),(例大祭10) [はぴねすみるく (おびゃー)] 肉欲神仰信 - tentacle and hermaphrodite and two girls - (東方Project),Nikuyokugami Gyoushin,japanese,obyaa,happiness milk,doujinshi,touhou project,"sanae kochiya, suwako moriya","futanari, urethra insertion, ahegao, lolicon, tentacles",31,2014-09-08 23:05:35,2014-09-09 06:05:35,2025-03-01 20:32:41
115966,イタチ女体化成人向けアンソロジー「アネカン」,イタチ女体化成人向けアンソロジー「アネカン」,イタチ女体化成人向けアンソロジー「アネカン」,japanese,ico,uchihadou honpo,doujinshi,naruto,"sasuke uchiha, itachi uchiha","maid, incest, sister, gender bender",89,2014-09-08 23:05:40,2014-09-09 06:05:40,2025-03-01 20:32:42
115967,(C86) [LOFLAT (Prime)] Hishokan Kaga no Natsuyasumi | Secretary Ship Kaga's Summer Vacation (Kantai Collection -KanColle-) [English] [Lazarus H],(C86) [LOFLAT (Prime)] 秘書艦加賀の夏休み (艦隊これくしょん-艦これ-) [英訳],Hishokan Kaga no Natsuyasumi | Secretary Ship Kaga's Summer Vacation,"english, translated",prime,loflat,doujinshi,kantai collection,kaga,"big breasts, dougi, military, stockings",24,2014-09-08 23:05:41,2014-09-09 06:05:41,2025-03-01 20:32:43
115968,[Kai.Tenchou (Murai G)] Revolution Child (Valvrave the Liberator) [Digital],[改・店長 (村井Ｇ)] Revolution Child (革命機ヴァルヴレイヴ) [DL版],Revolution Child,japanese,murai g,kai.tenchou,doujinshi,valvrave the liberator,l-elf karlstein,"swimsuit, crossdressing, bikini, males only, yaoi, tomgirl, shotacon",41,2014-09-08 23:33:19,2014-09-09 06:33:19,2025-03-01 20:32:44
115969,[Kai.Tenchou (Murai G)] coupling (Buddy Complex) [Digital],[改・店長 (村井Ｇ)] coupling (バディ・コンプレックス) [DL版],coupling,japanese,murai g,kai.tenchou,doujinshi,buddy complex,dio weinberg junyou,"big nipples, group, anal, crossdressing, bikini, males only, yaoi, large insertions, tomgirl, blindfold",31,2014-09-08 23:33:20,2014-09-09 06:33:20,2025-03-01 20:32:45
115970,[Kai.Tenchou (Murai G)] coupling+ (Buddy Complex) [Digital],[改・店長 (村井Ｇ)] coupling+ (バディ・コンプレックス) [DL版],coupling+,japanese,murai g,kai.tenchou,doujinshi,buddy complex,dio weinberg junyou,"big nipples, group, anal, sex toys, crossdressing, bikini, exhibitionism, males only, yaoi, stockings, large insertions, tomgirl",35,2014-09-08 23:33:20,2014-09-09 06:33:20,2025-03-01 20:32:46
115972,"[Tsuki no Hikari Keikaku (Tokyo Yamane, Yuki Higasinakan, Teppeki Kyojin)] Asuna to Shinkon Hatsuya (Sword Art Online) [English] {Zettai Ryouiki} [Digital]","[月ノヒカリ計画 (東京ヤマネ, ゆーき東中野, 鉄壁巨人)] アスナと新婚初夜 (ソードアート・オンライン) [英訳] [DL版]",Asuna to Shinkon Hatsuya,"english, translated","teppeki kyojin, yuki higasinakano, tokyo yamane",tsuki no hikari keikaku,doujinshi,sword art online,"asuna yuuki, kazuto kirigaya","full color, paizuri",10,2014-09-09 01:00:47,2014-09-09 08:00:47,2025-03-01 20:32:48
115974,(C83) [Hinemosuan (Hinemosu Notari)] GanGan Ikou yo! (Dragon Quest IV) [Chinese] [黑条汉化],(C83) [終日庵 (ひねもすのたり)] ガンガンいこうよっ！ (ドラゴンクエスト IV) [中国翻訳],GanGan Ikou yo!,"translated, chinese",hinemosu notari,hinemosuan,doujinshi,dragon quest iv,"meena, maya, sofia","futanari, group, dark skin, incest, pole dancing, tiara, sister, blowjob, dickgirl on dickgirl",26,2014-09-09 02:31:21,2014-09-09 09:31:21,2025-03-01 20:32:49
115975,(C83) [Jaga Bataa (Oimo)] My Prince (Mahou Shoujo Lyrical Nanoha) [English] [Yuri-ism],(C83) [じゃがバター (おいも)] My Prince (魔法少女リリカルなのは) [英訳],My Prince,"english, translated",oimo,jagabata,doujinshi,mahou shoujo lyrical nanoha,"signum, hayate yagami","females only, yuri, tribadism",27,2014-09-09 03:01:11,2014-09-09 10:01:11,2025-03-01 20:32:50
115976,(C86) [Kansai Gyogyou Kyoudou Kumiai (Marushin)] Isuzu Banka (Kantai Collection -KanColle-) [Chinese] [空気系☆漢化],(C86) [関西漁業協同組合 (丸新)] 五十鈴挽歌 (艦隊これくしょん-艦これ-) [中国翻訳],Isuzu Banka,"translated, chinese",marushin,kansai gyogyou kyoudou kumiai,doujinshi,kantai collection,"haruna, isuzu","big breasts, miko, full censorship, netorare, stockings, mind break, rape",38,2014-09-09 04:04:36,2014-09-09 11:04:36,2025-03-01 20:32:51
115977,(C86) [Kansai Gyogyou Kyoudou Kumiai (Marushin)] Isuzu Banka (Kantai Collection -KanColle-),(C86) [関西漁業協同組合 (丸新)] 五十鈴挽歌 (艦隊これくしょん-艦これ-),Isuzu Banka,japanese,marushin,kansai gyogyou kyoudou kumiai,doujinshi,kantai collection,"haruna, isuzu","miko, full censorship, netorare, drugs, stockings, rape",36,2014-09-09 04:04:37,2014-09-09 11:04:37,2025-03-01 20:32:51
115978,(C85) [Kansai Gyogyou Kyoudou Kumiai (Marushin)] Isuzu Sanka (Kantai Collection -KanColle-),(C85) [関西漁業協同組合 (丸新)] 五十鈴賛歌 (艦隊これくしょん-艦これ-),Isuzu Sanka,japanese,marushin,kansai gyogyou kyoudou kumiai,doujinshi,kantai collection,isuzu,"big breasts, full censorship",30,2014-09-09 04:04:37,2014-09-09 11:04:37,2025-03-01 20:32:52
115980,(C85) [Kogitsune (Kagitsune Torii)] Tsukaisute Onahole TENKO-chan (Touhou Project),(C85) [こぎつね (花狐とりい)] 使い捨てオナホール TENKOちゃん (東方Project),Tsukaisute Onahole TENKO-chan,japanese,kogitune torii,kogitune,doujinshi,touhou project,tenshi hinanai,"lolicon, breast expansion, lactation, stockings",23,2014-09-09 04:31:32,2014-09-09 11:31:32,2025-03-01 20:32:53
115982,"[Herohero Hospital (Herohero Tom, Isaki)] Lover Me! [Digital]",[へろへろHospital (へろへろTom、伊佐木)] Lover Me! [DL版],Lover Me!,japanese,"isaki, herohero tom",herohero hospital,doujinshi,,,"futanari, big breasts, bbw, big ass, ahegao, anal, femdom, lactation, tall girl, shotacon, dickgirl on male, male on dickgirl",44,2014-09-09 06:42:27,2014-09-09 13:42:27,2025-03-01 20:32:55
