ID,EN_TITLE,JP_TITLE,CLEAN_TITLE,LANGUAGE,ARTIST,GROUP_NAME,CATEGORY,PARODY,CHARACTER,TAGS,PAGES,UPLOAD_DATE,FORMATTED_DATE,SCRAPED_DATE
116979,(SC57) [RIBI Dou (Higata Akatsuki)] Sengoku Haru Emaki (Oda Nobuna no Yabou) [English] [PSYN],(サンクリ57) [RIBI堂 (陽方暁)] 戦国春絵巻 (織田信奈の野望) [英訳],Sengoku Haru Emaki,"english, translated",higata akatsuki,ribi dou,doujinshi,oda nobuna no yabou,"goemon hachisuka, katsuie shibata","big breasts, fundoshi, ahegao, lolicon, sole male",31,2014-09-23 05:44:18,2014-09-23 12:44:18,2025-03-01 20:48:07
116980,[Cho-yaki] Onee-chan wa Omocha ya | Big Sister's Toy Store [English] =LWB=,[腸焼き] 姉ちゃんはおもちゃ屋 [英訳],Onee-chan wa Omocha ya | Big Sister's Toy Store,"english, translated",cho-yaki,,manga,,,"gag, pegging, urethra insertion, strap-on, group, story arc, ahegao, anal, sex toys, ffm threesome, femdom, bondage, crossdressing, latex, incest, stockings, bodysuit, lingerie, sister, shibari",34,2014-09-23 06:31:51,2014-09-23 13:31:51,2025-03-01 20:48:08
116981,[Kai Hiroyuki] Boku no Yamanoue Mura Nikki Ch.1-9,[甲斐ひろゆき] 僕の山ノ上村日記 第1-9章,Boku no Yamanoue Mura Nikki Ch.1-9,japanese,kai hiroyuki,,manga,,,"milf, big breasts, nurse, group, glasses, schoolgirl uniform, breast feeding, huge breasts, harem, x-ray, lactation, paizuri",180,2014-09-23 08:07:23,2014-09-23 15:07:23,2025-03-01 20:48:09
116982,[Wamusato Haru] Tropical Oyako Mix [Chinese] [CE家族社],[和六里ハル] トロピカル☆母娘mix [中国翻訳],Tropical Oyako Mix,"translated, chinese",wamusato haru,,manga,,,"milf, big breasts, swimsuit, group, glasses, condom, harem, bikini, lolicon, tankoubon, rimjob, small breasts, blowjob, shotacon, oyakodon",217,2014-09-23 08:42:22,2014-09-23 15:42:22,2025-03-01 20:48:10
116983,[Yakiniku King] Mirai kara Kimashita! Zenpen | Mirai Paradox (part 1) [English] [PSYN],[焼肉キング] ミライから来ました! 前編 [英訳],Mirai kara Kimashita! Zenpen | Mirai Paradox,"english, translated",yakiniku king,,manga,,,"schoolgirl uniform, replaced, shimapan, nakadashi, anal, lolicon, x-ray, defloration, drugs, incest, daughter",33,2014-09-23 08:42:27,2014-09-23 15:42:27,2025-03-01 20:48:11
116984,[Ikegami Tatsuya] Shounen no Subete [Chinese] [黑条汉化],[池上竜矢] 少年のすべて [中国翻訳],Shounen no Subete,"translated, chinese",ikegami tatsuya,,manga,,,"big breasts, incest, sister, shotacon",20,2014-09-23 08:42:27,2014-09-23 15:42:27,2025-03-01 20:48:12
116985,(C86) [Rukonosu (Ganari Ryu)] Initiator Harem Plan (Black Bullet) [Chinese] [CE家族社],(C86) [龍虎乃巣 (がなり龍)] 幼女楽園計画 (ブラック・ブレット) [中国翻訳],Initiator Harem Plan,"translated, chinese",ganari ryu,rukonosu,doujinshi,black bullet,"tina sprout, kisara tendou, enju aihara","group, ffm threesome, lolicon, full color",21,2014-09-23 09:30:52,2014-09-23 16:30:52,2025-03-01 20:48:13
116986,[Ikegami Tatsuya] Eco Life Shimasho [Chinese] [黑条汉化],[池上竜矢] エコライフしましょ [中国翻訳],Eco Life Shimasho,"translated, chinese",ikegami tatsuya,,manga,,,"big breasts, glasses, incest, sister",16,2014-09-23 10:31:17,2014-09-23 17:31:17,2025-03-01 20:48:15
116987,[Ikegami Tatsuya] Ushiro no Shounen Daare [Chinese] [黑条汉化],[池上竜矢] 後ろの正面だあれ [中国翻訳],Ushiro no Shounen Daare,"translated, chinese",ikegami tatsuya,,manga,,,"big breasts, stockings",16,2014-09-23 10:31:18,2014-09-23 17:31:18,2025-03-01 20:48:16
116988,(COMIC1☆8) [Saigado] R-LAB.CS (Neon Genesis Evangelion),(COMIC1☆8) [彩画堂] R-LAB.CS (新世紀エヴァンゲリオン),R-LAB.CS,japanese,saigado,saigado,doujinshi,neon genesis evangelion,"shinji ikari, maya ibuki, ritsuko akagi","milf, pegging, strap-on, group, replaced, nakadashi, anal, ffm threesome, femdom, x-ray, stockings, rimjob, filming, blowjob",22,2014-09-23 11:00:38,2014-09-23 18:00:38,2025-03-01 20:48:17
116989,(C86) [Kansen Shoujo (Noto Kurumi)] Ryuu Ichaicha Tokidoki Oshikko (Kantai Collection -KanColle-),(C86) [甘泉少女 (能都くるみ)] 龍イチャイチャ時々おしっこ (艦隊これくしょん -艦これ-),Ryuu Ichaicha Tokidoki Oshikko,japanese,mitsurugi aoi,kansen shoujo,doujinshi,kantai collection,"taigei, ryuuhou","big breasts, nakadashi, pantyhose, incomplete",25,2014-09-23 13:02:15,2014-09-23 20:02:15,2025-03-01 20:48:18
116990,(C86) [Kansen Shoujo (Noto Kurumi)] Ryuu Ichaicha Tokidoki Oshikko (Kantai Collection -KanColle-) [Chinese] [无毒汉化组],(C86) [甘泉少女 (能都くるみ)] 龍イチャイチャ時々おしっこ (艦隊これくしょん -艦これ-) [中国翻訳],Ryuu Ichaicha Tokidoki Oshikko,"translated, chinese",mitsurugi aoi,kansen shoujo,doujinshi,kantai collection,ryuuhou,"big breasts, pantyhose, incomplete",26,2014-09-23 13:02:20,2014-09-23 20:02:20,2025-03-01 20:48:19
116994,(C86) [Tsunken (Men's)] Kaga San To Sinkonseikatu Sono2 (Kantai Collection -KanColle-),(C86) [ツン研 (Men's)] 加賀さんと新婚生活 その2 (艦隊これくしょん -艦これ-),Kaga San To Sinkonseikatu Sono2,japanese,mens,tsunken,doujinshi,kantai collection,kaga,,26,2014-09-23 15:04:08,2014-09-23 22:04:08,2025-03-01 20:48:22
116995,(COMIC1☆8) [Tsunken (Men's)] Kaga San To Sinkonseikatu (Kantai Collection -KanColle-),(COMIC1☆8) [ツン研 (Men's)] 加賀さんと新婚生活 (艦隊これくしょん -艦これ-),Kaga San To Sinkonseikatu,japanese,mens,tsunken,doujinshi,kantai collection,kaga,"ahegao, stockings",26,2014-09-23 15:04:09,2014-09-23 22:04:09,2025-03-01 20:48:23
116996,(C86) [Wasshoi Koubou (Hayami Sakura)] Loli-ka Shoujo Futari Kazoku Wa Rusu (To LOVE-Ru),(C86) [わっしょい☆工房 (速水桜)] ロリ化少女2人家族は留守 (To LOVEる -とらぶる-),Loli-ka Shoujo Futari Kazoku Wa Rusu,japanese,hayami sakura,wasshoi koubou,doujinshi,to love-ru,"yui kotegawa, lala satalin deviluke, rito yuuki","group, ffm threesome, demon girl, lolicon, age regression, sole male",24,2014-09-23 15:04:09,2014-09-23 22:04:09,2025-03-01 20:48:24
116997,"(Reitaisai 11) [D.N.A.Lab., Ichigosize (Miyasu Risa, Natsume Eri)] Lovely (Touhou Project) [Chinese] [绅士仓库汉化]","(例大祭11) [D・N・A.Lab., いちごさいず (ミヤスリサ, なつめえり)] Lovely (東方Project)  [中国翻訳]",Lovely,"translated, chinese","natsume eri, miyasu risa","d.n.a.lab., ichigosize",doujinshi,touhou project,"patchouli knowledge, marisa kirisame","futanari, full censorship, sole female, sole dickgirl",31,2014-09-23 15:04:10,2014-09-23 22:04:10,2025-03-01 20:48:25
116998,(C86) [Ringo Doumei (Mitaka)] Seireiou Tettei Juurin (Shinrabansho),(C86) [りんご同盟 (美岳)] 水嶺王徹底蹂躙 (神羅万象チョコ),Seireiou Tettei Juurin,japanese,mitaka,ringo doumei,doujinshi,shinrabansho,,"ryona, lolicon",31,2014-09-23 15:58:26,2014-09-23 22:58:26,2025-03-01 20:48:26
116999,[dogado] Homo Sexience [Ongoing],[도가도] 낙장불입 [進行中],Homo Sexience,english,dogado,,doujinshi,,,full color,842,2014-09-23 15:58:27,2014-09-23 22:58:27,2025-03-01 20:48:27
117000,[Pon Takahanada] Niizuma Osenaka Nagashimasu Ch. 2 (Action Pizazz 2014-01) [Chinese] [空気系☆漢化],[ポン貴花田] にーづまお背中流します 第2章 (アクションピザッツ 2014年1月号) [中国翻訳],Niizuma Osenaka Nagashimasu Ch. 2,"translated, chinese",pon takahanada,,manga,,,"big breasts, old man, swimsuit, full censorship, bikini",21,2014-09-23 16:01:23,2014-09-23 23:01:23,2025-03-01 20:48:28
117001,(C86) [chocolate Lv.5 (Dynamite moca)] Nanimo Shiranai Imouto ni Massage to Itsuwatte Itazura,(C86) [chocolate Lv.5 (ダイナマイトmoca)] 何も知らない妹にマッサージと偽っていたずら,Nanimo Shiranai Imouto ni Massage to Itsuwatte Itazura,japanese,dynamite moca,chocolate lv.5,doujinshi,,,"lolicon, sister",22,2014-09-23 16:31:23,2014-09-23 23:31:23,2025-03-01 20:48:28
117002,(C86) [F Taku (Anma)] Bukatsudou Shoujo Ryoujoku -Suieibu Hen-,(C86) [F宅 (安間)] 部活動少女陵辱-水泳部編-,Bukatsudou Shoujo Ryoujoku,japanese,anma,f taku,doujinshi,,,"big breasts, underwater, swimsuit, mmf threesome, group, cervix penetration, double penetration, fingering, rape, blowjob, chikan",26,2014-09-23 17:19:11,2014-09-24 00:19:11,2025-03-01 20:48:29
117004,(C86) [Kouyadou (Mizuki Eimu)] DEAR MY FRIEND (Kyou no 5 no 2),(C86) [こうや堂 (みずきえいむ)] DEAR MY FRIEND (今日の5の2),DEAR MY FRIEND,japanese,mizuki eimu,kouyadou,doujinshi,kyou no go no ni,chika koizumi,"netorare, lolicon, mosaic censorship, shotacon",34,2014-09-23 17:19:12,2014-09-24 00:19:12,2025-03-01 20:48:31
117005,[DESTINATION (Oda Jun)] Honey Dripper 2 (Cutey Honey),[ディスティネーション (小田淳)] HONEY DRIPPER2 (キューティーハニー),Honey Dripper 2,japanese,oda jun,destination,doujinshi,cutey honey,honey,"uncensored, bondage",54,2014-09-23 17:19:12,2014-09-24 00:19:12,2025-03-01 20:48:31
117006,(C86) [Jack to Nicholson (NoriPachi)] YamiPara!,(C86) [ジャックとニコルソン (のりパチ)] ヤミパラ!,YamiPara!,japanese,noripachi,jack to nicholson,doujinshi,,,"condom, lolicon, exhibitionism, multi-work series, tanlines, mosaic censorship",26,2014-09-23 17:19:13,2014-09-24 00:19:13,2025-03-01 20:48:32
117007,(COMIC1☆8) [Tsunken (Men's)] Kaga San To Sinkonseikatu (Kantai Collection -KanColle-),(COMIC1☆8) [ツン研 (Men's)] 加賀さんと新婚生活 (艦隊これくしょん -艦これ-),Kaga San To Sinkonseikatu,japanese,mens,tsunken,doujinshi,kantai collection,"teitoku, kaga","big breasts, ahegao, femdom, footjob, stockings, sole male",26,2014-09-23 17:19:14,2014-09-24 00:19:14,2025-03-01 20:48:33
117008,(C86) [Tsunken (Men's)] Kaga San To Sinkonseikatu Sono2 (Kantai Collection -KanColle-),(C86) [ツン研 (Men's)] 加賀さんと新婚生活 その2 (艦隊これくしょん -艦これ-),Kaga San To Sinkonseikatu Sono2,japanese,mens,tsunken,doujinshi,kantai collection,"teitoku, kaga","big breasts, ahegao, sex toys, sole male",26,2014-09-23 17:19:14,2014-09-24 00:19:14,2025-03-01 20:48:34
117009,"(C86) [Nankotsu Age Rice (Hibiki Hajime, Kyo1)] Mujina no Kyoudai","(C86) [なんこつ揚げライス (ヒビキハジメ, Kyo1)] ムジナの兄弟",Mujina no Kyoudai,japanese,kyo1,nankotsu age rice,doujinshi,,,"schoolgirl uniform, lolicon, rape, dilf, bbm",30,2014-09-23 17:19:14,2014-09-24 00:19:14,2025-03-01 20:48:35
117010,(MarionetteAngel2013) [PLANT (Tsurui)]Samishiku Nankanai!!2 (THE IDOLM@STER),(MarionetteAngel2013) [PLANT (鶴井)] さみしくなんかない!!2 (アイドルマスター),Samishiku Nankanai!!2,japanese,tsurui,plant,doujinshi,the idolmaster,"producer, hibiki ganaha","schoolgirl uniform, ahegao, sole female, sole male",41,2014-09-23 17:19:15,2014-09-24 00:19:15,2025-03-01 20:48:36
117011,(C86) [Magono-Tei (Carn)] Kayumidome 12 Houme (Nagi no Asukara),(C86) [まごの亭 (夏庵)] カユミドメ12ホウメ (凪のあすから),Kayumidome 12 Houme,japanese,carn,magono-tei,doujinshi,nagi no asukara,chisaki hiradaira,"netorare, schoolgirl uniform, dark skin, defloration, lactation, mosaic censorship, dilf, impregnation",23,2014-09-23 17:19:16,2014-09-24 00:19:16,2025-03-01 20:48:37
117012,(C86) [French letter (Fujisaki Hikari)] 401 -Hitonatsu no Ayamachi- (Kantai Collection -KanColle-),(C86) [French letter (藤崎ひかり)] 401 -ひと夏の過ち- (艦隊これくしょん -艦これ-),401,japanese,fujisaki hikari,french letter,doujinshi,kantai collection,i-401,"cheating, nakadashi, kimono, lolicon, tanlines, school swimsuit",30,2014-09-23 17:19:16,2014-09-24 00:19:16,2025-03-01 20:48:37
117013,(C86) [Great Acta (tokyo)] Ore no Yome-san ni Natte! 500000G (Arc The Lad),(C86) [GREAT芥 (tokyo)] 俺の嫁さんになって!500000G (アークザラッド),Ore no Yome-san ni Natte! 500000G,japanese,tokyo,great acta,doujinshi,arc the lad,,"sweating, big breasts, prostitution, nakadashi, apron, sole female, sole male",33,2014-09-23 17:19:16,2014-09-24 00:19:16,2025-03-01 20:48:38
117014,(C86) [G-SCAN CORP. (Satou Chagashi)] Sexuality x Service 3 (Servant x Service),(C86) [G-SCAN CORP. (佐藤茶菓子)] セクシャリティ×サービス3 (サーバント×サービス),Sexuality x Service 3,japanese,satou chagashi,g-scan corp.,doujinshi,servant x service,"yutaka hasebe, lucy ... yamagami","big breasts, glasses, ahegao, kimono",26,2014-09-23 17:19:17,2014-09-24 00:19:17,2025-03-01 20:48:39
117015,(C86) [HIYOKO CROWN (Shinano Yura)] Aino Minako XX-sai to Car Sex (Bishoujo Senshi Sailor Moon),(C86) [HIYOKO CROWN (しなの優良)] 愛野美奈子XX歳とカーセックス (美少女戦士セーラームーン),Aino Minako XX-sai to Car Sex,japanese,shinano yura,hiyoko crown,doujinshi,sailor moon,"minako aino, sailor venus","magical girl, schoolgirl uniform, prostitution, tiara, dilf, blowjob, bbm",22,2014-09-23 17:19:17,2014-09-24 00:19:17,2025-03-01 20:48:40
117016,(C86) [STUDIO TRIUMPH (Mutou Keiji)] Astral Bout Ver.28 (RAIL WARS!),(C86) [STUDIO TRIUMPH (むとうけいじ)] アストラルバウトVer.28 (RAIL WARS!),Astral Bout Ver.28,japanese,mutou keiji,studio triumph,doujinshi,rail wars,aoi sakurai,"netorare, ahegao, defloration, armpit licking, rape, impregnation",30,2014-09-23 17:19:17,2014-09-24 00:19:17,2025-03-01 20:48:41
117017,(C86) [Orenjiru (Orenchin)] Ore no Kotegawa ga Netoraremashita (To LOVE-Ru),(C86) [おれんジル (おれんちん)] 俺の古手川が寝取られました (ToLOVEる-とらぶる-),Ore no Kotegawa ga Netoraremashita,japanese,orenchin,orenjiru,doujinshi,to love-ru,"yui kotegawa, kenichi saruyama","full censorship, netorare, schoolgirl uniform, defloration, blackmail",34,2014-09-23 17:33:29,2014-09-24 00:33:29,2025-03-01 20:48:42
117018,"(C86) [Hito no Fundoshi (Yukiyoshi Mamizu)] WUG no Hidoi Hi. (Wake Up, Girls!)","(C86) [ひとのふんどし (ゆきよし真水)] W●Gのひどい日。 (Wake Up,Girls!)",WUG no Hidoi Hi.,japanese,yukiyoshi mamizu,hito no fundoshi,doujinshi,wake up girls,,"swimsuit, group, nakadashi, sleeping, bikini, drugs, chloroform, filming, mosaic censorship, rape, dilf",26,2014-09-23 17:33:29,2014-09-24 00:33:29,2025-03-01 20:48:43
117019,(C86) [Ichinichi Sanjou (Jinguu Kozue)] Kikan Shoujo Sakura-san (Gekkan Shoujo Nozaki-kun),(C86) [一日三錠 (神宮梢)] 季刊少女佐倉さん (月刊少女野崎くん),Kikan Shoujo Sakura-san,japanese,jinguu kozue,ichinichi sanjou,doujinshi,gekkan shoujo nozaki-kun,"chiyo sakura, umetarou nozaki","schoolboy uniform, schoolgirl uniform, stockings",24,2014-09-23 17:33:29,2014-09-24 00:33:29,2025-03-01 20:48:43
117020,(COMIC1☆7) [Nihon Dandy (Matsuno Susumu)] Homuhomu wo Zenra de Conbini e Ikaseru Hon (Puella Magi Madoka Magica) [chinese] [轻水三千汉化组],(COMIC1☆7) [日本ダンディ (松野すすむ)] ほむほむを全裸でコンビニへ行かせる本 (魔法少女まどか☆マギカ) [中国翻訳],Homuhomu wo Zenra de Conbini e Ikaseru Hon,"translated, chinese",matsuno susumu,nihon dandy,doujinshi,puella magi madoka magica,"kyouko sakura, homura akemi","bondage, lolicon, exhibitionism, tentacles",29,2014-09-23 18:32:09,2014-09-24 01:32:09,2025-03-01 20:48:44
117022,(C86) [774 House (774)] Hadakahime Honoka 2 Misemono Tanetsuke Saru Koubi [Chinese] [屏幕髒了漢化組],(C86) [774ハウス (774)] 裸姫穂乃火2 見世物種付猿交尾 [中国翻訳],Hadakahime Honoka 2 Misemono Tanetsuke Saru Koubi,"translated, chinese",nanashi,774 house,doujinshi,,,"birth, pregnant, unusual pupils, group, bestiality, nakadashi, ahegao, anal, gorilla, lolicon, double penetration, bukkake, mind break, smegma, impregnation, blowjob, collar",61,2014-09-23 19:03:40,2014-09-24 02:03:40,2025-03-01 20:48:46
117023,(C86) [Alemateorema (Kobayashi Youkoh)] GARIGARI 63 (Kantai Collection -KanColle-) [Chinese] [屏幕脏了汉化组],(C86) [アレマテオレマ (小林由高)] GARIGARI63 (艦隊これくしょん -艦これ-) [中国翻訳],GARIGARI 63,"translated, chinese",kobayashi youkoh,alemateorema,doujinshi,kantai collection,kaga,"ahegao, anal, sex toys, double penetration, stockings",26,2014-09-23 19:03:41,2014-09-24 02:03:41,2025-03-01 20:48:47
117024,[Sena Youtarou] Kannou no Samidare ~Climax~ | Sensual Early Summer Rain ~Climax~ (COMIC Penguin Celeb 2011-06) [English] [Decensored],[瀬奈陽太郎] 官能の五月雨 ～Climax～ (COMIC ペンギンセレブ 2011年6月号) [英訳] [無修正],Kannou no Samidare| Sensual Early Summer Rain,"english, translated",sena youtarou,,manga,,,"schoolboy uniform, uncensored, schoolgirl uniform, defloration, stockings",20,2014-09-23 19:30:55,2014-09-24 02:30:55,2025-03-01 20:48:48
117025,(C86)[ice*ico]狂い蝉[Chinese],(C86)[ice*ico]狂い蝉[中国翻訳],狂い蝉,"translated, chinese",ico,,doujinshi,naruto,"sasuke uchiha, itachi uchiha","incest, sister, gender bender",32,2014-09-23 21:32:25,2014-09-24 04:32:25,2025-03-01 20:48:48
117026,[UNKY (Unko Yoshida)] ±5 (Tiger & Bunny),[UNKY (うんこ吉田)] ±5 (TIGER & BUNNY),±5,japanese,unko yoshida,unky,doujinshi,tiger and bunny,"barnaby brooks jr., kotetsu t. kaburagi","males only, yaoi, muscle",24,2014-09-23 21:32:32,2014-09-24 04:32:32,2025-03-01 20:48:49
117027,[UNKY (Unko Yoshida)] ±5 (Tiger & Bunny) [English] [Harudoki Scanlation],[UNKY (うんこ吉田)] ±5 (TIGER & BUNNY) [英訳],±5,"english, translated",unko yoshida,unky,doujinshi,tiger and bunny,"barnaby brooks jr., kotetsu t. kaburagi","males only, yaoi, muscle",24,2014-09-23 22:05:47,2014-09-24 05:05:47,2025-03-01 20:48:50
117028,"[UNKY (Unko Yoshida)] Kami Monaku, (Tiger & Bunny) [English] [Chuu Translations]",[UNKY (うんこ吉田)] 神もなく、 (TIGER & BUNNY) [英訳],"Kami Monaku,","english, translated",unko yoshida,unky,doujinshi,tiger and bunny,"barnaby brooks jr., kotetsu t. kaburagi","males only, yaoi, dilf, muscle",56,2014-09-23 22:05:50,2014-09-24 05:05:50,2025-03-01 20:48:51
117029,"[UNKY (Unko Yoshida, Machiko)] Full Power Trick (Tiger & Bunny) [English] [Minh Ha]","[UNKY (うんこ吉田, マチコ)] FULL POWER TRICK (TIGER & BUNNY) [英訳]",Full Power Trick,"english, translated","machiko, unko yoshida",unky,doujinshi,tiger and bunny,"barnaby brooks jr., kotetsu t. kaburagi","males only, yaoi, dilf, muscle",22,2014-09-23 22:05:51,2014-09-24 05:05:51,2025-03-01 20:48:52
117030,[UNKY (Unko Yoshida)] After the Pool (Tiger & Bunny) [English] {Harudaki},[UNKY (うんこ吉田)] After the Pool (TIGER & BUNNY) [英訳],After the Pool,"english, translated",unko yoshida,unky,doujinshi,tiger and bunny,"barnaby brooks jr., kotetsu t. kaburagi","males only, yaoi, dilf, muscle",18,2014-09-23 22:05:51,2014-09-24 05:05:51,2025-03-01 20:48:53
117031,[Unky] Haru Desu Yo (Tiger & Bunny) (English),,Haru Desu Yo,"english, translated",unko yoshida,unky,doujinshi,tiger and bunny,"barnaby brooks jr., kotetsu t. kaburagi","males only, yaoi, dilf, muscle",13,2014-09-23 22:05:51,2014-09-24 05:05:51,2025-03-01 20:48:54
117032,[Arataka] Toraman (side story) (Tiger & Bunny) [English],,Toraman,"english, translated",,,doujinshi,tiger and bunny,"barnaby brooks jr., kotetsu t. kaburagi","cuntboy, eyemask",4,2014-09-23 22:05:52,2014-09-24 05:05:52,2025-03-01 20:48:55
117033,"(Boku no Hero 5) [Sumikko, Unky (Kaina, Unko Yoshida)] Kinoko (Tiger & Bunny)","(僕のヒーロー5) [sumikko, UNKY (カイナ, うんこ吉田)] キノコ (TIGER & BUNNY)",Kinoko,japanese,"kaina, unko yoshida","unky, sumikko",doujinshi,tiger and bunny,"barnaby brooks jr., kotetsu t. kaburagi","glasses, anal, bondage, males only, yaoi, dilf, muscle, shibari",30,2014-09-23 22:32:25,2014-09-24 05:32:25,2025-03-01 20:48:57
117034,(SUPER16) [Silver-Kingdom (11COLORS)] Yokubou no Tani Zetsubou no Ame ~Kouhen~ (JoJo's Bizarre Adventure -Steel Ball Run) [English],(SUPER16) [Silver-Kingdom (11COLORS)] 欲望の谷絶望の雨　～後編～ (ジョジョの奇妙な冒険 -スティール・ボール・ラン) [英訳],Yokubou no Tani Zetsubou no Ame,"english, translated",11colors,silver-kingdom,doujinshi,jojos bizarre adventure,,"anal, males only, yaoi, rape",34,2014-09-23 22:32:26,2014-09-24 05:32:26,2025-03-01 20:48:58
117035,(C86) [SEM;COLON (Mitsu King)] Senpai Append Natsu [Chinese] [空気系☆漢化],(C86) [SEM;COLON (蜜キング)] 先輩アペンド·夏 [中国翻訳],Senpai Append Natsu,"translated, chinese",mitsu king,sem colon,doujinshi,,,,22,2014-09-24 01:01:06,2014-09-24 08:01:06,2025-03-01 20:48:59
117036,(C86) [SEM;COLON (Mitsu King)] Senpai Append Natsu,(C86) [SEM;COLON (蜜キング)] 先輩アペンド·夏,Senpai Append Natsu,japanese,mitsu king,sem colon,doujinshi,,,,20,2014-09-24 01:31:13,2014-09-24 08:31:13,2025-03-01 20:49:00
117037,(C83) [TSK-BAR (Toguchi Masaya)] Hebihime-sama 29sai no Teisou wo Itadaku Hon (One Piece) [Chinese] [黑条汉化],(C83) [TSK-BAR (トグチマサヤ)] 蛇姫様29歳の貞操を頂く本 (ワンピース) [中国翻訳],Hebihime-sama 29sai no Teisou wo Itadaku Hon,"translated, chinese",toguchi masaya,tsk-bar,doujinshi,one piece,boa hancock,"big breasts, defloration",14,2014-09-24 01:31:13,2014-09-24 08:31:13,2025-03-01 20:49:02
117038,(CT24) [SEM;COLON (Mitsu King)] G.I.R.L (Selector Infected WIXOSS),(コミトレ24) [SEM;COLON (蜜キング)] G.I.R.L (selector infected WIXOSS),G.I.R.L,japanese,mitsu king,sem colon,doujinshi,selector infected wixoss,,"schoolgirl uniform, defloration, incest, sister",26,2014-09-24 02:03:30,2014-09-24 09:03:30,2025-03-01 20:49:03
117039,(C86) [SEM;COLON (Mitsu King)] Senpai Append Natsu,(C86) [SEM;COLON (蜜キング)] 先輩アペンド・夏,Senpai Append Natsu,japanese,mitsu king,sem colon,doujinshi,,,,17,2014-09-24 02:03:31,2014-09-24 09:03:31,2025-03-01 20:49:04
117040,[Sowitchraw] Hikikomogomo (COMIC Anthurium 017 2014-09) [English] =The Lost Light+Funeral of Smiles= [Digital],[Sowitchraw] ひきこもごも (COMIC アンスリウム 017 2014年9月号) [英訳] [DL版],Hikikomogomo,"english, translated",sowitchraw,,manga,,,"big breasts, bbw, big ass, femdom, bondage, incest, sister, yandere, shotacon",21,2014-09-24 02:03:32,2014-09-24 09:03:32,2025-03-01 20:49:05
117041,(C86) [SEM;COLON (Mitsu King)] Senpai Append Natsu [Chinese] [脸肿汉化组],(C86) [SEM;COLON (蜜キング)] 先輩アペンド・夏 [中国翻訳],Senpai Append Natsu,"translated, chinese",mitsu king,sem colon,doujinshi,,,,19,2014-09-24 04:00:47,2014-09-24 11:00:47,2025-03-01 20:49:06
117042,(Kouroumu 7) [Sakuya17sai (Moyomoto LV48)] Koumakan Milk Server (Touhou Project),(紅楼夢7) [咲耶17歳 (もょもとLV48)] 紅魔館みるくさぁばぁ (東方Project),Koumakan Milk Server,japanese,moyomoto lv48,sakuya17sai,doujinshi,touhou project,"sanae kochiya, sakuya izayoi","maid, group, enema, ahegao, inflation, stockings, mosaic censorship, rape",31,2014-09-24 04:33:42,2014-09-24 11:33:42,2025-03-01 20:49:07
117043,[K-Drive (Narutaki Shin)] Sayonara Mahou Shoujo (Mahou Shoujo Lyrical Nanoha) [Digital],[K-Drive (鳴滝しん)] サヨナラ魔法少女 (魔法少女リリカルなのは) [DL版],Sayonara Mahou Shoujo,japanese,narutaki shin,k-drive,doujinshi,mahou shoujo lyrical nanoha,"yuuno scrya, nanoha takamachi, chrono harlaown","netorare, full color, stockings",17,2014-09-24 04:33:44,2014-09-24 11:33:44,2025-03-01 20:49:08
117044,(SC63) [Mimicry.z (Aka Satanan)] Watashi no Shojo Ubai ni Kite! | Please steal my VIRGINITY! (No-Rin) [English] =TV=,(サンクリ63) [みみくりどっとぜっと (赤さたなん)] 私の処女奪いにきてっっ! (のうりん) [英訳],Watashi no Shojo Ubai ni Kite! | Please steal my VIRGINITY!,"english, translated",aka satanan,mimicry.z,doujinshi,no-rin,natsumi bekki,"dark skin, defloration, full color, mosaic censorship, teacher",12,2014-09-24 04:33:44,2014-09-24 11:33:44,2025-03-01 20:49:09
117045,(C86) [BRIO (YO)] Michitarita Lonely (Love Live!) [Chinese] [玻璃花園漢化],(C86) [BRIO (YO)] 満ち足りたLonely (ラブライブ!) [中国翻訳],Michitarita Lonely,"translated, chinese",puyocha,brio,doujinshi,love live,"eri ayase, nozomi toujou","females only, full censorship, schoolgirl uniform, yuri, fingering, tribadism",24,2014-09-24 04:33:45,2014-09-24 11:33:45,2025-03-01 20:49:10
117048,[Nozomu Tamaki] Anego 2 Ch. 10 [English] [Lazarus H],[環望] アネゴッ !! 2 第10章 [英訳],Anego 2 Ch. 10,"english, translated",tamaki nozomu,,manga,,,full censorship,26,2014-09-24 05:44:16,2014-09-24 12:44:16,2025-03-01 20:49:12
117049,(Reitaisai 11) [Itou Life] Wriggle-chan Ouen Sex (Touhou Project) [English] [CGrascal],(例大祭11) [伊東ライフ] りぐるちゃん応援せっくす(東方Project) [英訳],Wriggle-chan Ouen Sex,"english, translated",itou life,itou life,doujinshi,touhou project,wriggle nightbug,"leg lock, monster girl, glasses, insect girl, nakadashi, x-ray, stockings, apron",22,2014-09-24 05:44:16,2014-09-24 12:44:16,2025-03-01 20:49:13
117050,[Xration (mil)] 姫騎士テイム2 (ラグナロクオンライン),,姫騎士テイム2,japanese,mil,xration,doujinshi,ragnarok online,,,50,2014-09-24 07:01:57,2014-09-24 14:01:57,2025-03-01 20:49:14
117051,(C86) [Tetchan Hato (Minasuki Popuri)] Sayonara Peta Chite!,(C86) [てっちゃんハト (みなすきぽぷり)] サヨナラペタちて！,Sayonara Peta Chite!,japanese,minasuki popuri,tetchan hato,doujinshi,,,"condom, anal, lolicon, incest, tanlines, stockings",27,2014-09-24 07:30:55,2014-09-24 14:30:55,2025-03-01 20:49:14
117052,(C83) [Omoshiro Burger (Tokuda Shinnosuke)] 6+4 [2nd Edition 2013-01-20],(C83) [おもしろバーガー (徳田しんのすけ)] 6+4 [2版 2013年1月20日],6+4,japanese,tokuda shinnosuke,omoshiro burger,doujinshi,,,"big breasts, pregnant, group, schoolgirl uniform, impregnation",15,2014-09-24 08:34:38,2014-09-24 15:34:38,2025-03-01 20:49:15
