ID,EN_TITLE,JP_TITLE,CLEAN_TITLE,LANGUAGE,ARTIST,GROUP_NAME,CATEGORY,PARODY,CHARACTER,TAGS,PAGES,UPLOAD_DATE,FORMATTED_DATE,SCRAPED_DATE
147412,[Anthology] BOY'S Pierce Kaihatsu Shitsu vol.15 Renai Choukyou 24ji [Digital],[アンソロジー] BOY'Sピアス開発室 vol.15 恋愛調教24時 [DL版],BOY'S Pierce Kaihatsu Shitsu vol.15 Renai Choukyou 24ji,japanese,"nanoka, shibuya sicago, kaneko ako",,manga,,,"full censorship, anthology, anal, tracksuit, males only, yaoi, collar",136,2015-10-22 15:39:17,2015-10-22 22:39:17,2025-03-02 04:07:00
147413,[Anthology] BOY'S Pierce Kaihatsu Shitsu vol.13 Ore no Kokan ga Hi o Fukuze!! [Digital],[アンソロジー] BOY'Sピアス開発室 vol.13 俺の股間が火を噴くぜ!! [DL版],BOY'S Pierce Kaihatsu Shitsu vol.13 Ore no Kokan ga Hi o Fukuze!!,japanese,"shibuya sicago, yurihara aki, fujimako, komine kon, chono shibuki",,manga,,,"full censorship, anthology, anal, kimono, dark skin, males only, yaoi",123,2015-10-22 15:43:11,2015-10-22 22:43:11,2025-03-02 04:07:01
147415,[Tachibana Naoki] Hitozuma Sharehouse ~ Bishonure Okusama o Fukusuunin de Kyouyuu suru Koto 7,[断華ナオキ] 人妻シェアハウス～びしょ濡れ奥様を複数人で共有すること 7,Hitozuma Sharehouse ~ Bishonure Okusama o Fukusuunin de Kyouyuu suru Koto 7,japanese,tachibana naoki,,manga,,,"milf, big breasts, group, netorare, multi-work series, drugs, mosaic censorship",25,2015-10-22 15:44:41,2015-10-22 22:44:41,2025-03-02 04:07:02
147416,(C88) [Xration (mil)] Onigashima no Rouraku (Ragnarok Online) [Chinese] [為了拯救自己的蛋蛋漢化],(C88) [Xration (mil)] 鬼ヶ島の籠絡 (ラグナロクオンライン) [中国翻訳],Onigashima no Rouraku,"translated, chinese",mil,xration,doujinshi,ragnarok online,,"twins, milf, big breasts, old man, netorare, big ass, nakadashi, ahegao, bondage, drugs, rape, dilf, impregnation, kunoichi, bbm, shotacon",44,2015-10-22 15:53:54,2015-10-22 22:53:54,2025-03-02 04:07:03
147417,(C86) [slipstream (Masakichi)] Ore no Kanojo wa School☆Idol (Love Live!) [Chinese] [无毒汉化组],(C86) [slipstream (まさきち)] 俺のカノジョはスクール☆アイドル (ラブライブ!) [中国翻訳],Ore no Kanojo wa School☆Idol,"translated, chinese",masakichi,,doujinshi,love live,eri ayase,"schoolgirl uniform, nakadashi",19,2015-10-22 15:54:29,2015-10-22 22:54:29,2025-03-02 04:07:04
147420,(SUPER21) [Fiance Tank (Matsue)] Ringo-chan So Cute! (Uta no Prince-sama) [English] [N04h],(SUPER21) [フィアンセ戦車 (まつえー)] 林檎chan So Cute! (うたの☆プリンスさまっ♪) [英訳],Ringo-chan So Cute!,"english, translated",matsue,fiance tank,doujinshi,uta no prince-sama,ringo tsukimiya,"ahegao, anal, sex toys, crossdressing, males only, yaoi, mind break, dilf, tomgirl, blowjob",26,2015-10-22 15:58:51,2015-10-22 22:58:51,2025-03-02 04:07:06
147421,[Kon-Kit] Jisatsu Otoko no Beach l Suicide Man's Beach (COMIC Penguin Club 2014-09) [English] {TripleSevenScans},[蒟吉人] 自殺男のビーチ (COMIC ペンギンクラブ 2014年9月号) [英訳],Jisatsu Otoko no Beach l Suicide Man's Beach,"english, translated",kon-kit,,manga,,,"milf, swimsuit, full censorship, cheating, multi-work series",22,2015-10-22 15:59:27,2015-10-22 22:59:27,2025-03-02 04:07:07
147423,(Shuuki Reitaisai 2) [Iiwake-Gaisya (Shigemiya Kyouhei)] Alice no Mizu (Touhou Project),(秋季例大祭2) [いいわけ会社 (樹宮匡平)] ありすのみず (東方Project),Alice no Mizu,japanese,shigemiya kyouhei,iiwake-gaisya,doujinshi,touhou project,alice margatroid,"urination, kimono, stockings",18,2015-10-22 16:00:35,2015-10-22 23:00:35,2025-03-02 04:07:08
147424,[Yoshida Tobio] Onee-chan to Issho (COMIC Ero-Tama 2015-07 Vol. 9) [Chinese],[吉田鳶牡] お姉ちゃんといっしょ (Comic エロ魂 2015年7月号 vol.9) [中国翻訳],Onee-chan to Issho,"translated, chinese",yoshida tobio,,manga,,,"incest, mosaic censorship, sister, shotacon",19,2015-10-22 16:04:09,2015-10-22 23:04:09,2025-03-02 04:07:09
147425,[Kon-Kit] Hatsujou Arrowhead l Sexual Excitement Arrowhead (COMIC Penguin Club 2015-01) [English] {TripleSevenScans},[蒟吉人] 発情Arrowhead (COMIC ペンギンクラブ 2015年1月号) [英訳],Hatsujou Arrowhead l Sexual Excitement Arrowhead,"english, translated",kon-kit,,manga,,,"milf, big breasts, swimsuit, glasses, netorare, cheating, nakadashi, bikini, multi-work series, rape, dilf, bbm",22,2015-10-22 16:04:49,2015-10-22 23:04:49,2025-03-02 04:07:10
147429,[Shinkai] Sweet Jam,[真海] SWEET☆JAM,Sweet Jam,japanese,shinkai,,manga,,,"sweating, big breasts, triple penetration, group, glasses, uncensored, cervix penetration, anal, ffm threesome, double penetration, tankoubon, stockings, rape, age regression",202,2015-10-22 16:26:07,2015-10-22 23:26:07,2025-03-02 04:07:13
147431,[Fuusen Club] Inchoukyou Maika [Chinese],[風船クラブ] 淫調教マイカ [中国翻訳],Inchoukyou Maika,"translated, chinese",fuusen club,,manga,,,"futanari, big breasts, urethra insertion, group, ahegao, anal, sex toys, femdom, bondage, yuri, drugs, incest, tankoubon, orgasm denial, small breasts, mind break, rape, gender bender, big clit, big penis, shotacon, shibari, autofellatio",163,2015-10-22 17:18:54,2015-10-23 00:18:54,2025-03-02 04:07:14
147433,(C82) [Monmo Bokujou (Uron Rei)] KARLSLAND SYNDROME 2 (Strike Witches),(C82) [モンモー牧場 (ウーロン・レイ)] KARLSLAND SYNDROME 2 (ストライクウィッチーズ),KARLSLAND SYNDROME 2,japanese,uron rei,monmo bokujou,doujinshi,strike witches,hanna-justina marseille,"big breasts, full censorship, nakadashi, mind control",26,2015-10-22 17:20:55,2015-10-23 00:20:55,2025-03-02 04:07:15
147434,(C83) [Monmo Bokujou (Uron Rei)] KARLSLAND SYNDROME 2 end (Strike Witches),(C83) [モンモー牧場 (ウーロン・レイ)] KARLSLAND SYNDROME 2 end (ストライクウィッチーズ),KARLSLAND SYNDROME 2 end,japanese,uron rei,monmo bokujou,doujinshi,strike witches,minna-dietlinde wilcke,"big breasts, group, schoolgirl uniform, nakadashi, bikini, mind control",34,2015-10-22 17:22:00,2015-10-23 00:22:00,2025-03-02 04:07:17
147435,[Shioya (Shioya Maico)] Shimamu Ganbarimasu (THE iDOLM@STER CINDERELLA GIRLS) [Digital],[塩屋 (塩屋舞子)] しまむーガンバリマス (アイドルマスター シンデレラガールズ) [DL版],Shimamu Ganbarimasu,japanese,shioya maico,shioya,doujinshi,the idolmaster,uzuki shimamura,"group, nakadashi, mosaic censorship",18,2015-10-22 17:22:33,2015-10-23 00:22:33,2025-03-02 04:07:17
147436,[Shioya (Shioya Maico)] Joumu Ijiri (THE iDOLM@STER CINDERELLA GIRLS) [Digital],[塩屋 (塩屋舞子)] 常務いじり (アイドルマスター シンデレラガールズ) [DL版],Joumu Ijiri,japanese,shioya maico,shioya,doujinshi,the idolmaster,mishiro,"milf, big breasts, garter belt, group, anal, hairy, double penetration, stockings, mosaic censorship",20,2015-10-22 17:26:15,2015-10-23 00:26:15,2025-03-02 04:07:18
147437,(COMIC1☆9) [SONIC WINTER (Tsukishima Takafuyu)] OURS. (Amagi Brilliant Park),(COMIC1☆9) [SONIC WINTER (月島隆冬)] OURS. (甘城ブリリアントパーク),OURS.,japanese,tsukishima takafuyu,sonic winter,doujinshi,amagi brilliant park,"muse, isuzu sento","big breasts, big ass, nakadashi, mosaic censorship",26,2015-10-22 17:27:03,2015-10-23 00:27:03,2025-03-02 04:07:19
147438,[Zero no Mono] Fushi Dara (COMIC Ero-Tama 2015-09 Vol. 10) [Chinese] [无毒汉化组],[ゼロの者] 父子だら (Comic エロ魂 2015年9月号 vol.10) [中国翻訳],Fushi Dara,"translated, chinese",zero no mono,,manga,,,"big breasts, old man, incest, apron, mosaic censorship, dilf, daughter",5,2015-10-22 17:27:12,2015-10-23 00:27:12,2025-03-02 04:07:20
147442,[Matsunami Yuuki] Panic Paradise,[松並ゆうき] ぱにっくパラダイス,Panic Paradise,japanese,matsunami yuuki,,manga,,,"big breasts, full censorship, glasses, nakadashi, tankoubon, lingerie",165,2015-10-22 19:10:59,2015-10-23 02:10:59,2025-03-02 04:07:23
147443,(C86) [PINK.in BLACK (Kanaru)] LOOK AT ME (Kantai Collection -KanColle-) [English] {Cutegirls},(C86) [PINK.in BLACK (かなる)] LOOK AT ME (艦隊これくしょん -艦これ-) [英訳],LOOK AT ME,"english, translated",kanaru,pink.in black,doujinshi,kantai collection,"mutsu, teitoku, kaga","big breasts, bbw, dougi, military, defloration, stockings, collar, mecha girl",23,2015-10-22 19:21:12,2015-10-23 02:21:12,2025-03-02 04:07:24
147444,[Amamiya You] Aobazuku,[天宮耀] 青葉木菟,Aobazuku,japanese,amamiya you,,manga,,,"miko, glasses, schoolgirl uniform, nakadashi, tankoubon, stockings",184,2015-10-22 19:39:04,2015-10-23 02:39:04,2025-03-02 04:07:24
147446,[あべつくも、新] 熟れた女の香り蒸す絶海猥習温泉街1 [DL版],[あべつくも、新] 熟れた女の香り蒸す絶海猥習温泉街1 [DL版],熟れた女の香り蒸す絶海猥習温泉街1,japanese,"abe tsukumo, shin",,manga,,,"full censorship, full color",19,2015-10-22 20:20:49,2015-10-23 03:20:49,2025-03-02 04:07:26
147447,[あべつくも、新] 熟れた女の香り蒸す絶海猥習温泉街2 [DL版],[あべつくも、新] 熟れた女の香り蒸す絶海猥習温泉街2 [DL版],熟れた女の香り蒸す絶海猥習温泉街2,japanese,"abe tsukumo, shin",,manga,,,"handjob, big breasts, full censorship, big ass, ahegao, bondage, full color, blowjob",19,2015-10-22 20:21:24,2015-10-23 03:21:24,2025-03-02 04:07:27
147448,"[Abe Tsukumo, Shin] Nyotaika Taku Nomide Soko, Irecha damee! -Ore to Nyotaika Senpai to Futanari Ane no Kuro Majutsu- 1 [Digital]",[あべつくも、新] 女体化宅飲みでソコ、入れちゃだめぇっ! -俺と女体化先輩とふたなり姉の黒魔術- 1 [DL版],"Nyotaika Taku Nomide Soko, Irecha damee!1",japanese,"abe tsukumo, shin",,manga,,,"big breasts, full censorship, glasses, nakadashi, ahegao, drunk, gender bender",15,2015-10-22 20:21:53,2015-10-23 03:21:53,2025-03-02 04:07:28
147449,[Nendo.] Shoujo Kousai [English] [biribiri],[ねんど。] 少女交際  [英訳],Shoujo Kousai,"english, translated",nendo.,,manga,,,"group, glasses, story arc, cheating, shimapan, nakadashi, cousin, lolicon, incest, double penetration, tankoubon, stockings, sumata, oppai loli, sister, daughter, shotacon",182,2015-10-22 22:39:39,2015-10-23 05:39:39,2025-03-02 04:07:29
147450,[Uoman Kotaroo] School Counsellor Misato!!,[魚萬コタロー] スクールカウンセラーみさと!!,School Counsellor Misato!!,japanese,uoman kotaroo,,manga,,,"milf, big breasts, glasses, nakadashi, teacher, blowjob, deepthroat",32,2015-10-22 22:41:27,2015-10-23 05:41:27,2025-03-02 04:07:30
147451,(C76) [Chemical Drop (Kirigaya Kari)] Ichinan Satte mata Ichinan (Persona 4),(C76) [ケミカルドロップ (桐ヶ谷佳里)] 一難去ってまた一難 (ペルソナ4),Ichinan Satte mata Ichinan,japanese,,chemical drop,doujinshi,persona 4,"kanji tatsumi, yuu narukami","transformation, big breasts, crossdressing, bikini, gender bender",27,2015-10-22 22:51:04,2015-10-23 05:51:04,2025-03-02 04:07:31
147452,(COMIC1☆2) [Tsurikichi Doumei (Shiomi Yuusuke)] Yousei Joou (Various) [English] [Natty Translations] [Incomplete],(COMIC1☆2) [釣りキチ同盟 (士臣佑介)] 妖精女王 (よろず) [英訳] [ページ欠落],Yousei Joou,"english, translated",shiomi yuusuke,tsurikichi doumei,doujinshi,fairy tail,erza scarlet,"maid, sweating, big breasts, mmf threesome, group, prostitution, nakadashi, ahegao, anal, double penetration, stockings, bukkake, mosaic censorship, incomplete, sole female",24,2015-10-23 00:01:13,2015-10-23 07:01:13,2025-03-02 04:07:32
147454,[Shikishiro Konomi] Netoraserare Ch. 1-20,[色白好] ネトラセラレ 第1-20話,Netoraserare Ch. 1-20,japanese,shikishiro konomi,,manga,,,"milf, big breasts, full censorship, glasses, netorare, story arc, replaced, nakadashi, teacher",420,2015-10-23 00:54:46,2015-10-23 07:54:46,2025-03-02 04:07:34
147455,(C88) [Niji wo Machinagara (Biwa)] Chuudoku Shoujo (Danganronpa),(C88) [虹を待ちながら (枇杷)] ちゅーどくしょうじょ (ダンガンロンパ),Chuudoku Shoujo,japanese,biwa,niji wo machinagara,doujinshi,danganronpa,"komaru naegi, makoto naegi","big breasts, big ass, schoolgirl uniform, nakadashi, incest, sister",21,2015-10-23 00:55:27,2015-10-23 07:55:27,2025-03-02 04:07:35
147456,[Kouzuki Rio] Ingoku Game,[香月りお] 淫獄ゲーム,Ingoku Game,japanese,kouzuki rio,,manga,,,"big breasts, glasses, nakadashi, anal, tankoubon",197,2015-10-23 02:34:02,2015-10-23 09:34:02,2025-03-02 04:07:36
147457,(C88) [Albercope. (Alber)] Shiburin o Fukusuunin de Rape suru Ohanashi (THE IDOLM@STER CINDERELLA GIRLS) [Chinese] [无毒汉化组],(C88) [あるばーcope. (Alber)] しぶりんをふくすうにんでれいぷするお話 (アイドルマスター シンデレラガールズ) [中国翻訳],Shiburin o Fukusuunin de Rape suru Ohanashi,"translated, chinese",alber,albercorp.,doujinshi,the idolmaster,rin shibuya,"group, schoolgirl uniform, nakadashi, anal, bondage, rape",24,2015-10-23 03:31:34,2015-10-23 10:31:34,2025-03-02 04:07:37
147458,[Itaba Hiroshi] Ketsu-en Ch. 1-3,[板場広し] 血縁 第1-3話,Ketsu3,japanese,itaba hiroshi,,manga,,,"milf, big breasts, netorare, cheating, schoolgirl uniform, nakadashi, ahegao, sex toys, mother, cousin, incest, aunt, sister",64,2015-10-23 03:42:14,2015-10-23 10:42:14,2025-03-02 04:07:38
147459,[Hybrid Jimushitsu (Muronaga Chaashuu)] Hybrid Tsuushin vol. 19 (Nanatsu no Taizai) [English] [EHCOVE] [Digital],[ハイブリッド事務室 (室永叉焼)] ハイブリッド通信vol.19 (七つの大罪) [英訳] [DL版],Hybrid Tsuushin vol. 19,"english, translated",muronaga chaashuu,hybrid jimushitsu,doujinshi,nanatsu no taizai,"diane, elizabeth liones, merlin","sweating, big breasts, bbw, big ass, huge breasts, nipple fuck, incest, assjob, stockings, sister, shotacon",25,2015-10-23 04:36:16,2015-10-23 11:36:16,2025-03-02 04:07:38
147460,[Kinoko 931% (Taono Kinoko)] Masou Sanpo (Rance),[きのこ931% (汰尾乃きのこ)] まそうさんぽ (ランス),Masou Sanpo,japanese,taono kinoko,kinoko 931 percent,doujinshi,rance,shizuka masou,"birth, scat, pregnant, cervix penetration, dog, bestiality, ahegao, exhibitionism, x-ray, human pet, impregnation, collar, slave",41,2015-10-23 06:48:38,2015-10-23 13:48:38,2025-03-02 04:07:39
147461,"[Yamada Non] 3P, Hajimemashita! (BOY'S Pierce Kindan 2013-08) [English] [Blissful Sin] [Decensored]",[やまだノン] 3P、はじめました! (BOY’Sピアス禁断 2013年8月号) [英訳] [無修正],"3P, Hajimemashita!","english, translated",yamada non,,manga,,,"twins, schoolboy uniform, group, uncensored, anal, brother, males only, incest, yaoi, tomgirl",18,2015-10-23 06:50:30,2015-10-23 13:50:30,2025-03-02 04:07:40
147462,(C88) [Kyokutou Koumuten (Kikunosukemaru)] GIRLFriend’s 9 (Kantai Collection -KanColle-),(C88) [極東工務店 (菊のすけまる)] GIRLFriend's 9 (艦隊これくしょん -艦これ-),GIRLFriend’s 9,japanese,kikunosukemaru,kyokutou koumuten,doujinshi,kantai collection,"ro-500, teitoku","lolicon, tanlines, school swimsuit",22,2015-10-23 06:55:11,2015-10-23 13:55:11,2025-03-02 04:07:41
147463,(C88) [HIYOKO CROWN (Shinano Yura)] Maki-chan Kanshasai (Love Live!),(C88) [HIYOKO CROWN (しなの優良)] 真姫ちゃん感謝祭 (ラブライブ!),Maki-chan Kanshasai,japanese,shinano yura,hiyoko crown,doujinshi,love live,maki nishikino,"mmf threesome, group, schoolgirl uniform, bondage, defloration, rape",18,2015-10-23 06:56:57,2015-10-23 13:56:57,2025-03-02 04:07:42
147464,(COMIC1☆9) [Toraya (ITOYOKO)] Chotto H na Euphonium | Erotic Euphonium (Hibike! Euphonium) [English] [STURDY SCANS],(COMIC1☆9) [トラ屋 (ITOYOKO)] ちょっとHな♪ユーフォニアム (響け!ユーフォニアム) [英訳],Chotto H na Euphonium | Erotic Euphonium,"english, translated",itoyoko,toraya,doujinshi,hibike euphonium,"asuka tanaka, kumiko oumae","virginity, schoolboy uniform, glasses, schoolgirl uniform, nakadashi, defloration, stockings, teacher",27,2015-10-23 07:22:04,2015-10-23 14:22:04,2025-03-02 04:07:43
147465,[Rurunoya (Rurukichi)] Dead or Slave (Danganronpa) [Digital],[るるノ屋 (るるキチ)] デッドオアスレイヴ (ダンガンロンパ) [DL版],Dead or Slave,japanese,rurukichi,rurunoya,doujinshi,danganronpa,komaru naegi,"spanking, group, schoolgirl uniform, anal, double penetration",57,2015-10-23 08:15:39,2015-10-23 15:15:39,2025-03-02 04:07:44
147466,(C80) [Intendou (Yajuu)] Saotome-gumi VI (Kochikame),(C80) [淫天堂 (野獣)] 早乙女組VI (こち亀),Saotome-gumi VI,japanese,yajuu,intendou,doujinshi,kochikame,matoi giboshi,"group, ffm threesome, mosaic censorship",18,2015-10-23 08:21:50,2015-10-23 15:21:50,2025-03-02 04:07:45
147467,Helping with insomnia problems,,Helping with insomnia problems,"english, translated",,,doujinshi,,,"females only, unbirth, schoolgirl uniform, inflation, stockings",6,2015-10-23 09:00:44,2015-10-23 16:00:44,2025-03-02 04:07:46
147468,Octopus girl unbirth,,Octopus girl unbirth,japanese,yace,,doujinshi,original,,"monster girl, unbirth, full color, shotacon",8,2015-10-23 09:21:17,2015-10-23 16:21:17,2025-03-02 04:07:47
147469,(C88) [furuike (Sumiya)] Мой любимый ~Watashi no Aisuru Hito~ (THE IDOLM@STER CINDERELLA GIRLS) [English],(C88) [furuike (スミヤ)] Мой любимый モイ・リュビームイ～わたしのあいするひと～ (アイドルマスター シンデレラガールズ)  [英訳],Мой любимый,"english, translated",sumiya,furuike,doujinshi,the idolmaster,anastasia,"full censorship, collar, sole female, sole male",19,2015-10-23 09:40:44,2015-10-23 16:40:44,2025-03-02 04:07:48
147470,[Blue Keshi (lvlv)] Shintou - PENETRATION (Dungeon Fighter Online) [Digital],[ブルーケシ (lvlv)] 浸透 (アラド戦記) [DL版],Shintou - PENETRATION,japanese,lvlv,blue keshi,doujinshi,dungeon fighter online,,"urethra insertion, group, urination, anal, yaoi, demon, blowjob, tentacles, shotacon, deepthroat",32,2015-10-23 10:32:49,2015-10-23 17:32:49,2025-03-02 04:07:49
147471,(C86) [Mieow (Rustle)] Little Girl 9 [Chinese] [三分鐘熱度個人漢化],(C86) [Mieow (らする)] Little Girl 9 [中国翻訳],Little Girl 9,"translated, chinese",rustle,mieow,doujinshi,,,"swimsuit, bikini, lolicon, defloration, full color, shotacon",30,2015-10-23 10:46:50,2015-10-23 17:46:50,2025-03-02 04:07:50
147472,[Kuronekotei (Chibinon*)] Love Operation (Angel Beats!) [Digital],[黒猫亭 (チビのん☆)] ラブオペ (Angel Beats!) [DL版],Love Operation,japanese,chibinon,kuronekotei,doujinshi,angel beats,"yuri nakamura, yuzuru otonashi, kanade tachibana","nurse, group, masturbation, ffm threesome, lolicon, selfcest, catgirl",26,2015-10-23 11:49:28,2015-10-23 18:49:28,2025-03-02 04:07:50
147473,【更新合集】龙之谷破晓奇兵&纳米核心,【Updated collection】Dragon Nest Warriors` Dawn & NanoCore,【更新合集】龙之谷破晓奇兵&纳米核心,japanese,,dragon nest,doujinshi,,,imageset,17,2015-10-23 12:21:00,2015-10-23 19:21:00,2025-03-02 04:07:51
147474,(C88) [Xration (mil)] Onigashima no Rouraku (Ragnarok Online) [Chinese] [為了拯救自己的蛋蛋漢化],(C88) [Xration (mil)] 鬼ヶ島の籠絡 (ラグナロクオンライン) [中国翻訳],Onigashima no Rouraku,"translated, chinese",mil,xration,doujinshi,ragnarok online,,"twins, milf, big breasts, old man, netorare, big ass, nakadashi, ahegao, bondage, drugs, rape, dilf, impregnation, kunoichi, bbm, shotacon",44,2015-10-23 13:04:29,2015-10-23 20:04:29,2025-03-02 04:07:52
147475,(C84) [atSD (Tsuneyoshi)] Mikoto to. 4 | With Mikoto. 4 (Toaru Majutsu no Index) [English] [EHCOVE],(C84) [atSD (つねよし)] みことと。4 (とある魔術の禁書目録) [英訳],Mikoto to. 4 | With Mikoto. 4,"english, translated",tsuneyoshi,atsd,doujinshi,"toaru kagaku no railgun, toaru majutsu no index","touma kamijou, mikoto misaka","ahegao, hotpants, tomboy, sole female, sole male",22,2015-10-23 13:11:53,2015-10-23 20:11:53,2025-03-02 04:07:53
147476,(Reitaisai 12) [Kuma-tan Flash! (Yamu)] Tanetsuke Oji-san Hazard | Jizz Geezer Hazard (Touhou Project) [English],(例大祭12) [くまたんFlash! (やむっ)] 種付けおじさんハザード (幻想郷に種付けおじさんがやってきたYA-YA-YA) (東方Project) [英訳],Tanetsuke Oji-san Hazard | Jizz Geezer Hazard,"english, translated",yamu,"kuma-tan flash, reverse noise",doujinshi,touhou project,satori komeiji,"unusual pupils, nakadashi, dilf, impregnation, bbm",6,2015-10-23 13:20:42,2015-10-23 20:20:42,2025-03-02 04:07:54
147477,"[Hermit9 (Various)] Touhou Oniku Goudou -Nikuyoku no Mama Odorikurue! Oniku Kyouen, Kaimaku! (Touhou Project) [Digital]",[ハーミット9 (よろず)] 東方おにく合同 -肉欲のまま踊り狂え! おにくの狂宴、開幕!- (東方Project) [DL版],"Touhou Oniku Goudou -Nikuyoku no Mama Odorikurue! Oniku Kyouen, Kaimaku!",japanese,"pandain, shitto mask, wenajii, anchors",hermit9,doujinshi,touhou project,"chen, satori komeiji","futanari, big breasts, farting, bbw, big ass, nakadashi, ahegao, huge breasts, anal, weight gain, nipple fuck, inflation, breast expansion, lactation, tentacles",150,2015-10-23 13:49:26,2015-10-23 20:49:26,2025-03-02 04:07:55
147478,(C88) [Iiwake-Gaisya (Shigemiya Kyouhei)] Nanairo to xxx Play (Nanairo to Koibito Play 6) (Touhou Project),(C88) [いいわけ会社 (樹宮匡平)] 七色とxxxプレイ (七色と恋人プレイ6) (東方Project),Nanairo to xxx Play,japanese,shigemiya kyouhei,iiwake-gaisya,doujinshi,touhou project,alice margatroid,"big breasts, big ass, anal, stockings, paizuri",18,2015-10-23 14:31:44,2015-10-23 21:31:44,2025-03-02 04:07:56
147479,(C87) [Obumanjuu (obmas)] Oni No Yu,(C87) [おぶまんじゅう (obmas)] 鬼の湯,Oni No Yu,japanese,obmas,obumanjuu,doujinshi,,,"oni, big breasts, big ass, nakadashi, kimono, x-ray",26,2015-10-23 14:50:50,2015-10-23 21:50:50,2025-03-02 04:07:57
147480,(C88) [Little Hamlet (Kiira)] Komeiji Satori no Elevator wa Toilet ja arimasen (Touhou Project),(C88) [りとる☆はむれっと (きぃら～☆)] 古明地さとりのエレベーターはトイレじゃありません♡ (東方Project),Komeiji Satori no Elevator wa Toilet ja arimasen,japanese,kiira,little hamlet,doujinshi,touhou project,satori komeiji,"urination, lolicon, full color, mosaic censorship, piss drinking, shotacon",42,2015-10-23 17:08:32,2015-10-24 00:08:32,2025-03-02 04:07:58
147481,[Sabashi Renya] Boku no Hot Spot Ch.1 (COMIC Tenma 2014-09) [English] [TripleSevenScans],[左橋レンヤ] 僕のほっとすぽっと 第1話 (COMIC 天魔 2014年9月号) [英訳],Boku no Hot Spot Ch.1,"english, translated",sabashi renya,,manga,,,"handjob, virginity, leg lock, big breasts, swimsuit, urination, bikini, mosaic censorship, shotacon, sole female, sole male",27,2015-10-23 17:18:36,2015-10-24 00:18:36,2025-03-02 04:07:59
147482,"(C87) [Niratama (Sekihara, Hiroto)] Lovesick Girl (Love Live!) [English] [Zuiccraft Translation]",(C87) [にらたま (せきはら、広人)] Lovesick Girl (ラブライブ!) [英訳],Lovesick Girl,"english, translated","sekihara, hiroto",niratama,doujinshi,love live,"maki nishikino, nico yazawa","cunnilingus, females only, schoolgirl uniform, yuri",36,2015-10-23 17:19:28,2015-10-24 00:19:28,2025-03-02 04:07:59
147483,(C85) [Kajimura Market (Kajimura Kajima)] soRo style #19 (Ragnarok Online),(C85) [かじむらマーケット (かじむらカジマ)] soRo style #19 (ラグナロクオンライン),soRo style #19,japanese,kajimura kajima,kajimura market,doujinshi,ragnarok online,high priest,"full censorship, nakadashi, stockings",18,2015-10-23 17:20:00,2015-10-24 00:20:00,2025-03-02 04:08:00
147484,[Shimoyakedou (Ouma Tokiichi)] Shimamura-EX (THE iDOLM@STER Cinderella Girls) [Digital],[しもやけ堂 (逢魔刻壱)] しまむらっくす (アイドルマスター シンデレラガールズ) [DL版],Shimamura-EX,japanese,ouma tokiichi,shimoyakedou,doujinshi,the idolmaster,"producer, uzuki shimamura","schoolgirl uniform, nakadashi, full color, bloomers, school swimsuit",16,2015-10-23 17:20:32,2015-10-24 00:20:32,2025-03-02 04:08:01
147485,[Gentsuki Okiba (Gentsuki)] Sanae-shiki Miko no Oshigoto 2 (Touhou Project) [Digital],[ゲンツキオキバ (ゲンツキ)]  早苗式巫女のお仕事2 (東方Project) [DL版],Sanae-shiki Miko no Oshigoto 2,japanese,gentsuki,gentsuki okiba,doujinshi,touhou project,sanae kochiya,"big breasts, swimsuit, group, nakadashi, anal, bikini, double penetration",18,2015-10-23 17:22:09,2015-10-24 00:22:09,2025-03-02 04:08:02
147486,[Yoshino (Kikuduki Taro)] Minor Ward [Digital],[吉野 (菊月太朗)] Minor Ward [DL版],Minor Ward,japanese,kikuduki taro,yoshino,doujinshi,,,"full censorship, nakadashi, femdom, bondage, defloration, randoseru, sole female, sole male",28,2015-10-23 17:22:57,2015-10-24 00:22:57,2025-03-02 04:08:03
147487,[PONCHO MOJAH (Koharu Nanakusa)] Meganekko Ona Nikki [Digital],[ぽんちょもじゃー (小春七草)] 眼鏡娘オナ日記 [DL版],Meganekko Ona Nikki,japanese,koharu nanakusa,poncho mojah,doujinshi,,,"big breasts, females only, glasses, masturbation, sex toys, solo action, multi-work series, pantyhose, mosaic censorship, inverted nipples",23,2015-10-23 17:23:36,2015-10-24 00:23:36,2025-03-02 04:08:03
147488,(THE iDOLM@NIAX 9) [Wotona no Namae (Nakamura 01)] Ankira no Usui Hon (THE IDOLM@STER CINDERELLA GIRLS),(アイドルマニアックス9) [をとなのなまえ (那賀邑01)] あんきらの薄い本 (アイドルマスター シンデレラガールズ),Ankira no Usui Hon,japanese,,wotona no namae,doujinshi,the idolmaster,"anzu futaba, kirari moroboshi","futanari, nakadashi, lolicon",18,2015-10-23 17:24:09,2015-10-24 00:24:09,2025-03-02 04:08:05
