ID,EN_TITLE,JP_TITLE,CLEAN_TITLE,LANGUAGE,ARTIST,GROUP_NAME,CATEGORY,PARODY,CHARACTER,TAGS,PAGES,UPLOAD_DATE,FORMATTED_DATE,SCRAPED_DATE
145491,(C88) [Tohgoo (Fuyutugu)] Miyu Loli Onahole Kaihatsu Choukyou (Fate/kaleid liner Prisma Illya),(C88) [冬宮 (冬嗣)] 美遊ロリオナホ開発調教 (Fate/kaleid liner プリズマ☆イリヤ),Miyu Loli Onahole Kaihatsu Choukyou,japanese,fuyutugu,tohgoo,doujinshi,fate kaleid liner prisma illya,"miyu edelfelt, shirou emiya","anal, lolicon",26,2015-10-01 01:01:06,2015-10-01 08:01:06,2025-03-02 03:07:57
145492,(C88) [Yume no Niwatori Goya (Sabano Niwatori)] Sex Friend (Kari) 2 (Girl Friend BETA),(C88) [夢のニワトリ小屋 (さばのにわとり)] セックスフレンド(仮) 2 (ガールフレンド(仮)),Sex Friend2,japanese,sabanoniwatori,yume no niwatori goya,doujinshi,girl friend beta,tsugumi harumiya,"big breasts, glasses, fingering",26,2015-10-01 01:01:49,2015-10-01 08:01:49,2025-03-02 03:07:58
145493,(C88) [Kuromahou Kenkyuujo (Nukaji)] SheStar! Imouto ga Kawaikatta node Karada o Notto tte Jii shitemita Kekka (Charlotte),,SheStar! Imouto ga Kawaikatta node Karada o Notto tte Jii shitemita Kekka,japanese,,kuromahou kenkyuujo,doujinshi,charlotte,,"masturbation, lolicon, incest, sister",23,2015-10-01 01:06:13,2015-10-01 08:06:13,2025-03-02 03:07:59
145494,(C88) [Onna Kishi no Shiro (Okuri Banto)] Mahou Shoujo no Choukyou Yuugi (Fate/kaleid liner Prisma Illya),(C88) [女騎士の城 (送り萬都)] 魔法少女の調教遊戯 (Fate/kaleid liner プリズマ☆イリヤ),Mahou Shoujo no Choukyou Yuugi,japanese,okuri banto,onna kishi no shiro,doujinshi,fate kaleid liner prisma illya,miyu edelfelt,"swimsuit, corruption, schoolgirl uniform, femdom, lolicon, footjob, full color, bunny girl, stockings, pantyhose, mosaic censorship",16,2015-10-01 01:09:37,2015-10-01 08:09:37,2025-03-02 03:08:00
145495,(C88) [LemonMaiden (Aoi Masami)] Kyuusei Maryoku Chuudoku (Fate/kaleid liner Prisma Illya),(C88) [LemonMaiden (蒼海)] 吸精魔力中毒 (Fate/kaleid liner プリズマ☆イリヤ),Kyuusei Maryoku Chuudoku,japanese,aoi masami,lemonmaiden,doujinshi,fate kaleid liner prisma illya,illyasviel von einzbern,"mmf threesome, group, glasses, public use, schoolgirl uniform, anal, lolicon, defloration, multi-work series, double penetration",26,2015-10-01 01:13:07,2015-10-01 08:13:07,2025-03-02 03:08:00
145496,(C88) [a.la.mode (Kagura Takeshi)] 40 - Shana tan to Fetish Ero! - (Shakugan no Shana),(C88) [ア・ラ・モード (神楽武志)] 40-シャナたんとフェチえろっ!- (灼眼のシャナ),40,japanese,kagura takeshi,a.la.mode,doujinshi,shakugan no shana,shana,"swimsuit, pantyjob, hairjob, footjob, assjob, stockings, sumata, bloomers, school swimsuit",26,2015-10-01 01:13:49,2015-10-01 08:13:49,2025-03-02 03:08:01
145497,(C88) [Popochichi (Yahiro Pochi)] Shabulotte (Charlotte),(C88) [ぽぽちち (八尋ぽち)] シャブロット (シャーロット),Shabulotte,japanese,yahiro pochi,popochichi,doujinshi,charlotte,"nao tomori, misa kurobane, yuu otosaka","group, schoolgirl uniform, nakadashi, ffm threesome, filming, blowjob",22,2015-10-01 01:14:22,2015-10-01 08:14:22,2025-03-02 03:08:02
145498,(C88) [Esecool (BOSS Chin)] Gyouretsu no dekiru Puff-Puff-san (Dragon Quest),(C88) [エセクール (BOSS珍)] 行列のできるぱふぱふ屋さん (ドラゴンクエスト),Gyouretsu no dekiru Puffsan,japanese,boss chin,esecool,doujinshi,"dragon quest v, dragon quest ix","bianca whitaker, sellma","big breasts, nipple fuck, big areolae, lactation, chikan",26,2015-10-01 01:15:03,2015-10-01 08:15:03,2025-03-02 03:08:03
145499,(C88) [SHINING (Shaian)] Illya to Kuro no Oshioki Ecchi Night (Fate/kaleid liner Prisma Illya),(C88) [SHINING (しゃいあん)] イリヤとクロのお仕置きえっちナイト (Fate/kaleid liner プリズマ☆イリヤ),Illya to Kuro no Oshioki Ecchi Night,japanese,shaian,shining,doujinshi,fate kaleid liner prisma illya,"illyasviel von einzbern, shirou emiya, kuro von einzbern","nakadashi, lolicon, drugs",18,2015-10-01 01:18:43,2015-10-01 08:18:43,2025-03-02 03:08:04
145500,(C88) [Mousou Tengoku (P-chan)] YES Seiou Joshi Power (Girl Friend BETA),(C88) [妄想天国 (Pちゃん)] YES聖櫻女子パワー (ガールフレンド(仮)),YES Seiou Joshi Power,japanese,p-chan,mousou tengoku,doujinshi,girl friend beta,,"big breasts, group, harem, lolicon, footjob, full color, stockings, mosaic censorship",22,2015-10-01 01:20:35,2015-10-01 08:20:35,2025-03-02 03:08:05
145501,(C88) [Nanatsu no Kagiana (Nanakagi Satoshi)] Defective (Charlotte),(C88) [七つの鍵穴 (七鍵智志)] Defective (シャーロット),Defective,japanese,nanakagi satoshi,nanatsu no kagiana,doujinshi,charlotte,nao tomori,"netorare, cervix penetration, nakadashi, ahegao, dark skin, x-ray, mind control, rape, blowjob, bbm",25,2015-10-01 01:21:12,2015-10-01 08:21:12,2025-03-02 03:08:05
145502,[Marui Maru] Yui Sensei no Kyoushi Seikatsu | Ms. Yui's Sexual School Activities (MuchiMuchi ♥ Cream Pie) [English] [Hachimaki+Alex68785] [Digital],[丸居まる] 結衣先生の教師性活 (むちむち♥くりーむぱい) [英訳] [DL版],Yui Sensei no Kyoushi Seikatsu | Ms. Yui's Sexual School Activities,"english, translated",marui maru,,manga,,,"handjob, big breasts, mmf threesome, group, glasses, big ass, replaced, harem, exhibitionism, double penetration, pantyhose, bukkake, teacher, blowjob, shotacon",22,2015-10-01 01:25:41,2015-10-01 08:25:41,2025-03-02 03:08:06
145503,(C88) [Gessyu (Chouzetsu Bishoujo mine)] Nengu no Osamedoki (Kantai Collection -KanColle-),(C88) [げっしゅ (超絶美少女mine)] 年貢の納め時 (艦隊これくしょん -艦これ-),Nengu no Osamedoki,japanese,chouzetsu bishoujo mine,gessyu,doujinshi,kantai collection,"teitoku, kaga","big breasts, full censorship, bondage, x-ray, lactation, stockings, inverted nipples, sole female, sole male",28,2015-10-01 01:26:28,2015-10-01 08:26:28,2025-03-02 03:08:07
145504,(C88) [Mebius no wa (Nyx)] huta-colle!! (Kantai Collection -KanColle-),(C88) [Mebiusの環 (にゅくす)] huta-colle!! (艦隊これくしょん -艦これ-),huta-colle!!,japanese,nyx,mebius no wa,doujinshi,kantai collection,"ro-500, murakumo","futanari, swimsuit, unusual pupils, nakadashi, tanlines, school swimsuit, dickgirl on dickgirl",22,2015-10-01 01:27:04,2015-10-01 08:27:04,2025-03-02 03:08:08
145505,(C88) [Oretachi Misnon Ikka (Misnon the Great)] Yu-Sibu. (Yuusha ni Narenakatta Ore wa Shibushibu Shuushoku o Ketsui Shimashita.),(C88) [俺たちミスノン一家 (須原シイナ)] 憂しぶ。 (勇者になれなかった俺はしぶしぶ就職を決意しました。),Yu-Sibu.,japanese,"suhara shiina, misnon the great",oretachi misnon ikka,doujinshi,yuusha ni narenakatta ore wa shibushibu shuushoku wo ketsui shimashita.,fino bloodstone,"maid, elf, netorare, stockings, rape, sole female, sole male",21,2015-10-01 01:27:39,2015-10-01 08:27:39,2025-03-02 03:08:08
145506,(C88) [Kuromahou Kenkyuujo (Nukaji)] SheStar! Imouto ga Kawaikatta node Karada o Notto tte Jii shitemita Kekka (Charlotte),(C88) [黒魔法研究所 (ぬかじ)] SheStar!妹が可愛かったので体を乗っ取って自慰してみた結果 (シャーロット),SheStar! Imouto ga Kawaikatta node Karada o Notto tte Jii shitemita Kekka,japanese,nukaji,kuromahou kenkyuujo,doujinshi,charlotte,yuu otosaka,"masturbation, lolicon, incest, possession, sister",22,2015-10-01 15:16:26,2015-10-01 22:16:26,2025-03-02 03:08:09
145507,(C88) [Otona Shuppan (Hitsuji Takako)] Fumio no Yuuwaku Date (Girl Friend BETA),(C88) [おとな出版 (ひつじたかこ)] 文緒の誘惑デート (ガールフレンド(仮)),Fumio no Yuuwaku Date,japanese,hitsuji takako,otona shuppan,doujinshi,girl friend beta,fumio murakami,"big breasts, stockings",26,2015-10-01 15:17:27,2015-10-01 22:17:27,2025-03-02 03:08:10
145508,(C88) [Musashi-dou (Musashino Sekai)] Bismarck Mesumilk (Kantai Collection -KanColle-),(C88) [武蔵堂 (ムサシノセカイ)] ビスマルク メスミルク (艦隊これくしょん -艦これ-),Bismarck Mesumilk,japanese,musashino sekai,musashi-dou,doujinshi,kantai collection,"z1, bismarck","futanari, big breasts, pasties, nakadashi, ahegao, anal, crossdressing, military, big balls, stockings, tomgirl, blowjob, shotacon, dickgirl on male, male on dickgirl",25,2015-10-01 15:19:39,2015-10-01 22:19:39,2025-03-02 03:08:11
145509,(C88) [FULLMETAL MADNESS (Asahi)] Nyuu Hamari Michi (Kantai Collection -KanColle-),(C88) [FULLMETAL MADNESS (旭)] ニュー浜り道 (艦隊これくしょん -艦これ-),Nyuu Hamari Michi,japanese,asahi,fullmetal madness,doujinshi,kantai collection,hamakaze,"big breasts, schoolgirl uniform, huge breasts, nipple fuck, lactation, pantyhose, paizuri, inverted nipples",26,2015-10-01 15:20:31,2015-10-01 22:20:31,2025-03-02 03:08:11
145510,[Yaya Hinata] Tonari no Miko-san wa Minna Warau Ch.1-6 [English] [biribiri],[稍日向] 隣の巫女さんは皆笑う 第1-6話 [英訳],Tonari no Miko6,"english, translated",yaya hinata,,manga,,,"futanari, miko, group, glasses, story arc, anal, mtf threesome, kimono, defloration, drugs, possession, dick growth, catgirl, male on dickgirl",118,2015-10-01 15:23:59,2015-10-01 22:23:59,2025-03-02 03:08:12
145511,(C85) [Rotary Engine (Kannazuki Motofumi)] Technobreak Company (Outbreak Company) [English] [Doki Fansubs],(C85) [ろ～たり～Engine (神無月元史)] テクノブレイクカンパニー (アウトブレイク・カンパニー 萌える侵略者) [英訳],Technobreak Company,"english, translated",kannazuki motofumi,rotary engine,doujinshi,outbreak company,"myucel foaran, elbia hanaiman, petralka anne eldant iii","maid, elf, full censorship, dog girl, dark skin, lolicon, tiara",18,2015-10-01 15:28:18,2015-10-01 22:28:18,2025-03-02 03:08:13
145512,(C88) [choco BOX (choco-chip)] choco BOX C88 Goods Tapestry (Kantai Collection -KanColle-),(C88) [choco BOX (choco-chip)] choco BOX C88グッズ タペストリー (艦隊これくしょん -艦これ-),choco BOX C88 Goods Tapestry,japanese,choco-chip,choco box,doujinshi,kantai collection,"yamato, musashi","big breasts, glasses",37,2015-10-01 15:29:32,2015-10-01 22:29:32,2025-03-02 03:08:13
145515,[Hazuki] Hobaku Wana (COMIC HOTMILK 2010-04) [Chinese] [黑条汉化],[羽津樹] 捕縛罠 (コミックホットミルク 2010年4月号) [中国翻訳],Hobaku Wana,"translated, chinese",hazuki,,manga,,,"maid, group, nakadashi, ffm threesome, full color, stockings",8,2015-10-01 15:32:24,2015-10-01 22:32:24,2025-03-02 03:08:15
145516,"(C85) [Kuroi Mikan no Naru Momo no Ki (Koromo)] ""Uwa Tenryuu Kowai"" (Kantai Collection -KanColle-) [Chinese] [黑条汉化]",(C85) [黒いみかんのなるももの木 (コロモ)] 『うわ てんりゅう こわい』 (艦隊これくしょん -艦これ-) [中国翻訳],"""Uwa Tenryuu Kowai""","translated, chinese",koromo,kuroi mikan no naru momo no ki,doujinshi,kantai collection,tenryuu,"schoolgirl uniform, military, stockings, eyepatch, mecha girl",21,2015-10-01 15:33:05,2015-10-01 22:33:05,2025-03-02 03:08:17
145517,[Shinyanchi] Haramura-san wa Boku no Mono (Saki) [Chinese] [魔剑个人汉化],[シンヤんち] 孕むらさんはボクのもの (咲-Saki-) [中国翻訳],Haramura-san wa Boku no Mono,"translated, chinese",,shinyanchi,doujinshi,saki,nodoka haramura,"birth, big breasts, schoolgirl uniform, defloration, full color, lactation, stockings, mosaic censorship, impregnation, sole female",41,2015-10-01 15:34:09,2015-10-01 22:34:09,2025-03-02 03:08:17
145518,(C88) [Muchakai (Mucha)] Chizuru-chan Kaihatsu Nikki 3,(C88) [夢茶会 (むちゃ)] 千鶴ちゃん開発日記3,Chizuru-chan Kaihatsu Nikki 3,japanese,mucha,muchakai,doujinshi,,,"big breasts, unusual pupils, group, netorare, schoolgirl uniform, urination, prostitution, nakadashi, ahegao, anal, multi-work series, double penetration, mind break, dilf, blackmail, collar, slave",32,2015-10-01 15:36:50,2015-10-01 22:36:50,2025-03-02 03:08:19
145519,(C88) [Kazuya (Yoshiura Kazuya)] Yogaritagari+,(C88) [カズ屋 (由浦カズヤ)] よがりたがり+,Yogaritagari+,japanese,yoshiura kazuya,,doujinshi,,,"milf, big breasts, bbw, mmf threesome, group, full censorship, nakadashi, double penetration, dilf",22,2015-10-01 15:37:34,2015-10-01 22:37:34,2025-03-02 03:08:20
145520,[Comaku] Watashi no Shumi tte Hen desu ka? | Is My Hobby Weird? (L -Ladies & Girls Love- 04) [English] [Yuri-ism],[狛句] 私のシュミってヘンですか？ (L -Ladies & Girls Love- 04) [英訳],Watashi no Shumi tte Hen desu ka? | Is My Hobby Weird?,"english, translated",comaku,,manga,,,"females only, glasses, big ass, schoolgirl uniform, yuri, smell",25,2015-10-01 15:38:16,2015-10-01 22:38:16,2025-03-02 03:08:21
145522,(C88) [WIREFRAME (Yuuki Hagure)] Tamani wa Ore no Seishun Love Come mo Machigattatte Ii Janai. (Yahari Ore no Seishun Love Come wa Machigatteiru.) [English] {KFC Translations},(C88) [WIREFRAME (憂姫はぐれ)] たまには俺の青春ラブコメも間違ったっていいじゃない。 (やはり俺の青春ラブコメはまちがっている。) [英訳],Tamani wa Ore no Seishun Love Come mo Machigattatte Ii Janai.,"english, translated",yuuki hagure,wireframe,doujinshi,yahari ore no seishun love come wa machigatteiru,"yui yuigahama, hachiman hikigaya","schoolboy uniform, schoolgirl uniform, defloration, paizuri",21,2015-10-01 15:39:34,2015-10-01 22:39:34,2025-03-02 03:08:22
145523,[locon] Kinrou Shounen | He'll Make Her A Slut (Kyawatama 1ST Zettai Fukujuu Otokonoko.) [English] [B.E.C. Scans] [Digital],[locon] 勤労娼年 (きゃわたま 1ST 絶対服従男の娘。) [英訳] [DL版],Kinrou Shounen | He'll Make Her A Slut,"english, translated",locon,,manga,,,"group, prostitution, frottage, anal, crossdressing, males only, yaoi, stockings, mosaic censorship, dilf, tomgirl, bbm, shotacon",25,2015-10-01 15:42:14,2015-10-01 22:42:14,2025-03-02 03:08:24
145524,(C88) [Hissatsuwaza (Hissatsukun)] Taihen Kiken na... (Ninja Slayer) [Chinese] [空気系☆漢化],(C88) [ひっさつわざ (ひっさつくん)] タイヘンキケンナ・・・ (ニンジャスレイヤー) [中国翻訳],Taihen Kiken na...,"translated, chinese",hissatsukun,hissatsuwaza,doujinshi,ninja slayer,nancy lee,"big breasts, nakadashi, bondage, rape, kunoichi, shibari, sole female",24,2015-10-01 15:42:55,2015-10-01 22:42:55,2025-03-02 03:08:24
145525,[Onsoku Ebifly (Lew)] Hamedori Chijoku Shounen [Digital],[音速エビフライ (レゥ)] ハメ撮り恥辱少年 [DL版],Hamedori Chijoku Shounen,japanese,lew,onsoku ebifly,doujinshi,,,"group, anal, males only, yaoi, filming, mind break, rape, tomgirl, shotacon",26,2015-10-01 15:48:01,2015-10-01 22:48:01,2025-03-02 03:08:25
145526,(C88) [774 House (774)] Attaka Uzumaki | Warm Whirlpool (Naruto) [English] [YQII],(C88) [774ハウス (774)] あったかうずまき (NARUTO -ナルト-) [英訳],Attaka Uzumaki | Warm Whirlpool,"english, translated",nanashi,774 house,doujinshi,naruto,"naruto uzumaki, hinata hyuga","sweating, virginity, bandages, leg lock, big breasts, bbw, big ass, condom, ahegao, defloration, muscle",45,2015-10-01 15:50:18,2015-10-01 22:50:18,2025-03-02 03:08:26
145527,[JUST-K (Gekkoji)] Oppai Meister!! (Macross Frontier) [Digital],[JUST-K (激昂寺)] おっぱい☆マイスター!! (マクロスFRONTIER) [DL版],Oppai Meister!!,japanese,gekkoji,just-k,doujinshi,macross frontier,"ranka lee, alto saotome, sheryl nome","masturbation, mosaic censorship",22,2015-10-01 15:51:14,2015-10-01 22:51:14,2025-03-02 03:08:27
145528,[Nekonote Shobou (Nekonta)] Slime Hime-sama to Boku no Are. [Chinese] [不觉晓个人汉化] [Digital],[ねこのてしょぼう (ねこんた)] スライム姫さまとボクのアレ。 [中国翻訳] [DL版],Slime Hime-sama to Boku no Are.,"translated, chinese",nekonta,nekonote shobou,doujinshi,,,"big breasts, monster girl, nakadashi, anal, slime girl, shotacon",11,2015-10-01 15:52:20,2015-10-01 22:52:20,2025-03-02 03:08:28
145529,[Kidoukan (Kidou Muichi)] Chiisana Seikatsu 2 [Chinese] [夢之行蹤漢化組] [Digital],[綺堂館 (綺堂無一)] ちいさな性活2 [中国翻訳] [DL版],Chiisana Seikatsu 2,"translated, chinese",kidou muichi,kidoukan,doujinshi,,,"virginity, lolicon, defloration, multi-work series, tomboy, shotacon",44,2015-10-01 16:02:04,2015-10-01 23:02:04,2025-03-02 03:08:29
145530,(Houraigekisen! Yo-i! & Gunrei Bu Shuho Goudou Enshuu 3Senme) [Pixel Cot (Habara Meguru)] Haru Wazawai Akizuki (Kantai Collection -KanColle-),(軍令部酒保 & 砲雷撃戦!よーい! 合同演習参戦目) [Pixel Cot. (羽原メグル)] 春禍秋月 (艦隊これくしょん -艦これ-),Haru Wazawai Akizuki,japanese,habara meguru,pixel cot.,doujinshi,kantai collection,akizuki,"group, anal, lolicon, defloration, filming, rape, sole female",26,2015-10-01 16:04:43,2015-10-01 23:04:43,2025-03-02 03:08:30
145531,(C88) [Yu-Yu-Tei (Minakami Rinka)] Umaru to Onii-chan (Himouto! Umaru-chan),(C88) [悠々亭 (水上凛香)] うまるとおにいちゃん (干物妹! うまるちゃん),Umaru to Onii-chan,japanese,minakami rinka,yu-yu-tei,doujinshi,himouto umaru-chan,"taihei doma, umaru doma","incest, sister",17,2015-10-01 16:05:10,2015-10-01 23:05:10,2025-03-02 03:08:30
145532,(C88) [Happy Birthday (MARUchang)] Romance ga Ariamaru (Kantai Collection -KanColle-) [Chinese] [hado与怜个人汉化],(C88) [Happy Birthday (丸ちゃん。)] ロマンスがありあまる (艦隊これくしょん -艦これ-) [中国翻訳],Romance ga Ariamaru,"translated, chinese",maruchang,happy birthday,doujinshi,kantai collection,suzuya,stockings,21,2015-10-01 16:05:49,2015-10-01 23:05:49,2025-03-02 03:08:31
145533,[Yuzuki N Dash] Green Eyes (Comic Tenma 2013-06) [English] [Decensored] [Colorized] [In Progress],[柚木N'] グリーン・アイズ (COMIC 天魔 2013年6月号) [英訳] [無修正] [カラー化] [ページ欠落],Green Eyes,"english, translated",yuzuki n dash,,manga,,,"uncensored, full color, incest, sister",12,2015-10-01 16:06:21,2015-10-01 23:06:21,2025-03-02 03:08:32
145534,"(C88) [Uruujima (Uruujima Call)] 20-nengo no, Sailor Senshi o Kakyuu Youma no Ore ga Netoru 3 (Bishoujo Senshi Sailor Moon)",(C88) [うるう島 (うるう島呼音)] 20年後の、セーラー戦士を下級妖魔の俺が寝とる3 (美少女戦士セーラームーン),"20-nengo no, Sailor Senshi o Kakyuu Youma no Ore ga Netoru 3",japanese,uruujima call,uruujima,doujinshi,sailor moon,"minako aino, sailor venus","futanari, milf, sweating, big breasts, corruption, magical girl, group, glasses, body modification, ahegao, anal, mtf threesome, eyemask, incest, tiara, daughter, dick growth, tentacles, bbm, male on dickgirl",22,2015-10-01 16:07:02,2015-10-01 23:07:02,2025-03-02 03:08:33
145535,[Midori no Rupe] Garden I Ch. 0-5 [English] [MintVoid],[緑のルーペ] ガーデン I 第0-5話 [英訳],Garden I Ch. 0-5,"english, translated",midori no rupe,,manga,,,"mmf threesome, group, glasses, emotionless sex, netorare, story arc, schoolgirl uniform, condom, nakadashi, ryona, anal, lolicon, x-ray, defloration, incest, double penetration, oppai loli, mind break, rape, dilf, impregnation, daughter, collar",147,2015-10-01 16:35:24,2015-10-01 23:35:24,2025-03-02 03:08:34
145538,(CT26) [MIX-ISM (Inui Sekihiko)] Hate Episode -Danua Ryoujoku-hen- (Granblue Fantasy),(こみトレ26) [MIX-ISM (犬威赤彦)] ヘイトエピソード [ダヌア陵辱編] (グランブルーファンタジー),Hate Episodehen-,japanese,inui sekihiko,mix-ism,doujinshi,granblue fantasy,danua,"sweating, mmf threesome, group, snuff, anal, demon girl, double penetration, blowjob, sole female",14,2015-10-01 17:00:54,2015-10-02 00:00:54,2025-03-02 03:08:36
145540,[Uekan] Koi to Jijou to Et Cetera [Digital],[うえかん] 恋と事情とエトセトラ [DL版],Koi to Jijou to Et Cetera,japanese,uekan,,manga,,,"business suit, milf, big breasts, big ass, schoolgirl uniform, stockings, mosaic censorship",86,2015-10-01 18:30:31,2015-10-02 01:30:31,2025-03-02 03:08:38
145541,[Anzaki Moral] Haken Shain wa Onedari Suru [Digital],[杏咲モラル] 派遣社員はおねだりする [DL版],Haken Shain wa Onedari Suru,japanese,anzaki moral,,manga,,,"swimsuit, group, full censorship, glasses, story arc, tankoubon, stockings, school swimsuit",195,2015-10-01 18:38:54,2015-10-02 01:38:54,2025-03-02 03:08:38
145542,[Azuma Taira] Nukumori Jou no Binkan Lesson [Digital],[東タイラ] ぬくもり嬢の敏感レッスン [DL版],Nukumori Jou no Binkan Lesson,japanese,azuma taira,,manga,,,"maid, big breasts, full censorship, glasses, footjob, tankoubon, pantyhose",195,2015-10-01 18:46:52,2015-10-02 01:46:52,2025-03-02 03:08:39
145543,(C78) [Team Kihara (Mojarin)] Mitsurin no Arashi Daisakusen (Monster Hunter),(C78) [チームキハラ (もじゃりん)] 密林の嵐大作戦 (モンスターハンター),Mitsurin no Arashi Daisakusen,japanese,mojarin,team kihara,doujinshi,monster hunter,,"dark skin, lolicon",33,2015-10-01 18:50:31,2015-10-02 01:50:31,2025-03-02 03:08:40
145544,(C85) [Uran no Yakata (Uran)] Seikatsu Shidou Ichigakki,(C85) [雨蘭の館 (雨蘭)] せいかつ指導 一学期,Seikatsu Shidou Ichigakki,japanese,uran,uran no yakata,doujinshi,,,"spanking, schoolgirl uniform, lolicon, multi-work series, mosaic censorship, teacher, school swimsuit",27,2015-10-01 20:57:11,2015-10-02 03:57:11,2025-03-02 03:08:41
145545,(C86) [MASHIRA-DOU (Mashiraga Aki)] Story of the 'N' Situation - Situation#1 Kyouhaku [Chinese] [月之废墟汉化],(C86) [ましら堂 (猿駕アキ)] S.N.S #1脅迫 [中国翻訳],Story of the 'N' Situation - Situation#1 Kyouhaku,"translated, chinese",mashiraga aki,mashira dou,doujinshi,,,netorare,43,2015-10-01 20:58:31,2015-10-02 03:58:31,2025-03-02 03:08:42
145546,(C87) [MASHIRA-DOU (Mashiraga Aki)] Story of the 'N' Situation - Situation#2 Kokoro Utsuri [Chinese] [月之废墟汉化],(C87) [ましら堂 (猿駕アキ)] S.N.S #2こころうつり [中国翻訳],Story of the 'N' Situation - Situation#2 Kokoro Utsuri,"translated, chinese",mashiraga aki,mashira dou,doujinshi,,,"netorare, defloration",40,2015-10-01 20:59:42,2015-10-02 03:59:42,2025-03-02 03:08:43
145547,(C88) [MASHIRA-DOU (Mashiraga Aki)] Story of the 'N' Situation - Situation#3 Mukasino Otoko [Chinese] [月之废墟汉化],(C88) [ましら堂 (猿駕アキ)] S.N.S #3昔の男 [中国翻訳],Story of the 'N' Situation - Situation#3 Mukasino Otoko,"translated, chinese",mashiraga aki,mashira dou,doujinshi,,,"glasses, netorare",41,2015-10-01 21:01:06,2015-10-02 04:01:06,2025-03-02 03:08:43
145548,[Tomohara Michiya] Bishoujo,[友原道哉] 微少女,Bishoujo,japanese,tomohara michiya,,manga,,,"nurse, corset, group, uncensored, story arc, schoolgirl uniform, nakadashi, anal, ffm threesome, bondage, lolicon, exhibitionism, tankoubon, stockings, teacher, dilf, collar",184,2015-10-01 21:24:40,2015-10-02 04:24:40,2025-03-02 03:08:44
145549,[Yamato Akira] Shoujo Gensou,[八的暁] 少女幻想,Shoujo Gensou,japanese,yamato akira,,manga,,,"sweating, glasses, urination, nakadashi, femdom, bondage, lolicon, tankoubon, rape, tomboy, shotacon",150,2015-10-01 21:54:38,2015-10-02 04:54:38,2025-03-02 03:08:45
145550,(C87) [nb. (Poruporu)] Kaikan Transistor (Love Live!),(C87) [nb. (ぽるぽる)] 快感トランジスタ (ラブライブ!),Kaikan Transistor,japanese,,,doujinshi,love live,nico yazawa,"group, schoolgirl uniform, lolicon, drugs",17,2015-10-01 21:56:35,2015-10-02 04:56:35,2025-03-02 03:08:46
145551,(C88) [Horohoro Tei (dear)] Shiri (Kantai Collection -KanColle-),(C88) [ホロホロ亭 (dear)] 尻 (艦隊これくしょん -艦これ-),Shiri,japanese,dear,horohoro tei,doujinshi,kantai collection,taihou,"farting, unusual pupils, enema, anal, sex toys, inflation, stockings, sole female, sole male",21,2015-10-01 21:57:17,2015-10-02 04:57:17,2025-03-02 03:08:47
145552,(C88) [Gasshuukoku Nekometaru (Nekometaru)] Neko-gata Catapult (Kantai Collection -KanColle-),(C88) [合衆国ネタメコル (ねこめたる)] ネコ型カタパルト (艦隊これくしょん -艦これ-),Neko-gata Catapult,japanese,nekometaru,gasshuukoku nekometaru,doujinshi,kantai collection,"tone, teitoku","unusual pupils, anal, sex toys, military, lolicon, stockings, catgirl, tail plug",18,2015-10-01 22:00:51,2015-10-02 05:00:51,2025-03-02 03:08:47
145553,[Cyber Manga Doujou (Suzuki Metal)] オリジナル創作漫画,,オリジナル創作漫画,japanese,suzuki metal,cyber manga doujou,doujinshi,,,"females only, glasses, schoolgirl uniform, yuri",7,2015-10-01 22:01:02,2015-10-02 05:01:02,2025-03-02 03:08:48
145554,[Cyber Manga Doujou (Suzuki Metal)] コミケ88折本,,コミケ88折本,japanese,suzuki metal,cyber manga doujou,doujinshi,,,"anal, sex toys",4,2015-10-01 22:01:10,2015-10-02 05:01:10,2025-03-02 03:08:49
145555,[Kono Toru] 魔女っ娘あずさちゃん (THE IDOLM@STER),,魔女っ娘あずさちゃん,japanese,,,doujinshi,the idolmaster,azusa miura,"magical girl, full color, stockings",4,2015-10-01 22:01:17,2015-10-02 05:01:17,2025-03-02 03:08:50
145556,[Chi Jiazhu] Used Maidroid 001 & 002,,Used Maidroid 001 & 002,japanese,,,doujinshi,,,"maid, blowjob",4,2015-10-01 22:01:24,2015-10-02 05:01:24,2025-03-02 03:08:51
145557,[Chi Jiazhu] 廊下の野良犬,,廊下の野良犬,japanese,,,doujinshi,,,"females only, yuri, fingering",11,2015-10-01 22:01:40,2015-10-02 05:01:40,2025-03-02 03:08:51
145558,[Chi Jiazhu] 裏切り者とグリセリン,,裏切り者とグリセリン,japanese,,,doujinshi,,,"enema, femdom, bondage",12,2015-10-01 22:02:01,2015-10-02 05:02:01,2025-03-02 03:08:52
145559,[Chi Jiazhu] ランプをこすってもいないのに現れる魔神は偽者なのでご注意ください,,ランプをこすってもいないのに現れる魔神は偽者なのでご注意ください,japanese,,,doujinshi,,,"schoolgirl uniform, rape",2,2015-10-01 22:02:06,2015-10-02 05:02:06,2025-03-02 03:08:53
