ID,EN_TITLE,JP_TITLE,CLEAN_TITLE,LANGUAGE,ARTIST,GROUP_NAME,CATEGORY,PARODY,CHARACTER,TAGS,PAGES,UPLOAD_DATE,FORMATTED_DATE,SCRAPED_DATE
146115,"(C87) [corori (Yopparai Oni?, Haruichi)] HONOERIKAN (Love Live!)",(C87) [corori ( 酔っ払い鬼？、はるいち)] ホノエリKAN (ラブライブ!),HONOERIKAN,japanese,yopparai oni,corori,doujinshi,love live,"eri ayase, honoka kousaka","gag, group, schoolgirl uniform, bondage, sleeping, double penetration, chloroform, rape, chikan",50,2015-10-06 21:22:07,2015-10-07 04:22:07,2025-03-02 03:16:00
146116,[Sengoku Joketsu Emaki (Chinbotsu)] POISON (Final Fight) [English] [Digital],[戦国女傑絵巻 (沈没)] POISON (ファイナルファイト) [英訳] [DL版],POISON,"english, translated",chinbotsu,sengoku joketsu emaki,doujinshi,"street fighter, final fight",poison,"futanari, big breasts, big ass, prostitution, ahegao, anal, shemale, hotpants, muscle, big penis, collar, autofellatio, male on dickgirl",21,2015-10-06 22:20:51,2015-10-07 05:20:51,2025-03-02 03:16:01
146118,[Anthology] 2D Comic Magazine Me ga Heart ni Natte Kairaku Ochi suru Heroine-tachi Vol. 1 [Digital],[アンソロジー] 二次元コミックマガジン 目がハートになって快楽堕ちするヒロインたち Vol.1 [DL版],2D Comic Magazine Me ga Heart ni Natte Kairaku Ochi suru Heroine-tachi Vol. 1,japanese,"reiha, kasei, nishida megane",,manga,,,"big breasts, nun, corruption, pregnant, unusual pupils, miko, anthology, demon girl, latex, drugs, mind break, rape, leotard, impregnation, tentacles",63,2015-10-07 00:00:10,2015-10-07 07:00:10,2025-03-02 03:16:03
146119,[Jagausa] Rival wa Nyotaikasasete Haramaseru (2D Dream Magazine 2015-08 Vol. 83) [English] [biribiri],[じゃがうさ] ライバルは女体化させて孕ませる (二次元ドリームマガジン 2015年8月号 vol.83) [英訳],Rival wa Nyotaikasasete Haramaseru,"english, translated",jagausa,,manga,,,"squirting, cervix penetration, nakadashi, ahegao, bondage, lolicon, x-ray, oppai loli, mind break, rape, dilf, impregnation, gender bender, big clit, muscle, big penis, bbm, stomach deformation",20,2015-10-07 00:02:46,2015-10-07 07:02:46,2025-03-02 03:16:03
146120,[Yamatogawa] Vanilla Essence Ch. 1-2 [English] {YQII},[大和川] ヴァニラエッセンス 第1-2話 [英訳],Vanilla Essence Ch. 1-2,"english, translated",yamatogawa,,manga,,,"schoolboy uniform, glasses, schoolgirl uniform, defloration, filming, voyeurism",54,2015-10-07 00:13:13,2015-10-07 07:13:13,2025-03-02 03:16:05
146121,おしゅんぽミルク (Yu-Gi-Oh! ARC-V),[マガタタラ] おしゅんぽミルク (遊☆戯☆王ARC-V),おしゅんぽミルク,japanese,magatatara,,doujinshi,yu-gi-oh arc-v,"yuuto, shun kurosaki","anal, males only, yaoi, tomgirl, shotacon",18,2015-10-07 00:13:45,2015-10-07 07:13:45,2025-03-02 03:16:05
146122,Wakusa S・E・X (Tsuritama),(C84) [チュンチュン丸 (ユキペロリスト)] 惑星S・E・X (つり球),Wakusa S・E・X,japanese,,,doujinshi,tsuritama,"yuki sanada, natsuki usami","glasses, anal, males only, yaoi, blowjob",24,2015-10-07 00:17:27,2015-10-07 07:17:27,2025-03-02 03:16:06
146123,[Hyji] ∞Möbius,[灰司] ∞メビウス,∞Möbius,japanese,hyji,,manga,,,"handjob, bdsm, milf, big breasts, bbw, glasses, story arc, big ass, nakadashi, ahegao, bondage, mother, incest, tankoubon, teacher, blowjob, shibari, deepthroat",176,2015-10-07 00:49:54,2015-10-07 07:49:54,2025-03-02 03:16:07
146124,(SC45) [Kairanban (Bibi)] Benten Kairaku 12 Hebirei 2 (One Piece) [Chinese] [黑条汉化],(サンクリ45) [快乱版 (ビビ)] 弁天快楽12 蛇隷2 (ワンピース) [中国翻訳],Benten Kairaku 12 Hebirei 2,"translated, chinese",bibi,kairanban,doujinshi,one piece,boa hancock,"big breasts, mmf threesome, group",34,2015-10-07 00:53:48,2015-10-07 07:53:48,2025-03-02 03:16:07
146125,[Kimura Neito] Love Juice Fountain | 淫汁愛液飛濺的噴泉 [Chinese],[木村寧都] Love Juice Fountain [中国翻訳],Love Juice Fountain | 淫汁愛液飛濺的噴泉,"translated, chinese",kimura neito,,manga,,,"big breasts, group, schoolgirl uniform, nakadashi, ffm threesome, dark skin, lolicon, incest, tankoubon, gyaru, sister",198,2015-10-07 03:58:05,2015-10-07 10:58:05,2025-03-02 03:16:08
146126,[88scones (Sakaki Tsui)] Ayaki-kun to Houteishiki [English] {Shotachan},,Ayaki-kun to Houteishiki,"english, translated",sakaki tsui,88scones,doujinshi,,,"schoolboy uniform, glasses, anal, males only, yaoi, tomgirl, shotacon",10,2015-10-07 04:02:49,2015-10-07 11:02:49,2025-03-02 03:16:09
146127,(SC2015 Autumn) [Fujiya (Nectar)] Yobare! Cagliostro-chan (Granblue Fantasy),(サンクリ2015 Autumn) [ふじ家 (ねくたー)] 夜這れっ! カリオストロちゃん (グランブルーファンタジー),Yobare! Cagliostro-chan,japanese,nectar,fujiya,doujinshi,granblue fantasy,,"replaced, femdom, lolicon, stockings",14,2015-10-07 04:12:46,2015-10-07 11:12:46,2025-03-02 03:16:09
146128,"(SC2015 Autumn) [Neko to Hato (Hatoya Mameshichi)] GATE of Harem (Gate: Jieitai Kano Chi nite, Kaku Tatakaeri)",(サンクリ2015 Autumn) [ねことはと (鳩矢豆七)] GATE of Harem (ゲート 自衛隊 彼の地にて、斯く戦えり),GATE of Harem,japanese,hatoya mameshichi,neko to hato,doujinshi,gate - jietai kano chi nite kaku tatakaeri,"lelei la rellena, rory mercury, tuka luna marceau, youji itami","elf, group, harem, sleeping, military, footjob, stockings, gothic lolita, rape",26,2015-10-07 04:13:52,2015-10-07 11:13:52,2025-03-02 03:16:10
146129,[Littlewitch (Oyari Ashito)] ART GALLERY 9 NINE パンフレット,,ART GALLERY 9 NINE パンフレット,japanese,oyari ashito,littlewitch,doujinshi,,,"schoolgirl uniform, lolicon, full color, stockings, artbook",72,2015-10-07 04:36:08,2015-10-07 11:36:08,2025-03-02 03:16:11
146130,(C88) [Mieow (Rustle)] Little Girl 11,(C88) [Mieow (らする)] Little Girl 11,Little Girl 11,japanese,rustle,mieow,doujinshi,,,"masturbation, sex toys, solo action, lolicon, full color, stockings, filming, impregnation",31,2015-10-07 04:39:43,2015-10-07 11:39:43,2025-03-02 03:16:11
146131,(C82) [Nonsense (em)] BLUE ECLIPSE (Fate/stay night),(C82) [Nonsense (em)] BLUE ECLIPSE (Fate/stay night),BLUE ECLIPSE,japanese,em,nonsense,doujinshi,fate stay night,"lancer, rin tosaka","nakadashi, stockings, muscle, sole female, sole male",25,2015-10-07 04:40:26,2015-10-07 11:40:26,2025-03-02 03:16:12
146132,[Asaki Takayuki] Shiritsu Lowleg Shougakkou Saishuuwa | Lowleg Private Elementary School Final (Shougono) [English] [CapableScoutMan],[朝木貴行] 私立ローレグ小学校 最終話 (しょうごの) [英訳],Shiritsu Lowleg Shougakkou Saishuuwa | Lowleg Private Elementary School Final,"english, translated",asaki takayuki,,manga,,,"swimsuit, group, glasses, facesitting, harem, bikini, lolicon, footjob, stockings, pantyhose, teacher, bloomers, school swimsuit, randoseru",34,2015-10-07 04:49:17,2015-10-07 11:49:17,2025-03-02 03:16:13
146133,(C85) [Kamishiki (Kamizuki Shiki)] Kirakira Chuchu (Kantai Collection -KanColle-) [Chinese] [脸肿汉化组],(C85) [かみしき (守月史貴)] キラキラちゅっちゅ (艦隊これくしょん -艦これ-) [中国翻訳],Kirakira Chuchu,"translated, chinese",kamizuki shiki,kamishiki,doujinshi,kantai collection,shimakaze,"lolicon, stockings",26,2015-10-07 04:54:29,2015-10-07 11:54:29,2025-03-02 03:16:13
146134,(C88) [Yu-Yu-Tei (Minakami Rinka)] Umaru to Onii-chan (Himouto! Umaru-chan) [Chinese] [脸肿汉化组],(C88) [悠々亭 (水上凛香)] うまるとおにいちゃん (干物妹! うまるちゃん) [中国翻訳],Umaru to Onii-chan,"translated, chinese",minakami rinka,yu-yu-tei,doujinshi,himouto umaru-chan,"taihei doma, umaru doma","glasses, incest, sister",21,2015-10-07 04:55:06,2015-10-07 11:55:06,2025-03-02 03:16:14
146135,(C88) [Akatsuki Katsuie no Circle (Akatsuki Katsuie)] Nyotaika Pandemic 2,(C88) [暁勝家のサークル (暁勝家)] 女体化パンデミック2,Nyotaika Pandemic 2,japanese,akatsuki katsuie,akatsuki katsuie no circle,doujinshi,,,"big breasts, full censorship, nakadashi, dark skin, defloration, rape, dilf, gender bender, stomach deformation",20,2015-10-07 04:58:52,2015-10-07 11:58:52,2025-03-02 03:16:15
146136,(SC58) [Mainichi Sonoba Shinogi (Kuroinu)] Chuunibyou Datta kedo! (Chuunibyou demo Koi ga Shitai!) [English],(サンクリ58) [毎日その場シノギ (黒犬)] 中二病だったけど! (中二病でも恋がしたい!) [英訳],Chuunibyou Datta kedo!,"english, translated",kuroinu,mainichi sonoba shinogi,doujinshi,chuunibyou demo koi ga shitai,shinka nibutani,"dog, bestiality, nakadashi, ahegao, x-ray",20,2015-10-07 05:01:11,2015-10-07 12:01:11,2025-03-02 03:16:16
146137,[Chiba Tetsutarou] Mushi Yuugi Ch. 1 [Digital],[千葉哲太郎] 虫遊戯 第1話 [DL阪],Mushi Yuugi Ch. 1,japanese,chiba tetsutarou,,manga,,,"bestiality, nakadashi, sleeping, x-ray, insect, sole female",24,2015-10-07 05:15:15,2015-10-07 12:15:15,2025-03-02 03:16:17
146138,(C84) [Yourandou (Sugi G)] 09332 - Okusan SanjuuNi (Okusan),(C84) [洋蘭堂 (すぎぢー)] 09332-オクサンサンジュウニ- (おくさん),09332 - Okusan SanjuuNi,japanese,sugi g,yourandou,doujinshi,okusan,kyouko okita,"milf, big breasts, bbw, netorare, cheating, nakadashi, dilf",30,2015-10-07 05:15:58,2015-10-07 12:15:58,2025-03-02 03:16:17
146139,COMIC Ananga Ranga Vol. 4 [Digital],COMIC アナンガ・ランガvol.4 [DL版],COMIC Ananga Ranga Vol. 4,japanese,"reiha, cheewts, ryoh-zoh, anma, tanohito, koutarou, tohgarashi hideyu, aito matoko, haruyukiko, amahara, ooishi chuuni, tsukimoto kizuki",,manga,,,"big breasts, cheating, schoolgirl uniform, anthology, nakadashi, mind control",223,2015-10-07 05:40:19,2015-10-07 12:40:19,2025-03-02 03:16:19
146140,[LALAmate] Koi Tsuzuri | 甜蜜的淫戀 [Chinese],[LALAmate] 恋つづり [中国翻訳],Koi Tsuzuri | 甜蜜的淫戀,"translated, chinese",lalamate,,manga,,,"cousin, incest, tankoubon",186,2015-10-07 06:58:36,2015-10-07 13:58:36,2025-03-02 03:16:19
146141,(C88) [Service Heaven (Hayashi)] Gakkou Flesh | School-Flesh! (Gakkou Gurashi!) [English] {YQII},(C88) [サービスヘブン (ハヤシ)] がっこうフレッシュ (がっこうぐらし!) [英訳],Gakkou Flesh | School-Flesh!,"english, translated",hayashi,service heaven,doujinshi,gakkou gurashi,"kurumi ebisuzawa, yuuri wakasa, miki naoki, yuki takeya","garter belt, schoolgirl uniform, prostitution, harem, lolicon, defloration, stockings, oppai loli",20,2015-10-07 07:04:10,2015-10-07 14:04:10,2025-03-02 03:16:20
146143,[Anthology] 2D Comic Magazine Guillotine Kousoku de Gouin Sex Shokei Vol. 2 [Digital],[アンソロジー] 二次元コミックマガジン ギロチン拘束で強淫セックス処刑! Vol.2 [DL版],2D Comic Magazine Guillotine Kousoku de Gouin Sex Shokei Vol. 2,japanese,"ma-yu, nachisuke, mizuyan",,manga,,,"big breasts, group, public use, anthology, nakadashi, bondage, defloration, bike shorts, double penetration, pillory, bukkake, rape, kunoichi",69,2015-10-07 07:42:47,2015-10-07 14:42:47,2025-03-02 03:16:21
146144,(COMIC1☆9) [dam labo (dam)] Sorede Ii noka? Tenryuu-chan. (Kantai Collection -KanColle-),(COMIC1☆9) [だむlabo (だむ)] それでイイのか?天龍ちゃん。(艦隊これくしょん -艦これ-),Sorede Ii noka? Tenryuu-chan.,japanese,dam,dam labo,doujinshi,kantai collection,tenryuu,"big breasts, cervix penetration, nakadashi, drugs, breast expansion, lactation, stockings, eyepatch, paizuri, mosaic censorship",26,2015-10-07 07:47:45,2015-10-07 14:47:45,2025-03-02 03:16:22
146147,[Atelier:Dew(黒雲鵺)] 性欲飽和のらぶChu☆Chu!,,性欲飽和のらぶChu☆Chu!,japanese,,,doujinshi,steinsgate,"ruka urushibara, suzuha amane, faris nyannyan","pantyjob, group, ffm threesome, crossdressing, x-ray, stockings, tomgirl, shotacon",12,2015-10-07 08:42:56,2015-10-07 15:42:56,2025-03-02 03:16:24
146148,[Senor Daietsu] Gyaku Sekuhara Kyojiri Bukachou no Inshin | Reverse Sexual Harassment: Big Booty Boss and Her Lewd Lips (Kanjuku Monogatari 2012-12 Vol. 8) [English] [CapableScoutMan],[セニョール大悦] 逆セクハラ 巨尻部課長の 淫唇 (完熟ものがたり 2012年12月号 Vol.8) [英訳],Gyaku Sekuhara Kyojiri Bukachou no Inshin | Reverse Sexual Harassment: Big Booty Boss and Her Lewd Lips,"english, translated",senor daietsu,,manga,,,"milf, big breasts, bbw, full censorship, glasses, big ass, femdom, hairy",9,2015-10-07 08:43:12,2015-10-07 15:43:12,2025-03-02 03:16:24
146149,[Asaki Takayuki] Shougono [English],[朝木貴行] しょうごの [英訳],Shougono,"english, translated",asaki takayuki,,manga,,,"swimsuit, cunnilingus, group, glasses, story arc, schoolgirl uniform, facesitting, nakadashi, ahegao, anal, ffm threesome, femdom, harem, bikini, lolicon, footjob, defloration, incest, tankoubon, pantyhose, apron, sister, teacher, bloomers, randoseru, stomach deformation",204,2015-10-07 09:53:29,2015-10-07 16:53:29,2025-03-02 03:16:25
146150,(C87) [Gummy! (Iincho)] Good Boys Gone Bad (Free!) [English] [Carrot-Bunny],(C87) Gummy! (いいんちょ)] Good Boys Gone Bad (Free!) [英訳],Good Boys Gone Bad,"english, translated",iincho,gummy,doujinshi,free,"sousuke yamazaki, rin matsuoka","kissing, anal, males only, yaoi",71,2015-10-07 10:03:55,2015-10-07 17:03:55,2025-03-02 03:16:26
146152,[Mikokuno Homare] Classmate | 同班同學 [Chinese],[みこくのほまれ] クラスめいと [中国翻訳],Classmate | 同班同學,"translated, chinese",mikokuno homare,,manga,,,"full censorship, schoolgirl uniform, tankoubon, tomboy",96,2015-10-07 10:51:32,2015-10-07 17:51:32,2025-03-02 03:16:27
146153,(C70) [Fiance Tank (Matsue)] Kiniro Oppai Jizou (Bleach) [English] [Vixen of Argentum],(C70)  [フィアンセ戦車 (まつえー)] 金色おっぱい地蔵 (ブリーチ) [英訳],Kiniro Oppai Jizou,"english, translated",matsue,fiance tank,doujinshi,bleach,"shuuhei hisagi, nemu kurotsuchi","kimono, full body tattoo, collar",25,2015-10-07 11:20:51,2015-10-07 18:20:51,2025-03-02 03:16:28
146158,[Anthology] Tabete wa Ikenai - Don't Eat It,[アンソロジー] 食べてはいけない,Tabete wa Ikenai - Don't Eat It,japanese,"shiina nami, goya, shinjima saki, horihone saizou, nozarashi satoru, itou, kandanchi, aruza ryuuto",,manga,,,"scat, big breasts, farting, big ass, schoolgirl uniform, urination, anthology, femdom, coprophagia, foot licking, lolicon, yuri, stockings, pantyhose, rimjob, piss drinking, shotacon",163,2015-10-07 14:04:58,2015-10-07 21:04:58,2025-03-02 03:16:31
146159,(C86) [Kureura Seisakujo (Gin Jyuji)] Do-M 3 (Kantai Collection -KanColle-),(C86) [呉満作業所 (銀十字)] ドM3 (艦隊これくしょん -艦これ-),Do-M 3,japanese,gin jyuji,kureura seisakujo,doujinshi,kantai collection,"takao, z3","full censorship, nakadashi, femdom, stockings, shotacon",20,2015-10-07 14:07:04,2015-10-07 21:07:04,2025-03-02 03:16:32
146160,(C84) [Saito-Penguin (Saito Sakae)] Aa Chii-chan-sama! (Hataraku Maou-sama!),(C84) [西東ペンギン (さいとー栄)] ああっ ちーちゃんさま! (はたらく魔王さま!),Aa Chiisama!,japanese,saito sakae,saito-penguin,doujinshi,hataraku maou-sama,"chiho sasaki, sadao maou","big breasts, masturbation, nakadashi, cashier, exhibitionism, sole male",34,2015-10-07 14:27:14,2015-10-07 21:27:14,2025-03-02 03:16:33
146162,[Circle A-san Shobou (Various)] Plizm18+ (Various) [Digital],[サークル Aさん書房 (よろず)] Plizm18+ (よろず) [DL版],Plizm18+,japanese,"kanan maki, nishimura yuki, suzu kerariri",circle a-san shobou,doujinshi,"chobits, s-cry-ed","kanami yuta, chii",,55,2015-10-07 14:43:11,2015-10-07 21:43:11,2025-03-02 03:16:35
146163,(C87) [Mushimusume Aikoukai (ASTROGUY2)] Shibu Radi (THE IDOLM@STER CINDERELLA GIRLS),(C87) [蟲娘愛好会 (ASTROGUY2)] シブラジ (アイドルマスター シンデレラガールズ),Shibu Radi,japanese,astroguy2,mushimusume aikoukai,doujinshi,the idolmaster,rin shibuya,"masturbation, anal, sex toys",26,2015-10-07 14:51:03,2015-10-07 21:51:03,2025-03-02 03:16:35
146164,[Kusatsu Terunyo] Darkwhisper | 陰暗中的低語 [Chinese],[草津てるにょ] ダークウィスパー [中国翻訳],Darkwhisper | 陰暗中的低語,"translated, chinese",kusatsu terunyo,,manga,,,"maid, gag, group, anal, bondage, double penetration, tankoubon, pantyhose, rape",175,2015-10-07 15:21:13,2015-10-07 22:21:13,2025-03-02 03:16:36
146165,(C85) [Toriihime (Kokuu Rikishi)] Lalala! Kantai Enter Dock (Kantai Collection -KanColle-),(C85) [鳥居姫 (虚空力士)] ラララ!艦隊エンタードック (艦隊これくしょん -艦これ-),Lalala! Kantai Enter Dock,japanese,kokuu rikishi,toriihime,doujinshi,kantai collection,"shimakaze, tenryuu, atago, kaga","nakadashi, dark skin, x-ray, full color, stockings",16,2015-10-07 15:21:51,2015-10-07 22:21:51,2025-03-02 03:16:37
146166,[Shinonome Ryu] Ore to Kanojo to Owaru Sekai Ch. 1-15,[東雲龍] オレと彼女と終わる世界 第1-15話,Ore to Kanojo to Owaru Sekai Ch. 1-15,japanese,shinonome ryu,,manga,,,"futanari, elf, oni, big breasts, group, full censorship, glasses, story arc, ffm threesome, scanmark, demon girl, kimono, stockings, gender bender, catgirl",307,2015-10-07 15:42:02,2015-10-07 22:42:02,2025-03-02 03:16:38
146167,[Atsuya Kougyou (Kaisen Chuui)] Sonic Communication (Super Sonico),[篤屋工業 (開栓注意)] そにっくこみゅにけーしょん (すーぱーそに子),Sonic Communication,japanese,kaisen chuui,atsuya kougyou,doujinshi,super sonico,super sonico,"big breasts, nurse, full color, stockings, apron, paizuri, sole female",18,2015-10-07 15:50:43,2015-10-07 22:50:43,2025-03-02 03:16:38
146168,[Louis & Visee] PURE cross LOVE,[Louis & Visee] PURE cross LOVE,PURE cross LOVE,japanese,louis and visee,,manga,,,"big breasts, nun, schoolgirl uniform, anal, sex toys, bondage, kimono, defloration, incest, tankoubon, stockings, sister",200,2015-10-07 16:25:33,2015-10-07 23:25:33,2025-03-02 03:16:39
146169,(C83) [Condiment wa Hachibunme (Maeshima Ryou)] CHEMICAL HAPPY!! 2 (Smile Precure!),(C83) [コンディメントは8分目 (前島龍)] CHEMICAL HAPPY!! 2 (スマイルプリキュア!),CHEMICAL HAPPY!! 2,japanese,maeshima ryou,condiment wa hachibunme,doujinshi,smile precure,"cure happy, cure peace, cure beauty, cure march, cure sunny","magical girl, group, lolicon, multi-work series, drugs, double penetration, mind break, rape",27,2015-10-07 16:28:18,2015-10-07 23:28:18,2025-03-02 03:16:40
146171,[MMT!! (K2isu)] NATALIAN NIGHTS (THE IDOLM@STER CINDERELLA GIRLS) [English] [M@] [Digital],[MMT!! (ケィス)] NATALIAN NIGHTS (アイドルマスターシンデレラガールズ) [英訳] [DL版],NATALIAN NIGHTS,"english, translated",k2isu,mmt,doujinshi,the idolmaster,"producer, natalia","leg lock, big breasts, condom, nakadashi, dark skin, x-ray, defloration, hotpants, blowjob",29,2015-10-07 17:56:02,2015-10-08 00:56:02,2025-03-02 03:16:41
146172,(C67) [RIRIADOLL (Takewakamaru)] Keiyaku I (Kidou Senshi Gundam SEED DESTINY),(C67) [RIRIADOLL (武若丸)] 契約 I (機動戦士ガンダムSEED DESTINY),Keiyaku I,japanese,takewakamaru,ririadoll,doujinshi,gundam seed destiny,"kira yamato, athrun zala","vampire, defloration, gender bender",31,2015-10-07 18:01:19,2015-10-08 01:01:19,2025-03-02 03:16:42
146175,(C84) [Wareme (Koppe)] Chou Kenkou Yuuryou Bishoujo (Photo Kano),(C84) [割れ目 (こっぺ)] 超健康優良美少女 (フォトカノ),Chou Kenkou Yuuryou Bishoujo,japanese,koppe,wareme,doujinshi,photo kano,,"sweating, netorare, rape, blackmail",34,2015-10-07 18:07:40,2015-10-08 01:07:40,2025-03-02 03:16:43
146176,[MINI] Marie no Daibouken 6 (VS Muteki-ou) (Dead or Alive),[MINI] マリーの大冒険6（VS無敵王） (デッドオアアライブ),Marie no Daibouken 6,japanese,,mini,doujinshi,dead or alive,"marie rose, bass armstrong","ryona, masked face, non-h, wrestling, muscle",13,2015-10-07 18:08:09,2015-10-08 01:08:09,2025-03-02 03:16:44
146177,(C81) [Aruku Denpatou no Kai (Kimura Shuuichi)] Yukimura Muramura (Boku wa Tomodachi ga Sukunai),(C81) [歩く電波塔の会 (きむら秀一)] ゆきむらむらむら (僕は友達が少ない),Yukimura Muramura,japanese,kimura shuuichi,aruku denpatou no kai,doujinshi,boku wa tomodachi ga sukunai,"kodaka hasegawa, yukimura kusunoki, rika shiguma","maid, schoolboy uniform, anal, sex toys, table masturbation, defloration, stockings, small breasts, catgirl",30,2015-10-07 18:11:32,2015-10-08 01:11:32,2025-03-02 03:16:45
146178,(C84) [Faker's Manual (Rindoh)] Shingeki no Yaen (Shingeki no Kyojin) [English],(C84) [Faker's Manual (竜瞳)] 進撃の夜宴 (進撃の巨人) [英訳],Shingeki no Yaen,"english, translated",rindoh,fakers manual,doujinshi,shingeki no kyojin,krista lenz,"group, harem, drugs, mind break, rape",12,2015-10-07 18:12:09,2015-10-08 01:12:09,2025-03-02 03:16:45
146179,(SUPERKansai21) [Kagamichaya (Tokio)] Ore no Aruji ga Oujo de Koibito de Hikaeme ni Itte Chou Aishiteru! (Fire Emblem if),(SUPER関西21) [鏡茶屋 (ときお)] 俺の主が王女で恋人で控えめに言って超愛してる! (ファイアーエムブレムif),Ore no Aruji ga Oujo de Koibito de Hikaeme ni Itte Chou Aishiteru!,japanese,tokio,kagamichaya,doujinshi,fire emblem if,"joker, kamui","elf, butler, lingerie, fingering, sole female, sole male",26,2015-10-07 18:12:56,2015-10-08 01:12:56,2025-03-02 03:16:46
146180,(C83) [Kirei na Oneesan (Izumi Yayoi)] Aikagi - Ubawareta Osananajimi (Kanon) [English] [N04H],(C83) [紀霊なお姉さん (和泉弥生)] 哀鍵 奪われた幼馴染 (カノン) [英訳],Aikagi - Ubawareta Osananajimi,"english, translated",izumi yayoi,kirei na oneesan,doujinshi,kanon,nayuki minase,"milf, big breasts, netorare, nakadashi, defloration, drugs, drunk, rape",43,2015-10-07 18:20:09,2015-10-08 01:20:09,2025-03-02 03:16:47
146181,[Tiba-Santi] Dungeon Travelers - Tamaki no Himegoto (ToHeart2 Dungeon Travelers) [Chinese] [翠星石汉化] [Colorized] [Digital],[千葉産地] ダンジョントラベ〇ーズ環の秘め事 (トゥハート2 ダンジョントラベラーズ) [中国翻訳] [カラー化] [DL版],Dungeon Travelers - Tamaki no Himegoto,"translated, chinese",chiba tetsutarou,tiba-santi,doujinshi,toheart2,tamaki kousaka,"big breasts, group, bestiality, anal, thigh high boots, nipple fuck, double penetration, insect",29,2015-10-07 18:35:44,2015-10-08 01:35:44,2025-03-02 03:16:47
146182,(COMIC1☆8) [OTOMEKIBUN (Sansyoku Amido.)] Seishun Nikki 6,(COMIC1☆8) [乙女気分 (三色網戸。)] 性春日記 6,Seishun Nikki 6,japanese,sansyoku amido.,otomekibun,doujinshi,,,"big breasts, big ass, schoolgirl uniform",21,2015-10-07 18:36:19,2015-10-08 01:36:19,2025-03-02 03:16:48
146183,[ERONDON HEARTS (Engawa Suguru)] Beach de Gachi Nanpa! ~P5? Iie 6P desu~ (Super Real Mahjong PV) [Digital],[ERONDON HEARTS (エンガワ卓)] ビーチでガチナンパ! ～P5?いいえ6Pです～ (スーパーリアル麻雀PV) [DL版],Beach de Gachi Nanpa!,japanese,engawa suguru,erondon hearts,doujinshi,super real mahjong,"aya fujiwara, mizuki toono, akira hayasaka","swimsuit, group, dark skin, bikini, defloration, full color, mosaic censorship",32,2015-10-07 18:38:32,2015-10-08 01:38:32,2025-03-02 03:16:49
146184,[Kemoyuru (Akahito)] Kaerusiki Yokkyuuseikatu,[けもゆる (紅壱)] 蛙式欲求性活,Kaerusiki Yokkyuuseikatu,japanese,akahito,kemoyuru,doujinshi,,,"monster girl, vore, long tongue",25,2015-10-07 19:42:48,2015-10-08 02:42:48,2025-03-02 03:16:49
146185,(C85) [Blue Crest (Aono Akira)] Soshite Boku wa Sono Suisen ni Miirareta. (Dragon Ball Z)english biribiri,,Soshite Boku wa Sono Suisen ni Miirareta.english biribiri,"english, translated",aono akira,blue crest,doujinshi,,son gohan,,44,2015-10-07 20:05:24,2015-10-08 03:05:24,2025-03-02 03:16:50
146186,(C85) [Blue Crest (Aono Akira)] Soshite Boku wa Sono Suisen ni Miirareta. (Dragon Ball Z) [English] [biribiri],(C85) [Blue Crest (蒼野アキラ)] そして僕は其の水仙に魅入られた。 (ドラゴンボールZ) [英訳],Soshite Boku wa Sono Suisen ni Miirareta.,"english, translated",aono akira,blue crest,doujinshi,dragon ball z,"trunks briefs, son gohan","stockings, gender bender",45,2015-10-07 20:12:18,2015-10-08 03:12:18,2025-03-02 03:16:50
146187,"[Aoi Nagisa] Uninvited Saori-chan+Liliana-san of My House (r,s,s+,s++,ss)(chinese)",,Uninvited Saorisan of My House,"translated, chinese",aoi nagisa,,manga,,,"maid, big breasts, swimsuit, nakadashi, dark skin, bikini, full color, tanlines, stockings, pantyhose",46,2015-10-07 21:29:58,2015-10-08 04:29:58,2025-03-02 03:16:51
146188,[Nekometaru] Anna Senchou no Mame ga Koyoi no Utage de Bousou Suru you Desu! (COMIC Unreal 2014-02 Vol. 47) [Chinese],[ねこめたる] アンナ船長の魔眼が今宵の宴で暴走するようです！ (コミックアンリアル 2014年2月号 Vol.47) [中国翻訳],Anna Senchou no Mame ga Koyoi no Utage de Bousou Suru you Desu!,"translated, chinese",nekometaru,,manga,,,"big breasts, thigh high boots, full color, pirate, stockings",4,2015-10-07 21:30:08,2015-10-08 04:30:08,2025-03-02 03:16:52
146189,(C84) [S-FLAKE (Yukimitsu)] Ai ga GISSIRI - Love is crowded. (Dragon Ball Z),(C84) [S-FLAKE (ゆきみつ)] 愛がGISSIRI (ドラゴンボールZ),Ai ga GISSIRI - Love is crowded.,japanese,yukimitsu,s-flake,doujinshi,"dragon ball z, dragon ball","son goku, chi chi",,20,2015-10-07 21:40:46,2015-10-08 04:40:46,2025-03-02 03:16:52
146190,(C46) [Oiwaidou (Iwasaki Tatsuya)] No.18 SIDE REMAKES (Dragon Ball Z),(C46) [御祝堂 (岩崎たつや)] No.18 SIDE REMAKES (ドラゴンボールZ),No.18 SIDE REMAKES,japanese,iwasaki tatsuya,oiwaidou,doujinshi,dragon ball z,"android 18, krillin","nakadashi, incest, sister, sole female",35,2015-10-07 21:42:04,2015-10-08 04:42:04,2025-03-02 03:16:53
