ID,EN_TITLE,JP_TITLE,CLEAN_TITLE,LANGUAGE,ARTIST,GROUP_NAME,CATEGORY,PARODY,CHARACTER,TAGS,PAGES,UPLOAD_DATE,FORMATTED_DATE,SCRAPED_DATE
146732,(SC2015 Autumn) [Kyoten Heichou (Iwai Takeshi)] Star Tanjou (THE IDOLM@STER CINDERELLA GIRLS),(サンクリ2015 Autumn) [拠点兵長 (祝たけし)] スタァ誕生 (アイドルマスター シンデレラガールズ),Star Tanjou,japanese,iwai takeshi,kyoten heichou,doujinshi,the idolmaster,mishiro,"birth, milf, big breasts, triple penetration, pregnant, group, milking, huge breasts, anal, sex toys, eyemask, nipple fuck, human pet, double penetration, lactation, stockings, pantyhose, nose hook, dilf, impregnation",18,2015-10-15 04:55:18,2015-10-15 11:55:18,2025-03-02 03:23:20
146733,[Takasugi Kou] *Hard Luck Woman*,[タカスギコウ] ＊HARD LUCK WOMAN＊,*Hard Luck Woman*,japanese,takasugi kou,,manga,,,"milf, big breasts, swimsuit, group, full censorship, sex toys, bikini, double penetration, filming, sole female",50,2015-10-15 04:56:51,2015-10-15 11:56:51,2025-03-02 03:23:20
146734,[Miyahara Ayumu] Kanojo-tachi wa Abakareta Ch. 1-2,[宮原歩] 彼女たちは暴かれた 第1-2話,Kanojo2,japanese,miyahara ayumu,,manga,,,"schoolgirl uniform, replaced, nakadashi, thigh high boots, exhibitionism, blackmail, blowjob",80,2015-10-15 04:59:06,2015-10-15 11:59:06,2025-03-02 03:23:21
146735,[Dynamite moca] Nikubenki Otokonoko to 3P Shichau? (Pakorare Otokonoko!) [Chinese] [銀人個人漢化],[ダイナマイトmoca] 肉便器男の娘と3Pしちゃう？ (パコられ男の娘!) [中国翻訳],Nikubenki Otokonoko to 3P Shichau?,"translated, chinese",dynamite moca,,manga,,,"nurse, anal, crossdressing, full color, males only, yaoi, stockings, tomgirl, shotacon",5,2015-10-15 04:59:44,2015-10-15 11:59:44,2025-03-02 03:23:22
146736,(SC2015 Summer) [CARAMEL CRUNCH! (Rikatan)] Kozukuri Chino-chan (Gochuumon wa Usagi desu ka?) [Chinese] [绅士仓库汉化],(サンクリ2015 Summer) [CARAMEL CRUNCH! (りかたん☆)] こづくりチノちゃん (ご注文はうさぎですか?) [中国翻訳],Kozukuri Chino-chan,"translated, chinese",rikatan,caramel crunch,doujinshi,gochuumon wa usagi desu ka,chino kafuu,"lolicon, full color, mosaic censorship",12,2015-10-15 05:01:16,2015-10-15 12:01:16,2025-03-02 03:23:22
146737,[Shikishiro Konomi] Netoraserare | 虛假的寢取 Ch. 12-14 [Chinese] [無邪気漢化組],[色白好] ネトラセラレ 第12-15章 [中国翻訳],Netoraserare | 虛假的寢取 Ch. 12-14,"translated, chinese",shikishiro konomi,,manga,,,"business suit, milf, big breasts, full censorship, netorare",63,2015-10-15 05:04:07,2015-10-15 12:04:07,2025-03-02 03:23:23
146738,[co] Tatakau Onnanoko ga Sara ni Itametsukerareru Manga 2 [English] [SMDC],[co] 戦う女の子がさらに痛めつけられる漫画 2 [英訳],Tatakau Onnanoko ga Sara ni Itametsukerareru Manga 2,"english, translated",,,doujinshi,,,"schoolboy uniform, group, schoolgirl uniform, ryona, bondage, full color, collar",24,2015-10-15 05:05:03,2015-10-15 12:05:03,2025-03-02 03:23:24
146739,(C83) [Yudokuya (Tomokichi)] Zetsurin Kirito -Suguha to Asuna no Ikimakuri Mugen Zecchou- (Sword Art Online),(C83) [友毒屋 (友吉)] 絶倫キリト ～直葉と明日奈のイキまくり無限絶頂～ (ソードアート・オンライン),Zetsurin Kirito,japanese,tomokichi,yudokuya,doujinshi,sword art online,"asuna yuuki, suguha kirigaya, kazuto kirigaya","big breasts, group, nakadashi, ffm threesome, cousin, incest, stockings, paizuri",22,2015-10-15 05:05:44,2015-10-15 12:05:44,2025-03-02 03:23:24
146740,(C88) [Kitsune (Tachikawa Negoro)] Kaichou ni wa Te o Dasuna!! (Prison School),(C88) [来つ寝 (立川ねごろ)] 会長には手を出すな!! (監獄学園),Kaichou ni wa Te o Dasuna!!,japanese,tachikawa negoro,kitsune,doujinshi,prison school,"meiko shiraki, mari kurihara","big breasts, glasses, sleeping, chloroform, stockings, pantyhose, rape",30,2015-10-15 05:07:02,2015-10-15 12:07:02,2025-03-02 03:23:25
146741,(C88) [Yowatari Kouba (Jet Yowatari)] Boku no Dorei Nikki (Prison School),(C88) [世渡工場 (ジェット世渡り)] ボクのどれい日記 (監獄学園),Boku no Dorei Nikki,japanese,jet yowatari,yowatari kouba,doujinshi,prison school,"meiko shiraki, mari kurihara, kate takenomiya, risa bettou",femdom,7,2015-10-15 05:07:13,2015-10-15 12:07:13,2025-03-02 03:23:25
146742,[Ari] Curely Girl (COMIC Bavel 2015-08) [Chinese] [無邪気漢化組],[あり] きゅありーがーる (COMIC BAVEL 2015年8月号) [中国翻訳],Curely Girl,"translated, chinese",ari,,manga,,,"big breasts, nakadashi, stockings, impregnation",18,2015-10-15 05:07:45,2015-10-15 12:07:45,2025-03-02 03:23:26
146743,[Arubain] Kaasan to Koibito Seikatsu 5.5 [Chinese],[あるばいん] 母さんと恋人生活5.5 [中国翻訳],Kaasan to Koibito Seikatsu 5.5,"translated, chinese",,arubain,doujinshi,,,"milf, pregnant, mother, incest",13,2015-10-15 05:08:25,2015-10-15 12:08:25,2025-03-02 03:23:27
146744,(Houraigekisen! Yo-i! 6Senme!) [Ashima Sandou (Ashima Takumi)] Senkan Nagato Otoko o Shiru (Kantai Collection -KanColle-),(砲雷撃戦!よーい!六戦目!) [芦間山道 (芦間たくみ)] 戦艦長門 男を知る (艦隊これくしょん -艦これ-),Senkan Nagato Otoko o Shiru,japanese,ashima takumi,ashima sandou,doujinshi,kantai collection,nagato,"big breasts, full censorship, nakadashi, collar, mecha girl",22,2015-10-15 05:09:06,2015-10-15 12:09:06,2025-03-02 03:23:27
146745,(Yarou Fes 2013 petit) [Rycanthropy (Mizuki Gai)] Gokudou ga Soap de Awa Hime to Shite Hataraku Koto ni Natta Kekka [Chinese] [叔控学园汉化组],(野郎フェス2013 petit) [RYCANTHROPY (水樹凱)] 極道がソープで泡姫として働く事になった結果 [中国翻訳],Gokudou ga Soap de Awa Hime to Shite Hataraku Koto ni Natta Kekka,"translated, chinese",mizuki gai,rycanthropy,doujinshi,,,"anal, dark skin, full body tattoo, males only, yaoi, mind break, muscle",25,2015-10-15 05:09:57,2015-10-15 12:09:57,2025-03-02 03:23:28
146746,(C86) [SUGIYA (Sugii Tsukasa)] Kotegawa-san ni Shiro Sukumizu o Kisete Harenchi na Koto o suru Hon (To LOVE-Ru) [Chinese] [個人漢化],(C86) [杉屋 (すぎいつかさ)] 古手川さんに白スク水を着せてハレンチなことをする本 (ToLOVEる -とらぶる-) [中国翻訳],Kotegawa-san ni Shiro Sukumizu o Kisete Harenchi na Koto o suru Hon,"translated, chinese",sugii tsukasa,sugiya,doujinshi,to love-ru,"yui kotegawa, rito yuuki","swimsuit, full color, mosaic censorship, school swimsuit",13,2015-10-15 05:10:17,2015-10-15 12:10:17,2025-03-02 03:23:28
146747,(C86) [Ashima Sandou (Ashima Takumi)] Himegoto (Kantai Collection -KanColle-),(C86) [芦間山道 (芦間たくみ)] 秘メゴト (艦隊これくしょん -艦これ-),Himegoto,japanese,ashima takumi,ashima sandou,doujinshi,kantai collection,"nagato, mutsu","big breasts, nakadashi, lolicon, stockings",26,2015-10-15 05:11:17,2015-10-15 12:11:17,2025-03-02 03:23:29
146748,[Tarakan] Migite ga Bishoujo ni Natta kara Sex Shita kedo Doutei dayone!!,[たらかん] 右手が美少女になったからセックスしたけど童貞だよねっ！！,Migite ga Bishoujo ni Natta kara Sex Shita kedo Doutei dayone!!,japanese,tarakan,,manga,,,"futanari, big breasts, unusual pupils, group, story arc, nakadashi, ahegao, ffm threesome, x-ray, defloration, tankoubon, stockings, small breasts, voyeurism, impregnation, blowjob",199,2015-10-15 06:25:18,2015-10-15 13:25:18,2025-03-02 03:23:29
146750,[Pikopiko Saber] School Latte [Digital],[ピコピコサーベル] School Latte [DL版],School Latte,japanese,,pikopiko saber,doujinshi,,,"futanari, big breasts, bbw, group, schoolgirl uniform, stockings, big penis, dickgirl on male, male on dickgirl",18,2015-10-15 06:27:29,2015-10-15 13:27:29,2025-03-02 03:23:31
146751,(SC2015 Summer) [Hacchakesou (PONPON)] Tokumei no Megami-tachi (Dungeon ni Deai o Motomeru no wa Machigatteiru no Darou ka),(サンクリ2015 Summer) [はっちゃけ荘 (PONPON)] 匿名の女神たち (ダンジョンに出会いを求めるのは間違っているだろうか),Tokumei no Megami-tachi,japanese,ponpon,hacchakesou,doujinshi,dungeon ni deai o motomeru no wa machigatteiru darou ka,"hestia, bell cranel","virginity, big breasts, prostitution, nakadashi",22,2015-10-15 06:28:07,2015-10-15 13:28:07,2025-03-02 03:23:31
146752,"[Eroe] Seitenkango, Shinyuu to ~Ateuma Hen~",[エロエ] 性転換後、親友と～当て馬編～,"Seitenkango, Shinyuu to",japanese,,eroe,doujinshi,,,"story arc, mosaic censorship, gender bender, shotacon",204,2015-10-15 07:10:57,2015-10-15 14:10:57,2025-03-02 03:23:32
146753,[Granada Sky (Mogiki Hayami)] Mayonaka no Tokubetsu Lesson | Special Midnight Lesson (Go! Princess Precure) [English] {5 a.m.} [Digital],[グラナダの空 (十はやみ)] 真夜中の特別レッスン (Go! プリンセスプリキュア) [英訳] [DL版],Mayonaka no Tokubetsu Lesson | Special Midnight Lesson,"english, translated",mogiki hayami,granada sky,doujinshi,go princess precure,shut,"elf, unusual teeth, big breasts, corset, monster girl, group, anal, demon girl, shemale, stockings, ttm threesome, swinging, big penis, collar, dickgirl on dickgirl, male on dickgirl",13,2015-10-15 07:11:22,2015-10-15 14:11:22,2025-03-02 03:23:33
146756,COMIC Penguin Club Sanzokuban 2015-09,COMIC ペンギンクラブ山賊版 2015年9月号,COMIC Penguin Club Sanzokuban 2015-09,japanese,"tomono hiro, cuvie, sakai nayuta, sajipen, gomatamago, yumesaki sanjuro, tamagoro, kai hiroyuki, chataro, nishikawa kou, saotome mokono",,manga,,,"milf, big breasts, full censorship, glasses, big ass, schoolgirl uniform, anthology, defloration, incest, pantyhose, sister, dilf, shotacon",244,2015-10-15 09:08:36,2015-10-15 16:08:36,2025-03-02 03:23:35
146757,COMIC Tenma 2015-09,COMIC 天魔 2015年9月号,COMIC Tenma 2015-09,japanese,"koaya aco, tawara hiryuu, yumeiro gurasan, tachibana aruto, jinjin, kihiru, sabashi renya, taishinkokuoh anton, syati kamaboko, niwacho, tomoshibi hidekazu, esuo, sendou hachi, minase seri, oroneko, majoccoid, zaki zaraki, tarazoo",,manga,,,"futanari, milf, garter belt, swimsuit, gag, pegging, double anal, strap-on, group, glasses, big ass, schoolgirl uniform, anthology, ryona, anal, sex toys, ffm threesome, femdom, bondage, bikini, lolicon, big balls, human pet, lactation, stockings, orgasm denial, paizuri, mosaic censorship, cbt, blindfold, shotacon, dickgirl on dickgirl, tail plug",426,2015-10-15 10:12:02,2015-10-15 17:12:02,2025-03-02 03:23:36
146758,COMIC Megastore Alpha 2015-09,コミックメガストアα 2015年9月号,COMIC Megastore Alpha 2015-09,japanese,"clone ningen, dantetsu, koga ryouichi, arakure, nora shinji, monorino, hidari kagetora, menea the dog, aino chie, yonyon, tsuge yasuna, otone, mio, john sitch-oh, leli, eb110ss, rico, yamazaki kazuma, amagiri mio, kagura moromi, yano rahna",,manga,,,"business suit, handjob, milf, big breasts, nun, swimsuit, glasses, masturbation, cheating, schoolgirl uniform, anthology, ahegao, sex toys, sleeping, lolicon, incest, double penetration, tanlines, lactation, stockings, paizuri, mosaic censorship, sister, teacher, dilf, muscle",470,2015-10-15 11:54:15,2015-10-15 18:54:15,2025-03-02 03:23:37
146760,(C86) [Automa Kikyuu (Honjou Masato)] AV tte Naniyo? (Love Live!) [Chinese] [無毒漢化組],(C86) [オートマ気球 (本庄マサト)] AVってなによ？ (ラブライブ!) [中国翻訳],AV tte Naniyo?,"translated, chinese",honjou masato,automa kikyuu,doujinshi,love live,maki nishikino,schoolgirl uniform,24,2015-10-15 12:32:46,2015-10-15 19:32:46,2025-03-02 03:23:38
146761,[LEE] Nyan Nyan Rhapsody (Mini Mimi) [English] [gamefanppg],[LEE] わんにゃんパラダイス♪ (みにみみ) [英訳],Nyan Nyan Rhapsody,"english, translated",lee,,doujinshi,,,"leg lock, lolicon, defloration, stockings, possession, catgirl",17,2015-10-15 13:36:56,2015-10-15 20:36:56,2025-03-02 03:23:39
146762,(C88) [CrashRush (Gesshi)] Manatsu no hakuchuumu (Free!),(C88) [CrashRush (げっし)] 真夏の白昼夢 (Free!),Manatsu no hakuchuumu,japanese,gesshi,crashrush,doujinshi,free,"haruka nanase, makoto tachibana","schoolboy uniform, frottage, ahegao, anal, males only, merman, yaoi, sumata, muscle",29,2015-10-15 13:37:47,2015-10-15 20:37:47,2025-03-02 03:23:40
146763,[Homura Subaru] The Pandemimic (2D Comic Magazine Kairaku Meikyuu Dungeon ni kodama suru Mesu no Kyousei Vol. 3) [Chinese] [無毒漢化組] [Digital],[焔すばる] パンデミミック (二次元コミックマガジン 快楽迷宮 ダンジョンに木霊する牝の嬌声 Vol.3) [中国翻訳] [DL版],The Pandemimic,"translated, chinese",homura subaru,,manga,,,"futanari, corruption, living clothes, vore, latex, masked face, lactation, bodysuit, dick growth, tentacles",21,2015-10-15 13:38:33,2015-10-15 20:38:33,2025-03-02 03:23:40
146764,"[Thirty Saver Street 2D Shooting (Maki Hideto, Sawara Kazumitsu, Yonige-ya No Kyou)] Tail Shock 3 (Ore, Twintail ni Narimasu.) [Digital]",[サーティセイバーストリート (牧秀人、佐原一光、夜逃げ屋の恭)] テイルショック3 (俺、ツインテールになります。) [DL版],Tail Shock 3,japanese,"maki hideto, yonige-ya no kyou, sawara kazumitsu",thirty saver street 2d shooting,doujinshi,ore twintail ni narimasu.,tail red,"schoolgirl uniform, nakadashi, anal, bondage, rape, gender bender, tentacles, shibari",28,2015-10-15 13:39:17,2015-10-15 20:39:17,2025-03-02 03:23:41
146765,(C88) [Purin Kai Yoghurt (Chiri)] CxMxK NOTE VI,(C88) [プリン海ヨーグルト (ちり)] CxMxK NOTE VI,CxMxK NOTE VI,japanese,chiri,purin kai yoghurt,doujinshi,,,"swimsuit, full censorship, full color, catgirl",15,2015-10-15 13:39:44,2015-10-15 20:39:44,2025-03-02 03:23:41
146766,[Z-Ton] Bakumatsu Oyakodon Bleed Bangaihen (Konna Karada de Ii no Nara Toranoana Shousasshi) [Chinese] [黑街016],[Zトン] 幕末親子丼ブリード 番外編 (こんな軆でいいのなら とらのあな小冊子) [中国翻訳],Bakumatsu Oyakodon Bleed Bangaihen,"translated, chinese",z-ton,,manga,,,"monster girl, group, ffm threesome, mother, centaur, incest, sister, muscle",5,2015-10-15 13:39:55,2015-10-15 20:39:55,2025-03-02 03:23:42
146767,[Harukaze Do-jin] Aoi-chan Attack! Ch.2 [English] [biribiri],[春風道人] あおいちゃんアタック! 第2話 [英訳],Aoi-chan Attack! Ch.2,"english, translated",harukaze do-jin,,manga,,,"glasses, apron, teacher",24,2015-10-15 13:40:37,2015-10-15 20:40:37,2025-03-02 03:23:42
146768,[Takasugi Kou] Ingi no Hate 1 Ch. 1-6 [English] [desudesu],[タカスギコウ] 淫戯の果て 1 第1-6話 [英訳],Ingi no Hate 1 Ch. 1-6,"english, translated",takasugi kou,,manga,,,"milf, sweating, big breasts, full censorship, story arc, cheating",81,2015-10-15 13:43:18,2015-10-15 20:43:18,2025-03-02 03:23:43
146769,(SC54) [Shangrila (Kodou)] Sayaka to Issho | Together With Sayaka (Puella Magi Madoka Magica) [English],(サンクリ54) [シャングリラ (コドウ)] さやかと一緒 (魔法少女まどか☆マギカ) [英訳],Sayaka to Issho | Together With Sayaka,"english, translated",kodou,shangrila,doujinshi,puella magi madoka magica,"sayaka miki, kyouko sakura","females only, schoolgirl uniform, femdom, yuri, fingering, bloomers",22,2015-10-15 13:43:56,2015-10-15 20:43:56,2025-03-02 03:23:44
146770,(CT21) [Honey Butter3g (Mizukaga Syou) Nyaa Nyaa Holic (Puella Magi Madoka Magica) [English],(こみトレ21) 	[はちみつバター3g (水利硝)] にゃんにゃんHolic (魔法少女まどか☆マギカ) [英訳],(CT21) [Honey Butter3g (Mizukaga Syou) Nyaa Nyaa Holic (Puella Magi Madoka Magica) [English],"english, translated",mizukaga syou,honey butter3g,doujinshi,puella magi madoka magica,"sayaka miki, kyouko sakura","females only, schoolgirl uniform, tailjob, femdom, yuri, stockings, hotpants, catgirl",18,2015-10-15 13:44:26,2015-10-15 20:44:26,2025-03-02 03:23:45
146771,(C87) [Studio30NEKO (Fukunotsukuribe)] -F-TRANceFORM9,(C87)  [Studio30NEKO (ふくのつくりべ)] -F-TRANceFORM9,TRANceFORM9,japanese,fukunotsukuribe,studio30neko,doujinshi,,,"group, glasses, prostitution, nakadashi, anal, crossdressing, males only, yaoi, pantyhose, tomgirl, blowjob",28,2015-10-15 13:45:13,2015-10-15 20:45:13,2025-03-02 03:23:46
146772,(C88) [Mousouzoku no Soukutsu (Akasode)] Dan Bitch no Kai (Touhou Project),(C88) [妄想族の巣窟 (赤袖)] 壇ビッチの快 (東方Project),Dan Bitch no Kai,japanese,"akasode, taku",mousouzoku no soukutsu,doujinshi,touhou project,yuuka kazami,"big breasts, garter belt, bbw, vore, stockings, tentacles",26,2015-10-15 13:46:04,2015-10-15 20:46:04,2025-03-02 03:23:46
146774,[Granada Sky (Mogiki Hayami)] Amaeru Otouto ni Amai Ane | Spoiled Little Brother & Sweet Sister [English] [SaHa] [Digital],[グラナダの空 (十はやみ)] 甘える弟に甘い姉 [英訳] [DL版],Amaeru Otouto ni Amai Ane | Spoiled Little Brother & Sweet Sister,"english, translated",mogiki hayami,granada sky,doujinshi,,,"milf, big breasts, prostate massage, anal, shemale, incest, sister, shotacon, sole male, male on dickgirl, sole dickgirl",17,2015-10-15 13:50:03,2015-10-15 20:50:03,2025-03-02 03:23:48
146775,(C88) [Behind Moon (Q)] DR:II Ep. 5 ~Yukari no Naka no Aoi~ [English] [SaHa] [Decensored],(C88) [Behind Moon (Q)] DR:II Ep.5 ～ユカリの中のアオイ～ [英訳] [無修正],DR:II Ep. 5,"english, translated",q,behind moon,doujinshi,,,"futanari, transformation, uncensored, schoolgirl uniform, nakadashi, ahegao, sex toys, femdom, bondage, crossdressing, bikini, breast expansion, stockings, parasite, tomgirl, gender bender, big penis, feminization, male on dickgirl",32,2015-10-15 13:51:06,2015-10-15 20:51:06,2025-03-02 03:23:48
146776,[Kouzukitei (Kouzuki Rio)] Mama wa Saimin Chuudoku! 5 [Digital],[香月亭 (香月りお)] ママは催眠中毒! 5 [DL版],Mama wa Saimin Chuudoku! 5,japanese,kouzuki rio,kouzukitei,doujinshi,,,"milf, big breasts, netorare, nakadashi, sex toys, mind control, multi-work series, mosaic censorship",10,2015-10-15 13:51:24,2015-10-15 20:51:24,2025-03-02 03:23:49
146777,[Kouzukitei (Kouzuki Rio)] Mama wa Saimin Chuudoku! 6 [Digital],[香月亭 (香月りお)] ママは催眠中毒! 6 [DL版],Mama wa Saimin Chuudoku! 6,japanese,kouzuki rio,kouzukitei,doujinshi,,,"milf, big breasts, old man, netorare, nakadashi, mind control, mosaic censorship",10,2015-10-15 13:51:40,2015-10-15 20:51:40,2025-03-02 03:23:50
146778,[Misao.] Manzoku sasete? | Are you satisfied? ch1+2 (Hajimete Janai yo?) [English] [Rin],[みさお。]  満足させて？  (はじめてじゃないよ？) [英訳],Manzoku sasete? | Are you satisfied? ch1+2,"english, translated",misao.,,manga,,,"glasses, schoolgirl uniform, replaced, prostitution, condom, lolicon, stockings, dilf",37,2015-10-15 14:01:02,2015-10-15 21:01:02,2025-03-02 03:23:51
146779,(C88) [Popin'Rabbit (Esora Koto)] Yurori Kyouiku San,(C88) [ポッピンラビット (絵空コト)] ゆろりきょういくっ参,Yurori Kyouiku San,japanese,esora koto,popin rabbit,doujinshi,,,"nakadashi, lolicon, exhibitionism, tanlines, fairy",34,2015-10-15 14:04:19,2015-10-15 21:04:19,2025-03-02 03:23:51
146780,(C86) [brilliant thunder (Yumeno Tanuki)] Ota Demonai Joshi ga Comiket 4-kkame ni Asobi ni Yattekita in Melon,(C86) [brilliant thunder (夢乃狸)] オタでもない女子がコミケ4日目にアソビにヤって来たinメロン,Ota Demonai Joshi ga Comiket 4-kkame ni Asobi ni Yattekita in Melon,japanese,yumeno tanuki,brilliant thunder,doujinshi,,,"big breasts, group, glasses, nakadashi, tomboy, big penis, bbm",26,2015-10-15 14:05:18,2015-10-15 21:05:18,2025-03-02 03:23:52
146781,[Bubuzuke] Kounai Enkou (Comic Koh Vol. 4) [Chinese] [黑条汉化],[ぶぶづけ] 校内援肛 (COMIC 高 Vol.4) [中国翻訳],Kounai Enkou,"translated, chinese",bubuzuke,,manga,,,"big ass, cheating, schoolgirl uniform, prostitution, condom, nakadashi, anal, sex toys, vaginal sticker, stockings, mosaic censorship, dilf, blowjob, bbm",20,2015-10-15 14:06:13,2015-10-15 21:06:13,2025-03-02 03:23:53
146782,[Junko] Konbini-kun | Conveni-kun Ch. 1-5 [English] [Tomotomo],[純子] コンビニくん 第1-5話 [英訳],Konbinikun Ch. 1-5,"english, translated",,,manga,,,"kissing, story arc, males only, yaoi",136,2015-10-15 14:11:35,2015-10-15 21:11:35,2025-03-02 03:23:53
146783,(DC RETURNS 7) [Beni (Inoue Kiyoshi)] Toshoshitsu no Kajin-kun (Kuroko no Basuke) [English] [Tigoris Translates],(DC RETURNS 7) [紅-beni- (井上清)] 図書室の火神君 (黒子のバスケ) [英訳],Toshoshitsu no Kajin-kun,"english, translated",inoue kiyoshi,beni,doujinshi,kuroko no basuke,"tetsuya kuroko, taiga kagami","schoolboy uniform, schoolgirl uniform, gender bender",31,2015-10-15 14:12:44,2015-10-15 21:12:44,2025-03-02 03:23:54
146784,(C87) [Mieow (Rustle)] Little Girl 10 [English] [N04h],(C87) [Mieow (らする)] Little Girl 10 [英訳],Little Girl 10,"english, translated",rustle,mieow,doujinshi,,,"bondage, lolicon, full color, incest, bukkake, rape, shotacon",31,2015-10-15 15:19:28,2015-10-15 22:19:28,2025-03-02 03:23:55
146785,(Reitaisai 9) [Itou Life] Itou Life Rakugaki Bon 2 | Itou Life Rakugaki Book 2 (Touhou Project) [English] [142],(例大祭9) [伊東ライフ] 伊東ライフ らくがき本② (東方Project) [英訳],Itou Life Rakugaki Bon 2 | Itou Life Rakugaki Book 2,"english, translated",itou life,itou life,doujinshi,touhou project,wriggle nightbug,"glasses, schoolgirl uniform, insect girl",15,2015-10-15 15:20:01,2015-10-15 22:20:01,2025-03-02 03:23:56
146786,"(SC2015 Autumn) [Kaze no Gotoku! (Fubuki Poni, Fujutsushi)] Obsession (THE IDOLM@STER CINDERELLA GIRLS)","(サンクリ2015 Autumn) [風のごとく! (風吹ぽに, 風術師)] Obsession (アイドルマスター シンデレラガールズ)",Obsession,japanese,"fujutsushi, fubuki poni",kaze no gotoku,doujinshi,the idolmaster,kaede takagaki,"prostitution, drugs",26,2015-10-15 15:20:50,2015-10-15 22:20:50,2025-03-02 03:23:57
146787,(SC2015 Autumn) [88 Gou (Ooishi Chuuni)] Banana wa Oyatsu ni Hairimasen (Gakkou Gurashi!),(サンクリ2015 Autumn) [88号 (大石中二)] バナナはおやつに入りません (がっこうぐらし!),Banana wa Oyatsu ni Hairimasen,japanese,ooishi chuuni,88 gou,doujinshi,gakkou gurashi,yuki takeya,"mmf threesome, group, schoolgirl uniform, nakadashi, anal, double penetration, rimjob",18,2015-10-15 15:21:18,2015-10-15 22:21:18,2025-03-02 03:23:58
146788,(C86) [Royal Bitch (haruhisky)] Cheer Haru (The Melancholy of Haruhi Suzumiya),(C86) [ろいやるびっち (haruhisky)] ちあハル (涼宮ハルヒの憂鬱),Cheer Haru,japanese,haruhisky,royal bitch,doujinshi,the melancholy of haruhi suzumiya,"haruhi suzumiya, kyon","big breasts, schoolboy uniform, nakadashi, cheerleader, sole female",22,2015-10-15 15:22:40,2015-10-15 22:22:40,2025-03-02 03:23:59
146789,(C78) [Noritama-gozen (Noritama)] Bunny Blue (The Melancholy of Haruhi Suzumiya),(C78) [のりたま御膳 (のりたま)] Bunny Blue (涼宮ハルヒの憂鬱),Bunny Blue,japanese,noritama,noritama-gozen,doujinshi,the melancholy of haruhi suzumiya,"yuki nagato, ryoko asakura, kyon","big breasts, schoolboy uniform, group, nakadashi, ffm threesome, bunny girl, pantyhose",26,2015-10-15 15:23:34,2015-10-15 22:23:34,2025-03-02 03:24:00
146790,[Saotome Mokono] Gyakuten ♥ Shujuu Lovers,[早乙女もこ乃] 逆転♥主従Lovers,Gyakuten ♥ Shujuu Lovers,japanese,saotome mokono,,manga,,,"big breasts, garter belt, story arc, schoolgirl uniform, replaced, nakadashi, stockings, pantyhose",156,2015-10-15 15:45:25,2015-10-15 22:45:25,2025-03-02 03:24:00
146791,"[Freehand Tamashii] Oba-san Taku de Asedaku de, Hitasura Sex ni Hagemu! [Chinese] [某三人汉化组]",[フリーハンド魂] 伯母さん宅で汗だくで、ひたすらセックスに励む! [中国翻訳],"Oba-san Taku de Asedaku de, Hitasura Sex ni Hagemu!","translated, chinese",freehand tamashii,,doujinshi,,,"milf, glasses, cheating, full color, incest, aunt, mosaic censorship",33,2015-10-15 15:46:27,2015-10-15 22:46:27,2025-03-02 03:24:01
146793,[Gin] Acne reward (Girls forM Vol. 07) [Chinese] [LJY个人汉化],[ぎん] Acne reward (ガールズフォーム Vol.07) [中国翻訳],Acne reward,"translated, chinese",gin,,manga,,,"maid, pegging, strap-on, group, anal, ffm threesome, femdom, footjob, mosaic censorship, cbt",18,2015-10-15 15:48:11,2015-10-15 22:48:11,2025-03-02 03:24:02
146794,[Itaba Hiroshi] Hitachinaka-ke no Tsuma Ch. 1-3,[板場広し] 日立内家の妻 第1-3話,Hitachinaka3,japanese,itaba hiroshi,,manga,,,"inseki, milf, big breasts, old man, group, netorare, story arc, syringe, sex toys, ffm threesome, bondage, kimono, drugs, rape, dilf, impregnation, shibari",60,2015-10-15 15:50:07,2015-10-15 22:50:07,2025-03-02 03:24:03
146795,(C88) [BlueMage (Aoi Manabu)] Dagashi Chichi 3 (Dagashi Kashi) [English],(C88) [BlueMage (あおいまなぶ)] だがしちち3 (だがしかし)  [英訳],Dagashi Chichi 3,"english, translated",aoi manabu,bluemage,doujinshi,dagashi kashi,"hotaru shidare, saya endou, kokonotsu shikada","condom, femdom, x-ray, defloration, small breasts, smell, impregnation",20,2015-10-15 15:52:37,2015-10-15 22:52:37,2025-03-02 03:24:04
146796,COMIC Tenma 2015-09,COMIC 天魔 2015年9月号,COMIC Tenma 2015-09,japanese,"koaya aco, tawara hiryuu, yumeiro gurasan, tachibana aruto, jinjin, kihiru, sabashi renya, taishinkokuoh anton, syati kamaboko, niwacho, tomoshibi hidekazu, esuo, sendou hachi, minase seri, oroneko, majoccoid, zaki zaraki, tarazoo",,manga,,,"futanari, milf, big breasts, garter belt, swimsuit, gag, pegging, strap-on, bbw, group, glasses, schoolgirl uniform, anthology, nakadashi, ryona, anal, sex toys, ffm threesome, femdom, bondage, kimono, bikini, lolicon, big balls, lactation, stockings, orgasm denial, oppai loli, mosaic censorship, cbt, teacher, inverted nipples, blindfold, shotacon, dickgirl on dickgirl, tail plug",424,2015-10-15 17:24:13,2015-10-16 00:24:13,2025-03-02 03:24:04
