ID,EN_TITLE,JP_TITLE,CLEAN_TITLE,LANGUAGE,ARTIST,GROUP_NAME,CATEGORY,PARODY,CHARACTER,TAGS,PAGES,UPLOAD_DATE,FORMATTED_DATE,SCRAPED_DATE
159275,(C86) [Nyuu Koubou (Nyuu)] Oidemase!! Jiyuu Fuuzoku Gensoukyou Nihaku Mikka no Tabi - Yayoi (Touhou Project) [Chinese] [后悔的神官个人汉化],(C86) [にゅう工房 (にゅう)] おいでませ!!自由風俗幻想郷2泊3日の旅 弥生 (東方Project) [中国翻訳],Oidemase!! Jiyuu Fuuzoku Gensoukyou Nihaku Mikka no Tabi - Yayoi,"translated, chinese",nyuu,nyuu koubou,doujinshi,touhou project,"ichirin kumoi, nazrin, byakuren hijiri, fujiwara no mokou","group, ahegao, ryona, asphyxiation, mouse girl, mind control, blood, rape, body writing, bbm, piss drinking",37,2016-03-24 23:55:54,2016-03-25 06:55:54,2025-03-02 06:37:09
159276,(C89) [Kuma no Tooru Michi (Kumada)] One Night Jinrou (Touhou Project) [Chinese] [沒有漢化],(C89) [くまのとおるみち (くまだ)] わんナイト人狼 (東方Project) [中国翻訳],One Night Jinrou,"translated, chinese",kumada,kuma no tooru michi,doujinshi,touhou project,kagerou imaizumi,"full censorship, dog, bestiality, wolf girl, hairy, sole female",22,2016-03-24 23:59:41,2016-03-25 06:59:41,2025-03-02 06:37:10
159277,[しらそ] クリトリス·ハザード (二次元コミックマガジン デカクリ美少女クリイキ地獄 Vol.1) [Chinese] [沒有漢化] [Digital],[しらそ] クリトリス·ハザード (二次元コミックマガジン デカクリ美少女クリイキ地獄 Vol.1) [中国翻訳] [DL版],クリトリス·ハザード,"translated, chinese",shiraso,,manga,,,"replaced, x-ray, masked face, mind break, big clit",16,2016-03-25 00:00:12,2016-03-25 07:00:12,2025-03-02 06:37:10
159278,[る～く] くノ一ツバキ デカクリ改造の罠 (二次元コミックマガジン デカクリ美少女クリイキ地獄 Vol.1) [Chinese] [沒有漢化] [Digital],[る～く] くノ一ツバキ デカクリ改造の罠 (二次元コミックマガジン デカクリ美少女クリイキ地獄 Vol.1) [中国翻訳] [DL版],くノ一ツバキ デカクリ改造の罠,"translated, chinese",ruku,,manga,,,"piercing, replaced, sex toys, dark skin, mind break, big clit, kunoichi, tentacles",21,2016-03-25 00:04:42,2016-03-25 07:04:42,2025-03-02 06:37:11
159279,(SC2016 Winter) [APRICOTTEA (Minami)] Sukisuki Onii-chan (Himouto! Umaru-chan),(サンクリ2016 Winter) [APRICOTTEA (みなみ)] すきすきおにいちゃん (干物妹!うまるちゃん),Sukisuki Onii-chan,japanese,minami,apricottea,doujinshi,himouto umaru-chan,umaru doma,"garter belt, unusual pupils, group, nakadashi, lolicon, incest, stockings, sister, blowjob",24,2016-03-25 00:08:17,2016-03-25 07:08:17,2025-03-02 06:37:11
159280,[石野鐘音] ピンチ! 魔法少女マロン・拷問クリトリス～はじける超充血膨張陰核～ (二次元コミックマガジン デカクリ美少女クリイキ地獄 Vol.1) [Chinese] [沒有漢化] [Digital],[石野鐘音] ピンチ! 魔法少女マロン・拷問クリトリス～はじける超充血膨張陰核～ (二次元コミックマガジン デカクリ美少女クリイキ地獄 Vol.1) [中国翻訳] [DL版],ピンチ! 魔法少女マロン・拷問クリトリス～はじける超充血膨張陰核～,"translated, chinese",ishino kanon,,manga,,,"magical girl, replaced, hairy, big clit, tentacles",23,2016-03-25 00:09:08,2016-03-25 07:09:08,2025-03-02 06:37:12
159281,(FF27) [Kinokino (Try)] Goddess Imprisonment (Puzzle & Dragons) [Chinese],(FF27) [黑糯米飯糰 (TRY方言)] 女神禁錮 (パズル&ドラゴンズ) [中国語],Goddess Imprisonment,chinese,try,,doujinshi,puzzle and dragons,,"oni, big breasts, group, glasses, goblin, double vaginal, nakadashi, ahegao, anal, thigh high boots, x-ray, double penetration, stockings, bukkake, mind break, rape, blowjob, muscle, stomach deformation, deepthroat",28,2016-03-25 00:10:04,2016-03-25 07:10:04,2025-03-02 06:37:13
159282,(C89) [Aspergillus (Okara)] DREAM KNOCKER (Toaru Kagaku no Railgun) [Chinese]  [CE×幻之],(C89) [Aspergillus (おから)] DREAM KNOCKER (とある科学の超電磁砲) [中国翻訳],DREAM KNOCKER,"translated, chinese",okara,aspergillus,doujinshi,toaru kagaku no railgun,"touma kamijou, mikoto misaka","schoolgirl uniform, small breasts, sole female, sole male",28,2016-03-25 00:16:38,2016-03-25 07:16:38,2025-03-02 06:37:13
159284,(SC2016 Winter) [Kaname (Siina Yuuki)] Yama no Jiken (Yama no Susume)  [Chinese] [CE家族社],(サンクリ2016 Winter) [要 (椎名悠輝)] ヤマノジケン (ヤマノススメ) [中国翻訳],Yama no Jiken,"translated, chinese",siina yuuki,kaname,doujinshi,yama no susume,kokona aoba,"birth, triple penetration, pregnant, group, enema, urination, bondage, lolicon, x-ray, double penetration, drunk, rape, impregnation",47,2016-03-25 00:25:28,2016-03-25 07:25:28,2025-03-02 06:37:14
159285,(C89) [O-Mars (Mars)] Himitsu no Yobanashi Ni (Touken Ranbu) [English] [Shotachan],(C89) [O-Mars (マルス)] ひみつの夜話弐 (刀剣乱舞) [英訳],Himitsu no Yobanashi Ni,"english, translated",mars,o-mars,doujinshi,touken ranbu,"aizen kunitoshi, hotarumaru","kissing, fundoshi, group, frottage, anal, males only, yaoi, tomgirl, blowjob, shotacon, josou seme",23,2016-03-25 00:29:23,2016-03-25 07:29:23,2025-03-02 06:37:15
159286,[Xration (mil)] Onigashima no Ansoku (Ragnarok Online) [English] =TLL+SH= [Digital],[Xration (mil)] 鬼ヶ島の安息 (ラグナロクオンライン) [英訳] [DL版],Onigashima no Ansoku,"english, translated",mil,xration,doujinshi,ragnarok online,,"handjob, milf, big breasts, femdom, kimono, multi-work series, shotacon",18,2016-03-25 00:32:14,2016-03-25 07:32:14,2025-03-02 06:37:16
159287,(Aka no Hiroba 3) [Nantoka Ikitemasu. (Megumiya)] Sakuya to Alice de Futanari! Dakedo Honban Nashi! ...Sonna Aho na Naiyou desu. (Touhou Project) [English] [B.E.C. Scans],(紅のひろば3) [なんとか生きてます。 (恵屋)] 咲夜とアリスでふたなり！だけど本番無し！…そんなアホな内容です。 (東方Project) [英訳],Sakuya to Alice de Futanari! Dakedo Honban Nashi! ...Sonna Aho na Naiyou desu.,"english, translated",megumiya,nantoka ikitemasu,doujinshi,touhou project,"alice margatroid, sakuya izayoi",futanari,19,2016-03-25 00:33:09,2016-03-25 07:33:09,2025-03-02 06:37:16
159288,[Zucchini] Fudousan Monogatari -Iwakutsuki Bukken Hen- | Real Estate Story -Property with a Past Chapter- (COMIC Mugen Tensei 2015-12) [English] [N04h],[ズッキーニ] ふどうさん物語 ～いわくつき物件編～ (COMIC 夢幻転生 2015年12月号) [英訳],Fudousan Monogatari| Real Estate Story,"english, translated",zucchini,,manga,,,"maid, big breasts, garter belt, full censorship, cervix penetration, nakadashi, x-ray, huge penis, stockings, paizuri, lingerie, blowjob, big penis, slave",31,2016-03-25 00:34:09,2016-03-25 07:34:09,2025-03-02 06:37:17
159289,[Asano Shimon] Sister Blend (Nyotaika! Paradise 05) [English] [Decensored],[アサノシモン] シスターブレンド (にょたいか！パラダイス 05) [英訳] [無修正],Sister Blend,"english, translated",asano shimon,,manga,,,"sweating, big breasts, uncensored, defloration, incest, stockings, sister, gender bender",12,2016-03-25 00:34:32,2016-03-25 07:34:32,2025-03-02 06:37:19
159290,[Coelacanth] Mister Mistake (COMIC HOTMiLK 2016-03) [English] [Team Koinaka] [Digital],[しーらかんす] ミスターミステイク (コミックホットミルク 2016年3月号) [英訳] [DL版],Mister Mistake,"english, translated",coelacanth,,manga,,,"virginity, full censorship, nakadashi, femdom, stockings, sole female, sole male",23,2016-03-25 00:35:16,2016-03-25 07:35:16,2025-03-02 06:37:19
159291,[Hong BanJang] Aharoo Ch.1-6 (English) (YoManga) (Ongoing),,Aharoo Ch.1-6,"english, translated",hong banjang,,doujinshi,,,"full censorship, snuff, scanmark, full color, blood, slave",112,2016-03-25 00:38:31,2016-03-25 07:38:31,2025-03-02 06:37:20
159292,[Momonosuke] Tsuki to Odoriko | The Moon and the Dancer (Young Comic 2013-03) [English] [freudia],[桃之助] 月と踊り子 (ヤングコミック 2013年3月号) [英訳],Tsuki to Odoriko | The Moon and the Dancer,"english, translated",momonosuke,,manga,,,"big breasts, full censorship, nakadashi, dark skin, defloration, sole female, sole male",18,2016-03-25 00:39:09,2016-03-25 07:39:09,2025-03-02 06:37:20
159293,[Pija] Futari no Hi - Day only for two (COMIC BAVEL 2016-03) [English] [XCX Scans] [Digital],[ピジャ] ふたりの日 (COMIC BAVEL 2016年3月号) [英訳] [DL版],Futari no Hi - Day only for two,"english, translated",pija,,manga,,,"sweating, big breasts, condom, nakadashi, ahegao, incest, stockings, sister, sole female, sole male",23,2016-03-25 00:39:51,2016-03-25 07:39:51,2025-03-02 06:37:21
159294,[Kuzuyarou] Hina-chan to Toilet de [Digital],[屑夜郎] ひなちゃんとトイレで [DL版],Hina-chan to Toilet de,japanese,kuzuyarou,,doujinshi,,,"nakadashi, lolicon, defloration, rape, dilf, bbm",9,2016-03-25 00:42:28,2016-03-25 07:42:28,2025-03-02 06:37:22
159295,[Polorinken (Polorinken)] Menu: 44 Brand New Season (reprise) (Sentimental Graffiti),[ポロリン軒 (ポロリン賢)] MENU:44 Brand New Season (reprise) (センチメンタルグラフティ),Menu: 44 Brand New Season,japanese,polorinken,polorinken,doujinshi,sentimental graffiti,manami sugihara,"nun, full color, pantyhose",12,2016-03-25 00:42:54,2016-03-25 07:42:54,2025-03-02 06:37:22
159296,(C81) [r.i.s factory (Ruschuto)] Teacher's Pet (K-ON!) [Chinese] [最愛路易絲澪漢化組],(C81) [r.i.s factory (るしゅーと)] Teacher's Pet (けいおん!) [中国翻訳],Teacher's Pet,"translated, chinese",ruschuto,r.i.s factory,doujinshi,k-on,"sawako yamanaka, mio akiyama","big breasts, garter belt, group, glasses, shimapan, ffm threesome, stockings, teacher",35,2016-03-25 00:43:49,2016-03-25 07:43:49,2025-03-02 06:37:23
159297,[Makutsutei (Tenro Aya)] Sandworm no Seitai (Otome-tachi wa Marunomi nashi de wa mou Ikite Ikenai!) [Chinese] [虽然插着触手但依然欲求不满的喵酱汉化组] [Digital],[魔窟亭 (天路あや)] サンドウォームの生態 (乙女達は丸呑みなしではもういきていけない!) [中国翻訳] [DL版],Sandworm no Seitai,"translated, chinese",tenro aya,makutsutei,manga,,,"birth, pregnant, vore, dark skin, mosaic censorship, tentacles",8,2016-03-25 00:44:08,2016-03-25 07:44:08,2025-03-02 06:37:23
159298,"[Tankguy, ROZER] A World That I Rule Ch.01-14 [English] (Game of Scanlation) (Ongoing)","[탱크가이, ROZER] 내가 지배하는 세상",A World That I Rule Ch.01-14,"english, translated",rozer,,manga,,,"elf, full censorship, full color",273,2016-03-25 03:26:58,2016-03-25 10:26:58,2025-03-02 06:37:24
159299,[Mizuchirimen] Ama Ero Otokonoko [English] {Shotachan},[ミズチリメン] 甘エロ男の娘 [英訳],Ama Ero Otokonoko,"english, translated",,mizuchirimen,doujinshi,,,"anal, crossdressing, full color, males only, yaoi, stockings, mosaic censorship, tomgirl, shotacon",14,2016-03-25 03:29:44,2016-03-25 10:29:44,2025-03-02 06:37:25
159300,[Mutsu] Futanari enjoys ballbreaking [Chinese] [沒有漢化],[ムツ] ふたなり快楽玉地獄 [中国翻訳],Futanari enjoys ballbreaking,"translated, chinese",mutsu,kokochikyuu,doujinshi,,,"futanari, bdsm, torture, schoolgirl uniform, cbt",18,2016-03-25 03:30:15,2016-03-25 10:30:15,2025-03-02 06:37:25
159301,[Hitoriyou no Pot (Pokochin)] OHRENSCHMERZEN [Chinese] [沒有漢化],[ひとりようのポット (ぽこちん)] OHRENSCHMERZEN [中国翻訳],OHRENSCHMERZEN,"translated, chinese",pokochin,hitoriyou no pot,doujinshi,,,"futanari, elf, femdom, mother, incest, daughter, collar",23,2016-03-25 03:31:00,2016-03-25 10:31:00,2025-03-02 06:37:26
159302,[Kosuke Haruhito] Shake Love (Girls forM Vol. 10) [Chinese] [沒有漢化],[虎助遥人] Shake Love (ガールズフォーム Vol.10) [中国翻訳],Shake Love,"translated, chinese",kosuke haruhito,,manga,,,"urethra insertion, nakadashi, femdom, x-ray, drunk, orgasm denial, paizuri, waitress, mosaic censorship, sole female, sole male",25,2016-03-25 03:31:50,2016-03-25 10:31:50,2025-03-02 06:37:27
159303,"(CR31) [Nikomark (Minazuki Juuzou, TWILIGHT)] Sekai no Chuushin de Ai o Sakenda Nikomark (Neon Genesis Evangelion) [Chinese] [沒有漢化]","(Cレヴォ31) [にこまあく (水無月十三, TWILIGHT)] 世界の中心でアイを叫んだにこまあく (新世紀エヴァンゲリオン) [中国翻訳]",Sekai no Chuushin de Ai o Sakenda Nikomark,"translated, chinese","twilight, minazuki juuzou",nikomark,doujinshi,neon genesis evangelion,"shinji ikari, rei ayanami, asuka langley soryu","futanari, big breasts, group, bondage, yuri, mosaic censorship, shotacon",20,2016-03-25 03:34:47,2016-03-25 10:34:47,2025-03-02 06:37:27
159304,(Seishun Cup) [Mitsuya Yoguru (Futaba841)] Triple Banging! (Inazuma Eleven) [English] {Shotachan},(青春カップ) [ミツヤヨーグル (双葉841)] トリプルバーニング! (イナズマイレブン) [英訳],Triple Banging!,"english, translated",futaba841,mitsuya yoguru,doujinshi,inazuma eleven,"ichirouta kazemaru, shinichi handa, kuusuke matsuno","group, prostate massage, nakadashi, anal, males only, yaoi, blowjob, shotacon",21,2016-03-25 03:38:30,2016-03-25 10:38:30,2025-03-02 06:37:28
159305,[Irotenya] Onna Boukenshatachi ga Sabaku no Oasis ni Tachiyoru to......2 [English] =Krizalid & sureok1=,[色点屋] 女冒険者たちが砂漠のオアシスに立ち寄ると……2 [英訳],Onna Boukenshatachi ga Sabaku no Oasis ni Tachiyoru to......2,"english, translated",,irotenya,doujinshi,,,"birth, big breasts, group, urination, nakadashi, anal, dark skin, x-ray, defloration, full color, paizuri, mosaic censorship, rape, impregnation, blowjob, bbm",36,2016-03-25 03:39:23,2016-03-25 10:39:23,2025-03-02 06:37:29
159306,(C87) [AKACIA (Ginichi)] Yuubari-chan Hatsujouchuu (Kantai Collection -KanColle-),(C87) [AKACIA (銀一)] 夕張ちゃん発情中 (艦隊これくしょん -艦これ-),Yuubari-chan Hatsujouchuu,japanese,ginichi,akacia,doujinshi,kantai collection,"yuubari, teitoku","ahegao, pantyhose, blowjob, sole female, sole male",22,2016-03-25 03:40:06,2016-03-25 10:40:06,2025-03-02 06:37:29
159308,(SPARK9) [tate-A-tate (Elijah)] Crazy Cracky Chain (Alice in the Country of Hearts),(SPARK9) [tate-A-tate (エリヤ)] Crazy Cracky Chain (ハートの国のアリス ～Wonderful Wonder World～),Crazy Cracky Chain,japanese,elijah,tate-a-tate,doujinshi,alice in the country of hearts,"alice liddell, boris airay","catboy, catgirl",17,2016-03-25 03:41:22,2016-03-25 10:41:22,2025-03-02 06:37:31
159309,(C89) [Kaientai (Shuten Douji)] Hiru wa Krillin no Tsuma (Dragon Ball Z) [Chinese] [說真的這很花時間個人漢化],(C89) [絵援隊 (酒呑童子)] 昼はクリリンの妻 (ドラゴンボールZ) [中国翻訳],Hiru wa Krillin no Tsuma,"translated, chinese",shuten douji,kaientai,doujinshi,dragon ball z,"master roshi, android 18","milf, leg lock, big breasts, old man, netorare, big ass, cheating, ahegao, x-ray, lingerie, sunglasses",36,2016-03-25 03:42:29,2016-03-25 10:42:29,2025-03-02 06:37:31
159310,[Hayabusa] Usagi Seikatsu,[はやぶさ] うさぎ生活,Usagi Seikatsu,japanese,hayabusa,,doujinshi,,,"bunny boy, anal, crossdressing, males only, yaoi, tomgirl, shotacon",17,2016-03-25 03:46:36,2016-03-25 10:46:36,2025-03-02 06:37:32
159311,[Labitan (Nagata Maria)] Aniki to Issho (Cross Fight B-Daman) [Digital],[ラビタン (永田まりあ)] あにきといっしょ (クロスファイトビーダマン) [DL版],Aniki to Issho,japanese,nagata maria,labitan,doujinshi,b-daman,,"anal, males only, yaoi, tomgirl, shotacon",15,2016-03-25 03:49:12,2016-03-25 10:49:12,2025-03-02 06:37:33
159312,COMIC Megastore 2005-05,コミックメガストア 2005年5月号,COMIC Megastore 2005-05,japanese,"okano hajime, uona telepin, wamusato haru, ed, benjamin, itou ei, izumi kyouta, sena monaco, takemura sesshu, gorgeous takarada, harukaze do-jin, minority, yonekura kengo, kobayashi oukei, norakuro nero, iruma kamiri, bakuchin",,manga,,,"bandages, nurse, group, glasses, masturbation, schoolgirl uniform, anthology, nakadashi, sex toys, lolicon, multiple paizuri, footjob, stockings, lingerie, blowjob, blindfold, shotacon",422,2016-03-25 04:59:26,2016-03-25 11:59:26,2025-03-02 06:37:34
159313,(SC2016 Winter) [TIES (Takei Ooki)] Naka Warui Furi Shite Kasumi to Teitoku ga ××× Shimakuri tte Hontou desu ka? (Kantai Collection -KanColle-),(サンクリ2016 Winter) [TIES (タケイオーキ)] 仲悪いふりして霞と提督が×××しまくりって本当ですか? (艦隊これくしょん -艦これ-),Naka Warui Furi Shite Kasumi to Teitoku ga ××× Shimakuri tte Hontou desu ka?,japanese,takei ooki,ties,doujinshi,kantai collection,"kasumi, teitoku","schoolgirl uniform, military, lolicon, sole female, sole male",26,2016-03-25 05:04:54,2016-03-25 12:04:54,2025-03-02 06:37:34
159314,[Gentsuki Okiba (Gentsuki)] Watashi dake o Mitekudasai!! (Granblue Fantasy) [Chinese] [无毒汉化组] [Digital],[ゲンツキオキバ (ゲンツキ)] 私だけを見てくださいッ!! (グランブルーファンタジー) [中国翻訳] [DL版],Watashi dake o Mitekudasai!!,"translated, chinese",gentsuki,gentsuki okiba,doujinshi,granblue fantasy,lecia,"nakadashi, pantyhose, blowjob",20,2016-03-25 05:05:31,2016-03-25 12:05:31,2025-03-02 06:37:35
159315,[Jakou Nezumi] Android wa H na Yume o Miru ka? [Digital],[じゃこうねずみ] アンドロイドはHな夢を見るか？ [DL版],Android wa H na Yume o Miru ka?,japanese,jakou nezumi,,manga,,,"milf, big breasts, group, prostate massage, schoolgirl uniform, nakadashi, anal, robot, foot licking, footjob, mind control, incest, tankoubon, stockings, apron, paizuri, sister, blowjob, chikan",219,2016-03-25 05:11:55,2016-03-25 12:11:55,2025-03-02 06:37:36
159316,[I-Raf-you (Various)] Microne Magazine Vol. 31 [Chinese] [卞赤鲤个人汉化] [Digital],[I-Raf-you (よろず)] マイクローンマガジン Vol.31 [中国翻訳] [DL版],Microne Magazine Vol. 31,"translated, chinese","hase tsubura, ruuru, tomonaga kenji, usashiro mani, utahane w",i-raf-you,doujinshi,,,"bandages, shrinking, big breasts, farting, miko, bbw, anthology, footjob, minigirl, age progression, giantess, miniguy",51,2016-03-25 05:13:43,2016-03-25 12:13:43,2025-03-02 06:37:37
159317,[Hanafuda Sakurano] Yui Koi [Chinese] [上古勤受荣誉呈献],[花札さくらの] 結恋-ユイコイ- [中国翻訳],Yui Koi,"translated, chinese",hanafuda sakurano,,manga,,,"kissing, bandages, leg lock, cunnilingus, masturbation, schoolgirl uniform, urination, nakadashi, femdom, kimono, lolicon, x-ray, tankoubon, stockings, blowjob",198,2016-03-25 05:51:08,2016-03-25 12:51:08,2025-03-02 06:37:37
159318,[emily] Vanilla Pocket | 香草袋 (COMIC Potpourri Club 2015-05) [Chinese] [夢之行蹤漢化組],[emily] Vanilla Pocket (COMIC ポプリクラブ 2015年5月号) [中国翻訳],Vanilla Pocket | 香草袋,"translated, chinese",emily,,manga,,,"schoolboy uniform, full censorship, glasses, schoolgirl uniform, nakadashi, lolicon, defloration, sole female, sole male",21,2016-03-25 05:55:13,2016-03-25 12:55:13,2025-03-02 06:37:40
159319,(C88) [Kurimomo (Tsukako)] Uzuki Shower (THE IDOLM@STER CINDERELLA GIRLS) [Chinese] [CE家族社],(C88) [くりもも (つかこ)] うづきシャワー (アイドルマスター シンデレラガールズ) [中国翻訳],Uzuki Shower,"translated, chinese",tsukako,kurimomo,doujinshi,the idolmaster,"producer, uzuki shimamura","nakadashi, x-ray, blowjob, sole female, sole male",29,2016-03-25 05:56:02,2016-03-25 12:56:02,2025-03-02 06:37:40
159320,(C65) [Renai Mangaka (Naruse Hirofumi)] Magic For You! (Fate/stay night) [Chinese],(C65) [恋愛漫画家 (鳴瀬ひろふみ)] Magic For You! (Fate/stay night) [中国翻訳],Magic For You!,"translated, chinese",naruse hirofumi,renai mangaka,doujinshi,fate stay night,"rin tosaka, archer",dark skin,26,2016-03-25 05:59:18,2016-03-25 12:59:18,2025-03-02 06:37:41
159321,"[Minazuki Juuzou] Waga Nikuni Muretsudoi, Kurae. [Chinese] [大杂烩]",[水無月十三] 我が肉に群れ集い、喰らえ。 [中国翻訳],"Waga Nikuni Muretsudoi, Kurae.","translated, chinese",minazuki juuzou,,manga,,,"cunnilingus, mmf threesome, group, glasses, schoolgirl uniform, double vaginal, hairy, incest, double penetration, tankoubon, pantyhose, gokkun, fingering, bukkake, sister, teacher, blowjob, shotacon",141,2016-03-25 06:25:03,2016-03-25 13:25:03,2025-03-02 06:37:43
159322,(SC2016 Winter) [V-SLASH (Yuugiri)] Broken Clock Kairaku no Kokuin (Granblue Fantasy),(サンクリ2016 Winter) [V-SLASH (夕霧)] Broken Clock 快楽の刻印 (グランブルーファンタジー),Broken Clock Kairaku no Kokuin,japanese,yuugiri,v-slash,doujinshi,granblue fantasy,"beatrix, zeta","group, dog, midget, bestiality, nakadashi, ahegao, bondage, monster, low bestiality, double penetration, stockings, mind break, rape, slave",26,2016-03-25 06:29:40,2016-03-25 13:29:40,2025-03-02 06:37:43
159323,[Kawakami Kou] Asoko de Toberumon! (COMIC Megamilk 2012-06 Vol. 24) [English] [desudesu],[河上康] アソコでとべるもん! (コミックメガミルク 2012年6月号 Vol.24) [英訳],Asoko de Toberumon!,"english, translated",kawakami kou,,manga,,,"big breasts, coach, nakadashi, lolicon, defloration, paizuri, oppai loli, bloomers, sole female, sole male",22,2016-03-25 06:33:32,2016-03-25 13:33:32,2025-03-02 06:37:44
159324,[Cuvie] Henpin Fuka! - No Return (COMIC Penguin Celeb 2013-02) [English] [desudesu] [Digital],[Cuvie] 返品不可っ！ (COMIC ペンギンセレブ 2013年2月号) [英訳] [DL版],Henpin Fuka! - No Return,"english, translated",cuvie,,manga,,,"kissing, nakadashi, robot, defloration, sole female, sole male",26,2016-03-25 06:34:19,2016-03-25 13:34:19,2025-03-02 06:37:45
159325,(SC2015 Autumn) [Fuji Sengendou (Various)] Bessatsu Kikuushi no Kakurega  (Granblue Fantasy),(サンクリ2015 Autumn) [富士浅間堂 (よろず)] 別冊 騎空士の隠れ家 (グランブルーファンタジー),Bessatsu Kikuushi no Kakurega,japanese,wakamesan,fuji sengendou,doujinshi,granblue fantasy,djeeta,"big breasts, anthology, prostitution, lolicon, bunny girl, stockings, small breasts, blowjob",52,2016-03-25 06:43:23,2016-03-25 13:43:23,2025-03-02 06:37:46
159326,[ はらだ ] ～初恋～ [CHN],,～初恋～,"translated, chinese",harada,,manga,,,"kissing, anal, scanmark, males only, yaoi",48,2016-03-25 06:44:48,2016-03-25 13:44:48,2025-03-02 06:37:46
159327,(C89) [Kikyakudou (Karateka Value)] The secret of Charlotte (Granblue Fantasy),(C89) [鬼脚堂 (カラテカ・バリュー)] The secret of Charlotte (グランブルーファンタジー),The secret of Charlotte,japanese,karateka value,kikyakudou,doujinshi,granblue fantasy,,"elf, group, nakadashi, lolicon, inflation, stockings, impregnation, stomach deformation, sole female",24,2016-03-25 06:48:46,2016-03-25 13:48:46,2025-03-02 06:37:47
159328,(SC2016 Winter) [ARESTICA (Ariko Youichi)] Onee-san ni Makasetene (Granblue Fantasy),(サンクリ2016 Winter) [ARESTICA (有子瑶一)] お姉さんにまかせてね (グランブルーファンタジー),Onee-san ni Makasetene,japanese,ariko youichi,arestica,doujinshi,granblue fantasy,narmaya,"big breasts, demon girl, thigh high boots, stockings, sole female, sole male",15,2016-03-25 06:49:17,2016-03-25 13:49:17,2025-03-02 06:37:47
159329,[Roubai-tei (atahuta)] HARTMAAAAN!!!! (Strike Witches) [Chinese] [沒有漢化] [Digital],[狼狽亭 (atahuta)] HARTMAAAAN!!!! (ストライクウィッチーズ) [中国翻訳] [DL版],HARTMAAAAN!!!!,"translated, chinese",atahuta,roubai-tei,doujinshi,strike witches,erica hartmann,"onahole, femdom, military, lolicon, footjob, full color, stockings, mosaic censorship, cbt, blowjob",19,2016-03-25 06:51:59,2016-03-25 13:51:59,2025-03-02 06:37:48
159330,(C89) [Gessyu (Chouzetsu Bishoujo mine)] Kaku no Kozukuri (Kantai Collection -KanColle-) [Chinese] [沒有漢化],(C89) [げっしゅ (超絶美少女mine)] 鶴の子作り (艦隊これくしょん -艦これ-) [中国翻訳],Kaku no Kozukuri,"translated, chinese",chouzetsu bishoujo mine,gessyu,doujinshi,kantai collection,"shoukaku, teitoku","big breasts, full censorship, nakadashi, lactation, sole female, sole male",29,2016-03-25 06:59:34,2016-03-25 13:59:34,2025-03-02 06:37:49
159331,[冬野みかん] 大きい女の子とのえっち漫画3 [Chinese] [沒有漢化],[冬野みかん] 大きい女の子とのえっち漫画3 [中国翻訳],大きい女の子とのえっち漫画3,"translated, chinese",fuyuno mikan,,doujinshi,,,"lolicon, giantess",26,2016-03-25 07:04:08,2016-03-25 14:04:08,2025-03-02 06:37:49
159332,[Gin] Re:ache reward (Girls forM Vol. 10) [Chinese] [沒有漢化],[ぎん] Re:ache reward (ガールズフォーム Vol.10) [中国翻訳],Re:ache reward,"translated, chinese",gin,,manga,,,"maid, scar, pegging, full censorship, femdom, bondage, thigh high boots, latex, stockings, lingerie, cbt, collar, shibari",26,2016-03-25 07:04:54,2016-03-25 14:04:54,2025-03-02 06:37:50
159333,[Kakizaki Kousei] Ashikoki Hishokan Ikazuchi (Kantai Collection -KanColle-) [Chinese] [沒有漢化],[垣崎コウセイ] 足コキ秘書官雷 (艦隊これくしょん -艦これ-) [中国翻訳],Ashikoki Hishokan Ikazuchi,"translated, chinese",,,doujinshi,kantai collection,"ikazuchi, teitoku","schoolgirl uniform, femdom, foot licking, military, lolicon, footjob, stockings, smell, sole female, sole male",4,2016-03-25 07:05:16,2016-03-25 14:05:16,2025-03-02 06:37:51
