ID,EN_TITLE,JP_TITLE,CLEAN_TITLE,LANGUAGE,ARTIST,GROUP_NAME,CATEGORY,PARODY,CHARACTER,TAGS,PAGES,UPLOAD_DATE,FORMATTED_DATE,SCRAPED_DATE
158081,[Tomono Hiro] Hatsukoi Hanabi (COMIC Penguin Club Sanzokuban 2015-09) [Chinese] [最愛路易絲澪漢化組],[友野ヒロ] 初恋花火 (COMIC ペンギンクラブ山賊版 2015年9月号) [中国翻訳],Hatsukoi Hanabi,"translated, chinese",tomono hiro,,manga,,,"nakadashi, defloration",20,2016-03-08 17:18:13,2016-03-09 00:18:13,2025-03-02 06:22:43
158082,[Crimson] Taimashi Kaguya [Kanzenban] | 退魔士加乃綾【完全版】 [Chinese],[クリムゾン] 退魔士カグヤ【完全版】 [中国翻訳],Taimashi Kaguya| 退魔士加乃綾【完全版】,"translated, chinese",crimson,,manga,,,"bondage, tankoubon, rape, tentacles",135,2016-03-08 17:21:42,2016-03-09 00:21:42,2025-03-02 06:22:44
158083,[Danrenji] Elf no Youjo ga Itanode Mechakucha Yatta Hanashi | The Screwing Up an Elf Girl Because She's Right Over There Story [English],[だんれんじ] エルフの幼女がいたのでメチャクチャやった話  [英訳],Elf no Youjo ga Itanode Mechakucha Yatta Hanashi | The Screwing Up an Elf Girl Because She's Right Over There Story,"english, translated",danrenji,,doujinshi,,,"elf, orc, mmf threesome, group, lolicon, defloration, rape, sole female",6,2016-03-08 17:22:55,2016-03-09 00:22:55,2025-03-02 06:22:45
158084,(C89) [Kuma no Tooru Michi (Kumada)] One Night Jinrou (Touhou Project),(C89) [くまのとおるみち (くまだ)] わんナイト人狼 (東方Project),One Night Jinrou,japanese,kumada,kuma no tooru michi,doujinshi,touhou project,kagerou imaizumi,"full censorship, dog, bestiality, wolf girl, hairy, sole female",22,2016-03-08 17:26:31,2016-03-09 00:26:31,2025-03-02 06:22:46
158085,"(Shuuki Reitaisai 2) [YOMOTHUHIRASAKA, Heart's nest (bbsacon, hato)] Touhou Koushokuen (Touhou Project)",(秋季例大祭2) [黄泉比良坂、Heart's nest (bbsacon、hato)] 東方肛触宴 (東方Project),Touhou Koushokuen,japanese,"hato, bbsacon","yomothuhirasaka, hearts nest",doujinshi,touhou project,"marisa kirisame, reimu hakurei","big breasts, anal, vaginal sticker, inflation, double penetration, tentacles, crotch tattoo",34,2016-03-08 17:27:32,2016-03-09 00:27:32,2025-03-02 06:22:47
158086,(Shuuki Reitaisai 2) [Zensuu Hakai Kensa (Black)] 3-kkakan de Ningyoutsukai o Otosu Hon (Touhou Project),(秋季例大祭2) [全数破壊検査 (ぶらっく)] 3日間で人形遣いを堕とす本 (東方Project),3-kkakan de Ningyoutsukai o Otosu Hon,japanese,black,zensuu hakai kensa,doujinshi,touhou project,"nue houjuu, alice margatroid","futanari, big breasts, mind control, full color, lactation, shotacon",30,2016-03-08 17:31:23,2016-03-09 00:31:23,2025-03-02 06:22:47
158087,(C88) [Sunset Beach (Hammer)] Hitoriasobi Gensou 3-nenme (Touhou Project),(C88) [サンセットビーチ (ハマー)] ひとりあそび幻想 3ねんめ (東方Project),Hitoriasobi Gensou 3-nenme,japanese,hammer,sunset beach,doujinshi,touhou project,"nazrin, flandre scarlet, sanae kochiya, koishi komeiji, patchouli knowledge, alice margatroid, marisa kirisame, rumia, reimu hakurei, sakuya izayoi, koakuma, youmu konpaku, fujiwara no mokou, yuyuko saigyouji","masturbation, lolicon, full color",26,2016-03-08 17:36:26,2016-03-09 00:36:26,2025-03-02 06:22:48
158088,(C88) [Kuma no Mori (Kumataro)] SEMPITERNAL DOLL TIME (Touhou Project),(C88) [くまのもり (隈太郎)] SEMPITERNAL DOLL TIME (東方Project),SEMPITERNAL DOLL TIME,japanese,kumataro,kuma no mori,doujinshi,touhou project,"alice margatroid, sakuya izayoi","group, stockings, rape, tentacles",34,2016-03-08 17:37:26,2016-03-09 00:37:26,2025-03-02 06:22:49
158089,(C88) [grand-nauts (Hirose Madoka)] Honey Biscuits! (BeatStream) [Chinese] [LV.11 Unlimit],(C88) [grand-nauts (広瀬まどか)] honey biscuits! (ビートストリーム) [中国翻訳],Honey Biscuits!,"translated, chinese",hirose madoka,grand-nauts,doujinshi,beatstream,bisco,"big breasts, lolicon, oppai loli",19,2016-03-08 17:41:58,2016-03-09 00:41:58,2025-03-02 06:22:50
158090,(C89) [GREAT Akuta (tokyo)] Yurufuwa Yuka Life (Minami-ke),(C89) [GREAT芥 (tokyo)] ゆるふわユカらいふ (みなみけ),Yurufuwa Yuka Life,japanese,tokyo,,doujinshi,minami-ke,yuka uchida,"big breasts, piercing, group, big ass, masturbation, replaced, prostitution, anal, sex toys, dark skin, pubic stubble, full body tattoo, multi-work series, drugs, double penetration, drunk, gyaru, large insertions, impregnation, crotch tattoo, great akuta",58,2016-03-08 17:43:48,2016-03-09 00:43:48,2025-03-02 06:22:51
158091,(Girls Love Festival 16) [Souka Sentou (Various)] Yuri Live! (Love Live!),(Girls Love Festival 16) [双花仙桃 (よろず)] ユリライブ! (ラブライブ!),Yuri Live!,japanese,,souka sentou,doujinshi,love live,"hanayo koizumi, maki nishikino, rin hoshizora, nico yazawa","females only, schoolgirl uniform, yuri",27,2016-03-08 17:44:58,2016-03-09 00:44:58,2025-03-02 06:22:51
158092,[Haitokukan] Jikan Teishi no Otoko | The journal of the man who could stop time (COMIC Tenma 2015-11) [English] [naxusnl],[背徳漢] 時間停止の男 (COMIC 天魔 2015年11月号) [英訳],Jikan Teishi no Otoko | The journal of the man who could stop time,"english, translated",haitokukan,,manga,,,"time stop, schoolboy uniform, emotionless sex, netorare, schoolgirl uniform, assjob, paizuri, mind break, mosaic censorship, bloomers, blowjob, yandere",20,2016-03-08 17:45:39,2016-03-09 00:45:39,2025-03-02 06:22:52
158093,[Kome Nouka (Komezawa)] Ane no Kawari ni. [Digital],[こめ農家 (こめざわ)] 姉のかわりに。 [DL版],Ane no Kawari ni.,japanese,komezawa,kome nouka,doujinshi,,,"glasses, anal, bondage, crossdressing, x-ray, yaoi, mosaic censorship, rape, tomgirl, blowjob, shotacon",29,2016-03-08 17:50:31,2016-03-09 00:50:31,2025-03-02 06:22:53
158094,[Shiki Takuto] Tokoharu Ch. 3 (Tokoharu no Shoujo-tachi) [English],[史鬼匠人] 常春 第3話 (常春の少女たち) [英訳],Tokoharu Ch. 3,"english, translated",shiki takuto,,manga,,,"kimono, defloration, sole female, sole male",26,2016-03-08 17:51:16,2016-03-09 00:51:16,2025-03-02 06:22:54
158095,[Kome Nouka (Komezawa)] NON CHERRY DS [Digital],[こめ農家 (こめざわ)] NON CHERRY DS [DL版],NON CHERRY DS,japanese,komezawa,kome nouka,doujinshi,,,"anal, crossdressing, yaoi, mosaic censorship, tomgirl, shotacon",24,2016-03-08 17:57:08,2016-03-09 00:57:08,2025-03-02 06:22:54
158096,"(C89) [FLAT (Yukyu Ponzu)] Rika, Otona ni Shiteageyou (THE iDOLM@STER CINDERELLA GIRLS)",(C89) [FLAT (悠久ポン酢)] 莉嘉、大人にシてあげよう (アイドルマスター シンデレラガールズ),"Rika, Otona ni Shiteageyou",japanese,yukyu ponzu,flat,doujinshi,the idolmaster,rika jougasaki,"business suit, schoolgirl uniform, nakadashi, ahegao, lolicon, drugs, dilf, sole female, sole male",24,2016-03-08 18:01:01,2016-03-09 01:01:01,2025-03-02 06:22:55
158097,[Momonosuke] Beach de Kojinshidou - private lesson at the beach (Monthly Vitaman 2015-09) [English] [Fated Circle],[桃之助] ビーチde個人指導♡ (月刊 ビタマン 2015年9月号) [英訳],Beach de Kojinshidou - private lesson at the beach,"english, translated",momonosuke,,manga,,,"swimsuit, bikini, defloration, tanlines, tall girl, tomboy, sole female, sole male",20,2016-03-08 18:01:38,2016-03-09 01:01:38,2025-03-02 06:22:56
158098,"[Okayusan] Hitorigurashi, Ojamashimasu (COMIC Anthurium 026 2015-06) [English] [Fated Circle] [Digital]",[おかゆさん] 一人暮らし、おじゃまします (COMIC アンスリウム 026 2015年6月号) [英訳] [DL版],"Hitorigurashi, Ojamashimasu","english, translated",okayusan,,manga,,,"sweating, glasses, muscle",20,2016-03-08 18:02:25,2016-03-09 01:02:25,2025-03-02 06:22:56
158099,(SC64) [Nagiyamasugi (Nagiyama)] Love Live! Kotori-chan no KadoOna | Kotori-chan's Desk Edge Masturbation (Love Live!) [English] [h0henD],(サンクリ64) [ナギヤマスギ (那岐山)] ラブライブ!ことりちゃんの角オナ (ラブライブ!) [英訳],Love Live! Kotorichan's Desk Edge Masturbation,"english, translated",nagiyama,nagiyamasugi,doujinshi,love live,kotori minami,"maid, big breasts, schoolgirl uniform, table masturbation, solo action, exhibitionism, waitress, blackmail, sole female",16,2016-03-08 18:02:57,2016-03-09 01:02:57,2025-03-02 06:22:57
158101,(Nanairo Majo no Ningyou Butoukai. 5) [Yosutebito na Mangakaki (Tomoki Tomonori)] Watashi o H no Aite ni Erande kudasai! (Touhou Project) [English] {Mant},(七色魔女の人形舞踏会。5) [世捨人な漫画描き (ともきとものり)] 私をHの相手に選んでください! (東方Project) [英訳],Watashi o H no Aite ni Erande kudasai!,"english, translated",tomoki tomonori,yosutebito na mangakaki,doujinshi,touhou project,"sanae kochiya, suwako moriya, alice margatroid, cirno","lolicon, stockings",35,2016-03-08 18:09:34,2016-03-09 01:09:34,2025-03-02 06:22:59
158102,[Pyramid House (Muscleman)] Goshujin-sama Daisuki desu (Dorei to no Seikatsu -Teaching Feeling-),[ピラミッドハウス (マッスルマン)] ご主人様大好きです (奴隷との生活 -Teaching Feeling-),Goshujin-sama Daisuki desu,japanese,muscleman,pyramid house,doujinshi,dorei to no seikatsu,sylvie,"scar, defloration, mosaic censorship, impregnation, sole female, sole male",78,2016-03-08 18:12:52,2016-03-09 01:12:52,2025-03-02 06:23:01
158103,(Zenkoku Taikai R1) [Statice (Yurihara Aki)] Hana Momo -Sawada- (Katekyoo Hitman REBORN!) [English] [biribiri],(全国大会R1) [スターチス (百合原明)] ハナモモ -沢田- (家庭教師ヒットマンREBORN!) [英訳],Hana Momo,"english, translated",yurihara aki,statice,doujinshi,katekyo hitman reborn,"tsunayoshi sawada, mukuro rokudo","stockings, small breasts, gender bender",26,2016-03-08 18:19:22,2016-03-09 01:19:22,2025-03-02 06:23:01
158104,(SUPERKansai21) [Sukidarake (Fukuzawa Yukine)] Gold Oasis Shower (Yowamushi Pedal),(SUPER関西21) [すきだらけ (福沢ゆきね)] ゴールドオアシスシャワー (弱虫ペダル),Gold Oasis Shower,japanese,,sukidarake,doujinshi,yowamushi pedal,"yasutomo arakita, yukinari kuroda","urination, males only, yaoi, piss drinking",27,2016-03-08 18:20:08,2016-03-09 01:20:08,2025-03-02 06:23:02
158105,(Zenkai Cadence 5) [URiEF (Miki Yun)] Stop!! Arakita-kun! (Yowamushi Pedal),(全開ケイデンス5) [URiEF (三木ゆん)] ストップ!!荒北君! (弱虫ペダル),Stop!! Arakita-kun!,japanese,miki yun,urief,doujinshi,yowamushi pedal,"yasutomo arakita, jinpachi toudou","anal, males only, yaoi",26,2016-03-08 18:20:48,2016-03-09 01:20:48,2025-03-02 06:23:02
158106,(Kimi ni Bakyun! 2) [Mantou (Akiyama Manji)] Atama ga Warukute Tachi mo Warui (Yowamushi Pedal),(君にバキューン!2) [マントウ (秋山まんじ)] 頭がワルくて質もワルい (弱虫ペダル),Atama ga Warukute Tachi mo Warui,japanese,akiyama manji,,doujinshi,yowamushi pedal,"yasutomo arakita, hayato shinkai","anal, males only, yaoi",25,2016-03-08 18:21:24,2016-03-09 01:21:24,2025-03-02 06:23:03
158107,(Zenkai Cadence 5) [Hellenism (Y)] Yajuu no Kimochi (Yowamushi Pedal),(全開ケイデンス5) [へれニズム (Y)] 野獣のきもち (弱虫ペダル),Yajuu no Kimochi,japanese,y,hellenism,doujinshi,yowamushi pedal,"yasutomo arakita, jinpachi toudou","males only, yaoi",18,2016-03-08 18:21:53,2016-03-09 01:21:53,2025-03-02 06:23:04
158108,(SPARK10) [Shinkai Seizu (Shiroya)] Honey Melt (Yowamushi Pedal),(SPARK10) [深海星図 (白弥)] ハニーメルト (弱虫ペダル),Honey Melt,japanese,shiroya,shinkai seizu,doujinshi,yowamushi pedal,"yasutomo arakita, sakamichi onoda","glasses, males only, yaoi, blowjob",22,2016-03-08 18:22:27,2016-03-09 01:22:27,2025-03-02 06:23:04
158109,[DOZA Village (Dozamura)] Hitozuma Miyuki-san ni Otto Kounin de Mainichi Tanetsuke Sex [English] [Fated Circle] [Digital],[DOZA Village (どざむら)] 人妻美由紀さんに夫公認で毎日種付けセックス [英訳] [DL版],Hitozuma Miyuki-san ni Otto Kounin de Mainichi Tanetsuke Sex,"english, translated",dozamura,doza village,doujinshi,,,"milf, big breasts, gag, spanking, netorare, prostitution, nakadashi, full color, tanlines, stockings, pantyhose, swinging, filming, mosaic censorship, shotacon, sole female, sole male",42,2016-03-08 18:28:50,2016-03-09 01:28:50,2025-03-02 06:23:05
158110,(C84) [Al Dente (Tsuna)] Youshoku [Chinese] [脸肿汉化组],(C84) [あるでんて (ツナ)] 幼触 [中国翻訳],Youshoku,"translated, chinese",tsuna,al dente,doujinshi,,,"sleeping, lolicon, tentacles",18,2016-03-08 18:31:25,2016-03-09 01:31:25,2025-03-02 06:23:06
158111,[Yihyeonmin] Drug Candy Ch.0-33 [English] [YoManga],,Drug Candy Ch.0-33,"english, translated",yi hyeon min,,doujinshi,,,"full censorship, story arc, cheating, scanmark, full color",972,2016-03-08 20:50:01,2016-03-09 03:50:01,2025-03-02 06:23:07
158112,[Yihyeonmin] Drug Candy Ch.0-33 (English) (YoManga) (Ongoing),,Drug Candy Ch.0-33,"english, translated",yi hyeon min,,doujinshi,,,"full censorship, story arc, cheating, scanmark, full color",983,2016-03-08 21:26:55,2016-03-09 04:26:55,2025-03-02 06:23:07
158113,(C81) [Studio30NEKO (fukunotsukuribe)] MromantikXX  [Chinese] [沒有漢化] [Decensored],(C81) [Studio30NEKO (ふくのつくりべ)] MromantikXX  [中国翻訳] [無修正],MromantikXX,"translated, chinese",fukunotsukuribe,studio30neko,doujinshi,,,"uncensored, femdom, crossdressing, stockings, shotacon",29,2016-03-08 21:30:19,2016-03-09 04:30:19,2025-03-02 06:23:08
158114,[Sorimura Youji] Loli bitch counseling (Girls forM Vol. 11) [Chinese] [沒有漢化],[そりむらようじ] ロリビッチかうんせりんぐ (ガールズフォーム Vol.11) [中国翻訳],Loli bitch counseling,"translated, chinese",sorimura youji,,manga,,,"handjob, group, glasses, nakadashi, ffm threesome, femdom, lolicon, x-ray, footjob, stockings, blowjob, bbm",20,2016-03-08 21:34:10,2016-03-09 04:34:10,2025-03-02 06:23:09
158115,[Gamang] Sports Girl Ch.1-27  (English) (YoManga),,Sports Girl Ch.1-27,"english, translated",gamang,,doujinshi,,,"full censorship, scanmark, full color, muscle",497,2016-03-08 21:51:15,2016-03-09 04:51:15,2025-03-02 06:23:10
158116,(C89) [Nama Cream Biyori (Nanase Meruchi)] Melcheese 54 (Granblue Fantasy) [English] [JMCS],(C89) [生クリームびより (ななせめるち)] Melcheese54 (グランブルーファンタジー) [英訳],Melcheese 54,"english, translated",nanase meruchi,nama cream biyori,doujinshi,granblue fantasy,"gran, narmaya","demon girl, stockings, sole female, sole male",27,2016-03-08 21:52:50,2016-03-09 04:52:50,2025-03-02 06:23:10
158117,(C88) [MAPLER (Maple)] Tomodachi ni mo Naisho no Koto,(C88) [MAPLER (まぷる)] ともだちにもないしょのこと,Tomodachi ni mo Naisho no Koto,japanese,maple,mapler,doujinshi,,,"tutor, lolicon, multi-work series, sole female, sole male",26,2016-03-08 21:56:30,2016-03-09 04:56:30,2025-03-02 06:23:11
158118,(C88) [Hatogoya (Suruga Rinu)] Ro~Tension (Kantai Collection -KanColle-),(C88) [鳩小屋 (駿河りぬ)] ろ～テンション↑↑ (艦隊これくしょん -艦これ-),Ro~Tension,japanese,suruga rinu,hatogoya,doujinshi,kantai collection,ro-500,"nakadashi, lolicon, tanlines, school swimsuit, blowjob",27,2016-03-08 22:01:53,2016-03-09 05:01:53,2025-03-02 06:23:12
158119,(C88) [F Taku (Anma)] Mukuchi Shoujo no Chikan Higai 6,(C88) [F宅 (安間)] 無口少女の痴漢被害6,Mukuchi Shoujo no Chikan Higai 6,japanese,anma,f taku,doujinshi,,,"glasses, masturbation, schoolgirl uniform, multi-work series, pantyhose, chikan, sole female, sole male",26,2016-03-08 22:02:46,2016-03-09 05:02:46,2025-03-02 06:23:12
158120,(C88) [Shichiten Battou (Miyasaka Takaji)] Oshi no Yowai Jimi-kei JS wa Enjo Kousai o Kotowarenai.,(C88) [シチテンバットウ (ミヤサカタカジ)] 押しの弱い地味系JSは援助交際を断れない。,Oshi no Yowai Jimi-kei JS wa Enjo Kousai o Kotowarenai.,japanese,miyasaka takaji,shichiten battou,doujinshi,,,"glasses, prostitution, nakadashi, lolicon",34,2016-03-08 22:07:32,2016-03-09 05:07:32,2025-03-02 06:23:13
158121,[BAK Hyeong Jun] Sweet Guy Ch. 1-44 [English] [YoManga],[朴亨濬] カラダにイイ男 第1-44話 [英訳],Sweet Guy Ch. 1-44,"english, translated",bak hyeong jun,,doujinshi,,,"full censorship, glasses, story arc, replaced, mind control, full color",1129,2016-03-08 22:44:11,2016-03-09 05:44:11,2025-03-02 06:23:14
158122,[Karitouroku M] Yousei Little no Nyotai Tanken Monogatari (19),[仮登録M] 妖精リトルの女体探検物語(19),Yousei Little no Nyotai Tanken Monogatari,japanese,karitouroku m,,doujinshi,,,"monster girl, vore, minigirl, fairy",20,2016-03-08 22:46:30,2016-03-09 05:46:30,2025-03-02 06:23:15
158123,[Syati Kamaboko] Clever? Solution [English] [PSYN],[シャチカマボコ] Clever? Solution [英訳],Clever? Solution,"english, translated",syati kamaboko,,manga,,,"handjob, leg lock, group, story arc, schoolgirl uniform, urination, nakadashi, anal, ffm threesome, femdom, bondage, defloration, human pet, drugs, stockings, small breasts, paizuri, mind break, mosaic censorship, teacher, blackmail, tomboy, yandere, slave, sole male, tail plug",124,2016-03-08 23:09:13,2016-03-09 06:09:13,2025-03-02 06:23:15
158124,[Dr.P] Momoiro Daydream [English] {YQII + Afro},[Dr.P] ももいろデイドリーム [英訳],Momoiro Daydream,"english, translated",dr.p,,manga,,,"full censorship, glasses, facesitting, nakadashi, bondage, dark skin, defloration, bunny girl, tankoubon, pantyhose, drunk, small breasts, leotard, tomboy, blindfold",196,2016-03-08 23:41:08,2016-03-09 06:41:08,2025-03-02 06:23:16
158125,[Kai Hiroyuki] Shiritsu Seiko Gakuen ~Shinbun-bu Momose Rio~ | Seiko Private High Newspaper Club - Rio Momose (Bitch Hi School) [English] [Tadanohito/Varkatzas666] [Decensored],[甲斐ひろゆき] 私立・精洸学園 〜新聞部・百瀬莉緒～ (びっちHiスクール) [英訳] [無修正],Shiritsu Seiko Gakuen ~ShinbunRio Momose,"english, translated",kai hiroyuki,,manga,,,"schoolboy uniform, glasses, uncensored, schoolgirl uniform, replaced, nakadashi, stockings",20,2016-03-08 23:42:05,2016-03-09 06:42:05,2025-03-02 06:23:17
158126,"(C89) [Kaze no Gotoku! (Fubuki Poni, Fujutsushi)] Tomoe Mami Intai!? Zenbu Misemasu Namida to Nikuyoku no LAST LIVE!! (Puella Magi Madoka Magica)","(C89) [風のごとく! (風吹ぽに, 風術師)] 巴◯ミ引退!？全部見せます涙と肉欲のラストLIVE!! (魔法少女まどか☆マギカ)",Tomoe Mami Intai!? Zenbu Misemasu Namida to Nikuyoku no LAST LIVE!!,japanese,"fujutsushi, fubuki poni",kaze no gotoku,doujinshi,puella magi madoka magica,mami tomoe,"big breasts, dark skin, double penetration, stockings, filming, blowjob",26,2016-03-08 23:42:52,2016-03-09 06:42:52,2025-03-02 06:23:18
158127,[Ashika] Boot! 1.5 (Moppet.) [English] [Fated Circle] [Digital],[あしか] Boot! 1.5 (もぺっと。) [英訳] [DL版],Boot! 1.5,"english, translated",ashika,,manga,,,"group, nakadashi, harem, dark skin, lolicon, policewoman, mosaic censorship",9,2016-03-08 23:44:15,2016-03-09 06:44:15,2025-03-02 06:23:18
158128,"[Ahemaru (Henrik)] Irihaji (Fate/kaleid liner Prisma Illya, Gatchaman Crowds) [Chinese] [犬走椛个人汉化] [Digital]",[アヘ丸 (ヘンリーク)] いりはじ (Fate/kaleid liner プリズマ☆イリヤ、ガッチャマンクラウズ) [中国翻訳] [DL版],Irihaji,"translated, chinese",ahemaru,ahemaru,doujinshi,"gatchaman crowds, fate kaleid liner prisma illya","hajime ichinose, illyasviel von einzbern","big breasts, nakadashi, ahegao, anal, bondage, lolicon, inflation, double penetration, stockings, pantyhose, tentacles, stomach deformation",31,2016-03-08 23:48:02,2016-03-09 06:48:02,2025-03-02 06:23:19
158129,[Jyoka] Hachishaku Hachiwa Keraku Meguri - Igyou Kaikitan,[叙火] 八尺八話快樂巡り 異形怪奇譚,Hachishaku Hachiwa Keraku Meguri - Igyou Kaikitan,japanese,jyoka,,manga,,,"sundress, birth, milf, sweating, transformation, big breasts, corruption, pregnant, bull, bbw, amputee, monster girl, group, story arc, big ass, bestiality, nakadashi, snake girl, anal, tall man, femdom, bondage, harem, hairy, ghost, kimono, nipple fuck, double penetration, tanlines, tankoubon, big areolae, multiple arms, lactation, pantyhose, tall girl, mind break, rape, giantess, impregnation, miniguy, petrification, muscle, tentacles, shotacon",217,2016-03-09 00:28:11,2016-03-09 07:28:11,2025-03-02 06:23:20
158130,[PNO Group (Hase Yuu)] Motto! Ilya Bunhokan Keikaku (Fate/stay night) [Chinese] [我们并不是汉化组],[PNOグループ (はせ☆裕)] もっと！イリヤ分補完計画！ (Fate/stay night) [中国翻訳],Motto! Ilya Bunhokan Keikaku,"translated, chinese",hase yuu,pno group,doujinshi,fate stay night,"illyasviel von einzbern, shirou emiya","lolicon, incest",37,2016-03-09 00:33:23,2016-03-09 07:33:23,2025-03-02 06:23:20
158131,(C89) [Cior (ken-1)] Asunama 4 (Sword Art Online),(C89) [Cior (ken-1)] あすなま4 (ソードアート・オンライン),Asunama 4,japanese,ken-1,cior,doujinshi,sword art online,asuna yuuki,"big breasts, group, netorare, nakadashi, double penetration, stockings, mind break, rape",18,2016-03-09 00:33:54,2016-03-09 07:33:54,2025-03-02 06:23:21
158133,(C89) [IrodoRIP (Ayato Ayari)] Shounen Ninja Koushoku Kitan (Ragnarok Online) [Chinese] [瑞树汉化组],(C89) [彩RIP (あやとあやり)] 娼年忍者好色奇譚 (ラグナロクオンライン) [中国翻訳],Shounen Ninja Koushoku Kitan,"translated, chinese",ayato ayari,irodorip,doujinshi,ragnarok online,,"frottage, anal, crossdressing, males only, yaoi, stockings, tomgirl, kunoichi, shotacon, feminization",31,2016-03-09 00:43:37,2016-03-09 07:43:37,2025-03-02 06:23:22
158134,[Gengoroh Tagame][田龟源五郎] 无限游戏 PART 3[黑夜汉化组] [Chinese],,无限游戏 PART 3,"translated, chinese",tagame gengoroh,,doujinshi,,,"scanmark, males only, yaoi, rimjob, muscle",21,2016-03-09 00:45:22,2016-03-09 07:45:22,2025-03-02 06:23:23
158135,[You You Tsuushin (Shinonome Yuu)] Imouto Tsuushin Vol.4 - Chiko & Riko Hen,[遊遊通信 (東雲優)]  妹々通信 Vol.4 -ちこ&りこ編-,Imouto Tsuushin Vol.4 - Chiko & Riko Hen,japanese,shinonome yuu,you you tsuushin,doujinshi,,,"twins, ffm threesome, lolicon, incest, sister",23,2016-03-09 00:49:07,2016-03-09 07:49:07,2025-03-02 06:23:23
158136,(SC2015 Autumn) [ZIGZAG (Hirno)] Seiyokudo 100% (Sennen Sensou Aigis) [Chinese] [黑锅汉化组],(サンクリ2015 Autumn) [ZIGZAG (Hirno)] 性欲度100% (千年戦争アイギス) [中国翻訳],Seiyokudo 100%,"translated, chinese",hirno,zigzag,doujinshi,sennen sensou aigis,nanaly,lolicon,23,2016-03-09 00:52:01,2016-03-09 07:52:01,2025-03-02 06:23:24
158137,[You You Tsuushin (Shinonome Yuu)] Suki dakara ii yo ne?,[遊遊通信 (東雲優)]  好きだからいいよね?,Suki dakara ii yo ne?,japanese,shinonome yuu,you you tsuushin,doujinshi,,,"incest, sister",37,2016-03-09 00:53:18,2016-03-09 07:53:18,2025-03-02 06:23:24
158138,[Nico Pun Nise] Chou Saisentan Kanojo [Chinese],[笑花偽] 超最先端彼女 [中国翻訳],Chou Saisentan Kanojo,"translated, chinese",nico pun nise,,manga,,,"big breasts, mmf threesome, story arc, schoolgirl uniform, ffm threesome, incest, tankoubon, stockings, sister, blowjob, shotacon",114,2016-03-09 00:56:19,2016-03-09 07:56:19,2025-03-02 06:23:25
158139,[Moekorodo (Norio Minami)] Teitoku no Sei Kantai  (Kantai Collection -KanColle-) [Digital],[萌殺堂 (矩尾ミナミ)]  提督の性艦隊  (艦隊これくしょん-艦これ-) [DL版],Teitoku no Sei Kantai,japanese,norio minami,moekorodo,doujinshi,kantai collection,"shimakaze, akatsuki, takao, hibiki, tatsuta, tenryuu, atago, murakumo, inazuma, ikazuchi, teitoku","nakadashi, lolicon, footjob, eyepatch, paizuri, blowjob, mecha girl",14,2016-03-09 00:58:52,2016-03-09 07:58:52,2025-03-02 06:23:26
158140,(Hop!Step!Jam!) [Kuroquis (Kuro)] IN (Kuroko no Basuke) [English] {SammyJ},(Hop!Step!Jam!) [Kuroquis (Kuro)] IN (黒子のバスケ) [英訳],IN,"english, translated",kuro,kuroquis,doujinshi,kuroko no basuke,"taiga kagami, daiki aomine","sweating, ahegao, anal, dark skin, males only, yaoi, blowjob, muscle",38,2016-03-09 00:59:54,2016-03-09 07:59:54,2025-03-02 06:23:27
158141,[Moekorodo (Norio Minami)] Teitoku no Sei Kantai san  (Kantai Collection -KanColle-) [Digital],[萌殺堂 (矩尾ミナミ)] 提督の性艦隊 参 (艦隊これくしょん -艦これ-) [DL版],Teitoku no Sei Kantai san,japanese,norio minami,moekorodo,doujinshi,kantai collection,"nagato, kumano, yuubari, arare, kasumi, asashio, teitoku, suzuya, arashio, michishio, ooshio","group, nakadashi, harem, lolicon, stockings, pantyhose",14,2016-03-09 01:24:29,2016-03-09 08:24:29,2025-03-02 06:23:27
158142,[Moekorodo (Norio Minami)] Teitoku no Sei Kantai shi (Kantai Collection -KanColle-) [Digital],[萌殺堂 (矩尾ミナミ)] 提督の性艦隊 肆 (艦隊これくしょん-艦これ-) [DL版],Teitoku no Sei Kantai shi,japanese,norio minami,moekorodo,doujinshi,kantai collection,"oboro, agano, sazanami, amatsukaze, ushio, yahagi, noshiro, taihou, teitoku, akebono, sakawa","nakadashi, harem, lolicon, stockings",14,2016-03-09 01:25:00,2016-03-09 08:25:00,2025-03-02 06:23:28
158143,[Moekorodo (Norio Minami)] Teitoku no Sei Kantai go (Kantai Collection -KanColle-) [Digital],[萌殺堂 (矩尾ミナミ)] 提督の性艦隊 伍 (艦隊これくしょん-艦これ-) [DL版],Teitoku no Sei Kantai go,japanese,norio minami,moekorodo,doujinshi,kantai collection,"houshou, shigure, naka, sendai, harusame, jintsuu, yuudachi, teitoku, murasame","nakadashi, harem, lolicon",14,2016-03-09 01:27:07,2016-03-09 08:27:07,2025-03-02 06:23:28
