ID,EN_TITLE,JP_TITLE,CLEAN_TITLE,LANGUAGE,ARTIST,GROUP_NAME,CATEGORY,PARODY,CHARACTER,TAGS,PAGES,UPLOAD_DATE,FORMATTED_DATE,SCRAPED_DATE
158692,(C89) [Joujou Tenki (Heguri)] Jokyoukou wa Hoshi ni Aisaretai (Jojo's Bizarre Adventure),(C89) [上々天気 (へぐり)] 女教皇は星に愛されたい (ジョジョの奇妙な冒険),Jokyoukou wa Hoshi ni Aisaretai,japanese,heguri,joujou tenki,doujinshi,jojos bizarre adventure,"jotaro kujo, midler","futanari, big breasts, shotacon, male on dickgirl, sole dickgirl",22,2016-03-11 04:17:08,2016-03-11 11:17:08,2025-03-02 06:30:04
158693,(C89) [Saboten Binta (Kawakami Kou)] Kurousagi ga Shirousagi ni Nacchau Sou desu yo!? (Mondaiji-tachi ga Isekai kara Kuru Sou desu yo?),(C89) [サボテンビンタ (河上康)] 黒ウサギが白ウサギになっちゃうそうですよ!? (問題児たちが異世界から来るそうですよ?),Kurousagi ga Shirousagi ni Nacchau Sou desu yo!?,japanese,kawakami kou,saboten binta,doujinshi,mondaiji-tachi ga isekai kara kuru sou desu yo,kurousagi,"big breasts, triple penetration, group, double vaginal, anal, hairy, double penetration, bunny girl, stockings, mosaic censorship, dilf, bbm",21,2016-03-11 04:17:45,2016-03-11 11:17:45,2025-03-02 06:30:05
158694,[Minion] SECOND RARE (Lolita Dreamy Drip) [Chinese] [贝尔西行寺个人汉化] [Digital],[みにおん] SECOND RARE (ロリどりみどり) [中国翻訳] [DL版],SECOND RARE,"translated, chinese",minion,,manga,,,"group, lolicon, rape",21,2016-03-11 04:21:21,2016-03-11 11:21:21,2025-03-02 06:30:05
158695,[Orange Peels (Ore P 1-gou)] Honto ni Chotto dake Kowai Youkai Otogibanashi -Akaname Hen- [Chinese] [無邪気漢化組] [Digital],[オレンジピールズ (俺P1号)] 本当にちょっとだけ怖い 妖怪お伽話 -あかなめ編- [中国翻訳] [DL版],Honto ni Chotto dake Kowai Youkai Otogibanashi,"translated, chinese",ore p 1-gou,orange peels,doujinshi,,,"business suit, big breasts, group, big ass, ahegao, bondage, tickling, full color, mosaic censorship, tentacles, shotacon",37,2016-03-11 04:22:25,2016-03-11 11:22:25,2025-03-02 06:30:07
158696,(C86) [Hibi Rakuraku (Aoki Kanji)] Momioka no Hatsujou | Momioka's Horniness (To LOVE-Ru) [Chinese] [癡漢個人漢化],(C86) [日日楽楽 (青木幹治)] 籾岡の発情 (To LOVEる -とらぶる-) [中国翻訳],Momioka no Hatsujou | Momioka's Horniness,"translated, chinese",aoki kanji,hibi rakuraku,doujinshi,to love-ru,"risa momioka, rito yuuki","handjob, schoolboy uniform, schoolgirl uniform, bondage, sole female",30,2016-03-11 04:23:17,2016-03-11 11:23:17,2025-03-02 06:30:08
158697,[Kamino Ryu-ya] Eroi Ko tte Omowarechau kana [Chinese] [篆儀通文書坊漢化],[上乃龍也] エロい娘って思われちゃうかな [中国翻訳],Eroi Ko tte Omowarechau kana,"translated, chinese",kamino ryu-ya,,manga,,,"sundress, handjob, leg lock, big breasts, garter belt, nakadashi, anal, sex toys, x-ray, incest, tankoubon, stockings, sister, blowjob",200,2016-03-11 04:28:54,2016-03-11 11:28:54,2025-03-02 06:30:08
158698,"[Tankguy, ROZER] A World That I Rule Ch.01-13 [English] (Game of Scanlation) (Ongoing)","[탱크가이, ROZER] 내가 지배하는 세상",A World That I Rule Ch.01-13,"english, translated",rozer,,manga,,,"elf, full color",253,2016-03-11 04:37:46,2016-03-11 11:37:46,2025-03-02 06:30:09
158699,[Agata] Iinazuke wa Gouhou | Betrothed are Fair Game (Manga Bangaichi 2016-03) [English] {5 a.m.},[アガタ] 許嫁は合法 (漫画ばんがいち 2016年3月号) [英訳],Iinazuke wa Gouhou | Betrothed are Fair Game,"english, translated",agata,,manga,,,"virginity, big breasts, big ass, nakadashi, ahegao, femdom, hairy, defloration, mosaic censorship, rape, shotacon, sole female, sole male",20,2016-03-11 04:40:55,2016-03-11 11:40:55,2025-03-02 06:30:10
158700,(C89) [Mr.Rabbit (Sakofu)] SuzuKuma Futanarix (Kantai Collection -KanColle-),(C89) [Mr.Rabbit (さこふ)] 鈴熊ふたなりックス (艦隊これくしょん-艦これ-),SuzuKuma Futanarix,japanese,sakofu,mr.rabbit,doujinshi,kantai collection,"kumano, suzuya","futanari, nakadashi, x-ray, stockings",26,2016-03-11 04:41:49,2016-03-11 11:41:49,2025-03-02 06:30:10
158701,[DOZA Village (Dozamura)] Katekyo-saki no Loli Twinte ga Bitch na Ueni S ni Mezamete Komaru,[DOZA Village (どざむら)] カテキョ先のロリツインテがビッチな上にSに目覚めてこまる,Katekyo-saki no Loli Twinte ga Bitch na Ueni S ni Mezamete Komaru,japanese,dozamura,doza village,doujinshi,,,"garter belt, netorare, femdom, bondage, lolicon, x-ray, footjob, full color, tanlines, stockings, pantyhose, cbt, dilf, bbm",84,2016-03-11 04:56:40,2016-03-11 11:56:40,2025-03-02 06:30:11
158702,(SC2016 Winter) [Hirahira (Hirari)] Dorei-chan to no Saisho no Hanashi (Dorei to no Seikatsu -Teaching Feeling-),(サンクリ2016 Winter) [ひらひら (ひらり)] 奴隷ちゃんとの最初の話 (奴隷との生活 -Teaching Feeling-),Dorei-chan to no Saisho no Hanashi,japanese,hirari,hirahira,doujinshi,dorei to no seikatsu,sylvie,"scar, stockings, sole female, sole male",18,2016-03-11 04:57:19,2016-03-11 11:57:19,2025-03-02 06:30:11
158703,(CT27) [Tadaichidono (Haiboku)] Urakan -Roryuu urakan 36shiki- (Ikkitousen),(こみトレ27) [ただ一度の (敗北)] うらかん～呂流裏姦三十六式 (一騎当千),Urakan,japanese,haiboku,tadaichidono,doujinshi,ikkitousen,"shimei ryomou, housen ryofu, kanu unchou","futanari, big breasts, group, schoolgirl uniform, anal, dark skin, x-ray, double penetration, eyepatch, blowjob, dickgirl on dickgirl",34,2016-03-11 04:58:17,2016-03-11 11:58:17,2025-03-02 06:30:12
158704,(C89) [Tousen Soudou (Tousen)] Bara Niku! 2 (Rozen Maiden),(C89) [冬扇草堂 (冬扇)] ばらにく!2 (ローゼンメイデン),Bara Niku! 2,japanese,tousen,tousen soudou,doujinshi,rozen maiden,"shinku, suigintou","futanari, big breasts, group, full censorship, huge breasts, lactation, dick growth",22,2016-03-11 04:58:57,2016-03-11 11:58:57,2025-03-02 06:30:13
158705,(CCOSaka104) [Kanarukan (Kanano Ayu)] LOVE ME NOW! (UN-GO),(CC大阪104) [歌鳴館 (奏乃あゆ)] LOVE ME NOW! (UN-GO),LOVE ME NOW!,japanese,kanano ayu,kanarukan,doujinshi,un-go,inga,"schoolboy uniform, glasses, anal, bondage, crossdressing, footjob, males only, yaoi, stockings, pantyhose, paizuri, tomgirl, shotacon",26,2016-03-11 05:59:45,2016-03-11 12:59:45,2025-03-02 06:30:14
158706,(SC2016 Winter) [Mantobi (Hashimoto)] Shironyanko (Shironeko Project),(サンクリ2016 Winter) [まんとび (橋本)] シロニャンコ (白猫プロジェクト),Shironyanko,japanese,hashimoto,mantobi,doujinshi,shironeko project,,"sole female, sole male",17,2016-03-11 06:00:28,2016-03-11 13:00:28,2025-03-02 06:30:14
158707,(C89) [NERCO (Koikawa Minoru)] Shameimaru in Yamagoya (Touhou Project),(C89) [NERCO (恋河ミノル)] 射命丸 in 山小屋 (東方Project),Shameimaru in Yamagoya,japanese,koikawa minoru,nerco,doujinshi,touhou project,aya shameimaru,"ahegao, anal, x-ray, full color, stockings, gokkun, rape, blackmail",22,2016-03-11 06:01:05,2016-03-11 13:01:05,2025-03-02 06:30:15
158708,(C89) [Pigeon Blood (Asou Shin)] Kyuujitsu Zenya (Touhou Project),(C89) [鳩血 (麻生シン)] 休日前夜 (東方Project),Kyuujitsu Zenya,japanese,asou shin,pigeon blood,doujinshi,touhou project,"hong meiling, sakuya izayoi","maid, futanari, leg lock, anal, sex toys, double penetration, stockings",18,2016-03-11 06:01:38,2016-03-11 13:01:38,2025-03-02 06:30:15
158709,(C88) [Kitsune to Budou (Kurona)] Kyoushuu Nyannyan (Touhou Project),(C88) [きつねとぶどう (くろな)] 強襲娘々 (東方Project),Kyoushuu Nyannyan,japanese,kurona,kitsune to budou,doujinshi,touhou project,seiga kaku,"hairy, x-ray",14,2016-03-11 06:02:02,2016-03-11 13:02:02,2025-03-02 06:30:16
158710,(Kouroumu 10) [Kaokuba (Shinyashiki)] YariSana (Touhou Project),(紅楼夢10) [家屋場 (新屋敷)] やりさな (東方Project),YariSana,japanese,shinyashiki,kaokuba,doujinshi,touhou project,sanae kochiya,"big breasts, stockings, paizuri",18,2016-03-11 06:02:31,2016-03-11 13:02:31,2025-03-02 06:30:17
158711,"(Kouroumu 9) [Nekonokone, TLG (Takeyuu, bowalia)] Udon no Zu (Touhou Project)",(紅楼夢9) [TLG、ねこのこね (bowalia、タケユウ)] 優曇のず (東方Project),Udon no Zu,japanese,"bowalia, takeyuu","tlg, nekonokone",doujinshi,touhou project,reisen udongein inaba,"lolicon, bunny girl, stockings, bukkake, school swimsuit, sole female",26,2016-03-11 06:06:19,2016-03-11 13:06:19,2025-03-02 06:30:18
158712,"(C89) [Area7 (Kinata)] Umikaze, Ganbarimasu! (Kantai Collection -KanColle-) [Chinese] [CE家族社]",(C89) [えりあ7 (葵奈太)] 海風、頑張ります! (艦隊これくしょん -艦これ-) [中国翻訳],"Umikaze, Ganbarimasu!","translated, chinese",kinata,area7,doujinshi,kantai collection,"teitoku, kawakaze, umikaze","cunnilingus, nakadashi, military, yuri, stockings, bisexual",38,2016-03-11 06:07:26,2016-03-11 13:07:26,2025-03-02 06:30:19
158713,(Jigoku no Tomoshibi 6) [DUMMY.N (Nemusugiruko)] Sake to Koi ni Nomareru Bekarazu. (Hoozuki no Reitetsu),(地獄の灯火 六) [DUMMY.N (ねむすぎるこ)] 酒と恋に飲まれるべからず。 (鬼灯の冷徹),Sake to Koi ni Nomareru Bekarazu.,japanese,nemusugi ruko,dummy.n,doujinshi,hoozuki no reitetsu,"hakutaku, hoozuki","oni, males only, yaoi",47,2016-03-11 06:08:35,2016-03-11 13:08:35,2025-03-02 06:30:20
158714,(RTS!!5) [MOBRIS (Tomoharu)] Neko Otoko Ichizoku no Koubi Report (Haikyuu!!),(RTS!!5) [MOBRIS (トモハル)] 猫男一族の交尾レポート (ハイキュー!!),Neko Otoko Ichizoku no Koubi Report,japanese,tomoharu,mobris,doujinshi,haikyuu,"kenma kozume, tetsurou kuroo","catboy, males only, yaoi",45,2016-03-11 06:17:21,2016-03-11 13:17:21,2025-03-02 06:30:20
158715,(C87) [DAIRA (Himeno)] MoreMore HAPPY TRIP! (Yowamushi Pedal),(C87) [DAIRA (ヒメノ)] MoreMore HAPPY TRIP! (弱虫ペダル),MoreMore HAPPY TRIP!,japanese,himeno,daira,doujinshi,yowamushi pedal,"sakamichi onoda, yuusuke makishima","glasses, anal, kimono, males only, yaoi",31,2016-03-11 06:18:11,2016-03-11 13:18:11,2025-03-02 06:30:21
158716,(Neko Masshigura! 3) [Babaroa Peropero (Ichi)] Kimi to Yume no Tsuzuki o. (Haikyuu!!),(ネコ・マっしぐら!3) [ババロアペロペロ (いち)] キミと夢の続きを。 (ハイキュー!!),Kimi to Yume no Tsuzuki o.,japanese,ichi,,doujinshi,haikyuu,"morisuke yaku, lev haiba","males only, yaoi",23,2016-03-11 06:18:49,2016-03-11 13:18:49,2025-03-02 06:30:21
158717,(C88) [Megane (Hobi)] DanceAround (Haikyuu!!),(C88) [Megane (ホビ)] DanceAround (ハイキュー!!),DanceAround,japanese,hobi,megane,doujinshi,haikyuu,"koutaro bokuto, keiji akaashi","males only, yaoi",27,2016-03-11 06:19:28,2016-03-11 13:19:28,2025-03-02 06:30:22
158718,[Shihachiro] Toaru Hi no Yorimichi (COMIC HOTMiLK 2015-07) [Chinese],[しはちろ] とある日の寄り道 (コミックホットミルク 2015年7月号) [中国翻訳],Toaru Hi no Yorimichi,"translated, chinese",shihachiro,,manga,,,"full censorship, schoolgirl uniform, full color",9,2016-03-11 06:19:50,2016-03-11 13:19:50,2025-03-02 06:30:23
158719,[Shihachiro] Ghost ~Toaru Hi no Kyounetsu~ (COMIC HOTMiLK 2015-10) [Chinese],[しはちろ] ゴースト～とある日の狂熱～ (コミックホットミルク 2015年10月号) [中国翻訳],Ghost,"translated, chinese",shihachiro,,manga,,,"big breasts, full censorship",21,2016-03-11 06:20:26,2016-03-11 13:20:26,2025-03-02 06:30:23
158720,(C88) [Orange Caramel. (Hatori Yuzuca)] 0613 (Haikyuu!!) [Incomplete],(C88) [オレンジキャラメル。 (はとりゆず果)] 0613 (ハイキュー!!) [ページ欠落],0613,japanese,hatori yuzuca,orange caramel.,doujinshi,haikyuu,"tobio kageyama, koushi sugawara","males only, yaoi, incomplete",34,2016-03-11 06:21:15,2016-03-11 13:21:15,2025-03-02 06:30:24
158721,"(Boku to Koi no Keiji) [Hourou (Michinoku)] Sakura Hirahira, (Haikyuu!!)",(ボクと恋の啓示) [放浪 (みちのく)] さくらひらひら、 (ハイキュー!!),"Sakura Hirahira,",japanese,michinoku,hourou,doujinshi,haikyuu,"koutaro bokuto, keiji akaashi","males only, yaoi",24,2016-03-11 06:21:49,2016-03-11 13:21:49,2025-03-02 06:30:24
158722,"(SPARK10) [Ruby (Ai)] Chanto, Ii, Kara. (Haikyuu!!)",(SPARK10) [Ruby (藍)] ちゃんと、イイ、から。 (ハイキュー!!),"Chanto, Ii, Kara.",japanese,ai,ruby,doujinshi,haikyuu,"koutaro bokuto, tetsurou kuroo","anal, males only, yaoi, muscle",27,2016-03-11 06:22:29,2016-03-11 13:22:29,2025-03-02 06:30:25
158723,[Studio Mizuyokan (Higashitotsuka Raisuta)] DARK SLAVES HARDCORE DL (PreCure Series),[スタジオみずよーかん (東戸塚らいすた)] DARK SLAVES HARDCORE DL ((プリキュアシリーズ),DARK SLAVES HARDCORE DL,japanese,higashitotsuka raisuta,studio mizuyokan,doujinshi,"go princess precure, pretty cure, heartcatch precure, fresh precure","cure moonlight, dark precure, eas, twilight","big breasts, gag, corruption, unusual pupils, mmf threesome, corset, group, public use, big ass, nakadashi, anal, bondage, thigh high boots, x-ray, latex, double penetration, pillory, lactation, bukkake, mind break, mosaic censorship, blindfold, collar, slave",509,2016-03-11 07:33:33,2016-03-11 14:33:33,2025-03-02 06:30:27
158724,[Kishimoto Saisi] naruto ninja biography vol.09 (naruto) [chinese],[岸本齋史] 火影忍傳 (ナルト) 9 [中国翻訳],naruto ninja biography vol.09,"translated, chinese",,,manga,naruto,"naruto uzumaki, sakura haruno, tsunade",anthology,157,2016-03-11 07:54:37,2016-03-11 14:54:37,2025-03-02 06:30:27
158726,(C65) [accede@rabbit (Patriciana Kikuchi)] in WHITE (Gundam SEED),(C65) [accede@rabbit (パトリシアーナ菊池)] in WHITE (機動戦士ガンダムSEED),in WHITE,japanese,patriciana kikuchi,accede at rabbit,doujinshi,gundam seed,"miguel aiman, nicol amalfi, olor kudenbru, rau le creuset","eyemask, males only, yaoi",43,2016-03-11 07:56:09,2016-03-11 14:56:09,2025-03-02 06:30:29
158727,"[bolze. (Maru Mikan)] O, My Sadness Episode #4 Kaiteiban (Ah! My Goddess) [English] [EHCOVE]","[bolze. (○蜜柑)] O, My Sadness Episode #4 改訂版 (ああっ女神さまっ) [英訳]","O, My Sadness Episode #4 Kaiteiban","english, translated",rit.,bolze.,doujinshi,ah my goddess,skuld,"lolicon, mind break, rape, blowjob",64,2016-03-11 08:04:36,2016-03-11 15:04:36,2025-03-02 06:30:29
158728,"[Ogu] Onii-chan, Outou Suru! | Onii-chan, respond! (Shoujo Shiki Fuzoku Ogu Hinyoukika) [English] [ATF]",[おぐ] お兄ちゃん、応答する！ (少女式付属おぐ泌尿器科) [英訳],"Oniichan, respond!","english, translated",ogu,,manga,,,"inseki, anal, lolicon, incest, sister, sole female, sole male",25,2016-03-11 08:09:34,2016-03-11 15:09:34,2025-03-02 06:30:30
158729,[RPG Company 2 (Aono Rokugou)] Hikari Zettai no Kiki (Digimon Adventure 02) [English] [Digital],[RPGカンパニー2 (青野六剛)] ヒカリ絶対の危機 (デジモンアドベンチャー 02) [英訳] [DL版],Hikari Zettai no Kiki,"english, translated",aono rokugou,rpg company 2,doujinshi,digimon adventure,kari kamiya,"mmf threesome, group, glasses, anal, lolicon, full color, assjob, mosaic censorship, blackmail, sole female",26,2016-03-11 08:13:07,2016-03-11 15:13:07,2025-03-02 06:30:30
158730,[Kudou Hisashi] Hajimete ga Ippai (Comic LO 2016-02) [English] [biribiri],[くどうひさし] はじめてがいっぱい (COMIC LO 2016年2月号) [英訳],Hajimete ga Ippai,"english, translated",kudou hisashi,,manga,,,"nakadashi, tutor, lolicon, x-ray, defloration, stockings, mosaic censorship, sole male",32,2016-03-11 08:18:50,2016-03-11 15:18:50,2025-03-02 06:30:31
158731,[Insane] Love Parameter Ch.1-26 (English) (YoManga) (Ongoing),,Love Parameter Ch.1-26,"english, translated",,,doujinshi,,,"full censorship, glasses, story arc, scanmark, bondage, full color",374,2016-03-11 08:29:31,2016-03-11 15:29:31,2025-03-02 06:30:32
158732,(Zennin Shuuketsu 2) [Ring memo (Oretto)] Watashi No Hajimete (Naruto),(全忍集結2) [Ring memo (おれっと)] わたしのはじめて (NARUTO -ナルト-),Watashi No Hajimete,japanese,oretto,ring memo,doujinshi,naruto,"naruto uzumaki, hinata hyuga","bandages, big breasts, ahegao, sole female, sole male",87,2016-03-11 08:32:20,2016-03-11 15:32:20,2025-03-02 06:30:33
158733,(C89) [In The Sky (Nakano Sora)] Aki to Matsuri to Urakaze to (Kantai Collection -KanColle-) [English] [XCX Scans],(C89) [In The Sky (中乃空)] 秋と祭りと浦風と (艦隊これくしょん -艦これ-) [英訳],Aki to Matsuri to Urakaze to,"english, translated",nakano sora,in the sky,doujinshi,kantai collection,"hamakaze, teitoku, urakaze","nakadashi, kimono, x-ray",27,2016-03-11 08:33:15,2016-03-11 15:33:15,2025-03-02 06:30:33
158734,[Minako Nami] Nono-chan to Mama | Nono-chan and Mama (Futanari Excellent! 1) [English] [Tigoris],[みなこなみ] ノノちゃんとママ (ふたなりエクセレント! 1) [英訳],Nonochan and Mama,"english, translated",minako nami,,manga,,,"futanari, handjob, milf, nakadashi, femdom, mother, incest, paizuri, daughter, sole female, sole dickgirl",18,2016-03-11 08:33:49,2016-03-11 15:33:49,2025-03-02 06:30:34
158736,[Orange Peels (Ore P 1-gou)] Honto ni Chotto dake Kowai Youkai Otogibanashi -Akaname Hen- [Digital],[オレンジピールズ (俺P1号)] 本当にちょっとだけ怖い 妖怪お伽話 -あかなめ編- [DL版],Honto ni Chotto dake Kowai Youkai Otogibanashi,japanese,ore p 1-gou,orange peels,doujinshi,,,"big breasts, group, nakadashi, ahegao, bondage, foot licking, tickling, monster, x-ray, full color, shotacon",66,2016-03-11 08:45:36,2016-03-11 15:45:36,2025-03-02 06:30:35
158737,[Colt (LEE)] KemoMimi Onsen e Youkoso Ver1.1 [Chinese] [无毒汉化组X無邪気漢化組] [Digital],[Colt (LEE)] ケモミミ温泉へようこそ Ver1.1 [中国翻訳] [DL版],KemoMimi Onsen e Youkoso Ver1.1,"translated, chinese",lee,colt,doujinshi,,,"group, full censorship, ffm threesome, lolicon, oppai loli, raccoon girl, fox girl",28,2016-03-11 08:50:19,2016-03-11 15:50:19,2025-03-02 06:30:36
158738,[Umayahara] Shien S Plus (Fire Emblem Kakusei),[ウマヤハラ] 支援Sプラス (ファイアーエムブレム 覚醒),Shien S Plus,japanese,,umayahara,doujinshi,fire emblem awakening,"robin, lucina","full color, mosaic censorship",16,2016-03-11 08:50:49,2016-03-11 15:50:49,2025-03-02 06:30:37
158739,(COMIC1☆9) [Rosapersica (Ichinomiya)] Yoru Yahagi (Kantai Collection -KanColle-) [Chinese] [嗶咔嗶咔漢化組],(COMIC1☆9) [Rosapersica (一ノ宮)] ヨルヤハギ (艦隊これくしょん -艦これ-) [中国翻訳],Yoru Yahagi,"translated, chinese",ichinomiya,rosapersica,doujinshi,kantai collection,"yahagi, teitoku","military, blowjob, sole female, sole male",43,2016-03-11 08:52:02,2016-03-11 15:52:02,2025-03-02 06:30:38
158741,(C84) [Mikenekodou (Muten)] Hebi Hime-sama to Warui Mushi (One Piece) [Chinese] [沒有漢化],(C84) [三毛猫堂 (武天)] 蛇姫さまと悪い虫 (ワンピース) [中国翻訳],Hebi Hime-sama to Warui Mushi,"translated, chinese",muten,mikenekodou,doujinshi,one piece,"boa hancock, marguerite","strap-on, group, females only, anal, yuri, defloration, double penetration, mosaic censorship",38,2016-03-11 08:59:02,2016-03-11 15:59:02,2025-03-02 06:30:39
158742,(Shota Scratch 27) [M2-HERO (Kagemusha)] Tensai-kun Fetishism Ride (Big Hero 6) [Chinese] [沒有漢化],(ショタスクラッチ27) [M2-HERO (影武者)] 天才君フェチズムライド (ベイマックス) [中国翻訳],Tensai-kun Fetishism Ride,"translated, chinese",kagemusha,m2-hero,doujinshi,big hero 6,,"robot, males only, yaoi, shotacon",18,2016-03-12 04:46:10,2016-03-12 11:46:10,2025-03-02 06:30:40
158743,"[Circle Ao Kurage (Ao Kurage)] Ma, Mazoku wa Toilet toka Ikanaishi!! | D-Demons Don't use the Bathroom!! [English] [Digital]",[サークル青くらげ (青くらげ)] ま、魔族はトイレとか行かないしっ!! [英訳] [DL版],"Ma, Mazoku wa Toilet toka Ikanaishi!! | D-Demons Don't use the Bathroom!!","english, translated",ao kurage,circle ao kurage,doujinshi,,,"urination, demon girl, lolicon, minigirl, non-h, stockings",42,2016-03-12 04:51:56,2016-03-12 11:51:56,2025-03-02 06:30:40
158744,(C81) [Shounen Zoom (Shigeru)] Manga Shounen Zoom Vol. 04 [English] {Shotachan},(C81) [少年ズーム (しげる)] 漫画少年ズーム VOL.04 [英訳],Manga Shounen Zoom Vol. 04,"english, translated",shigeru,shounen zoom,doujinshi,,,"handjob, kissing, glasses, masturbation, anal, sleeping, males only, yaoi, blowjob, shotacon",38,2016-03-12 04:58:46,2016-03-12 11:58:46,2025-03-02 06:30:41
158745,[Hinasaki Yo] Suki na Hito ga Dekita! - I've got someone special! [Chinese] [嗶咔嗶咔漢化組] [Digital],[雛咲葉] 好きな人ができた！ [中国翻訳] [DL版],Suki na Hito ga Dekita! - I've got someone special!,"translated, chinese",hinasaki yo,,manga,,,"big breasts, miko, glasses, kimono, defloration, tankoubon, stockings, small breasts, bloomers, school swimsuit",225,2016-03-12 06:37:49,2016-03-12 13:37:49,2025-03-02 06:30:42
158746,(CiNDERELLA☆STAGE 4 STEP) [NxC Thermit (Nohito)] Konna nimo Itooshii 2 (THE IDOLM@STER CINDERELLA GIRLS),(シンデレラ☆ステージ4STEP) [N×Cてるみっと (Nohito)] こんなにも愛おしい2 (アイドルマスター シンデレラガールズ),Konna nimo Itooshii 2,japanese,nohito,nxcthermit,doujinshi,the idolmaster,"fumika sagisawa, producer","big ass, gokkun, sole female, sole male",26,2016-03-12 06:38:51,2016-03-12 13:38:51,2025-03-02 06:30:43
158747,(Graket 2) [HECHOCHO (ABO)] Karamete Royal Sex (Granblue Fantasy),(グラケット2) [ヘ蝶々 (ABO)] からめて高貴嬢事 (グランブルーファンタジー),Karamete Royal Sex,japanese,abo,hechocho,doujinshi,granblue fantasy,"heles, gran","metal armor, paizuri, sole female, sole male",25,2016-03-12 06:39:37,2016-03-12 13:39:37,2025-03-02 06:30:43
158748,[Kakitsubata no Yashiro (Kakitsubata Kanae)] Soukuu no Chouki-tachi - One's Favorite Mistress of Grand Blue Sky (Granblue Fantasy),[杜若社 (杜若かなえ)] 蒼空の寵姫たち (グランブルーファンタジー),Soukuu no ChoukiOne's Favorite Mistress of Grand Blue Sky,japanese,kakitsubata kanae,kakitsubata no yashiro,doujinshi,granblue fantasy,heles,"big breasts, sole female, sole male",18,2016-03-12 06:40:12,2016-03-12 13:40:12,2025-03-02 06:30:44
158749,"(COMIC1☆9) [Kikkaya (Uesugi Kyoushirou, Sakaki Yuino)] Sumimasen. (THE IDOLM@STER CINDERELLA GIRLS) [English]",(COMIC1☆9) [橘花屋 (上杉響士郎、榊ゆいの) すみません。 (アイドルマスター シンデレラガールズ) [英訳],Sumimasen.,"english, translated","sakaki yuino, uesugi kyoushirou",kikkaya,doujinshi,the idolmaster,"producer, uzuki shimamura","fingering, sole female, sole male",22,2016-03-12 06:40:52,2016-03-12 13:40:52,2025-03-02 06:30:45
158750,(C86) [HIYOKO CROWN (Shinano Yura)] Aino Minako XX-sai to Car Sex (Bishoujo Senshi Sailor Moon) [Chinese] [滑稽汉化组],(C86) [HIYOKO CROWN (しなの優良)] 愛野美奈子XX歳とカーセックス (美少女戦士セーラームーン) [中国翻訳],Aino Minako XX-sai to Car Sex,"translated, chinese",shinano yura,hiyoko crown,doujinshi,sailor moon,"minako aino, sailor venus","magical girl, schoolgirl uniform, prostitution, tiara, dilf, bbm",23,2016-03-12 06:41:35,2016-03-12 13:41:35,2025-03-02 06:30:45
158751,[Teyantei] Sunnyday After tomorrow (Fate/stay night),[てやん亭] Sunnyday After tomorrow (Fate/stay night),Sunnyday After tomorrow,japanese,hagane tetsu,teyantei,doujinshi,fate stay night,"rin tosaka, saber",full censorship,3,2016-03-12 06:41:43,2016-03-12 13:41:43,2025-03-02 06:30:46
158752,(FF24) [Kanden Shoujo Chuuihou (Miyuki Rei)] Nagato’s Special Repairs (Kantai Collection -KanColle-) [Chinese],(FF24) [感電少女注意報 (深雪零)] 長門の特別維修 (艦隊これくしょん -艦これ-) [中国語],Nagato’s Special Repairs,chinese,miyuki rei,kanden shoujo chuuihou,doujinshi,kantai collection,"nagato, teitoku","big breasts, uncensored, nakadashi, anal, sex toys, military, full color, stockings, mecha girl",18,2016-03-12 06:42:13,2016-03-12 13:42:13,2025-03-02 06:30:47
158753,(C88) [Youmusya (Gengorou)] Kiyoshimo mo! (Kantai Collection -KanColle-) [Chinese] [嗶咔嗶咔漢化組],(C88) [遥夢社 (源五郎)] きよしもも! (艦隊これくしょん -艦これ-) [中国翻訳],Kiyoshimo mo!,"translated, chinese",gengorou,youmusya,doujinshi,kantai collection,"kiyoshimo, musashi","glasses, dark skin, lolicon, pantyhose",31,2016-03-12 06:47:17,2016-03-12 13:47:17,2025-03-02 06:30:47
158754,[Chiba Tetsutarou] Mushi Yuugi Ch. 1 [Chinese] [Digital],[千葉哲太郎] 虫遊戯 第1話 [中国翻訳] [DL阪],Mushi Yuugi Ch. 1,"translated, chinese",chiba tetsutarou,,manga,,,"bestiality, nakadashi, insect, sole female",25,2016-03-12 06:52:02,2016-03-12 13:52:02,2025-03-02 06:30:48
158755,[Chiba Tetsutarou] Mushi Yuugi Ch. 2 [Chinese] [Digital],[千葉哲太郎] 虫遊戯 第2話 [中国翻訳] [DL版],Mushi Yuugi Ch. 2,"translated, chinese",chiba tetsutarou,,manga,,,"bestiality, stockings, insect, sole female",24,2016-03-12 06:55:04,2016-03-12 13:55:04,2025-03-02 06:30:49
158756,(C88) [Rosapersica (Ichinomiya)] Yoru Yahagi 2 (Kantai Collection -KanColle-) [Chinese] [嗶咔嗶咔漢化組],(C88) [Rosapersica (一ノ宮)] ヨルヤハギ2 (艦隊これくしょん -艦これ-) [中国翻訳],Yoru Yahagi 2,"translated, chinese",ichinomiya,rosapersica,doujinshi,kantai collection,"yahagi, teitoku","sole female, sole male",42,2016-03-12 06:56:17,2016-03-12 13:56:17,2025-03-02 06:30:50
158757,[Arsenal] Hatsujou Sex Days | 發情的SEX Days [Chinese],[アーセナル] 発情セックスDays [中国翻訳],Hatsujou Sex Days | 發情的SEX Days,"translated, chinese",arsenal,,manga,,,"handjob, big breasts, schoolgirl uniform, nakadashi, x-ray, tankoubon, stockings, paizuri, bukkake, school swimsuit, blowjob",197,2016-03-12 07:14:48,2016-03-12 14:14:48,2025-03-02 06:30:50
