ID,EN_TITLE,JP_TITLE,CLEAN_TITLE,LANGUAGE,ARTIST,GROUP_NAME,CATEGORY,PARODY,CHARACTER,TAGS,PAGES,UPLOAD_DATE,FORMATTED_DATE,SCRAPED_DATE
240316,[Yohane (Kobiyuun)] Zuihou Nisshi 4 (Kantai Collection -KanColle-) [Digital],[夜羽根 (こびゆうん)] 瑞鳳日誌4 (艦隊これくしょん -艦これ-) [DL版],Zuihou Nisshi 4,japanese,kobiyuun,,doujinshi,kantai collection,"teitoku, zuihou","group, ffm threesome, lolicon, multi-work series, incest, daughter, sole male, oyakodon, ponytail",22,2018-07-24 02:15:13,2018-07-24 09:15:13,2025-03-03 10:58:14
240317,[Mukumukumoon (Mogiri)] Zuihou Kyousei Kanin Nishiki (Kantai Collection -KanColle-) [Digital],[むくむくむーん (もぎり)] 瑞鳳強制姦淫・二式 (艦隊これくしょん -艦これ-) [DL版],Zuihou Kyousei Kanin Nishiki,japanese,mogiri,mukumukumoon,doujinshi,kantai collection,zuihou,"lolicon, rape, sole female, ponytail",20,2018-07-24 02:19:20,2018-07-24 09:19:20,2025-03-03 10:58:14
240318,(COMIC1☆11) [EXTENDED PART (Endo Yoshiki)] Scathach-shishou ni Okasareru Hon (Fate/Grand Order) [English] [EHCOVE],(COMIC1☆11) [拡張パーツ (遠藤良危)] スカサハ師匠に犯される本 (Fate/Grand Order) [英訳],Scathach-shishou ni Okasareru Hon,"english, translated",yoshiki,extended part,doujinshi,fate grand order,"scathach, gudao","prostate massage, nakadashi, femdom, bodysuit, blowjob, sole female, sole male",23,2018-07-24 02:20:26,2018-07-24 09:20:26,2025-03-03 10:58:14
240319,[strongests (Yukimitsuki)] Tama ni wa Aisaretai!  (Kidou Senshi Gundam SEED DESTINY),[strongests (雪見月)] たまには愛されたい! (機動戦士ガンダムSEED DESTINY),Tama ni wa Aisaretai!,japanese,yukimitsuki,strongests,doujinshi,gundam seed destiny,"cagalli yula athha, kira yamato, athrun zala","mmf threesome, group, anal, yaoi, sole female, bisexual",19,2018-07-24 02:21:43,2018-07-24 09:21:43,2025-03-03 10:58:14
240320,(C76) [Charinko Fox (Yaegashi Nan)] Ookami no Kimagure Hon (Spice and Wolf),(C76) [チャリンコ狐 (八重樫南)] 狼の気まぐれ本 (狼と香辛料),Ookami no Kimagure Hon,japanese,yaegashi nan,charinko fox,doujinshi,spice and wolf,"kraft lawrence, holo","wolf girl, femdom, full color, mosaic censorship, sole female, sole male, kemonomimi",14,2018-07-24 02:22:34,2018-07-24 09:22:34,2025-03-03 10:58:14
240321,[furuike (Sumiya)] Grand Hotel Princess,[furuike (スミヤ)] Grand Hotel Princess,Grand Hotel Princess,japanese,sumiya,furuike,doujinshi,original,,"mmf threesome, group, full censorship, nakadashi, harem, bukkake, blowjob, sole female, twintails",18,2018-07-24 06:01:34,2018-07-24 13:01:34,2025-03-03 10:58:14
240322,(C91) [K2 Manhole (P)] Andira no Kouyuuki (Granblue Fantasy) [Chinese] [古戰逃兵打十億漢化],(C91) [K2マンホール (P)] アンチラの尻遊記 (グランブルーファンタジー) [中国翻訳],Andira no Kouyuuki,"translated, chinese",p senpuki,k2 manhole,doujinshi,granblue fantasy,"gran, andira","anal, lolicon, sole female, sole male, kemonomimi",35,2018-07-24 06:11:55,2018-07-24 13:11:55,2025-03-03 10:58:15
240323,[Hatomame (Ago)] Uchi no Musume no Arbeit! ANOTHER [English] [Quilliam] [Digital],[ハトマメ (顎)] うちの娘のアルバイト! ANOTHER [英訳] [DL版],Uchi no Musume no Arbeit! ANOTHER,"english, translated",ago,hatomame,doujinshi,original,,"big breasts, nurse, unusual pupils, emotionless sex, big ass, ahegao, huge breasts, x-ray, stockings, paizuri, blowjob, deepthroat, sole male",29,2018-07-24 06:13:55,2018-07-24 13:13:55,2025-03-03 10:58:14
240324,(C86) [28_works (Oomori Harusame)] KMB (Monster Hunter) [English] [SneakyTranslations],(C86) [28_works (大守春雨)] KMB (モンスターハンター) [英訳],KMB,"english, translated",oomori harusame,28works,doujinshi,monster hunter,,"sweating, nakadashi, freckles, sleeping, lolicon, defloration, rape, sole female, sole male",22,2018-07-24 06:19:15,2018-07-24 13:19:15,2025-03-03 10:58:15
240325,(C92) [Toitoikai (Toitoi)] Suzuka Choukyou Kiroku,(C92) [対々会 (といとい)] すずか調教記録,Suzuka Choukyou Kiroku,japanese,toitoi,toitoikai,doujinshi,original,,"big breasts, swimsuit, schoolgirl uniform, nakadashi, defloration, dilf, blackmail, sole female, sole male",34,2018-07-24 10:02:32,2018-07-24 17:02:32,2025-03-03 10:58:15
240326,(C91) [Shocoratie! (Shocora)] Doutei Gari Heroines (Boku no Hero Academia),(C91) [ショコラティエ! (ショコラ)] 童貞狩りヒロインズ (僕のヒーローアカデミア),Doutei Gari Heroines,japanese,shocora,shocoratie,doujinshi,my hero academia,"mina ashido, momo yaoyorozu, ochako uraraka, tenya iida","group, glasses, bondage, harem, dark skin, x-ray, sole male, dark sclera",18,2018-07-24 10:03:27,2018-07-24 17:03:27,2025-03-03 10:58:15
240327,[Kuusou] New! Type ♥ Ch. 0-1 [English] [Ancient Archon+B.E.C. Scans],[空想] 乳! Type ♥ 第0-1話 [英訳],New! Type ♥ Ch. 0-1,"english, translated",kuusou,,manga,,,"big breasts, garter belt, mmf threesome, big nipples, group, cheating, huge breasts, anal, sleeping, nipple fuck, defloration, inflation, incest, double penetration, breast expansion, tankoubon, big areolae, lactation, stockings, chinese dress, paizuri, cheerleader, rape, sister, dilf, muscle, christmas, bbm, deepthroat, gigantic breasts, ponytail, twintails",31,2018-07-24 10:05:47,2018-07-24 17:05:47,2025-03-03 10:58:15
240328,[Kazuhiro] Orc Senyou Aigan Anelf (Aijou no Injoku Elf) [Textless],[一弘] オーク専用愛玩アナフル (愛嬢の淫辱エルフ) [無字],Orc Senyou Aigan Anelf,japanese,kazuhiro,,doujinshi,,,"elf, pig man, anal, monster, stockings",22,2018-07-24 10:07:00,2018-07-24 17:07:00,2025-03-03 10:58:15
240329,[Kazuhiro] Orc Senyou Aigan Anelf | The Orc's Analfuck Pet (Aijou no Injoku Elf) [English] [Stopittarpit],[一弘] オーク専用愛玩アナフル (愛嬢の淫辱エルフ) [英訳],Orc Senyou Aigan Anelf | The Orc's Analfuck Pet,"english, translated",kazuhiro,,doujinshi,,,"elf, sweating, big breasts, double anal, orc, pig man, ahegao, anal, tall man, bondage, monster, inflation, drugs, gaping, mind break, rape, bbm, stomach deformation",23,2018-07-24 10:08:09,2018-07-24 17:08:09,2025-03-03 10:58:16
240331,(COMIC1☆13) [Kurokami Studio S (Mukouhara Shiryu)] Vtuber ni Gachi Koi Shitara Ikan no ka (Virtual YouTuber) [Chinese] [上野联邦汉化组],(COMIC1☆13) [クロカミスタジオS (むこうはらしりゅう)] Vtuberにガチ恋したらいかんのか (バーチャルYouTuber) [中国翻訳],Vtuber ni Gachi Koi Shitara Ikan no ka,"translated, chinese",mukouhara shiryu,kurokami studio s,doujinshi,,mirai akari,"emotionless sex, stockings, paizuri, sole female, ponytail",23,2018-07-24 10:10:23,2018-07-24 17:10:23,2025-03-03 10:58:16
240332,"(COMIC1☆13) [Salt choc (Naha 78)] N? Ima, Nandemo Suru tte Itta yo ne? (Fate/Grand Order) [Chinese] [德雷个人汉化]",(COMIC1☆13) [塩ちょこ (ナハ78)] ん?今、何でもするって言ったよね? (Fate/Grand Order) [中国翻訳],"N? Ima, Nandemo Suru tte Itta yo ne?","translated, chinese",naha 78,salt choc,doujinshi,fate grand order,"gudao, scheherazade","big breasts, swimsuit, dark skin, sole female, sole male",24,2018-07-24 10:11:44,2018-07-24 17:11:44,2025-03-03 10:58:16
240333,COMIC Megastore DEEP Vol. 16 [Digital],コミックメガストアDEEP Vol.16 [DL版],COMIC Megastore DEEP Vol. 16,japanese,"shijou sadafumi, takase yuu, kotoyoshi yumisuke, utamaro, ashika, ebifly, tanaka-ex, aoi hitori, nekoaka, taiban steak",,manga,,,"milf, big breasts, time stop, pregnant, nurse, bbw, group, glasses, big ass, cheating, anthology, nakadashi, huge breasts, anal, ffm threesome, crossdressing, hairy, dark skin, pubic stubble, lolicon, incest, double penetration, tanlines, aunt, yaoi, lactation, stockings, pantyhose, tomgirl, impregnation, tentacles, shotacon",204,2018-07-24 10:21:31,2018-07-24 17:21:31,2025-03-03 10:58:16
240334,[Doujin Mukashibanashi] Tsuma to Gikei ga Katte ni SEX Shiteita [chinese],[同人昔話] 妻と義兄が勝手にSEXしていた [中国翻訳],Tsuma to Gikei ga Katte ni SEX Shiteita,"translated, chinese",,doujin mukashibanashi,doujinshi,original,,"milf, netorare, full color, mosaic censorship, dilf, blackmail, sole female, bald, kemonomimi",27,2018-07-24 10:23:02,2018-07-24 17:23:02,2025-03-03 10:58:17
240335,"[Fuusen Club ""Kuroshiki!""] Paitama Tokubetsuban",[風船クラブ「黒式!」] ぱいタマ特別版,Paitama Tokubetsuban,japanese,fuusen club,fuusen club kuroshiki,doujinshi,original,,"futanari, group, anal, shemale, big balls, mosaic censorship, cbt, blowjob, big penis, male on dickgirl",35,2018-07-24 10:24:43,2018-07-24 17:24:43,2025-03-03 10:58:17
240336,[Mutsuki] Yatte... Ugoite! Dashite | 插進來…抽動吧！射精進去♥ [Chinese],[睦月] ヤって…動いて！射精して [中国翻訳],Yatte... Ugoite! Dashite | 插進來…抽動吧！射精進去♥,"translated, chinese",mutsuki,,manga,,,"inseki, schoolboy uniform, story arc, schoolgirl uniform, incest, tankoubon, stockings, sister, tomboy, ponytail",197,2018-07-24 10:34:07,2018-07-24 17:34:07,2025-03-03 10:58:17
240337,(C88) [Akari wa Honnori Tomoreba Ii (Kurokuro)] Satori-san to (Touhou Project) [Chinese] [靴下汉化组],(C88) [明かりはほんのり灯ればいい (くろくろ)] さとりさんと (東方Project) [中国翻訳],Satori-san to,"translated, chinese",kurokuro,akari wa honnori tomoreba ii,doujinshi,touhou project,satori komeiji,"elf, blowjob, sole female, sole male",20,2018-07-24 14:01:32,2018-07-24 21:01:32,2025-03-03 10:58:17
240338,[Chinshieden (Yukibana)] Splat Double (Splatoon 2) [English] [Digital],[靜雪殿 (雪華)] Splat Double (Splatoon 2) [英訳] [DL版],Splat Double,"english, translated",yukibana,chinshieden,doujinshi,splatoon,"marina, pearl","strap-on, females only, sex toys, dark skin, lolicon, yuri, double penetration",25,2018-07-24 14:08:21,2018-07-24 21:08:21,2025-03-03 10:58:17
240339,[Pecan (Makunouchi)] Slave Dogman,[ピーカン (幕野内)] スレイヴドッグマン,Slave Dogman,japanese,makunouchi,pecan,doujinshi,original,,"femdom, cbt",26,2018-07-24 14:09:35,2018-07-24 21:09:35,2025-03-03 10:58:17
240340,[Kuroi Mono (Akadama)] Zutto Issho | Together forever (Chuunibyou demo Koi ga Shitai!) [English] [DrunkenWeeb] [Digital],[黒いモノ (紅玉)] ずっといっしょ (中二病でも恋がしたい!) [英訳] [DL版],Zutto Issho | Together forever,"english, translated",akadama,kuroi mono,doujinshi,chuunibyou demo koi ga shitai,rikka takanashi,"scat, spanking, schoolboy uniform, netorare, schoolgirl uniform, ahegao, anal, sex toys, coprophagia, double penetration, stockings, eyepatch, mind break, rape, bbm",38,2018-07-24 14:13:47,2018-07-24 21:13:47,2025-03-03 10:58:17
240341,[Emori Uki] Musuko no Omocha ~Boshi o Tsunagu Haitoku no Yokubou~  [Chinese] [ssps漢化],[江森うき] 息子のおもちゃ ～母子を繋ぐ背徳の欲棒～ [中国翻訳],Musuko no Omocha,"translated, chinese",emori uki,,manga,,,"milf, big breasts, mother, full color, incest, widow, mosaic censorship, sole female, sole male",27,2018-07-24 14:15:04,2018-07-24 21:15:04,2025-03-03 10:58:17
240342,[Plum] Ojou-sama no Omiashi de  (COMIC Anthurium 2018-01) [Chinese] [兔司姬漢化組] [Digital],[ぷらむ] 御嬢様の御御足で  (COMIC アンスリウム 2018年1月号) [中国翻訳] [DL版],Ojou-sama no Omiashi de,"translated, chinese",plum,,manga,,,"schoolgirl uniform, footjob, pantyhose, sole female, sole male",26,2018-07-24 14:16:23,2018-07-24 21:16:23,2025-03-03 10:58:17
240343,[Zmey no Soukutsu (Heibon Kaeru)] SS Kuroshio | 潛水艦黑潮 (Kantai Collection -KanColle-) [Chinese] [漢化組漢化組] [Digital],[ズメイの巣窟 (平凡蛙)] えすえすくろしほ (艦隊これくしょん -艦これ-) [中国翻訳] [DL版],SS Kuroshio | 潛水艦黑潮,"translated, chinese",heibon kaeru,zmey no soukutsu,doujinshi,kantai collection,"teitoku, kuroshio","swimsuit, sole female, sole male",22,2018-07-24 14:17:35,2018-07-24 21:17:35,2025-03-03 10:58:17
240344,(CT25) [Shinshifuku Uriba (Shinshi Hadagi)] Kiriya Aoi-chan no Erohon 2 (Aikatsu!),(こみトレ25) [紳士服売場 (紳士肌着)] 霧矢あおいちゃんのエロ本2 (アイカツ!),Kiriya Aoi-chan no Erohon 2,japanese,,,doujinshi,aikatsu,,"schoolgirl uniform, lolicon, sole female, sole male, ponytail",14,2018-07-24 14:18:18,2018-07-24 21:18:18,2025-03-03 10:58:18
240345,(CT21) [Yuuen Floor (Keishiki)] Soto no Sekai wa Kowai (Touhou Project),(こみトレ21) [遊園ふろあ (系式)] 外の世界は怖い (東方Project),Soto no Sekai wa Kowai,japanese,keishiki,yuuen floor,doujinshi,touhou project,cirno,"dark skin, lolicon, sole female, sole male",17,2018-07-24 14:19:19,2018-07-24 21:19:19,2025-03-03 10:58:18
240346,(CT19) [Ginsiba. (Shieko)] Heroine Shinsatsu Monogatari (Tantei Opera Milky Holmes),(こみトレ19) [ぎんしば。 (しえっち)] ヒロイン診察物語 (探偵オペラミルキィホームズ),Heroine Shinsatsu Monogatari,japanese,,ginsiba.,doujinshi,tantei opera milky holmes,,lolicon,26,2018-07-24 14:20:45,2018-07-24 21:20:45,2025-03-03 10:58:18
240347,[HATENA-BOX (Oda Kenichi)] Double Heroine EX (Mahou Shoujo Lyrical Nanoha) [Digital],[HATENA-BOX (おだけんいち)] ダブルヒロインEX (魔法少女リリカルなのは) [DL版],Double Heroine EX,japanese,oda kenichi,hatena-box,doujinshi,mahou shoujo lyrical nanoha,"fate testarossa, nanoha takamachi",full color,16,2018-07-24 14:22:02,2018-07-24 21:22:02,2025-03-03 10:58:18
240348,(COMIC1☆11) [Pinke (Kaya)] Warspite Lv.2 (Kantai Collection -KanColle-),(COMIC1☆11) [ぴんけ (かや)] Warspite Lv.2 (艦隊これくしょん -艦これ-),Warspite Lv.2,japanese,kaya,pinke,doujinshi,kantai collection,"teitoku, warspite","crown, shotacon, sole female, sole male",21,2018-07-24 14:23:26,2018-07-24 21:23:26,2025-03-03 10:58:18
240349,(C91) [ARCHANGEL (Ayanokouji Haruka)] Kuronekokan V (Ore no Imouto ga Konna ni Kawaii Wake ga Nai),(C91) [ARCHANGEL (綾小路はるか)] 黒猫館 V (俺の妹がこんなに可愛いわけがない),Kuronekokan V,japanese,ayanokouji haruka,archangel,doujinshi,ore no imouto ga konna ni kawaii wake ga nai,ruri gokou,,22,2018-07-24 14:24:31,2018-07-24 21:24:31,2025-03-03 10:58:19
240350,(C92) [Cafe Kahlua (Yatsude Kazuki)] You-chan to Cosplay H (Love Live! Sunshine!!),(C92) [CafeKahlua (やつでかずき)] 曜ちゃんとこすぷれH (ラブライブ! サンシャイン!!),You-chan to Cosplay H,japanese,yatsude kazuki,cafe kahlua,doujinshi,love live sunshine,you watanabe,"bondage, pantyhose",26,2018-07-24 14:25:42,2018-07-24 21:25:42,2025-03-03 10:58:19
240351,(Houraigekisen! Yo-i! 14Senme)  [ROCK CLIME (Danbo)] Hishokan Ushio wa Ofuro de Shitai. (Kantai Collection -KanColle-),(砲雷撃戦!よーい!十四戦目) [ROCK CLIME (ダンボ)] 秘書艦潮はお風呂でしたい。 (艦隊これくしょん -艦これ-),Hishokan Ushio wa Ofuro de Shitai.,japanese,danbo,rock clime,doujinshi,kantai collection,"ushio, teitoku","big breasts, sole female, sole male",18,2018-07-24 14:26:38,2018-07-24 21:26:38,2025-03-03 10:58:19
240352,[Tridisaster (Saida Kazuaki)] Maya-sama no Sukima (Kantai Collection -KanColle-) [Digital],[Tridisaster (さいだ一明)] 摩耶サマのスキマ (艦隊これくしょん -艦これ-) [DL版],Maya-sama no Sukima,japanese,saida kazuaki,tridisaster,doujinshi,kantai collection,"maya, teitoku","big breasts, armpit sex, armpit licking, sole male",24,2018-07-24 14:27:56,2018-07-24 21:27:56,2025-03-03 10:58:19
240353,静かな森の夜 (冴えない彼女の育てかた),(C92) [風華雪 (ハヤテ)] 静かな森の夜 (冴えない彼女の育てかた),静かな森の夜,japanese,,,doujinshi,saenai heroine no sodatekata,"utaha kasumigaoka, tomoya aki","big breasts, glasses, nakadashi, kimono, paizuri, sole female, sole male",26,2018-07-24 14:29:09,2018-07-24 21:29:09,2025-03-03 10:58:19
240354,(C91) [corori (Yopparai Oni?)] HANAKAN Nande Konna Koto ni Naru zura!? (Love Live! Sunshine!!) [English] [Gagak_black],(C91) [corori (酔っ払い鬼?)] はなかん なんでこんな事になるズラ!? (ラブライブ! サンシャイン!!) [英訳],HANAKAN Nande Konna Koto ni Naru zura!?,"english, translated",yopparai oni,corori,doujinshi,love live sunshine,hanamaru kunikida,"sweating, swimsuit, glasses, masturbation, schoolgirl uniform, nakadashi, tracksuit, x-ray, defloration, pantyhose, rape, teacher, dilf, blackmail, impregnation, blowjob, sole female, sole male",37,2018-07-24 14:31:01,2018-07-24 21:31:01,2025-03-03 10:58:19
240355,(C93) [METAL-WIND (Sangou)] Paizuri Gaman Test (Kantai Collection -KanColle-) [Chinese] [胸垫汉化组],(C93) [METAL-WIND (さんごう)] 乳挟耐久試験 (艦隊これくしょん -艦これ-) [中国翻訳],Paizuri Gaman Test,"translated, chinese",sangou,metal-wind,doujinshi,kantai collection,"takao, atago, teitoku","big breasts, paizuri",27,2018-07-24 14:32:17,2018-07-24 21:32:17,2025-03-03 10:58:20
240356,(C93) [Kossorikakuredokoro (Island)] Re:M@STER IDOL ver.RITSUKO (THE iDOLM@STER) [Chinese] [胸垫汉化组],(C93) [こっそり隠れ処 (あいらんど)] Re:M@STER IDOL ver.RITSUKO (アイドルマスター) [中国翻訳],Re:M@STER IDOL ver.RITSUKO,"translated, chinese",island,kossorikakuredokoro,doujinshi,the idolmaster,"producer, ritsuko akizuki","glasses, sole female, sole male",27,2018-07-24 18:03:00,2018-07-25 01:03:00,2025-03-03 10:58:20
240357,"(Sounanoka 6) [Momonashi Potato (Momonashi Potato)] Koyoi, Yojaku wa Yojaku to Naru (Touhou Project)",(想七日6) [桃梨ぽてと (桃梨ぽてと)] 今宵、詠雀は夜雀となる (東方Project),"Koyoi, Yojaku wa Yojaku to Naru",japanese,momonashi potato,momonashi potato,doujinshi,touhou project,"rumia, mystia lorelei",lolicon,30,2018-07-24 18:09:24,2018-07-25 01:09:24,2025-03-03 10:58:20
240358,(Panzer Girls! 8) [Trample Rigger (Yequo)] RB32 (Girls und Panzer),(パンツァーガールズ!8) [Trample Rigger (イエクオ)]  RB32 (ガールズ&パンツァー),RB32,japanese,yequo,trample rigger,doujinshi,girls und panzer,,"group, dark skin, rape, sole female",21,2018-07-24 18:10:26,2018-07-25 01:10:26,2025-03-03 10:58:20
240360,Take a peek 偷窥70-73 Chinese,,Take a peek 偷窥70-73 Chinese,chinese,,,manga,,,webtoon,104,2018-07-24 18:18:58,2018-07-25 01:18:58,2025-03-03 10:58:21
240361,[Hotel Negresco (Negresco)] hepatica6.0 (Xenoblade Chronicles 2),[Hotel Negresco (Negresco)] hepatica6.0 (ゼノブレイド2),hepatica6.0,japanese,negresco,hotel negresco,doujinshi,"xenosaga, xenoblade chronicles 2","kos-mos, t-elos, pyra, rex","glasses, dark skin, bodysuit",26,2018-07-24 18:20:17,2018-07-25 01:20:17,2025-03-03 10:58:21
240362,(C92) [Twilight Road (Tomo)] FGO no Omakebon (Fate/Grand Order),(C92) [Twilight Road (ともー)] FGOのおまけ本 (Fate/Grand Order),FGO no Omakebon,japanese,tomo,twilight road,doujinshi,fate grand order,souji okita,"stockings, sole female, sole male",9,2018-07-24 18:20:40,2018-07-25 01:20:40,2025-03-03 10:58:21
240363,"(SC2017 Winter) [TwinBox (Hanahanamaki, Sousouman)] Kouen no Naisho na Koto (Kantai Collection -KanColle-) [Chinese] [花火汉化组]",(サンクリ2017 Winter) [TwinBox (花花捲、草草饅)] こうえんのナイショなこと (艦隊これくしょん -艦これ-) [中国翻訳],Kouen no Naisho na Koto,"translated, chinese","sousouman, hanahanamaki",twinbox,doujinshi,kantai collection,kashima,"swimsuit, bikini, twintails",16,2018-07-24 18:21:23,2018-07-25 01:21:23,2025-03-03 10:58:20
240364,[Q] Kagai Lesson (Fujouri na Nyotai Kousoku) [Chinese] [村长个人汉化] [Digital],[Q] 課外調教 (不条理な女体拘束) [中国翻訳] [DL版],Kagai Lesson,"translated, chinese",q,,manga,,,"garter belt, glasses, prostate massage, anal, femdom, bondage, shemale, stockings, teacher, ponytail",16,2018-07-24 18:22:19,2018-07-25 01:22:19,2025-03-03 10:58:21
240365,(C92) [Hidebou House (Hidebou)] Takane ga Mizugi ni Kikaetara | 如果贵音换上泳装的话 (THE iDOLM@STER) [Chinese] [may 自费汉化],(C92) [ヒデボウハウス (ひでぼう)] 貴音が水着に着替えたら (アイドルマスター) [中国翻訳],Takane ga Mizugi ni Kikaetara | 如果贵音换上泳装的话,"translated, chinese",hidebou,hidebou house,doujinshi,the idolmaster,takane shijou,"big breasts, swimsuit, bikini, full color, paizuri, sole female, ponytail",20,2018-07-24 18:23:16,2018-07-25 01:23:16,2025-03-03 10:58:21
240366,(C76) [PINK CHUCHU (Mikeou)] Houkago Attack (Amagami),(C76) [PINK CHUCHU (みけおう)] 放課後アタック (アマガミ),Houkago Attack,japanese,mikeou,pink chuchu,doujinshi,amagami,,,26,2018-07-24 18:24:31,2018-07-25 01:24:31,2025-03-03 10:58:21
240367,(Reitaisai 15) [Kedama Gyuunyuu (Tamano Kedama)] Patchouli Sensei ga Oshiete Kureru | Teach me Patchouli Sensei (Touhou Project) [English] =White Symphony=,(例大祭15) [毛玉牛乳 (玉之けだま)] パチュリー先生が教えてくれる (東方Project) [英訳],Patchouli Sensei ga Oshiete Kureru | Teach me Patchouli Sensei,"english, translated",tamano kedama,kedama gyuunyuu,doujinshi,touhou project,patchouli knowledge,"garter belt, ahegao, lolicon, stockings, sole female, sole male",26,2018-07-24 18:33:31,2018-07-25 01:33:31,2025-03-03 10:58:21
240369,(C93) [O.N Art Works (Oni-noboru)] The Enkou m@ster -collection- Soushuuhen (THE IDOLM@STER CINDERELLA GIRLS),(C93) [O.N Art Works (Oni-noboru)] The Enkou m@ster -collection- 総集編 (アイドルマスター シンデレラガールズ),The Enkou m@sterSoushuuhen,japanese,oni-noboru,o.n art works,doujinshi,the idolmaster,"rika jougasaki, minami nitta, producer, rin shibuya, mika jougasaki, onix","big breasts, group, anal, ffm threesome, bikini, full color, stockings, mosaic censorship, catgirl",80,2018-07-24 18:38:37,2018-07-25 01:38:37,2025-03-03 10:58:22
240370,(C92) [Norinori Seika (Nori Senbei)] Amedama to Inu (Girls und Panzer) [Chinese] [沒有漢化],(C92) [のりのり製菓 (海苔せんべい)] あめ玉といぬ (ガールズ&パンツァー) [中国翻訳],Amedama to Inu,"translated, chinese",nori senbei,norinori seika,doujinshi,girls und panzer,"maho nishizumi, darjeeling","females only, sex toys, yuri, fingering",27,2018-07-24 18:39:54,2018-07-25 01:39:54,2025-03-03 10:58:22
240371,(FF21) [Friendly Sky (CHuN)] 少女自在式#10.9 LOLOL (League of Legends),(FF21) [風舞結界 (CHuN)] 少女自在式#10.9 LOLOL (League of Legends),少女自在式#10.9 LOLOL,japanese,chun,,doujinshi,league of legends,"lulu, sona buvelle, lux, ahri, garen",incest,5,2018-07-24 18:40:12,2018-07-25 01:40:12,2025-03-03 10:58:22
240372,[F.W.ZHolic (FAN)] Supervised Adultery (Fate/Grand Order) [Chinese] [Digital],[F.W.ZHolic (FAN)] 姦守自盜 (Fate/Grand Order) [中国語] [DL版],Supervised Adultery,chinese,fan,f.w.zholic,doujinshi,fate grand order,"shuten douji, minamoto no raikou","futanari, oni, milf, big breasts, group, nakadashi, ffm threesome, femdom, mtf threesome, bodysuit, small breasts, paizuri, dick growth, horns",21,2018-07-24 18:41:21,2018-07-25 01:41:21,2025-03-03 10:58:22
240373,(C92) [Cafe Unlimited (Hiiragi Masaki)] Shounen Maid Curo-kun ~Himitsu no Kobeya Hen~,(C92) [カフェ・アンリミテッド (柊柾葵)] 少年メイドクーロ君~秘密の小部屋篇~,Shounen Maid Curo-kun,japanese,hiiragi masaki,cafe unlimited,doujinshi,original,,"maid, prostate massage, anal, sex toys, bondage, crossdressing, males only, yaoi, pillory, tomgirl, shotacon",35,2018-07-24 18:49:37,2018-07-25 01:49:37,2025-03-03 10:58:22
240374,(Shota Scratch 24) [Mysp5cm (Mareo)] No-pan Otokonoko × Shabushabu Namahousou [Chinese] [EZR個人漢化],(ショタスクラッチ24) [まいすぺ5cm (まれお)] ノーパン男の娘×しゃぶしゃぶナマ放送 [中国翻訳],No-pan Otokonoko × Shabushabu Namahousou,"translated, chinese",mareo,mysp5cm,doujinshi,original,,"anal, crossdressing, cosplaying, brother, multi-work series, incest, yaoi, tomgirl, shotacon, josou seme",14,2018-07-24 18:52:02,2018-07-25 01:52:02,2025-03-03 10:58:23
240375,(ShotaFes 2) [OS tokku (Shikimura)] Ashita mo Ikeru kana,(ショタフェス2) [OS特区 (しきむら)] あしたもいけるかな,Ashita mo Ikeru kana,japanese,shikimura,os tokku,doujinshi,original,,"schoolboy uniform, anal, males only, yaoi, shotacon",19,2018-07-24 18:55:08,2018-07-25 01:55:08,2025-03-03 10:58:23
240376,[Shiwasu no Okina] Ero Pippi Ch.1-2 [English],[師走の翁] エロ・ピッピ 第1-2話 [英訳],Ero Pippi Ch.1-2,"english, translated",shiwasu no okina,,manga,,,"mmf threesome, schoolboy uniform, group, glasses, netorare, cheating, schoolgirl uniform, condom, nakadashi, low lolicon, lolicon, exhibitionism, yuri, x-ray, defloration, gyaru, bukkake, filming, rape, teacher, dilf, blowjob, shotacon",62,2018-07-24 19:11:30,2018-07-25 02:11:30,2025-03-03 10:58:23
240377,(brilliant days 11) [Se-ri (Gimako)] Yumemakura Yokai Kitan (Ensemble Stars!),(brilliant days 11) [セーリ (ぎまこ)] 夢枕妖怪奇譚 (あんさんぶるスターズ!),Yumemakura Yokai Kitan,japanese,gimako,se-ri,doujinshi,ensemble stars,"tetora nagumo, kuro kiryu","wolf boy, catboy, group, anal, males only, yaoi, shotacon, kemonomimi",26,2018-07-24 19:20:06,2018-07-25 02:20:06,2025-03-03 10:58:23
240378,[Yuurei] Animal party (Kemono Friends) [Digital],[幽零] Animal party (けものフレンズ) [DL版],Animal party,japanese,yuurei,,doujinshi,kemono friends,"serval, kaban, japanese crested ibis","futanari, stockings, mosaic censorship, catgirl, kemonomimi",25,2018-07-24 19:21:24,2018-07-25 02:21:24,2025-03-03 10:58:23
