ID,EN_TITLE,JP_TITLE,CLEAN_TITLE,LANGUAGE,ARTIST,GROUP_NAME,CATEGORY,PARODY,CHARACTER,TAGS,PAGES,UPLOAD_DATE,FORMATTED_DATE,SCRAPED_DATE
239608,"(Ware, Yasen ni Totsunyuusu! 6) [Menteisho (Mentei)] Satsuki AiAiAi Kiwami (Kantai Collection -KanColle-) [Chinese] [想日电酱汉化组]",(我、夜戦に突入す!6) [めんてい処 (めんてい)] 皐月愛愛愛極 (艦隊これくしょん -艦これ-) [中国翻訳],Satsuki AiAiAi Kiwami,"translated, chinese",menteiyakuna,menteisho,doujinshi,kantai collection,"teitoku, satsuki","schoolgirl uniform, lolicon, stockings, sole female",23,2018-07-15 14:12:20,2018-07-15 21:12:20,2025-03-03 10:56:21
239609,(C92) [Rokusyoku Mikan (Tachiroku)] Nitta-san Taijuu o Fuyasite Kudasai. (THE IDOLM@STER CINDERELLA GIRLS),(C92) [緑色みかん (タチロク)] 新田さん体重を増やしてください。 (アイドルマスター シンデレラガールズ),Nitta-san Taijuu o Fuyasite Kudasai.,japanese,tachibana roku,rokusyoku mikan,doujinshi,the idolmaster,"minami nitta, producer","big breasts, swimsuit, nakadashi, bikini, sole female, sole male",32,2018-07-15 14:13:56,2018-07-15 21:13:56,2025-03-03 10:56:22
239611,(SC2018 Spring) [Nagiyamasugi (Nagiyama)] Joshikousei Shuudan Chikan Densha 3,(サンクリ2018 Spring) [ナギヤマスギ (那岐山)] 女子校生集団痴漢電車3,Joshikousei Shuudan Chikan Densha 3,japanese,nagiyama,nagiyamasugi,doujinshi,original,,"business suit, sweating, big breasts, mmf threesome, group, glasses, schoolgirl uniform, nakadashi, bondage, rape, dilf, chikan, sole female",24,2018-07-15 14:16:29,2018-07-15 21:16:29,2025-03-03 10:56:22
239612,(Mitsudol 17) [Esora Note (Majima Shiroyuki)] the immoral Flavors (Sengoku Otome: Momoiro Paradox),(貢ドル17) [エソラnote (間島白幸)] the immoral Flavors (戦国乙女～桃色パラドックス～),the immoral Flavors,japanese,majima shiroyuki,esora note,doujinshi,sengoku otome,,"glasses, dark skin, lolicon, mind control, rape",78,2018-07-15 14:38:50,2018-07-15 21:38:50,2025-03-03 10:56:22
239613,(Reitaisai 15) [Onna Kishi no Shiro (Knight)] Moshi Hakurei Reimu ni Naretara (Touhou Project),(例大祭15) [女騎士の城 (ナイト)] もし博麗霊夢になれたら (東方Project),Moshi Hakurei Reimu ni Naretara,japanese,knight,onna kishi no shiro,doujinshi,touhou project,reimu hakurei,"unusual pupils, bestiality, sex toys, x-ray, full color, gaping, mosaic censorship",16,2018-07-15 14:39:43,2018-07-15 21:39:43,2025-03-03 10:56:22
239614,[Hokyuun] Paizuri Comic 3 [English],[ほきゅーん] パイズリコミック3 [英訳],Paizuri Comic 3,"english, translated",,hokyuun,doujinshi,original,,"big breasts, unusual pupils, demon girl, dark skin, bikini, full color, breast expansion, paizuri, mosaic censorship, rape, sole female, sole male, clothed paizuri",12,2018-07-15 14:40:18,2018-07-15 21:40:18,2025-03-03 10:56:23
239615,(C93) [Sakuraito (Utana)] Himitsu no daisuki (Ginga e Kickoff!!),(C93) [サクライト (うたな)] ひみつのだいすき (銀河へキックオフ!!),Himitsu no daisuki,japanese,utana,sakuraito,doujinshi,ginga e kickoff,"kota furuya, shou oota, ryuuji furuya, ouzou furuya","group, anal, males only, yaoi, shotacon",23,2018-07-15 18:05:16,2018-07-16 01:05:16,2025-03-03 10:56:23
239616,"[Spiral Brain (Greco Roman)] Saenai Ore no Moto ni, Morrigan-san to Lilith-chan ga Sumitsuita. (Darkstalkers) [Digital]",[スパイラルブレーン (暮古浪漫)] 冴えない俺のもとに、モリガンさんとリリスちゃんが棲みついた。 (ヴァンパイア) [DL版],"Saenai Ore no Moto ni, Morriganchan ga Sumitsuita.",japanese,greco roman,spiral brain,doujinshi,darkstalkers,"morrigan aensland, lilith aensland",,20,2018-07-15 18:06:08,2018-07-16 01:06:08,2025-03-03 10:56:23
239617,(C93) [Ikkizuka (Kizuka Kazuki)] Chitsujo Break (Granblue Fantasy) [English] [constantly],(C93) [いっきづか (きづかかずき)] 秩序ブレイク (グランブルーファンタジー) [英訳],Chitsujo Break,"english, translated",kizuka kazuki,ikkizuka,doujinshi,granblue fantasy,"lecia, monika","kissing, big breasts, mmf threesome, group, big ass, nakadashi, hairy, military, x-ray, stockings, pantyhose, rape, blackmail, blowjob, bald",27,2018-07-15 18:07:24,2018-07-16 01:07:24,2025-03-03 10:56:23
239618,[Akai Yoru] Kamimachi Iede Shoujo | 待援助的翹家少女  [Chinese],[紅威ヨル] 神待ち家出少女  [中国翻訳],Kamimachi Iede Shoujo | 待援助的翹家少女,"translated, chinese",akai yoru,,manga,,,"story arc, schoolgirl uniform, prostitution, tankoubon, dilf",182,2018-07-15 18:16:16,2018-07-16 01:16:16,2025-03-03 10:56:23
239619,(C93) [PORYGON137 (Hidari Pory5n)] Itaike na Kimi Dakara (Mob Psycho 100),(C93) [PORYGON137 (左ポリ5ン)] 幼気なキミだから (モブサイコ100),Itaike na Kimi Dakara,japanese,hidari pory5n,porygon137,doujinshi,mob psycho 100,shigeo kageyama,"anal, bondage, males only, yaoi, rape, blackmail, blowjob, shotacon",27,2018-07-15 18:22:08,2018-07-16 01:22:08,2025-03-03 10:56:24
239620,(C92) [Royal Bitch (haruhisky)] Ku-neru Sumata 5 (Ku-neru Maruta),(C92) [ろいやるびっち (haruhisky)] くーねるすまた 5 (くーねるまるた),Ku-neru Sumata 5,japanese,haruhisky,royal bitch,doujinshi,ku-neru maruta,,"old man, mmf threesome, group, anal, harem, double penetration, dilf, sole female",22,2018-07-15 18:23:13,2018-07-16 01:23:13,2025-03-03 10:56:24
239621,(C72) [Hakusyoku Miminagaten (Ameotoko)] Konton,(C72) [白触耳長店 (雨男)] 混沌,Konton,japanese,ameotoko,hakusyoku miminagaten,doujinshi,original,,"elf, orc, group, nakadashi, anal, lolicon, x-ray, inflation, lactation",22,2018-07-15 18:28:18,2018-07-16 01:28:18,2025-03-03 10:56:24
239622,"(C89) [Toko-ya (HEIZO, Kitoen)] Elf no Onna Kishi no Junan",(C89) [床子屋 (HEIZO、鬼頭えん)] エルフの女騎士の受難,Elf no Onna Kishi no Junan,japanese,"heizo, kitoen",toko-ya,doujinshi,original,,"elf, mmf threesome, group, nakadashi, defloration, double penetration, rape, blowjob, sole female",26,2018-07-15 18:29:33,2018-07-16 01:29:33,2025-03-03 10:56:24
239623,[Rapurando] Shota Kyoudai to Tonari no Oba-san. | Two shota brothers and an older woman in the neighbourhood. [English] [InsanePraetor],[らぷらんど] ショタ兄弟と隣のおばさん。 [英訳],Shota Kyoudai to Tonari no Oba-san. | Two shota brothers and an older woman in the neighbourhood.,"english, translated",,rapurando,doujinshi,original,,"milf, big breasts, bbw, mmf threesome, group, big ass, ahegao, full color, drugs, double penetration, tanlines, mosaic censorship, blowjob, shotacon, sole female",33,2018-07-15 18:36:43,2018-07-16 01:36:43,2025-03-03 10:56:24
239624,[Taikuyamori (Tamahiro)] Taichukoromansu [Chinese] [男男搭配干♂活不累双人汉化（施工中）],[対空ヤモリ (たまひろ)] タチドコロマンス [中国翻訳],Taichukoromansu,"translated, chinese",tamahiro,taiku yamori,doujinshi,original,,"males only, yaoi, muscle",8,2018-07-15 18:37:07,2018-07-16 01:37:07,2025-03-03 10:56:25
239625,(COMIC1☆10) [Pinke (Kaya)] Prism Heart (Granblue Fantasy),(COMIC1☆10) [ぴんけ (かや)] プリズムハート (グランブルーファンタジー),Prism Heart,japanese,kaya,pinke,doujinshi,granblue fantasy,clarisse,,21,2018-07-15 18:38:04,2018-07-16 01:38:04,2025-03-03 10:56:25
239626,(C93) [Yanyanyo (Yanyo)] Aishite! Shikikan (Azur Lane),(C93) [やんやんよ (やんよ)] 愛して！ 指揮官 (アズールレーン),Aishite! Shikikan,japanese,yanyo,yanyanyo,doujinshi,azur lane,"fusou, nachi, takao, yamashiro, atago, prinz eugen, kaga, saratoga, illustrious, belfast, javelin, hammann, san diego","big breasts, lolicon, full color, stockings, artbook, beauty mark",27,2018-07-15 18:43:59,2018-07-16 01:43:59,2025-03-03 10:56:25
239627,(C90) [CHRONOLOG (Sakurazawa Izumi)] Atsuatsu Pola-chan (Kantai Collection -KanColle-) [Chinese] [脸肿汉化组],(C90) [CHRONOLOG (桜沢いづみ)] あつあつポーラちゃん (艦隊これくしょん -艦これ-) [中国翻訳],Atsuatsu Pola-chan,"translated, chinese",sakurazawa izumi,chronolog,doujinshi,kantai collection,"teitoku, pola","sole female, sole male",30,2018-07-15 18:45:22,2018-07-16 01:45:22,2025-03-03 10:56:25
239628,[Namonashi] Fukutsu no Perorist | The Indomitable Perorist (Fukutsu no Perorist) [English] =White Symphony= [Digital],[無望菜志] 不屈のペロリスト (不屈のペロリスト) [英訳] [DL版],Fukutsu no Perorist | The Indomitable Perorist,"english, translated",namonashi,,manga,,,"virginity, schoolboy uniform, nakadashi, foot licking, x-ray, footjob, defloration, stockings, sole female, sole male",31,2018-07-15 18:46:47,2018-07-16 01:46:47,2025-03-03 10:56:25
239630,[Ougi Ranmaru] Kobamenai Jukubo,[扇蘭丸] 拒めない塾母,Kobamenai Jukubo,japanese,,ougi ranmaru,doujinshi,original,,"milf, big breasts, group, glasses, netorare, big ass, ahegao, mother, full color, incest, mosaic censorship, sole female",31,2018-07-15 18:49:41,2018-07-16 01:49:41,2025-03-03 10:56:25
239631,Chichi ga shutchō kara kaette kuru mae ni tībakku sugata no yokkyū fuman'na haha o netoru,[maple号] 父が出張から帰ってくる前にTバック姿の欲求不満な母を寝取る,Chichi ga shutchō kara kaette kuru mae ni tībakku sugata no yokkyū fuman'na haha o netoru,japanese,maple-go,maple-go,doujinshi,,margaret,"milf, big breasts, big ass, mother, incest, lingerie, mosaic censorship, sole female",31,2018-07-15 18:51:30,2018-07-16 01:51:30,2025-03-03 10:56:27
239632,(C84) [Ishimura-ya (Ishimura)] Matowaritsuki (Touhou Project),(C84) [石村屋 (いしむら)] マトワリツキ (東方Project),Matowaritsuki,japanese,ishimura,ishimuraya,doujinshi,touhou project,patchouli knowledge,"big breasts, triple penetration, corruption, living clothes, anal, vore, bondage, monster, x-ray, double penetration, mind break, leotard, blowjob, tentacles",37,2018-07-15 18:53:15,2018-07-16 01:53:15,2025-03-03 10:56:25
239633,(C85) [Ishimura-ya (Ishimura)] Matowaritsuki II (Touhou Project),(C85) [石村屋 (いしむら)] マトワリツキⅡ (東方Project),Matowaritsuki II,japanese,ishimura,ishimuraya,doujinshi,touhou project,"patchouli knowledge, sakuya izayoi","big breasts, corruption, living clothes, anal, vore, bondage, double penetration, mind break, leotard, blowjob, tentacles, eggs",30,2018-07-15 18:54:46,2018-07-16 01:54:46,2025-03-03 10:56:25
239634,[Oden Sensei] Haha ga Dogeza Shita Hi ~Kichiku Musuko ni Otosareta Kachiki na Haha~,[汚電せんせい] 母が土下座した日 ～鬼畜息子に堕とされた勝気な母～,Haha ga Dogeza Shita Hi,japanese,,oden sensei,doujinshi,original,,"milf, big breasts, big ass, cheating, mother, incest, mosaic censorship, shotacon, sole female, sole male",68,2018-07-15 19:09:46,2018-07-16 02:09:46,2025-03-03 10:56:27
239635,(C90) [BURUMAN (Tajima Yuki)] RED BURU -SUMMER- (Touhou Project),(C90) [BURUMAN (田嶋有紀)] RED BURU -SUMMER- (東方Project),RED BURU,japanese,tajima yuki,buruman,doujinshi,touhou project,sakuya izayoi,"full color, pantyhose, leotard, blowjob",13,2018-07-15 19:10:35,2018-07-16 02:10:35,2025-03-03 10:56:27
239636,(Reitaisai 9) [BURUMAN (Tajima Yuki)] Red buru Mk-2 (Touhou Project),(例大祭9) [BURUMAN (田嶋有紀)] Red buru Mk-2 (東方Project),Red buru Mk-2,japanese,tajima yuki,buruman,doujinshi,touhou project,sakuya izayoi,"full color, pantyhose, leotard",9,2018-07-15 19:11:01,2018-07-16 02:11:01,2025-03-03 10:56:27
239637,(Futaket 13.5) [Mebius no Wa (Nyx)] Futanari Tenshi-chan ni Fumarete Horareru Hon 2 (Touhou Project),(ふたけっと13.5) [Mebiusの環 (Nyx)] ふたなり天子ちゃんに踏まれて掘られる本2 (東方Project),Futanari Tenshi-chan ni Fumarete Horareru Hon 2,japanese,nyx,mebius no wa,doujinshi,touhou project,tenshi hinanai,"futanari, anal, footjob, pantyhose, shotacon, sole female, sole male, dickgirl on male, male on dickgirl",26,2018-07-15 19:16:55,2018-07-16 02:16:55,2025-03-03 10:56:27
239638,(Futaket 14) [Mebius no wa (Nyx)] Futanari Tenshi Monogatari 3 (Touhou Project),(ふたけっと14) [Mebiusの環 (Nyx)] ふたなり天子物語 3 (東方Project),Futanari Tenshi Monogatari 3,japanese,nyx,mebius no wa,doujinshi,touhou project,tenshi hinanai,"futanari, swimsuit, urethra insertion, living clothes, anal, double penetration, pantyhose, tentacles, shotacon, dickgirl on male",30,2018-07-15 19:23:41,2018-07-16 02:23:41,2025-03-03 10:56:27
239639,(Reitaisai 15) [Kuma no Mori (Kumataro)] REFORM EDEN (Touhou Project),(例大祭15) [くまのもり (隈太郎)] REFROM EDEN (東方Project),REFORM EDEN,japanese,kumataro,kuma no mori,doujinshi,touhou project,"alice margatroid, reimu hakurei, satori komeiji, sumireko usami","corruption, unusual pupils, ahegao, monster, lolicon, x-ray, mind break, blowjob, tentacles, crotch tattoo",50,2018-07-15 19:36:53,2018-07-16 02:36:53,2025-03-03 10:56:28
239640,(C77) [Hibiki (Iganseijin)] Oppachu x Chuppachutte Romanda yo ne (Touhou Project),(C77) [響輝 (胃がん星人)] おっぱちゅ×ちっぱちゅって浪漫だよね (東方Project),Oppachu x Chuppachutte Romanda yo ne,japanese,iganseijin,hibiki,doujinshi,touhou project,"patchouli knowledge, alice margatroid, marisa kirisame, shikieiki yamaxanadu","females only, masturbation, sex toys, yuri, selfcest",34,2018-07-15 19:38:28,2018-07-16 02:38:28,2025-03-03 10:56:28
239641,(C92) [CHIBIKKO KINGDOM (Kekocha)] C92 Omake Bon - AmeriKan Bikini Car Wash (Kantai Collection -KanColle-),(C92) [CHIBIKKO KINGDOM (けこちゃ)] C92おまけ本 アメリ艦ビキニカーウォッシュ☆ (艦隊これくしょん -艦これ-),C92 Omake Bon - AmeriKan Bikini Car Wash,japanese,kekocha,chibikko kingdom,doujinshi,kantai collection,"iowa, saratoga","big breasts, swimsuit, bikini",8,2018-07-15 19:38:53,2018-07-16 02:38:53,2025-03-03 10:56:28
239642,(C89) [Search-Light (Risei)] Yakuzuke ni Sarete Ubawareta Kanojo (DQN ni Somerareru Senpai),(C89) [サーチライト (李星)] ヤク漬けにされて奪われた彼女 (DQNに染められる先輩),Yakuzuke ni Sarete Ubawareta Kanojo,japanese,risei,search-light,doujinshi,original,,"netorare, defloration",22,2018-07-15 19:40:08,2018-07-16 02:40:08,2025-03-03 10:56:28
239643,(C86) [Search-Light (Risei)] NTR Haramasare Ubawareta Aibou,(C86) [サーチライト (李星)] NTR 孕まされ奪われた相棒,NTR Haramasare Ubawareta Aibou,japanese,risei,search-light,doujinshi,original,,"pregnant, netorare, mind control, mind break, impregnation",30,2018-07-15 19:41:40,2018-07-16 02:41:40,2025-03-03 10:56:28
239645,(COMITIA 102) [Search-Light (Risei)] Sennyo Biyakuzuke Tettei Choukyou,(コミティア 102) [サーチライト (李星)] 仙女媚薬漬け徹底調教,Sennyo Biyakuzuke Tettei Choukyou,japanese,risei,search-light,doujinshi,original,,"urination, rape, smegma, piss drinking",30,2018-07-15 19:43:55,2018-07-16 02:43:55,2025-03-03 10:56:29
239646,(COMITIA99) [Search-Light (Risei)] Ryoujoku MoriKamisama Biyaku Otoshi!!!,(コミティア99) [サーチライト (李星)] 陵辱 森神様媚薬堕し!!!,Ryoujoku MoriKamisama Biyaku Otoshi!!!,japanese,risei,search-light,doujinshi,original,,"pregnant, drugs, impregnation, sole female, sole male",30,2018-07-15 19:45:19,2018-07-16 02:45:19,2025-03-03 10:56:29
239647,(COMITIA 104) [Search-Light (Risei)] Shikigami ni Otosareta Taima Miko,(コミティア 104) [サーチライト (李星)] 式神に堕とされた退魔巫女,Shikigami ni Otosareta Taima Miko,japanese,risei,search-light,doujinshi,original,,"monster, sole female",26,2018-07-15 22:01:58,2018-07-16 05:01:58,2025-03-03 10:56:29
239648,(COMITIA97) [Search-Light (Risei)] Himekami-sama Kanzen Ryoujoku Sennou Otoshi,(コミティア97) [サーチライト (李星)] 姫神様完全陵辱 洗脳堕シ,Himekami-sama Kanzen Ryoujoku Sennou Otoshi,japanese,risei,search-light,doujinshi,original,,"pregnant, rape, impregnation, catgirl, sole female, kemonomimi",30,2018-07-15 22:03:24,2018-07-16 05:03:24,2025-03-03 10:56:29
239649,[Mashiro no Hihoukan (Various)] Nyotaika Sareta Otokonoko-tachi [Chinese] [瑞树汉化组] [Digital],[真城の秘宝館 (よろず)] 女体化された男の子たち！ [中国翻訳] [DL版],Nyotaika Sareta Otokonoko-tachi,"translated, chinese",,mashiro no hihoukan,doujinshi,original,,"bunny girl, bride, gender bender",49,2018-07-15 22:05:32,2018-07-16 05:05:32,2025-03-03 10:56:30
239651,[Penguindou] Oba-san to H Shimasho [Digital],[筆吟堂] オバさんとHしましょ [DL版],Oba-san to H Shimasho,japanese,penguindou,penguindou,doujinshi,original,,"milf, kissing, big breasts, bbw, cunnilingus, big ass, cheating, huge breasts, big areolae, paizuri, blowjob, shotacon",27,2018-07-15 22:11:49,2018-07-16 05:11:49,2025-03-03 10:56:30
239652,[Shichimen Soka (Sexyturkey)] Eirei Josou Cosplay Archaman (Fate/Grand Order) [Chinese] [EZR個人漢化] [Digital],[七面楚歌 (すたーきー)] 英霊女装コスプレアーキマン (Fate/Grand Order) [中国翻訳] [DL版],Eirei Josou Cosplay Archaman,"translated, chinese",sexyturkey,shichimen soka,doujinshi,fate grand order,"shielder, gudako, gudao, romani archaman","nakadashi, anal, crossdressing, cosplaying, yaoi, tomgirl, josou seme",16,2018-07-15 22:12:39,2018-07-16 05:12:39,2025-03-03 10:56:30
239653,Now you can do it! Illustrated Tied How to Manual (SANWA MOOK light maniac Guide Series),いますぐデキる！図説縛り方マニュアル (SANWA MOOK ライト・マニアック・ガイドシリーズ),Now you can do it! Illustrated Tied How to Manual,japanese,,,manga,,,"bondage, artbook, shibari",65,2018-07-15 22:15:21,2018-07-16 05:15:21,2025-03-03 10:56:30
239654,(C85) [Transistor Baby (Hata)] Anadorunayo!! (Kantai Collection -KanColle-),(C85) [トランジスタベイビィ (波多)] あなどるなよ!! (艦隊これくしょん -艦これ-),Anadorunayo!!,japanese,hata,transistor baby,doujinshi,kantai collection,"nagato, teitoku","anal, military, stockings, collar, mecha girl, sole female, sole male",18,2018-07-15 22:16:26,2018-07-16 05:16:26,2025-03-03 10:56:30
239655,(C93) [Transistor Baby (Hata)] Fuujin Kanraku ~Taimanin Asuka Sennou Choukyou ni Otsu~ (Taimanin Asagi),(C93) [トランジスタベイビィ (波多)] 風神陥落 ～対魔忍アスカ洗脳調教に堕つ～ (対魔忍アサギ),Fuujin Kanraku,japanese,hata,transistor baby,doujinshi,taimanin asagi,,"big breasts, ahegao, bondage, thigh high boots, mind control, bodysuit, mind break, rape, impregnation, crotch tattoo",18,2018-07-15 22:17:18,2018-07-16 05:17:18,2025-03-03 10:56:30
239656,(SC31) [Transistor Baby (Hata)] Zoku Himeou no Gyokuza Sundome Ban (Shinrabansho),(サンクリ31) [トランジスタベイビィ (波多)] 続・姫王の玉座 寸止め版 (神羅万象),Zoku Himeou no Gyokuza Sundome Ban,japanese,hata,transistor baby,doujinshi,shinrabansho,,"rape, tentacles",12,2018-07-15 22:17:54,2018-07-16 05:17:54,2025-03-03 10:56:31
239657,(C81) [Transistor Baby (Hata)] Ride・The・Emichan (Cardfight!! Vanguard),(C81) [トランジスタベイビィ (波多)] ライド・ザ・エミちゃん (カードファイト!! ヴァンガード),Ride・The・Emichan,japanese,hata,transistor baby,doujinshi,cardfight vanguard,"emi sendou, aichi sendou","anal, lolicon, incest",17,2018-07-15 22:18:50,2018-07-16 05:18:50,2025-03-03 10:56:31
239658,(C92) [Transistor Baby (Hata)] Shimakazekun in Ero Trap Dungeon (Kantai Collection -KanColle-),(C92) [トランジスタベイビィ (波多)] 島風くんINエロトラップダンジョン (艦隊これくしょん -艦これ-),Shimakazekun in Ero Trap Dungeon,japanese,hata,transistor baby,doujinshi,kantai collection,shimakaze,"schoolgirl uniform, pig man, anal, crossdressing, cosplaying, yaoi, stockings, rape, tomgirl, shotacon",18,2018-07-15 22:19:39,2018-07-16 05:19:39,2025-03-03 10:56:31
239659,(CT22) [Transistor Baby (Hata)] Futari wa Big Bombers (Dragon's Crown),(こみトレ22) [トランジスタベイビィ (波多)] ふたりはビッグ・ボンバーズ (ドラゴンズクラウン),Futari wa Big Bombers,japanese,hata,transistor baby,doujinshi,dragons crown,,"elf, mmf threesome, group",8,2018-07-15 22:20:03,2018-07-16 05:20:03,2025-03-03 10:56:31
239660,[Transistor Baby (Hata)] Lyrical Charge (Mahou Shoujo Lyrical Nanoha),[トランジスタベイビィ (波多)] リリカルチャージ (魔法少女リリカルなのは),Lyrical Charge,japanese,hata,transistor baby,doujinshi,mahou shoujo lyrical nanoha,"fate testarossa, nanoha takamachi","futanari, anal, sex toys, lolicon",12,2018-07-15 22:20:41,2018-07-16 05:20:41,2025-03-03 10:56:31
239661,(C87) [Akanagi (Aikawa Tatsuki)] Teitoku ga Neteiru Sou desu yo...? (Kantai Collection -KanColle-),(C87) [あかなぎ (相川たつき)] 提督が寝ているそうですよ…? (艦隊これくしょん -艦これ-),Teitoku ga Neteiru Sou desu yo...?,japanese,aikawa tatsuki,akanagi,doujinshi,kantai collection,"kongou, haruna, teitoku","group, ffm threesome, full color, mosaic censorship, sole male",16,2018-07-15 22:21:30,2018-07-16 05:21:30,2025-03-03 10:56:31
239662,[TANA] Oyome-sama Honey Days Joukan Ch. 6 [English] [biribiri],[TANA] およめさまHONEYDAYS♥ 上巻 第6話 [英訳],Oyome-sama Honey Days Joukan Ch. 6,"english, translated",tana,,manga,,,"kissing, big breasts, strap-on, group, cheating, double blowjob, nakadashi, ahegao, anal, sex toys, ffm threesome, bondage, yuri, x-ray, double penetration, gaping, bukkake, blowjob, stomach deformation, bisexual",24,2018-07-15 22:22:43,2018-07-16 05:22:43,2025-03-03 10:56:31
239663,(C59) [Juukan Oukoku (Toyoshima Yuusaku)] Yuusaku No Doremi♪ (Ojamajo Doremi) [English] [biribiri],(C59) [ジュウカンオウコク (豊島ゆーさく)] ゆーさくのどれみ♪ (おジャ魔女どれみ) [英訳],Yuusaku No Doremi♪,"english, translated",toyoshima yuusaku,juukan oukoku,doujinshi,ojamajo doremi,doremi harukaze,"lolicon, rape",31,2018-07-15 22:28:33,2018-07-16 05:28:33,2025-03-03 10:56:31
239664,[Ukikotatsu] Nagasare Sensei,[うきこたつ] ながされ先生,Nagasare Sensei,japanese,ukikotatsu,,doujinshi,original,,"business suit, kissing, cheating, pantyhose, mosaic censorship, teacher, blowjob, deepthroat, sole female, sole male",127,2018-07-16 02:05:59,2018-07-16 09:05:59,2025-03-03 10:56:32
239665,[Ari and Mura] Osananajimi Saimin Choukyou Nikki,[蟻アンド村] 幼馴染催眠調教日記,Osananajimi Saimin Choukyou Nikki,japanese,,,doujinshi,original,,"leg lock, schoolgirl uniform, urination, ahegao, blowjob face, lolicon, mind control, human pet, blowjob, shotacon, sole female, tail plug, ari and mura",97,2018-07-16 02:28:42,2018-07-16 09:28:42,2025-03-03 10:56:32
239666,[Hatomame (Ago)] Uchi no Musume to Otokonoko! - Nukimakuri 1-nichi Date [English] [N04h],[ハトマメ (顎)] うちの娘と男の子!ヌきまくり1日デート [英訳],Uchi no Musume to Otokonoko!nichi Date,"english, translated",ago,hatomame,doujinshi,original,,"big breasts, bbw, big ass, ahegao, huge breasts, anal, full color, mosaic censorship, tomgirl, big penis, shotacon, sole female, sole male",21,2018-07-16 02:32:49,2018-07-16 09:32:49,2025-03-03 10:56:32
239667,[Gesukabi Baiyousou (Dr. Chocorata)] -anjir- Chuuhen II (Touhou Project) [Digital],[ゲスカビ培養槽 (Dr.ちょこら~た)] -anjir(アンジール)-中編Ⅱ (東方Project) [DL版],Chuuhen II,japanese,dr. chocorata,gesukabi baiyousou,doujinshi,touhou project,"yoshika miyako, seiga kaku",full color,31,2018-07-16 02:34:25,2018-07-16 09:34:25,2025-03-03 10:56:32
239668,(CR37) [YLANG-YLANG (Ichie Ryouko)] PINK PRISONER (D.Gray-man) [English] [kusanyag & Hunter Nightblood],(Cレヴォ37) [イランイラン (一恵りょうこ)] PINK PRISONER (ディー・グレイマン) [英訳],PINK PRISONER,"english, translated",ichie ryouko,ylang-ylang,doujinshi,d.gray-man,"allen walker, lenalee lee","stockings, sole female, sole male, twintails",27,2018-07-16 02:35:48,2018-07-16 09:35:48,2025-03-03 10:56:32
239670,(COMIC1☆6) [Cyber Manga Doujou (Suzuki Metal)] Tsuki no Megami to Mayoi Inu (Cardfight!! Vanguard) [English] [PerceptivePercival],(COMIC1☆6) [サイバー☆マンガ道場 (鈴木メタル)] 月の女神と迷い犬 (カードファイト!! ヴァンガード) [英訳],Tsuki no Megami to Mayoi Inu,"english, translated",suzuki metal,cyber manga doujou,doujinshi,cardfight vanguard,"aichi sendou, misaki tokura","big breasts, shotacon, sole female, sole male",26,2018-07-16 02:49:23,2018-07-16 09:49:23,2025-03-03 10:56:32
239672,[Ogata Zen] Suzuwe-san wa Ryoubo | Dorm Mother Suzuwe-san 2 (Towako 3) [English] {CapableScoutMan & bigk40k} [Digital],[尾形全] すずゑさんは寮母 (永遠娘 参) [英訳] [DL版],Suzuwesan 2,"english, translated",ogata zen,,manga,,,"lolicon, sole female, sole male",8,2018-07-16 02:56:14,2018-07-16 09:56:14,2025-03-03 10:56:33
239673,[An-Arc (Hamo)] Kashima Nyo! (Kantai Collection -KanColle-) [Digital],[アンアーク (はも)] 鹿島にょ! (艦隊これくしょん -艦これ-) [DL版],Kashima Nyo!,japanese,hamo,an-arc,doujinshi,kantai collection,kashima,"big breasts, mmf threesome, group, urination, anal, full color, double penetration, sole female, twintails",16,2018-07-16 02:57:21,2018-07-16 09:57:21,2025-03-03 10:56:33
239674,(Yarou Fes 2018-petit- in OSAKA) [Muki Pomera (Kaidou Kana)] I have no choice. (Friday the 13th),(野郎フェス2018-petit- in OSAKA) [ムキぽめら (蚕堂カナ)] I have no choice. (13日の金曜日),I have no choice.,japanese,kaidou kana,muki pomera,doujinshi,"friday the 13th, halloween",jason voorhees,"handjob, prostate massage, nakadashi, anal, masked face, males only, yaoi, rape, muscle",20,2018-07-16 02:58:31,2018-07-16 09:58:31,2025-03-03 10:56:33
