ID,EN_TITLE,JP_TITLE,CLEAN_TITLE,LANGUAGE,ARTIST,GROUP_NAME,CATEGORY,PARODY,CHARACTER,TAGS,PAGES,UPLOAD_DATE,FORMATTED_DATE,SCRAPED_DATE
238914,(Rainbow Flavor 7) [Maguro Beya (Shiratama)] Uchi no Ako ga Konna ni Seichouki na Wake ga Nai! (Suite PreCure),(レインボーフレーバー7) [まぐろ部屋 (しらたま)] うちのアコがこんなに成長期なわけがない！ (スイート プリキュア♪),Uchi no Ako ga Konna ni Seichouki na Wake ga Nai!,japanese,shiratama,maguro beya,doujinshi,suite precure,,"lolicon, sole female, sole male",19,2018-07-07 14:32:36,2018-07-07 21:32:36,2025-03-03 10:54:30
238915,"(Reitaisai 8) [Testa Kitchen (Testa, Aisa)] SHADOW MOON (Touhou Project)",(例大祭8) [てすた厨房 (てすた、秋沙)] SHADOW MOON (東方Project),SHADOW MOON,japanese,,testa kitchen,doujinshi,touhou project,sakuya izayoi,"maid, anal",34,2018-07-07 14:34:12,2018-07-07 21:34:12,2025-03-03 10:54:30
238916,[Syamisen Koubou (Koishikawa)] Girls und Girls ~MihoYuka Sakusen desu!~ (Girls und Panzer) [Digital],[三味線工房 (小石川)] ガールズ アンド ガールズ 〜みほゆか作戦です！〜 (ガールズ&パンツァー) [DL版],Girls und Girls,japanese,koishikawa,syamisen koubou,doujinshi,girls und panzer,"yukari akiyama, miho nishizumi","females only, schoolgirl uniform, yuri, tribadism",22,2018-07-07 14:35:12,2018-07-07 21:35:12,2025-03-03 10:54:30
238917,(Suzuna Gensou Emaki) [Nanatsuboshi (7)] Suzunone (Touhou Project),(鈴奈幻想絵巻) [ななつぼし (7)] すずのね (東方Project),Suzunone,japanese,,,doujinshi,touhou project,"kosuzu motoori, mamizou futatsuiwa","females only, glasses, yuri",22,2018-07-07 14:36:20,2018-07-07 21:36:20,2025-03-03 10:54:30
238918,[Idobata Kaigisho (Fried)] Yuudachi-san wa Haitenai (Kantai Collection -KanColle-) [Digital],[井戸端会議所 (ふりいど)] 夕立さんははいてない (艦隊これくしょん -艦これ-) [DL版],Yuudachi-san wa Haitenai,japanese,fried.,idobata kaigisho,doujinshi,kantai collection,"yuudachi, teitoku",sole male,22,2018-07-07 14:37:34,2018-07-07 21:37:34,2025-03-03 10:54:30
238919,[Gamenhaji (Uwano Sora)] Watashi datte Yuusha to Ecchi ga Shitai zo (Maoyuu Maou Yuusha),[画面端 (ウワノソラ)] 私だって勇者とエッチがしたいぞ (まおゆう魔王勇者),Watashi datte Yuusha to Ecchi ga Shitai zo,japanese,uwano sora,gamenhaji,doujinshi,maoyuu maou yuusha,"yuusha, maou","big breasts, nakadashi, paizuri, mosaic censorship, sole female, sole male, horns",22,2018-07-07 14:38:29,2018-07-07 21:38:29,2025-03-03 10:54:31
238920,(Futaket 14) [Nisin Sansin (Nisin)] Tsuki ga Kirei desu ne. (Mito Tsukino),(ふたけっと14) [にしん三振 (ニシン)] 月が綺麗ですね。 (月ノ美兎),Tsuki ga Kirei desu ne.,japanese,nisin,nisin sansin,doujinshi,,tsukino mito,"futanari, scat, farting, coprophagia, stockings",26,2018-07-07 14:39:40,2018-07-07 21:39:40,2025-03-03 10:54:31
238921,(COMITIA113) [Monji Koubou (Kikuichi Monji)] Memory of scatology,(コミティア113) [もんじ肛房 (菊一もんじ)] Memory of scatology,Memory of scatology,japanese,kikuichi monji,monji koubou,doujinshi,original,,"scat, sex toys, exhibitionism, mosaic censorship",34,2018-07-07 14:41:17,2018-07-07 21:41:17,2025-03-03 10:54:31
238922,[Zero Punch] Osaka no Ko yanen de (EROGROS Vol. 4)  [Chinese] [沒有漢化] [Digital],[ぜろぽんち] 大阪の子やねんで (エログロス Vol.4)  [中国翻訳]  [DL版],Osaka no Ko yanen de,"translated, chinese",zero punch,,manga,,,"snuff, lolicon, sole female, sole male",17,2018-07-07 14:44:39,2018-07-07 21:44:39,2025-03-03 10:54:31
238923,"(C62) [PARADISE""D"" PRODUCTS (HJB)] PD Vol. 1 (Dead or Alive)","(C62) [PARADISE""D"" PRODUCTS (HJB)] PD Vol.1 (デッド・オア・アライブ)",PD Vol. 1,japanese,"paradise d, hjb",paradise d products,doujinshi,dead or alive,ayane,"females only, masturbation, schoolgirl uniform, urination, hairy, incest",27,2018-07-07 14:45:52,2018-07-07 21:45:52,2025-03-03 10:54:31
238924,[Fukakutei Kuukan (aruva)] Elf Oujo Kousoku Kusuguri Monzetsu Zecchou Goumon [Chinese] [布魯斯個人漢化],[不確定空間 (aruva)] エルフ王女拘束くすぐり悶絶絶頂拷問 [中国翻訳],Elf Oujo Kousoku Kusuguri Monzetsu Zecchou Goumon,"translated, chinese",aruva,fukakutei kuukan,doujinshi,original,,"elf, big breasts, tickling",25,2018-07-07 14:47:01,2018-07-07 21:47:01,2025-03-03 10:54:32
238925,[Ryuuta] Senyaku Yubiwa [Digital],[竜太] 先約指輪 [DL版],Senyaku Yubiwa,japanese,ryuuta,,manga,,,"big breasts, sole female, sole male",40,2018-07-07 14:48:42,2018-07-07 21:48:42,2025-03-03 10:54:32
238926,(C75) [May no Tenshi (Neyuki Rei)] sai*scribbles,(C75) [メイの天使 (根雪れい)] sai*scribbles,sai*scribbles,japanese,neyuki rei,may no tenshi,doujinshi,original,,,9,2018-07-07 14:49:10,2018-07-07 21:49:10,2025-03-03 10:54:32
238927,(C92) [SAZ (soba)] Hodasare Sugite Tatenai no! (Fate/Grand Order) [Chinese] [无毒汉化组],(C92) [SAZ (soba)] 絆されスギテたてないの！ (Fate/Grand Order) [中国翻訳],Hodasare Sugite Tatenai no!,"translated, chinese",soba,saz,doujinshi,fate grand order,"gudao, musashi miyamoto","big breasts, nakadashi, stockings, blowjob, sole female, sole male, ponytail",19,2018-07-07 14:50:15,2018-07-07 21:50:15,2025-03-03 10:54:33
238928,(C89) [Ishikawa Pro (Ishikawa Naoya)] Kuttsukiboshi Soushuuhen -purity- (Kuttsukiboshi),(C89) [石川プロ (石川直哉)] くっつきぼし総集編 -purity- (くっつきぼし),Kuttsukiboshi Soushuuhen,japanese,ishikawa naoya,ishikawa pro,doujinshi,kuttsukiboshi,,"kissing, females only, yuri, full color, fingering",114,2018-07-07 14:56:03,2018-07-07 21:56:03,2025-03-03 10:54:32
238929,[Mahouya] Osananajimi Heroine Akuochi [Chinese] [这很恶堕汉化组],[魔法屋] 幼馴染ヒロイン悪堕ち [中国翻訳],Osananajimi Heroine Akuochi,"translated, chinese",mahouya,,manga,,,"corruption, pantyhose",17,2018-07-07 14:56:54,2018-07-07 21:56:54,2025-03-03 10:54:34
238930,(COMIC1☆13) [Mizuwari Neko (Toyo)] Service Manten Jervis-chan (Kantai Collection -KanColle-) [Chinese] [无毒汉化组],(COMIC1☆13) [水割り猫 (トヨ)] サービス満点ジャーヴィスちゃん (艦隊これくしょん -艦これ-) [中国翻訳],Service Manten Jervis-chan,"translated, chinese",toyo,mizuwari neko,doujinshi,kantai collection,"teitoku, jervis","swimsuit, bikini, lolicon, dilf, sole female, sole male",28,2018-07-07 15:02:17,2018-07-07 22:02:17,2025-03-03 10:54:34
238931,(C93) [Jam Kingdom (Jam Ouji)] excrement dream,(C93) [ジャム王国 (ジャム王子)] excrement dream,excrement dream,japanese,jam ouji,jam kingdom,doujinshi,original,,"scat, females only, schoolgirl uniform, sex toys, coprophagia, yuri, rimjob, tribadism, twintails",22,2018-07-07 15:03:24,2018-07-07 22:03:24,2025-03-03 10:54:34
238932,[Asahina Makoto] Shoujo Kansatsu Nikki [Chinese],[朝比奈まこと] 少女姦察日記 [中国翻訳],Shoujo Kansatsu Nikki,"translated, chinese",asahina makoto,,manga,,,"lolicon, tankoubon, stockings, randoseru, twintails",202,2018-07-07 18:45:24,2018-07-08 01:45:24,2025-03-03 10:54:34
238933,(C93) [Pirates Patrol (Otokawa Kazuki)] Pocchari Jimiko no Haisetsu Jijou,(C93) [パイレーツパトロール (乙川カヅキ)] ぽっちゃり地味子の排泄事情,Pocchari Jimiko no Haisetsu Jijou,japanese,otokawa kazuki,pirates patrol,doujinshi,original,,"scat, glasses, schoolgirl uniform, urination, exhibitionism",22,2018-07-07 18:46:36,2018-07-08 01:46:36,2025-03-03 10:54:34
238934,[Sorasore (Jagayamatarawo)] IN MY ROOM (Fate/Grand Order) [2018-07-10],[そらそれ (じゃが山たらヲ)] IN MY ROOM (Fate/Grand Order) [2018年7月10日],IN MY ROOM,japanese,jagayamatarawo,sorasore,doujinshi,fate grand order,"gudao, helena blavatsky","nakadashi, lolicon, stockings, blowjob, sole female, sole male",22,2018-07-07 18:50:50,2018-07-08 01:50:50,2025-03-03 10:54:35
238935,(C93) [Peko Renmei (Aquajet Kosuke)] Kimi kara egao o ubatte gomen,(C93) [ぺこ連盟 (AJこーすけ)] キミから笑顔を奪ってごめん,Kimi kara egao o ubatte gomen,japanese,aquajet kosuke,peko renmei,doujinshi,original,,"kissing, anal, bondage, males only, yaoi, rape, shotacon",33,2018-07-07 18:58:35,2018-07-08 01:58:35,2025-03-03 10:54:34
238936,[sorani] Shujuu Complex,[sorani] 主従コンプレックス,Shujuu Complex,japanese,sorani,,manga,,,"maid, big breasts, schoolboy uniform, group, glasses, schoolgirl uniform, nakadashi, ffm threesome, defloration, paizuri, blowjob, sole male",102,2018-07-07 19:03:14,2018-07-08 02:03:14,2025-03-03 10:54:34
238937,[Melonbooks]  Ritoru Monsutaa~ Ritaa~nzu,テーマ別画集第9弾「りとるもんすたぁ～りたぁ～んず」,Ritoru Monsutaanzu,japanese,"ichiri, henreader, kisaragi miyu, yukino minato, azuma yuki, kuromotokun, focke wolf, rouka",,doujinshi,original,,"lolicon, full color, artbook",17,2018-07-07 19:07:28,2018-07-08 02:07:28,2025-03-03 10:54:34
238938,[Mochi] Onibana Muzan | Withering Oni Flowers Ch. 1-4 [English] [ATF] [Digital],[モチ] 鬼華憮散 第1-4話 [英訳] [DL版],Onibana Muzan | Withering Oni Flowers Ch. 1-4,"english, translated",mochi,,manga,,,"oni, kissing, old man, triple penetration, group, cervix penetration, nakadashi, ahegao, ryona, wolf girl, bondage, lolicon, defloration, double penetration, mind break, rape, blackmail, muscle, big penis, horns",77,2018-07-07 19:25:15,2018-07-08 02:25:15,2025-03-03 10:54:34
238939,[Abujan (Roger Mango)] Kemono Ana Vol. 04 (Gin no Saji),[アブジャン (ロジャー・マンゴー)] 獣穴Vol.04～おじ様グループ中出しパコ会～ (銀の匙),Kemono Ana Vol. 04,japanese,matrix one,mizu,doujinshi,silver spoon,aki mikage,"milf, big breasts, group, bestiality, nakadashi, ahegao, anal, sex toys, bondage, whip, full color, human pet, inflation, double penetration, paizuri, bukkake, mosaic censorship, large insertions, blowjob, big penis, collar, tail plug",84,2018-07-07 19:43:32,2018-07-08 02:43:32,2025-03-03 10:54:35
238940,[Yottanchi (Yottan)] Ashikoki [Digital],[よったんち (ヨッタン)] 足コキ [DL版],Ashikoki,japanese,yottan,yottanchi,doujinshi,original,,"business suit, big breasts, nurse, schoolgirl uniform, foot licking, footjob, pantyhose, smell, mosaic censorship, teacher",26,2018-07-07 19:44:44,2018-07-08 02:44:44,2025-03-03 10:54:35
238941,[Touma Ran] Nounai Inran Choukyou | Dirty Training Inside the Brain (Kinbaku no Uzuki) [Chinese] [Decensored],[冬魔乱] 脳内淫乱調教 (緊縛の疼き) [中国翻訳] [無修正],Nounai Inran Choukyou | Dirty Training Inside the Brain,"translated, chinese",touma ran,,manga,,,"milf, females only, uncensored, femdom, mother, incest, daughter",20,2018-07-07 19:45:37,2018-07-08 02:45:37,2025-03-03 10:54:35
238942,"(C89) [Mofu Shippo Lab (Subaru.)] Kyoudai de Tomodachi de Koibito na Boku to Neko | Siblings, Friends, Lovers: My life with a cat (Touhou Project) [English] [ATF]",(C89) [もふしっぽらぼ (すばる。)] 姉弟で友達で恋人な僕と猫 (東方Project) [英訳],"Kyoudai de Tomodachi de Koibito na Boku to Neko | Siblings, Friends, Lovers: My life with a cat","english, translated",nakamura subaru,mofu shippo lab,doujinshi,touhou project,chen,"handjob, cunnilingus, lolicon, blowjob, catgirl, shotacon, sole female, sole male, kemonomimi",31,2018-07-07 19:53:24,2018-07-08 02:53:24,2025-03-03 10:54:35
238943,[yun-uyeon (ooyun)] How to use dolls 05 (Girls Frontline) [Chinese] [吹雪翻譯],[윤우연 (ooyun)] 人形的正確用法 - How to use dolls 05 (少女前線) [中国翻訳],How to use dolls 05,"translated, chinese",ooyun,,doujinshi,girls frontline,k2,"mmf threesome, group, uncensored, anal, military, full color, double penetration, pantyhose, sole female",14,2018-07-07 19:54:12,2018-07-08 02:54:12,2025-03-03 10:54:35
238945,(Kouroumu 10) [Nagiyamasugi (Nagiyama)] Hifuu Ryoujoku 1 - Renko Chikan Densha (Touhou Project) [English] [robypoo],(紅楼夢10) [ナギヤマスギ (那岐山)] 秘封陵辱1 蓮子痴漢電車 (東方Project) [英訳],Hifuu Ryoujoku 1 - Renko Chikan Densha,"english, translated",nagiyama,nagiyamasugi,doujinshi,touhou project,renko usami,"squirting, nakadashi, defloration, rape, dilf, chikan",22,2018-07-07 19:57:29,2018-07-08 02:57:29,2025-03-03 10:54:36
238946,(Reitaisai 15) [Kinokomushin (Kinokomushi)] KINOKOS TOUHOU BOX (Touhou Project),(例大祭15) [きのこむ神 (きのこむし)] KINOKOS TOUHOU BOX (東方Project),KINOKOS TOUHOU BOX,japanese,kinokomushi,kinokomushin,doujinshi,touhou project,"koishi komeiji, utsuho reiuji, satori komeiji",lolicon,105,2018-07-07 20:19:59,2018-07-08 03:19:59,2025-03-03 10:54:36
238947,(C67) [Okachimentaiko (H-H)] Dears - Mitsuka Sensei no Ikenai Tokubetsu Hoshuu | Mitsuka Sensei's Forbidden Special Training (H-H Soushuuhen 4) (DearS) [English] [EHCOVE],(C67) [おかちめんたいこ (H-H)] Dears 蜜香先生のいけない特別補習 (H・H総集編4) (ディアーズ) [英訳],Dears - Mitsuka Sensei no Ikenai Tokubetsu Hoshuu | Mitsuka Sensei's Forbidden Special Training,"english, translated",h-h,okachimentaiko,doujinshi,dears,mitsuka yoshimine,"milf, big breasts, garter belt, group, big ass, cheating, nakadashi, anal, hairy, double penetration, big areolae, stockings, paizuri, bukkake, teacher, blowjob, sole female",18,2018-07-07 20:20:52,2018-07-08 03:20:52,2025-03-03 10:54:36
238948,(C93) [Shouyu no Sato (Kirishima Ayu)] Double Raikou Kyousoukyoku (Fate/Grand Order),(C93) [醤油の里 (霧島鮎)] だぶるライコウ狂槍曲 (Fate/Grand Order),Double Raikou Kyousoukyoku,japanese,kirishima ayu,shouyu no sato,doujinshi,fate grand order,"gudao, minamoto no raikou","big breasts, swimsuit, group, big ass, ffm threesome, bodysuit, sole male",26,2018-07-07 20:22:04,2018-07-08 03:22:04,2025-03-03 10:54:36
238949,[Tanabe Kyou] Little My Star (Petitx) [English] [progste],[田辺京] りる☆まい☆すたー☆ (ぷ痴っくす) [英訳],Little My Star,"english, translated",tanabe kyou,,manga,,,"breast feeding, prostitution, condom, stockings, paizuri, oppai loli, bbm, sole female, sole male",25,2018-07-07 20:23:16,2018-07-08 03:23:16,2025-03-03 10:54:37
238950,[Tanabe Kyou] Petanko Bitch Ch. 3-5 [English],[田辺京] ぺたん娘♥びっち 第3-5話 [英訳],Petanko Bitch Ch. 3-5,"english, translated",tanabe kyou,,manga,,,"virginity, big breasts, mmf threesome, group, glasses, nakadashi, anal, niece, dark skin, lolicon, defloration, incest, double penetration, stockings, rimjob, gyaru, paizuri, filming, blowjob, bbm, sole female",72,2018-07-07 20:41:40,2018-07-08 03:41:40,2025-03-03 10:54:37
238951,[Nippa Takahide] Kusari no Kuni no Anoko (COMIC Mugen Tensei 2018-05) [Chinese] [沒有漢化] [Digital],[新羽隆秀] 鎖の国のあの娘 (COMIC 夢幻転生 2018年5月号) [中国翻訳] [DL版],Kusari no Kuni no Anoko,"translated, chinese",nippa takahide,,manga,,,"oni, full censorship, femdom, lolicon, orgasm denial, age progression, horns",45,2018-07-07 20:43:47,2018-07-08 03:43:47,2025-03-03 10:54:37
238952,The Lady Likes It Sweet... [English] [Rewrite],,The Lady Likes It Sweet...,english,sowjun,section-11,doujinshi,majestic prince,rin suzukaze,"nakadashi, femdom, military, mosaic censorship, impregnation, blowjob, sole female",56,2018-07-07 22:02:41,2018-07-08 05:02:41,2025-03-03 10:54:37
238953,[gloomy seven (Katou Piko)] Be my honey (Yuri on Ice) [Digital],[gloomy seven (加藤ぴこ)] Be my honey (ユーリ!!! on ICE) [DL版],Be my honey,japanese,katou piko,gloomy seven,doujinshi,yuri on ice,"victor nikiforov, yuuri katsuki",gender bender,36,2018-07-07 22:04:11,2018-07-08 05:04:11,2025-03-03 10:54:37
238954,[CARNELIAN] Oyome-san ni Shite Kudasai (Kantai Collection -KanColle-) [Digital],[CARNELIAN] お嫁さんにしてください (艦隊これくしょん -艦これ-) [DL版],Oyome-san ni Shite Kudasai,japanese,carnelian,carnelian,doujinshi,kantai collection,"yamato, teitoku","sole female, sole male, ponytail",19,2018-07-07 22:04:58,2018-07-08 05:04:58,2025-03-03 10:54:37
238955,[Binatsu] 私はそれを拒めない 遥は二度寝取られる,[びなつ] 私はそれを拒めない 遥は二度寝取られる,私はそれを拒めない 遥は二度寝取られる,japanese,,binatsu,doujinshi,original,,"full color, sole female",43,2018-07-07 22:06:39,2018-07-08 05:06:39,2025-03-03 10:54:38
238956,[ginko aratame sakaki] Bishoujo Sailor Senshi Ijimetai (Bishoujo Senshi Sailor Moon),[ginko改めsakaki] 美少女セーラー戦士いじめ隊 (美少女戦士セーラームーン),Bishoujo Sailor Senshi Ijimetai,japanese,ginko,,doujinshi,sailor moon,"sailor jupiter, sailor saturn, sailor moon, sailor pluto, sailor mercury, sailor neptune, sailor uranus, sailor venus, sailor mars","scat, bondage, full color, mosaic censorship",24,2018-07-07 22:07:39,2018-07-08 05:07:39,2025-03-03 10:54:37
238957,[Rocket Monkey] Tsuki ga Noboru Zenpen | Moonrise Zenpen (COMIC HOTMILK 2018-08) [English] [sureok1] [Digital],[ロケットモンキー] 月がのぼる 前編 (コミックホットミルク 2018年8月号) [英訳] [DL版],Tsuki ga Noboru Zenpen | Moonrise Zenpen,"english, translated",rocket monkey,,manga,,,"big breasts, bbw, full censorship, netorare, condom, coach, hairy, x-ray, smell, tall girl, teacher, bloomers, dilf, blackmail, tomboy, bbm, sole female, sole male",26,2018-07-07 22:08:55,2018-07-08 05:08:55,2025-03-03 10:54:37
238958,(Reitaisai 15) [110-GROOVE (Itou Yuuji)] Sakuya-san VS Meiling-san (Touhou Project),(例大祭15) [110-GROOVE (イトウゆーじ)] 咲夜さんVS美鈴さん (東方Project),Sakuyasan,japanese,itou yuuji,110-groove,doujinshi,touhou project,"hong meiling, sakuya izayoi","maid, futanari, big breasts, paizuri, blowjob, dick growth",22,2018-07-07 22:09:58,2018-07-08 05:09:58,2025-03-03 10:54:37
238959,[IncluDe (Foolest)] Itazura wa Yousei no Honnou desu (Touhou Project) [2018-06],[IncluDe (ふぅりすと)] 悪戯は妖精の本能です (東方Project) [2018年6月],Itazura wa Yousei no Honnou desu,japanese,foolest,include,doujinshi,touhou project,star sapphire,"nakadashi, femdom, lolicon, fairy, blindfold, bbm, sole female, sole male, bald",20,2018-07-07 22:14:36,2018-07-08 05:14:36,2025-03-03 10:54:38
238960,(COMIC1☆13) [ROCK CLIME (Danbo)] Portland no Yawaraka na Tawawa - Soft TA-WA-WA of Portland (Azur Lane) [English] [CGrascal],(COMIC1☆13) [ROCK CLIME (ダンボ)] ポートランドのやわらかなたわわ (アズールレーン)  [英訳],Portland no Yawaraka na TawawaWA-WA of Portland,"english, translated",danbo,rock clime,doujinshi,azur lane,portland,"big breasts, unusual pupils, first person perspective, sole female, sole male",22,2018-07-07 22:15:39,2018-07-08 05:15:39,2025-03-03 10:54:38
238961,[French letter (Fujisaki Hikari)] Touhou Soushuuhen (Touhou Project) [Digital],[French letter (藤崎ひかり)] 東方総集編 (東方Project) [DL版],Touhou Soushuuhen,japanese,fujisaki hikari,french letter,doujinshi,touhou project,"flandre scarlet, remilia scarlet","wings, full censorship, schoolgirl uniform, bondage, sleeping, lolicon, full color, stockings",84,2018-07-07 22:32:16,2018-07-08 05:32:16,2025-03-03 10:54:38
238962,"(COMIC1☆13) [Hokkebain! (Halcon)] Mousou Zakki MURAMURA (Soukou Akki Muramasa, Girls und Panzer, Amagami)",(COMIC1☆13) [ほっけばいん! (はるこん)] 妄想雑記 MURAMURA (装甲悪鬼村正、ガールズ&パンツァー、アマガミ),Mousou Zakki MURAMURA,japanese,halcon,hokkebain,doujinshi,"girls und panzer, full metal daemon muramasa, amagami","mako reizei, ai nanasaki, muramasa, nisei muramasa","swimsuit, gag, group, condom, anal, sex toys, ffm threesome, bondage, dark skin, lolicon, footjob, stockings, school swimsuit, blindfold, collar, oyakodon",18,2018-07-07 22:36:26,2018-07-08 05:36:26,2025-03-03 10:54:38
238963,(IDOL STAR FESTIV@L 05) [Haru Koubou (Harukoubou Norimaki)] MILLIERO.02 (THE IDOLM@STER MILLION LIVE!),(IDOL STAR FESTIV@L 05) [春工房 (春工房のりまき)] MILLIERO.02 (アイドルマスター ミリオンライブ!),MILLIERO.02,japanese,harukoubou norimaki,haru koubou,doujinshi,the idolmaster,"nao yokoyama, megumi tokoro, elena shimabara, kotoha tanaka","group, schoolgirl uniform, harem, ponytail",36,2018-07-07 22:38:14,2018-07-08 05:38:14,2025-03-03 10:54:38
238964,(SC2018 Summer) [+Elegy (mt)] St. Louis wa Aisaretai (Azur Lane),(サンクリ2018 Summer) [+Elegy (mt)] セントルイスは愛されたい (アズールレーン),St. Louis wa Aisaretai,japanese,mt,plus elegy,doujinshi,azur lane,st. louis,"big breasts, stockings, sole female, ponytail",26,2018-07-07 22:39:39,2018-07-08 05:39:39,2025-03-03 10:54:39
238966,"(SC2018 Summer) [TwinBox (Hanahanamaki, Sousouman)] Amaetaku Naru Maid-chou (Azur Lane)",(サンクリ2018 Summer) [TwinBox (花花捲、草草饅)] 甘えたくなるメイド長 (アズールレーン),Amaetaku Naru Maid-chou,japanese,"sousouman, hanahanamaki",twinbox,doujinshi,azur lane,belfast,"maid, big breasts, stockings, collar, sole female, sole male",18,2018-07-07 22:47:27,2018-07-08 05:47:27,2025-03-03 10:54:39
238967,(SC2018 Summer) [Testa Chuubou (Testa)] Arisu-chan to Icha Love Ecchi Suru dake no Hon (Girls und Panzer),(サンクリ2018 Summer) [てすた厨房 (てすた)] 愛里寿ちゃんといちゃらぶえっちするだけの本 (ガールズ&パンツァー),Arisu-chan to Icha Love Ecchi Suru dake no Hon,japanese,testa,testa kitchen,doujinshi,girls und panzer,arisu shimada,"full censorship, anal, lolicon, stockings, sole female",18,2018-07-07 22:51:00,2018-07-08 05:51:00,2025-03-03 10:54:39
238968,(C59) [Juukan Oukoku (Toyoshima Yuusaku)] Yuusaku No Doremi♪ (Ojamajo Doremi) [English] [biribiri],(C59) [ジュウカンオウコク (豊島ゆーさく)] ゆーさくのどれみ♪ (おジャ魔女どれみ) [英訳],Yuusaku No Doremi♪,"english, translated",toyoshima yuusaku,juukan oukoku,doujinshi,ojamajo doremi,doremi harukaze,"lolicon, rape",31,2018-07-08 02:07:38,2018-07-08 09:07:38,2025-03-03 10:54:39
238969,[Shioroku] Onnanoko Houimou,[シオロク] おんなのこ包囲網,Onnanoko Houimou,japanese,shioroku,,manga,,,"big breasts, group, glasses, story arc, nakadashi, ffm threesome, harem, tankoubon, stockings, lingerie, twintails",198,2018-07-08 02:17:20,2018-07-08 09:17:20,2025-03-03 10:54:40
238971,[Bu-chan] Mama Zukushi,[ぶーちゃん] ママづくし + 8P小冊子,Mama Zukushi,japanese,bu-chan,,manga,,,"milf, big breasts, mmf threesome, group, glasses, big ass, nakadashi, ahegao, huge breasts, anal, blowjob face, femdom, mother, dark skin, incest, tanlines, tankoubon, big areolae, gyaru, dilf, impregnation, blowjob, muscle, shotacon, oyakodon",214,2018-07-08 03:16:06,2018-07-08 10:16:06,2025-03-03 10:54:40
238972,(C92) [Takotsuboya (TK)] Teitoku no Ketsudan Zettai Kokubouken | Admiral's Decision: Absolute National Defense Zone (Kantai Collection -KanColle-) [English] [N04h],(C92) [蛸壷屋 (TK)] テートクの決断 絶対国防圏 (艦隊これくしょん -艦これ-) [英訳],Teitoku no Ketsudan Zettai Kokubouken | Admiral's Decision: Absolute National Defense Zone,"english, translated",tk,takotsuboya,doujinshi,kantai collection,"zuikaku, yukikaze, kaga","yuri, multi-work series",60,2018-07-08 03:19:11,2018-07-08 10:19:11,2025-03-03 10:54:40
238973,(Lyrical Magical 25) [Hinatabokko Club (FuraFura)] Otona no Jikan (Magical Girl Lyrical Nanoha),(リリカルマジカル25) [ひなたぼっこ倶楽部 (ふらふら)] 大人の時間 (魔法少女リリカルなのは),Otona no Jikan,japanese,furafura,hinatabokko club,doujinshi,mahou shoujo lyrical nanoha,nove,"females only, yuri, drunk",16,2018-07-08 03:20:01,2018-07-08 10:20:01,2025-03-03 10:54:40
238974,[Shihai Shoujo (Dining)] Medaka The End 2 (Medaka Box) [English] [J-Eye],[支配少女 (ダイニング)] めだか・ジ・エンド2 (めだかボックス) [英訳],Medaka The End 2,"english, translated",dining,shihai shoujo,doujinshi,medaka box,medaka kurokami,"scat, humiliation, piercing, females only, schoolgirl uniform, urination, femdom, coprophagia, exhibitionism, yuri, mind control, human pet, stockings, collar, piss drinking, slave",19,2018-07-08 03:20:59,2018-07-08 10:20:59,2025-03-03 10:54:40
238975,(C88) [Toxic Store (Tocky)] Kantai Illustration (Kantai Collection -KanColle-),(C88) [Toxic Store (Tocky)] 艦隊いらすとれいしょん (艦隊これくしょん -艦これ-),Kantai Illustration,japanese,tocky,toxic store,doujinshi,kantai collection,,"low lolicon, lolicon, low shotacon, shotacon",70,2018-07-08 03:24:01,2018-07-08 10:24:01,2025-03-03 10:54:40
238976,(C82) [Bizensiki Roroppu (Bizen)] Okaeri no Oshiri Ecchi [English] [DFC],(C82) [備前式ロロップ (備前)] おかえりのおしりえっち [英訳],Okaeri no Oshiri Ecchi,"english, translated",bizen,bizensiki roroppu,doujinshi,original,,"schoolgirl uniform, urination, anal, lolicon, incest, sister, sole female, sole male, twintails",26,2018-07-08 06:06:26,2018-07-08 13:06:26,2025-03-03 10:54:40
238977,(C88) [Dadachamame (TTOMM)] OILY (THE IDOLM@STER),(C88) [だだちゃまめ (TTOMM)] OILY (アイドルマスター),OILY,japanese,ttomm,dadachamame,doujinshi,the idolmaster,iori minase,"swimsuit, bikini, lolicon, tanlines",23,2018-07-08 06:10:51,2018-07-08 13:10:51,2025-03-03 10:54:40
238979,(C88) [SLeeVe (Sody)] Chicchai Ko no Hon Vol. 5,(C88) [SLeeVe (Sody)] ちっちゃいこの本 Vol.5,Chicchai Ko no Hon Vol. 5,japanese,sody,sleeve,doujinshi,original,,"glasses, anal, sex toys, bondage, lolicon, full color, tanlines, mosaic censorship, rape, sole male, ponytail, twintails",20,2018-07-08 06:16:27,2018-07-08 13:16:27,2025-03-03 10:54:41
