ID,EN_TITLE,JP_TITLE,CLEAN_TITLE,LANGUAGE,ARTIST,GROUP_NAME,CATEGORY,PARODY,CHARACTER,TAGS,PAGES,UPLOAD_DATE,FORMATTED_DATE,SCRAPED_DATE
238291,(C92) [Yakisaba Teishoku (Buri no Teriyaki)] FGO Teishoku Rakugakibon (Fate/Grand Order) [Chinese]【瓜皮汉化】,(C92) [焼鯖定食 (鰤乃照焼)] FGO定食ラクガキ本 (Fate/Grand Order) [中国翻訳],FGO Teishoku Rakugakibon【瓜皮汉化】,"translated, chinese",buri no teriyaki,yakisaba teishoku,doujinshi,fate grand order,"jeanne darc, shielder, astolfo",full color,17,2018-07-01 02:01:03,2018-07-01 09:01:03,2025-03-03 10:52:49
238292,[Kazuhiro] Aijou no Injoku Elf,[一弘] 愛嬢の淫辱エルフ,Aijou no Injoku Elf,japanese,kazuhiro,,manga,,,"birth, elf, big breasts, urethra insertion, double anal, piercing, pregnant, nipple birth, mmf threesome, group, netorare, milking, nakadashi, ahegao, huge breasts, anal, harem, nipple fuck, inflation, prolapse, breast expansion, tankoubon, lactation, stockings, insect, mind break, impregnation, collar, tentacles, eggs, stomach deformation",240,2018-07-01 02:13:34,2018-07-01 09:13:34,2025-03-03 10:52:49
238293,[Komickers (Kurei Daisuke)] Ja Ja Inunarashi (Granblue Fantasy) [Digital],[Komickers (暮井大助)] じゃじゃ狗ならし (グランブルーファンタジー) [DL版],Ja Ja Inunarashi,japanese,kurei daisuke,komickers,doujinshi,granblue fantasy,yuisis,"scat, piercing, spanking, urination, bondage, hairy, prolapse, drugs, hairy armpits, slave, sole female, sole male, kemonomimi",28,2018-07-01 02:15:09,2018-07-01 09:15:09,2025-03-03 10:52:49
238294,[テラス] 凛子 寝取られとおまけ（Chinese）,【黑条汉化】[テラス] 凛子 寝取られとおまけ,凛子 寝取られとおまけ（Chinese）,"translated, chinese",terasu,,doujinshi,"love plus, jikkyou powerful pro yakyuu",rinko kobayakawa,netorare,45,2018-07-01 02:18:44,2018-07-01 09:18:44,2025-03-03 10:52:50
238295,(C50) [DEROLIAN (Shark Yaminabe)] Tenkuu no Escaflowne (The Vision of Escaflowne),(C50) [デロリアン (シャーク闇鍋)] 天空のエロスカフローネ (天空のエスカフローネ),Tenkuu no Escaflowne,japanese,shark yaminabe,derolian,doujinshi,the vision of escaflowne,"merle, van fanel, hitomi kanzaki, allen schezar, dilandau albatou","futanari, schoolgirl uniform, anal, lolicon, double penetration, catgirl, autofellatio, kemonomimi",66,2018-07-01 03:00:55,2018-07-01 10:00:55,2025-03-03 10:52:50
238296,"(C54) [DEROLIAN (Raijin Maru, Shark Yaminabe)] YAT Anshin? Uchuu Ryokou (YAT Anshin! Uchuu Ryokou)",(C54) [デロリアン (雷神丸、シャーク闇鍋)] YAT安心?宇宙旅行 (YAT安心! 宇宙旅行),YAT Anshin? Uchuu Ryokou,japanese,"shark yaminabe, raijin maru",derolian,doujinshi,yat space travel agency,"katsura tenjoin, goro hoshiwatari","piercing, big nipples, lolicon",34,2018-07-01 03:16:17,2018-07-01 10:16:17,2025-03-03 10:52:50
238297,(C84) [Yuuji Wonder (Sumino Yuuji)] BROKEN SWORD (Dokidoki! Precure),(C84) [ゆうじワンダー (速野悠二)] BROKEN SWORD (ドキドキ!プリキュア),BROKEN SWORD,japanese,sumino yuuji,yuuji wonder,doujinshi,dokidoki precure,"alice yotsuba, makoto kenzaki","futanari, magical girl, anal, thigh high boots, defloration, dick growth",26,2018-07-01 06:01:19,2018-07-01 13:01:19,2025-03-03 10:52:50
238298,(C72) [Harakiri Yakkyoku (Karura Jun)] Queen's Bontage (Etrian Odyssey),(C72) [腹切薬局 (迦楼羅淳)] Queen's Bontage (世界樹の迷宮),Queen's Bontage,japanese,karura jun,harakiri yakkyoku,doujinshi,etrian odyssey,,"futanari, group, bondage, dick growth, dickgirl on dickgirl, dickgirls only",26,2018-07-01 06:02:39,2018-07-01 13:02:39,2025-03-03 10:52:50
238299,(C73) [MISS BLACK OFFLINE (MISS BLACK)] Elven no waka Okusama 1 + 1. 5 (Final Fantasy XI),(C73) [MISS BLACK OFFLINE (MISS BLACK)] エルヴァーンの若奥様 1+1.5 (ファイナルファンタジー XI),Elven no waka Okusama 1 + 1. 5,japanese,miss black,miss black offline,doujinshi,final fantasy xi,,"futanari, elf, anal, orgasm denial, blowjob, catgirl",34,2018-07-01 06:04:13,2018-07-01 13:04:13,2025-03-03 10:52:50
238300,(C89) [Sweet Pea (Ooshima Tomo)] NicoMaki Kanshou PARTY (Love Live!),(C89) [スイートピー (大島智)] にこまき鑑賞PARTY (ラブライブ!),NicoMaki Kanshou PARTY,japanese,ooshima tomo,sweet pea,doujinshi,love live,"maki nishikino, nico yazawa","females only, schoolgirl uniform, yuri, small breasts, tribadism, twintails",32,2018-07-01 06:05:41,2018-07-01 13:05:41,2025-03-03 10:52:50
238301,(C90) [Waterfall (Takano Saku)] Himitsu no Jikan (Love Live!),(C90) [Waterfall (嵩乃朔)] 秘密の時間 (ラブライブ!),Himitsu no Jikan,japanese,takano saku,waterfall,doujinshi,love live,"eli ayase, nozomi tojo","females only, yuri, bunny girl, kemonomimi, twintails",32,2018-07-01 06:07:07,2018-07-01 13:07:07,2025-03-03 10:52:50
238302,(C93) [Kuronisiki (Takaharu)] Shigure no Dakigokochi (Kantai Collection -KanColle-) [English] {petra_lal},(C93) [黒錦 (タカハル)] 時雨のだきごこち (艦隊これくしょん -艦これ-) [英訳],Shigure no Dakigokochi,"english, translated",takaharu,kuronisiki,doujinshi,kantai collection,"shigure, teitoku","full censorship, nakadashi, collar, sole female, sole male",27,2018-07-01 06:08:23,2018-07-01 13:08:23,2025-03-03 10:52:50
238303,(C90) [Sweet Pea (Ooshima Tomo)] NICO & MAKI COLLECTION 3 (Love Live!),(C90) [スイートピー (大島智)] NICO & MAKI COLLECTION 3 (ラブライブ!),NICO & MAKI COLLECTION 3,japanese,ooshima tomo,sweet pea,doujinshi,love live,"maki nishikino, nico yazawa","females only, yuri, small breasts, twintails",200,2018-07-01 06:18:27,2018-07-01 13:18:27,2025-03-03 10:52:50
238304,(COMIC1☆13) [Wasanbon (WA)] WASANBON vol.10 (Kantai Collection -KanColle-),(COMIC1☆13) [わさんぼん (WA)] WASANBON vol.10 (艦隊これくしょん -艦これ-),WASANBON vol.10,japanese,wa,wasanbon,doujinshi,kantai collection,"akagi, kaga","dark skin, full color, bunny girl, stockings, pantyhose, leotard, kemonomimi, ponytail",13,2018-07-01 10:02:02,2018-07-01 17:02:02,2025-03-03 10:52:51
238305,(C89) [Akatama (Sakurafubuki Nel)] focus [English] [ATF],(C89) [アカタマ (桜吹雪ねる)] focus [英訳],focus,"english, translated",sakurafubuki nel,akatama,doujinshi,original,,"prostitution, nakadashi, sex toys, lolicon, exhibitionism, bunny girl, stockings, sole female",21,2018-07-01 10:06:45,2018-07-01 17:06:45,2025-03-03 10:52:51
238306,[Konshin] Laura to Kuro no Shiawase no Jumon (COMIC Unreal 2018-06 Vol. 73) [Chinese] [驭灵师个人汉化] [Digital],[魂神] ローラとクロの幸せの呪文 (コミックアンリアル 2018年6月号 Vol.73) [中国翻訳] [DL版],Laura to Kuro no Shiawase no Jumon,"translated, chinese",konshin,,manga,,,"elf, catboy, impregnation, sole female, sole male, kemonomimi",12,2018-07-01 10:07:20,2018-07-01 17:07:20,2025-03-03 10:52:51
238307,[Behind Moon (Q)] YAMATO 2199 Alternative (Space Battleship Yamato 2199) [English] {Hennojin} [Digital],[Behind Moon (Q)] YAMATO 2199 Alternative (宇宙戦艦ヤマト2199) [英訳] [DL版],YAMATO 2199 Alternative,"english, translated",q,behind moon,doujinshi,"space battleship yamato, space battleship yamato 2199","makoto harada, kaoru niimi, yuki mori","futanari, kissing, onahole, glasses, masturbation, multiple penises, replaced, ahegao, anal, hairy, double penetration, bodysuit, fingering, bukkake, blowjob, dickgirl on dickgirl",37,2018-07-01 10:09:03,2018-07-01 17:09:03,2025-03-03 10:52:51
238308,[Yamaguchi Nao] Igyou no Majo,[やまぐち なお] 異形の魔女,Igyou no Majo,japanese,yamaguchi nao,,doujinshi,original,,"monster girl, tentacles, sole female, sole male",123,2018-07-01 10:13:47,2018-07-01 17:13:47,2025-03-03 10:52:51
238309,[Yamaguchi Nao] Peropero Manga,[やまぐち なお] ぺろぺろ漫画,Peropero Manga,japanese,yamaguchi nao,,doujinshi,original,,"monster girl, sole female, sole male, ponytail",12,2018-07-01 10:14:20,2018-07-01 17:14:20,2025-03-03 10:52:52
238310,(C55) [Enmaya (Various)] Sakuracchi (Cardcaptor Sakura),(C55) [えんま屋 (よろず)] さくらっち (カードキャプターさくら),Sakuracchi,japanese,bob.,enmaya,doujinshi,cardcaptor sakura,"syaoran li, tomoyo daidouji, sakura kinomoto","schoolboy uniform, schoolgirl uniform, ffm threesome, lolicon, blowjob, shotacon",36,2018-07-01 10:23:23,2018-07-01 17:23:23,2025-03-03 10:52:52
238311,(C62) [Yanasegawabeya (Various)] Kanwakyuudai (Various),(C62) [柳瀬川部屋 (よろず)] 閑話休題 (よろず),Kanwakyuudai,japanese,"u-tom, kiyose, hagunsei",yanasegawabeya,doujinshi,devilman,,"glasses, lolicon",36,2018-07-01 10:34:54,2018-07-01 17:34:54,2025-03-03 10:52:52
238312,[YOSHITORA] Henkyou no Seijo,[YOSHITORA] 辺境の聖女,Henkyou no Seijo,japanese,yoshitora,,doujinshi,original,,"snuff, vore, guro",26,2018-07-01 10:36:05,2018-07-01 17:36:05,2025-03-03 10:52:53
238313,[Ukikotatsu] Nagasare Sensei,[うきこたつ] ながされ先生,Nagasare Sensei,japanese,ukikotatsu,,doujinshi,original,,"business suit, kissing, cheating, pantyhose, mosaic censorship, teacher, blowjob, sole female, sole male",121,2018-07-01 10:40:54,2018-07-01 17:40:54,2025-03-03 10:52:52
238314,(C63) [IZU Ya (Various)] Ishuuin α (Ojamajo Doremi),(C63) [IZU屋 (よろず)] 伊集院α (おジャ魔女どれみ),Ishuuin α,japanese,"izumi hiro 4gou, izumi hiroshi",izuya,doujinshi,ojamajo doremi,,"lolicon, incest, daughter, blowjob",38,2018-07-01 10:52:55,2018-07-01 17:52:55,2025-03-03 10:52:53
238315,(C65) [Anzen Ekisu (Various)] mango pudding (Various),(C65) [安全えきす (よろず)] mango pudding (よろず),mango pudding,japanese,,anzen ekisu,doujinshi,"ojamajo doremi, tokyo mew mew, digimon frontier","hazuki fujiwara, zoe orimoto, doremi harukaze, aiko senoo, poppu harukaze, momoko asuka, hana makihatayama","scat, group, glasses, nakadashi, anal, lolicon, bukkake, blowjob",32,2018-07-01 11:01:41,2018-07-01 18:01:41,2025-03-03 10:52:53
238316,[Oda Natsuki] Onee-chan ni Ecchi na Koto Shicha Ikemasen! 9 (Fire Emblem if),[織田夏樹] お姉ちゃんにエッチなことしちゃいけません! 9 (ファイアーエムブレムif),Onee-chan ni Ecchi na Koto Shicha Ikemasen! 9,japanese,oda natsuki,,doujinshi,fire emblem if,kamui,"elf, big breasts",20,2018-07-01 11:02:47,2018-07-01 18:02:47,2025-03-03 10:52:53
238317,(C68) [Dennougiwa (Takano Iori)] Twins Note (Fushigiboshi no Futagohime),(C68) [電脳戯話 (高野庵)] Twins Note (ふしぎ星の☆ふたご姫),Twins Note,japanese,takano iori,dennougiwa,doujinshi,fushigiboshi no futagohime,"fine, rein","futanari, cunnilingus, lolicon, incest, shotacon",24,2018-07-01 11:09:01,2018-07-01 18:09:01,2025-03-03 10:52:53
238318,(C68) [Reien (Kinoshita Rei)] Natsu Ichigo (Ichigo Mashimaro),(C68) [黎en (きのした黎)] 夏苺 (苺ましまろ),Natsu Ichigo,japanese,kinoshita rei,reien,doujinshi,ichigo mashimaro,"ana coppola, matsuri sakuragi, nobue itou, miu matsuoka, chika itou","futanari, group, glasses, lolicon, incest, blowjob",24,2018-07-01 11:13:32,2018-07-01 18:13:32,2025-03-03 10:52:54
238319,(COMIC1☆4) [Wancho-ke (Wancho)] Shita kara K-ON o Mitemiyou (K-ON!),(COMIC1☆4) [わんちょ家 (わんちょ)] したからけいおんをみてみよう (けいおん!),Shita kara K-ON o Mitemiyou,japanese,wancho,wancho-ke,doujinshi,k-on,"ui hirasawa, azusa nakano, yui hirasawa","females only, schoolgirl uniform, lolicon, yuri, incest, oppai loli",32,2018-07-01 11:21:09,2018-07-01 18:21:09,2025-03-03 10:52:54
238320,[Haitukun] Hitozuma Futakoma |地方媽媽小漫畫  [Chinese][Ongoing][變態浣熊漢化組],[Haitukun] ひとづまフタコマ [中国翻訳],Hitozuma Futakoma |地方媽媽小漫畫,"translated, chinese",haitukun,,doujinshi,original,,"milf, big breasts, cheating, impregnation",22,2018-07-01 11:22:04,2018-07-01 18:22:04,2025-03-03 10:52:54
238321,[San Kento] Tomodachi no Haha o Netoru ~Osaerarenai Shoudou 1-11 [Chinese] [超能汉化组],[三顕人] 友達の母を寝取る～抑えられない衝動 1-11 [中国翻訳],Tomodachi no Haha o Netoru ~Osaerarenai Shoudou 1-11,"translated, chinese",grifon,,manga,,,"milf, big breasts, group, full censorship, story arc, sex toys, harem, full color",272,2018-07-01 11:33:26,2018-07-01 18:33:26,2025-03-03 10:52:54
238322,[Pan to Butterfly. (Tokei Usagi)] Tenkuu no Konyoku Monogatari (Dragon Quest V) [Chinese] [TF机翻] [Digital],[パンとバタフライ。 (とけーうさぎ)] 天空の混浴物語 (ドラゴンクエストV) [中国翻訳] [DL版],Tenkuu no Konyoku Monogatari,"translated, chinese",tokei usagi,pan to butterfly.,doujinshi,dragon quest v,"tabitha, bianca whitaker, parry","milf, big breasts, nakadashi, mother, lolicon, defloration, incest, mosaic censorship, sister, daughter, shotacon, oyakodon",28,2018-07-01 11:39:20,2018-07-01 18:39:20,2025-03-03 10:52:54
238323,Seishun amigo~datte otoko no ko damon~ (Ookiku Furikabutte),[魚肉ブラザーズ (ハセクラホッケ)] 性春アミーゴ～だって男の子だもーん～ (おおきく振りかぶって),Seishun amigo,japanese,hasekura hokke,gyoniku brothers,doujinshi,ookiku furikabutte,"ren mihashi, takaya abe","males only, yaoi, shotacon",26,2018-07-01 11:45:01,2018-07-01 18:45:01,2025-03-03 10:52:54
238324,[isao] SUKI SUKI (Ecchi MAX!!) [English] [N04h] [Digital],[isao] 好き☆好き (えっちーMAX!!) [英訳] [DL版],SUKI SUKI,"english, translated",isao,,manga,,,"big breasts, schoolboy uniform, glasses, schoolgirl uniform, nakadashi, hairy, paizuri, sole female, sole male",16,2018-07-01 11:45:59,2018-07-01 18:45:59,2025-03-03 10:52:55
238325,[A-10] Load of Trash Kanzenban Ch. 1-11 [Chinese] [沒有漢化],[A-10] Lord of Trash 完全版 第1-11話 [中国翻訳],Load of Trash Kanzenban Ch. 1-11,"translated, chinese",a-10,,manga,,,"glasses, uncensored, story arc, schoolgirl uniform, urination, infantilism, bestiality, anal, femdom, crossdressing, demon girl, footjob, diaper, yaoi, tomgirl, blowjob, gender bender, incomplete, tentacles",172,2018-07-01 12:26:52,2018-07-01 19:26:52,2025-03-03 10:52:55
238326,[FruitsJam (Mikagami Sou)] Ura Mahou Sensei Jamma! 17 (Mahou Sensei Negima!) [Chinese] [輝夜漢化] [Digital],[フルーツジャム (水鏡想)] 裏魔法先生ジャムま！17 (魔法先生ネギま！) [中国翻訳] [DL版],Ura Mahou Sensei Jamma! 17,"translated, chinese",mikagami sou,fruitsjam,doujinshi,mahou sensei negima,"theodora, negi springfield","mmf threesome, group, anal, demon girl, thigh high boots, dark skin, blowjob, sole female",29,2018-07-01 12:28:24,2018-07-01 19:28:24,2025-03-03 10:52:55
238327,[Mousou Engine (Korotsuke)] Izen to Shite Nigate na Senpai (Hitozuma) o Otosu Hanashi [Chinese] [我尻故我在個人漢化],[妄想エンジン (コロツケ)] 依然として苦手な先輩（人妻）を堕とす話 [中国翻訳],Izen to Shite Nigate na Senpaio Otosu Hanashi,"translated, chinese",korotsuke,mousou engine,doujinshi,original,,"milf, big breasts, netorare, nakadashi, ahegao, dark skin, full color, tanlines, stockings, gyaru, lingerie, filming, mind break, mosaic censorship, blackmail, sole female, sole male, beauty mark, ponytail",49,2018-07-01 12:30:34,2018-07-01 19:30:34,2025-03-03 10:52:55
238329,[Kansou Enoki Take (Enoki no Titan)] Benkyou (Naturo),[乾燥榎茸 (えのきのちた)] 勉強 (ナルト),Benkyou,japanese,enoki no titan,kansou enoki take,doujinshi,naruto,,"anal, males only, yaoi, shotacon",21,2018-07-01 14:32:53,2018-07-01 21:32:53,2025-03-03 10:52:56
238330,(BanG Dreamer's Party! 4th STAGE) [Red Chuck (Tyatubo)] Kiss Shite Motto Shiritai (BanG Dream!),(BanG Dreamer's Party! 4th STAGE) [レッドチャック (ちゃつぼ)] キスしてもっと知りたい (BanG Dream!),Kiss Shite Motto Shiritai,japanese,tyatubo,red chuck,doujinshi,bang dream,"saaya yamabuki, tae hanazono","females only, yuri, fingering",30,2018-07-01 14:34:11,2018-07-01 21:34:11,2025-03-03 10:52:56
238331,(C89) [Kurokami Studio S (Mukouhara Shiryu)] Chou o Yumemu (Kantai Collection -KanColle-),(C89) [クロカミスタジオS (むこうはらしりゅう)] 蝶を夢む (艦隊これくしょん -艦これ-),Chou o Yumemu,japanese,mukouhara shiryu,kurokami studio s,doujinshi,kantai collection,"haruna, teitoku","stockings, sole female, sole male",30,2018-07-01 14:35:41,2018-07-01 21:35:41,2025-03-03 10:52:56
238332,(Reitaisai 13) [Tora Koubou (Ken Tatuki)] Parsee Sukebe Shiyouya! (Touhou Project),(例大祭13) [寅工房 (剣辰輝)] パルスィスケベしようや! (東方Project),Parsee Sukebe Shiyouya!,japanese,ken tatuki,tora koubou,doujinshi,touhou project,parsee mizuhashi,sole female,20,2018-07-01 14:36:39,2018-07-01 21:36:39,2025-03-03 10:52:56
238333,(RAG-FES48) [Hakkindo (Suisui)] Immoral SECRAMENT 4 (Ragnarok Online),(RAG-FES48) [白金堂 (すいすい)] Immoral SECRAMENT 4 (ラグナロクオンライン),Immoral SECRAMENT 4,japanese,suisui,hakkindo,doujinshi,ragnarok online,,"orc, monster, rape",18,2018-07-01 14:37:29,2018-07-01 21:37:29,2025-03-03 10:52:56
238334,(C88) [Hikiwari Nattou (Ohayou-san)] Libeccio-chan ga Chakunin Shimashita!! (Kantai Collection -KanColle-),(C88) [ひきわり納豆 (おはようさん)] リベッチオちゃんが着任しました!! (艦隊これくしょん -艦これ-),Libeccio-chan ga Chakunin Shimashita!!,japanese,ohayou-san,hikiwari nattou,doujinshi,kantai collection,"teitoku, libeccio","shimapan, lolicon, full color, mecha girl, sole female, twintails",7,2018-07-01 14:39:14,2018-07-01 21:39:14,2025-03-03 10:52:57
238335,(C82) [Hitsuji Kikaku (HITSUJI)] SHINOBU le DO... (Bakemonogatari),(C82) [ひつじ企画 (HITSUJI)] SHINOBU le DO... (化物語),SHINOBU le DO...,japanese,hitsuji,hitsuji kikaku,doujinshi,bakemonogatari,shinobu oshino,"lolicon, bloomers, blowjob, sole female",26,2018-07-01 14:45:50,2018-07-01 21:45:50,2025-03-03 10:52:57
238336,(C88) [4season (Saeki Nao)]  Love Collection! 2015 4season Love Live! Soushuuhen (Love Live!),(C88) [4season (彩季なお)] Love Collection! 2015 4season Love Live! 総集編 (ラブライブ!),Love Collection! 2015 4season Love Live! Soushuuhen,japanese,saeki nao,4season,doujinshi,love live,"kotori minami, honoka kosaka",yuri,90,2018-07-01 14:50:02,2018-07-01 21:50:02,2025-03-03 10:52:57
238337,(SC2018 Summer) [fluffy x fluffy (Waki)] Koi suru Mafuyu wa Hon ga Ususugite sugu Kaho to Ecchi shichau no. (Blend S),(サンクリ2018 Summer) [fluffy×fluffy (わき)] 恋する麻冬は本が薄すぎてすぐ夏帆とえっちしちゃうの。 (ブレンド・S),Koi suru Mafuyu wa Hon ga Ususugite sugu Kaho to Ecchi shichau no.,japanese,ikawa waki,fluffy x fluffy,doujinshi,blend s,"kaho hinata, mafuyu hoshikawa","females only, yuri",18,2018-07-01 14:50:55,2018-07-01 21:50:55,2025-03-03 10:52:57
238338,(C93) [Sunezumi Fauvism (Jingo Kajiki)] Tora no Kimochi ni Naru desu yo? (THE iDOLM@STER CINDERELLA GIRLS) [Chinese] [大友同好会],(C93) [素鼠フォーヴィスム (神護カジキ)] トラの気持ちになるですよ? (アイドルマスターシンデレラガールズ)[中国翻訳],Tora no Kimochi ni Naru desu yo?,"translated, chinese",jingo kajiki,sunezumi fauvism,doujinshi,the idolmaster,"kaede takagaki, miyu mifune","females only, yuri, catgirl, beauty mark, kemonomimi",21,2018-07-01 14:51:55,2018-07-01 21:51:55,2025-03-03 10:52:57
238339,(COMIC1☆13) [Studio KIMIGABUCHI (Kimimaru)] Ayanami no Oogata Yuden Kaihatsu (Azur Lane),(COMIC1☆13) [スタジオKIMIGABUCHI (きみまる)] 綾波の大型油田開発 (アズールレーン),Ayanami no Oogata Yuden Kaihatsu,japanese,kimimaru,studio kimigabuchi,doujinshi,azur lane,ayanami,"old man, schoolgirl uniform, anal, sole female, sole male, bald",21,2018-07-01 14:52:48,2018-07-01 21:52:48,2025-03-03 10:52:57
238340,(SUPER21) [Gakushokutei (Watanohara)] Yagami Sousakan no Ichigo Milk (Mahou Shoujo Lyrical Nanoha),(SUPER21) [学食亭 (わたのはら)] 八神捜査官のいちごミルク (魔法少女リリカルなのは),Yagami Sousakan no Ichigo Milk,japanese,watanohara,gakushokutei,doujinshi,mahou shoujo lyrical nanoha,hayate yagami,"apron, sole female, sole male",22,2018-07-01 14:53:50,2018-07-01 21:53:50,2025-03-03 10:52:57
238341,"(SC2018 Summer) [Puchimaple (Hisagi)] Yureru Shanai, Kimi no Sekimen. (Yuyushiki)",(サンクリ2018 Summer) [ぷちめいぷる (ひさぎ)] 揺れる車内、キミの赤面。 (ゆゆ式),"Yureru Shanai, Kimi no Sekimen.",japanese,hisagi,puchimaple,doujinshi,yuyushiki,yui ichii,"schoolgirl uniform, lolicon, chikan, sole female",17,2018-07-01 14:54:38,2018-07-01 21:54:38,2025-03-03 10:52:57
238342,(Reitaisai 15) [Terebi-san (Chuusuu Kairo)] Lady no Omochabako - Lady's Toy Box (Touhou Project),(例大祭15) [てれびさん (中枢回路)] レディの玩具箱 (東方Project),Lady no Omochabako - Lady's Toy Box,japanese,chuusuu kairo,terebi-san,doujinshi,touhou project,flandre scarlet,"wings, masturbation, replaced, anal, sex toys, solo action, lolicon, double penetration",22,2018-07-01 14:58:17,2018-07-01 21:58:17,2025-03-03 10:52:57
238343,(COMIC1☆13) [Karuwani (Rama)] Nanmokanmo Mujikaku de Muboubi na Sanzou-chan ga Warui. (Fate/Grand Order),(COMIC1☆13) [かるわに (らま)] なんもかんも無自覚で無防備な三蔵ちゃんが悪い。 (Fate/Grand Order),Nanmokanmo Mujikaku de Muboubi na Sanzou-chan ga Warui.,japanese,rama,karuwani,doujinshi,fate grand order,"gudao, xuanzang","big breasts, replaced, nakadashi, sleeping, paizuri, inverted nipples, sole female, sole male",22,2018-07-01 14:59:15,2018-07-01 21:59:15,2025-03-03 10:52:58
238344,[Cute (Kamiya Tomoe)] Momiji-san Hakarareru (Touhou Project) [Digital],[Cute (神谷ともえ)] 椛さん謀られるっ (東方Project) [DL版],Momiji-san Hakarareru,japanese,kamiya tomoe,cute,doujinshi,touhou project,"momiji inubashiri, aya shameimaru","blindfold, kemonomimi",18,2018-07-01 15:00:02,2018-07-01 22:00:02,2025-03-03 10:52:58
238345,(COMIC1☆13) [ENJOY MIX (Tokiai Haya)] Akashi Daisuki nya! (Azur Lane),(COMIC1☆13) [ENJOY MIX (伽藍快)] 明石ダイスキにゃ! (アズールレーン),Akashi Daisuki nya!,japanese,tokiai haya,enjoy mix,doujinshi,azur lane,akashi,"lolicon, full color, catgirl, bandaid, sole female, sole male, beauty mark, kemonomimi",14,2018-07-01 15:03:09,2018-07-01 22:03:09,2025-03-03 10:52:58
238346,"(C83) [Wagamama Dou (Syowmaru, NIO)] Pairozetter (Chousoku Henkei Gyrozetter)",(C83) [我儘堂 (翔丸、NIO)] パイロゼッター (超速変形ジャイロゼッター),Pairozetter,japanese,syowmaru,wagamama dou,doujinshi,chousoku henkei gyrozetter,rui akana,"sole female, sole male",26,2018-07-01 15:04:19,2018-07-01 22:04:19,2025-03-03 10:52:58
238347,[Nukodayo (Nukoda)] Metsubou Confuse (Hinabita) [Digital],[ぬこだよ (ぬこだ)] 滅亡こんふゅーず (ひなビタ♪) [DL版],Metsubou Confuse,japanese,nukoda,nukodayo,doujinshi,hinabita,,"schoolgirl uniform, nakadashi, blowjob, sole female",21,2018-07-01 15:05:22,2018-07-01 22:05:22,2025-03-03 10:52:58
238348,(Reitaisai 15) [Drink it! (ODD)] Konna ni Kawaii Kanojo wa Ari? Nashi? (Touhou Project) [Chinese] [好想玩梗汉化组],(例大祭15) [Drink it! (オード)] こんなに可愛い彼女はあり?なし? (東方Project) [中国翻訳],Konna ni Kawaii Kanojo wa Ari? Nashi?,"translated, chinese",odd,drink it,doujinshi,touhou project,"yukari yakumo, yuyuko saigyouji","females only, sex toys, yuri",22,2018-07-01 15:06:22,2018-07-01 22:06:22,2025-03-03 10:52:58
238349,[Gotoh Akira] 21-ji no Onna ~Newscaster Katsuki Miki~ Bangaihen Kamera no Mae no Mesu Inu 10 | The Bitch in Front of the Camera 10 (Manga Bangaichi 2016-09) [English] [Zero Translations],[後藤晶] 21時の女～ニュースキャスター桂木美紀～ 番外編 カメラの前の牝犬10 (漫画ばんがいち 2016年9月号) [英訳],21-ji no OnnaBangaihen Kamera no Mae no Mesu Inu 10 | The Bitch in Front of the Camera 10,"english, translated",gotoh akira,,manga,,,"pegging, strap-on, cunnilingus, corset, group, anal, sex toys, ffm threesome, femdom, bondage, stockings, mosaic censorship, collar, sole male, tail plug",20,2018-07-01 15:07:18,2018-07-01 22:07:18,2025-03-03 10:52:59
238350,(C92) [Kurokami Studio S (Mukouhara Shiryu)] Aibiki Monochrome (Kantai Collection -KanColle-),(C92) [クロカミスタジオS (むこうはらしりゅう)] アイビキモノクロヲム (艦隊これくしょん -艦これ-),Aibiki Monochrome,japanese,mukouhara shiryu,kurokami studio s,doujinshi,kantai collection,"haruna, teitoku","full censorship, pantyhose, sole female",18,2018-07-01 15:08:08,2018-07-01 22:08:08,2025-03-03 10:52:59
238351,(Zesshou Stage 7) [Hanagara Shirt (Fujikawa Daichi)] Osanazuma wa Renkinjutsushi 1 (Senki Zesshou Symphogear GX),(絶唱ステージ7) [花柄シャツ (藤川大智)] 幼妻は錬金術師① (戦姫絶唱シンフォギアGX),Osanazuma wa Renkinjutsushi 1,japanese,fujikawa daichi,hanagara shirt,doujinshi,senki zesshou symphogear,carol malus dienheim,"lolicon, blowjob, sole female, sole male",26,2018-07-01 15:14:31,2018-07-01 22:14:31,2025-03-03 10:52:59
238352,"(C88) [CUNICULUS (Yositama)] A, Hai. Ano... Ganbarimasu! (Kantai Collection -KanColle-)",(C88) [CUNICULUS (ヨシタマ)] あ、はい。あの...頑張ります! (艦隊これくしょん -艦これ-),"A, Hai. Ano... Ganbarimasu!",japanese,yositama,cuniculus,doujinshi,kantai collection,"murakumo, teitoku, isonami","pregnant, ffm threesome, pantyhose, sole male",26,2018-07-01 15:15:42,2018-07-01 22:15:42,2025-03-03 10:52:59
238353,(C82) [Serizawa-Room (Serizawa)] RISAKEI (Amagami),(C82) [芹沢室 (芹沢)] RISAKEI (アマガミ),RISAKEI,japanese,serizawa,serizawa-room,doujinshi,amagami,"risa kamizaki, keiko tanaka, junichi tachibana","schoolgirl uniform, nakadashi, full color",18,2018-07-01 15:16:29,2018-07-01 22:16:29,2025-03-03 10:52:59
