ID,EN_TITLE,JP_TITLE,CLEAN_TITLE,LANGUAGE,ARTIST,GROUP_NAME,CATEGORY,PARODY,CHARACTER,TAGS,PAGES,UPLOAD_DATE,FORMATTED_DATE,SCRAPED_DATE
612683,[Obentou Code Saver (Saboten Rotosu)] Theatrical (Genshin Impact) [Digital],[おべんとうコードセイバー (さぼてんロトス)] Theatrical (原神) [DL版],Theatrical,japanese,saboten rotosu,,doujinshi,genshin impact,"albedo, aether, scaramouche","anal, males only, yaoi, blowjob, anal intercourse",27,2025-12-01 12:43:40,2025-12-01 12:43:40,2025-12-02 14:01:42
612684,[osuwaani] Request Itadaita Mono desu (One Piece) [English],[オスワーニ] リクエストいただいたものです (ワンピース) [英訳],Request Itadaita Mono desu,"english, translated",osuwaani,,doujinshi,one piece,"nami, absalom","big breasts, rape, rough translation",5,2025-12-01 12:44:16,2025-12-01 12:44:16,2025-12-02 14:01:43
612685,[Anon 2-okunen] Ittai Dou Natte Shimau no ka!? (Chinkasu shuu Okazu ni Onanie Saremasu) [Ongoing],[あのん2億年] 一体どうなってしまうのか!? (チンカス臭オカズにオナニーされます) [進行中],Ittai Dou Natte Shimau no ka!?,japanese,anon 2-okunen,,doujinshi,original,,"big breasts, glasses, schoolgirl uniform, phimosis, smell, smegma, tomboy, blowjob, sole female, sole male, pixie cut, no penetration, focus blowjob, nipple stimulation",200,2025-12-01 13:00:47,2025-12-01 13:00:47,2025-12-02 14:01:43
612686,"[Chu~koto 🔞] The Clumsy Nemophila: A Story of a Shy, Busty Girl from Class Begging Me to Date Her",[ちゅ〜こと🔞] 不器用なネモフィラ クラスの陰キャ巨乳女子に付き合ってくれとせがまれた話,"The Clumsy Nemophila: A Story of a Shy, Busty Girl from Class Begging Me to Date Her",japanese,,,doujinshi,original,,"sweating, big breasts, nakadashi, hairy, x-ray, multi-work series, paizuri, blowjob, deepthroat, sole female, sole male, eye-covering bang",51,2025-12-01 13:03:54,2025-12-01 13:03:54,2025-12-02 14:01:44
612687,[至室] ふたなり新島真の精子と情報を搾る (ペルソナ5),[至室] ふたなり新島真の精子と情報を搾る (ペルソナ5),ふたなり新島真の精子と情報を搾る,japanese,shimuro itaru,,doujinshi,persona 5,makoto niijima,"handjob, bondage, shemale, invisible, sole male, sole dickgirl, bald, no penetration, multiple orgasms",8,2025-12-01 13:04:38,2025-12-01 13:04:38,2025-12-02 14:01:44
612688,"[Chu~koto 🔞] The Clumsy Nemophila 2: A Story of a Shy, Busty Girl Having Intimacy on the School Rooftop",[ちゅ〜こと🔞] 不器用なネモフィラ2 陰キャ巨乳女子と学校の屋上でエッチする話,"The Clumsy Nemophila 2: A Story of a Shy, Busty Girl Having Intimacy on the School Rooftop",japanese,,,doujinshi,original,,"sweating, big breasts, big ass, schoolgirl uniform, nakadashi, ahegao, asphyxiation, hairy, multi-work series, filming, blowjob, sole male, eye-covering bang",30,2025-12-01 13:06:29,2025-12-01 13:06:29,2025-12-02 14:01:45
612689,[Chu~koto 🔞] The Clumsy Nemophila 3 [Ongoing],[ちゅ〜こと🔞] 不器用なネモフィラ3 [進行中],The Clumsy Nemophila 3,japanese,,,doujinshi,original,,"handjob, sweating, big breasts, x-ray, multi-work series, sole female, sole male",16,2025-12-01 13:07:38,2025-12-01 13:07:38,2025-12-02 14:01:45
612690,"[shokitai | utsuro_butai] Saimin, Kakete Mite | Hypnosis, Give it a Try - Chapter 1 [English] [Morally Bankrupt Wizard Translations]",[書記隊] サイミン、掛けてみて 第1話 [英訳],"Saimin, Kakete Mite | Hypnosis, Give it a Try - Chapter 1","english, translated",shokitai | utsuro butai,,doujinshi,original,,"schoolgirl uniform, mind control, multi-work series, webtoon, no penetration",12,2025-12-01 13:08:37,2025-12-01 13:08:37,2025-12-02 14:01:46
612691,"[Genki Tarou] Kasshoku Ogre Musume no Omanko Security Check [Japanese, English]",[元気太郎] 褐色オーガ娘のおまんこセキュリティチェック [日本語、英語],Kasshoku Ogre Musume no Omanko Security Check,"japanese, english",genki tarou,,doujinshi,original,,"lolicon, x-ray, muscle, stomach deformation, sole female, horns, tail, cumflation",10,2025-12-01 13:10:50,2025-12-01 13:10:50,2025-12-02 14:01:46
612692,"[Genki Tarou] Loli Hina Kana x BBC (Okinawa de Suki ni Natta Ko ga Hougen Sugite Tsura Sugiru) [Japanese, English]",[元気太郎] ロリひなかな×BBC (沖縄で好きになった子が方言すぎてツラすぎる) [日本語、英語],Loli Hina Kana x BBC,"japanese, english",genki tarou,,doujinshi,okinawa de suki ni natta ko ga hougen sugite tsura sugiru,"kana higa, hina kyan","group, nakadashi, ffm threesome, dark skin, lolicon, x-ray, full color, blowjob",10,2025-12-01 13:13:06,2025-12-01 13:13:06,2025-12-02 14:01:47
612693,"[Genki Tarou] Shalem ni Oshiokix Manga (Granblue Fantasy) [Japanese, English]",[元気太郎] シャレムにお仕置きックス漫画 (グランブルーファンタジー) [日本語、英語],Shalem ni Oshiokix Manga,"japanese, english",genki tarou,,doujinshi,granblue fantasy,helel ben shalem,"dark skin, lolicon, full color, multi-work series, oppai loli, sole male",12,2025-12-01 13:15:44,2025-12-01 13:15:44,2025-12-02 14:01:48
612694,[かいせんどんぶり] 年下ADと盛っちゃう美優さん (アイドルマスターシンデレラガールズ),[かいせんどんぶり] 年下ADと盛っちゃう美優さん (アイドルマスターシンデレラガールズ),年下ADと盛っちゃう美優さん,japanese,kaisen donburi,,doujinshi,the idolmaster,miyu mifune,sole female,7,2025-12-01 13:16:24,2025-12-01 13:16:24,2025-12-02 14:01:48
612695,[かいせんどんぶり] めぐるが低身長な王族に奉仕 (アイドルマスターシャイニーカラーズ),[かいせんどんぶり] めぐるが低身長な王族に奉仕 (アイドルマスターシャイニーカラーズ),めぐるが低身長な王族に奉仕,japanese,kaisen donburi,,doujinshi,the idolmaster,meguru hachimiya,"netorare, facesitting, dark skin, rimjob, paizuri, big penis, sole female, no penetration, focus paizuri",7,2025-12-01 13:17:00,2025-12-01 13:17:00,2025-12-02 14:01:49
612696,[IM240 Tamanegi (Various)] Coconuts Island (Naisho no Coconut),[IM240玉葱 (よろず)] Coconuts Island (ないしょのココナッツ),Coconuts Island,japanese,"ruuen rouga, ramiya ryou, marino aya",im240 tamanegi,doujinshi,naisho no coconut,,"leotard, goudoushi, sketch lines",38,2025-12-01 13:19:27,2025-12-01 13:19:27,2025-12-02 14:01:49
612697,[NYPAON] Icha Love (Tachibana-san-chi no Dansei Jijou) [Chinese] [黑锅汉化组],[NYPAON] いちゃらぶ (橘さん家ノ男性事情) [中国翻訳],Icha Love,"translated, chinese",nypaon,,doujinshi,tachibana-san-chi no dansei jijou,"kyouka tachibana, yuika tachibana, koharu tachibana","milf, kissing, big breasts, swimsuit, group, nakadashi, blowjob face, ffm threesome, harem, bikini, full color, incest, paizuri, mosaic censorship, blackmail, blowjob, big penis, sole male, oyakodon, shimaidon, multimouth blowjob, eye-covering bang",38,2025-12-01 13:21:56,2025-12-01 13:21:56,2025-12-02 14:01:50
612698,[Dokuneko Noil] Fan Ichigo Nigo ni Warui Koto o Suru Hanashi (Zenpen) (Bocchi the Rock!),[毒猫ノイル]ファン1号2号に悪いことをする話【前編】(ぼっち・ざ・ろっく!),Fan Ichigo Nigo ni Warui Koto o Suru Hanashi,japanese,dokuneko noil,,doujinshi,bocchi the rock,,"kissing, group, condom, full color, multi-work series, drunk, rape",15,2025-12-01 13:23:01,2025-12-01 13:23:01,2025-12-02 14:01:50
612699,(C106) [Potato Salad (Himekuri)] Koi Shiru Kouritsu Renkin Joshi 2 | 戀愛煉金效率少女 2 (Ryza no Atelier) [Chinese] [RATKING機翻],(C106) [ぽてとさらだ (ヒめくり)] 恋知る効率錬金女子2 (ライザのアトリエ) [中国翻訳],Koi Shiru Kouritsu Renkin Joshi 2 | 戀愛煉金效率少女 2,"translated, chinese",himekuri,potato salad,doujinshi,atelier ryza | ryza no atelier,reisalin stout | ryza,"big breasts, nakadashi, dark skin, multi-work series, eye-covering bang",32,2025-12-01 13:25:19,2025-12-01 13:25:19,2025-12-02 14:01:51
612700,[Okuva]Fluffy Floating Butt (Color Edition)(Granblue Fantasy),ふわふわ浮かぶお尻の※（カラー版）,Fluffy Floating Butt,"english, translated",okuva,,doujinshi,granblue fantasy,"djeeta, andira","futanari, full color, rough translation, dickgirl on female, futanarization",6,2025-12-01 13:27:26,2025-12-01 13:27:26,2025-12-02 14:01:51
612701,[Guro|猎奇] Raiden Shogun(雷电将军) R-18G collection,,Raiden ShogunR-18G collection,chinese,,,doujinshi,genshin impact,raiden shogun,"torture, amputee, snuff, sex toys, brain fuck, blood, guro, rape, blowjob, cannibalism, hanging, gang rape, corpse",376,2025-12-01 13:50:00,2025-12-01 13:50:00,2025-12-02 14:01:52
612702,[Leonardo 16sei] Himitsu no Chicchana Hamarigoto [Digital],[れオナるド16世] ヒミツのちっちゃなハマりごと [DL版],Himitsu no Chicchana Hamarigoto,japanese,leonardo 16sei,,manga,,,"kissing, fundoshi, anal, lolicon, incest, tanlines, assjob, tankoubon, sister, tomboy, blowjob, shotacon, anal intercourse, kodomo doushi",199,2025-12-01 14:28:03,2025-12-01 14:28:03,2025-12-02 14:01:53
612703,[Momoyama Hato]  Jigoku de  Mita Amai Yume  - A Soft Glow in My Abyss. [Digital],[モモヤマハト] 地獄で見た甘い夢 [DL版],Jigoku de  Mita Amai Yume  - A Soft Glow in My Abyss.,japanese,momoyama hato,,manga,,,"inseki, anal, niece, lolicon, incest, double penetration, tankoubon, stockings, bbm, netorase, confinement",215,2025-12-01 15:09:21,2025-12-01 15:09:21,2025-12-02 14:01:53
612704,[Higashi Tarou] Onii-chan to Imouto-chan,[ひがしたろう] お兄ちゃんと妹ちゃん,Oniichan,japanese,higashi tarou,,doujinshi,original,,"full censorship, story arc, lolicon, incest, non-h, stockings, sister, sole female, sole male, ponytail, twintails, no penetration",48,2025-12-01 15:18:20,2025-12-01 15:18:20,2025-12-02 14:01:54
612705,[Vpan's EXTASY (Satou Kuuki)] Vanishing Reality ~Otome Ginsei Lumiphonia~ [English] [biribiri] [Digital],[Vパン'sエクスタシー (左藤空気)] Vanishing Reality ～乙女銀星ルミフォニア～ [英訳] [DL版],Vanishing Reality,"english, translated",satou kuuki,vpans extasy,doujinshi,original,,"kissing, virginity, bandages, big breasts, corruption, magical girl, netorare, big ass, nakadashi, ahegao, anal, femdom, bondage, thigh high boots, monster, defloration, mind control, multi-work series, double penetration, mind break, rape, low shotacon, tomgirl, impregnation, tentacles, vtuber, gloves, gender change, classroom",53,2025-12-01 15:22:06,2025-12-01 15:22:06,2025-12-02 14:01:55
612706,[Anthology] Kindan Renai Remix 1 Muriyari Taiken,[アンソロジー] 禁断恋愛Remix1 ムリヤリ体験,Kindan Renai Remix 1 Muriyari Taiken,japanese,"miyuki rou, sakura eri, mayumi daisuke, beauty hair, chihiro, kuriyama natsuki, suzumushi gyoe, kamakiri | akagi ryouichi",,manga,,,anthology,172,2025-12-01 15:32:04,2025-12-01 15:32:04,2025-12-02 14:01:55
612707,[Anthology] Kindan Renai Remix 2 Shiiku Ai,[アンソロジー] 禁断恋愛Remix2 飼育愛,Kindan Renai Remix 2 Shiiku Ai,japanese,"sakura eri, mayumi daisuke, uziga waita, beauty hair, chihiro, kuriyama natsuki, suzumushi gyoe, kamakiri | akagi ryouichi",,manga,,,anthology,174,2025-12-01 15:41:56,2025-12-01 15:41:56,2025-12-02 14:01:56
612708,[Anthology] Kindan Renai Remix 3 Hentai Ai,[アンソロジー] 禁断恋愛Remix3 ヘンタイ愛,Kindan Renai Remix 3 Hentai Ai,japanese,"miyuki rou, sakura eri, hiiragi masaki, beauty hair, kuriyama natsuki, kamakiri | akagi ryouichi, yume neko",,manga,,,"anthology, nakadashi, aoi shiori",166,2025-12-01 15:51:50,2025-12-01 15:51:50,2025-12-02 14:01:56
612709,[Anthology] Kindan Renai Remix 4 Incest Taboo,[アンソロジー] 禁断恋愛Remix4 インセストタブー,Kindan Renai Remix 4 Incest Taboo,japanese,"sakura eri, hiiragi masaki, sada ko-ji, kubukurin, maro, chihiro, kuriyama natsuki, suzumushi gyoe",,manga,,,"anthology, incest",170,2025-12-01 16:01:50,2025-12-01 16:01:50,2025-12-02 14:01:57
612710,[Announ] Shounen yo Daishi o Idake | 少年啊征服大姐姐吧  (COMIC Anthurium 2019-07) [Chinese] [不咕鸟汉化组&Amerins補鑲] [Decensored]  [Digital],[暗ノ吽] 少年よ大姉を抱け (COMIC アンスリウム 2019年7月号) [中国翻訳] [無修正] [DL版],Shounen yo Daishi o Idake | 少年啊征服大姐姐吧,"translated, chinese",announ,,manga,,,"milf, big breasts, bbw, cunnilingus, schoolboy uniform, big nipples, uncensored, big ass, nakadashi, ahegao, huge breasts, hairy, big areolae, fingering, tall girl, sole female, sole male, ponytail, clothed male nude female, smalldom, nipple stimulation",25,2025-12-01 16:03:39,2025-12-01 16:03:39,2025-12-02 14:01:58
612711,"[PLATONiCA (Nyorubee)] Hee~ Sou Yatte Ochinpo Ira tsukasete kurun Daa, Iiyo, Kinayo [English]",[PLATONiCA (にょるべえ)] へぇ〜そうやっておちんぽイラつかせてくるんだあ、いいよ来なよ [英訳],"Hee~ Sou Yatte Ochinpo Ira tsukasete kurun Daa, Iiyo, Kinayo","english, translated",nyorutarou | nyorubee,platonica,doujinshi,original,,"zombie, futanari, big breasts, snuff, nakadashi, demon girl, pig girl, stockings, big penis, kemonomimi, horns, tail, gloves, cumflation, full-packaged futanari, dickgirl on female",25,2025-12-01 16:05:33,2025-12-01 16:05:33,2025-12-02 14:01:58
612712,[Fukurasuzume (Sunaba Suzume)] The Handjob Parlor’s Most Popular Kemomimi Girl (Part 3 of 3) [English] [Your Deer Friends Black],,The Handjob Parlor’s Most Popular Kemomimi Girl,"english, translated",sunaba suzume,fukurasuzume,doujinshi,original,,"big breasts, pasties, femdom, full color, multi-work series, bunny girl, stockings, mosaic censorship, kemonomimi",62,2025-12-01 16:09:47,2025-12-01 16:09:47,2025-12-02 14:01:59
612713,[Fukurasuzume (Sunaba Suzume)] The Handjob Parlor’s Most Popular Kemomimi Girl (Parts 1-3) [English] [Your Deer Friends Black],,The Handjob Parlor’s Most Popular Kemomimi Girl,"english, translated",sunaba suzume,fukurasuzume,doujinshi,original,,"maid, handjob, kissing, big breasts, unusual pupils, pasties, breast feeding, prostitution, nakadashi, femdom, full color, multi-work series, bunny girl, lactation, stockings, sumata, paizuri, mosaic censorship, blowjob, kemonomimi, ball caressing",142,2025-12-01 16:19:01,2025-12-01 16:19:01,2025-12-02 14:01:59
612714,[Kupiko] Coworker vore,,Coworker vore,english,cupiko,,doujinshi,original,,"futanari, scat, urethra insertion, bbw, masturbation, snuff, vore, miniguy, cockphagia",7,2025-12-01 16:19:43,2025-12-01 16:19:43,2025-12-02 14:02:00
612715,[deramon072] Zen Zero Futanari Evelyn Slut Yanagi,,Zen Zero Futanari Evelyn Slut Yanagi,japanese,,,doujinshi,zenless zone zero,,"futanari, vore, shemale, miniguy, dickgirl on female",4,2025-12-01 16:20:13,2025-12-01 16:20:13,2025-12-02 14:02:00
612716,(C106) [virophilia (Orihi Chihiro)] Fukoku - Conspiracy vol. 2 (Love Live! Hasunosora Jogakuin School Idol Club),(C106) [virophilia (織日ちひろ)] 不軌 vol.2 (ラブライブ!蓮ノ空女学院スクールアイドルクラブ),Fukoku - Conspiracy vol. 2,japanese,orihi chihiro,virophilia,doujinshi,love live hasunosora jogakuin school idol club,"rurino osawa, hime anyoji","futanari, multi-work series, sole female, sole dickgirl, ponytail, dickgirl on female",37,2025-12-01 16:22:45,2025-12-01 16:22:45,2025-12-02 14:02:01
612717,(C106) [virophilia (Orihi Chihiro)] Fukoku Vol. 2 | Conspiracy Vol. 2 (Love Live! Hasunosora Jogakuin School Idol Club) [English],(C106) [virophilia (織日ちひろ)] 不軌 vol.2 (ラブライブ!蓮ノ空女学院スクールアイドルクラブ) [英訳],Fukoku Vol. 2 | Conspiracy Vol. 2,"english, translated",orihi chihiro,virophilia,doujinshi,love live hasunosora jogakuin school idol club,"rurino osawa, hime anyoji","futanari, multi-work series, sole female, sole dickgirl, ponytail, dickgirl on female",38,2025-12-01 16:25:19,2025-12-01 16:25:19,2025-12-02 14:02:02
612718,[nnheizi] 屈服于米凯拉大人的消化道吧！,,屈服于米凯拉大人的消化道吧！,chinese,,,doujinshi,original,,"vore, analphagia",15,2025-12-01 16:26:28,2025-12-01 16:26:28,2025-12-02 14:02:02
612719,【フル漫画】女騎士団長、屈服メス堕ちNTR〜憧れのオルティーナ団長が負けた日〜｜夜あくび小隊,【フル漫画】女騎士団長、屈服メス堕ちNTR〜憧れのオルティーナ団長が負けた日〜｜夜あくび小隊,【フル漫画】女騎士団長、屈服メス堕ちNTR〜憧れのオルティーナ団長が負けた日〜｜夜あくび小隊,japanese,,,manga,,,"big breasts, cunnilingus, netorare, nakadashi, ahegao, dark skin, x-ray, gyaru-oh, fingering, mosaic censorship, muscle, big penis, sole female, sole male, beauty mark, nipple stimulation",40,2025-12-01 16:29:03,2025-12-01 16:29:03,2025-12-02 14:02:03
612720,[Moreriikusu (More)] Saki-chan wa P ni Nandemo Shitekureru | 花海咲季愿意为P做任何事 (Gakuen IDOLM@STER) [Chinese] [学园偶像大师同好会x神人汉化组] [Digital],[モレリークス (モレ)] 咲季ちゃんはPに何でもシてくれる (学園アイドルマスター) [中国翻訳] [DL版],Saki-chan wa P ni Nandemo Shitekureru | 花海咲季愿意为P做任何事,"translated, chinese",more,moreriikusu,doujinshi,the idolmaster,"producer, saki hanami","schoolgirl uniform, sole female, sole male",18,2025-12-01 16:30:30,2025-12-01 16:30:30,2025-12-02 14:02:03
612721,[にょたヨフ] skeb🔞大槻唯・催眠 (アイドルマスター シンデレラガールズ),[にょたヨフ] skeb🔞大槻唯・催眠 (アイドルマスター シンデレラガールズ),skeb🔞大槻唯・催眠,japanese,niban,,doujinshi,the idolmaster,yui ohtsuki,"kissing, big breasts, unusual pupils, mind control, sole female, sole male, bald",3,2025-12-01 16:30:57,2025-12-01 16:30:57,2025-12-02 14:02:04
612722,[武器屋] ハーピィレディ２お姉さん カラーエロマンガ (遊戯王),[武器屋] ハーピィレディ２お姉さん カラーエロマンガ (遊戯王),ハーピィレディ２お姉さん カラーエロマンガ,japanese,,bukiya,doujinshi,yu-gi-oh,harpie lady 2,"big breasts, harpy, dark skin, x-ray, muscle, sole female, sole male, pixie cut, eye-covering bang",5,2025-12-01 16:31:22,2025-12-01 16:31:22,2025-12-02 14:02:04
612723,[らーめん] おにまい なゆたんのお泊り (お兄ちゃんはおしまい!),[らーめん] おにまい なゆたんのお泊り (お兄ちゃんはおしまい!),おにまい なゆたんのお泊り,japanese,ra-men,,doujinshi,onii-chan wa oshimai,"mahiro oyama, nayuta tenkawa","big breasts, nakadashi, defloration, breast expansion, paizuri, impregnation, sole female, sole male, sole dickgirl, gender change, futanarization",17,2025-12-01 16:32:27,2025-12-01 16:32:27,2025-12-02 14:02:05
612724,[Shotaian (Aian)] Onoko to. [English] [Digital] [Incomplete],[あいあん] おのこと。 [DL版],Onoko to.,"english, translated",aian,shotaian,manga,,,"maid, garter belt, gag, piercing, nurse, corset, witch, group, glasses, public use, prostate massage, schoolgirl uniform, ahegao, anal, sex toys, bondage, crossdressing, shemale, exhibitionism, latex, double penetration, breast expansion, tankoubon, yaoi, stockings, orgasm denial, lingerie, filming, large insertions, dilf, tomgirl, blowjob, muscle, blindfold, collar, incomplete, feminization, fisting, dickgirl on male, male on dickgirl, josou seme, harness, leash, large tattoo, mesuiki, anal intercourse, cock ring, nipple piercing",265,2025-12-01 16:48:55,2025-12-01 16:48:55,2025-12-02 14:02:06
612725,[50ling] 乱世书--朱雀 九,,乱世书朱雀 九,english,50ling,,doujinshi,original,,"big breasts, torture, ahegao, huge breasts, sex toys, bondage, guro",14,2025-12-01 16:50:12,2025-12-01 16:50:12,2025-12-02 14:02:06
612726,[TeruTeruGirl (Amano Teru)] Namaiki Mahoutsukai Hae ni Wakaraserareru [Chinese] [シロヤシオ],[てるてるがーる (天乃輝)] 生イキ魔法使い蠅に分からせられる [中国翻訳],Namaiki Mahoutsukai Hae ni Wakaraserareru,"translated, chinese",amano teru,teruterugirl,doujinshi,original,,"worm, anal, anal birth, inflation, insect, sole female, twintails, vaginal birth",34,2025-12-01 16:52:31,2025-12-01 16:52:31,2025-12-02 14:02:07
612727,[Kome Juice (Nuka)] もてなしウィンター (Watashi ga Motenai no wa Dou Kangaetemo Omaera ga Warui!),,もてなしウィンター,japanese,nuka,kome juice,doujinshi,its not my fault that im not popular | watashi ga motenai no wa dou kangaetemo omaera ga warui,"tomoko kuroki, tomoki kuroki","spanking, incest, sole female",78,2025-12-01 16:57:48,2025-12-01 16:57:48,2025-12-02 14:02:07
612728,[TeruTeruGirl (Amano Teru)] Chubatsu [Digital],[てるてるがーる (天乃輝)] 蟲罰 [DL版],Chubatsu,japanese,amano teru,teruterugirl,doujinshi,original,,"squirting, mmf threesome, group, anal, anal birth, long tongue, insect, gaping, rape, parasite, sole female, focus anal, gang rape",44,2025-12-01 17:00:50,2025-12-01 17:00:50,2025-12-02 14:02:08
612729,[Anthology] Okasare Miboujin no Toiki Vol. 01 [Digital],[アンソロジー] 犯され未亡人の吐息VOL.01 [DL版],Okasare Miboujin no Toiki Vol. 01,japanese,"kousaka tsutomu, kasama shirou, enji, kodama ryou, mura mura, aoyama kazumi | aoyama ikkai",,manga,,,"milf, anthology, stockings, pantyhose, widow",113,2025-12-01 17:07:51,2025-12-01 17:07:51,2025-12-02 14:02:08
612730,[Anthology] Okasare Miboujin no Toiki Vol. 02 [Digital],[アンソロジー] 犯され未亡人の吐息VOL.02 [DL版],Okasare Miboujin no Toiki Vol. 02,japanese,"nagata tomato, kousaka tsutomu, senor daietsu, juteimu nakata, enji, kodama ryou, aoyama kazumi | aoyama ikkai",,manga,,,"milf, garter belt, anthology, double penetration, stockings, widow",119,2025-12-01 17:15:17,2025-12-01 17:15:17,2025-12-02 14:02:09
612731,[Anthology] Okasare Miboujin no Toiki Vol. 03 [Digital],[アンソロジー] 犯され未亡人の吐息VOL.03 [DL版],Okasare Miboujin no Toiki Vol. 03,japanese,"kousaka tsutomu, tomita shigeru, juteimu nakata, tatsumi hiroshi, kodama ryou, dajji fukai, mura mura, aoyama kazumi | aoyama ikkai",,manga,,,"milf, big breasts, pregnant, mmf threesome, group, anthology, hairy, double penetration, widow",121,2025-12-01 17:22:58,2025-12-01 17:22:58,2025-12-02 14:02:09
612732,[Anthology] Okasare Miboujin no Toiki Vol. 04 [Digital],[アンソロジー] 犯され未亡人の吐息VOL.04 [DL版],Okasare Miboujin no Toiki Vol. 04,japanese,"tomita shigeru, kodama ryou, osada kaname, mizushima sei, mura mura, aoyama kazumi | aoyama ikkai",,manga,,,"milf, anthology, double penetration, stockings, widow",112,2025-12-01 17:29:55,2025-12-01 17:29:55,2025-12-02 14:02:10
612733,[Anthology] Okasare Miboujin no Toiki Vol. 05 [Digital],[アンソロジー] 犯され未亡人の吐息VOL.05 [DL版],Okasare Miboujin no Toiki Vol. 05,japanese,"kousaka tsutomu, tomita shigeru, tsunoame kazuya, kodama ryou, mizushima sei, mura mura, aoyama kazumi | aoyama ikkai",,manga,,,"milf, anthology, double penetration, stockings, widow",111,2025-12-01 17:36:41,2025-12-01 17:36:41,2025-12-02 14:02:11
612734,[Anthology] Okasare Miboujin no Toiki Vol. 06 [Digital],[アンソロジー] 犯され未亡人の吐息VOL.06 [DL版],Okasare Miboujin no Toiki Vol. 06,japanese,"kousaka tsutomu, irikura hiroshi, kodama ryou, osada kaname, yamato kaoru, aoyama kazumi | aoyama ikkai",,manga,,,"milf, anthology, double penetration, widow",112,2025-12-01 17:43:24,2025-12-01 17:43:24,2025-12-02 14:02:11
612735,[Anthology] Okasare Miboujin no Toiki Vol. 07 [Digital],[アンソロジー] 犯され未亡人の吐息VOL.07 [DL版],Okasare Miboujin no Toiki Vol. 07,japanese,"kousaka tsutomu, irikura hiroshi, kodama ryou, dajji fukai, osada kaname, yamato kaoru",,manga,,,"milf, group, anthology, double penetration, stockings, widow",112,2025-12-01 17:50:01,2025-12-01 17:50:01,2025-12-02 14:02:12
612736,[Anthology] Okasare Miboujin no Toiki Vol. 08 [Digital],[アンソロジー] 犯され未亡人の吐息VOL.08 [DL版],Okasare Miboujin no Toiki Vol. 08,japanese,"irikura hiroshi, juteimu nakata, kodama ryou, yamato kaoru, mizushima sei, shimizu masaharu",,manga,,,"milf, anthology, widow",121,2025-12-01 17:57:31,2025-12-01 17:57:31,2025-12-02 14:02:12
612737,[Anthology] Okasare Miboujin no Toiki Vol. 09 [Digital],[アンソロジー] 犯され未亡人の吐息VOL.09 [DL版],Okasare Miboujin no Toiki Vol. 09,japanese,"irikura hiroshi, tomita shigeru, kodama ryou, yamato kaoru, mizushima sei",,manga,,,"milf, big breasts, anthology, double penetration, widow",121,2025-12-01 18:04:43,2025-12-01 18:04:43,2025-12-02 14:02:13
612738,[Paya8] New Eridu Metropolitan Defense Supplementary Plan ~ Special Operations Individual Control Protocol (Zenless Zone Zero),新エリー都防衛補完計画 ~ 特殊戦力個体統制方案 JP,New Eridu Metropolitan Defense Supplementary Plan ~ Special Operations Individual Control Protocol,japanese,paya8,,doujinshi,zenless zone zero,yixuan,"squirting, sweating, big breasts, corruption, machine, milking, body modification, nakadashi, anal, sex toys, bondage, mind control, drugs, lactation, fingering, filming, mind break, rape, blowjob, slave, bald, anal intercourse, multiple orgasms",48,2025-12-01 18:08:00,2025-12-01 18:08:00,2025-12-02 14:02:13
612739,[ie] ie総集編,[ie] ie総集編,ie総集編,japanese,ie,,doujinshi,original,,"maid, schoolgirl uniform, nakadashi, ahegao, anal, low lolicon, demon girl, lolicon, x-ray, mind control, stockings, paizuri, lingerie, teacher, blowjob, shotacon, tail, soushuuhen",777,2025-12-01 20:31:38,2025-12-01 20:31:38,2025-12-02 14:02:14
