ID,EN_TITLE,JP_TITLE,CLEAN_TITLE,LANGUAGE,ARTIST,GROUP_NAME,CATEGORY,PARODY,CHARACTER,TAGS,PAGES,UPLOAD_DATE,FORMATTED_DATE,SCRAPED_DATE
565657,(C81) [Tenguren (Nario)] Boketsu o Horu 10 Junbigou | Заглиблення в Мамину Нірку 10 [Ukrainian] [Knight],(C81) [天愚連 (ナリヲ)] 母穴を掘る10準備号 [英訳],Boketsu o Horu 10 Junbigou | Заглиблення в Мамину Нірку 10,"japanese, translated, ukrainian",nario,tenguren,doujinshi,original,,"milf, virginity, big breasts, breast feeding, mother, hairy, incest, widow, sole female, sole male",22,2025-04-01 15:12:37,2025-04-01 15:12:37,2025-04-02 05:11:29
565658,家に帰って処理するフミネ・後編,,家に帰って処理するフミネ・後編,japanese,ahemaru | henrik,,doujinshi,,,"big breasts, sole female, nipple stimulation",12,2025-04-01 15:14:27,2025-04-01 15:14:27,2025-04-02 05:11:30
565659,银河女神奈斯特VS触手怪兽格布,,银河女神奈斯特VS触手怪兽格布,"translated, chinese",,warabimochi,doujinshi,ultraman,,tentacles,3,2025-04-01 15:14:59,2025-04-01 15:14:59,2025-04-02 05:11:30
565660,(CR35) [Chanbara! (Kimuraya Izumi)] Out Side 13 Haitoku no Maria (Maria-sama ga Miteru),(Cレヴォ35) [ちゃんばら! (木村屋いづみ)] OUT SIDE 13 背徳のマリア (マリア様がみてる),Out Side 13 Haitoku no Maria,japanese,kimuraya izumi,chanbara,doujinshi,maria-sama ga miteru,,"strap-on, yuri",34,2025-04-01 15:17:37,2025-04-01 15:17:37,2025-04-02 05:11:31
565661,[ドウム参式] ユイちゃん,[ドウム参式] ユイちゃん,ユイちゃん,japanese,,,doujinshi,,,"gag, bondage, sole male",21,2025-04-01 15:19:34,2025-04-01 15:19:34,2025-04-02 05:11:32
565662,[ドウム参式] 美穂さん,[ドウム参式] 美穂さん,美穂さん,japanese,,,doujinshi,,,imageset,24,2025-04-01 15:21:33,2025-04-01 15:21:33,2025-04-02 05:11:32
565663,[LOVE ADDICT (Woma)] Libra (Mahoutsukai no Yakusoku) [Digital],[LOVE ADDICT (ヲマ)] Libra (魔法使いの約束) [DL版],Libra,japanese,woma,love addict,doujinshi,mahoutsukai no yakusoku | promise of wizard,"heathcliff blanchett, shino sherwood","anal, males only, yaoi, collar, beauty mark, anal intercourse",36,2025-04-01 15:25:00,2025-04-01 15:25:00,2025-04-02 05:11:33
565664,[Makin] Furan-chan ga futanari ni naru | Flan-chan Becomes a Futanari [English] [Ongoing],「フランちゃんがふたなりになる」,Furanchan Becomes a Futanari,"english, translated",makin,,doujinshi,touhou project,"flandre scarlet, sakuya izayoi","futanari, sole female, sole dickgirl",3,2025-04-01 15:25:27,2025-04-01 15:25:27,2025-04-02 05:11:34
565665,[Cupiko] Ningen Benki Tokashite Akogare no Hitodzuma no Unko o Taberu Koto ni Natta Otoko no Hanashi,[くぴこ] 人間便器と化して憧れの人妻のウンコを食べることになった男の話,Ningen Benki Tokashite Akogare no Hitodzuma no Unko o Taberu Koto ni Natta Otoko no Hanashi,japanese,cupiko,,doujinshi,original,,"milf, scat, farting, public use, big ass, facesitting, anal, coprophagia, anal intercourse",18,2025-04-01 15:27:01,2025-04-01 15:27:01,2025-04-02 05:11:35
565666,[Honami (Taromo)] ひとの気も知らないで。 (Blue Lock) [Digital],[穂波 (たろも)] ひとの気も知らないで。 (ブルーロック) [DL版],ひとの気も知らないで。,japanese,taromo,,doujinshi,blue lock,"seishiro nagi, yoichi isagi","masturbation, anal, males only, yaoi, anal intercourse",35,2025-04-01 15:30:03,2025-04-01 15:30:03,2025-04-02 05:11:36
565667,[ANIMAL SERVICE (Haison)] Inukan Nikki 7 [Chinese] [Digital] [MK6HX个人汉化],[ANIMAL SERVICE (ハイソン)] 犬姦日記7 [DL版],Inukan Nikki 7,"translated, chinese",haison,animal service,doujinshi,original,,"swimsuit, dog, bestiality, ahegao, mother, bikini, multi-work series, incest, kemonomimi",37,2025-04-01 15:37:23,2025-04-01 15:37:23,2025-04-02 05:11:37
565668,[Bonnie] Hitoyo-chan Yuuna-chan Akari-chan,[ぼに～] 一夜ちゃんユウナちゃん暁璃ちゃん,Hitoyochan Akari-chan,japanese,bonnie,,doujinshi,original,,"oni, big breasts, nakadashi, dark skin, bunny girl, rape, dilf, blowjob, bbm, horns",5,2025-04-01 15:38:04,2025-04-01 15:38:04,2025-04-02 05:11:38
565669,[Onapan] Kouhai ni Kawaigararetemasu [Chinese] [甜族星人赞助汉化] [Digital],[おなぱん] 後輩に可愛がられてます [中国翻訳] [DL版],Kouhai ni Kawaigararetemasu,"translated, chinese",onapan,,manga,,,"big breasts, schoolgirl uniform, tankoubon",199,2025-04-01 15:54:23,2025-04-01 15:54:23,2025-04-02 05:11:39
565670,[Liebling (hm)] Virgin Cat (Blue Lock) [Digital],[Liebling (hm)] Virgin Cat (ブルーロック) [DL版],Virgin Cat,japanese,hm,liebling,doujinshi,blue lock,"yoichi isagi, michael kaiser","catboy, anal, tracksuit, males only, yaoi, kemonomimi, tail, anal intercourse",18,2025-04-01 15:56:25,2025-04-01 15:56:25,2025-04-02 05:11:39
565671,[Alfre-Tori] Matenshoku no Yakata 13 [Chinese] [狼姫个人汉化],[あるふれっ鸟] 魔転职の馆⑬ [中国翻訳],Matenshoku no Yakata 13,"translated, chinese",alfre-tori,,doujinshi,,,"corruption, demon girl, gender morph, gender change",27,2025-04-01 15:58:50,2025-04-01 15:58:50,2025-04-02 05:11:40
565672,蕩心ショコラーデ,,蕩心ショコラーデ,japanese,inami,navy,doujinshi,fate grand order,"siegfried, kriemhild","sole female, sole male",33,2025-04-01 16:01:56,2025-04-01 16:01:56,2025-04-02 05:11:41
565673,[Nigiri Usagi] Hen na Soubi no Sei de O◯nko Kowarete Shimatta de wa Nai ka! 1,[にぎりうさぎ] 変な装備のせいでお◯んこ壊れてしまったではないかッ！１,Hen na Soubi no Sei de O◯nko Kowarete Shimatta de wa Nai ka! 1,japanese,nigiri usagi,,doujinshi,original,,"dilf, no penetration",14,2025-04-01 16:03:17,2025-04-01 16:03:17,2025-04-02 05:11:42
565674,[Azarashi no Otoshimono (Marumai)] Hitozuma no Takuhaibin Otodokesaki no Dekachin de Watashi wa Mesu ni Narimashita [Chinese],[あざらしの落とし物 (まるまい)] 人妻の宅配便ーお届け先のデカチンで私は雌になりましたー [中国翻訳],Hitozuma no Takuhaibin Otodokesaki no Dekachin de Watashi wa Mesu ni Narimashita,"translated, chinese",marumai,,doujinshi,original,,"milf, big breasts, glasses, netorare, urination, bbm, sole female, extraneous ads",70,2025-04-01 16:09:24,2025-04-01 16:09:24,2025-04-02 05:11:42
565675,[Kusayarou] Mesugaki ni Oshioki | 教训雌小鬼 [Chinese],[草野郎] メスガキにお仕置き [中国翻訳],Mesugaki ni Oshioki | 教训雌小鬼,"translated, chinese",,,doujinshi,original,,"big breasts, nakadashi, stomach deformation, sole female, sole male, twintails",2,2025-04-01 16:09:54,2025-04-01 16:09:54,2025-04-02 05:11:43
565676,[ドウム参式] 紗江さんとライカさん,[ドウム参式] 紗江さんとライカさん,紗江さんとライカさん,japanese,,,doujinshi,,,"bdsm, torture, femdom, bondage, imageset",134,2025-04-01 16:20:44,2025-04-01 16:20:44,2025-04-02 05:11:44
565677,[ドウム参式] 遥さん,[ドウム参式] 遥さん,遥さん,japanese,,,doujinshi,,,"imageset, blowjob",104,2025-04-01 16:29:15,2025-04-01 16:29:15,2025-04-02 05:11:45
565678,[ASO (湖中あそ)] 待ての分だけ手加減できない (Hypnosis Mic) [Digital],[ASO (湖中あそ)] 待ての分だけ手加減できない (ヒプノシスマイク) [DL版],待ての分だけ手加減できない,japanese,,,doujinshi,hypnosis mic,"saburo yamada, jiro yamada","anal, brother, males only, incest, heterochromia, beauty mark, anal intercourse",34,2025-04-01 16:32:59,2025-04-01 16:32:59,2025-04-02 05:11:46
565679,[ASO (湖中あそ)] これを恋と呼ぶならば (Hypnosis Mic) [Digital],[ASO (湖中あそ)] これを恋と呼ぶならば (ヒプノシスマイク) [DL版],これを恋と呼ぶならば,japanese,,,doujinshi,hypnosis mic,"saburo yamada, jiro yamada","brother, males only, incest, yaoi, heterochromia, beauty mark",46,2025-04-01 16:38:31,2025-04-01 16:38:31,2025-04-02 05:11:47
565680,[Mimonel] jishō tokubetsu sōsatai no hōkago benkyōkai ♥,[ミモネル] 自称特別捜査隊の放課後勉強会♥,jishō tokubetsu sōsatai no hōkago benkyōkai ♥,japanese,mimonel,,doujinshi,persona 4,,"harem, full color, sole male",9,2025-04-01 16:39:33,2025-04-01 16:39:33,2025-04-02 05:11:48
565681,Mesu Mama,,Mesu Mama,"english, translated",kusatsu terunyo,,doujinshi,,,"milf, big breasts, mother, incest, manga",26,2025-04-01 16:42:10,2025-04-01 16:42:10,2025-04-02 05:11:49
565682,[Copy 2] 29-sai Half-foot | 29岁半身人 (Dungeon Meshi) [中文] [嘘梦神父教皇汉化],[コピー2] 29岁ハーフフット (ダンジョン飯),29foot | 29岁半身人,"translated, chinese",,,doujinshi,dungeon meshi,chilchuck tims,"anal, males only, yaoi, blowjob",12,2025-04-01 16:43:35,2025-04-01 16:43:35,2025-04-02 05:11:50
565683,[CRAFT (Kiliu)] Sono Zunou wa Otona no Tame ni [Digital][Chinese][种付大叔个人汉化],[CRAFT (きぃう)] その頭脳はオトナのために [DL版][中国翻訳],Sono Zunou wa Otona no Tame ni,"translated, chinese",kiliu,craft,doujinshi,original,,"sweating, big breasts, group, glasses, cervix penetration, breast feeding, nakadashi, ahegao, bikini, paizuri, oppai loli, impregnation, bbm, stomach deformation, sole female, bald, beauty mark, twintails, rough translation, nipple stimulation",35,2025-04-01 16:46:35,2025-04-01 16:46:35,2025-04-02 05:11:51
565684,[Hamachi Rinkai Koen (Taihe-yo)] 昨日は夢見がよかった (ONE PIECE) [Digital],[ハマチ臨海公園 (太平洋)] 昨日は夢見がよかった (ワンピース) [DL版],昨日は夢見がよかった,japanese,taihe-yo,,doujinshi,one piece,portgas d. ace,"ryona, males only, blood, yaoi, rape",40,2025-04-01 16:50:10,2025-04-01 16:50:10,2025-04-02 05:11:52
565685,(Sensei no Archive 13) [Heso no gomaabura (Hekoman)] shupore! (Blue Archive) [Chinese] [角都九阳个人汉化] [Digital],(せんせーのアーカイブ13) [へそのゴマ油 (へこまん)] シュポれっ!  (ブルーアーカイブ) [中国翻訳],shupore!,"translated, chinese","tachibana hikari, hekoman",,doujinshi,blue archive,"sensei, hikari tachibana, nozomi tachibana","twins, swimsuit, group, ffm threesome, femdom, bikini, lolicon, shotacon, sole male, twintails, tail, very long hair, nipple stimulation, halo, kodomo doushi",17,2025-04-01 16:54:13,2025-04-01 16:54:13,2025-04-02 05:11:53
565686,[sakanaya] A Manga About a Perverted Dance Instructor Who Attacks Fuu-tan (Shiranui Flare) [English],[sakanaya] ふー◯んが変態ダンス講師に襲われちゃうスケベ漫画 (不知火フレア) [英訳],A Manga About a Perverted Dance Instructor Who Attacks Fuu-tan,"english, translated",sakanaya,sakanaya,doujinshi,hololive,shiranui flare,"elf, big breasts, big ass, nakadashi, dark skin, sumata, blowjob, sole male, ponytail, vtuber, very long hair, school gym uniform",7,2025-04-01 16:55:12,2025-04-01 16:55:12,2025-04-02 05:11:54
565687,[愛上陸] むかつくギャルに催眠をかける話 （本人も気付かないうちに種付けルート）,[愛上陸] むかつくギャルに催眠をかける話 （本人も気付かないうちに種付けルート）,むかつくギャルに催眠をかける話 （本人も気付かないうちに種付けルート）,japanese,aiue oka,,doujinshi,original,,"kissing, big breasts, nakadashi, mind control, gyaru, first person perspective, sole female, sole male",16,2025-04-01 16:56:33,2025-04-01 16:56:33,2025-04-02 05:11:54
565688,[Hashibiroko (Zuikou Kou)] Saint Seia | 淫欲~性斗士~小圣娅 (Blue Archive) [Chinese] [欶澜汉化组] [Digital],[ハシビロ湖 (瑞弘コウ)] 性淫セイア (ブルーアーカイブ) [中国翻訳] [DL版],Saint Seia | 淫欲小圣娅,"translated, chinese",zuikou kou,hashibiroko,doujinshi,blue archive,"sensei, seia yurizono","stockings, sole female, sole male, kemonomimi, tail, halo",23,2025-04-01 16:58:49,2025-04-01 16:58:49,2025-04-02 05:11:55
565689,[愛上陸] むかつくギャルに催眠をかける話（尊厳破壊ルート  1-3）,[愛上陸] むかつくギャルに催眠をかける話 （尊厳破壊ルート  1-3）,むかつくギャルに催眠をかける話（尊厳破壊ルート  1-3）,japanese,aiue oka,,doujinshi,,,"nakadashi, mind control, gyaru, blowjob",59,2025-04-01 17:03:50,2025-04-01 17:03:50,2025-04-02 05:11:56
565690,Strip Rock-Paper-Scissor Match,,Strip RockScissor Match,japanese,,,doujinshi,original,,"males only, yaoi",20,2025-04-01 17:05:35,2025-04-01 17:05:35,2025-04-02 05:11:56
565691,[Muunyan] No Mark (COMIC Shingeki 2025-01) [English] [rez_a],[むーにゃん] No Mark (COMIC 真激 2025年1月号) [中国翻訳] [DL版],No Mark,"english, translated",muunyan,,manga,,,"big breasts, full censorship, netorare, coach, nakadashi, ahegao, ffm threesome, hairy, tracksuit, stockings, big penis, sole male, ponytail, hidden sex, shimaidon, very long hair",36,2025-04-01 17:08:49,2025-04-01 17:08:49,2025-04-02 05:11:57
565692,[Onapan] Kouhai ni Kawaigararetemasu [Chinese] [甜族星人赞助汉化] [Digital],[おなぱん] 後輩に可愛がられてます [中国翻訳] [DL版],Kouhai ni Kawaigararetemasu,"translated, chinese",onapan,,manga,,,"handjob, big breasts, glasses, schoolgirl uniform, tankoubon, stockings, lingerie, blowjob",199,2025-04-01 17:25:43,2025-04-01 17:25:43,2025-04-02 05:11:58
565693,[Ishigaki Takashi] Kugisaki Anal Otoshi (Jujutsu Kaisen) [English],[イシガキタカシ] 釘崎アナル堕とし (呪術廻戦) [英訳],Kugisaki Anal Otoshi,"english, translated",ishigaki takashi,,doujinshi,jujutsu kaisen,nobara kugisaki,"scat, big breasts, big ass, masturbation, enema, schoolgirl uniform, moral degeneration, ahegao, anal, sex toys, coprophagia, solo action, stockings, pantyhose, paizuri, low shotacon, blackmail, blowjob, shotacon, deepthroat, sole female, focus anal, anal intercourse, rough translation",60,2025-04-01 17:38:45,2025-04-01 17:38:45,2025-04-02 05:11:58
565694,[愛上陸] キルアオ 蜜岡レノン 救出失敗エンド,,キルアオ 蜜岡レノン 救出失敗エンド,japanese,aiue oka,,doujinshi,,,"kissing, x-ray, mind control, blowjob, first person perspective, bbm, sole male, bald, multimouth blowjob, crying",4,2025-04-01 17:39:33,2025-04-01 17:39:33,2025-04-02 05:11:59
565695,[betm] OVERLORD同人,,OVERLORD同人,chinese,betm,,doujinshi,overlord,,"uncensored, anal, males only, yaoi, blowjob",3,2025-04-01 17:39:57,2025-04-01 17:39:57,2025-04-02 05:12:00
565696,[Tooyama Burin] Yuusha-sama wa Houshuu ni Hitozuma o Gokibou desu Vol. 2 [English] [Tomoshibi],[遠山ブリン] 勇者さまは報酬に人妻をご希望です 2巻,Yuusha-sama wa Houshuu ni Hitozuma o Gokibou desu Vol. 2,"english, translated",toyama burin,,manga,,,"elf, milf, big breasts, nun, full censorship, story arc, nakadashi, demon girl, multi-work series, tankoubon, rape, big penis",172,2025-04-01 18:14:12,2025-04-01 18:14:12,2025-04-02 05:12:00
565697,[I'm moralist (柳原ミツキ、犬侍、ふじのん)] 精隷牢獄リェグ～奇形魔物との自慰交尾に伴う破滅願望～[中国翻訳],[I'm moralist (柳原ミツキ、犬侍、ふじのん)] 精隷牢獄リェグ～奇形魔物との自慰交尾に伴う破滅願望～[中国翻訳],精隷牢獄リェグ～奇形魔物との自慰交尾に伴う破滅願望～,"translated, chinese","yanagihara mitsuki, hujinon",im moralist,doujinshi,,,"tentacles, vaginal birth, confinement",32,2025-04-01 18:17:11,2025-04-01 18:17:11,2025-04-02 05:12:01
565698,[もちぐされ (よも木)] すきだよ (Blue Lock) [Digital],[もちぐされ (よも木)] すきだよ (ブルーロック) [DL版],すきだよ,japanese,,,doujinshi,blue lock,"yoichi isagi, rin itoshi","schoolboy uniform, males only, yaoi",45,2025-04-01 18:21:02,2025-04-01 18:21:02,2025-04-02 05:12:02
565699,[もちぐされ (よも木)] 俺だけ見てろよ！ (Blue Lock) [Digital],[もちぐされ (よも木)] 俺だけ見てろよ！ (ブルーロック) [DL版],俺だけ見てろよ！,japanese,,,doujinshi,blue lock,"yoichi isagi, rin itoshi","anal, males only, yaoi, anal intercourse",18,2025-04-01 18:22:43,2025-04-01 18:22:43,2025-04-02 05:12:03
565700,[Bifidus] Yuki no Kaniku | The Fruit of Snow [English] [Project Valvrein],[ビフィダス] 雪の果肉 (田舎の女) [スペイン翻訳] [DL版],Yuki no Kaniku | The Fruit of Snow,"english, translated",bifidus,,doujinshi,,,"big breasts, pregnant, condom, nakadashi, mosaic censorship, sole female, sole male, manga",29,2025-04-01 18:25:23,2025-04-01 18:25:23,2025-04-02 05:12:03
565701,[Kakuninii] Ningen Sousa RemoCon 2 [Digital],[角煮煮] 人間操作リモコン2 [DL版],Ningen Sousa RemoCon 2,japanese,kakuninii,,doujinshi,original,,"swimsuit, schoolgirl uniform, nakadashi, mind control",40,2025-04-01 18:29:18,2025-04-01 18:29:18,2025-04-02 05:12:04
565702,血族Bloodline,,血族Bloodline,"japanese, chinese",fairwind,,doujinshi,original,,"anal, bondage, males only, yaoi, blowjob, muscle, variant set",30,2025-04-01 18:32:03,2025-04-01 18:32:03,2025-04-02 05:12:05
565703,[Hiro潶] 《~英霊百足蹂躙~妖精女王+雷电女王篇》,,《妖精女王+雷电女王篇》,chinese,,,doujinshi,fate grand order,,,20,2025-04-01 18:33:57,2025-04-01 18:33:57,2025-04-02 05:12:05
565704,[Koma Neko Jinja (Koma Neko)] Vtuber no Naka no Hito,,Vtuber no Naka no Hito,"translated, chinese",,,doujinshi,,,extraneous ads,36,2025-04-01 18:37:10,2025-04-01 18:37:10,2025-04-02 05:12:06
565705,[Komaneko Shrine (Komaneko)] Tsundere Fathercon Kusagaya-san,,Tsundere Fathercon Kusagaya-san,"translated, chinese",,,doujinshi,,,"incest, gyaru, daughter, blowjob, extraneous ads",35,2025-04-01 18:40:27,2025-04-01 18:40:27,2025-04-02 05:12:07
565706,C105_Hoshizora_Sutekki_Kisaragi_Nana_Oshioki!_Koyanskaya_Fate_Grand,,C105_Hoshizora_Sutekki_Kisaragi_Nana_Oshioki!_Koyanskaya_Fate_Grand,"translated, chinese",kisaragi nana,,doujinshi,fate grand order,koyanskaya,"big breasts, fox girl, kemonomimi, extraneous ads",27,2025-04-01 18:43:03,2025-04-01 18:43:03,2025-04-02 05:12:08
565707,NOTONE_Asakura_Shimoichi_Shoushika_Taisaku_Mesugaki_chan_Ni_Digital,,NOTONE_Asakura_Shimoichi_Shoushika_Taisaku_Mesugaki_chan_Ni_Digital,"translated, chinese",asakura shimoichi,notone,doujinshi,original,,"lolicon, extraneous ads, mesugaki",46,2025-04-01 18:52:20,2025-04-01 18:52:20,2025-04-02 05:12:09
565708,NOTONE_Asakura_Shimoichi_Shoushika_Taisaku_Mesugaki_chan_Digital,,NOTONE_Asakura_Shimoichi_Shoushika_Taisaku_Mesugaki_chan_Digital,"translated, chinese",asakura shimoichi,notone,doujinshi,original,,"lolicon, extraneous ads, mesugaki",61,2025-04-01 19:04:47,2025-04-01 19:04:47,2025-04-02 05:12:10
565709,"Fujimaru_You've_Laid_In_Your_Bed,_Now_Make_It_+_Afterstory_Hana",,"Fujimaru_You've_Laid_In_Your_Bed,_Now_Make_It_+_Afterstory_Hana","translated, chinese",fujimaru,,manga,,,"uncensored, full color, sole female, sole male, extraneous ads",32,2025-04-01 19:07:40,2025-04-01 19:07:40,2025-04-02 05:12:10
565710,[Ryou] Cosplay Fuuzoku ni Ittara Josou Saserareta Hanashi,,Cosplay Fuuzoku ni Ittara Josou Saserareta Hanashi,"translated, chinese",ryou,,doujinshi,,,"pasties, crossdressing, bunny girl, extraneous ads",44,2025-04-01 19:11:18,2025-04-01 19:11:18,2025-04-02 05:12:11
565711,[gumi_chocolate_pine] Tomodachi no Okaasan wa Ikeikede Muchimuchi,[ぐみちょこれーとぱいん] 友達のお母さんはイケイケでムチムチ,Tomodachi no Okaasan wa Ikeikede Muchimuchi,japanese,gumi chocolate pine,,doujinshi,original,,"milf, big breasts, bbw, glasses, big ass, cheating, nakadashi, shotacon, sole female",22,2025-04-01 19:16:15,2025-04-01 19:16:15,2025-04-02 05:12:11
565712,[Shiki Hanana] Mother wants to cure her son's spoiled behavior [English] [SongSoMi],,Mother wants to cure her son's spoiled behavior,"english, translated",,shiki hanana,doujinshi,original,,"milf, mother, full color, incest, mosaic censorship, shotacon",56,2025-04-01 19:27:51,2025-04-01 19:27:51,2025-04-02 05:12:12
565713,[Dokuneko Noil] Kurumi ni  Warui Koto o suru no Hanashi (zenpen),胡桃に悪いことをする話【前編】,Kurumi ni  Warui Koto o suru no Hanashi,japanese,dokuneko noil,,doujinshi,genshin impact,hu tao,"cunnilingus, drunk, rape, blowjob, sole female, sole male",13,2025-04-01 19:29:16,2025-04-01 19:29:16,2025-04-02 05:12:13
565714,[Cucchiore] Hatsukoi to Maou - First Love And King of the Darkness | 初恋与魔王 (Dungeon Kouryaku wa SEX de!! Vol. 7) [Chinese] [hEROs汉化组] [Decensored] [restday111去码],[くっきおーれ] 初恋と魔王 (ダンジョン攻略はSEXで！！ VOL.7) [中国翻訳] [無修正],Hatsukoi to Maou - First Love And King of the Darkness | 初恋与魔王,"translated, chinese",cucchiore,,manga,,,"big breasts, uncensored, demon girl, horns",23,2025-04-01 19:31:25,2025-04-01 19:31:25,2025-04-02 05:12:13
565715,(成年コミック) [いとううさぎ] これが私の初めてなの？ + イラストカード,(成年コミック) [いとううさぎ] これが私の初めてなの？ + イラストカード,これが私の初めてなの？ + イラストカード,"translated, chinese",itou usagi,,manga,,,"swimsuit, group, lolicon, stockings, dilf, blowjob, rough translation",217,2025-04-01 20:46:05,2025-04-01 20:46:05,2025-04-02 05:12:14
565716,[Hermit] Musuko no Yuujin to Kankei Omotta Mama no Hanashi,[Hermit] 息子の友人と関係を持ったママの話,Musuko no Yuujin to Kankei Omotta Mama no Hanashi,japanese,,hermit,doujinshi,original,,"milf, kissing, scat, big breasts, cheating, nakadashi, x-ray, full color, mosaic censorship, impregnation, shotacon, sole female, sole male, beauty mark, smalldom",42,2025-04-01 20:54:55,2025-04-01 20:54:55,2025-04-02 05:12:15
565717,(brilliant days 54) [meromelo (rara)] Megane wa Sonomama (Ensemble Stars!),(brilliant days 54) [meromelo (らら)] めがねはそのまま (あんさんぶるスターズ！),Megane wa Sonomama,japanese,rara,meromelo,doujinshi,ensemble stars,nazuna nito,"glasses, anal, males only, yaoi, shotacon, anal intercourse",24,2025-04-01 21:00:11,2025-04-01 21:00:11,2025-04-02 05:12:16
565718,Karamizakari Anthology [Chinese] [Decensored] [Digital],カラミざかりアンソロジー [中国翻訳] [無修正] [DL版],Karamizakari Anthology,"translated, chinese","syuuen, katsura airi, densuke, shiwasu no okina, same manma, osato, eda, toilet komoru | otoi rekomaru",,doujinshi,,,"netorare, uncensored, anthology, manga",151,2025-04-01 21:12:42,2025-04-01 21:12:42,2025-04-02 05:12:17
565719,Asagami  [Skeb] Female Louis Hypnosis Pregnancy (Fire Emblem Engage),Asagami  【Skeb】女体化ルイ 催眠孕ませ,AsagamiFemale Louis Hypnosis Pregnancy,japanese,asagami,,doujinshi,"fire emblem, fire emblem engage",louis,"kissing, big breasts, mind control, mosaic censorship, sole female, sole male, bald, gender morph, gender change",10,2025-04-01 21:14:01,2025-04-01 21:14:01,2025-04-02 05:12:18
565720,[Nise Onnanoko Modoki] irekawa Oji ~Irekawari Jutsu o Tsukaeru Ojisan-tachi~ [English],[ニセオンナノコモドキ] イレカワオジ~入れ替わり術を使えるおじさんたち~,irekawa Oji,"english, translated",,,doujinshi,original,,"big breasts, old man, corruption, masturbation, body swap, nakadashi, ahegao, huge breasts, small breasts, gender change",30,2025-04-01 21:16:36,2025-04-01 21:16:36,2025-04-02 05:12:19
565721,[ジンガイラボ (めび太)] 人間の精子で妊娠するメス猿を絶滅の危機から救う話,[ジンガイラボ (めび太)] 人間の精子で妊娠するメス猿を絶滅の危機から救う話,人間の精子で妊娠するメス猿を絶滅の危機から救う話,japanese,,,manga,,,"dark skin, lolicon, full color, shotacon, sole male, monkey girl",41,2025-04-01 21:20:27,2025-04-01 21:20:27,2025-04-02 05:12:19
565722,Kiga tsuyokute otoko girai na Kadokura-san wo ippai hazukashimeru hanashi  [esuesu],気が強くて男嫌いな門倉さんをいっぱい辱める話 [esuesu],Kiga tsuyokute otoko girai na Kadokura-san wo ippai hazukashimeru hanashi,japanese,,esuesu,doujinshi,,,,24,2025-04-01 21:22:33,2025-04-01 21:22:33,2025-04-02 05:12:20
565723,"[Stardust! (えむ丸, 川伊ねね)] ふたりのひみつ (Blue Lock) [Digital]","[Stardust! (えむ丸, 川伊ねね)] ふたりのひみつ (ブルーロック) [DL版]",ふたりのひみつ,japanese,,,doujinshi,blue lock,"yoichi isagi, meguru bachira","anal, males only, yaoi, anal intercourse",37,2025-04-01 21:26:11,2025-04-01 21:26:11,2025-04-02 05:12:21
565724,[STUDIO HUAN (Kotoyoshi Yumisuke)] Ikijigoku rifure ni tokeru otto tanshin funin hitodzuma,[STUDIOふあん(琴義弓介)] イキ地獄リフレに溶ける夫単身赴任人妻 通常版,Ikijigoku rifure ni tokeru otto tanshin funin hitodzuma,japanese,kotoyoshi yumisuke,studio huan,doujinshi,original,,"big breasts, cheating, nakadashi, anal, sex toys, hairy, bikini, fingering, blowjob, muscle, sole female, ponytail, anal intercourse, nipple stimulation",125,2025-04-01 21:37:13,2025-04-01 21:37:13,2025-04-02 05:12:22
565725,[STUDIO HUAN (Kotoyoshi Yumisuke)] Ikijigoku rifure ni tokeru otto tanshin funin hitodzuma Inmō ari,[STUDIOふあん(琴義弓介)] イキ地獄リフレに溶ける夫単身赴任人妻 陰毛あり,Ikijigoku rifure ni tokeru otto tanshin funin hitodzuma Inmō ari,japanese,kotoyoshi yumisuke,studio huan,doujinshi,original,,"squirting, big breasts, nakadashi, anal, sex toys, hairy, bikini, x-ray, fingering, blowjob, sole female, ponytail, anal intercourse, nipple stimulation",125,2025-04-01 21:48:31,2025-04-01 21:48:31,2025-04-02 05:12:23
565726,[FAKE An] Boshi donburi ryokan 〜 gōyoku fushi ni moteasoba re 〜,[FAKE庵] 母子丼旅館〜強欲父子に弄ばれ〜,Boshi donburi ryokan 〜 gōyoku fushi ni moteasoba re 〜,japanese,,fake an,doujinshi,,,,121,2025-04-01 21:57:41,2025-04-01 21:57:41,2025-04-02 05:12:24
