ID,EN_TITLE,JP_TITLE,CLEAN_TITLE,LANGUAGE,ARTIST,GROUP_NAME,CATEGORY,PARODY,CHARACTER,TAGS,PAGES,UPLOAD_DATE,FORMATTED_DATE,SCRAPED_DATE
612631,四葉の戦姫クローバーローゼ ボイスコミック第二話（特典② 描き下ろしおまけイラスト）,四葉の戦姫クローバーローゼ ボイスコミック第二話（特典② 描き下ろしおまけイラスト）,四葉の戦姫クローバーローゼ ボイスコミック第二話（特典② 描き下ろしおまけイラスト）,japanese,,,doujinshi,original,,,13,2025-12-01 04:18:18,2025-12-01 04:18:18,2025-12-02 14:01:11
612632,[acroyali] 碧蓝航线系列 双凤双飞本,,碧蓝航线系列 双凤双飞本,chinese,,,doujinshi,azur lane,taihou,"big breasts, group, ffm threesome, bondage, lactation, mosaic censorship, impregnation, shotacon, shibari, ponytail",26,2025-12-01 04:24:01,2025-12-01 04:24:01,2025-12-02 14:01:11
612633,[白熊] コミケでエロいことするあずきち,[白熊] コミケでエロいことするあずきち,コミケでエロいことするあずきち,japanese,sirokuma,,doujinshi,hololive,azki,"bikini, collar, sole female, bald, vtuber",14,2025-12-01 04:25:06,2025-12-01 04:25:06,2025-12-02 14:01:12
612634,[リンリ缶] kdu mkrとえっちなイベント,[リンリ缶] kdu mkrとえっちなイベント,kdu mkrとえっちなイベント,japanese,rinri kan,,doujinshi,nijisanji,rindou mikoto,"oni, sole female, sole male, horns, vtuber",11,2025-12-01 04:26:01,2025-12-01 04:26:01,2025-12-02 14:01:12
612635,"[Baketsu Purin] ""Omae ga Futta InCha Onna, Ima ja Followers Hyakuman-nin Goe no Bakunyuu Gravure Idol dazo? w"" —Kanojo no Iru Ore o Muchimuchi Bakunyuu Body de Yuuwaku shite kite Gyaku NTR— | 「你以前拒絕的陰角女孩現在已是追隨者超過100萬人的爆乳寫真集偶像了哦？哈哈」 [Chinese] [Amerins漢化] [Digital]",[バケツプリン] 「お前がフった陰キャ女、今じゃフォロワー100万人超えの爆乳グラビアアイドルだぞ？w」 ―彼女のいる俺をむちむち爆乳ボディで誘惑してきて逆NTR― [中国翻訳] [DL版],"""Omae ga Futta InCha Onna, Ima ja Followers Hyakuman-nin Goe no Bakunyuu Gravure Idol dazo? w"" —Kanojo no Iru Ore o Muchimuchi Bakunyuu Body de Yuuwaku shite kite Gyaku NTR— | 「你以前拒絕的陰角女孩現在已是追隨者超過100萬人的爆乳寫真集偶像了哦？哈哈」","translated, chinese",,baketsu purin,doujinshi,original,,"big breasts, netorare, cheating, nakadashi, multi-work series, paizuri, blowjob, sole male, very long hair",81,2025-12-01 04:30:57,2025-12-01 04:30:57,2025-12-02 14:01:13
612636,"[Baketsu Purin] ""Omae ga Futta InCha Onna, Ima ja Followers Hyakuman-nin Goe no Bakunyuu Gravure Idol dazo? w"" 2 —Kanojo no Iru Ore o Muchimuchi Bakunyuu Body de Yuuwaku shite kite Gyaku NTR— | 「你以前拒絕的陰角女孩現在已是追隨者超過100萬人的爆乳寫真集偶像了哦？哈哈」2 [Chinese] [Amerins漢化] [Digital]",[バケツプリン] 「お前がフった陰キャ女、今じゃフォロワー100万人超えの爆乳グラビアアイドルだぞ?w」2 ―彼女のいる俺をむちむち爆乳ボディで誘惑してきて逆NTR― [中国翻訳] [DL版],"""Omae ga Futta InCha Onna, Ima ja Followers Hyakuman-nin Goe no Bakunyuu Gravure Idol dazo? w"" 2 —Kanojo no Iru Ore o Muchimuchi Bakunyuu Body de Yuuwaku shite kite Gyaku NTR— | 「你以前拒絕的陰角女孩現在已是追隨者超過100萬人的爆乳寫真集偶像了哦？哈哈」2","translated, chinese",,baketsu purin,doujinshi,original,,"handjob, kissing, big breasts, swimsuit, glasses, netorare, cheating, schoolgirl uniform, breast feeding, nakadashi, kimono, bikini, multi-work series, paizuri, sole male, ponytail, nipple stimulation",84,2025-12-01 04:36:14,2025-12-01 04:36:14,2025-12-02 14:01:14
612637,[KeinV] 多国合同調査チーム·稲妻 (Genshin Impact),[KeinV] 多国合同調査チーム·稲妻 (原神),多国合同調査チーム·稲妻,japanese,maskwolf | keinv,,doujinshi,genshin impact,"aether, keqing, ganyu, yae miko","big breasts, group, netorare, full color, hidden sex",11,2025-12-01 04:37:14,2025-12-01 04:37:14,2025-12-02 14:01:14
612638,[Manmaya (Same Manma)] Seitaishi ~Watashi no Tsuma o Daitekure~ | 性療師1～請疼愛我的妻子～ [Chinese] [Digital],[まんま屋 (さめまんま)] 性体師～私の妻を抱いてくれ～ [中国翻訳] [DL版],Seitaishi| 性療師1～請疼愛我的妻子～,"translated, chinese",same manma,manmaya,doujinshi,original,,"milf, big breasts, uncensored, cheating, huge breasts, anal, hairy, multi-work series, big areolae, swinging, lingerie, fingering, sole male, anal intercourse, netorase",103,2025-12-01 04:44:10,2025-12-01 04:44:10,2025-12-02 14:01:15
612639,(C96) [Himepuchitei (Hamaburicchi)] Mesugaki Flan-chan Suikan Anal Choukyou ~Nemutteite Kigatsukanai Uchi ni Hentai Anal Dorei ni Sareru Imouto-sama~| 雌小鬼❤芙蘭醬 睡奸後竅調教 趁深眠之時無法察覺的間隙 變態❤肛門❤淪爲奴隸的妹妹大人(Touhou Project)[Chinese] [明稿昨拖汉化组],(C96) [ひめぷち亭 (ハマブリッチ)] メスガキ♥フランちゃん睡姦アナル調教♥~眠っていて気が付かないうちに変態♥アナル♥奴隷にされる妹様♥~ (東方Project) [中国翻訳],Mesugaki Flansama~| 雌小鬼❤芙蘭醬 睡奸後竅調教 趁深眠之時無法察覺的間隙 變態❤肛門❤淪爲奴隸的妹妹大人,"translated, chinese",hamaburicchi | anda,himepuchitei,doujinshi,touhou project,flandre scarlet,"wings, anal, sleeping, lolicon, sole female, sole male, focus anal, anal intercourse, mesugaki",23,2025-12-01 04:49:08,2025-12-01 04:49:08,2025-12-02 14:01:15
612640,"[Touga] Otoko Tomodachi 3nin, Ecchi ni Mezame SUMMER!? ～Oretachi Otoko de, Tomodachi nanoni!～",[藤河] 男友達3人、エッチに目覚めサマー！? ～俺達男で、友達なのに！～,"Otoko Tomodachi 3nin, Ecchi ni Mezame SUMMER!? ～Oretachi Otoko de, Tomodachi nanoni!～",japanese,togapi,,doujinshi,original,,"group, anal, full color, males only, yaoi, tomgirl, anal intercourse",73,2025-12-01 04:54:03,2025-12-01 04:54:03,2025-12-02 14:01:16
612641,[Cocoa Holic (Yuizaki Kazuya)] Onnanoko no Mayu 2 -Maid in May- | 名为茧的少女2 -五月的女仆装- [Chinese] [绅士仓库汉化] [Digital],[ココアホリック (ユイザキカズヤ)] おんなのこのまゆ2 -さつきよそをい- [中国翻訳] [DL版],Onnanoko no Mayu 2| 名为茧的少女2,"translated, chinese",yuizaki kazuya,cocoa holic,doujinshi,original,,"maid, lolicon, multi-work series, stockings, sole female, sole male",34,2025-12-01 05:01:38,2025-12-01 05:01:38,2025-12-02 14:01:17
612642,[MangMoongMing] Step Sis x Big Bro | 조그만 누나와 큰 동생.  | 小不点姐姐与大块头弟弟 [中文翻译]（更新中）,[망뭉밍] 조그만 누나와 큰 동생[中文翻译]（更新中）,Step Sis x Big Bro | 조그만 누나와 큰 동생.  | 小不点姐姐与大块头弟弟（更新中）,"translated, chinese",mangmoongming,,doujinshi,original,,"full censorship, tall man, dark skin, full color, incest, big penis, stomach deformation, webtoon, bald",307,2025-12-01 05:23:23,2025-12-01 05:23:23,2025-12-02 14:01:17
612643,[灸と生ハム(宗六)]双子猫再録 [Dante x Vergil](Devil May Cry) [Chinese],[灸と生ハム(宗六)]双子猫再録 [ダンバジ](デビルメイクライ) [中国翻訳],双子猫再録,"translated, chinese",,,doujinshi,devil may cry,"vergil, dante","twins, brother, males only, yaoi",48,2025-12-01 05:26:25,2025-12-01 05:26:25,2025-12-02 14:01:18
612644,[田舎の化身] 時間停止漫画,[田舎の化身] 時間停止漫画,時間停止漫画,japanese,inaka no keshin,,doujinshi,original,,"time stop, schoolgirl uniform, sole female",4,2025-12-01 05:26:59,2025-12-01 05:26:59,2025-12-02 14:01:18
612645,[Muigyuu] Ugokenai Dark Elf ni Suki Katte suru Hanashi,[ムイギュウ] 動けないダークエルフに好き勝手する話,Ugokenai Dark Elf ni Suki Katte suru Hanashi,japanese,muigyuu,,doujinshi,original,,"elf, kissing, big breasts, nakadashi, dark skin, rape, dilf, impregnation, blowjob, bbm, sole female, sole male",6,2025-12-01 05:27:41,2025-12-01 05:27:41,2025-12-02 14:01:19
612646,[Toriaezu Milk (konpa)] Goshujinsama to Ecchi ga daisuki na Otoko no Ko o Mimamoru Hon,[とりあえずミルク (konpa)] ご主人様とえっちが大好きな男の娘を見守る本,Goshujinsama to Ecchi ga daisuki na Otoko no Ko o Mimamoru Hon,japanese,konpa,toriaezu milk,doujinshi,original,,"group, anal, crossdressing, shemale, dark skin, males only, yaoi, tomgirl, anal intercourse",39,2025-12-01 05:30:24,2025-12-01 05:30:24,2025-12-02 14:01:19
612647,[Ikki Ichiyuu] Hatsukoi Aite wa Senpai-tachi no Niku Onaho | 初恋对象是前辈们的人肉飞机杯 [Chinese],[一起一雄] 初恋相手は先輩達の肉オナホ [中国翻訳],Hatsukoi Aite wa Senpai-tachi no Niku Onaho | 初恋对象是前辈们的人肉飞机杯,"translated, chinese",ikki ichiyuu,,doujinshi,original,,"big breasts, bbw, mmf threesome, group, netorare, schoolgirl uniform, nakadashi, hairy, gyaru-oh, big areolae, inverted nipples, blowjob, extraneous ads",46,2025-12-01 05:33:13,2025-12-01 05:33:13,2025-12-02 14:01:20
612648,[Fuguta-ke] Kangoshi-san ga Chinko Arau Tsuide ni Nuitekureru Hanashi | 护士小姐在给我清洗鸡儿的时候顺便帮我撸的故事 [Chinese] [Digital],[フグタ家] 看護師さんがチンコ洗うついでにヌいてくれる話 [中国翻訳] [DL版],Kangoshi-san ga Chinko Arau Tsuide ni Nuitekureru Hanashi | 护士小姐在给我清洗鸡儿的时候顺便帮我撸的故事,"translated, chinese",fuguta-ke,,doujinshi,original,,"handjob, big breasts, nurse, nakadashi, sole female, sole male, gloves, extraneous ads",36,2025-12-01 05:35:36,2025-12-01 05:35:36,2025-12-02 14:01:20
612649,[Anabuki Bouhatei] Bakunyuu Gal no Kakushigoto [Chinese] [Digital],[穴吹防波堤] 爆乳ギャルのカクシゴト [中国翻訳] [DL版],Bakunyuu Gal no Kakushigoto,"translated, chinese",anabuki bouhatei,,doujinshi,original,,"big breasts, big ass, schoolgirl uniform, nakadashi, huge breasts, gyaru, inverted nipples, sole female, sole male, extraneous ads",42,2025-12-01 05:38:23,2025-12-01 05:38:23,2025-12-02 14:01:21
612650,[Ginshio Honpo (Ginen)] Akumu Byoutou ~Hakui no Tenshi ni Shinya no Haisetsu Kaijo de Anal Name & Chichishibori Tekoki Sareru Boku~ [Chinese],[銀しお本舗 (銀塩)] 悪夢病棟〜白衣の天使に深夜の排泄介助でアナル舐め＆乳絞り手コキされる僕〜 [中国翻訳],Akumu Byoutou,"translated, chinese",ginen,ginshio honpo,doujinshi,original,,"handjob, big breasts, femdom, stockings, rimjob, sole female, sole male, gloves, mouth mask, eye-covering bang, extraneous ads",29,2025-12-01 05:40:25,2025-12-01 05:40:25,2025-12-02 14:01:22
612651,[Ash wing (Makuro)] Docchi ga Osuki desu ka + Ecchi na Omakebon | 喜歡哪一邊呢 + 色色的雜圖本 (Blue Archive) [Chinese] [Digital],[Ash wing (まくろ)] どっちがお好きですか (ブルーアーカイブ) [中国翻訳],Docchi ga Osuki desu ka + Ecchi na Omakebon | 喜歡哪一邊呢 + 色色的雜圖本,"translated, chinese",makuro,ash wing,doujinshi,blue archive,"sensei, kanna ogata","big breasts, schoolboy uniform, sole female, sole male, kemonomimi, eye-covering bang, extraneous ads, halo",40,2025-12-01 05:43:02,2025-12-01 05:43:02,2025-12-02 14:01:22
612652,[Yawarakai Niku (Yuruchin Kyouso)] Shojo no Watashi ga Nikubenki ni Ochiru made... vol.2 [Chinese],[柔らかい肉 (ゆるちん教祖)] 処女の私が肉便器に堕ちるまで… vol.2 [中国翻訳],Shojo no Watashi ga Nikubenki ni Ochiru made... vol.2,"translated, chinese",yuruchin kyouso,,doujinshi,original,,"big breasts, group, anal, multi-work series, double penetration, pixie cut, eye-covering bang, extraneous ads",37,2025-12-01 05:45:38,2025-12-01 05:45:38,2025-12-02 14:01:23
612653,[Charucharo] Enkyori Renai Chuuni Betsu no Otoko o Shitte Shimau | 被别的男人知道自己在异地恋 [Chinese],[ちゃるちゃろ] 遠距離恋愛中に別の男を知ってしまう [中国翻訳],Enkyori Renai Chuuni Betsu no Otoko o Shitte Shimau | 被别的男人知道自己在异地恋,"translated, chinese",,,doujinshi,original,,"big breasts, group, netorare, nakadashi, ahegao, drugs, bunny girl, stockings, fingering, rape, phone sex, body writing, sole female, extraneous ads",48,2025-12-01 05:48:49,2025-12-01 05:48:49,2025-12-02 14:01:23
612654,[Namajiru Honpo (Pirukusu)] Moto Cosplayer Hitozuma Yukari (32) Seikatsuhi o Kasegu Tame Otto ni Naisho de Doujin AV Debut | 曾经玩cos的人妻优香理（32）为了赚生活费瞒着丈夫AV出道的故事 [Chinese],[生汁本舗 (ぴるくす)] 元コスプレイヤー人妻ゆかり(32)生活費を稼ぐため夫に内緒で同人AVデビュー [中国翻訳],Moto Cosplayer Hitozuma YukariSeikatsuhi o Kasegu Tame Otto ni Naisho de Doujin AV Debut | 曾经玩cos的人妻优香理（32）为了赚生活费瞒着丈夫AV出道的故事,"translated, chinese",pirukusu,,doujinshi,original,,"squirting, milf, big breasts, netorare, cheating, schoolgirl uniform, prostitution, sex toys, gyaru-oh, lingerie, filming, blowjob, muscle, collar, sole female, sole male, beauty mark, twintails, exposed clothing, extraneous ads",78,2025-12-01 05:53:31,2025-12-01 05:53:31,2025-12-02 14:01:24
612655,[Omusubi Kororin (Omusubi Korori)] Ore no Jimi Kanojo wa Natsuyasumi dake Aitsu Senyou no OnaPet | 我的土妹子女友在暑假成为了他的专属了性玩物 [Chinese] [Digital],[おむすびころりん (緒結ころり)] 俺の地味彼女は夏休みだけあいつ専用のオナペット [中国翻訳] [DL版],Ore no Jimi Kanojo wa Natsuyasumi dake Aitsu Senyou no OnaPet | 我的土妹子女友在暑假成为了他的专属了性玩物,"translated, chinese",omusubi korori,aburi tarako-tei | omusubi kororin,doujinshi,original,,"big breasts, glasses, netorare, hairy, kimono, bikini, gyaru-oh, stockings, blackmail, sole female, sole male, eye-covering bang, extraneous ads",57,2025-12-01 05:57:14,2025-12-01 05:57:14,2025-12-02 14:01:25
612656,[Imokenpi Kinenbi] Uso TS ~Shinjiteita Shinyuu ga Boku no Doutei o Nerau Dosukebe Inma datta Hanashi~ [Chinese],[いもけんぴ記念日] 嘘TS♂♀〜信じていた親友がボクの童貞を狙うドスケベ淫魔だった話〜 [中国翻訳],Uso TS,"translated, chinese",,imokenpi kinenbi,doujinshi,original,,"wings, big breasts, demon girl, dark skin, collar, sole female, tail, eye-covering bang, gender change, extraneous ads",44,2025-12-01 05:59:58,2025-12-01 05:59:58,2025-12-02 14:01:25
612657,[Deastim (Unadon)] Otto wa Dare ni mo Watashimasen (Fate/Grand Order) [Chinese] [Digital],[であすちーむ (うな丼)] 夫は誰にも渡しませんっ (Fate/Grand Order) [中国翻訳] [DL版],Otto wa Dare ni mo Watashimasen,"translated, chinese",unadon,deastim,doujinshi,fate grand order,"gudao | ritsuka fujimaru, morgan le fay","big breasts, mosaic censorship, sole female, sole male, ponytail, very long hair, extraneous ads",35,2025-12-01 06:02:26,2025-12-01 06:02:26,2025-12-02 14:01:26
612658,[Unian (Uni18)] Sennou Appli de Namaiki na Oshiego ni Sukihoudai Shitemita | 用催眠APP狠狠地调教傲慢的女学生 [Chinese],[うに庵 (うに18)] 洗脳アプリで生意気な教え子に好き放題してみた [中国翻訳],Sennou Appli de Namaiki na Oshiego ni Sukihoudai Shitemita | 用催眠APP狠狠地调教傲慢的女学生,"translated, chinese",uni18,unian,doujinshi,original,,"sweating, schoolgirl uniform, hairy, defloration, mind control, mosaic censorship, teacher, bbm, sole female, sole male, extraneous ads",49,2025-12-01 06:05:43,2025-12-01 06:05:43,2025-12-02 14:01:26
612659,"[Countack (Kojiki Ohji)] Boku ga Taifu Sareru made, Ato | 距離我被逮捕、還剩 [Chinese] [Digital]",[カウンタック (古事記王子)] 僕がたいふぉされるまで、あと [中国翻訳] [DL版],"Boku ga Taifu Sareru made, Ato | 距離我被逮捕、還剩","translated, chinese",kojiki ohji,countack,doujinshi,original,,"group, schoolgirl uniform, prostitution, anal, lolicon, sole female, twintails, soushuuhen, anal intercourse, extraneous ads",63,2025-12-01 06:18:05,2025-12-01 06:18:05,2025-12-02 14:01:27
612660,[Kumano Tooru] Yuki Hodoki (COMIC Penguin Club 2023-06) [Chinese] [Digital],[くまのとおる] ゆきほどき (COMIC ペンギンクラブ 2023年6月号) [中国翻訳] [DL版],Yuki Hodoki,"translated, chinese",kumada | kumano tooru,,manga,,,"full censorship, sole female, sole male, extraneous ads",27,2025-12-01 06:20:03,2025-12-01 06:20:03,2025-12-02 14:01:27
612661,[Anthology] Otoko no Ko-llection! S AD 07 Saiin Otokonoko! [Digital],[アンソロジー] 男の娘・れくしょんッ！S AD 07 催淫男の娘！[DL版],Otoko no Ko-llection! S AD 07 Saiin Otokonoko!,japanese,"hayashida toranosuke, palco nagashima, nyantarous, marui shiro | shikakui kuromaru, okuta kei, yasumi, snow",,manga,,,"maid, handjob, kissing, garter belt, big nipples, schoolgirl uniform, anthology, nakadashi, anal, sex toys, crossdressing, phimosis, mind control, males only, inflation, yaoi, stockings, apron, tomgirl, blowjob, beauty mark, cumflation, mesuiki, anal intercourse, nipple stimulation",114,2025-12-01 06:27:04,2025-12-01 06:27:04,2025-12-02 14:01:28
612662,[Muigyuu] Futon no naka no Goriyama-kun,[ムイギュウ] 布団の中のゴリ山くん,Futon no naka no Goriyama-kun,japanese,muigyuu,,doujinshi,original,,"kissing, nakadashi, sleeping, rape, muscle, sole female, sole male",8,2025-12-01 06:28:01,2025-12-01 06:28:01,2025-12-02 14:01:29
612663,[Anthology] Comic Masura VOL.02,[アンソロジー] コミックマスラ VOL.02,Comic Masura VOL.02,japanese,"ikue fuji, sayakata, tokisudeni osushi, fukamichi ranou",,manga,,,"maid, big breasts, glasses, anthology, big areolae, stockings",115,2025-12-01 06:35:25,2025-12-01 06:35:25,2025-12-02 14:01:29
612664,[Yoku no Genzen (Tarenagashi)] Jimi-chan to Chiyara-senpai! [Digital],[欲の源泉 (垂れ流し)] 地美ちゃんと千也羅先輩っ! [DL版],Jimisenpai!,japanese,tarenagashi,,doujinshi,original,,"milf, kissing, big breasts, nurse, schoolboy uniform, glasses, schoolgirl uniform, nakadashi, ahegao, anal, blowjob face, gyaru-oh, blowjob, muscle, big penis, sole female, sole male, twintails",57,2025-12-01 06:39:07,2025-12-01 06:39:07,2025-12-02 14:01:30
612665,COMIC Shigekiteki SQUIRT!! Vol. 66 [Digital],コミック刺激的 SQUIRT！！Vol.66 [DL版],COMIC Shigekiteki SQUIRT!! Vol. 66,japanese,"urakawa opera, yoshida tobio, nishida megane, sakamata nerimono, kurosaki shun, shigeking-max",,manga,,,"big breasts, group, anthology, nakadashi, anal, hairy, lolicon, double penetration",128,2025-12-01 07:02:44,2025-12-01 07:02:44,2025-12-02 14:01:30
612666,Masyo Ecole Vol.10,Masyo Ecole Vol.10,Masyo Ecole Vol.10,japanese,"tenchuumaru, emina, tenjiku rounin, isemagu, enpuro, tomura suisen, harakucchi, suzuoka chitose, tiamat, sayato",,manga,,,"big breasts, netorare, cheating, anthology, hairy, lolicon",237,2025-12-01 07:48:16,2025-12-01 07:48:16,2025-12-02 14:01:31
612667,[Muigyuu] Konyoku toka Kinishinai Elf-san,[ムイギュウ] 混浴とか気にしないエルフさん,Konyoku toka Kinishinai Elf-san,japanese,muigyuu,,doujinshi,original,,"elf, big breasts, mmf threesome, group, nakadashi, dilf",17,2025-12-01 07:49:44,2025-12-01 07:49:44,2025-12-02 14:01:32
612668,[YANAGIE TERASU ][[Guda sake] raburabu ryokan etchi[ fate grand order ),,raburabu ryokan etchi[ fate grand order ),japanese,,,doujinshi,fate grand order,,demon girl,12,2025-12-01 07:50:33,2025-12-01 07:50:33,2025-12-02 14:01:32
612669,COMIC Unreal 2025-12 Vol. 118 [Digital],コミックアンリアル 2025年12月号 Vol.118 [DL版],COMIC Unreal 2025-12 Vol. 118,japanese,"somejima, mori airi, shiina kazuki, harigane shinshi, tanenashi miya, solar milk, neriume, imachi reki, echigoya takeru, garoudo, masuda miyaka | wakuta chisaki, fukuinu, naitou kirara, d kaketsu, amatsuji, yuumi, usotsuki fx, shiranai hitoshi, takutaku",,manga,,,"wings, big breasts, nun, bbw, monster girl, full censorship, anthology, bestiality, ahegao, demon girl, hairy, horse, slime girl, tanlines, bunny girl, cowgirl, fox girl, shotacon, crotch tattoo, kemonomimi, horns, tail, gender change",456,2025-12-01 09:20:22,2025-12-01 09:20:22,2025-12-02 14:01:33
612670,COMIC Kuriberon DUMA 2025-12 Vol.79,COMIC クリベロン DUMA 2025年12月号 Vol.79,COMIC Kuriberon DUMA 2025-12 Vol.79,japanese,"sunagawa tara, nme, kurogane satsuki | kurogane maki, hasebe souutsu, wakimiunten, choma, kawaguchi ran, huwahuwa raidou, uncow, zusuki",,manga,,,"milf, big breasts, piercing, anthology, ahegao, hairy, mosaic censorship, muscle, crotch tattoo, thick eyebrows, nipple piercing",268,2025-12-01 09:37:19,2025-12-01 09:37:19,2025-12-02 14:01:33
612671,[Mugihoho (Muigyuu)] Elf to Orc no Otoshigoro,[ムギホホ (ムイギュウ)] エルフとオークのお年頃,Elf to Orc no Otoshigoro,japanese,muigyuu,mugihoho,doujinshi,original,,"elf, virginity, orc, nakadashi, defloration, impregnation, muscle, stomach deformation, sole female, sole male, ponytail",25,2025-12-01 09:39:12,2025-12-01 09:39:12,2025-12-02 14:01:34
612672,[Nanamehan (Hansharu)] Saikyou Mesugaki-chan no Kusozako Muchimuchi Sentouinka Kaizou Koutei | 最猛雌小鬼醬的戰鬥員化改造工程 [Chinese] [沒有漢化] [Digital],[ななめ班 (半しゃる)] 最恐メスガキちゃんのクソザコむちむち戦闘員化改造工程  [中国翻訳] [DL版],Saikyou Mesugaki-chan no Kusozako Muchimuchi Sentouinka Kaizou Koutei | 最猛雌小鬼醬的戰鬥員化改造工程,"translated, chinese",hansharu,nanamehan,doujinshi,original,,"body modification, thigh high boots, lolicon, latex, breast expansion, twintails, gloves",38,2025-12-01 09:46:10,2025-12-01 09:46:10,2025-12-02 14:01:35
612673,[Akashamu (Akai Hoshi)] Bakunyuu Tosho Iin no Stalker Onna ni Osowareta kara Gyakushuu shite yaru Hanashi. [Chinese] [Digital],[紅しゃむ (紅いほし)] 爆乳図書委員のストーカー女に襲われたから逆襲してやる話。 [中国翻訳] [DL版],Bakunyuu Tosho Iin no Stalker Onna ni Osowareta kara Gyakushuu shite yaru Hanashi.,"translated, chinese",akashamu,,doujinshi,original,,"kissing, big breasts, glasses, nakadashi, x-ray, footjob, inverted nipples, blowjob, big penis, yandere, sole female, sole male, twintails, extraneous ads",59,2025-12-01 09:50:10,2025-12-01 09:50:10,2025-12-02 14:01:35
612674,[Anthology] comic End Roll Vol.2,[アンソロジー] comicエンドロールvol.2,comic End Roll Vol.2,japanese,"daitou, tearontaron",,manga,,,"schoolgirl uniform, anthology, blackmail, twintails",134,2025-12-01 09:58:51,2025-12-01 09:58:51,2025-12-02 14:01:36
612675,COMIC Orga Vol. 80,COMICオルガ vol.80,COMIC Orga Vol. 80,japanese,"keso, asahina makoto, tamaki, tamio",,manga,,,"big breasts, anthology, lolicon, exhibitionism",82,2025-12-01 10:15:17,2025-12-01 10:15:17,2025-12-02 14:01:36
612676,[あくた～] 即堕ちTSっ娘と絶倫フタナリっ娘,,即堕ちTSっ娘と絶倫フタナリっ娘,japanese,,akuta,doujinshi,original,,"futanari, big breasts, spanking, paizuri, gender morph, gender change, nipple piercing, dickgirl on female",41,2025-12-01 10:17:58,2025-12-01 10:17:58,2025-12-02 14:01:37
612677,[海凪コウ] 個室サウナデート,[海凪コウ] 個室サウナデート,個室サウナデート,japanese,minagi koh,,doujinshi,original,,"kissing, swimsuit, nakadashi, bikini, blowjob, sole female, sole male",11,2025-12-01 10:18:49,2025-12-01 10:18:49,2025-12-02 14:01:38
612678,COMIC AUN Kai Vol. 40,COMIC 阿吽 改 Vol.40,COMIC AUN Kai Vol. 40,japanese,"hatch, tetsuna, shijokko, hashimura aoki | kanno wataru, pupunezumi",,manga,,,"big breasts, amputee, anthology, niece, lolicon, defloration, incest, kemonomimi, vaginal birth",124,2025-12-01 10:41:55,2025-12-01 10:41:55,2025-12-02 14:01:38
612679,COMIC Shingeki 2026-01 [Digital],COMIC 真激 2026年1月号 [DL版],COMIC Shingeki 2026-01,japanese,"taihei tengoku, gonza, runa, bu-chan, seijin, miumi, amano kazumi | taira issui, muunyan, ryokurin, aoyama kiiro., sakuretsu tororokonbu, oritsuki fumio, zuuga, shuuhen kouichi, masutabe shou, emumiya nyamu, tachi iyashi, enu naitsu",,manga,,,"futanari, milf, unusual teeth, kissing, big breasts, garter belt, piercing, full censorship, netorare, anthology, ahegao, niece, hairy, dark skin, lolicon, mind control, incest, tanlines, lactation, stockings, rimjob, gyaru, sister, blowjob, beauty mark, twintails, hair buns, stirrup legwear, eye-covering bang, painted nails, dickgirl on female",600,2025-12-01 12:37:31,2025-12-01 12:37:31,2025-12-02 14:01:40
612680,[Putama] Kisaki Rumi 4-page (Blue Archive),[ぷ玉] キサキルミ 4ページ (ブルーアーカイブ),Kisaki Rumi 4-page,japanese,putama,,doujinshi,blue archive,"sensei, rumi akeshiro, kisaki ryuuge","handjob, big breasts, cunnilingus, group, ffm threesome, lolicon, small breasts, paizuri, sole male, kemonomimi, twintails, hair buns, very long hair, multiple handjob, halo",8,2025-12-01 12:39:49,2025-12-01 12:39:49,2025-12-02 14:01:40
612681,[海凪コウ] 勤労感謝の日,[海凪コウ] 勤労感謝の日,勤労感謝の日,japanese,minagi koh,,doujinshi,original,,"stockings, chinese dress, first person perspective, sole female, sole male",10,2025-12-01 12:40:42,2025-12-01 12:40:42,2025-12-02 14:01:41
612682,[海凪コウ] 体育祭ギャル,[海凪コウ] 体育祭ギャル,体育祭ギャル,japanese,minagi koh,,doujinshi,original,,"kissing, cunnilingus, group, facesitting, nakadashi, ffm threesome, femdom, footjob, full color, rimjob, gyaru, smell, bloomers, blowjob, sole male, beauty mark, multimouth blowjob, nipple stimulation, painted nails",16,2025-12-01 12:41:53,2025-12-01 12:41:53,2025-12-02 14:01:41
