ID,EN_TITLE,JP_TITLE,CLEAN_TITLE,LANGUAGE,ARTIST,GROUP_NAME,CATEGORY,PARODY,CHARACTER,TAGS,PAGES,UPLOAD_DATE,FORMATTED_DATE,SCRAPED_DATE
576963,[Nijiiro Guin-tei (Nijiiro Guin)] Kaisha no Senpai ga Urusai node Jyuujun na Mesu Ana ni Naru made Kaihatsusuru｜公司前輩太囉嗦 所以將她開發成順從的雌性肉穴 [Chinese] [OMTSW漢化],[虹色ぐいん亭 (虹色ぐいん)] 会社の先輩がうるさいので従順なメス穴になるまで開発する [中国翻訳],Kaisha no Senpai ga Urusai node Jyuujun na Mesu Ana ni Naru made Kaihatsusuru｜公司前輩太囉嗦 所以將她開發成順從的雌性肉穴,"translated, chinese",nijiiro guin,,doujinshi,original,,"big breasts, nakadashi, ahegao, anal, sex toys, gaping, blowjob, sole female, focus anal, anal intercourse",44,2025-06-03 16:24:53,2025-06-03 16:24:53,2025-06-04 14:09:13
576964,[Sukebe Hatsudensho (Hatsuden Pengin)] Akogare no Senpai Maidchou no Yotogi o Kengaku | 我所崇拜的女仆长前辈的侍寝♡教学 [Chinese] [灼眼の牛爷爷个人汉化] [Digital],[すけべ発電所 (発電ペンギン)] 憧れの先輩メイド長の夜伽を見学 [中国翻訳] [DL版],Akogare no Senpai Maidchou no Yotogi o Kengaku | 我所崇拜的女仆长前辈的侍寝♡教学,"translated, chinese",hatsuden pengin,,doujinshi,original,,"maid, kissing, big breasts, old man, humiliation, urination, ahegao, anal, dog girl, stockings, paizuri, gaping, blowjob, collar, sole male, tail plug, kemonomimi, leash, petplay",40,2025-06-03 16:28:18,2025-06-03 16:28:18,2025-06-04 14:09:15
576965,"[Jairou] Rankou de Wakarou! | Let's Learn With Orgy! Ch. 2 [English] [Colorized] [MrBubbles,hardcase8translates, biribiri, Ra3byou] [SPDSD]",[ジャイロウ] 乱交で分かろう! [英訳],Rankou de Wakarou! | Let's Learn With Orgy! Ch. 2,"english, translated",jairou | xil,,manga,,,"group, glasses, dark skin, lolicon, full color, shotacon, kodomo doushi",46,2025-06-03 16:38:37,2025-06-03 16:38:37,2025-06-04 14:09:16
576966,seed of ruin 11,seed of ruin 11,seed of ruin 11,japanese,,,doujinshi,,,"elf, snuff, nakadashi, x-ray, blood, bodysuit, fingering, guro, impregnation, gloves, nipple stimulation, high heels",66,2025-06-03 16:44:01,2025-06-03 16:44:01,2025-06-04 14:09:17
576967,[Ikinuki.] Taisetsu na Tsuma ga Iru noni...... 10-Kai Shasei Shinai to Derenai Heya de Kinkyuu Boukensha no Elite Osananajimi ni Okasarete Shimatta Hanashi | 明明已經有重要的妻子了…卻被困在不射精10次就出不去的房間。被黃金級冒險者的精英青梅竹馬給榨精的故事 [Chinese],[イキヌキ。] 大切な妻がいるのに......10回射精しないと出れない部屋で金級冒険者のエリート幼馴染に犯されてしまった話 [中国翻訳],Taisetsu na Tsuma ga Iru noni...... 10-Kai Shasei Shinai to Derenai Heya de Kinkyuu Boukensha no Elite Osananajimi ni Okasarete Shimatta Hanashi | 明明已經有重要的妻子了…卻被困在不射精10次就出不去的房間。被黃金級冒險者的精英青梅竹馬給榨精的故事,"translated, chinese",ikinuki.,,doujinshi,original,,"big breasts, netorare, extraneous ads",51,2025-06-03 16:48:28,2025-06-03 16:48:28,2025-06-04 14:09:18
576968,[Bukatsu] Dekapai Iinchou no Kuse ni Namaiki da! (ANGEL Club 2025-06) [Chinese] [Digital],[ぶかつ] デカパイ委員長のくせに生イキだ! (ANGEL 倶楽部 2025年6月号) [中国翻訳] [DL版],Dekapai Iinchou no Kuse ni Namaiki da!,"translated, chinese",bukatsu,,manga,,,"big breasts, full censorship, glasses, extraneous ads",24,2025-06-03 16:50:45,2025-06-03 16:50:45,2025-06-04 14:09:20
576969,[Takashi] Ken Hime wa Midara ni Otosareru (ANGEL Club 2025-06) [Chinese] [Digital],[たかし] 剣姫は淫らに堕とされる (ANGEL 倶楽部 2025年6月号) [中国翻訳] [DL版],Ken Hime wa Midara ni Otosareru,"translated, chinese",takashi,,manga,,,"big breasts, full censorship, sole female, ponytail, extraneous ads",28,2025-06-03 16:53:22,2025-06-03 16:53:22,2025-06-04 14:09:21
576970,[Ameyama Denshin] Ura ni Wake Renai Shinkouchuu Ch. 2 (ANGEL Club 2025-06) [Chinese] [Digital],[雨山電信] 裏庭家恋愛進行中 第2話 (ANGEL 倶楽部 2025年6月号) [中国翻訳] [DL版],Ura ni Wake Renai Shinkouchuu Ch. 2,"translated, chinese",ameyama denshin,,manga,,,"full censorship, glasses, anal, extraneous ads",25,2025-06-03 16:55:50,2025-06-03 16:55:50,2025-06-04 14:09:22
576971,[Matsuzawa Muni] Nyuugyuu no Bunzai (ANGEL Club 2025-06) [Chinese] [Digital],[松沢夢丹] 乳牛の分罪 (ANGEL 倶楽部 2025年6月号) [中国翻訳] [DL版],Nyuugyuu no Bunzai,"translated, chinese",matsuzawa muni,,manga,,,"big breasts, full censorship, lactation, stockings, extraneous ads",26,2025-06-03 16:58:19,2025-06-03 16:58:19,2025-06-04 14:09:23
576972,[Makuragi Zabuton]  Kyonyuu Gal no Love Love Ongaeshi | 巨乳辣妹的恩恩愛愛報恩 [Chinese],[枕木ざぶとん] 巨乳ギャルのラブラブ恩返し [中国翻訳],Kyonyuu Gal no Love Love Ongaeshi | 巨乳辣妹的恩恩愛愛報恩,"translated, chinese",,makuragi zabuton,doujinshi,original,,"big breasts, gyaru, sole female, sole male, extraneous ads",30,2025-06-03 17:01:08,2025-06-03 17:01:08,2025-06-04 14:09:24
576973,[Dennou Deryu- Zyon] Sakyubasu Sisuta- ni Ki ni Irare ta no de Hara mase NoukouH suru Koto ni [Digital],[電脳デリュージョン] サキュバスシスターに気に入られたので孕ませ濃厚Hすることに [DL版],Sakyubasu Sisuta- ni Ki ni Irare ta no de Hara mase NoukouH suru Koto ni,japanese,,,manga,,,"sweating, big breasts, nun, nakadashi, demon girl, stockings, blowjob, sole female, sole male, crotch tattoo, horns, anal intercourse, doujinshi",58,2025-06-03 17:06:13,2025-06-03 17:06:13,2025-06-04 14:09:25
576974,[SST] My married sister came back home,結婚したお姉ちゃんが家に戻ってきた,My married sister came back home,"english, translated",,sst,doujinshi,original,,"milf, big breasts, full color, incest, mosaic censorship, sister, sole female, sole male, rough translation",24,2025-06-03 17:08:14,2025-06-03 17:08:14,2025-06-04 14:09:26
576975,[Remu] Yuuyake Doori no Mukougawa Kouhen (ANGEL Club 2025-06) [Chinese] [Digital],[れむ] 夕焼け通りの向こう側 後編 (ANGEL 倶楽部 2025年6月号) [中国翻訳] [DL版],Yuuyake Doori no Mukougawa Kouhen,"translated, chinese",remu,,manga,,,"big breasts, full censorship, extraneous ads",26,2025-06-03 17:10:37,2025-06-03 17:10:37,2025-06-04 14:09:27
576976,(C105) [ZENTANGLE (Hirasawa Zen)] Master Senzoku Dosukebe Oppai Seishori Servant (Fate/Grand Order) [Chinese],(C105) [ZENTANGLE (平沢Zen)] マスター専属どすけべおっぱい性処理サーヴァント (Fate/Grand Order) [中国翻訳],Master Senzoku Dosukebe Oppai Seishori Servant,"translated, chinese",hirasawa zen,zentangle,doujinshi,fate grand order,"artoria pendragon alter, gudao | ritsuka fujimaru","big breasts, huge breasts, stockings, sole female, sole male, gloves, extraneous ads",35,2025-06-03 17:14:41,2025-06-03 17:14:41,2025-06-04 14:09:28
576977,"[ZUZUZU (Kamiya Zuzu) ]Pien na Ore, Shachiku na Watashi. ~Kinou made Black datta noni, Okitara Sekai ga Pink ni Somattete Kusa Nan da ga~ | 萌萌的俺、社畜的我。〜明明直到昨天还在牛马工厂当打工人、醒来之后发现整个世界都染成了粉色、也太生草了w〜 [Chinese] [瑞树汉化组]",[ズズズ (神谷ズズ)] ぴえんな俺、社畜な私。〜昨日までブラックだったのに、起きたら世界がピンクに染まってて草なんだが〜 [中国翻訳],"Pien na Ore, Shachiku na Watashi.| 萌萌的俺、社畜的我。〜明明直到昨天还在牛马工厂当打工人、醒来之后发现整个世界都染成了粉色、也太生草了w〜","translated, chinese",kamiya zuzu,zuzuzu,doujinshi,original,,"business suit, leg lock, masturbation, body swap, sex toys, blowjob face, stockings, gyaru, blowjob, collar, sole female, sole male, twintails, gender change, nipple stimulation",48,2025-06-03 17:19:02,2025-06-03 17:19:02,2025-06-04 14:09:29
576978,[ムロイ] 花嫁の人妻,,花嫁の人妻,japanese,muroi,,doujinshi,gotoubun no hanayome | the quintessential quintuplets,ichika nakano,big breasts,521,2025-06-03 18:02:21,2025-06-03 18:02:21,2025-06-04 14:09:30
576979,[Usagijima (Chiso)] Oyasumi no Ato ni (Hunter x Hunter) [Digital],[うさぎじま (ちそ)] おやすみのあとに (ハンター×ハンター) [DL版],Oyasumi no Ato ni,japanese,chiso,usagijima,doujinshi,hunter x hunter,"illumi zoldyck, killua zoldyck","anal, brother, males only, incest, yaoi, shotacon, anal intercourse",30,2025-06-03 18:09:44,2025-06-03 18:09:44,2025-06-04 14:09:31
576980,[Yamanashi Yuuya] Sacred Holy Heart Odette Lilia ~The Girl Who Fell into Lust~ [English],[山梨ユウヤ] 聖心煌姫オデットリリア ～淫子宮に堕ちた少女～,Sacred Holy Heart Odette Lilia,"english, translated",yamanashi yuuya,,manga,,,"sweating, corruption, magical girl, nakadashi, femdom, x-ray, masked face, fingering, rape, stomach deformation, sole female, crotch tattoo, ponytail, exposed clothing, nipple stimulation, high heels",20,2025-06-03 18:11:52,2025-06-03 18:11:52,2025-06-04 14:09:32
576981,[まくねいる工房 (黒須嗣載)] あンなァ、きょうちゃんとなァ 暫定版03,,あンなァ、きょうちゃんとなァ 暫定版03,japanese,cloth tsugutoshi,mcnail koubou,doujinshi,boku no kokoro no yabai yatsu,"anna yamada, kyoutarou ichikawa","sole female, sole male, eye-covering bang",12,2025-06-03 18:13:14,2025-06-03 18:13:14,2025-06-04 14:09:33
576982,[Fun Fan] Healer Sen Ijime 6,[Funふぁん] ヒーラー専いじめ 6,Healer Sen Ijime 6,japanese,fun fan,,doujinshi,original,,"big breasts, ahegao, nipple fuck, full color, lactation, big clit, tentacles, clit stimulation, nipple stimulation",6,2025-06-03 18:14:02,2025-06-03 18:14:02,2025-06-04 14:09:34
576983,[leiji]肉块5.5,[泪吉]肉块5.5,肉块5.5,chinese,leiji,,doujinshi,,,,18,2025-06-03 18:15:39,2025-06-03 18:15:39,2025-06-04 14:09:35
576984,"(C74) [Gekidoku Shoujo (ke-ta, Hyuuga, Touma Nadare)] Touhou Shoujo (Touhou Project)",(C74) [劇毒少女(ke-ta、日向、東馬なだれ)] 東方少女 (東方Project),Touhou Shoujo,japanese,ke-ta,gekidoku shoujo,doujinshi,touhou project,,,31,2025-06-03 18:18:29,2025-06-03 18:18:29,2025-06-04 14:09:36
576985,[洛天二] 关于妮可被法厄同淦的乱七八糟这件事,,关于妮可被法厄同淦的乱七八糟这件事,chinese,,,doujinshi,zenless zone zero,nicole demara,sole female,15,2025-06-03 18:19:53,2025-06-03 18:19:53,2025-06-04 14:09:37
576986,Milf and Gilf ntr,,Milf and Gilf ntr,japanese,zxcv,,doujinshi,,,"milf, big breasts, huge breasts, artistcg",8,2025-06-03 18:20:45,2025-06-03 18:20:45,2025-06-04 14:09:38
576987,[奥田枠]K的支配者[Chinese] [看海汉化组] [Digital],[奥田枠]Kの支配者[中国翻訳] [DL版],K的支配者,"translated, chinese",,,manga,,,,85,2025-06-03 18:27:27,2025-06-03 18:27:27,2025-06-04 14:09:40
576988,[おつまみひとくち (祭屋すぐる)] ラブリーメルティーハニーバニー,,ラブリーメルティーハニーバニー,japanese,,,doujinshi,original,,"bunny boy, anal, males only, yaoi, collar, anal intercourse",31,2025-06-03 21:03:00,2025-06-03 21:03:00,2025-06-04 14:09:41
576989,[山森ぽてと]莲木君和三毛君[Chinese] [看海汉化组] [Digital],[山森ぽてと]蓮木くんと三毛くん[中国翻訳] [DL版],莲木君和三毛君,"translated, chinese",,,manga,,,"tankoubon, yaoi, kemonomimi",213,2025-06-03 21:20:48,2025-06-03 21:20:48,2025-06-04 14:09:42
576990,[定時]加油武藏君！[Chinese] [看海汉化组] [Digital],[定時]がんばれむさしくん![中国翻訳] [DL版],加油武藏君！,"translated, chinese",,,manga,,,yaoi,20,2025-06-03 21:23:53,2025-06-03 21:23:53,2025-06-04 14:09:43
576991,"[Botandou (Kio Shimoku)] Zenbu, Sensei no Sei. 2 Zenpen Futanari Jokyoushi ga Yokkyuu Fuman na Hogosha o Sukkiri Saseru Hanashi.",[ぼたん堂 (木尾士目)] ぜんぶ、せんせいのせい。2 前編 ふ〇なり女教師が欲求不満な保護者をスッキリさせる話。,"Zenbu, Sensei no Sei. 2 Zenpen Futanari Jokyoushi ga Yokkyuu Fuman na Hogosha o Sukkiri Saseru Hanashi.","english, translated",kio shimoku,botandou,doujinshi,original,,"futanari, milf, big breasts, group, glasses, milking, nakadashi, ahegao, freckles, lab coat, mother, x-ray, fft threesome, multi-work series, incest, lactation, pantyhose, fingering, teacher, daughter, blowjob, big penis, sole dickgirl, oyakodon, beauty mark, ponytail, twintails, nipple stimulation, dickgirl on female",83,2025-06-03 21:30:57,2025-06-03 21:30:57,2025-06-04 14:09:43
576992,My first sleepover at my friend's house,,My first sleepover at my friend's house,english,zxcv,,manga,,,"milf, big breasts, dark nipples, huge breasts, artistcg, hairy, paizuri, hairy armpits, exposed clothing, transparent clothing",10,2025-06-03 21:32:03,2025-06-03 21:32:03,2025-06-04 14:09:44
576993,NTR (Pixiv Fanbox),,NTR,english,zxcv,,doujinshi,original,,"big breasts, netorare, artistcg, bald",18,2025-06-03 21:33:28,2025-06-03 21:33:28,2025-06-04 14:09:45
576994,[タカスケ] レディ・アヴァロン（プロトマーリン）,,レディ・アヴァロン（プロトマーリン）,japanese,takasuke,,doujinshi,fate grand order,,"netorare, dark skin, first person perspective, sole female, sole male",6,2025-06-03 21:34:14,2025-06-03 21:34:14,2025-06-04 14:09:47
576995,[タカスケ] stripping the waistline of all b,,stripping the waistline of all b,japanese,takasuke,,doujinshi,blue archive,kisaki ryuuge,"pregnant, dark skin, x-ray, sole female, sole male, hair buns",2,2025-06-03 21:34:38,2025-06-03 21:34:38,2025-06-04 14:09:47
576996,[タカスケ] 風野灯織がヤバい隣人に目をつけられて洗脳され人生を使い潰される話,,風野灯織がヤバい隣人に目をつけられて洗脳され人生を使い潰される話,japanese,takasuke,,doujinshi,the idolmaster,hiori kazano,"humiliation, piercing, nakadashi, sex toys, x-ray, stockings, mind break, collar, sole female, nipple piercing",11,2025-06-03 21:35:46,2025-06-03 21:35:46,2025-06-04 14:09:48
576997,[タカスケ] 最強超能力者ちゃんが弱点のお豆をぐちゃぐちゃに弄ばれて泣き喚いちゃう話,,最強超能力者ちゃんが弱点のお豆をぐちゃぐちゃに弄ばれて泣き喚いちゃう話,japanese,takasuke,,doujinshi,original,,"machine, sex toys, bondage, blindfold, collar, sole female",6,2025-06-03 21:36:30,2025-06-03 21:36:30,2025-06-04 14:09:49
576998,[Imai Yuu] Zombie Sekai de Harem wo Tsukurou! 16.2,[今井ユウ] ゾンビ世界でハーレムをつくろう! 16.2,Zombie Sekai de Harem wo Tsukurou! 16.2,japanese,imai yuu,,manga,,,"big breasts, glasses, multi-work series, gyaru",18,2025-06-03 21:38:12,2025-06-03 21:38:12,2025-06-04 14:09:50
576999,[pink-noise (Mizuiro Megane)] Mama Time Seisui Hen [Uncensored],[pink-noise (みずいろめがね)] ママタイム聖水編 [Uncensored],Mama Time Seisui Hen,japanese,mizuiro megane,pink-noise,doujinshi,original,,"milf, glasses, uncensored, mother, incest, piss drinking, shotacon, sole female, sole male, internal urination",39,2025-06-03 22:08:43,2025-06-03 22:08:43,2025-06-04 14:09:51
577000,"[Amulai Okashi Seisakusho (Sasanomanibi)] Imouto to Irekawatta Onii-chan wa, Sono Mama Oishiku Itadakarete shimaimashita. [Chinese] [Cauli个人汉化]",[あむぁいおかし製作所 (笹ノ間にび)] 妹と入れ替わったお兄ちゃんは、そのまま美味しくいただかれてしまいました。 [中国翻訳],"Imouto to Irekawatta Onii-chan wa, Sono Mama Oishiku Itadakarete shimaimashita.","translated, chinese",sasanoma nibi,amuai okashi seisakusho | amulai sweet factory,doujinshi,original,,"big breasts, swimsuit, body swap, nakadashi, x-ray, paizuri, fingering, mosaic censorship, blowjob, muscle, sole female, sole male, twintails, hidden sex, gender change, nipple stimulation",43,2025-06-03 22:12:22,2025-06-03 22:12:22,2025-06-04 14:09:52
577001,[Hitonarazaru] Houmon Futokorogo -Houmon Kaigo-,[ヒトナラザル] 訪問懐子-ホウモンカイゴ-,Houmon Futokorogo,japanese,,,doujinshi,original,,"big breasts, old man, netorare, cheating, prostitution, nakadashi, mosaic censorship, impregnation, big penis, beauty mark, pixie cut",36,2025-06-03 22:15:24,2025-06-03 22:15:24,2025-06-04 14:09:53
577002,[Gekkou] Bettari Hibiki-chan no Game Nikki | The Clingy Hibiki-chan's Gamer Diary (Digital Puni Pedo! Vol. 36) [English] {Mistvern},[月光] べったりひびきちゃんのゲーム日記 (デジタルぷにぺどッ! Vol.36) [英訳],Bettari Hibikichan's Gamer Diary,"english, translated",gekkou,,manga,,,"glasses, nakadashi, dark skin, lolicon, hotpants, tomboy, bbm, sole female, sole male, ponytail, hidden sex",16,2025-06-03 22:18:57,2025-06-03 22:18:57,2025-06-04 14:09:54
577003,[Onigiri to Okazu] Nee Oba-chan SEX tte nani ~?,[おにぎりとおかず] ねえおばちゃんSEXってなに～?,Nee Oba-chan SEX tte nani ~?,japanese,,,doujinshi,original,,"milf, big breasts, cheating, nakadashi, x-ray, big penis, shotacon, sole female, sole male, shaved head, closed eyes, smalldom",27,2025-06-03 22:24:46,2025-06-03 22:24:46,2025-06-04 14:09:55
577004,[Ariyuuji] Hajimete Gajo Tomodachi no Mama (Shufu 37-sai)! ?,[ありゆーじ] 初めてが女トモダチのママ(主婦37歳)！?,Hajimete Gajo Tomodachi no Mama! ?,japanese,ariyuzi,ariyuuji,doujinshi,original,,"milf, virginity, big breasts, cheating, shotacon, sole female, sole male",32,2025-06-03 22:31:45,2025-06-03 22:31:45,2025-06-04 14:09:56
577005,[SS Daxian Society] Musuko no Tomodachi to Ofuro de NTR haha,[SS大仙社團] 息子の友達とお風呂でNTR母,Musuko no Tomodachi to Ofuro de NTR haha,japanese,,,doujinshi,original,,"milf, big breasts, cheating, nakadashi, dark skin, full color, mosaic censorship, shotacon, sole female, sole male, beauty mark",12,2025-06-03 22:34:20,2025-06-03 22:34:20,2025-06-04 14:09:57
577006,p站白味三号大佬,,p站白味三号大佬,"japanese, chinese",,,doujinshi,uma musume pretty derby,,"big breasts, dark skin, misc, imageset, horse girl, kemonomimi",302,2025-06-03 22:59:02,2025-06-03 22:59:02,2025-06-04 14:09:58
577007,[Locus (希咲のあ)] のんたんは我慢できない,,のんたんは我慢できない,japanese,kisaki noah,locus,doujinshi,original,,"males only, yaoi, tomgirl",30,2025-06-03 23:02:00,2025-06-03 23:02:00,2025-06-04 14:09:59
577008,[えろはむ]乳首開発サロンへようこそ,,乳首開発サロンへようこそ,japanese,nanahamu,,doujinshi,,,"ahegao, yuri, no penetration, nipple stimulation",65,2025-06-03 23:07:44,2025-06-03 23:07:44,2025-06-04 14:10:01
577009,[FDSP (Sakagaki)] Tonari no Oneesan ga Ero sugite Shikottetara Kossori Nuite Kureta Hanashi | The Sexy Girl in the Next Seat Gave Me a Handjob [English],[FDSP (サカガキ)] 隣のお姉さんがエロ過ぎてシコってたらこっそり抜いてくれた話 [英訳],Tonari no Oneesan ga Ero sugite Shikottetara Kossori Nuite Kureta Hanashi | The Sexy Girl in the Next Seat Gave Me a Handjob,"english, translated",sakagaki | yuujin,fdsp,doujinshi,original,,"big breasts, pantyhose, blowjob, sole female, sole male",44,2025-06-03 23:12:12,2025-06-03 23:12:12,2025-06-04 14:10:02
577010,(C105) [戌の犬小屋 (ヤミノケル)]ユ●カと性処理えっちする本！！(ブルーアーカイブ),,ユ●カと性処理えっちする本！！,japanese,yami keru-chan | inunari,inu no inugoya,doujinshi,blue archive,"yuuka hayase, sensei","big breasts, big ass, blowjob, muscle, halo",30,2025-06-03 23:14:58,2025-06-03 23:14:58,2025-06-04 14:10:04
577011,El día en que vencí a mi novia super-alta,Koushinchou de MeguTai na Kanojo ga Makechau Hi,El día en que vencí a mi novia super-alta,"japanese, translated",,,doujinshi,,,"big breasts, big ass, nakadashi, full color, tall girl",14,2025-06-03 23:16:28,2025-06-03 23:16:28,2025-06-04 14:10:05
577012,[Yukia] Imoto no seijo ga ani e no koigokoro kara yami ochi suru hanashi,[ゆきあ]妹聖女が兄への恋心から闇落ちする話,Imoto no seijo ga ani e no koigokoro kara yami ochi suru hanashi,japanese,yukia,reset,doujinshi,original,,"transformation, corruption, netorare, incest, possession, sister",41,2025-06-03 23:20:25,2025-06-03 23:20:25,2025-06-04 14:10:06
577013,[Ronrinri Ronri] Minori-chan to Chouzetsu Tech Oji-san,[論倫理ろんり] みのりちゃんと超絶テクおじさん,Minorisan,japanese,ronrinri ronri,,doujinshi,original,,"kissing, cunnilingus, masturbation, nakadashi, dark skin, lolicon, fingering, filming, rape, dilf, randoseru, bbm, chikan, sole female, sole male, bald, nipple stimulation",31,2025-06-03 23:26:38,2025-06-03 23:26:38,2025-06-04 14:10:07
577014,"[KOYUKI-ya (Koyuki, Yaki Tomato)] Uchi no Yandere na Kaineko-chan ni Mechakucha ni Shiborarechau Hanashi + Yandere Kai Neko Series | My Obsessive Kitty Squeezes Me Dry [English]",[KOYUKI屋 (koyuki、焼きトマト)] うちのヤンデレな飼い猫ちゃんにメチャクチャに搾られちゃう話 + ヤンデレ飼い猫シリーズ [英訳],Uchi no Yandere na Kaineko-chan ni Mechakucha ni Shiborarechau Hanashi + Yandere Kai Neko Series | My Obsessive Kitty Squeezes Me Dry,"english, translated","kotatsu, yakitomato",koyuki-ya,doujinshi,original,,"slime, leg lock, big breasts, swimsuit, unusual pupils, nakadashi, ahegao, femdom, x-ray, stockings, paizuri, blowjob, yandere, kunoichi, catgirl, sole female, sole male, beauty mark, kemonomimi, tail, very long hair, multiple orgasms, painted nails",82,2025-06-03 23:33:42,2025-06-03 23:33:42,2025-06-04 14:10:08
577015,[Xration (mil)] Haha no Hi Sono 2 (Tsujou Kougeki ga Zentai Kougeki de 2-kai Kougeki no Okaasan wa Suki desu ka?) [English] [FC],[Xration (mil)] 母の日 その2 (通常攻撃が全体攻撃で二回攻撃のお母さんは好きですか？),Haha no Hi Sono 2,"english, translated",mil,xration,doujinshi,okaasan online,mamako oosuki,"milf, big breasts, orc, pregnant, mind control, full color, multi-work series, huge penis, lactation, stockings, cowgirl, mosaic censorship, collar, shotacon, sole female, sole male, kemonomimi",5,2025-06-03 23:35:07,2025-06-03 23:35:07,2025-06-04 14:10:09
577016,[Michitomo Ito] Takuran Joshi wa Takaraka ni Warau 1-2 | The Cuckoo Girl Laughs Loudly 1-2 [English] [Fated Circle],[伊東倫智] 托卵女子は高らかに嗤う 1-2,Takuran Joshi wa Takaraka ni Warau 12,"english, translated",,,manga,,,"cheating, multi-work series, impregnation",64,2025-06-03 23:40:37,2025-06-03 23:40:37,2025-06-04 14:10:10
577017,[FGO] Majinbashira Edelfelt,[FGO]魔人柱エーデルフェルト,Majinbashira Edelfelt,japanese,,,doujinshi,"fate kaleid liner prisma illya, fate grand order","miyu edelfelt, illyasviel von einzbern","futanari, kissing, transformation, corruption, masturbation, thigh high boots, yuri, possession, gloves, high heels, dickgirl on female, futanarization",15,2025-06-03 23:42:03,2025-06-03 23:42:03,2025-06-04 14:10:12
577018,[FDSP (Sakagaki)] Mitchaku! Onee-san ni Fukakouryoku kara ka Shibushibu Nuite Moratta Hanashi | Glued Together! The Story of How a Lady Reluctantly Got Me off Due To Unavoidable Circumstances [English],[FDSP (サカガキ)] 密着!お姉さんに不可抗力からか渋々抜いてもらった話  [英訳],Mitchaku! Onee-san ni Fukakouryoku kara ka Shibushibu Nuite Moratta Hanashi | Glued Together! The Story of How a Lady Reluctantly Got Me off Due To Unavoidable Circumstances,"english, translated",sakagaki | yuujin,fdsp,doujinshi,original,,"handjob, big breasts, nakadashi, chikan, sole female, sole male, hidden sex",29,2025-06-03 23:44:43,2025-06-03 23:44:43,2025-06-04 14:10:12
577019,[LIME&MINT (Punching Namatamago)] Shigoto de Tsukarekitta Kareshi o Iyashite Ageru Marine | Marine soothes her exhausted working boyfriend (Houshou Marine) [Literally Starving] [English],[LIME&MINT (パンチング生卵)] 仕事で疲れ切った彼氏を癒やしてあげるマリン (宝鐘マリン) [英訳],Shigoto de Tsukarekitta Kareshi o Iyashite Ageru Marine | Marine soothes her exhausted working boyfriend,"english, translated",punching namatamago,,doujinshi,hololive,houshou marine,"big breasts, nakadashi, apron, paizuri, sole female, sole male, heterochromia, vtuber",48,2025-06-03 23:48:52,2025-06-03 23:48:52,2025-06-04 14:10:13
577020,[MOJIMUJI] となりのあの子で妄想,,となりのあの子で妄想,japanese,mojimuji,,doujinshi,,,"big breasts, cowgirl, collar, sole female, kemonomimi, gloves",7,2025-06-03 23:50:23,2025-06-03 23:50:23,2025-06-04 14:10:15
577021,[MOJIMUJI] となりのあの子とお金持ちそうなおっさん1,,となりのあの子とお金持ちそうなおっさん1,japanese,mojimuji,,doujinshi,,,"swimsuit, piercing, bikini, collar, sole female, crotch tattoo, nipple piercing",7,2025-06-03 23:51:09,2025-06-03 23:51:09,2025-06-04 14:10:16
577022,[abgrund (さいかわゆさ)] セラピストイチローの女子学園ハーレム化計画I+II [中国翻訳],[abgrund (さいかわゆさ)] セラピストイチローの女子学園ハーレム化計画I+II [中国翻訳],セラピストイチローの女子学園ハーレム化計画I+II,"translated, chinese",saikawa yusa | udk,abgrund,doujinshi,,,"big breasts, group, ffm threesome, bald",118,2025-06-04 00:01:49,2025-06-04 00:01:49,2025-06-05 14:00:44
577023,[abgrund (さいかわゆさ)] SANA 1(播種)   2(発芽),[abgrund (さいかわゆさ)] SANA 1(播種)   2(発芽),SANA 12,"japanese, translated, chinese",saikawa yusa | udk,abgrund,doujinshi,original,,"kissing, cunnilingus, schoolgirl uniform, condom, ahegao, sleeping, gyaru-oh, multi-work series, bunny girl, blowjob",103,2025-06-04 00:10:30,2025-06-04 00:10:30,2025-06-05 14:00:45
