ID,EN_TITLE,JP_TITLE,CLEAN_TITLE,LANGUAGE,ARTIST,GROUP_NAME,CATEGORY,PARODY,CHARACTER,TAGS,PAGES,UPLOAD_DATE,FORMATTED_DATE,SCRAPED_DATE
565528,COMIC Kuriberon DUMA 2025-04 Vol.71,COMIC クリベロン DUMA 2025年4月号 Vol.71,COMIC Kuriberon DUMA 2025-04 Vol.71,japanese,"sunagawa tara, mokuzou, takashi, announ, hasebe souutsu, watari kaoru, pororivista",,manga,,,"milf, big breasts, anthology, nakadashi, huge breasts, crossdressing, big areolae, yaoi, rape, tomgirl",210,2025-04-01 00:00:33,2025-04-01 00:00:33,2025-04-02 05:09:48
565529,Towako 18 [Digital],永遠娘 18 [DL版],Towako 18,japanese,"mutou mato, binsen, youta, yumano yuuki, gengorou, yam, amagaeru, ayane, jagayamatarawo, garoudo, suzan, heiqing langjun | kokusei roukun, dokukinokozin | mimit",,manga,,,"big breasts, cunnilingus, anthology, nakadashi, lolicon, yuri, bunny girl, drunk, lingerie, mosaic censorship, tomboy, fox girl, catgirl, kemonomimi, horns, thick eyebrows, tail, eye-covering bang",377,2025-04-01 00:32:20,2025-04-01 00:32:20,2025-04-02 05:09:50
565530,[Uchiyama Aki] Ecchi Gumi Chihiro 1 [Digital],[内山亜紀] えっち組ちひろ,Ecchi Gumi Chihiro 1,japanese,uchiyama aki,,manga,,,incomplete,38,2025-04-01 00:36:48,2025-04-01 00:36:48,2025-04-02 05:09:50
565531,[Uchiyama Aki] Bishoujo mania kurabu 1-2 [Digital],[内山亜紀] 美少女マニアクラブ,Bishoujo mania kurabu 1-2,japanese,uchiyama aki,,manga,,,"lolicon, incomplete",39,2025-04-01 00:40:26,2025-04-01 00:40:26,2025-04-02 05:09:51
565532,[Uchiyama Aki] H bishoujo kanpanii 1-4 [Digital],[内山亜紀] H美少女カンパニー,H bishoujo kanpanii 1-4,japanese,uchiyama aki,,manga,,,incomplete,37,2025-04-01 00:43:46,2025-04-01 00:43:46,2025-04-02 05:09:52
565533,Masyo Ecole Vol.6,Masyo Ecole Vol.6,Masyo Ecole Vol.6,japanese,"sawada daisuke, john k. pe-ta, tenchuumaru, emina, tenjiku rounin, enpuro, tomura suisen, hoshisaka ami",,manga,,,"milf, big breasts, cheating, snuff, anthology, diaper, rape",200,2025-04-01 01:00:59,2025-04-01 01:00:59,2025-04-02 05:09:53
565534,[Uchiyama Aki] Pinkii dooru 1-2 [Digital],[内山亜紀] ピンキー・ドール,Pinkii dooru 1-2,japanese,uchiyama aki,,manga,,,"bondage, lolicon, leotard, incomplete",31,2025-04-01 01:04:00,2025-04-01 01:04:00,2025-04-02 05:09:53
565535,COMIC Shingeki 2025-05 [Digital],COMIC 真激 2025年5月号 [DL版],COMIC Shingeki 2025-05,japanese,"agata, koyama shigeru, nagaikusa, kumataro, futaba yae, ryokurin, hasunoue baitsu, asai makoto, nakano hitomi, sanatuki, sakuretsu tororokonbu, ozu satoru, takeaki gaku, samazuka mashio, emumiya nyamu, onigawara keruri, hanimemeo, muchimuchi chiaki, yakuya, ropan",,manga,,,"maid, futanari, milf, big breasts, swimsuit, pegging, big nipples, group, full censorship, glasses, schoolgirl uniform, pasties, anthology, nakadashi, ahegao, huge breasts, anal, sex toys, hairy, thigh high boots, dark skin, lolicon, x-ray, double penetration, tanlines, bunny girl, big areolae, stockings, pantyhose, rimjob, paizuri, dilf, tomgirl, inverted nipples, blowjob, big penis, collar, shotacon, ponytail, twintails, pixie cut, anal intercourse, exposed clothing, detached sleeves, dickgirl on female",620,2025-04-01 03:36:40,2025-04-01 03:36:40,2025-04-02 05:09:55
565536,[Gengorou] オトメオアシス【FANZA限定特典付き】[Digital],[源五郎] オトメオアシス【FANZA限定特典付き】[DL版],オトメオアシス【FANZA限定特典付き】,japanese,gengorou,,manga,,,"sweating, leg lock, pregnant, group, glasses, story arc, masturbation, schoolgirl uniform, breast feeding, condom, nakadashi, ffm threesome, femdom, harem, dark skin, lolicon, x-ray, tankoubon, lactation, drunk, paizuri, gokkun, fingering, bukkake, voyeurism, blowjob, collar, twintails, multimouth blowjob, school gym uniform, smalldom, nipple stimulation",248,2025-04-01 04:31:46,2025-04-01 04:31:46,2025-04-02 05:09:55
565537,(Douyara Deban no Youda! 35) [pobee (Gurasuke)] Yoidore Kega Naku Haji mo Naku (Boku no Hero Academia),,Yoidore Kega Naku Haji mo Naku,japanese,,,doujinshi,my hero academia | boku no hero academia,"katsuki bakugou, kyoka jiro",,36,2025-04-01 04:35:43,2025-04-01 04:35:43,2025-04-02 05:09:56
565538,[ご] Fill this hole with you♡ (Jujutsu Kaisen) [Digital],[ご] この穴いっぱいアナタで埋めて♡(Jujutsu Kaisen) [Digital],Fill this hole with you♡,japanese,,,doujinshi,jujutsu kaisen,"satoru gojo, kento nanami","males only, yaoi",36,2025-04-01 04:38:55,2025-04-01 04:38:55,2025-04-02 05:09:57
565539,[AskRay (Bosshi)] Learn Through Pictures! | Rie and Eri’s Tentacle Guide [Colorized],,Learn Through Pictures! | Rie and Eri’s Tentacle Guide,"english, translated",bosshi,askray,doujinshi,original,,"twins, elf, triple penetration, lolicon, full color, double penetration, tentacles, stomach deformation, fisting, twintails, cumflation",13,2025-04-01 04:40:20,2025-04-01 04:40:20,2025-04-02 05:09:58
565540,[Roki] Kaisha no Kouhai ni Keigo de Semerare Taberarechau Hanashi | 被公司的後輩用敬語調教並推倒的故事 [Chinese] [Asuzak_Tei 个人漢化],[ロキ] 会社の後輩に敬語で責められ食べられちゃう話 [中国翻訳],Kaisha no Kouhai ni Keigo de Semerare Taberarechau Hanashi | 被公司的後輩用敬語調教並推倒的故事,"translated, chinese",roki,,doujinshi,original,,"femdom, foot licking, sole female, sole male, beauty mark",55,2025-04-01 04:44:46,2025-04-01 04:44:46,2025-04-02 05:09:59
565541,[Anthology] LEAGUE OF LEGENDS ANTHOLOGY (League of Legends) [Chinese],[合同誌] 激鬥召喚峽谷 英雄聯盟成人向合同 (League of Legends) [中国語],LEAGUE OF LEGENDS ANTHOLOGY,chinese,"ayumu, naidong, proudbanana",pencilbox,doujinshi,league of legends,"irelia, jinx, ezreal, ashe, caitlyn, riven, ahri, vex, fiddlesticks","big breasts, uncensored",70,2025-04-01 04:51:00,2025-04-01 04:51:00,2025-04-02 05:10:00
565542,[MAFIC (Choukutetsushitsugan)] Saruyome Kyousei Iruikonintan [Digital] [English],[MAFIC (超苦鉄質岩)] サルヨメ 強制異類婚姻譚 [DL版],Saruyome Kyousei Iruikonintan,"english, translated",choukutetsushitsugan,mafic,doujinshi,original,,"pregnant, netorare, impregnation, sole female, rough translation",60,2025-04-01 04:56:02,2025-04-01 04:56:02,2025-04-02 05:10:01
565543,[Teterun] Super Cock Showdown Maratian Kingdom Edition [English] [Part 1-17],,Super Cock Showdown Maratian Kingdom Edition,"english, translated",teterun,,doujinshi,original,,"futanari, big breasts, urethra insertion, unusual pupils, big ass, balls expansion, ahegao, huge breasts, dark skin, big balls, huge penis, tall girl, big penis, dickgirl on dickgirl, twintails, high heels, penis enlargement",153,2025-04-01 05:08:40,2025-04-01 05:08:40,2025-04-02 05:10:02
565544,Husbands Who Let Their Wives Sleep Around 3,妻を抱かせる夫達3,Husbands Who Let Their Wives Sleep Around 3,"english, translated",,artienne,doujinshi,original,,"kissing, big breasts, group, netorare, anal, ffm threesome, hairy, rimjob, swinging, ball sucking, dilf, bbm, rough translation, netorase",91,2025-04-01 05:15:49,2025-04-01 05:15:49,2025-04-02 05:10:02
565545,(C103) [Ringoya (Various)] Sukebe Doujin-roku Sakazaki Mikoko Goudou (Kaiji),(C103) [リンゴヤ (よろず)] 助平同人録 ミココ 坂崎美心合同 (賭博黙示録カイジ),Sukebe Doujin-roku Sakazaki Mikoko Goudou,japanese,"kosuke haruhito, soine, alp, kizuka kazuki",ringoya,doujinshi,kaiji,"kaiji itou, mikoko sakazaki","unusual teeth, big breasts, big lips",20,2025-04-01 05:18:46,2025-04-01 05:18:46,2025-04-02 05:10:03
565546,[Yuuki Alice] Aigan Kyoushi [Chinese],[夕姫ありす] 愛玩教師 [中国翻訳],Aigan Kyoushi,"translated, chinese",yuuki alice,,manga,,,"big breasts, tankoubon",188,2025-04-01 05:32:23,2025-04-01 05:32:23,2025-04-02 05:10:04
565547,[尾崎 (潮崎) ]爆乳魔法少女が平和の為に出産アクメ決めまくるお話[Chinese] ｜爆乳魔法少女為了和平瘋狂分娩高潮的故事【錫沃拉巨大兔猻漢化】,[尾崎 (潮崎) ]爆乳魔法少女が平和の為に出産アクメ決めまくるお話[中国翻訳]｜爆乳魔法少女為了和平瘋狂分娩高潮的故事【錫沃拉巨大兔猻漢化】,爆乳魔法少女が平和の為に出産アクメ決めまくるお話｜爆乳魔法少女為了和平瘋狂分娩高潮的故事【錫沃拉巨大兔猻漢化】,"translated, chinese",ozaki,,manga,,,"big breasts, old man, swimsuit, piercing, pregnant, public use, big ass, urination, huge breasts, sex toys, exhibitionism, mind control, prolapse, stockings, bukkake, mosaic censorship, low shotacon, impregnation, sole female, bald, vaginal birth",100,2025-04-01 05:40:43,2025-04-01 05:40:43,2025-04-02 05:10:04
565548,[老攻] 疾博传 [Chinese],[老攻] 疾博传 [中国語],疾博传,chinese,,,doujinshi,boruto,"ino yamanaka, sakura haruno, tsunade, temari, hinata hyuga, boruto uzumaki, himawari uzumaki","milf, big breasts, netorare, mother, hairy, footjob, incest, aunt, big areolae, voyeurism, shotacon",32,2025-04-01 05:47:31,2025-04-01 05:47:31,2025-04-02 05:10:05
565549,[Taniuchi Kazuki] Min [Chinese],[谷内和生] 罠 [中国翻訳],Min,"translated, chinese",taniuchi kazuki,,manga,,,tankoubon,157,2025-04-01 05:59:21,2025-04-01 05:59:21,2025-04-02 05:10:06
565550,[AkisaeHitori] My Wife's NTR Diary 1 [ENGLISH],,My Wife's NTR Diary 1,english,akisaehitori,,doujinshi,original,,"big breasts, corruption, netorare, cheating, condom, nakadashi, femdom, swinging, filming, blowjob, collar, netorase",18,2025-04-01 06:01:05,2025-04-01 06:01:05,2025-04-02 05:10:07
565551,RIAOMA 2,リアおま2,RIAOMA 2,"english, translated",teruki kuma | teruki akira,,manga,,,"lolicon, rough translation",13,2025-04-01 06:04:17,2025-04-01 06:04:17,2025-04-02 05:10:07
565552,扶她JK狼奈,ふたなりJKろうな,扶她JK狼奈,chinese,akiamare,futamare,doujinshi,original,,"futanari, glasses, anal, blowjob face, kimono, blowjob, deepthroat, dickgirl on male, male on dickgirl, sole dickgirl, beauty mark, full-packaged futanari",56,2025-04-01 06:09:05,2025-04-01 06:09:05,2025-04-02 05:10:09
565553,[JOKERKIN]WUYA 4 part A CH(公開啦),,WUYA 4 part A CH,japanese,jokerkin,,doujinshi,original,,"bondage, latex, tentacles",45,2025-04-01 06:13:53,2025-04-01 06:13:53,2025-04-02 05:10:09
565554,[Senor Daietsu] Kyonyuu Jukubo no Abunai Kaikan Ch. 1-9 [Chinese] [Decensored] [Digital],[セニョール大悦] 巨乳熟母のアブない快感 第1-9話 [中国翻訳] [無修正] [DL版],Kyonyuu Jukubo no Abunai Kaikan Ch. 1-9,"translated, chinese",senor daietsu,,manga,,,"milf, big breasts, bbw, group, uncensored, femdom, mother, incest, rape, muscle",195,2025-04-01 06:29:14,2025-04-01 06:29:14,2025-04-02 05:10:10
565555,[Shimoyama Giruko] Ijou na Juku Niku Tsuma no Ayamachi Ch. 1-3 [Chinese] [Digital],[下山ギルコ] 異常な熟肉妻のあやまち 第1-3話 [中国翻訳] [DL版],Ijou na Juku Niku Tsuma no Ayamachi Ch. 1-3,"translated, chinese",shimoyama giruko,,manga,,,"milf, mmf threesome, group, full censorship, mother, incest",63,2025-04-01 06:34:25,2025-04-01 06:34:25,2025-04-02 05:10:11
565556,[摩伊那市 (絵子るび)] にこやかおばちゃん（Chinese）,,にこやかおばちゃん（Chinese）,"translated, chinese",ecoruby,,doujinshi,original,,"milf, big breasts, mmf threesome, group, big ass, huge breasts, mosaic censorship, hotpants, shotacon, sole female, closed eyes, pixie cut, small penis, eye-covering bang",28,2025-04-01 06:40:10,2025-04-01 06:40:10,2025-04-02 05:10:11
565557,[Semashi] [butahana] nanishite mo yo-sa-sōna musume [hana fukku] [English],[せまし]【豚鼻】何してもよさそうな娘【鼻フック】,nanishite mo yosōna musume,"english, translated",kanri kokka semashi,,doujinshi,original,,"elf, unusual teeth, transformation, big breasts, corruption, nose fuck, unusual pupils, body modification, nakadashi, ahegao, huge breasts, blowjob face, pig girl, latex, mind control, bodysuit, smell, nose hook, blowjob, gloves",36,2025-04-01 06:43:24,2025-04-01 06:43:24,2025-04-02 05:10:12
565558,[クロFn] 牝豚転落禄（Chinese）【更新中】,,牝豚転落禄（Chinese）【更新中】,"translated, chinese",kuro fn,,manga,,,"big breasts, military",24,2025-04-01 06:45:45,2025-04-01 06:45:45,2025-04-02 05:10:13
565559,琴葉姉妹は配信したい,,琴葉姉妹は配信したい,japanese,microa,,doujinshi,voiceroid,"akane kotonoha, aoi kotonoha","group, ffm threesome, sole male, shimaidon",20,2025-04-01 06:47:47,2025-04-01 06:47:47,2025-04-02 05:10:13
565560,修学旅行でクラスメイトと初エッチするふたなり①,,修学旅行でクラスメイトと初エッチするふたなり①,japanese,,,doujinshi,original,,"group, x-ray, full color, sole dickgirl, dickgirl on female",16,2025-04-01 06:49:18,2025-04-01 06:49:18,2025-04-02 05:10:14
565561,めちゃくちゃイライラしてる樋〇さんに呼び出されて,,めちゃくちゃイライラしてる樋〇さんに呼び出されて,japanese,tanakala,,doujinshi,original,,"blowjob, sole female, sole male",3,2025-04-01 06:49:47,2025-04-01 06:49:47,2025-04-02 05:10:15
565562,有罪のアザゼル - Guilty Azazel -,,有罪のアザゼル,japanese,yokoyama kouji,tonari no yama,doujinshi,mahou shoujo lyrical nanoha | magical girl lyrical nanoha,signum,"group, sole female",15,2025-04-01 06:51:06,2025-04-01 06:51:06,2025-04-02 05:10:16
565563,ROMANCE,,ROMANCE,japanese,yokoyama kouji,tonari no yama,doujinshi,original,,"group, blowjob",15,2025-04-01 06:52:31,2025-04-01 06:52:31,2025-04-02 05:10:16
565564,黒姫とおじさん,,黒姫とおじさん,japanese,yokoyama kouji,,doujinshi,original,,"kissing, dark skin, sole female, sole male",12,2025-04-01 06:53:45,2025-04-01 06:53:45,2025-04-02 05:10:17
565565,黒姫さん、おじさんとラブラブＨする,,黒姫さん、おじさんとラブラブＨする,japanese,yokoyama kouji,,doujinshi,original,,"kissing, sole female, sole male",11,2025-04-01 06:54:50,2025-04-01 06:54:50,2025-04-02 05:10:18
565566,黒姫さんアフター！,,黒姫さんアフター！,japanese,yokoyama kouji,,doujinshi,original,,"sole female, sole male",17,2025-04-01 06:56:25,2025-04-01 06:56:25,2025-04-02 05:10:19
565567,透明人間のやるべきこと,,透明人間のやるべきこと,japanese,yokoyama kouji,,doujinshi,original,,"sole female, sole male",6,2025-04-01 06:57:06,2025-04-01 06:57:06,2025-04-02 05:10:20
565568,[船堀斉晃] 人妻再調教日誌11-21最终话[廉价汉化组],,人妻再調教日誌11-21最终话,"translated, chinese",funabori nariaki,,manga,,,"group, netorare, enema, ahegao, anal, bondage, masked face, blowjob, low scat, anal intercourse",198,2025-04-01 07:13:44,2025-04-01 07:13:44,2025-04-02 05:10:21
565569,出来ちゃった黒姫さんと,,出来ちゃった黒姫さんと,japanese,yokoyama kouji,,doujinshi,original,,"pregnant, sole female, sole male",10,2025-04-01 07:15:02,2025-04-01 07:15:02,2025-04-02 05:10:21
565570,いろはにほエロ！30話の続き,,いろはにほエロ！30話の続き,japanese,yokoyama kouji,,doujinshi,original,,"mosaic censorship, nudity only, twintails, horns",8,2025-04-01 07:15:54,2025-04-01 07:15:54,2025-04-02 05:10:22
565571,レッドナイト・イヴ29.5話別視点,,レッドナイト・イヴ29.5話別視点,japanese,yokoyama kouji,,doujinshi,original,,,2,2025-04-01 07:16:17,2025-04-01 07:16:17,2025-04-02 05:10:23
565572,羽菜さん拘束くすぐり,,羽菜さん拘束くすぐり,japanese,yokoyama kouji,,doujinshi,original,,bondage,6,2025-04-01 07:16:58,2025-04-01 07:16:58,2025-04-02 05:10:24
565573,足神さんの抜け駆け,,足神さんの抜け駆け,japanese,yokoyama kouji,,doujinshi,original,,"paizuri, blowjob",14,2025-04-01 07:18:21,2025-04-01 07:18:21,2025-04-02 05:10:24
565574,黒姫エッチグレー,,黒姫エッチグレー,japanese,yokoyama kouji,,doujinshi,original,,"dark skin, dilf, blowjob, bbm, sole female, sole male",4,2025-04-01 07:18:55,2025-04-01 07:18:55,2025-04-02 05:10:25
565575,モモはチンカスチンポの皮剥き,,モモはチンカスチンポの皮剥き,japanese,yokoyama kouji,,doujinshi,to love-ru,momo velia deviluke,"demon girl, blowjob, sole female, tail, focus blowjob",2,2025-04-01 07:19:18,2025-04-01 07:19:18,2025-04-02 05:10:26
565576,足神さん写生大会グレー,,足神さん写生大会グレー,japanese,yokoyama kouji,,doujinshi,original,,"pasties, exhibitionism, sole female",2,2025-04-01 07:19:40,2025-04-01 07:19:40,2025-04-02 05:10:27
565577,高画質データ。文字無し版あり,,高画質データ。文字無し版あり,japanese,yokoyama kouji,,doujinshi,original,,"sole female, sole male",4,2025-04-01 07:20:12,2025-04-01 07:20:12,2025-04-02 05:10:28
565578,小鳥遊黒姫は複数のおじさんと仲良し,,小鳥遊黒姫は複数のおじさんと仲良し,japanese,yokoyama kouji,,doujinshi,original,,"group, harem, sole female",24,2025-04-01 07:22:22,2025-04-01 07:22:22,2025-04-02 05:10:29
565579,[MARY'S BOY] Kugi wa atsui uchi ni ute (Jujutsu Kaisen),,Kugi wa atsui uchi ni ute,japanese,,,doujinshi,jujutsu kaisen,,,43,2025-04-01 07:25:56,2025-04-01 07:25:56,2025-04-02 05:10:29
565580,"[Echichi Koubou (ababari)] Gakeppuchi Idol, Hajimete no Gravure Satsuei de Zecchou!? ~Mizugi no Naka Made Massage Sareru nante Kiitemasen!~ | Desperate Idol, Climaxing During Her First Gravure Shoot!? ~Nobody Told Me the Massage Would Groping Inside My Swimsuit!~ [English] [Aishi21]",[えちち工房 (ababari)] 崖っぷちアイドル、初めてのグラビア撮影で絶頂！？〜水着の中までマッサージされるなんて聞いてません！〜,"Gakeppuchi Idol, Hajimete no Gravure Satsuei de Zecchou!?| Desperate Idol, Climaxing During Her First Gravure Shoot!?","english, translated",ababari,echichi koubou,doujinshi,original,,"squirting, kissing, big breasts, swimsuit, humiliation, unusual pupils, nakadashi, ahegao, bondage, oil, hairy, dark skin, bikini, x-ray, gyaru-oh, defloration, fingering, filming, rape, dilf, muscle, sole female, facial hair, clit stimulation, nipple stimulation",57,2025-04-01 07:30:51,2025-04-01 07:30:51,2025-04-02 05:10:30
565581,[寿司握り虫(加速)] daydream,[寿司握り虫(加速)] daydream,daydream,japanese,kasoku,,doujinshi,original,,nun,17,2025-04-01 07:32:28,2025-04-01 07:32:28,2025-04-02 05:10:31
565582,[Mizushima Sorahiko] Iiwake mo Dekinai ~Ane Kare~ 2 [Digital],[水島空彦] いいわけも出来ない ～姉彼～ 2巻 [DL版],Iiwake mo Dekinai2,japanese,mizushima sorahiko,,manga,,,"full censorship, glasses, multi-work series, tankoubon",169,2025-04-01 07:46:35,2025-04-01 07:46:35,2025-04-02 05:10:32
565583,[TeruTeruGirl (Amano Teru)] Another World ALIEN II,[てるてるがーる (天乃輝)] Another World ALIEN II,Another World ALIEN II,japanese,amano teru,teruterugirl,doujinshi,aliens,facehugger,"anal birth, inflation, vaginal birth",52,2025-04-01 07:51:30,2025-04-01 07:51:30,2025-04-02 05:10:32
565584,[Robert Silva] ENDEAVOR - INFERNO,,ENDEAVOR - INFERNO,english,,,doujinshi,my hero academia | boku no hero academia,enji todoroki | endeavor,"drugs, yaoi, muscle",40,2025-04-01 07:55:16,2025-04-01 07:55:16,2025-04-02 05:10:33
565585,[deruderuga-ru]haihae [てるてるがーる]灰蠅,[てるてるがーる]灰蠅,haihae灰蠅,japanese,amano teru,teruterugirl,doujinshi,original,,"bestiality, x-ray, double penetration, insect, impregnation, eggs, vaginal birth",50,2025-04-01 07:59:48,2025-04-01 07:59:48,2025-04-02 05:10:34
565586,[Kurukuru] Furusato Nousei | Hometown Cumtribution [English] [NudeSalad],[くるくる] ふるさと納精 [英訳],Furusato Nousei | Hometown Cumtribution,"english, translated",kurukuru,,doujinshi,original,,"kissing, big breasts, swimsuit, emotionless sex, big ass, prostitution, nakadashi, ahegao, bikini, x-ray, drugs, stockings, mind break, sole female, sole male, bald",38,2025-04-01 08:03:08,2025-04-01 08:03:08,2025-04-02 05:10:34
565587,[Naitou Kirara] Slime Girl Meruru's Sexy Job - Episode 1 (COMIC Unreal 2025-04 Vol. 114) [English] [Digital],,Slime Girl Meruru's Sexy Job - Episode 1,"english, translated",naitou kirara,,manga,,,"slime, full censorship, body modification, nakadashi, blowjob, rough translation",26,2025-04-01 08:05:44,2025-04-01 08:05:44,2025-04-02 05:10:35
565588,鄰居。之後，[漫漫長夜x禁漫漢化組] [多紋サカキ] 隣人。のち、(WEEKLY快楽天 2024 No.24) [無修正] [中国翻訳],,鄰居。之後，隣人。のち、,"translated, chinese",tamon sakaki,,manga,,,"big breasts, uncensored, defloration, blowjob, sole female, sole male",29,2025-04-01 08:08:29,2025-04-01 08:08:29,2025-04-02 05:10:36
565589,[Kurukuru] Mura no Kishuu de Bakunyuu Yankee to Yareta Hanashi | A Story About Fucking a Big-Titted Delinquent Because of Village Traditions [English] [TOMISCANS],[くるくる] 村の奇習で爆乳ヤンキーとヤれた話 [英訳],Mura no Kishuu de Bakunyuu Yankee to Yareta Hanashi | A Story About Fucking a Big-Titted Delinquent Because of Village Traditions,"english, translated",kurukuru,kurukuru,doujinshi,original,,"big breasts, nakadashi, ahegao, huge breasts, stockings, blowjob, big penis, sole female, sole male, bald, beauty mark, nipple stimulation",40,2025-04-01 08:12:00,2025-04-01 08:12:00,2025-04-02 05:10:37
565590,[Bareisho Tarou to Butter Inu (Bareisho Tarou)] FGO no Erohon (Fate/Grand Order),[馬鈴薯太郎とバター犬 (馬鈴薯太郎)] えふじおのえろ本 (Fate/Grand Order),FGO no Erohon,japanese,bareisho tarou,bareisho tarou to butter ken,doujinshi,fate grand order,"nightingale, gudao | ritsuka fujimaru","big breasts, garter belt, nurse, emotionless sex, nakadashi, stockings, paizuri, bukkake, sole female, sole male, gloves",19,2025-04-01 08:13:49,2025-04-01 08:13:49,2025-04-02 05:10:37
565591,(TOKYO FES Jul.2024) [Repezen Dosukebe (Ikare Edo Ryokou)] Kazoku Ryokousaki de Hitomebore Shita Ero Gaki to Yaru ♥ Kouhen (Slam Dunk) [English] [mysterymeat3],(TOKYO FES Jul.2024) [レペゼンドスケベ (イカれ江戸旅行)] 家族旅行先でひとめぼれしたエロガキとヤるっ♡後編 (スラムダンク) [英訳],Kazoku Ryokousaki de Hitomebore Shita Ero Gaki to Yaru ♥ Kouhen,"english, translated",choueki oji-san,repezen dosukebe,doujinshi,slam dunk,"hisashi mitsui, ryota miyagi","group, anal, males only, yaoi, filming, shotacon",27,2025-04-01 08:20:31,2025-04-01 08:20:31,2025-04-02 05:10:38
565592,(C75) [ANA (Kichijouji Kitashirou)] Aoi Shichauzo Full Throttle (You're Under Arrest!) [English] [mysterymeat3],(C75) [ANA (吉祥寺北四郎)] 葵しちゃうぞフルスロットル (逮捕しちゃうぞ) [英訳],Aoi Shichauzo Full Throttle,"english, translated",kichijouji kitashirou,ana,doujinshi,youre under arrest | taiho shichauzo,aoi futaba,"scat, anal, shemale, policewoman, male on dickgirl, anal intercourse",31,2025-04-01 08:23:21,2025-04-01 08:23:21,2025-04-02 05:10:39
565593,(C104) [Umari-ya (D-2)] Kiriko Route Another #09 Zenpen -Jitaku Anani-hen~ (Sword Art Online) [English] [mysterymeat3],(C104) [埋まり屋 (D-2)] キリ娘ルート Another #09 補編 〜自宅アナニー編〜 [英訳],Kiriko Route Another #09 Zenpenhen~,"english, translated",d-2,umari-ya,doujinshi,sword art online,kazuto kirigaya | kirito,"chastity belt, masturbation, anal, sex toys, crossdressing, solo action, multi-work series, low bestiality, yaoi, tomgirl, feminization, sole male, nipple stimulation",21,2025-04-01 08:25:23,2025-04-01 08:25:23,2025-04-02 05:10:39
565594,(C105) [Akaeboshi (Binto)] Zutto Mama ni Narussu! [English],(C105) [アカエボシ(瓶人)] ずっとママになるっす！[英訳],Zutto Mama ni Narussu!,"english, translated",binto,akaeboshi,doujinshi,original,,"breast feeding, anal, crossdressing, dark skin, gyaru-oh, males only, yaoi, tomgirl, blowjob, twintails",24,2025-04-01 08:27:44,2025-04-01 08:27:44,2025-04-02 05:10:40
565595,[Sou Akiko] Cats On The Black Cage,[奏亜希子] CATS ON THE BLACK CAGE,Cats On The Black Cage,japanese,sou akiko,,manga,,,"piercing, group, ffm threesome, tankoubon, bisexual",170,2025-04-01 08:41:30,2025-04-01 08:41:30,2025-04-02 05:10:40
565596,[TRY&Hougen Futari Shakai (Hougen)] Akogare no Seitokaichou ga Kyonyuu Sugiru Ken 2 | About the Beloved Student President's Huge Tits 2 [English] [Decensored] [Digital],[TRY&方言二人社会 (TRY方言)] 憧れの生徒会長が巨乳すぎる件 2 [英訳] [無修正] [DL版],Akogare no Seitokaichou ga Kyonyuu Sugiru Ken 2 | About the Beloved Student President's Huge Tits 2,"english, translated",try | hougen,,doujinshi,,,"big breasts, mmf threesome, group, glasses, public use, uncensored, schoolgirl uniform, nakadashi, huge breasts, anal, harem, x-ray, multi-work series, double penetration, stockings, bukkake, filming, dilf, blowjob, collar, bbm, sole female, oyakodon, beauty mark, anal intercourse",38,2025-04-01 08:44:58,2025-04-01 08:44:58,2025-04-02 05:10:41
565597,Miyu-chan is Famous for her Huge Breasts [kurukuru] [TOMISCANS],,Miyu-chan is Famous for her Huge Breasts,"english, translated",kurukuru,kurukuru,doujinshi,original,,"big breasts, glasses, stockings, cowgirl, sole female, sole male, bald",36,2025-04-01 08:48:10,2025-04-01 08:48:10,2025-04-02 05:10:42
565598,[石狩庵] 褐色でかでかボーイッシュ ! 渚ちゃん 2,[石狩庵] 褐色でかでかボーイッシュ ! 渚ちゃん 2,褐色でかでかボーイッシュ ! 渚ちゃん 2,japanese,,ishikarian,doujinshi,original,,"big breasts, pregnant, dark skin, tall girl, piss drinking, deepthroat, sole female, sole male",71,2025-04-01 08:54:34,2025-04-01 08:54:34,2025-04-02 05:10:43
565599,[Akow Kazumi] HYSTERIC ALIVE [Chinese],[亜神和美] HYSTERIC ALIVE [中国翻訳],HYSTERIC ALIVE,"translated, chinese",akow kazumi,,manga,,,"tankoubon, guro",172,2025-04-01 09:07:27,2025-04-01 09:07:27,2025-04-02 05:10:44
