ID,EN_TITLE,JP_TITLE,CLEAN_TITLE,LANGUAGE,ARTIST,GROUP_NAME,CATEGORY,PARODY,CHARACTER,TAGS,PAGES,UPLOAD_DATE,FORMATTED_DATE,SCRAPED_DATE
612800,[Shivharu] ショタの全裸汗だく足コキ and ショタの丸吞みセックス,,ショタの全裸汗だく足コキ and ショタの丸吞みセックス,japanese,shivharu,,doujinshi,original,,"sweating, vore, males only, yaoi, miniguy",14,2025-12-01 23:35:18,2025-12-01 23:35:18,2025-12-02 14:02:50
612801,[Kuishinbou (Naitou Haruto)] Aisuru Tsuma ga Zetsurin Shachou no Te ni Ochita Sono Hi 2 [Chinese] [老夫个人机翻润色],[くいしん房 (ないとう春人)] 愛する妻が絶倫社長の手に堕ちたその日2 [中国翻訳],Aisuru Tsuma ga Zetsurin Shachou no Te ni Ochita Sono Hi 2,"translated, chinese",naitou haruto,kuishinbou,doujinshi,original,,"twins, milf, kissing, big breasts, pregnant, mmf threesome, group, netorare, cheating, nakadashi, ahegao, multi-work series, mosaic censorship, dilf, blowjob, deepthroat, bald, ponytail, shimaidon, rough translation",56,2025-12-01 23:38:51,2025-12-01 23:38:51,2025-12-02 14:02:50
612802,[Mei's Mother] Plain Mom 3 ~ Mom succumbs to her sexual desire and has sex with her new husband ~ [Old Husband's Personal Machine],[めいの母]地味かーちゃん3〜性欲に負けたかーちゃん、新しい旦那と交尾三昧〜【老夫个人机翻润色】,Plain Mom 3,"translated, chinese",,,doujinshi,original,,"milf, big breasts, pregnant, netorare, story arc, nakadashi, mother, dark skin, multi-work series, bride, filming, voyeurism, impregnation, shaved head, beauty mark, rough translation, low incest, netorase",105,2025-12-01 23:45:27,2025-12-01 23:45:27,2025-12-02 14:02:51
612803,[Poppu P] Tsuma ga Netorare Ochite Haramu made [Chinese] [老夫个人机翻润色],[ポップP] 妻がネトラレ堕ちて孕むまで [中国翻訳],Tsuma ga Netorare Ochite Haramu made,"translated, chinese",,,doujinshi,original,,"inseki, milf, big breasts, netorare, story arc, cheating, hairy, incest, rape, dilf, daughter, bbm, sole female, beauty mark, pixie cut, rough translation",133,2025-12-01 23:53:33,2025-12-01 23:53:33,2025-12-02 14:02:52
612804,[Senor Daietsu] Shintai Kensa de Yoromeite…. | Strip Search (Ecchi wa Bijin Jukujo ni Makasete) [English] [HentaiLLC] [Digital],[セニョール大悦] 身体検査でよろめいて････ (エッチは美人熟女にまかせて ) [英訳],Shintai Kensa de Yoromeite…. | Strip Search,"english, translated",,,manga,,,"big breasts, bbw, huge breasts, ffm threesome, sole male, rough translation",16,2025-12-01 23:54:47,2025-12-01 23:54:47,2025-12-02 14:02:52
612805,[Senor Daietsu] Bakunyū jokyōshi no tōsaku shidō | Lewd Lessons from Stacked Teacher [English] [HentaiLLC] [Digital],[セニョール大悦] 爆乳女教師の倒錯指導 (近親肉欲交尾したがる完熟母) [英訳],Bakunyū jokyōshi no tōsaku shidō | Lewd Lessons from Stacked Teacher,"english, translated",,,manga,,,"big breasts, bbw, huge breasts, rough translation",12,2025-12-01 23:55:45,2025-12-01 23:55:45,2025-12-02 14:02:53
612806,[Senor Daietsu] Sukin ni kodawaru naka dashi chō jukubo | Safety Comes First [English] [HentaiLLC]  [Digital],[セニョール大悦] スキンにこだわる中出し超熟母 (近親肉欲交尾したがる完熟母) [英訳],Sukin ni kodawaru naka dashi chō jukubo | Safety Comes First,"english, translated",senor daietsu,,manga,,,"big breasts, bbw, huge breasts, rough translation",16,2025-12-01 23:56:54,2025-12-01 23:56:54,2025-12-02 14:02:53
612807,[Senor Daietsu] Omoide no Nikubou Baton | Memories of the Meat Baton (Kyonyuu Bishiri Suteki de Yasashii Shirouto Hitozuma) [English] [HentaiLLC] [Digital],[セニョール大悦] 想い出の肉棒バトン (巨乳美尻ステキで優しいしろうと人妻) [英訳] [DL版],Omoide no Nikubou Baton | Memories of the Meat Baton,"english, translated",senor daietsu,,manga,,,"big breasts, bbw, huge breasts, rough translation",16,2025-12-01 23:58:06,2025-12-01 23:58:06,2025-12-02 14:02:54
612808,[Senor Daietsu] Kyojiri Shufu wa Otto ni Naisho de... | A Big-Butt Housewife's Secret (Harenchi Oku-sama Suteki ni Nure Midare Nikki) [English] [HentaiLLC] [Digital],[セニョール大悦] 巨尻主婦は夫に内緒で… (破廉恥奥様ステキに濡れ乱れ日記) [英訳] [DL版],Kyojiri Shufu wa Otto ni Naisho de... | A Big-Butt Housewife's Secret,"english, translated",senor daietsu,,manga,,,"milf, big breasts, bbw, full censorship, big ass, cheating, mother, incest, sole female, sole male, rough translation",16,2025-12-01 23:59:20,2025-12-01 23:59:20,2025-12-02 14:02:55
612809,[Senor Daietsu] Bi Oba Hajimete no Shiofuki | Beautiful Aunt's First Gush (Sex ga Ikigai no Hitozuma-tachi no Seitai) [English] [HentaiLLC] [Digital],[セニョール大悦] 美叔母 初めての潮吹き (セックスが生きがいの人妻たちの生態) [英訳],Bi Oba Hajimete no Shiofuki | Beautiful Aunt's First Gush,"english, translated",senor daietsu,,manga,,,"big breasts, bbw, huge breasts, rough translation",16,2025-12-02 00:00:39,2025-12-02 00:00:39,2025-12-03 14:00:40
612810,[Senor Daietsu] Kyonyuu Tsuma no Hajirai Kaniku | Shy Wife's Soft Curves (Ecchi wa Bijin Jukujo ni Makasete) [English] [HentaiLLC] [Digital],[セニョール大悦] 巨乳妻の恥じらい果肉 (エッチは美人熟女にまかせて) [英訳],Kyonyuu Tsuma no Hajirai Kaniku | Shy Wife's Soft Curves,"english, translated",senor daietsu,,manga,,,"milf, big breasts, bbw, full censorship, cheating, huge breasts, mother, incest, sole female, rough translation",16,2025-12-02 00:01:54,2025-12-02 00:01:54,2025-12-03 14:00:41
612811,[Senor Daietsu] Otto no soba de okasarete | Secret Play (Oku-sama-tachi wa Kyou mo Yokkyuu Fuman) [English] [HentaiLLC] [Digital],[セニョール大悦] 夫の傍で犯されて (奥様たちは今日も欲求不満) [英訳],Otto no soba de okasarete | Secret Play,"english, translated",senor daietsu,,manga,,,"big breasts, huge breasts, rough translation",20,2025-12-02 00:03:23,2025-12-02 00:03:23,2025-12-03 14:00:42
612812,[Senor Daietsu] Watashi wa musuko ni okasa remashita | The Deal Between Mother and Son (Okasare Miboujin no Toiki Vol. 02) [English] [HentaiLLC] [Digital],[セニョール大悦] 私は息子に犯されました (犯され未亡人の吐息VOL.02) [英訳] [DL版],Watashi wa musuko ni okasa remashita | The Deal Between Mother and Son,"english, translated",senor daietsu,,manga,,,"big breasts, rough translation",16,2025-12-02 00:04:36,2025-12-02 00:04:36,2025-12-03 14:00:42
612813,[Horieros] Sekai Saikyou no Koroshiya Self Mesu-ka Kaizou [13],[ほりえろす]【メス堕ち最強の殺し屋セルフシーメール化改造【13】,Sekai Saikyou no Koroshiya Self Mesu-ka Kaizou,"japanese, english",horieros,,doujinshi,original,,"big breasts, huge breasts, anal, shemale, small penis, focus anal, anal intercourse",6,2025-12-02 00:05:18,2025-12-02 00:05:18,2025-12-03 14:00:43
612814,[Senor Daietsu] Yokujō okusama to mōsō daikō hito | Lustful Wife and Fantasy Agent (Oku-sama-tachi wa Kyou mo Yokkyuu Fuman) [English] [HentaiLLC] [Digital],[セニョール大悦] 欲情奥様と妄想代行人 (奥様たちは今日も欲求不満) [英訳] [DL版],Yokujō okusama to mōsō daikō hito | Lustful Wife and Fantasy Agent,"english, translated",senor daietsu,,manga,,,"milf, big breasts, full censorship, masturbation, nakadashi, sex toys, filming, rape, blowjob, muscle, sole female, bald, rough translation",10,2025-12-02 00:06:04,2025-12-02 00:06:04,2025-12-03 14:00:43
612815,[Izure] Cool na Gal ga Onaho ni Natte Kureru Hanashi | The Story of How a Cool Gyaru Became My Onahole [English] [gotbored] [Digital],[いづれ] クールなギャルがオナホになってくれる話 [英訳] [DL版],Cool na Gal ga Onaho ni Natte Kureru Hanashi | The Story of How a Cool Gyaru Became My Onahole,"english, translated",izure,,doujinshi,original,,"big breasts, schoolboy uniform, emotionless sex, big ass, schoolgirl uniform, condom, nakadashi, ahegao, hairy, x-ray, gyaru, sole female, sole male, beauty mark, ponytail, eye-covering bang, multiple orgasms, nipple stimulation",67,2025-12-02 00:10:25,2025-12-02 00:10:25,2025-12-03 14:00:44
612816,[Marushamo] Shukushou sare Omocha ni sareru Ani  [Chinese] [沒有漢化],[まるしゃも] 縮小されオモチャにされる兄 [中国翻訳],Shukushou sare Omocha ni sareru Ani,"translated, chinese",marushamo,,doujinshi,original,,"big breasts, miniguy",66,2025-12-02 00:14:54,2025-12-02 00:14:54,2025-12-03 14:00:45
612817,[Pentacle (Shimipan)] Shikatanaku Kaa-chan to Sex Shimasu 6 [Chinese],[ペンタクル] 仕方なく母ちゃんとセックスします6 [中国翻訳],Shikatanaku Kaa-chan to Sex Shimasu 6,"translated, chinese",shimipan,pentacle,doujinshi,original,,"squirting, milf, kissing, big breasts, big ass, cheating, breast feeding, nakadashi, mother, hairy, full color, incest, mosaic censorship, voyeurism, pixie cut, netorase",61,2025-12-02 00:20:01,2025-12-02 00:20:01,2025-12-03 14:00:45
612818,[Anabuki Bouhatei] Bakunyuu Gal no Kakushigoto [Chinese],[穴吹防波堤] 爆乳ギャルのカクシゴト [中国翻訳],Bakunyuu Gal no Kakushigoto,"translated, chinese",anabuki bouhatei,,doujinshi,original,,"big breasts, piercing, big ass, schoolgirl uniform, condom, nakadashi, ahegao, huge breasts, gyaru, inverted nipples, sole female, sole male, clothed paizuri, eye-covering bang, extraneous ads",44,2025-12-02 00:22:57,2025-12-02 00:22:57,2025-12-03 14:00:46
612819,[Nechosuke (Shijimi)] NTR Chinpo INN ~Taisetsu na Hito-tachi no Status ga Jusei-zumi ni natte ita Kudan~ | NTR肉棒旅馆~珍视之人的角色面板居然显示已受精~ [Chinese] [白杨汉化组],[ねちょすけ (しじみ)] NTR チンポ INN ~大切な人たちのステータスが受精済みになっていた件~ [中国翻訳],NTR Chinpo INN| NTR肉棒旅馆,"translated, chinese",shijimi,,doujinshi,original,,"big breasts, netorare, nakadashi, ahegao, anal, x-ray, paizuri, blowjob, kemonomimi, ponytail, anal intercourse",46,2025-12-02 00:25:58,2025-12-02 00:25:58,2025-12-03 14:00:46
612820,(C84) [AERODOG (inu)] Suruga Play Hana (Bakemonogatari) [Chinese],(C84) [AERODOG (inu)] 駿河プレイ花 (化物語) [中国翻訳],Suruga Play Hana,"translated, chinese",inu,aerodog,doujinshi,bakemonogatari,"koyomi araragi, suruga kanbaru","schoolgirl uniform, anal, bike shorts, blowjob, sole female, sole male, twintails, anal intercourse, extraneous ads",31,2025-12-02 00:27:58,2025-12-02 00:27:58,2025-12-03 14:00:47
612821,COMIC HOTMiLK Koime Vol. 55 [Digital],コミックホットミルク濃いめ vol.55 [DL版],COMIC HOTMiLK Koime Vol. 55,japanese,"shijou sadafumi, touma itsuki, kuroiwa menou, kokonoki nao, kishizuka kenji, utamaro, minamida usuke, sakomae aichi | aino chie, umino ryo, yagami sai, sexy imo",,manga,,,"milf, big breasts, group, cheating, anthology, nakadashi, anal, mother, incest, double penetration, impregnation, pixie cut, anal intercourse",273,2025-12-02 00:45:33,2025-12-02 00:45:33,2025-12-03 14:00:47
612822,[Nigiri Usagi] Seito ni Juusho ga Baretanda ga Owatta Kamoshiren 1-9,[にぎりうさぎ] 生徒に住所がバレたんだが終わったかもしれん 1-9,Seito ni Juusho ga Baretanda ga Owatta Kamoshiren 1-9,japanese,nigiri usagi,,doujinshi,original,,"handjob, kissing, group, glasses, schoolgirl uniform, nakadashi, blowjob face, ffm threesome, harem, gyaru, teacher, blowjob, blindfold, sole male, twintails, clothed female nude male",80,2025-12-02 00:50:44,2025-12-02 00:50:44,2025-12-03 14:00:48
612823,[Fanbox] Nenha,,Nenha,japanese,nenpa,,doujinshi,original,,"time stop, mind control",133,2025-12-02 00:59:09,2025-12-02 00:59:09,2025-12-03 14:00:49
612824,"[U League (Yusuri)] Yuri de Succubus! 2 ~Koi suru Inma, Ningen to no Koi o Jouju saseru!?~ | Yuri de Succubus! 2 - A  Lovestruck Succubus Makes Her Love with a Human Come True! [English]",[ユ・リーグ (ゆすり)] 百合deサキュバス!2～恋する淫魔、人間との恋を成就させる!?～ [英訳],Yuri de Succubus! 2| Yuri de Succubus! 2 - A  Lovestruck Succubus Makes Her Love with a Human Come True!,"english, translated",yusuri,u league,doujinshi,original,,"kissing, cunnilingus, females only, masturbation, sex toys, demon girl, yuri, multi-work series, fingering, tribadism, collar, crotch tattoo, horns, tail, clit stimulation, rough translation, painted nails",59,2025-12-02 01:03:04,2025-12-02 01:03:04,2025-12-03 14:00:49
612825,(C106) [OrangeMaru (YD)] OrangeMaru vol.17 (THE iDOLM@STER: Shiny Colors) [Colorized] [Satansoft] [English],(C106) [OrangeMaru (YD)] OrangeMaru vol.17 (アイドルマスター シャイニーカラーズ) [英訳],OrangeMaru vol.17,"english, translated",yd,orangemaru,doujinshi,the idolmaster,madoka higuchi,"wings, big breasts, demon girl, bikini, latex, full color, stockings, sole female, sole male, crotch tattoo, horns, tail, stirrup legwear",9,2025-12-02 01:03:58,2025-12-02 01:03:58,2025-12-03 14:00:50
612826,"[Maikage (Mikage)] Senpai no Tame ni, Dakaremasu.丨为了前辈，我原意献身 [Chinese]",[舞影 (美影)] 先輩のために、抱かれます。 [中国翻訳],"Senpai no Tame ni, Dakaremasu.丨为了前辈，我原意献身","translated, chinese",mikage,maikage,doujinshi,original,,"big breasts, netorare, cheating, schoolgirl uniform, condom, nakadashi, swinging, paizuri, filming, voyeurism, muscle, big penis, stomach deformation, sole female, beauty mark, netorase",72,2025-12-02 01:08:25,2025-12-02 01:08:25,2025-12-03 14:00:51
612827,[Emuo Koubou (Yonesuke)] Gal to Bikyaku to Yuuwaku Date丨玉足辣妹的诱惑与约会 [Chinese] [Digital],[えむお工房 (よねすけ)] ギャルと美脚と誘惑デート [中国翻訳] [DL版],Gal to Bikyaku to Yuuwaku Date丨玉足辣妹的诱惑与约会,"translated, chinese",yonesuke,emuo koubou,doujinshi,original,,"sweating, big breasts, group, nakadashi, ffm threesome, femdom, foot licking, thigh high boots, footjob, gyaru, smell, tall girl, cbt, hotpants, sole male, nipple stimulation, painted nails",41,2025-12-02 01:11:13,2025-12-02 01:11:13,2025-12-03 14:00:51
612828,"[Shion] Kono Koikatsu Onsen Tour ni wa, Yarimoku Onna Shika Inakatta 1-6",[紫おん] この恋活温泉ツアーには、ヤリモク女しかいなかった,"Kono Koikatsu Onsen Tour ni wa, Yarimoku Onna Shika Inakatta 1-6",japanese,shion,,manga,,,"kissing, group, full censorship, story arc, nakadashi, ffm threesome, full color, multi-work series, paizuri, ball sucking, blowjob, sole male, multimouth blowjob, nipple stimulation",150,2025-12-02 01:20:22,2025-12-02 01:20:22,2025-12-03 14:00:52
612829,[Yamamori Himawari] Maishuu Doyou wa Kousoku no Hi,[山盛りひまわり] 毎週土曜は拘束の日,Maishuu Doyou wa Kousoku no Hi,japanese,yamamoto kichiko,yamamori himawari,doujinshi,original,,,39,2025-12-02 01:22:54,2025-12-02 01:22:54,2025-12-03 14:00:52
612830,カリン & アスナ (Pixiv Fanbox),カリン & アスナ (Pixiv Fanbox),カリン & アスナ,chinese,bingdak,,doujinshi,blue archive,,"futanari, big breasts",4,2025-12-02 01:23:23,2025-12-02 01:23:23,2025-12-03 14:00:53
612831,[Putama] Fanbox汉化合集 (Blue Archive) [Chinese] [欶澜汉化组],[ぷ玉] Fanbox汉化合集 (ブルーアーカイブ) [中国翻訳],Fanbox汉化合集,"translated, chinese",putama,,doujinshi,blue archive,"hasumi hanekawa, yuuka hayase, iori shiromi, haruna kurodate, karin kakudate, mika misono, ako amau, saki sorai, sensei, saori joumae, kazusa kyouyama, toki asuma, rio tsukatsuki, rumi akeshiro, kikyou kiryuu, yukari kadenokouji, ichika nakamasa, kisaki ryuuge, kirara yozakura, satsuki kyougoku, eri shirao","maid, handjob, sweating, kissing, wings, leg lock, swimsuit, group, schoolgirl uniform, nakadashi, ahegao, ffm threesome, femdom, dark skin, bikini, x-ray, blowjob, catgirl, sole male, ponytail, school gym uniform, nipple stimulation, halo",158,2025-12-02 01:32:53,2025-12-02 01:32:53,2025-12-03 14:00:54
612832,【まきん】よろず単発『URA个人汉化』,【まきん】よろず単発『URA个人汉化』,【まきん】よろず単発『URA个人汉化』,"translated, chinese",makin,,doujinshi,touhou project,,"futanari, chastity belt, netorare, anal, femdom, lolicon, tomgirl, big penis, collar, dickgirl on male, ponytail, dickgirl on female",32,2025-12-02 01:38:30,2025-12-02 01:38:30,2025-12-03 14:00:54
612833,[Mizore Nabe (Mizore)] Irai Shippai -QUEST FAILED- [Chinese][Digital],[みぞれ鍋 (みぞれ)] 依頼失敗-QUEST FAILED- [中国翻訳] [DL版],Irai Shippai,"translated, chinese",mizore,mizore nabe,doujinshi,original,,"big breasts, garter belt, monster girl, glasses, femdom",35,2025-12-02 01:40:55,2025-12-02 01:40:55,2025-12-03 14:00:55
612834,[Iwao] Tifa iroiro (Final Fantasy VII) [Chinese] [Digital],[いわお] ティファ色々 (ファイナルファンタジーVII) [中国翻訳] [DL版],Tifa iroiro,"translated, chinese",iwao,,doujinshi,final fantasy vii,tifa lockhart,"big breasts, bondage, stockings, tentacles, sole female",12,2025-12-02 01:41:54,2025-12-02 01:41:54,2025-12-03 14:00:55
612835,[バナナソード] 男の娘魔導師とオナホ契約,,男の娘魔導師とオナホ契約,japanese,,,doujinshi,original,,"anal, yaoi, tomgirl",17,2025-12-02 01:43:08,2025-12-02 01:43:08,2025-12-03 14:00:56
612836,[高饅] 大和 (艦隊これくしょん -艦これ-),[高饅] 大和 (艦隊これくしょん -艦これ-),大和,japanese,takaman,,doujinshi,kantai collection,"yamato, teitoku","nakadashi, blowjob, sole female, sole male",10,2025-12-02 01:43:54,2025-12-02 01:43:54,2025-12-03 14:00:56
612837,[Moo] Ambriel no Okozukai Kasegi (Arknights) [Decensored] [Chinese],[Moo] アンブリエルのお小遣い稼ぎ (明日方舟)[無修正][中文翻译],Ambriel no Okozukai Kasegi,"translated, chinese",moo,,doujinshi,arknights,"doctor, ambriel","uncensored, prostitution, nakadashi, stockings, blowjob, sole female, sole male, halo",11,2025-12-02 01:44:46,2025-12-02 01:44:46,2025-12-03 14:00:57
612838,[バナナソード] 小人で遊ぼう,,小人で遊ぼう,japanese,,,doujinshi,original,,"shrinking, full color, males only, yaoi, tomgirl, miniguy, comic",26,2025-12-02 01:46:32,2025-12-02 01:46:32,2025-12-03 14:00:58
612839,[Neko no Youchuu] Blaze to Sauna Mitai na Sex suru Hanashi | 与煌进行蒸桑拿一般的性爱 (Arknights) [Chinese] [并非汉化组],[猫の幼虫] ブレイズとサウナみたいなセックスする話 (アークナイツ) [中国翻訳],Blaze to Sauna Mitai na Sex suru Hanashi | 与煌进行蒸桑拿一般的性爱,"translated, chinese",neko no youchuu,,doujinshi,arknights,"doctor, blaze","catgirl, sole female, sole male, kemonomimi",13,2025-12-02 01:47:38,2025-12-02 01:47:38,2025-12-03 14:00:58
612840,[Cocoa Holic (Yuizaki Kazuya)] Onnanoko no Mayu 2 -Maid in May- | 名为茧的少女2 -五月的女仆装- [Chinese] [绅士仓库汉化] [Digital],[ココアホリック (ユイザキカズヤ)] おんなのこのまゆ2 -さつきよそをい- [中国翻訳] [DL版],Onnanoko no Mayu 2| 名为茧的少女2,"translated, chinese",yuizaki kazuya,cocoa holic,doujinshi,original,,"maid, unusual pupils, nakadashi, lolicon, multi-work series, stockings, sole female, sole male",34,2025-12-02 01:53:58,2025-12-02 01:53:58,2025-12-03 14:00:59
612841,[芋一郎] 占いギャルと,[芋一郎] 占いギャルと,占いギャルと,japanese,imo ichirou,,doujinshi,original,,"swimsuit, glasses, bikini, mind control, full color, gyaru, lingerie, chikan, sole female, sole male, kemonomimi, ponytail, no penetration, forced exposure, onsen",29,2025-12-02 01:55:58,2025-12-02 01:55:58,2025-12-03 14:00:59
612842,"[utsuro_butai] Saimin, Kakete Mite | Hypnosis, Give it a Try - Chapter 1 [English] [Morally Bankrupt Wizard Translations]",[書記隊] サイミン、掛けてみて 第1話 [英訳],"Saimin, Kakete Mite | Hypnosis, Give it a Try - Chapter 1","english, translated",shokitai | utsuro butai,,doujinshi,original,,"schoolgirl uniform, mind control, multi-work series, webtoon, no penetration",12,2025-12-02 01:57:01,2025-12-02 01:57:01,2025-12-03 14:01:00
612843,[Limake (Limit)] Akutoku Shounyo Inga Ouhou [Digital],[Limake (Limit)] 悪徳商女 因果応報 [DL版],Akutoku Shounyo Inga Ouhou,japanese,limit,limake,doujinshi,original,,"squirting, kissing, nakadashi, ahegao, anal, anorexic, robot, dark skin, lolicon, x-ray, drugs, double penetration, large insertions, muscle, big penis, sole female, shaved head, domination loss, anal intercourse, mesugaki",26,2025-12-02 02:01:56,2025-12-02 02:01:56,2025-12-03 14:01:00
612844,[バナナソード] 幼馴染のヒミツ/関西より愛をこめて,,幼馴染のヒミツ/関西より愛をこめて,japanese,,,doujinshi,original,,"anal, sleeping, full color, males only, yaoi, tomgirl",26,2025-12-02 02:03:58,2025-12-02 02:03:58,2025-12-03 14:01:01
612845,[Mocumental (Coela Network)] Oniyome to Rugger Man Doutei ~Zenpen~ | The Demon Wife and the Virgin Rugby Player – Part 1 [English] [LKK•Scans],[モキュメンタル (Coela Network)] 鬼嫁とラガーマン童貞 ~前編~ [英訳],Oniyome to Rugger Man Doutei| The Demon Wife and the Virgin Rugby Player – Part 1,"english, translated",,coela network,doujinshi,original,,"milf, virginity, big breasts, netorare, condom, dark skin, full color, multi-work series, drunk, swinging, filming, mosaic censorship, blowjob, muscle, big penis, sole female, multipanel sequence, netorase",70,2025-12-02 02:08:45,2025-12-02 02:08:45,2025-12-03 14:01:01
612846,[誤じ脱ぢ] Aな関係 (学園アリス),[誤じ脱ぢ] Aな関係 (学園アリス),Aな関係,japanese,,,doujinshi,original,,"futanari, lolicon, shotacon",31,2025-12-02 02:14:52,2025-12-02 02:14:52,2025-12-03 14:01:02
612847,(C106) [MAIDOLL (Fei)] SNS de Daininki na Layer ga Watashi o Sasotte Off-Pako no Hanashi. ~Himitsu no Nijikai Sex Hen~ - Famous cosplayer invited me to have sex after event. [Chinese] [黑锅汉化组],(C106) [MAIDOLL (飛燕)] SNSで大人気なレイヤーが私を誘ってオフパコの話。～秘密の二次会セックス編～ [中国翻訳],SNS de Daininki na Layer ga Watashi o Sasotte OffFamous cosplayer invited me to have sex after event.,"translated, chinese",fei,maidoll,doujinshi,original,,"big breasts, group, pasties, ffm threesome, multi-work series, stockings, blowjob, collar, sole male, kemonomimi, tail, high heels",27,2025-12-02 02:16:47,2025-12-02 02:16:47,2025-12-03 14:01:03
612848,(C91) [MAXI (Puti)] Zettai Fukujuu Ad Veritas (Quiz RPG Mahoutsukai to Kuroneko no Wiz) [Chinese] [RATKING機翻],(C91) [MAXI (ぷち)] 絶対服従アドヴェリタス (クイズRPG魔法使いと黒猫のウィズ) [中国翻訳],Zettai Fukujuu Ad Veritas,"translated, chinese",puti,maxi,doujinshi,quiz rpg mahoutsukai to kuroneko no wiz,,"glasses, out of order, sole female, sole male, extraneous ads",32,2025-12-02 02:18:57,2025-12-02 02:18:57,2025-12-03 14:01:03
612849,[Taishinkokuoh Anton] A New Light (COMIC Penguin Club 2023-06) [Chinese] [Digital],[大秦国王安敦] A New Light (COMIC ペンギンクラブ 2023年6月号) [中国翻訳] [DL版],A New Light,"translated, chinese",taishinkokuoh anton,,manga,,,"lolicon, shotacon, extraneous ads",27,2025-12-02 02:24:32,2025-12-02 02:24:32,2025-12-03 14:01:04
612850,[Onigiri Unicorn] Douse Watashi nante! (COMIC Penguin Club 2023-06) [Chinese] [Digital],[鬼斬ゆにこーん] どうせ私なんて! (COMIC ペンギンクラブ 2023年6月号) [中国翻訳] [DL版],Douse Watashi nante!,"translated, chinese",onigiri unicorn,,manga,,,extraneous ads,27,2025-12-02 02:26:26,2025-12-02 02:26:26,2025-12-03 14:01:04
612851,[Tonari] Hontou no Koto wa Ienai yo (COMIC Penguin Club 2023-06) [Chinese] [Digital],[隣] 本当の事は言えないよ (COMIC ペンギンクラブ 2023年6月号) [中国翻訳] [DL版],Hontou no Koto wa Ienai yo,"translated, chinese",tonari,,manga,,,"lolicon, extraneous ads",27,2025-12-02 02:31:22,2025-12-02 02:31:22,2025-12-03 14:01:05
612852,[Kurumiya Mashimin] Eigyou Seiseki (COMIC Penguin Club 2023-06) [Chinese] [Digital],[胡桃屋ましみん] 営業性績 (COMIC ペンギンクラブ 2023年6月号) [中国翻訳] [DL版],Eigyou Seiseki,"translated, chinese",kurumiya mashimin | mashi miyuki,,manga,,,"big breasts, glasses, extraneous ads",27,2025-12-02 02:33:19,2025-12-02 02:33:19,2025-12-03 14:01:05
612853,[Karakuchi Choucream] Junjo saiin therapy (COMIC Europa Vol. 18) [Chinese],[辛口しゅーくりーむ] 純情催淫セラピー (コミックエウロパ Vol.18) [中国翻訳],Junjo saiin therapy,"translated, chinese",karakuchi choucream | sakurai maki,,manga,,,"big breasts, schoolgirl uniform, extraneous ads",27,2025-12-02 02:35:04,2025-12-02 02:35:04,2025-12-03 14:01:06
612854,[Kisuna TRACK (Kisuna)] Byururu-ed Sperma | 噴射粘稠偶像大師 (THE IDOLM@STER CINDERELLA GIRLS) [Chinese] [Digital],[キスナトラック (キスナ)] びゅるるどすぺるま (アイドルマスター シンデレラガールズ) [中国翻訳] [DL版],Byururu-ed Sperma | 噴射粘稠偶像大師,"translated, chinese",,,doujinshi,the idolmaster,"honoka ayase, yuzu kitami, shinobu kudo, azuki momoi","swimsuit, prostitution, bikini, extraneous ads",31,2025-12-02 02:37:13,2025-12-02 02:37:13,2025-12-03 14:01:06
612855,[Tohyama Eight] Netsubou Onsen Bojou (Hataraku Onee-san no Himitsu ~Kyuujitsu wa Onsen e GO Hen~) [Chinese],[東山エイト] 熱望温泉慕情 (働くお姉さんの秘蜜〜休日は温泉へGO★編〜) [中国翻訳],Netsubou Onsen Bojou,"translated, chinese",tohyama eight,,manga,,,extraneous ads,27,2025-12-02 02:39:03,2025-12-02 02:39:03,2025-12-03 14:01:07
