ID,EN_TITLE,JP_TITLE,CLEAN_TITLE,LANGUAGE,ARTIST,GROUP_NAME,CATEGORY,PARODY,CHARACTER,TAGS,PAGES,UPLOAD_DATE,FORMATTED_DATE,SCRAPED_DATE
587468,[Karamomo Tart (Qal)] Komeiji Satori to Atarashii Pet (Touhou Project) [Chinese] [古明地小姐机翻汉化] (Reitaisai 15),[からももたると (くぁる)] 古明地さとりと新しいペット (東方Project) [古明地小姐机翻汉化] (例大祭15),Komeiji Satori to Atarashii Pet,"translated, chinese",kindatsu | qal,karamomo tart,manga,,,"tentacles, rough translation",16,2025-08-01 23:03:18,2025-08-01 23:03:18,2025-08-02 14:02:48
587469,[Tomoe Tenbu] Spamtan EX (Sandwich Sisters) (Decensored) [English] [Shiro Translation],[巴天舞] スパムタンEX (Sandwich Sisters) [英訳],Spamtan EX,"english, translated",tomoe tenbu,,manga,,,"big breasts, nakadashi, breast expansion",17,2025-08-01 23:04:25,2025-08-01 23:04:25,2025-08-02 14:02:49
587470,[Ooi Masakazu / Inomaru] Isekai Furin ll ~Michibika Reshi Hitodzuma Tachi to Bukiyo Tensei Yuusha~vol 06 [English],[大井昌和×いのまる]   異世界不倫Ⅱ～導かれし人妻たちと不器用転生勇者～第06巻 [英訳],Isekai Furin llvol 06,"english, translated","inomaru, ooi masakazu",,manga,,,"handjob, milf, big breasts, group, full censorship, cheating, multi-work series, huge penis, blowjob, big penis",154,2025-08-01 23:13:28,2025-08-01 23:13:28,2025-08-02 14:02:50
587471,Feliz Navidad How to Use Men,,Feliz Navidad How to Use Men,japanese,,,doujinshi,,,"full censorship, glasses, femdom, webtoon",130,2025-08-01 23:20:41,2025-08-01 23:20:41,2025-08-02 14:02:50
587472,[Neko Samurai] Boku no Juusha-tachi,[猫サム雷] 僕の従者たち,Boku no Juusha-tachi,japanese,neko samurai,,doujinshi,original,,"sweating, big breasts, swimsuit, netorare, big ass, schoolgirl uniform, condom, huge breasts, bikini, big areolae, huge penis, stockings, tall girl, blowjob, big penis, shotacon, shaved head, smalldom",52,2025-08-01 23:30:28,2025-08-01 23:30:28,2025-08-02 14:02:51
587473,[Mirakoku (Yasumi Mirakichi)] 1-kagetsu Ninshin Shinakereba Otoko ni Modoreru Hanashi (4) [Chinese] [个人汉化] [Sample],[みら国 (やすみみらきち)] 1ヶ月妊娠しなければ男に戻れる話(4) [中訳] [見本],1-kagetsu Ninshin Shinakereba Otoko ni Modoreru Hanashi,"translated, chinese",yasumi mirakichi,mirakoku,doujinshi,original,,"multi-work series, gender change, rough translation",5,2025-08-01 23:30:59,2025-08-01 23:30:59,2025-08-02 14:02:52
587474,[Ooi Masakazu / Inomaru] Isekai Furin ll ~Michibika Reshi Hitodzuma Tachi to Bukiyo Tensei Yuusha~vol 07 [English],[大井昌和×いのまる]   異世界不倫Ⅱ～導かれし人妻たちと不器用転生勇者～第07巻 [英訳],Isekai Furin llvol 07,"english, translated","inomaru, ooi masakazu",,manga,,,"milf, big breasts, group, full censorship, cheating, multi-work series, lactation, impregnation, big penis",150,2025-08-01 23:39:41,2025-08-01 23:39:41,2025-08-02 14:02:53
587475,"Can I be a Sex Slave, Not a Priest?",,"Can I be a Sex Slave, Not a Priest?","english, translated",,,doujinshi,original,,"big breasts, spanking, cunnilingus, vampire, prostate massage, anal, sex toys, femdom, bondage, blood, orgasm denial, muscle, collar, sole female, tail plug, webtoon, clothed female nude male, leash",362,2025-08-02 00:01:30,2025-08-02 00:01:30,2025-08-03 14:00:42
587476,[Ooi Masakazu / Inomaru] Isekai Furin ll ~Michibika Reshi Hitodzuma Tachi to Bukiyo Tensei Yuusha~vol 08 [English],[大井昌和×いのまる]   異世界不倫Ⅱ～導かれし人妻たちと不器用転生勇者～第08巻 [英訳],Isekai Furin llvol 08,"english, translated","inomaru, ooi masakazu",,manga,,,"milf, big breasts, unusual pupils, group, full censorship, cheating, ahegao, demon girl, multi-work series, lactation, impregnation, big penis, penis enlargement",150,2025-08-02 00:10:21,2025-08-02 00:10:21,2025-08-03 14:00:43
587477,[Inue Shinsuke] Mesuinu no Sato | Bitch Village (COMIC ExE 50) [English] [meganekun_tl] [Digital],[犬江しんすけ] めすいぬのさと (コミック エグゼ 50) [英訳] [DL版],Mesuinu no Sato | Bitch Village,"english, translated",inue shinsuke,,manga,,,"big breasts, unusual pupils, mmf threesome, group, full censorship, glasses, netorare, big ass, nakadashi, anal, harem, full color, masked face, multi-work series, drugs, double penetration, drunk, swinging, paizuri, fingering, blowjob, sole female, facial hair, anal intercourse",27,2025-08-02 00:12:13,2025-08-02 00:12:13,2025-08-03 14:00:44
587478,[HB] Reforming a Delinquent Boy by Turning Him into a Girl [English],[HB] 不良少年を女にして更生させるようです [スペイン翻訳],Reforming a Delinquent Boy by Turning Him into a Girl,"english, translated",hb,hb,doujinshi,original,,"unusual teeth, scar, big breasts, garter belt, gag, schoolboy uniform, group, glasses, nakadashi, sex toys, bondage, exhibitionism, defloration, double penetration, stockings, filming, mind break, rape, teacher, dilf, blowjob, gender bender, collar, gender morph, exposed clothing, rough translation, classroom",34,2025-08-02 00:14:12,2025-08-02 00:14:12,2025-08-03 14:00:45
587479,[汉化重置] [FUYUGOMORI (winte)] TEARDROPS (Pokémon) [阿龙的个人汉化],,TEARDROPS,"translated, chinese",winte,fuyugomori,doujinshi,pokemon,,,42,2025-08-02 00:16:45,2025-08-02 00:16:45,2025-08-03 14:00:45
587480,"[Tokonatsu Sanshouuo (Pegina)] Boku wa, Imouto no Yuuwaku ni Taekirezu Onaho to Iu Koto ni Shite Sex o Suru. | 我，没能抵挡住妹妹的诱惑把她当成了我的飞机杯和她发生了性关系。[Chinese] [吗喽汉化组] [Digital]",[常夏山椒魚 (ぺぎな)] 僕は、妹の誘惑に耐え切れずオナホということにしてセックスをする。[中国翻訳] [DL版],"Boku wa, Imouto no Yuuwaku ni Taekirezu Onaho to Iu Koto ni Shite Sex o Suru. | 我，没能抵挡住妹妹的诱惑把她当成了我的飞机杯和她发生了性关系。","translated, chinese",pegina,tokonatsu sanshouuo,doujinshi,original,,"big breasts, onahole, nakadashi, defloration, incest, sister, blindfold, sole female",53,2025-08-02 00:19:58,2025-08-02 00:19:58,2025-08-03 14:00:46
587481,[Ogu] Sore wa Omajinai [Digital],[おぐ] それわ おまじない [DL版],Sore wa Omajinai,japanese,ogu,,doujinshi,original,,"urethra insertion, cunnilingus, group, anal, sex toys, ffm threesome, brother, lolicon, incest, stockings, sister, sole male, bisexual, twintails, shimaidon, anal intercourse",24,2025-08-02 00:24:27,2025-08-02 00:24:27,2025-08-03 14:00:47
587482,[Ooi Masakazu / Inomaru] Isekai Furin ll ~Michibika Reshi Hitodzuma Tachi to Bukiyo Tensei Yuusha~vol 09 [English],[大井昌和×いのまる]   異世界不倫Ⅱ～導かれし人妻たちと不器用転生勇者～第09巻 [英訳],Isekai Furin llvol 09,"english, translated","inomaru, ooi masakazu",,manga,,,"big breasts, multi-work series",151,2025-08-02 00:33:33,2025-08-02 00:33:33,2025-08-03 14:00:47
587483,"[NT Labo (NT Robo)] Aisai, Doui no Ue, Netorare 3 ~Ogawa-ke no Baai~",[NTラボ (NTロボ)] 愛妻、同意の上、寝取られ 3 ～小川家の場合～,"Aisai, Doui no Ue, Netorare 3",japanese,nt robo,ntlabo,doujinshi,original,,"big breasts, netorare, ahegao, exhibitionism, multi-work series, sole female, pixie cut",234,2025-08-02 00:46:31,2025-08-02 00:46:31,2025-08-03 14:00:48
587484,[Anthology] Hataraku Onee-san no Himitsu ~Kyuujitsu wa Onsen e GO Hen~,[アンソロジー] 働くお姉さんの秘蜜〜休日は温泉へGO★編〜,Hataraku Onee-san no Himitsu,japanese,"oouso, karakuchi choucream, hiroshiki, tohyama eight",,manga,,,"big breasts, anthology",84,2025-08-02 00:51:42,2025-08-02 00:51:42,2025-08-03 14:00:49
587485,[Anthology] Hataraku Onee-san no Himitsu ~Kyonyuu Onee-san Ganbaru Hen~,[アンソロジー] 働くお姉さんの秘蜜〜巨乳お姉さんガンバる編〜,Hataraku Oneesan Ganbaru Hen~,japanese,"yumeno tanuki, yumoteliuce, raita",,manga,,,"big breasts, group, glasses, anthology, eye-covering bang",62,2025-08-02 00:55:23,2025-08-02 00:55:23,2025-08-03 14:00:50
587486,[Anyanko] Shoujo ni Narikake no Koro [Digital],[あにゃんこ] 少女になりかけの頃 [DL版],Shoujo ni Narikake no Koro,japanese,anyanko,,manga,,,"lolicon, defloration, tankoubon, blowjob, ponytail",207,2025-08-02 01:33:29,2025-08-02 01:33:29,2025-08-03 14:00:52
587487,[Wada Wau] さらぷにほっぺなぴゅありてぃ [Digital],[和田羽烏] さらぷにほっぺなぴゅありてぃ [DL版],さらぷにほっぺなぴゅありてぃ,japanese,wada wau,,manga,,,"big breasts, group, ffm threesome, lolicon, bunny girl, tankoubon, oppai loli, blowjob, randoseru, shotacon, twintails, multimouth blowjob, kodomo doushi",199,2025-08-02 02:10:24,2025-08-02 02:10:24,2025-08-03 14:00:53
587488,[Jikahatsudensho (flanvia)] Zange Ana | Confession Hole [English] [Kyuume] [Digital],[自家発電処 (flanvia)] 懺悔穴 [英訳] [DL版],Zange Ana | Confession Hole,"english, translated",flanvia,jikahatsudensho,doujinshi,original,,"sweating, big breasts, nun, triple penetration, glory hole, mmf threesome, group, uncensored, cheating, nakadashi, ahegao, anal, x-ray, multi-work series, double penetration, stockings, big penis, collar, sole female, sole male, crotch tattoo, beauty mark, hidden sex, anal intercourse",45,2025-08-02 02:13:12,2025-08-02 02:13:12,2025-08-03 14:00:54
587489,[Sannyuutei (Sannyuutei Shinta)] Ningenbenki ni naritai Shidzuka-chan,[三乳亭 (三乳亭しん太)] 人間便器になりたいシヅカちゃん,Ningenbenki ni naritai Shidzuka-chan,japanese,sannyuutei shinta,sannyuutei,doujinshi,original,,"ahegao, blowjob, body writing, deepthroat, sole female, anal intercourse",30,2025-08-02 02:15:13,2025-08-02 02:15:13,2025-08-03 14:00:56
587490,[ASM-P] Marida! Ofuro ni Ikou (Gundam Unicorn),[ASM-P] マリーダ!お風呂にいこう (ガンダムUC),Marida! Ofuro ni Ikou,japanese,,,doujinshi,gundam unicorn,"mineva lao zabi, marida cruz | ple twelve","females only, nudity only, asm-p",18,2025-08-02 02:17:02,2025-08-02 02:17:02,2025-08-03 14:00:57
587491,夜美奈漫画 from chapter 1 to 27 artist:ぶえん,,夜美奈漫画 from chapter 1 to 27 artist:ぶえん,japanese,,,doujinshi,sailor moon | bishoujo senshi sailor moon,"sailor moon | usagi tsukino, sailor jupiter | makoto kino, sailor mars | rei hino, sailor mercury | ami mizuno, sailor venus | minako aino, kou seiya, kou yaten",non-h,473,2025-08-02 02:42:52,2025-08-02 02:42:52,2025-08-03 14:00:59
587492,[Pometeor (Enotou)] Shiren mo toaru ainokatachi (Kid Icarus Uprising) [English] {Chin²},[ポメテオ (えのとう)]  試練もとある愛のカタチ  [英訳],Shiren mo toaru ainokatachi,"english, translated",enotou,pometeor,doujinshi,kid icarus,"pit, magnus","handjob, wings, nakadashi, anal, bike shorts, males only, yaoi, rimjob, blowjob, big penis, shotacon, mesuiki, anal intercourse, nipple stimulation",29,2025-08-02 02:48:53,2025-08-02 02:48:53,2025-08-03 14:01:01
587493,[THE L & 仿制 & 孔心] 单身即纵欲 | 單身即縱慾 1-8 [Chinese] [Ongoing],,单身即纵欲 | 單身即縱慾 1-8,"translated, chinese",,,manga,,,webtoon,128,2025-08-02 02:58:24,2025-08-02 02:58:24,2025-08-03 14:01:03
587494,[Anthology] Hataraku Onee-san no Himitsu ~Office Love Hen~,[アンソロジー] 働くお姉さんの秘蜜～オフィスラブ編～,Hataraku Onee-san no Himitsu,japanese,"fukuroumori, moonlight, izumiya otoha, yamada yuuya, kakino nashiko, karakuchi choucream | sakurai maki",,manga,,,"anthology, pantyhose",126,2025-08-02 03:05:44,2025-08-02 03:05:44,2025-08-03 14:01:04
587495,(CR29) [Saigado] Boku no Seinen Kouken-nin 3 [Chinese] [Decensored],(Cレヴォ29) [彩画堂] ボクの成年貢献人3 [中国翻訳] [無修正],Boku no Seinen Kouken-nin 3,"translated, chinese",saigado | ishoku dougen,saigado,doujinshi,original,,"uncensored, twintails",40,2025-08-02 03:08:07,2025-08-02 03:08:07,2025-08-03 14:01:05
587496,[くすりゆび] ギャルだからゴムつけなくていい、とか思ってない？,[くすりゆび] ギャルだからゴムつけなくていい、とか思ってない？,ギャルだからゴムつけなくていい、とか思ってない？,japanese,,,doujinshi,,,"big breasts, glasses, schoolgirl uniform, full color, gyaru, mosaic censorship, sole female, sole male",96,2025-08-02 03:13:39,2025-08-02 03:13:39,2025-08-03 14:01:06
587497,[Tanoshii Milkya-san (Milkya)] Maou-sama Wakarase! [English] [Digital],[たのしいみるくやさん (みるくや)] 魔王様わからせ! [英訳] [DL版],Maou-sama Wakarase!,"english, translated",,,doujinshi,,,"yaoi, rough translation",46,2025-08-02 03:16:55,2025-08-02 03:16:55,2025-08-03 14:01:07
587498,[Skyblue (Kuuki)] Yoru no Shigoto (Naruto),[Skyblue (Kuuki)] 夜の仕事 (NARUTO -ナルト-),Yoru no Shigoto,japanese,kuuki,skyblue,doujinshi,naruto,ino yamanaka,"big breasts, huge breasts, mosaic censorship, big penis, sole female, very long hair, eye-covering bang",15,2025-08-02 03:17:59,2025-08-02 03:17:59,2025-08-03 14:01:07
587499,[Skyblue (Kuuki)] LOSER (Shokugeki no Soma),[Skyblue (Kuuki)] LOSER (食戟のソーマ),LOSER,japanese,kuuki,skyblue,doujinshi,shokugeki no soma,erina nakiri,"big breasts, nakadashi, huge breasts, mosaic censorship, sole female",20,2025-08-02 03:19:22,2025-08-02 03:19:22,2025-08-03 14:01:08
587500,(C61) [Saigado] Boku no Seinen Kouken-nin 4 [Chinese] [Decensored],(C61) [彩画堂] ボクの成年貢献人4 [中国翻訳] [無修正],Boku no Seinen Kouken-nin 4,"translated, chinese",saigado | ishoku dougen,saigado,doujinshi,original,,uncensored,48,2025-08-02 03:22:02,2025-08-02 03:22:02,2025-08-03 14:01:09
587501,[Kokoro no Mama] Sake no ikioi de namaiki onna no erosuicchi ga ichatta NTR 18 (Dragon Ball Super),[ココロのまま] 酒の勢いで生意気女のエロスイッチが入ちゃったNTR18 (ドラゴンボール超),Sake no ikioi de namaiki onna no erosuicchi ga ichatta NTR 18,japanese,yuichi ishikawa | karafoo,kokoro no mama,doujinshi,dragon ball super,"vegeta, android 18","cheating, drunk, sole female, sole male",30,2025-08-02 03:23:51,2025-08-02 03:23:51,2025-08-03 14:01:09
587502,Naruho ToroTsuna 2 Sample,,Naruho ToroTsuna 2 Sample,japanese,,naruho-dou,doujinshi,"naruto, boruto","naruto uzumaki, tsunade, hinata hyuga","milf, cheating, huge breasts",6,2025-08-02 03:24:24,2025-08-02 03:24:24,2025-08-03 14:01:10
587503,[LFTN] 雪美のお相撲体験,,雪美のお相撲体験,japanese,lftn,,doujinshi,the idolmaster,yukimi sajo,sole female,20,2025-08-02 03:25:40,2025-08-02 03:25:40,2025-08-03 14:01:12
587504,[LFTN] P ni Te o Desaseyou!!! (THE IDOLM@STER CINDERELLA GIRLS),[LFTN] Pに手を出させよう!!! (アイドルマスター シンデレラガールズ),P ni Te o Desaseyou!!!,japanese,lftn,,doujinshi,the idolmaster,"risa matoba, haru yuuki",,22,2025-08-02 03:27:02,2025-08-02 03:27:02,2025-08-03 14:01:13
587505,[LFTN] Kikaku no Setsumei o Shiyou to Shita Yasaki... (THE IDOLM@STER CINDERELLA GIRLS),[LFTN] 企画の説明をしようとした矢先... (アイドルマスター シンデレラガールズ),Kikaku no Setsumei o Shiyou to Shita Yasaki...,japanese,lftn,,doujinshi,the idolmaster,chitose kurosaki,,17,2025-08-02 03:28:06,2025-08-02 03:28:06,2025-08-03 14:01:14
587506,[LFTN] Yoidore Yuuwaku Buchigire Toilet Pakopako Sex!!! (THE IDOLM@STER CINDERELLA GIRLS),[LFTN] 酔いどれ誘惑ブチギレトイレパコパコセックス!!! (アイドルマスター シンデレラガールズ),Yoidore Yuuwaku Buchigire Toilet Pakopako Sex!!!,japanese,lftn,,doujinshi,the idolmaster,sanae katagiri,,22,2025-08-02 03:29:29,2025-08-02 03:29:29,2025-08-03 14:01:15
587507,[LFTN] Risa-chan no Video (THE IDOLM@STER CINDERELLA GIRLS),[LFTN] 梨沙ちゃんのビデオ (アイドルマスター シンデレラガールズ),Risa-chan no Video,japanese,lftn,,doujinshi,the idolmaster,risa matoba,sole female,18,2025-08-02 03:30:35,2025-08-02 03:30:35,2025-08-03 14:01:16
587508,[LFTN] Miria no Onsen Report (THE IDOLM@STER CINDERELLA GIRLS),[LFTN] みりあの温泉リポート!! (アイドルマスター シンデレラガールズ),Miria no Onsen Report,japanese,lftn,,doujinshi,the idolmaster,miria akagi,onsen,16,2025-08-02 03:31:41,2025-08-02 03:31:41,2025-08-03 14:01:17
587509,[LFTN] Otoko o Yuuwaku!! Unit Taikousen (THE IDOLM@STER CINDERELLA GIRLS),[LFTN] 男を誘惑!! ユニット対抗戦 (アイドルマスター シンデレラガールズ),Otoko o Yuuwaku!! Unit Taikousen,japanese,lftn,,doujinshi,the idolmaster,,,23,2025-08-02 03:33:12,2025-08-02 03:33:12,2025-08-03 14:01:18
587510,[LFTN] Maekawa no Otete ni Taeraretara (THE IDOLM@STER CINDERELLA GIRLS),[LFTN] 前川のおててに耐えられたら (アイドルマスター シンデレラガールズ),Maekawa no Otete ni Taeraretara,japanese,lftn,,doujinshi,the idolmaster,miku maekawa,"sole female, sole male",16,2025-08-02 03:34:18,2025-08-02 03:34:18,2025-08-03 14:01:19
587511,[LFTN] Riamu to P no Akira Onanie (THE IDOLM@STER CINDERELLA GIRLS),[LFTN] りあむとPのあきらオナニー (アイドルマスター シンデレラガールズ),Riamu to P no Akira Onanie,japanese,lftn,,doujinshi,the idolmaster,riamu yumemi,collar,17,2025-08-02 03:35:25,2025-08-02 03:35:25,2025-08-03 14:01:20
587512,[LFTN] Inran!! SEX Travel!! (THE IDOLM@STER CINDERELLA GIRLS),[LFTN] 淫乱!! SEXトラベル!! (アイドルマスター シンデレラガールズ),Inran!! SEX Travel!!,japanese,lftn,,doujinshi,the idolmaster,"kaede takagaki, mizuki kawashima, miyu mifune",,55,2025-08-02 03:38:41,2025-08-02 03:38:41,2025-08-03 14:01:20
587513,[LFTN] ヴィヴィとノノの妊娠しないと出られない部屋,,ヴィヴィとノノの妊娠しないと出られない部屋,japanese,lftn,,doujinshi,,,,19,2025-08-02 03:39:52,2025-08-02 03:39:52,2025-08-03 14:01:21
587514,[LFTN] 洋子さんのちんちん応援,,洋子さんのちんちん応援,japanese,lftn,,doujinshi,,,,16,2025-08-02 03:40:55,2025-08-02 03:40:55,2025-08-03 14:01:22
587515,[LFTN] Miyu-san o Netoraseyou (THE IDOLM@STER CINDERELLA GIRLS),[LFTN] 美優さんを寝取らせよう (アイドルマスター シンデレラガールズ),Miyu-san o Netoraseyou,japanese,lftn,,doujinshi,the idolmaster,miyu mifune,,38,2025-08-02 03:43:08,2025-08-02 03:43:08,2025-08-03 14:01:22
587516,[LFTN] 触られすぎて大きくなるカヨコ,,触られすぎて大きくなるカヨコ,japanese,lftn,,doujinshi,blue archive,,nipple stimulation,16,2025-08-02 03:44:07,2025-08-02 03:44:07,2025-08-03 14:01:24
587517,[Makigai Ikko] Hitozuma Juurintou Ch. 1-7 [Chinese] [Digital],[巻貝一ヶ] 人妻蹂躙島 第1-7話 [中国翻訳] [DL版],Hitozuma Juurintou Ch. 1-7,"translated, chinese",makigai ikko,,manga,,,"big breasts, pregnant, netorare, cheating, anal",132,2025-08-02 03:51:55,2025-08-02 03:51:55,2025-08-03 14:01:24
587518,[gege] Ishtar,伊什塔尔,Ishtar,"english, translated",gege,,doujinshi,fate grand order,"shielder | mash kyrielight, ereshkigal, ishtar","futanari, strap-on, skinsuit, anal, sex toys, full color, double penetration, stockings, tiara, blowjob, collar, sole male, bisexual, gender change, rough translation",26,2025-08-02 03:53:41,2025-08-02 03:53:41,2025-08-03 14:01:26
587519,[Onihime] Kanjuku Sister - the sister of matured sweet Ch. 1-11 [Chinese],[鬼姫] 甘熟シスター 第1-11話 [中国翻訳],Kanjuku Sister11,"translated, chinese",onihime,,manga,,,"gag, glasses, bondage",177,2025-08-02 04:03:44,2025-08-02 04:03:44,2025-08-03 14:01:26
587520,[gege] Witch Irena,魔女伊蕾娜,Witch Irena,"english, translated",gege,,doujinshi,majo no tabitabi,elaina,"kissing, mmf threesome, witch, group, skinsuit, nakadashi, moral degeneration, anal, harem, x-ray, defloration, full color, drugs, double penetration, bunny girl, stockings, mind break, leotard, muscle, crotch tattoo, bald, very long hair, anal intercourse, exposed clothing, gender change, rough translation",33,2025-08-02 04:05:53,2025-08-02 04:05:53,2025-08-03 14:01:27
587521,[gege] My Balls Were Drained While Wearing Asuna's Skin,穿上白皮的我再被榨干,My Balls Were Drained While Wearing Asuna's Skin,"english, translated",gege,,doujinshi,blue archive,"asuna ichinose, karin kakudate","futanari, big breasts, skinsuit, nakadashi, dark skin, x-ray, bunny girl, pantyhose, gaping, leotard, collar, sole male, bisexual, kemonomimi, ponytail, gloves, very long hair, eye-covering bang, gender change, rough translation, futanarization",21,2025-08-02 04:07:18,2025-08-02 04:07:18,2025-08-03 14:01:28
587522,[Kuro Fn] Pakorare Award Ch. 1-7 [Chinese] [Digital],[クロFn] パコられアワード 第1-7話 [中国翻訳] [DL版],Pakorare Award Ch. 1-7,"translated, chinese",kuro fn,,manga,,,"big breasts, swimsuit, dark skin, ponytail",145,2025-08-02 04:15:56,2025-08-02 04:15:56,2025-08-03 14:01:29
587523,[LFTN] アザミの胸を狙う怪書,,アザミの胸を狙う怪書,japanese,lftn,,doujinshi,,,big breasts,31,2025-08-02 04:17:56,2025-08-02 04:17:56,2025-08-03 14:01:31
587524,[gege] Formidable,可畏,Formidable,"english, translated",gege,,doujinshi,azur lane,"illustrious, shikikan, formidable","maid, kissing, big breasts, skinsuit, yuri, full color, stockings, tribadism, sole male, twintails, gloves, gender change, rough translation",24,2025-08-02 04:19:24,2025-08-02 04:19:24,2025-08-03 14:01:32
587525,[gege] Revenge of the Possession Ninja,附身忍者的复仇,Revenge of the Possession Ninja,"english, translated",gege,,doujinshi,"naruto, boruto","hinata hyuga, boruto uzumaki","milf, big breasts, triple penetration, garter belt, group, netorare, masturbation, urination, breast feeding, nakadashi, anal, harem, mother, full color, incest, double penetration, stockings, possession, bukkake, voyeurism, anal intercourse, gender change, rough translation",29,2025-08-02 04:21:19,2025-08-02 04:21:19,2025-08-03 14:01:34
587526,[gege] The Young Lady,百变小姐姐,The Young Lady,"english, translated",gege,,doujinshi,original,,"kissing, big breasts, skinsuit, nakadashi, dark skin, x-ray, full color, muscle, gender change, rough translation",21,2025-08-02 04:22:42,2025-08-02 04:22:42,2025-08-03 14:01:34
587527,[SERIOUS GRAPHICS (ICE)] ICE BOXXX alternative 7 国語教師 間矢 響 第一話 増補版 [DL版] [空気系☆漢化],[SERIOUS GRAPHICS (ICE)] ICE BOXXX alternative 7 国語教師 間矢 響 第一話 増補版 [DL版] [空気系☆漢化],ICE BOXXX alternative 7 国語教師 間矢 響 第一話 増補版,"translated, chinese",ice,serious graphics,doujinshi,original,,"big breasts, glasses, blowjob face, blowjob",42,2025-08-02 04:25:24,2025-08-02 04:25:24,2025-08-03 14:01:35
587528,[Shiodome (Jisupeke)] Ekkusu no ama no shita wa dosukeberashi (Mega Man X),,Ekkusu no ama no shita wa dosukeberashi,japanese,,,doujinshi,mega man x | rockman x,"zero, mega man x | rockman x","big breasts, robot, stuck in wall, sole female, sole male, gender change",32,2025-08-02 04:27:33,2025-08-02 04:27:33,2025-08-03 14:01:36
587529,[Kara] 邪教徒の神殿,,邪教徒の神殿,japanese,kara,,doujinshi,original,,"squirting, sweating, big breasts, torture, monster girl, females only, ahegao, femdom, bondage, oil, tickling, dark skin, yuri, full color, multiple arms, no penetration, forced exposure, crying, nipple stimulation",20,2025-08-02 04:29:50,2025-08-02 04:29:50,2025-08-03 14:01:37
587530,[70 Nenshiki Yuukyuu Kikan (Ohagi-san)] Beatrice Brothel 3 [AI Translated] [Digital],ビアトリスの姫館 3,Beatrice Brothel 3,"english, translated",endou okito | ohagi-san,70 nenshiki yuukyuu kikan,doujinshi,,,rough translation,62,2025-08-02 04:33:45,2025-08-02 04:33:45,2025-08-03 14:01:38
587531,[Suga Shima Satoru] sorairo no shūmatsu | 天蓝色的周末 [Chinese] [马栏山汉化组] [Digital],[菅嶋さとる]空色の週末 [中国翻訳] [DL版],sorairo no shūmatsu | 天蓝色的周末,"translated, chinese",,,doujinshi,,,"scanmark, full color, males only, yaoi",24,2025-08-02 04:35:16,2025-08-02 04:35:16,2025-08-03 14:01:39
587532,[Shirokuma Danshi (Studio V)] Bodyguard ep2,,Bodyguard ep2,english,,gay comics,manga,,,"bdsm, uncensored, big ass, nakadashi, anal, hairy, big balls, full color, males only, yaoi, blowjob, big penis, facial hair, big muscles",16,2025-08-02 04:36:21,2025-08-02 04:36:21,2025-08-03 14:01:40
587533,[LFTN] 楓さんと童貞,,楓さんと童貞,japanese,lftn,,doujinshi,,,,28,2025-08-02 04:37:54,2025-08-02 04:37:54,2025-08-03 14:01:41
587534,[LFTN] 楓さんと童貞,,楓さんと童貞,japanese,lftn,,doujinshi,the idolmaster,kaede takagaki,sole female,20,2025-08-02 04:39:03,2025-08-02 04:39:03,2025-08-03 14:01:42
587535,[LFTN] 小さくなって仁奈ちゃんとせっくす,,小さくなって仁奈ちゃんとせっくす,japanese,lftn,,doujinshi,the idolmaster,nina ichihara,lolicon,16,2025-08-02 04:42:01,2025-08-02 04:42:01,2025-08-03 14:01:43
587536,[LFTN] 海の家で乱交パーティ!?,,海の家で乱交パーティ!?,japanese,lftn,,doujinshi,,,big breasts,17,2025-08-02 04:43:06,2025-08-02 04:43:06,2025-08-03 14:01:44
587537,[LFTN] 下校S○X,,下校S○X,japanese,lftn,,doujinshi,original,,"lolicon, stockings, randoseru, shotacon, twintails, kodomo doushi, kodomo only",15,2025-08-02 04:46:00,2025-08-02 04:46:00,2025-08-03 14:01:45
587538,[LFTN] 邂逅！！！,,邂逅！！！,japanese,lftn,,doujinshi,original,,"demon girl, sole male",72,2025-08-02 04:49:48,2025-08-02 04:49:48,2025-08-03 14:01:45
587539,[LFTN] 仁奈S◯X,,仁奈S◯X,japanese,lftn,,doujinshi,the idolmaster,nina ichihara,"lolicon, sole female",16,2025-08-02 04:52:32,2025-08-02 04:52:32,2025-08-03 14:01:46
587540,[LFTN] はーの手◯キカラオケ,,はーの手◯キカラオケ,japanese,lftn,,doujinshi,the idolmaster,hayate hisakawa,,16,2025-08-02 04:53:31,2025-08-02 04:53:31,2025-08-03 14:01:47
