ID,EN_TITLE,JP_TITLE,CLEAN_TITLE,LANGUAGE,ARTIST,GROUP_NAME,CATEGORY,PARODY,CHARACTER,TAGS,PAGES,UPLOAD_DATE,FORMATTED_DATE,SCRAPED_DATE
576778,(C86) [Key Trash (Hikagi Tatsuhiko)] RINGBELL01 (side-A) [Chinese] [张佳乐个人汉化],(C86) [KEY TRASH (緋鍵龍彦)] RINGBELL01 (side-A) [中国翻訳],RINGBELL01,"translated, chinese",hikagi tatsuhiko,key trash,doujinshi,original,,"group, ffm threesome, femdom, harem, footjob, pantyhose",26,2025-06-03 00:21:57,2025-06-03 00:21:57,2025-06-04 14:05:46
576779,[Salt Peanuts (Niea)] Cry Baby Cry part.3 (Toaru Kagaku no Railgun)[Chinese] [流氓兔机翻汉化],[Salt Peanuts (にえあ)] Cry Baby Cry part.3 (とある科学の超電磁砲) [中国翻訳],Cry Baby Cry part.3,"translated, chinese",niea,salt peanuts,doujinshi,toaru project,"ruiko saten, kazari uiharu, mikoto misaka","multi-work series, stockings, dilf, rough translation",41,2025-06-03 00:25:46,2025-06-03 00:25:46,2025-06-04 14:05:47
576780,[Enokoro Kurage (NOSA)] Watashi no Nozomu Koto (Love Live! Nijigasaki High School Idol Club) [English] [YuushaNi] [Digital],[えのころくらげ (NOSA)] 私の望むこと (ラブライブ!虹ヶ咲学園スクールアイドル同好会) [英訳] [DL版],Watashi no Nozomu Koto,"english, translated",nosa,enokoro kurage,doujinshi,love live nijigasaki high school idol club,shioriko mifune,"schoolgirl uniform, nakadashi, blowjob, sole female, sole male",20,2025-06-03 00:28:00,2025-06-03 00:28:00,2025-06-04 14:05:48
576781,[Tareme Shijou Shugi (Kamanbeer)] sweet nuts (Blue Archive) [Chinese] [欶澜汉化组] [Digital],[垂れ目至上主義 (かまんべーる)] sweet nuts (ブルーアーカイブ) [中国翻訳] [DL版],sweet nuts,"translated, chinese",,,doujinshi,blue archive,"natsu yutori, sensei","impregnation, sole female, sole male, hair buns, halo",20,2025-06-03 00:29:56,2025-06-03 00:29:56,2025-06-04 14:05:49
576782,[Nakaura Tomoki] Ueno-kun wa Kaihatsu-zumi Dai 29 wa | Ueno-kun Has Been Developed Chapter 29 [English],[中浦トモキ] 上野くんは開発済み 第29話 [英訳],Uenozumi Dai 29 wa | Ueno-kun Has Been Developed Chapter 29,"english, translated",nakaura,,manga,,,"glasses, masturbation, sex toys, multi-work series, gokkun, tomboy, sole female, sole male",20,2025-06-03 00:31:39,2025-06-03 00:31:39,2025-06-04 14:05:51
576783,[Dokuneko Noil] Tsukioka Kogane ni Warui Koto o Suru Hanashi (Kouhen) | Tsukioka Kogane Has a Very Bad Night (Part 2) (THE iDOLM@STER: Shiny Color) [English] [Fap It Scans] [Decensored],[毒猫ノイル] 月岡恋鐘に悪いことをする話(後編) (アイドルマスター シャイニーカラーズ) [英訳] [無修正],Tsukioka Kogane ni Warui Koto o Suru Hanashi| Tsukioka Kogane Has a Very Bad Night,"english, translated",dokuneko noil,,doujinshi,the idolmaster,"producer, kogane tsukioka","business suit, kissing, big breasts, uncensored, nakadashi, x-ray, full color, multi-work series, drunk, paizuri, rape, impregnation, sole female, sole male",16,2025-06-03 00:33:09,2025-06-03 00:33:09,2025-06-04 14:05:52
576784,[Kurokoya (Shikigami Kuroko)] Business no Tame ni Ochinchin o Hayashimashita wa!! (Princess Connect! Re:Dive) [Chinese] [廉价汉化组] [Digital],[くろこ屋 (式神くろ子)] ビジネスのためにオチンチンを生やしましたわ!! (プリンセスコネクト!Re:Dive) [中国翻訳] [DL版],Business no Tame ni Ochinchin o Hayashimashita wa!!,"translated, chinese",shikigami kuroko,kurokoya,doujinshi,princess connect,"saren sasaki, akino toudou","futanari, elf, stockings, dickgirl on female",27,2025-06-03 00:35:35,2025-06-03 00:35:35,2025-06-04 14:05:53
576785,[Ame Ramune (Amecha)] Piper vs Saimin Oji-san (Zenless Zone Zero) [English] [Digital],[アメラムネ (アメちゃ)] パイパーvsマッサージオジサン (ゼンレスゾーンゼロ) [英訳] [DL版],Piper vs Saimin Oji-san,"english, translated",amecha,ame ramune,doujinshi,zenless zone zero,piper wheel,"nakadashi, blowjob face, lolicon, stockings, dilf, blowjob, big penis, sole female, sole male, gloves",31,2025-06-03 00:42:34,2025-06-03 00:42:34,2025-06-04 14:05:54
576786,[Coburaco] Toshokan de Benkyou Shiteitara Itsumo Kuru Gal JK ni... | 在圖書館K書時被常來的辣妹JK… [Chinese] [Digital],[みっつまん] 図書館で勉強していたらいつも来るギャルJKに… [中国翻訳] [DL版],Toshokan de Benkyou Shiteitara Itsumo Kuru Gal JK ni... | 在圖書館K書時被常來的辣妹JK…,"translated, chinese",coburaco,mittsuman,doujinshi,original,,"virginity, big breasts, glasses, schoolgirl uniform, gyaru, sole female",25,2025-06-03 00:44:58,2025-06-03 00:44:58,2025-06-04 14:05:55
576787,[Mittsuman (glycogen)] Kino no Tomo wa Kyou no SeFri | 昨天的朋友是今天的砲友 [Chinese] [Digital],[みっつまん (グリコーゲン)] 昨日の友は今日のセフレ [中国翻訳] [DL版],Kino no Tomo wa Kyou no SeFri | 昨天的朋友是今天的砲友,"translated, chinese",glycogen,mittsuman,doujinshi,original,,"big breasts, schoolboy uniform, schoolgirl uniform, condom, defloration, multi-work series, sole female, sole male",37,2025-06-03 00:48:17,2025-06-03 00:48:17,2025-06-04 14:05:55
576788,"[Mittsuman (Mittsuman, Dosukebe Kojikimaru)] Kyouyuu Toilet de JK ni Sakuseisarete Shofuki Shichatta Ryman no Hanashi. | 在公廁被JK搾精並讓她潮吹的故事 [Chinese] [Digital]",[みっつまん (みっつまん、ドスケベ乞食丸)] 共有トイレでJKに搾精されて潮吹きシちゃったリーマンの話。 [中国翻訳] [DL版],Kyouyuu Toilet de JK ni Sakuseisarete Shofuki Shichatta Ryman no Hanashi. | 在公廁被JK搾精並讓她潮吹的故事,"translated, chinese","mittsuman, dosukebe kojikimaru",mittsuman,doujinshi,original,,"nakadashi, full color, gyaru, mosaic censorship, sole female, sole male, twintails",24,2025-06-03 00:50:26,2025-06-03 00:50:26,2025-06-04 14:05:57
576789,[Tanuking Sleep (Drachef)] Tomodachi no Mama to Hame Makuru Boku [English] [Digital] [CulturedCommissions],[たぬきんぐすりーぷ (ドラチェフ)] 友達のママとハメまくる僕 [英訳] [DL版],Tomodachi no Mama to Hame Makuru Boku,"english, translated",drachef,tanuking sleep,doujinshi,original,,"milf, kissing, big breasts, bbw, big ass, cheating, nakadashi, hairy, x-ray, big areolae, impregnation, blowjob, big penis, shotacon, sole female, beauty mark, hidden sex",34,2025-06-03 00:57:43,2025-06-03 00:57:43,2025-06-04 14:05:58
576790,[BOSS Chin] Ashiete♥Amuru (New-ring♥TOIRO) [English] [CulturedCommissions],[BOSS珍] あしえて♥アムール (乳輪♥十色) [英訳],Ashiete♥Amuru,"english, translated",boss chin,,doujinshi,original,,"big breasts, big nipples, glasses, big areolae, shotacon, hidden sex, manga, smalldom",19,2025-06-03 01:02:07,2025-06-03 01:02:07,2025-06-04 14:05:59
576791,"[Kaze no Gotoku! (Fubuki Poni, Mittsuman)] Namaiki na Papakatsu Joshikousei ni Oji-san ga Tappuri Shitsukete Agemashita. | 對厚顏無恥的援交JK施以嚴厲管教 [Chinese] [Digital]",[風のごとく! (風吹ぽに、みっつまん)] 生意気なパパ活女子校生におじさんがたっぷり躾けてあげました。 [中国翻訳] [DL版],Namaiki na Papakatsu Joshikousei ni Oji-san ga Tappuri Shitsukete Agemashita. | 對厚顏無恥的援交JK施以嚴厲管教,"translated, chinese","kazabuki poni, mittsuman",kaze no gotoku,doujinshi,original,,"glasses, schoolgirl uniform, prostitution, bondage, gyaru, mosaic censorship, dilf, sole female, sole male",23,2025-06-03 01:04:15,2025-06-03 01:04:15,2025-06-04 14:06:00
576792,[Toriko Henkyou (Gumi)] Zatsui Suetsumu Hana (Rakudai Ninja Rantarou) [Digital],[虜辺境 (ぐみ)] 雑伊末摘花 (落第忍者乱太郎) [DL版],Zatsui Suetsumu Hana,japanese,gumi,toriko henkyou,doujinshi,nintama rantarou,"isaku zenpouji, konnamon zatto","ninja, males only, yaoi",14,2025-06-03 01:05:43,2025-06-03 01:05:43,2025-06-04 14:06:01
576793,[Nanao Yukiji] Mesu no Honnou ni Sakaraenai [Chinese] [漢化組漢化組×我尻故我在 & 就變態翻譯組一人樣 x 我尻故我在個人漢化 & MingZ同学个人汉化 &钢华团汉化组] [Digital],[七尾ゆきじ] 雌の本能に逆らえない [中国翻訳] [DL版],Mesu no Honnou ni Sakaraenai,"translated, chinese",nanao yukiji,,manga,,,"inseki, milf, big breasts, pregnant, netorare, cheating, ahegao, blowjob face, mother, hairy, incest, tankoubon, impregnation, blowjob",203,2025-06-03 01:22:34,2025-06-03 01:22:34,2025-06-04 14:06:02
576794,[Ahemaru] Suyasuya Curry Rice (Oozora Subaru),[アヘ丸] すやすやカレーライス (大空スバル),Suyasuya Curry Rice,japanese,ahemaru | henrik,,doujinshi,hololive,oozora subaru,"squirting, cunnilingus, mmf threesome, group, sleeping, ghost, x-ray, double penetration, filming, sole female, vtuber",36,2025-06-03 01:25:38,2025-06-03 01:25:38,2025-06-04 14:06:03
576795,[Kamoshika Steak (Kamoshika)] Inran Majuu Kouryakusen (Blue Archive) [Chinese] [白杨汉化组] [Digital],[かもしかステーキ (かもしか)] 淫乱魔獣攻略戦 (ブルーアーカイブ) [中国翻訳] [DL版],Inran Majuu Kouryakusen,"translated, chinese",kamoshika,kamoshika steak,doujinshi,blue archive,"sensei, kazusa kyouyama","catgirl, sole female, sole male, kemonomimi, gloves, halo",28,2025-06-03 01:28:06,2025-06-03 01:28:06,2025-06-04 14:06:04
576796,[Marushamo] Chiisaku Sarete Bakunyuu Shiyounin Elf ni Shiboritsukusareru,[まるしゃも] 小さくされて爆乳使用人エルフに搾り尽くされる,Chiisaku Sarete Bakunyuu Shiyounin Elf ni Shiboritsukusareru,japanese,marushamo,,doujinshi,original,,"elf, shrinking, big breasts, femdom, minigirl, giantess, miniguy, very long hair",62,2025-06-03 01:33:14,2025-06-03 01:33:14,2025-06-04 14:06:05
576797,(C104) [Back Rash (Mya Ken)] Himitsu no Game Seisaku Alice Hen | 秘密的游戏制作2 爱丽丝篇 (Blue Archive) [Chinese] [欶澜汉化组],(C104) [Back Rash (みゃーけん)] 秘密のゲーム制作2 アリス編 (ブルーアーカイブ) [中国翻訳],Himitsu no Game Seisaku Alice Hen | 秘密的游戏制作2 爱丽丝篇,"translated, chinese",,,doujinshi,blue archive,"alice tendou, sensei","very long hair, halo",30,2025-06-03 01:36:02,2025-06-03 01:36:02,2025-06-04 14:06:07
576798,[テンパりんぐ (トキマチ★エイセイ)] キサラさんの爆釣おチンポフィッシング (tales of arise) [79%汉化组],[テンパりんぐ (トキマチ★エイセイ)] キサラさんの爆釣おチンポフィッシング (tales of arise) [79%汉化组],キサラさんの爆釣おチンポフィッシング,"translated, chinese",tokimachi eisei,temparing,doujinshi,tales of arise,kisara,"futanari, sole dickgirl, full-packaged futanari",14,2025-06-03 01:37:41,2025-06-03 01:37:41,2025-06-04 14:06:08
576799,[Rimu Chanchi (Uni Cream Korokke)] Senpai no Kakkoii Oshasei Misete kudasai,[りむちゃんち (うにクリームコロッケ)] 先輩のかっこいいお射精 見せてください♡,Senpai no Kakkoii Oshasei Misete kudasai,japanese,rimukoro,,doujinshi,original,,"handjob, sweating, leg lock, unusual pupils, schoolboy uniform, glasses, schoolgirl uniform, nakadashi, femdom, x-ray, small breasts, blowjob, sole female, sole male, smalldom, rimu chanchi",52,2025-06-03 01:42:08,2025-06-03 01:42:08,2025-06-04 14:06:09
576800,[Mimonel] Reijou Succubus no Shojo Sotsugyou Kinenbi,[ミモネル] 令嬢サキュバスの処女卒業記念日♥,Reijou Succubus no Shojo Sotsugyou Kinenbi,japanese,mimonel,,doujinshi,original,,"wings, big breasts, glasses, demon girl, hairy, x-ray, full color, multi-work series, muscle, first person perspective, sole male, horns, tail, cumflation",13,2025-06-03 01:43:30,2025-06-03 01:43:30,2025-06-04 14:06:10
576801,"[Dodameyasan (Sasakuma Kyouta)] Watashi wa Gehin de Fuketsu na Saimin Sennou Nanka ni, Kusshi na......Nhiii!?",[ドダメ屋さん (ささくまきょうた)] 私は下品で不潔な催眠洗脳なんかに、屈しなっ......んひぃいっ♡♡♡!?,"Watashi wa Gehin de Fuketsu na Saimin Sennou Nanka ni, Kusshi na......Nhiii!?",japanese,sasakuma kyouta,dodameyasan,doujinshi,original,,"handjob, kissing, big breasts, magical girl, schoolgirl uniform, nakadashi, ahegao, dark skin, defloration, mind control, rape, leotard, blowjob, bbm, sole female, sole male",38,2025-06-03 01:46:48,2025-06-03 01:46:48,2025-06-04 14:06:11
576802,[Chimiya] 土妹子的汗水武器 [Chinese] [欶澜汉化组],[ちみや] 地味子ちゃんの汗ヌレ武器 [中国翻訳],土妹子的汗水武器,"translated, chinese",chimiya,,manga,,,"sweating, full censorship, wet clothes",18,2025-06-03 01:48:41,2025-06-03 01:48:41,2025-06-04 14:06:12
576803,"[Gyuumagyuuma (Umadura, Ushiking)] Hitozuma Otokonoko to Seishori no Tsudoi 3 | 人妻伪娘的性处理集会3 [Chinese] [贱兔汉化组]",[ぎゅうまぎゅうま (ウマデュラ、ウシキング)] 人妻男の娘と性処理の集い3 [中国翻訳],Hitozuma Otokonoko to Seishori no Tsudoi 3 | 人妻伪娘的性处理集会3,"translated, chinese","umadura grenouille, ushiking",gyuumagyuuma,doujinshi,original,,"handjob, big breasts, group, prostate massage, nakadashi, anal, sex toys, eyemask, crossdressing, x-ray, full color, yaoi, rimjob, tomgirl, blowjob, feminization, josou seme, small penis, mesuiki, eye-covering bang, anal intercourse",41,2025-06-03 01:52:25,2025-06-03 01:52:25,2025-06-04 14:06:13
576804,[Doushia (Terasu MC)] Kibou Idenshi no Zetsubou-teki Konzetsu (Danganronpa) [DL版],[ドーシア (テラスMC)] 希望遺伝子の絶望的根絶 (ダンガンロンパ) [DL版],Kibou Idenshi no Zetsubou-teki Konzetsu,japanese,terasu mc,doushia,doujinshi,danganronpa,"kyouko kirigiri, aoi asahina, makoto naegi","sweating, big breasts, chastity belt, group, netorare, nakadashi, dark skin, mind break, ponytail, small penis, very long hair",19,2025-06-03 01:54:10,2025-06-03 01:54:10,2025-06-04 14:06:14
576805,[Onigawara Keruri] TS Gakuen no Choujou | TS后登上学院的顶点(COMIC 真激 2025年5月号)[贱兔汉化组x禁漫天堂],[鬼瓦けるり]TS 学園の頂点(COMIC 真激 2025年5月号)[中文翻译],TS Gakuen no Choujou | TS后登上学院的顶点,"translated, chinese",onigawara keruri,,manga,,,"big breasts, schoolboy uniform, netorare, schoolgirl uniform, nakadashi, sex toys, femdom, stockings, gender change",33,2025-06-03 01:56:58,2025-06-03 01:56:58,2025-06-04 14:06:15
576806,[Taiga Rei] Ten'i Saki wa Dragon no Ikenie Nadoko Route ~ Harami Ochiru TS Knight Louisa ~ | 穿越成巨龙的祭品苗床～沦陷孕堕的TS骑士露易莎～[賤兔漢化組x禁漫天堂],[太賀零]転移先はドラゴンの生贄苗床ルート～孕み堕ちるTS騎士ルイーザ～[中文翻译],Ten'i Saki wa Dragon no Ikenie Nadoko Route| 穿越成巨龙的祭品苗床～沦陷孕堕的TS骑士露易莎～,"translated, chinese",taiga rei,,manga,,,"big breasts, corruption, humiliation, pregnant, group, dragon, bestiality, nakadashi, defloration, mind break, rape, big penis, eggs, gender change, vaginal birth",29,2025-06-03 02:03:23,2025-06-03 02:03:23,2025-06-04 14:06:16
576807,[Dodome Branko-dou (Dodome Branko)] Danchi no Tomodachi [Chinese] [vk机翻] [Digital],[百々目ぶらんこ堂 (百々目ぶらんこ)] 団地の友達 [中国翻訳] [DL版],Danchi no Tomodachi,"translated, chinese",dodome branko,,doujinshi,original,,"handjob, masturbation, nakadashi, anorexic, lolicon, tomboy, blowjob, shotacon, sole female, sole male, no penetration, rough translation, nipple stimulation, kodomo doushi, kodomo only",61,2025-06-03 02:16:43,2025-06-03 02:16:43,2025-06-04 14:06:17
576808,[490] In Shou Shitsu Dai [chinese],[490] 因小失大 [中国翻译],In Shou Shitsu Dai,"translated, chinese",490,,doujinshi,original,,"schoolgirl uniform, mind control, breast expansion, ass expansion",11,2025-06-03 02:17:56,2025-06-03 02:17:56,2025-06-04 14:06:19
576809,"[ZUZUZU (Kamiya Zuzu)] Pien na Ore, Shachiku na Watashi. ~Kinou made Black datta noni, Okitara Sekai ga Pink ni Somattete Kusa Nan da ga~ - A pien me, A slave me. It was a black company until yesterday, but when i woke up, the world was dyed in Plonk and i can't help but laugh [Chinese]",[ズズズ (神谷ズズ)] ぴえんな俺、社畜な私。〜昨日までブラックだったのに、起きたら世界がピンクに染まってて草なんだが〜 [中国翻訳],"Pien na Ore, Shachiku na Watashi.- A pien me, A slave me. It was a black company until yesterday, but when i woke up, the world was dyed in Plonk and i can't help but laugh","translated, chinese",kamiya zuzu,zuzuzu,doujinshi,original,,"leg lock, body swap, sole female, gender change, extraneous ads",53,2025-06-03 02:22:42,2025-06-03 02:22:42,2025-06-04 14:06:20
576810,[AhrStudio] April 2022 Plan A,,April 2022 Plan A,chinese,,ahr studio,doujinshi,original,,yaoi,25,2025-06-03 02:25:02,2025-06-03 02:25:02,2025-06-04 14:06:21
576811,[Wet Sand (Mochiba Hachi)] Zhu Yuan Senzoku Iankan ni Ochiru (Zenless Zone Zero) [Chinese] [Digital],[ウェットサンド (餅場はち)] 朱鳶専属慰安官に堕ちる (ゼンレスゾーンゼロ) [中国翻訳] [DL版],Zhu Yuan Senzoku Iankan ni Ochiru,"translated, chinese",mochiba hachi,wet sand,doujinshi,zenless zone zero,zhu yuan,"big breasts, crotch tattoo, extraneous ads",28,2025-06-03 02:27:35,2025-06-03 02:27:35,2025-06-04 14:06:22
576812,[くまのみ] 大人妊婦化TSFシングルマザー熟女娘 [Chinese] [弱智酱( ﾟ∀。)个人机翻汉化],,大人妊婦化TSFシングルマザー熟女娘,"translated, chinese",kumanomi,,doujinshi,original,,"big breasts, pregnant, breast feeding, lactation, gender change, rough translation",4,2025-06-03 02:28:20,2025-06-03 02:28:20,2025-06-04 14:06:23
576813,"[Kanariko] Tantei no tatakai (Tantei wa Mou, Shindeiru.)",[カナリコ] 探偵の闘い (探偵はもう、死んでいる。),Tantei no tatakai,japanese,kanariko,,doujinshi,tantei wa mou shindeiru.,siesta,"full color, mosaic censorship, sole female, nudity only",15,2025-06-03 02:29:47,2025-06-03 02:29:47,2025-06-04 14:06:25
576814,[Chinjao Girl. (Special G)] [Hihou] Kaisha no Iki Okure BBA Haramaseta [Chinese] [黑锅汉化组] [Digital],[チンジャオ娘。 (すぺしゃるじー)] 【悲報】会社の行き遅れBBA孕ませた [中国翻訳] [DL版],Kaisha no Iki Okure BBA Haramaseta,"translated, chinese",special g,chinjao girl.,doujinshi,original,,"business suit, milf, sweating, big breasts, glasses, story arc, cheating, condom, blowjob face, kimono, defloration, full color, lactation, pantyhose, drunk, lingerie, mosaic censorship, rape, impregnation, inverted nipples, blowjob, chikan, sole female, sole male, beauty mark, hidden sex",115,2025-06-03 02:39:32,2025-06-03 02:39:32,2025-06-04 14:06:26
576815,[niwaniwa(大庭アキル)] 転生モブはBLゲーの続編世界でハーレムルートに突入しました! [中国翻译],,転生モブはBLゲーの続編世界でハーレムルートに突入しました!,"translated, chinese",oova akiru,,doujinshi,original,,"multi-work series, males only, yaoi",76,2025-06-03 02:46:53,2025-06-03 02:46:53,2025-06-04 14:06:27
576816,[Haadan (Non)] Amane-kun no Fuman | 天音君的不满 [Chinese] [Digital],[はあだん (のん)] 天音くんの不満 [中国翻訳] [DL版],Amane-kun no Fuman | 天音君的不满,chinese,non,haadan,doujinshi,original,,"schoolboy uniform, anal, males only, yaoi, tomgirl, anal intercourse",30,2025-06-03 02:50:20,2025-06-03 02:50:20,2025-06-04 14:06:28
576817,[Iketatsu Shizuru] Yometori Houinjou | Bride-Taking Lewd Scroll (ANGEL Club 2025-04) [English] [Apricot] [Digital],嫁取り淫法帖 (ANGEL 倶楽部 2025年4月号) [英語翻訳] [DL版],Yometori Houinjou | Bride-Taking Lewd Scroll,"english, translated",iketatsu shizuru,,manga,,,"big breasts, group, full censorship, nakadashi, ahegao, sex toys, ffm threesome, bondage, mind break, impregnation, muscle, big penis, kunoichi, bisexual, ponytail",21,2025-06-03 02:52:54,2025-06-03 02:52:54,2025-06-04 14:06:29
576818,Strange Records 1,,Strange Records 1,english,meowwithme,,doujinshi,original,,"transformation, drugs, feminization, gender change",23,2025-06-03 02:54:53,2025-06-03 02:54:53,2025-06-04 14:06:30
576819,[FLAT (Yukyu Ponzu)] Mitsu ni Kuwareru [Chinese] [白杨汉化组] [Digital],[FLAT (悠久ポン酢)] 蜜に喰われる [中国翻译] [DL版],Mitsu ni Kuwareru,"translated, chinese",yukyu ponzu,flat,doujinshi,original,,"glasses, femdom, incest, sister, shotacon",38,2025-06-03 03:03:21,2025-06-03 03:03:21,2025-06-04 14:06:31
576820,[冷凍くん (0等)] 第一王子のバレてはいけない初体験,,第一王子のバレてはいけない初体験,japanese,reitou,reitokun,doujinshi,original,,"kissing, group, anal, dark skin, males only, double penetration, yaoi, tomgirl, anal intercourse",48,2025-06-03 03:08:49,2025-06-03 03:08:49,2025-06-04 14:06:32
576821,[Laniporte (Wamibanta)] Ima wa mada Ohiru made - Now Until Noon Still. [Digital],[ラニポルテ (わみばんた)] 今はまだお昼まで [DL版],Ima wa mada Ohiru made - Now Until Noon Still.,japanese,wamibanta,laniporte,doujinshi,original,,"anal, males only, yaoi, shotacon, small penis, anal intercourse",28,2025-06-03 03:15:23,2025-06-03 03:15:23,2025-06-04 14:06:33
576822,[Cat Run (Kyarine)] Kamattemorawarenai node Shikikan no Heya de Onanie Shichaimashita (Girls' Frontline),[Cat Run (きゃりね)] 構ってもらえないので指揮官の部屋でオナニーしちゃいました♡ (少女前線),Kamattemorawarenai node Shikikan no Heya de Onanie Shichaimashita,japanese,kyarine | suzune kanon,cat run,doujinshi,girls frontline,fn five-seven,"masturbation, ponytail",12,2025-06-03 03:16:39,2025-06-03 03:16:39,2025-06-04 14:06:34
576823,[Haikibutsu (Yaza Daichi)] Kinbaku Josou Ani e no Retsujou [Digital],[廃棄物 (矢座だいち)] 緊縛女装 兄への劣情 [DL版],Kinbaku Josou Ani e no Retsujou,japanese,daichi,haikibutsu,doujinshi,original,,"gag, schoolboy uniform, anal, bondage, crossdressing, males only, yaoi, tomgirl, collar, ponytail, anal intercourse",24,2025-06-03 03:19:44,2025-06-03 03:19:44,2025-06-04 14:06:35
576824,[oat & meal] Hoshikunaru Futago no Itoko Imouto Hen | Can't Help Wanting Them: Twin Cousins – Younger Sister Arc [English] [Fated Circle],[おーと&みぃる] 欲しくなる 双子のいとこ 妹編 [英訳],Hoshikunaru Futago no Itoko Imouto Hen | Can't Help Wanting Them: Twin Cousins – Younger Sister Arc,"english, translated",,oat and meal,doujinshi,original,,"full censorship, cheating, multi-work series, sole female, sole male",17,2025-06-03 03:21:41,2025-06-03 03:21:41,2025-06-04 14:06:37
576825,[Kakuzato-ichi (Kakuzatou)] Futanari Trap Room [English] [ジゲッチ] [Digital],[核座頭市 (核座頭)] ふたなりトラップルーム [英訳] [DL版],Futanari Trap Room,"english, translated",kakuzatou,kakuzato-ichi,doujinshi,original,,"futanari, elf, big breasts, glasses, big ass, condom, nakadashi, huge breasts, shemale, dark skin, full color, paizuri, mosaic censorship, blowjob, sole female, sole dickgirl, full-packaged futanari, dickgirl on female, futanarization",39,2025-06-03 03:25:08,2025-06-03 03:25:08,2025-06-04 14:06:38
576826,[Orgasm Slap (Ichino Milk)] Senpai no Yume o Kanaete Ageru Kouhai no Hanashi (Genshin Impact),[オルガムスラップ (いちのみるく)] 先輩の夢を叶えてあげる後輩の話 (原神),Senpai no Yume o Kanaete Ageru Kouhai no Hanashi,japanese,ichino milk,orgasm slap,doujinshi,genshin impact,"alhaitham, kaveh","males only, yaoi",34,2025-06-03 03:28:02,2025-06-03 03:28:02,2025-06-04 14:06:39
576827,[Orgasm Slap (Ichino Milk)] Enkaku Kyousei Zetchou Mesu Ochi Hon (Genshin Impact),[オルガムスラップ (いちのみるく)] 遠隔強制絶頂メス堕ち本 (原神),Enkaku Kyousei Zetchou Mesu Ochi Hon,japanese,ichino milk,orgasm slap,doujinshi,genshin impact,alhaitham,"males only, yaoi",30,2025-06-03 03:30:42,2025-06-03 03:30:42,2025-06-04 14:06:40
576828,[Ichino Milk] Alhazen to Piston Machine no Manga (Genshin Impact),[いちのみるく] 赤ゼンとピストンマシンの漫画 (原神),Alhazen to Piston Machine no Manga,japanese,ichino milk,,doujinshi,genshin impact,"alhaitham, kaveh","males only, yaoi",16,2025-06-03 03:32:29,2025-06-03 03:32:29,2025-06-04 14:06:41
576829,蛇の隠れ祠 (Uncomplete),,蛇の隠れ祠,japanese,getdrain,,doujinshi,original,,"artistcg, kimono",5,2025-06-03 03:33:04,2025-06-03 03:33:04,2025-06-04 14:06:42
576830,[Melonbooks (Rico)] Melon de Ero Ero [English] [NNLT4],[メロンブックス (Rico)] メロンでエロエロ [英訳],Melon de Ero Ero,"english, translated",rico,,doujinshi,original,,"group, glasses, lolicon, stockings, mosaic censorship, sole male",25,2025-06-03 03:38:29,2025-06-03 03:38:29,2025-06-04 14:06:43
576831,[Minamo Zuki (Kanna)] Kanojo wa Hajime kara Ochiteita | 她从一開始就墮落了 [Chinese] [Amerins漢化],[水面月 (カンナ)] 彼女は初めから墮ちていた [中国翻訳],Kanojo wa Hajime kara Ochiteita | 她从一開始就墮落了,"translated, chinese",kanna | kisaragi kanna,minamo zuki,doujinshi,original,,"big breasts, bbw, netorare, schoolgirl uniform, nakadashi, stockings, blackmail, sole female, sole male, gloves, eye-covering bang",46,2025-06-03 03:42:37,2025-06-03 03:42:37,2025-06-04 14:06:44
576832,(C102) [Hoshizora Sutekki (Kisaragi Nana)] Servant Namahame Seikatsu | Raw Sex Life With a Servant (Fate/Grand Order) [English] [Shiro Translation],(C102) [星空ステッキ (如月なな)] サーヴァント生ハメ性活 (Fate/Grand Order) [英訳],Servant Namahame Seikatsu | Raw Sex Life With a Servant,"english, translated",kisaragi nana,hoshizora sutekki,doujinshi,fate grand order,"shielder | mash kyrielight, boudica, bb, gudao | ritsuka fujimaru, barghest, koyanskaya","big breasts, pregnant, nakadashi, x-ray, stockings, impregnation, sole male, kemonomimi, eye-covering bang",36,2025-06-03 03:46:03,2025-06-03 03:46:03,2025-06-04 14:06:46
