ID,EN_TITLE,JP_TITLE,CLEAN_TITLE,LANGUAGE,ARTIST,GROUP_NAME,CATEGORY,PARODY,CHARACTER,TAGS,PAGES,UPLOAD_DATE,FORMATTED_DATE,SCRAPED_DATE
612740,(8wora) Super Goddess VS Space Superhuman,(8ヲラ) 超女神VS宇宙超人,Super Goddess VS Space Superhuman,japanese,8wora,,doujinshi,original,,"big breasts, ryona, monster, prolapse, muscle, stomach deformation, fisting, sole female, sole male, cuntbusting",23,2025-12-01 20:33:37,2025-12-01 20:33:37,2025-12-02 14:02:14
612741,[Stapspats (Hisui)] Gensoukyou Futanari Chinpo Wrestling 9 Alice & Marisa VS Nitori & Hina (Touhou Project) [Chinese] [Digital],[Stapspats (翡翠石)] 幻想郷フタナリチンポレスリング9 アリス&魔理沙VSにとり&雛 (東方Project) [中国翻訳] [DL版],Gensoukyou Futanari Chinpo Wrestling 9 Alice & Marisa VS Nitori & Hina,"translated, chinese",hisui,stapspats,doujinshi,touhou project,"alice margatroid, marisa kirisame, hina kagiyama, nitori kawashiro","futanari, stockings, rough translation",43,2025-12-01 20:36:34,2025-12-01 20:36:34,2025-12-02 14:02:15
612742,[Takk] Player Record Book : Episode 1,,Player Record Book : Episode 1,"japanese, english",takk,,doujinshi,original,,"glasses, uncensored, nakadashi, anal, dark skin, x-ray, males only, yaoi, muscle, kemonomimi, variant set, mesuiki, anal intercourse",20,2025-12-01 20:38:03,2025-12-01 20:38:03,2025-12-02 14:02:15
612743,[Digianko (Ankoman)] Saoyaku Yamato Takeru ga Onna Eirei-tachi to Ecchi Shimakuru Hon (Fate Grand Order) [English] [Kuraudo],,Saoyaku Yamato Takeru ga Onna Eirei-tachi to Ecchi Shimakuru Hon,"english, translated",ankoman,digianko,doujinshi,fate grand order,"astolfo, minamoto no raikou, yamato takeru, nemo marine, ushi gozen","milf, big breasts, pregnant, nakadashi, dark skin, trampling, stockings, tomgirl, big penis, incomplete, josou seme",11,2025-12-01 20:39:05,2025-12-01 20:39:05,2025-12-02 14:02:16
612744,[Matsuyama Seiji] My Brother's Wife's Ass is Like a Peach,[松山せいじ]おっぱいみたいに揉めるしりの兄嫁,My Brother's Wife's Ass is Like a Peach,"translated, chinese",matsuyama seiji,,doujinshi,original,,"inseki, milf, sweating, pregnant, glasses, big ass, cheating, condom, nakadashi, hairy, incest, mosaic censorship, sister, impregnation, sole female, sole male, beauty mark, rough translation",33,2025-12-01 20:41:20,2025-12-01 20:41:20,2025-12-02 14:02:17
612745,[巻貝一ヶ] NTR配信 ～姦禁ストリーマー～（Chinese）【更新中】,,NTR配信 ～姦禁ストリーマー～（Chinese）【更新中】,"translated, chinese",makigai ikko,,manga,,,"sweating, big breasts, mmf threesome, group, glasses, netorare, enema, infantilism, x-ray, bunny girl, big areolae, stockings, filming, rape, sole female",67,2025-12-01 20:45:25,2025-12-01 20:45:25,2025-12-02 14:02:17
612746,[深田拓士] 淫妻図鑑（Chinese）【更新中】,,淫妻図鑑（Chinese）【更新中】,"translated, chinese",fukada takushi,,manga,,,"milf, sweating, oyakodon, twintails",74,2025-12-01 20:50:06,2025-12-01 20:50:06,2025-12-02 14:02:18
612747,[よんよん] イジラレボディ（Chinese）【更新中】,,イジラレボディ（Chinese）【更新中】,"translated, chinese",yonyon,,manga,,,"sweating, big breasts, strap-on, big nipples, group, body modification, ahegao, ffm threesome, bondage, dark skin, yuri, breast expansion, stockings, gyaru, collar, gloves, gender morph, gender change",83,2025-12-01 20:55:59,2025-12-01 20:55:59,2025-12-02 14:02:18
612748,(StvD_m) The warmth of my brother [Grappler Baki],兄の温もり [StvD_m  刃牙],The warmth of my brother,japanese,,,doujinshi,grappler baki,baki hanma,"anal, males only, incest, yaoi, big penis, multiple orgasms",38,2025-12-01 20:58:24,2025-12-01 20:58:24,2025-12-02 14:02:19
612749,[Arctic Char] Arctic Char JK Collection [English] [Denpasoft],,Arctic Char JK Collection,english,arctic char,arctic char,doujinshi,original,,"maid, squirting, garter belt, cunnilingus, masturbation, schoolgirl uniform, nakadashi, ffm threesome, stockings, blowjob",90,2025-12-01 21:03:55,2025-12-01 21:03:55,2025-12-02 14:02:19
612750,[Akizora Momidi]【FC先行連載】秘孔整体3,[秋空もみぢ]【FC先行連載】秘孔整体3,【FC先行連載】秘孔整体3,japanese,akizora momidi,otukimi koubo,doujinshi,original,,"glasses, nakadashi, low lolicon, femdom, dark skin, lolicon, x-ray, footjob, multi-work series, chinese dress, blowjob, muscle, watermarked, sole female, sole male, twintails, hair buns",70,2025-12-01 21:16:36,2025-12-01 21:16:36,2025-12-02 14:02:20
612751,[Hatome Honpo (Hatome)] Maryokugire de Miugoki ga Torenai Mahou Shoujo Aite ni Makeru Wake ga Nai daro!,[はとめ本舗 (はとめ)] 魔力切れで身動きが取れない魔法少女相手に負ける訳がないだろ!,Maryokugire de Miugoki ga Torenai Mahou Shoujo Aite ni Makeru Wake ga Nai daro!,japanese,hatome,hatome honpo,doujinshi,original,,"magical girl, nakadashi, bondage, lolicon, x-ray, blowjob, blindfold, sole female, sole male",29,2025-12-01 21:22:28,2025-12-01 21:22:28,2025-12-02 14:02:21
612752,[Shakazukin] Gyaku NTR Seiheki Do-M Kanojo [2]〜 Onnanoko Datte Netora Retai!〜[Chinese] [括号a机翻] [Digital],[シャカズキン] 逆NTR性癖ドМ彼女2 [中国翻訳],Gyaku NTR Seiheki Do-M Kanojo〜 Onnanoko Datte Netora Retai!〜,"translated, chinese",,shakazukin,doujinshi,original,,"cum swap, squirting, bdsm, milf, big breasts, humiliation, layer cake, cunnilingus, group, netorare, big ass, masturbation, nakadashi, ahegao, sex toys, blowjob face, ffm threesome, multi-work series, swinging, fingering, blowjob, sole male, bisexual, twintails, pixie cut, rough translation, netorase",52,2025-12-01 21:25:50,2025-12-01 21:25:50,2025-12-02 14:02:21
612753,[jemini] セシアがエロすぎるのが悪い‼︎  (ガンダムEXA),[jemini] セシアがエロすぎるのが悪い‼︎  (ガンダムEXA),セシアがエロすぎるのが悪い‼︎,japanese,,,doujinshi,gundam exa,"sthesia awar, sthesia awar nono, sthesia awar acht, sthesia awar primo, sthesia awar sesto","big breasts, jeminiremu",27,2025-12-01 21:27:42,2025-12-01 21:27:42,2025-12-02 14:02:22
612754,[こふに] じいさんは床上手 (クレヨンしんちゃん),[こふに] じいさんは床上手 (クレヨンしんちゃん),じいさんは床上手,japanese,kohuni,,doujinshi,crayon shin-chan,ginnosuke nohara,"big breasts, old man, nakadashi, lactation, mosaic censorship, inverted nipples, sole male, bald",46,2025-12-01 21:30:46,2025-12-01 21:30:46,2025-12-02 14:02:22
612755,[こふに] 引っ張りだこ,[こふに] 引っ張りだこ,引っ張りだこ,japanese,kohuni,,doujinshi,crayon shin-chan,,"big breasts, lactation",12,2025-12-01 21:31:41,2025-12-01 21:31:41,2025-12-02 14:02:23
612756,[こふに] 先生も雌,[こふに] 先生も雌,先生も雌,japanese,kohuni,,doujinshi,crayon shin-chan,,"big breasts, lactation",14,2025-12-01 21:32:37,2025-12-01 21:32:37,2025-12-02 14:02:23
612757,[こふに] 5人目のお友達 (クレヨンしんちゃん),[こふに] 5人目のお友達 (クレヨンしんちゃん),5人目のお友達,japanese,kohuni,,doujinshi,crayon shin-chan,,"big breasts, lactation, mosaic censorship, sole female, sole male, bald",7,2025-12-01 21:33:19,2025-12-01 21:33:19,2025-12-02 14:02:24
612758,[こふに] アンケートに協力 (クレヨンしんちゃん),[こふに] アンケートに協力 (クレヨンしんちゃん),アンケートに協力,japanese,kohuni,,doujinshi,crayon shin-chan,,"big breasts, lactation, mosaic censorship, sole female",7,2025-12-01 21:33:54,2025-12-01 21:33:54,2025-12-02 14:02:25
612759,[こふに] とある日の野原家 (クレヨンしんちゃん),[こふに] とある日の野原家 (クレヨンしんちゃん),とある日の野原家,japanese,kohuni,,doujinshi,crayon shin-chan,"misae nohara, hiroshi nohara, musae koyama","big breasts, sole male",5,2025-12-01 21:34:23,2025-12-01 21:34:23,2025-12-02 14:02:25
612760,[Namiroji (Shiina Nami)] Haisetsu Shoujo 19 [Chinese] [Digital],[波路地 (椎名波)] 排泄少女19 [中国翻訳] [DL版],Haisetsu Shoujo 19,"translated, chinese",shiina nami,namiroji,doujinshi,original,,"scat, big breasts, swimsuit, bikini, multi-work series, no penetration, extraneous ads",22,2025-12-01 21:35:49,2025-12-01 21:35:49,2025-12-02 14:02:26
612761,[ROUTE1 (Taira Tsukune)] Kimi wa Dorei. (Dragon Quest Dai no Daibouken) [Digital],[ROUTE1 (平つくね)] 君は奴隷。 (ドラゴンクエスト ダイの大冒険) [DL版],Kimi wa Dorei.,japanese,taira tsukune,route1,doujinshi,dragon quest dai no daibouken,"maam, popp","squirting, sweating, big breasts, big ass, nakadashi, anal, x-ray, masked face, fingering, rape, blowjob, collar, bbm, stomach deformation, slave, ponytail, hair buns, anal intercourse, nipple stimulation",49,2025-12-01 21:39:09,2025-12-01 21:39:09,2025-12-02 14:02:26
612762,[Kinugoshi Body (Kin)] Shanpankouru wa owaranai 2 (Boku no Hero Academia),,Shanpankouru wa owaranai 2,japanese,kin,,doujinshi,my hero academia | boku no hero academia,"izuku midoriya, katsuki bakugou","kissing, ahegao, anal, sex toys, males only, yaoi, blowjob, muscle",94,2025-12-01 21:45:45,2025-12-01 21:45:45,2025-12-02 14:02:27
612763,[yummy (SMS)] HALLUCINATION (Boku no Hero Academia),,HALLUCINATION,japanese,,yummy,doujinshi,my hero academia | boku no hero academia,"izuku midoriya, katsuki bakugou","ahegao, bunny boy, anal, males only, yaoi, blowjob, horns, tail, lizard guy",44,2025-12-01 21:48:50,2025-12-01 21:48:50,2025-12-02 14:02:27
612764,Yousei chan haraboko sutanbai! Onaho yousei ni nacchaureshu-,妖精ちゃん腹ぼこスタンバイ！オナホ妖精になっちゃうれしゅ-,Yousei chan haraboko sutanbai! Onaho yousei ni nacchaureshu-,japanese,,dote no namakura,doujinshi,original,,"mmf threesome, nakadashi, ahegao, x-ray, minigirl, inflation, rape, giantess, dilf, fairy, stomach deformation, cumflation, multiple orgasms",65,2025-12-01 21:53:15,2025-12-01 21:53:15,2025-12-02 14:02:28
612765,"[Article 60 of Criminal Code (Shuhan)] Pillow talk 2 - kokui no mirai senshi , megane o kakeru (Dragon Ball Z)",,"Pillow talk 2 - kokui no mirai senshi , megane o kakeru",japanese,fujimoto hideaki | shuhan,article 60 of criminal code,doujinshi,dragon ball z,"trunks briefs, son gohan","anal, males only, yaoi, blowjob, muscle",36,2025-12-01 21:55:41,2025-12-01 21:55:41,2025-12-02 14:02:29
612766,[Bata13] Hinata Raikage NTR [English],,Hinata Raikage NTR,english,bata13,,doujinshi,naruto,"hinata hyuga, fourth raikage","big breasts, netorare, cheating, dark skin, blowjob, muscle, nipple stimulation",10,2025-12-01 21:56:31,2025-12-01 21:56:31,2025-12-02 14:02:29
612767,[Karakishi Youhei-dan Shinga (Sahara Wataru)] NARUTOP PINK 104 (Naruto) [Digital],[からきし傭兵団 真雅 (砂原渉)] NARUTOP PINK 104 (NARUTO -ナルト-) [DL版],NARUTOP PINK 104,japanese,sahara wataru,karakishi youhei-dan,doujinshi,naruto,"naruto uzumaki, sakura haruno","big breasts, big ass, nakadashi, dark skin, sole female, sole male",32,2025-12-01 21:58:43,2025-12-01 21:58:43,2025-12-02 14:02:30
612768,[Remain add]Thelema  Song que Captain（honkai gakuen）[aqiaoge个人汉化],[またあおうね]松瑟舰（崩壊3rd）[aqiaoge个人汉化],Thelema  Song que Captain（honkai gakuen）,japanese,,,doujinshi,honkai gakuen,,,12,2025-12-01 21:59:38,2025-12-01 21:59:38,2025-12-02 14:02:30
612769,[Sukiyaki Party (Migami)] Kore wa shuugyoudesukara! (Dragon Ball Z) (+Bonus comics),,Kore wa shuugyoudesukara!,japanese,,,doujinshi,dragon ball z,"trunks briefs, son gohan, son goten","anal, males only, yaoi, muscle",73,2025-12-01 22:03:50,2025-12-01 22:03:50,2025-12-02 14:02:31
612770,[Heroine Engineering (TAREkatsu)] Prospect 1.1 (Dragon Quest: Dai no Daibouken) [Digital],[ヒロイン工学研究所 (TARE活)]  プロスペクト1.1 (ドラゴンクエスト ダイの大冒険) [DL版],Prospect 1.1,japanese,tarekatsu,heroine engineering,doujinshi,dragon quest dai no daibouken,maam,"ryona, possession, rape, tentacles, sole female",103,2025-12-01 22:10:07,2025-12-01 22:10:07,2025-12-02 14:02:31
612771,(C105) [Yoneya (hyouta)] Schrödinger no Kuroneko to 3 (Blue Archive),(C105) [よねや (俵太)] シュレディンガーの黒猫と3 猫と乙女と湯けむり事変 (ブルーアーカイブ),Schrödinger no Kuroneko to 3,japanese,hyouta,yoneya,doujinshi,blue archive,kikyou kiryuu,"schoolgirl uniform, tailjob, anal, footjob, multi-work series, catgirl, sole female, sole male, kemonomimi, tail, anal intercourse, halo",22,2025-12-01 22:11:48,2025-12-01 22:11:48,2025-12-02 14:02:32
612772,[Gokubuto Mayuge] 原创题材色色小黄漫 [Chinese] [欶澜汉化组],[極太眉毛] オリジナルものエロ漫画 [中国翻訳],原创题材色色小黄漫,"translated, chinese",gokubuto mayuge,,doujinshi,original,,"nakadashi, lingerie, sole female, gloves",3,2025-12-01 22:12:16,2025-12-01 22:12:16,2025-12-02 14:02:33
612773,[Hyoui Lover (Ichi Militia)] Yukon no Kyuuketsuki | Soul-Transferring Vampire (Hyoui Catalog ~Onna no Karada ga Nottorare Makuru Godou Hon~) [English] [GTF],,Yukon no Kyuuketsuki | Soul-Transferring Vampire,"english, translated",,hyoui lover,doujinshi,original,,"big breasts, corruption, vampire, milking, snuff, nakadashi, femdom, x-ray, stockings, possession, sole female, gloves, very long hair, multiple orgasms, gender change, painted nails",8,2025-12-01 22:13:24,2025-12-01 22:13:24,2025-12-02 14:02:33
612774,(C95) [Inu to Kotatsu (Nanase Mizuho)] Dappou hihiirokane | 法外绯绯金 (Granblue Fantasy) [Chinese],(C95) [犬とコタツ (七瀬瑞穂)] 脱法ヒヒイロカネ (グランブルーファンタジー) [中国翻訳],Dappou hihiirokane | 法外绯绯金,"translated, chinese",nanase mizuho,inu to kotatsu,doujinshi,granblue fantasy,"djeeta, gran","sweating, big breasts, prostitution, nakadashi, bunny girl, stockings, leotard, sole female, sole male, kemonomimi",24,2025-12-01 22:15:17,2025-12-01 22:15:17,2025-12-02 14:02:34
612775,[Tiramisu Tart (Kazuhiro)] Zubora Ane (Haishinsha) ga Gobaku Ero Buzz Shitakara Hirakinaotte Kyoudai de Ero Haishin suru Waku | 散漫的姐姐（是主播）不小心搞成黄播结果火了於是改行搞起了姐弟黃播的故事 [Chinese],[てぃらみすたると (一弘)] ズボラ姉（配信者）が誤爆エロバズしたから開き直って姉弟でエロ配信する枠 [中国翻訳],Zubora Anega Gobaku Ero Buzz Shitakara Hirakinaotte Kyoudai de Ero Haishin suru Waku | 散漫的姐姐（是主播）不小心搞成黄播结果火了於是改行搞起了姐弟黃播的故事,"translated, chinese",kazuhiro,tiramisu tart,doujinshi,original,,"big breasts, hairy, incest, big areolae, gyaru, sister, sole female, sole male, mouth mask, extraneous ads",44,2025-12-01 22:18:08,2025-12-01 22:18:08,2025-12-02 14:02:34
612776,[Asuhar] Even wives crave intimacy,人妻だって抱かれたい,Even wives crave intimacy,japanese,,,doujinshi,original,,"milf, big breasts, bbw, netorare, cheating, nakadashi, blowjob face, hairy, bunny girl, stockings, lingerie, fingering, blowjob, collar, sole female, sole male, missing cover, beauty mark, gloves",42,2025-12-01 22:20:47,2025-12-01 22:20:47,2025-12-02 14:02:35
612777,[Remain add]Cyrene（honkai : star rail）[aqiaoge个人汉化],[またあおうね]昔涟（崩壊:スターレイル）[aqiaoge个人汉化],Cyrene（honkai : star rail）,"japanese, chinese",mata aou ne,,doujinshi,honkai star rail,cyrene,"artistcg, very long hair",2,2025-12-01 22:21:10,2025-12-01 22:21:10,2025-12-02 14:02:35
612778,[Sanjiro] Senobi shitatte Koi Shitai! | 踮起脚尖也要谈恋爱!(COMIC LO 2025-02) [Chinese] [Sky110036个人汉化] [Digital],[さんじろ] 背伸びしたって恋したい! (COMIC LO 2025年2月号)  [中国翻訳] [DL版],Senobi shitatte Koi Shitai! | 踮起脚尖也要谈恋爱!,"translated, chinese",sanjiro,,manga,,,"lolicon, mosaic censorship",30,2025-12-01 22:26:45,2025-12-01 22:26:45,2025-12-02 14:02:36
612779,宝多六花催眠計画,宝多六花催眠計画,宝多六花催眠計画,japanese,,,doujinshi,ssss.gridman,rikka takarada,"big breasts, piercing, netorare, schoolgirl uniform, condom, nakadashi, bondage, mind control, big areolae, dilf, impregnation, inverted nipples, blowjob, collar, body writing, deepthroat, slave, sole female, leash, painted nails",18,2025-12-01 22:28:07,2025-12-01 22:28:07,2025-12-02 14:02:37
612780,[U.R.C (Momoya Show-Neko)] Nekoyashiki Y no Junan - SUFFERING OF NEKOYASHIKI Y (Wonderful PreCure!) [Chinese] [Digital],[U.R.C (桃屋しょう猫)] 猫屋敷Yの受難 (わんだふるぷりきゅあ!) [中国翻訳] [DL版],Nekoyashiki Y no Junan - SUFFERING OF NEKOYASHIKI Y,"translated, chinese",momoya show-neko,u.r.c,doujinshi,wonderful precure,"cure lillian | mayu nekoyashiki, cure nyammy | yuki nekoyashiki","sweating, group, nakadashi, anal, double penetration, very long hair, extraneous ads",38,2025-12-01 22:30:39,2025-12-01 22:30:39,2025-12-02 14:02:37
612781,[Nameraka Seinikuten (kamasu)] Binkan Jimiko wa Iki zurai!!! | Life Ain’t Easy for a Sensitive Plain Jane!!! [English] [Suizokukan],[滑らか精肉店 (kamasu)] ビンカン地味子は生きヅラい!!! [英訳],Binkan Jimiko wa Iki zurai!!! | Life Ain’t Easy for a Sensitive Plain Jane!!!,"english, translated",kamasu,yawaraka seinikuten | nameraka seinikuten,doujinshi,original,,"business suit, squirting, big breasts, glasses, nakadashi, sex toys, diaper, pantyhose, fingering, rape, sole female, sole male",65,2025-12-01 22:34:57,2025-12-01 22:34:57,2025-12-02 14:02:39
612782,[らーめん] スタレ クラーラとパン屋さんのお手伝い (崩壊:スターレイル),[らーめん] スタレ クラーラとパン屋さんのお手伝い (崩壊:スターレイル),スタレ クラーラとパン屋さんのお手伝い,japanese,ra-men,,doujinshi,honkai star rail,clara,"nakadashi, lolicon, x-ray, rape, impregnation, sole female, sole male, facial hair, very long hair",16,2025-12-01 22:37:50,2025-12-01 22:37:50,2025-12-02 14:02:39
612783,[Kougun Nisshi (Did)] Ochido 100% (Kantai Collection -KanColle-) [Digital],[行軍日誌 (でど)] 落ち度100% (艦隊これくしょん -艦これ-) [DL版],Ochido 100%,japanese,didloaded,,doujinshi,kantai collection,shiranui,"blowjob, deepthroat, sole female, ponytail",16,2025-12-01 22:39:04,2025-12-01 22:39:04,2025-12-02 14:02:40
612784,[Kougun Nisshi (Did)] Ochido 102% (Kantai Collection -KanColle-) [Digital],[行軍日誌 (でど)] 落ち度102% (艦隊これくしょん -艦これ-) [DL版],Ochido 102%,japanese,didloaded,,doujinshi,kantai collection,shiranui,"bike shorts, sole female, ponytail",15,2025-12-01 22:40:10,2025-12-01 22:40:10,2025-12-02 14:02:40
612785,[Kougun Nisshi (Did)] Ochido 103% (Kantai Collection -KanColle-) [Digital],[行軍日誌 (でど)] 落ち度103% (艦隊これくしょん -艦これ-) [DL版],Ochido 103%,japanese,didloaded,,doujinshi,kantai collection,shiranui,"bike shorts, sole female, ponytail",17,2025-12-01 22:41:25,2025-12-01 22:41:25,2025-12-02 14:02:41
612786,[Dokuneko Noil]  Fan Ichigo Nigo ni Warui Koto o Suru Hanashi (Zenpen) | 对粉丝1号和2号做坏事的故事 前篇 (Bocchi the Rock!) [Chinese] [Akiseherol个人汉化],[毒猫ノイル]ファン1号2号に悪いことをする話【前編】(ぼっち・ざ・ろっく!) [中国翻訳],Fan Ichigo Nigo ni Warui Koto o Suru Hanashi| 对粉丝1号和2号做坏事的故事 前篇,"translated, chinese",dokuneko noil,,doujinshi,bocchi the rock,,"full color, drunk, rape",15,2025-12-01 22:42:40,2025-12-01 22:42:40,2025-12-02 14:02:41
612787,[Kuga Tsuniya] Itsuka Fukushuu Suru Sono Tame ni [Chinese] [酸菜魚ゅ°],[玖珂ツニヤ] いつか復讐するその為に [中国翻訳],Itsuka Fukushuu Suru Sono Tame ni,"translated, chinese",kuga tsuniya,,doujinshi,original,,"bandages, schoolgirl uniform, condom, nakadashi, ahegao, anal, asphyxiation, scanmark, hairy, stockings, eyepatch, blowjob, first person perspective, yandere, sole female, sole male, very long hair, anal intercourse, crying",74,2025-12-01 22:47:11,2025-12-01 22:47:11,2025-12-02 14:02:42
612788,(C106) [SEVEN TAILS (Fukuinu)] NIGHT POOL HOUND DOG (Blue Archive) [ English ] [ MTL ],(C106) [SEVEN TAILS (福犬)] NIGHT POOL HOUND DOG (ブルーアーカイブ) [英訳],NIGHT POOL HOUND DOG,"english, translated",fukuinu,seven tails,doujinshi,blue archive,"kanna ogata, fubuki nemugaki, kirino nakatsukasa","futanari, unusual teeth, big breasts, swimsuit, nakadashi, ahegao, anal, sex toys, bikini, x-ray, blowjob, dickgirl on dickgirl, kemonomimi, eye-covering bang, rough translation, halo, dickgirl on female, futanarization",22,2025-12-01 22:48:52,2025-12-01 22:48:52,2025-12-02 14:02:42
612789,[Domestic Milk (Ogu)] Kimi to Shitai Koto - What I want to do with you. (Genshin Impact) [Digital],[国産牛乳 (オグ)] きみとしたいこと。 (原神) [DL版],Kimi to Shitai Koto - What I want to do with you.,japanese,ogu,,doujinshi,genshin impact,"aether, diluc ragnvindr",gender change,55,2025-12-01 22:52:09,2025-12-01 22:52:09,2025-12-02 14:02:43
612790,(Futaket 15) [SEVEN TAILS (Fukuinu)] Yotsuyu no Zousan (Alice Gear Aegis) [English] [MTL],(ふたけっと15) [SEVEN TAILS (福犬)] ヨツユ・ノ・ゾウサン (アリス・ギア・アイギス) [英訳],Yotsuyu no Zousan,"english, translated",fukuinu,seven tails,doujinshi,alice gear aegis,"shitara kaneshiya, fumika momoshina, yotsuyu hirasaka","futanari, handjob, onahole, strap-on, group, glasses, nakadashi, anal, sex toys, femdom, dark skin, fft threesome, defloration, paizuri, big penis, sole dickgirl, dickgirl on female",18,2025-12-01 22:53:28,2025-12-01 22:53:28,2025-12-02 14:02:44
612791,[Hellcherr & 活火山] 守护妳 | 守護妳 1-6 [Chinese] [Ongoing],,守护妳 | 守護妳 1-6,"translated, chinese",,,manga,,,"story arc, full color, webtoon",145,2025-12-01 23:04:56,2025-12-01 23:04:56,2025-12-02 14:02:45
612792,[Honey Lounge (Hachimitsu)] Nibai! 3 Chuuhen  [Chinese] [沒有漢化],[Honey Lounge (はちみつ)] にばい!3 中編  [中国翻訳],Nibai! 3 Chuuhen,"translated, chinese",hachimitsu,honey lounge,doujinshi,original,,"humiliation, urination, femdom, hairy, multi-work series, stockings, smell, giantess, miniguy, piss drinking",72,2025-12-01 23:09:49,2025-12-01 23:09:49,2025-12-02 14:02:45
612793,[Shishamo] Tatsumaki's Shrinking Punishment,[ししゃも] タツマキの縮小お仕置き,Tatsumaki's Shrinking Punishment,japanese,shishamo,,doujinshi,one punch man,senritsu no tatsumaki,"shrinking, farting, femdom, non-h, miniguy, sole female, sole male, no penetration",8,2025-12-01 23:10:30,2025-12-01 23:10:30,2025-12-02 14:02:46
612794,[Shiono Kou] Boshi Jouji ~Daisuki na Okaa-san to Konya Majiwaru~ - MOTHER AND SON LOVE AFFAIR | 母子情事～今夜与深爱的妈妈交合～  [Chinese] [boomboom123个人汉化 & AI上色],[汐乃コウ] 母子情事 〜大好きな母さんと今夜交わる〜 [中国翻訳],Boshi Jouji ~Daisuki na OkaaMOTHER AND SON LOVE AFFAIR | 母子情事～今夜与深爱的妈妈交合～,"translated, chinese",shiono kou,,doujinshi,original,,"milf, big breasts, mother, hairy, full color, incest, blowjob, sole female, sole male, beauty mark",98,2025-12-01 23:15:54,2025-12-01 23:15:54,2025-12-02 14:02:46
612795,[Shishamo] Ellen gives the dwarf some constipation gas,[ししゃも] 小人に便秘ガスをお見舞いするエレン,Ellen gives the dwarf some constipation gas,japanese,shishamo,,doujinshi,zenless zone zero,ellen joe,"farting, femdom, miniguy, sole female, sole male, no penetration",11,2025-12-01 23:16:44,2025-12-01 23:16:44,2025-12-02 14:02:47
612796,[Sep]No Nuts November[Chinese][機翻潤色],,No Nuts November,"translated, chinese",sep,,doujinshi,original,,"futanari, big breasts, wormhole, urethra insertion, group, uncensored, breast feeding, condom, huge breasts, demon girl, big balls, full color, huge penis, orgasm denial, paizuri, tall girl, big penis, sole dickgirl, horns, tail, very long hair, eye-covering bang, rough translation, lipstick mark, full-packaged futanari, penis enlargement, dickgirl on female",31,2025-12-01 23:18:44,2025-12-01 23:18:44,2025-12-02 14:02:47
612797,[Alikui V Line (Ooooalikui)] Mei to Sugosu 7-kakan. - SEVEN DAYS WITH MY NIECE [Digital],[ありくいVライン (おおおおありくい)] 姪と過ごす7日間。 [DL版],Mei to Sugosu 7SEVEN DAYS WITH MY NIECE,japanese,ooooalikui,alikui v line,doujinshi,original,,"niece, lolicon, incest, sole female, sole male",65,2025-12-01 23:31:52,2025-12-01 23:31:52,2025-12-02 14:02:48
612798,(C105) [Kakinotanehitotsubu (Kakino Nashiko)] Misaki Summer (Blue Archive)[English][MTL],(C105) [柿の種一粒 (柿野なしこ)] ミサキサマー (ブルーアーカイブ),Misaki Summer,"english, translated",kakino nashiko,kakinotanehitotsubu,doujinshi,blue archive,"sensei, misaki imashino","swimsuit, piercing, glasses, bikini, sole female, sole male, rough translation, halo",22,2025-12-01 23:33:33,2025-12-01 23:33:33,2025-12-02 14:02:49
612799,[Mimonel] Jishou Tokubetsu Sousatai no Houkago Benkyoukai | The self-proclaimed Investigation Squad’s after-school study meeting (Persona 4) [English] [Shiririn],[ミモネル] 自称特別捜査隊の放課後勉強会♥ (ペルソナ4) [英訳],Jishou Tokubetsu Sousatai no Houkago Benkyoukai | The selfschool study meeting,"english, translated",mimonel,,doujinshi,persona 4,"naoto shirogane, chie satonaka, rise kujikawa, yukiko amagi, yuu narukami | seta souji","big breasts, group, glasses, nakadashi, harem, x-ray, full color, stockings, inverted nipples, stomach deformation, sole male, twintails",6,2025-12-01 23:34:06,2025-12-01 23:34:06,2025-12-02 14:02:49
