ID,EN_TITLE,JP_TITLE,CLEAN_TITLE,LANGUAGE,ARTIST,GROUP_NAME,CATEGORY,PARODY,CHARACTER,TAGS,PAGES,UPLOAD_DATE,FORMATTED_DATE,SCRAPED_DATE
587604,[Nna Timun (yurarin)]Oyako de shojo de ninshin shite akachan unjyaimashita. Terebi de wa kageki sugite katto sareta mikokai ezoshu.,[んつぁてぃむん (遊来りん)] 親子で小〇生で妊娠して赤ちゃん産んじゃいました 未公開映像集 [DL版],Oyako de shojo de ninshin shite akachan unjyaimashita. Terebi de wa kageki sugite katto sareta mikokai ezoshu.,japanese,yurarin,ntuateimun,doujinshi,original,,"pregnant, lolicon, stockings, oppai loli, impregnation, sole female",16,2025-08-02 11:07:56,2025-08-02 11:07:56,2025-08-03 14:02:42
587605,[Dokusai Switch] Kō Shinchō Joshi Barē-bu ni Mazo Haiboku Sa Se Areta Hanashi,[独裁スイッチ],Kō Shinchō Joshi Barē-bu ni Mazo Haiboku Sa Se Areta Hanashi,japanese,,dokusai switch,doujinshi,,,"big breasts, humiliation, group, femdom, footjob, full color, bike shorts, cbt, shotacon, sole male, ponytail, clothed female nude male, small penis, forced exposure",35,2025-08-02 11:14:54,2025-08-02 11:14:54,2025-08-03 14:02:43
587606,[こけもも] 海で周りの人に見られながら、ナンパ師達にえっちされちゃう ル〇ナ,,海で周りの人に見られながら、ナンパ師達にえっちされちゃう ル〇ナ,japanese,kokemomo,,doujinshi,hololive,himemori luna,"pregnant, group, sole female, vtuber",12,2025-08-02 11:15:49,2025-08-02 11:15:49,2025-08-03 14:02:44
587607,[ie] 勧誘,[ie] 勧誘,勧誘,japanese,ie,,doujinshi,original,,group,3,2025-08-02 12:00:40,2025-08-02 12:00:40,2025-08-03 14:02:45
587608,Fortune Teller Full Comic,,Fortune Teller Full Comic,english,,,doujinshi,original,,"femdom, bondage, thigh high boots, multi-work series, mind break, gloves",5,2025-08-02 12:01:08,2025-08-02 12:01:08,2025-08-03 14:02:45
587609,[Digital Flyer (Oota Yuuichi)] NKMMRKGK [Digital],[Digital Flyer (大田優一)] NKMMRKGK [DL版],NKMMRKGK,japanese,oota yuuichi,digital flyer,doujinshi,,,"catgirl, kemonomimi",8,2025-08-02 12:01:42,2025-08-02 12:01:42,2025-08-03 14:02:46
587610,[Digital Flyer (Oota Yuuichi)] RKGKNKMM3 [Digital],[Digital Flyer (大田優一)] RKGKNKMM3 [DL版],RKGKNKMM3,japanese,oota yuuichi,digital flyer,doujinshi,,,kemonomimi,9,2025-08-02 12:02:23,2025-08-02 12:02:23,2025-08-03 14:02:47
587611,[Digital Flyer (Oota Yuuichi)] Neko to Geboku preⅢ [Digital],[Digital Flyer (大田優一)] ねことげぼくpreⅢ [DL版],Neko to Geboku preⅢ,japanese,oota yuuichi,digital flyer,doujinshi,,,,11,2025-08-02 12:03:05,2025-08-02 12:03:05,2025-08-03 14:02:48
587612,[Digital Flyer (Oota Yuuichi)] SCBSRKGK [Digital],[Digital Flyer (大田優一)] SCBSRKGK [DL版],SCBSRKGK,japanese,oota yuuichi,digital flyer,doujinshi,,,demon girl,9,2025-08-02 12:03:43,2025-08-02 12:03:43,2025-08-03 14:02:49
587613,[Dokuneko Noil] Gotou Hitori ni Warui Koto o Suru Hanashi (Zenpen) (Bocchi the Rock!) [English],[毒猫ノイル] 後藤ひとりに悪いことをする話（前編）,Gotou Hitori ni Warui Koto o Suru Hanashi,"english, translated",dokuneko noil,,doujinshi,bocchi the rock,hitori gotou,"big breasts, drunk, rape, sole female",13,2025-08-02 12:04:34,2025-08-02 12:04:34,2025-08-03 14:02:50
587614,[Nyakkuru] Boku o Model ni shite kudasai! [Chinese] [oo2oo个人汉化] [Digital],[ニャックル] ボクを参考にしてくださいっ！ (男の娘、めしあがれっ！) [中国翻訳] [DL版],Boku o Model ni shite kudasai!,"translated, chinese",nyakkuru,,manga,,,"anal, crossdressing, males only, yaoi, tomgirl, blowjob, anal intercourse",16,2025-08-02 12:05:43,2025-08-02 12:05:43,2025-08-03 14:02:50
587615,[Eight PM] Do namaiki na Juma-kun o mechakucha wakaraseru [Digital],[エイトピーエム] ド生意気なジュマくんをめちゃくちゃわからせる [DL版],Do namaiki na Juma-kun o mechakucha wakaraseru,japanese,ozi8 | 12ennogift,,doujinshi,original,,"maid, schoolboy uniform, schoolgirl uniform, anal, crossdressing, dark skin, males only, yaoi, stockings, tomgirl, blowjob, collar, shotacon, kemonomimi, gloves, anal intercourse",90,2025-08-02 13:17:12,2025-08-02 13:17:12,2025-08-03 14:02:51
587616,"[Fuzume] Ore, isekai de shibori torarete masu... | 我、在异世界被榨干了… [Chinese] [oo2oo个人汉化] [Ongoing]",[ふずめ] オレ、異世界で搾り取られてます… [中国翻訳] [進行中],"Ore, isekai de shibori torarete masu... | 我、在异世界被榨干了…","translated, chinese",,fuzume,doujinshi,original,,"elf, kissing, big breasts, unusual pupils, catboy, witch, masturbation, shimapan, blowjob face, femdom, crossdressing, cosplaying, lolicon, exhibitionism, assjob, stockings, paizuri, fingering, tomgirl, blowjob, shotacon, clothed paizuri, kemonomimi, tail, very long hair, penis enlargement",97,2025-08-02 13:35:22,2025-08-02 13:35:22,2025-08-03 14:02:52
587617,Bitchy Married Woman Pregnant and Depraved in AV [english],,Bitchy Married Woman Pregnant and Depraved in AV,"english, translated",ponchi,,doujinshi,,,"milf, big breasts, pregnant, dark nipples, abortion, artistcg, hairy, dark skin, big areolae",12,2025-08-02 13:38:02,2025-08-02 13:38:02,2025-08-03 14:02:53
587618,[Jun Tokutyu Kuromask (Hetaren)] Yuusha level up de Sister kara Shukufuku o | 勇者在等级提升后于修女处得到祝福 [Chinese] [欶澜汉化组] [Digital],[準特注くろますく (へたれん)] 勇者レベルアップでシスターから祝福を [中国翻訳] [DL版],Yuusha level up de Sister kara Shukufuku o | 勇者在等级提升后于修女处得到祝福,"translated, chinese",hetaren,jun tokutyu kuromask,doujinshi,original,,"big breasts, nun, paizuri, blowjob, deepthroat, sole female, sole male, focus blowjob",61,2025-08-02 13:41:47,2025-08-02 13:41:47,2025-08-03 14:02:54
587619,[YANCHA CLUB (DOUSAI)] Senpai yuusha de ore goburin?! [Digital],[やんちゃ倶楽部 (百斎)] センパイ勇者で俺ゴブリン?！ [DL版],Senpai yuusha de ore goburin?!,japanese,dousai,yancha club,doujinshi,original,,"goblin, nakadashi, anal, bondage, males only, yaoi, rape, blowjob, muscle, big penis, collar, shotacon, mesuiki, anal intercourse, bite mark",58,2025-08-02 13:52:37,2025-08-02 13:52:37,2025-08-03 14:02:55
587620,"[Seisui BAR] Isekai Tensei Shite Nouryoku de H na Koto suru Hanashi 2 ""Jinrou"" [English]",[聖水BAR] 異世界転生して能力でＨなことする話②『人狼』,"Isekai Tensei Shite Nouryoku de H na Koto suru Hanashi 2 ""Jinrou""","english, translated",,seisui bar,doujinshi,original,,"big breasts, nakadashi, wolf girl, hairy, multi-work series, sole female, kemonomimi, tail, domination loss",4,2025-08-02 13:53:05,2025-08-02 13:53:05,2025-08-03 14:02:59
587621,[Iwashita Shoten (Iwashita)] Kawatta Joshikai,[いわした書店 (いわした)] 皮った女子会,Kawatta Joshikai,japanese,iwashita,iwashita shoten,doujinshi,original,,"futanari, skinsuit, gender change",36,2025-08-02 13:55:11,2025-08-02 13:55:11,2025-08-03 14:03:00
587622,[Mimonel] shinya no ecchina gāruzubatoru ♥,[ミモネル] 深夜のエッチなガールズバトル♥,shinya no ecchina gāruzubatoru ♥,japanese,mimonel,,doujinshi,zenless zone zero,"belle, alice thymefield, yuzuha ukinami","group, females only, ahegao, anal, sex toys, yuri, full color, inflation, bunny girl, collar, kemonomimi, twintails, very long hair, fff threesome",11,2025-08-02 14:01:10,2025-08-02 14:01:10,2025-08-03 14:03:00
587623,"[Hoyhoy Colo, Atomic Bomb] Moto Himote Doutei wa Mikaeshitai! ~Bitch Goshimai Kouryaku Game~ Ch.5 (Dascomi Vol.37) [结城铃兰个人汉化] [Digital]",[ホイホイこーろ、跡美くぼむ] 元・非モテ童貞は見返したい！～ビッチ五姉妹攻略ゲーム～ 5話 [中国翻訳] [DL版],Moto Himote Doutei wa Mikaeshitai!Ch.5,"translated, chinese",hoyhoy colo,,manga,,,"big breasts, group, full censorship",25,2025-08-02 14:02:54,2025-08-02 14:02:54,2025-08-03 14:03:01
587624,[Okina Keikaku (Shiwasu no Okina)] 100-Kai Furareta Zetsubou-teki ni Motenai Ore o Awarenda Kareshi Ari Onna Tomodachi ga Nandemo Eroi Koto Yarasete Kureta!! | 有男友的女生朋友們，可憐告白被拒絕100次，完全交不到女友的我，讓我和她們做盡色色的事!! [Chinese]  [暮想出版+eve补嵌] [Decensored] [Digital,[翁計画 (師走の翁)] 100回フラれた絶望的にモテない俺を憐れんだ彼氏あり女友達が何でもエロい事ヤらせてくれた!! [中国翻訳] [無修正] [DL版],100teki ni Motenai Ore o Awarenda Kareshi Ari Onna Tomodachi ga Nandemo Eroi Koto Yarasete Kureta!! | 有男友的女生朋友們，可憐告白被拒絕100次，完全交不到女友的我，讓我和她們做盡色色的事!![Digital,"translated, chinese",shiwasu no okina,okina keikaku,doujinshi,original,,"big breasts, group, glasses, uncensored, cheating, schoolgirl uniform, anal, ffm threesome, harem, gyaru, blowjob, sole male, ponytail",118,2025-08-02 14:09:45,2025-08-02 14:09:45,2025-08-03 14:03:02
587625,Sud and Submission,,Sud and Submission,"english, translated",,,manga,,,"pegging, spanking, prostate massage, ryona, anal, sex toys, femdom, bondage, shibari, webtoon, clothed female nude male, defaced",257,2025-08-02 14:24:30,2025-08-02 14:24:30,2025-08-03 14:03:03
587626,[Vera City] Fate finds a Fox Familiar [Chinese],,Fate finds a Fox Familiar,"translated, chinese",,,manga,,,"witch, misc, non-h, webtoon, western non-h, rough translation",9,2025-08-02 14:25:20,2025-08-02 14:25:20,2025-08-03 14:03:03
587627,[Seisui BAR] Isekai Tensei Shite Nouryoku de H na Koto suru Hanashi 3 [English],[聖水BAR] 異世界転生して能力でＨなことする話③,Isekai Tensei Shite Nouryoku de H na Koto suru Hanashi 3,"english, translated",,seisui bar,doujinshi,original,,"big breasts, witch, glasses, hairy, bikini, multi-work series, bunny girl, chinese dress, hotpants, muscle, kemonomimi, twintails, hair buns, rough translation",4,2025-08-02 14:25:45,2025-08-02 14:25:45,2025-08-03 14:03:04
587628,[Hikari no Tomoshibi (Kousoku)] Shigure Kikaishiki Jinmon EX2 -Boku no Zecchou Dungeon Dasshutsu- (Kantai Collection -KanColle-),[光の燭 (光燭)] 時雨機械式尋問EX2 -僕の絶頂ダンジョン脱出- (艦隊これくしょん -艦これ-),Shigure Kikaishiki Jinmon EX2,japanese,kousoku,hikari no tomoshibi,doujinshi,kantai collection,shigure,,22,2025-08-02 14:27:10,2025-08-02 14:27:10,2025-08-03 14:03:05
587629,"[Seisui BAR] Isekai Tensei Shite Nouryoku de H na Koto suru Hanashi 4 ""Minotaur"" [English]",[聖水BAR] 異世界転生して能力でＨなことする話④『ミノタウロス』 [英訳],"Isekai Tensei Shite Nouryoku de H na Koto suru Hanashi 4 ""Minotaur""","english, translated",,seisui bar,doujinshi,original,,"big breasts, time stop, nakadashi, multi-work series, cowgirl, paizuri, sole female, sole male, kemonomimi, horns, tail, eye-covering bang",4,2025-08-02 14:27:41,2025-08-02 14:27:41,2025-08-03 14:03:06
587630,[SUTEMUKI / Matoi Keruna] 10℃ (Mobile Suit Gundam ZZ) [中文] [ZZ高达卡缪捷多],[素敵!無敵!ムッキムキ / 的井けるな] 10℃ (機動戦士ガンダムΖΖ),10℃,"japanese, chinese",,,doujinshi,"gundam, gundam zz, mobile suit gundam | kidou senshi gundam","kamille bidan, judau ashta","males only, non-h, yaoi",39,2025-08-02 14:30:08,2025-08-02 14:30:08,2025-08-03 14:03:06
587631,[虹照] 後輩オタク友達JKが可愛すぎるもんでっ！3,[虹照] 後輩オタク友達JKが可愛すぎるもんでっ！3,後輩オタク友達JKが可愛すぎるもんでっ！3,japanese,,niji-teru,doujinshi,original,,"glasses, multi-work series, sole female, sole male",69,2025-08-02 14:34:10,2025-08-02 14:34:10,2025-08-03 14:03:08
587632,"[Seisui BAR] Isekai Tensei Shite Nouryoku de H na Koto suru Hanashi 5 ""Jinrou to Minotaur"" [English]",[聖水BAR] 異世界転生して能力でＨなことする話⑤『人狼とミノタウロス』,"Isekai Tensei Shite Nouryoku de H na Koto suru Hanashi 5 ""Jinrou to Minotaur""","english, translated",,seisui bar,doujinshi,original,,"kissing, big breasts, group, nakadashi, wolf girl, ffm threesome, exhibitionism, yuri, mind control, multi-work series, cowgirl, sole male, bisexual, kemonomimi, horns, tail, eye-covering bang",4,2025-08-02 14:34:38,2025-08-02 14:34:38,2025-08-03 14:03:08
587633,[Kokemomo] Lamy ni Shiborareru | Lamy squeezes me (Yukihana Lamy) [English],[こけもも] ラ〇ィに絞られる (雪花ラミィ) [英語],Lamy ni Shiborareru | Lamy squeezes me,english,kokemomo,,doujinshi,hololive,yukihana lamy,"elf, sole female, vtuber",10,2025-08-02 14:35:22,2025-08-02 14:35:22,2025-08-03 14:03:10
587634,[Kokemomo] Lamy ni Shiborareru (Yukihana Lamy),[こけもも] ラ〇ィに絞られる (雪花ラミィ),Lamy ni Shiborareru,japanese,kokemomo,,doujinshi,hololive,yukihana lamy,"elf, sole female, vtuber",10,2025-08-02 14:36:05,2025-08-02 14:36:05,2025-08-03 14:03:10
587635,"[Kokemomo] Korone Houchi Play (Inugami Korone, Nekomata Okayu)",[こけもも] こ〇ね放置プレイ (戌神ころね、猫又おかゆ),Korone Houchi Play,japanese,kokemomo,,doujinshi,hololive,"inugami korone, nekomata okayu","sex toys, dog girl, bondage, full color, collar, kemonomimi, tail, vtuber, object insertion only",10,2025-08-02 14:36:45,2025-08-02 14:36:45,2025-08-03 14:03:11
587636,"[Kokemomo] Korone Houchi Play | Leave the Korone unattended (Inugami Korone, Nekomata Okayu) [English]",[こけもも] こ〇ね放置プレイ (戌神ころね、猫又おかゆ) [英語],Korone Houchi Play | Leave the Korone unattended,english,kokemomo,,doujinshi,hololive,"inugami korone, nekomata okayu","sex toys, dog girl, bondage, collar, kemonomimi, tail, vtuber, object insertion only",10,2025-08-02 14:37:30,2025-08-02 14:37:30,2025-08-03 14:03:12
587637,[Horori] Teyvat Gravure #09 (Genshin Impact) [Chinese],[Horori] Teyvat Gravure #09 (原神) [中国翻訳],Teyvat Gravure #09,"japanese, translated, chinese",horori,,doujinshi,genshin impact,"raiden shogun, yae miko",big breasts,20,2025-08-02 15:01:40,2025-08-02 15:01:40,2025-08-03 14:03:12
587638,(C106) [Kurumiya (Junkin Chikushou)] Boku no xxxx o Kaese!! [Digital],(C106) [くるみ屋 (純金畜生)] 僕の××××を返せッ！！ [DL版],Boku no xxxx o Kaese!!,japanese,,,doujinshi,original,,"maid, lolicon, very long hair, gender change",31,2025-08-02 15:07:35,2025-08-02 15:07:35,2025-08-03 14:03:13
587639,[蒼き星 (全白)] 紅蓮燦爛,,紅蓮燦爛,japanese,akaiguppy,aokihoshi,doujinshi,goddess of victory nikke,"scarlet, shikikan","sole female, sole male",34,2025-08-02 15:09:38,2025-08-02 15:09:38,2025-08-03 14:03:14
587640,[みさんが] 圧縮編成ドピュレヒコール,,圧縮編成ドピュレヒコール,japanese,misanga,,doujinshi,the idolmaster,"misuzu hataya, temari tsukimura","group, ffm threesome",26,2025-08-02 15:11:13,2025-08-02 15:11:13,2025-08-03 14:03:15
587641,[だにまるstudio (だにまる)] 京也は夢で私を犯す (オリジナル) [DL版],[だにまるstudio (だにまる)] 京也は夢で私を犯す (オリジナル) [DL版],京也は夢で私を犯す,japanese,danimaru,,doujinshi,original,,"squirting, kissing, leg lock, big breasts, cunnilingus, nakadashi, sex toys, sleeping, x-ray, drunk, fingering, blowjob, sole female, sole male, beauty mark, nipple stimulation",74,2025-08-02 15:15:38,2025-08-02 15:15:38,2025-08-03 14:03:15
587642,"[Akane Shuuhei Dou (Akane Shuuhei)] Onna Gakuenchou Chun-Li, Soushuuhen (Street Fighter) [Digital][ongoing][Chinese][考古学家汉化]",[茜しゅうへい堂 (茜しゅうへい)] 女学園長春麗、総集編 (ストリートファイター) [DL版][中国翻訳][考古學家漢化],"Onna Gakuenchou Chun-Li, Soushuuhen","translated, chinese",akane shuuhei,akane shuuhei dou,doujinshi,street fighter,"juri han, chun-li","futanari, big breasts, anal, blowjob, cumflation, dickgirl on female",113,2025-08-02 15:22:33,2025-08-02 15:22:33,2025-08-03 14:03:16
587643,[Riku no Kotoutei (Shayo)] Inaka ni wa kore kurai shika Goraku ga nai Soushuuhen,[陸の孤島亭 (しゃよー)] 田舎にはこれくらいしか娯楽がない 1~5+會場限定本+單行本新繪漫畫 [中国翻訳] [無修正],Inaka ni wa kore kurai shika Goraku ga nai Soushuuhen,"translated, chinese",shayo,riku no kotoutei,doujinshi,original,,"big breasts, swimsuit, group, uncensored, schoolgirl uniform, nakadashi, huge breasts, tall man, ffm threesome, harem, x-ray, multi-work series, tanlines, stockings, apron, filming, muscle, collar, sole male, redraw, gloves, very long hair, eye-covering bang",286,2025-08-02 15:38:40,2025-08-02 15:38:40,2025-08-03 14:03:17
587644,[DROP DEAD!! (水瀬修)] 微熱に濡れる君がすき。 [DL版],[DROP DEAD!! (水瀬修)] 微熱に濡れる君がすき。 [DL版],微熱に濡れる君がすき。,japanese,minase syu,drop dead,doujinshi,,,"schoolgirl uniform, urination",44,2025-08-02 16:03:05,2025-08-02 16:03:05,2025-08-03 14:03:18
587645,[まなちゃんねる (やざわまな)] リコリスの屈辱3角,,リコリスの屈辱3角,japanese,yazawa mana,mana channel,doujinshi,lycoris recoil,chisato nishikigi,,18,2025-08-02 16:04:16,2025-08-02 16:04:16,2025-08-03 14:03:18
587646,[Meboshidou(Meboshijin)] Yumemiruprism [IdentityV][Digital],[目星堂 (目星陣)] ユメミルプリズム (IdentityV)[DL版],Yumemiruprism,japanese,,,doujinshi,identity v,,,25,2025-08-02 16:05:51,2025-08-02 16:05:51,2025-08-03 14:03:19
587647,[Meboshidou(Meboshijin)] 窥见溢彩之梦丨Yumemiruprism [IdentityV][Digital][Chinese],[目星堂 (目星陣)] ユメミルプリズム (IdentityV)[DL版][中国翻訳],窥见溢彩之梦丨Yumemiruprism,"translated, chinese",,,doujinshi,identity v,"norton campbell, emma woods","unusual teeth, scar, nakadashi, x-ray, big penis, sole female, sole male",27,2025-08-02 16:07:43,2025-08-02 16:07:43,2025-08-03 14:03:20
587648,【まりぱか】EVENING DINER夜晚的餐館,,【まりぱか】EVENING DINER夜晚的餐館,"translated, chinese",,,manga,,,"story arc, males only, yaoi, rough translation",157,2025-08-02 16:16:34,2025-08-02 16:16:34,2025-08-03 14:03:22
587649,[沖葉] 先生、俺,[沖葉] 先生、俺,先生、俺,"translated, chinese",okiha,,doujinshi,the idolmaster,lilja katsuragi,"schoolgirl uniform, mosaic censorship, sole female",4,2025-08-02 16:17:05,2025-08-02 16:17:05,2025-08-03 14:03:23
587650,[おやすみ毛布 (ひつじ)]兄弟遊戲,,兄弟遊戲,"translated, chinese",,,doujinshi,original,,"anal, males only, incest, yaoi, rough translation",50,2025-08-02 16:20:08,2025-08-02 16:20:08,2025-08-03 14:03:23
587651,[おやすみ毛布 (ひつじ)]完整的一族,,完整的一族,"translated, chinese",,,doujinshi,original,,"anal, males only, incest, yaoi, rough translation",90,2025-08-02 16:25:52,2025-08-02 16:25:52,2025-08-03 14:03:25
587652,[おやすみ毛布 (ひつじ)]完整的一族 起源,,完整的一族 起源,"translated, chinese",,,doujinshi,original,,"anal, males only, incest, yaoi, rough translation",86,2025-08-02 16:31:23,2025-08-02 16:31:23,2025-08-03 14:03:25
587653,【まりぱか】實之森,,【まりぱか】實之森,"translated, chinese",,,manga,,,"story arc, males only, yaoi, rough translation",277,2025-08-02 16:47:27,2025-08-02 16:47:27,2025-08-03 14:03:26
587654,[Naraku No Nimotsu] Badidi x Nobara [CrossOver Doujin Commission] (Jujutsu Kaisen x Dragon Ball Z),,Badidi x Nobara,english,,naraku no nimotsu,doujinshi,"dragon ball z, jujutsu kaisen",nobara kugisaki,"big breasts, defloration, mind control, rimjob, paizuri, mosaic censorship, smalldom",5,2025-08-02 16:48:05,2025-08-02 16:48:05,2025-08-03 14:03:27
587655,[Ateam (yuru)] Sensei no Katatsumuri | 老师的小蜗牛们 (Blue Archive) [Chinese] [欶澜汉化组] [Digital],[Ateam (yuru)] せんせいのかたつむり (ブルーアーカイブ) [DL版] [中国翻訳],Sensei no Katatsumuri | 老师的小蜗牛们,"translated, chinese",yuru,,doujinshi,blue archive,"koharu shimoe, sensei",,15,2025-08-02 17:01:18,2025-08-02 17:01:18,2025-08-03 14:03:28
587656,[Yukimaruya (Yukimuramaru)] Kouyuubutsu Shoujo 4 [Ongoing],公有物少女4,Kouyuubutsu Shoujo 4,"translated, chinese",yukimuramaru,,doujinshi,original,,"anal, sex toys",22,2025-08-02 17:02:36,2025-08-02 17:02:36,2025-08-03 14:03:29
587657,[Shakkotsu no Shibazuke (Takafuji)] Ai-Chan's First Time ♂♂♂♂♂,[甘噛本舗 (まんの)] 入り浸りギャルにま〇こ使わせて貰う話4 [英訳] [DL版],Ai-Chan's First Time ♂♂♂♂♂,"english, translated",,,doujinshi,idoly pride,,"futanari, kissing, big breasts, nakadashi, hairy, x-ray, muscle, big penis, sole female, sole dickgirl, rough translation, full-packaged futanari, dickgirl on female",34,2025-08-02 17:04:41,2025-08-02 17:04:41,2025-08-03 14:03:30
587658,(COMIC TREASURE 37) [Matatabi] Miko x Bondage x Rubber,(こみっくトレジャー37) [マタタビ精肉店] 巫女×拘束×ラバー [DL版],Miko x Bondage x Rubber,japanese,,,doujinshi,,,"chastity belt, gag, miko, bondage, latex, blindfold, collar, nipple piercing",9,2025-08-02 17:05:20,2025-08-02 17:05:20,2025-08-03 14:03:31
587659,[4HEADBOIII] State mandated GF,,State mandated GF,english,,,doujinshi,"sousou no frieren | frieren beyond journeys end, zenless zone zero","frieren, burnice white","big breasts, gag, unusual pupils, machine, body modification, ahegao, mind control, stockings, small breasts, collar, crotch tattoo",30,2025-08-02 18:02:30,2025-08-02 18:02:30,2025-08-03 14:03:32
587660,[TJ_studio (Toji)] Josou Ouji wa Wakarasetai! | 女装王子想要好好教训！[Chinese] [白杨汉化组],[TJ_studio (冬至)] 女装王子はわからせたい! [中国翻訳],Josou Ouji wa Wakarasetai! | 女装王子想要好好教训！,"translated, chinese",toji,tj studio,doujinshi,original,,"twins, inseki, group, schoolgirl uniform, anal, ffm threesome, crossdressing, lolicon, incest, sister, tomgirl, blackmail, sole male, twintails, anal intercourse, nipple stimulation, mesugaki",46,2025-08-02 18:10:50,2025-08-02 18:10:50,2025-08-03 14:03:33
587661,[1St-Kuro] That Night (Strike Witches),,That Night,japanese,1st-kuro,,doujinshi,strike witches,"minna-dietlinde wilcke, mio sakamoto",yuri,33,2025-08-02 18:12:42,2025-08-02 18:12:42,2025-08-03 14:03:34
587662,[MM] Kohai to Ichaicha Suru Hanashi,,Kohai to Ichaicha Suru Hanashi,"translated, chinese",mmchair,,doujinshi,original,,"glasses, sole female, sole male, no penetration, extraneous ads",21,2025-08-02 18:14:03,2025-08-02 18:14:03,2025-08-03 14:03:35
587663,[赤城あさひと]不良っぽい彼女はダラダラしたい』,,不良っぽい彼女はダラダラしたい』,"translated, chinese",akagi asahito,,doujinshi,,,"sole female, sole male, manga, extraneous ads",16,2025-08-02 18:15:05,2025-08-02 18:15:05,2025-08-03 14:03:35
587664,[わづち直] イメージチェンジ,,イメージチェンジ,"translated, chinese",wazuchi nao,,doujinshi,,,"bbw, full censorship, manga, extraneous ads",27,2025-08-02 18:16:50,2025-08-02 18:16:50,2025-08-03 14:03:36
587665,[みなもと小定]「待て」はできない,,「待て」はできない,"translated, chinese",minamoto kosada,,doujinshi,,,"big breasts, glasses, sole male, kemonomimi, manga, extraneous ads",23,2025-08-02 18:18:25,2025-08-02 18:18:25,2025-08-03 14:03:37
587666,[ポン貴花田] わたしの奥にとどくきみ vol.7。,,わたしの奥にとどくきみ vol.7。,"translated, chinese",pon takahanada,,doujinshi,,,"full censorship, kimono, tall girl, sole female, sole male, manga, extraneous ads",23,2025-08-02 18:20:04,2025-08-02 18:20:04,2025-08-03 14:03:38
587667,[Amuai Okashi Seisakusho (Tsukumaru)] The Delinquent Son’s TS Re-Education Plan! [English],[あむぁいおかし製作所 (つく丸)] 不良息子のTS育て直し計画!,The Delinquent Son’s TS Re-Education Plan!,"english, translated",tsukumaru,amuai okashi seisakusho | amulai sweet factory,doujinshi,original,,"maid, bdsm, big breasts, machine, nakadashi, mind control, incest, stockings, paizuri, daughter, blowjob, collar, feminization, deepthroat, granddaughter, twintails, gender change",44,2025-08-02 18:22:43,2025-08-02 18:22:43,2025-08-03 14:03:39
587668,[Momoiro-netsuduki (Kisaki Nana)]1824+α (Osomatsu-San)[Chinese],,1824+α,"translated, chinese",kisaki nana,momoiro-netsuduki,doujinshi,osomatsu-san,"ichimatsu matsuno, karamatsu matsuno","kissing, schoolboy uniform, anal, brother, males only, incest, yaoi, anal intercourse",91,2025-08-02 18:27:58,2025-08-02 18:27:58,2025-08-03 14:03:40
587669,[Jamming] Sensei ni Dashitee! - It ejaculates in the teacher! [Chinese] [Decensored],[じゃみんぐ] 先生に射精してぇ！[中国翻訳] [無修正],Sensei ni Dashitee! - It ejaculates in the teacher!,"translated, chinese",jamming,,manga,,,,216,2025-08-02 18:40:20,2025-08-02 18:40:20,2025-08-03 14:03:40
587670,[Syunichi Kansuu (Syunichi)] Koushi Kondou Namahame Koubi | Mixing Business with Raw Pleasure (Blue Archive) [English] [Coffedrug] [Digital] [Decensored],[しゅにち関数 (しゅにち)] 公私混同生ハメ交尾 (ブルーアーカイブ) [英訳] [DL版],Koushi Kondou Namahame Koubi | Mixing Business with Raw Pleasure,"english, translated",syunichi,syunichi kansuu,doujinshi,blue archive,"sensei, aoi oki","elf, big breasts, uncensored, big ass, nakadashi, ahegao, x-ray, defloration, big areolae, orgasm denial, fingering, teacher, impregnation, muscle, sole female, sole male, beauty mark, gloves, multiple orgasms, halo",35,2025-08-02 18:42:37,2025-08-02 18:42:37,2025-08-03 14:03:41
