ID,EN_TITLE,JP_TITLE,CLEAN_TITLE,LANGUAGE,ARTIST,GROUP_NAME,CATEGORY,PARODY,CHARACTER,TAGS,PAGES,UPLOAD_DATE,FORMATTED_DATE,SCRAPED_DATE
612921,[神仙] 秦で捕まったコヤンスカヤ (Fate/Grand Order),[神仙] 秦で捕まったコヤンスカヤ (Fate/Grand Order),秦で捕まったコヤンスカヤ,japanese,,,doujinshi,fate grand order,koyanskaya,"glasses, kemonomimi",27,2025-12-02 06:12:54,2025-12-02 06:12:54,2025-12-03 14:01:45
612922,[神仙] シャルリアハード  (ワンピース),[神仙] シャルリアハード  (ワンピース),シャルリアハード,japanese,,,doujinshi,one piece,,,59,2025-12-02 06:16:39,2025-12-02 06:16:39,2025-12-03 14:01:46
612923,[神仙] 高画質版 (王様ランキング),[神仙] 高画質版 (王様ランキング),高画質版,japanese,,,doujinshi,ousama ranking,hiling,"mother, incest",26,2025-12-02 06:18:20,2025-12-02 06:18:20,2025-12-03 14:01:47
612924,[MangMoongMing] Step Sis x Big Bro | 조그만 누나와 큰 동생.  | 小不点姐姐与大块头弟弟 [中文翻译]（更新中）,[망뭉밍] 조그만 누나와 큰 동생[中文翻译]（更新中）,Step Sis x Big Bro | 조그만 누나와 큰 동생.  | 小不点姐姐与大块头弟弟（更新中）,"translated, chinese",mangmoongming,,doujinshi,original,,"full censorship, tall man, dark skin, full color, incest, big penis, stomach deformation, webtoon, bald",336,2025-12-02 06:42:28,2025-12-02 06:42:28,2025-12-03 14:01:48
612925,[DARKMOON (Nanten)] Do-S Shitsuke Gakari to Akuyaku Reijou Lesson3 ~Shitsuke Gakari Saigo no Choukyou!?~,[DARKMOON (南天)] ドS躾け係と悪役令嬢Lesson3 ～躾け係最後の調教⁉～,Do-S Shitsuke Gakari to Akuyaku Reijou Lesson3,japanese,nanten,darkmoon,doujinshi,,,"cunnilingus, mmf threesome, group, x-ray, sole female",44,2025-12-02 06:45:38,2025-12-02 06:45:38,2025-12-03 14:01:48
612926,[NCP (big.g)] Yokkyuu Fuman Zuma shika Inai Shima 3 ~ Erroi Fuushuu no Aru Shima de Morafuo kara Hitozuma o Netotte Haramaseru~,[NCP (big.g)] 欲求不満妻しかいない島3 ～エッロい風習のある島でモラ夫から人妻を寝取ってハラマセル～   【XY个人翻译】,Yokkyuu Fuman Zuma shika Inai Shima 3,"translated, chinese",,,doujinshi,,,"milf, rough translation",22,2025-12-02 06:47:17,2025-12-02 06:47:17,2025-12-03 14:01:49
612927,[Mogura no Suana (zeiminarai)] Doukeshi wa Boku no Ougonkyou (Dungeon Meshi),[モグラの巣穴 (zeiminarai)] 道化師は僕の黄金郷 (ダンジョン飯),Doukeshi wa Boku no Ougonkyou,japanese,,,doujinshi,dungeon meshi,thistle,"elf, dark skin, blowjob, gender change",21,2025-12-02 06:48:45,2025-12-02 06:48:45,2025-12-03 14:01:49
612928,[神仙] 禍津姫の巫女VS7人ミサキ,[神仙] 禍津姫の巫女VS7人ミサキ,禍津姫の巫女VS7人ミサキ,japanese,,,doujinshi,original,,big breasts,56,2025-12-02 06:52:36,2025-12-02 06:52:36,2025-12-03 14:01:50
612929,[Bullet] Otoko no ko Mahō Shōjo no Ecchi na Maryoku Hokyū Afutā | Femboy Magical Girl’s Naughty Mana Recharge After Story [English] [LKK•Scans],[おちゃづけ] 男の娘魔法少女のエッチな魔力補給 アフター,Otoko no ko Mahō Shōjo no Ecchi na Maryoku Hokyū Afutā | Femboy Magical Girl’s Naughty Mana Recharge After Story,"english, translated",baret,,doujinshi,original,,"futanari, transformation, big breasts, corruption, schoolgirl uniform, nakadashi, anal, crossdressing, shemale, dark skin, multi-work series, bunny girl, breast expansion, yaoi, gyaru, tomgirl, blowjob, big penis, feminization, male on dickgirl, sole dickgirl, crotch tattoo, anal intercourse, gender morph, gender change, full-packaged futanari",36,2025-12-02 06:55:02,2025-12-02 06:55:02,2025-12-03 14:01:51
612930,[セイドレイ・フェタチーロ] マルシルとファリンの臭いフェチ料理 (Dungeon Meshi),,マルシルとファリンの臭いフェチ料理,japanese,,,doujinshi,dungeon meshi,marcille donato,"elf, big breasts, gag",24,2025-12-02 07:01:57,2025-12-02 07:01:57,2025-12-03 14:01:51
612931,[耕色堂] マルシルと温泉えっち (Dungeon Meshi),,マルシルと温泉えっち,japanese,,,doujinshi,dungeon meshi,marcille donato,"elf, ponytail, onsen",105,2025-12-02 07:08:56,2025-12-02 07:08:56,2025-12-03 14:01:52
612932,[Hissatsuwaza (Hissatsukun)] Onsen Ryokan III [Chinese] [Digital],ひっさつわざ (ひっさつくん)] 温泉旅姦III [中国翻訳] [DL版],Onsen Ryokan III,"translated, chinese",hissatsukun,hissatsuwaza,doujinshi,,,"big breasts, multi-work series, rape, bbm",30,2025-12-02 07:11:12,2025-12-02 07:11:12,2025-12-03 14:01:52
612933,[Seinyanko Gakuen (Kozue Akari)] Mitsuyaku ~Secret Wedding~ (Sengoku Otome) [Chinese] [Script7810],[聖にゃんこ学園 (こずえあかり)] 密約～Secret Wedding～ (戦国乙女) [中国翻訳],Mitsuyaku,"translated, chinese",kozue akari,seinyanko gakuen,doujinshi,sengoku otome,,"females only, yuri, mosaic censorship, ponytail",53,2025-12-02 07:14:48,2025-12-02 07:14:48,2025-12-03 14:01:53
612934,[prhs] Yaoyorozu Naburi 4 ~ Kamigakashi hen [Digital],[prhs] 八百万嬲り【FANZA限定】4〜神犯し編【デジタル特装版】,Yaoyorozu Naburi 4 ~ Kamigakashi hen,japanese,prhs,,manga,,,"story arc, multi-work series, tankoubon, tentacles",310,2025-12-02 07:32:43,2025-12-02 07:32:43,2025-12-03 14:01:54
612935,[U.R.C (Momoya Show-Neko)] Nekoyashiki Y no Junan - SUFFERING OF NEKOYASHIKI Y (Wonderful PreCure!) [Chinese] [不咕鸟汉化组] [Digital],[U.R.C (桃屋しょう猫)] 猫屋敷Yの受難 (わんだふるぷりきゅあ!) [中国翻訳] [DL版],Nekoyashiki Y no Junan - SUFFERING OF NEKOYASHIKI Y,"translated, chinese",momoya show-neko,u.r.c,doujinshi,wonderful precure,"cure lillian | mayu nekoyashiki, cure nyammy | yuki nekoyashiki","squirting, kissing, transformation, magical girl, group, ahegao, anal, thigh high boots, multi-work series, drugs, double penetration, fingering, rape, ponytail, anal intercourse, nipple stimulation",31,2025-12-02 07:34:59,2025-12-02 07:34:59,2025-12-03 14:01:54
612936,"[Maikage (Mikage)] Senpai no Tame ni, Dakaremasu.丨为了前辈，我愿意献身 [Chinese]",[舞影 (美影)] 先輩のために、抱かれます。 [中国翻訳],"Senpai no Tame ni, Dakaremasu.丨为了前辈，我愿意献身","translated, chinese",mikage,maikage,doujinshi,original,,"big breasts, netorare, schoolgirl uniform, condom, nakadashi, swinging, paizuri, filming, voyeurism, muscle, big penis, stomach deformation, sole female, beauty mark, netorase",72,2025-12-02 08:04:51,2025-12-02 08:04:51,2025-12-03 14:01:55
612937,[Yachou (Bloiler Yachou)] Ichiryuu Sennyuu Sousakan Haiboku丨一流潜入捜査官敗北 [Chinese],[野鳥 (ブロイラー野鳥)] 一流潜入捜査官敗北 [中国翻訳],Ichiryuu Sennyuu Sousakan Haiboku丨一流潜入捜査官敗北,chinese,,,doujinshi,,,big breasts,28,2025-12-02 08:06:49,2025-12-02 08:06:49,2025-12-03 14:01:55
612938,[Habutton] Honeymoon Days [English],,Honeymoon Days,"english, translated",habutton,bhm,doujinshi,original,,"bbw, weight gain, bbm",18,2025-12-02 08:08:07,2025-12-02 08:08:07,2025-12-03 14:01:56
612939,[Anabuki Bouhatei] Bakunyuu Gal no Kakushigoto丨巨乳辣妹的隐瞒之事 [Chinese],[穴吹防波堤] 爆乳ギャルのカクシゴト [中国翻訳],Bakunyuu Gal no Kakushigoto丨巨乳辣妹的隐瞒之事,"translated, chinese",anabuki bouhatei,,doujinshi,,,"big breasts, big ass, schoolgirl uniform, nakadashi, huge breasts, hairy, gyaru, inverted nipples, sole female, sole male",37,2025-12-02 08:10:34,2025-12-02 08:10:34,2025-12-03 14:01:56
612940,[UraNai] Junior Idol ga Nama Honban de go Houshi Shitekureru Koukyuu ura Soopu Haado,[Uraナイ] ジュニアアイドルが生本番でご奉仕してくれる高級裏ソープ ハード,Junior Idol ga Nama Honban de go Houshi Shitekureru Koukyuu ura Soopu Haado,japanese,uranai,,doujinshi,,,"prostitution, multi-work series",42,2025-12-02 08:13:20,2025-12-02 08:13:20,2025-12-03 14:01:57
612941,[Ushinomiya (Ushinomiya)] Doll Muchi na Jinzou Otome-tachi haitatsuin Arisu-hen,[ウシノミヤ (うしのみや)]ドール 無知な人造乙女たち 配達員アリス編,Doll Muchi na Jinzou Otomehen,japanese,ushinomiya,ushinomaruyaki,doujinshi,,,"big breasts, robot, ponytail",33,2025-12-02 08:15:34,2025-12-02 08:15:34,2025-12-03 14:01:57
612942,[kocc House (nama)] -connect- [Digital] [Tenuous Scans],[koccハウス (nama)] -connect- [DL版],[kocc House (nama)] -connect- [Digital] [Tenuous Scans],"english, translated",namatsui,kocc house,doujinshi,,,"schoolboy uniform, schoolgirl uniform, condom, sole female, sole male",28,2025-12-02 08:17:25,2025-12-02 08:17:25,2025-12-03 14:01:58
612943,[Aimitsu] Ishuzoku Lesbians - Interspecies Lesbians [Digital],[姶蜜] 異種族レズビアンズ [DL版],Ishuzoku Lesbians - Interspecies Lesbians,japanese,aimitsu,,manga,,,"futanari, elf, big breasts, monster girl, nakadashi, slime girl, yuri, double penetration, breast expansion, tankoubon, multiple arms, lactation, stockings, paizuri, inverted nipples, blowjob, tentacles, kemonomimi, horns, eye-covering bang, anal intercourse, full-packaged futanari, dickgirl on female, futanarization",171,2025-12-02 08:28:48,2025-12-02 08:28:48,2025-12-03 14:01:59
612944,[Permission (Alisame)] Yuusha no Haikijou de Succubus ni Mujihi ni Level Drain Sareru Ohanashi [Chinese],[ぱ～みっしょん (在鮫)] 勇者の廃棄場でサキュバスに無慈悲にレベルドレインされるお話 [中国翻訳],Yuusha no Haikijou de Succubus ni Mujihi ni Level Drain Sareru Ohanashi,"translated, chinese",alisame,permission,doujinshi,,,"wings, femdom, demon girl, rape, sole male, horns, tail, extraneous ads",33,2025-12-02 09:02:40,2025-12-02 09:02:40,2025-12-03 14:01:59
612945,お隣さんと僕,,お隣さんと僕,japanese,,,doujinshi,,,"big breasts, huge breasts, artistcg, paizuri",110,2025-12-02 09:08:47,2025-12-02 09:08:47,2025-12-03 14:02:00
612946,絶倫ショタ勇者の救いなき冒険,,絶倫ショタ勇者の救いなき冒険,japanese,,,doujinshi,,,"artistcg, slime girl",52,2025-12-02 09:11:41,2025-12-02 09:11:41,2025-12-03 14:02:00
612947,[Hissatsuwaza (Hissatsukun)] Onsen Ryokan III [Chinese] [Digital],[ひっさつわざ (ひっさつくん)] 温泉旅姦III [中国翻訳] [DL版],Onsen Ryokan III,"translated, chinese",hissatsukun,hissatsuwaza,doujinshi,,,"big breasts, multi-work series, rape, bbm",34,2025-12-02 09:14:00,2025-12-02 09:14:00,2025-12-03 14:02:01
612948,[Hatome Honpo (Hatome)] Maryokugire de Miugoki ga Torenai Mahou Shoujo Aite ni Makeru Wake ga Nai daro! [Chinese] [紫藤汉化组],[はとめ本舗 (はとめ)] 魔力切れで身動きが取れない魔法少女相手に負ける訳がないだろ! [中国翻訳],Maryokugire de Miugoki ga Torenai Mahou Shoujo Aite ni Makeru Wake ga Nai daro!,"translated, chinese",hatome,hatome honpo,doujinshi,original,,"magical girl, nakadashi, ahegao, blowjob face, bondage, x-ray, stockings, eyepatch, blowjob, blindfold, collar, deepthroat, sole female, sole male, focus blowjob",31,2025-12-02 09:16:11,2025-12-02 09:16:11,2025-12-03 14:02:01
612949,搾精廃墟2～人外に精を根こそぎ搾り取られる男の子たち～,,搾精廃墟2～人外に精を根こそぎ搾り取られる男の子たち～,japanese,,,doujinshi,,,"big breasts, artistcg",72,2025-12-02 09:20:36,2025-12-02 09:20:36,2025-12-03 14:02:02
612950,[Osuwaani] Request Itadaita Mono Desu,[オスワーニ] リクエストいただいたものです,Request Itadaita Mono Desu,japanese,osuwaani,,doujinshi,,,,2,2025-12-02 09:20:58,2025-12-02 09:20:58,2025-12-03 14:02:03
612951,"[Zupps (Yoikono tt, Katsura Airi)] Karami Zakari if Boys Love 3",カラミざかり if Boys Love3～親友♂とのセックスが忘れられない俺～,Karami Zakari if Boys Love 3,japanese,yoikono tt,,doujinshi,,,"netorare, anal, yaoi",88,2025-12-02 09:26:23,2025-12-02 09:26:23,2025-12-03 14:02:03
612952,無口だけどカラダの主張は強い爆乳メカクレシスターさん調子に乗った少年のボス猿チンポにブチ犯されまくって全身汁まみれケモノセックス,,無口だけどカラダの主張は強い爆乳メカクレシスターさん調子に乗った少年のボス猿チンポにブチ犯されまくって全身汁まみれケモノセックス,japanese,,,doujinshi,,,"big breasts, nun, bbw, big nipples, big ass, nakadashi, huge breasts, dark skin, big areolae, stuck in wall, impregnation, deepthroat, sole female, sole male, beauty mark, eye-covering bang, fanny packing",31,2025-12-02 09:28:26,2025-12-02 09:28:26,2025-12-03 14:02:04
612953,[Shinozaki Rei] Dosukebe Kyojiri Musume Lily,[しのざき嶺] どスケベ巨尻娘Lily,Dosukebe Kyojiri Musume Lily,japanese,shinozaki rei,,manga,,,"glasses, tankoubon",179,2025-12-02 10:11:57,2025-12-02 10:11:57,2025-12-03 14:02:04
612954,[Takasugi Kou] My Fair MILF,[タカスギコウ] My Fair MILF,My Fair MILF,japanese,takasugi kou,,manga,,,"milf, big breasts, mother, hairy, incest, tankoubon, teacher",216,2025-12-02 10:25:40,2025-12-02 10:25:40,2025-12-03 14:02:05
612955,[Hoshiduki Melon] Game Furin Numa ~Inran Hitozuma ga Dan Houkai Saseru made~,[星月めろん] ゲーム不倫沼～淫乱人妻が団崩壊させるまで～,Game Furin Numa,japanese,hoshiduki melon,,manga,,,"milf, big breasts, tankoubon",196,2025-12-02 10:38:52,2025-12-02 10:38:52,2025-12-03 14:02:05
612956,[Kuroi Kingyo] Damesu Switch,[黒井きんぎょ] 堕牝スイッチ,Damesu Switch,japanese,kuroi kingyo,,manga,,,"milf, big breasts, tankoubon",196,2025-12-02 10:52:01,2025-12-02 10:52:01,2025-12-03 14:02:06
612957,[Drill Murata] Mesu Etsu Toiki Nemoto made Fukaku…,[ドリルムラタ] メス悦吐息 根元まで深く…,Mesu Etsu Toiki Nemoto made Fukaku…,japanese,drill murata,,manga,,,"big breasts, mmf threesome, group, glasses, ffm threesome, bikini, stockings, pantyhose, filming, dilf, blowjob",197,2025-12-02 11:04:51,2025-12-02 11:04:51,2025-12-03 14:02:07
612958,[38] イドリー (ゼンレスゾーンゼロ),[38] イドリー (ゼンレスゾーンゼロ),イドリー,japanese,38 | thirty8ght,,doujinshi,zenless zone zero,yidhari murphy,,16,2025-12-02 11:06:12,2025-12-02 11:06:12,2025-12-03 14:02:07
612959,[Minamida Usuke] Inyoku Hitodzuma Ohogoe Sengen | Horny Milf's Orgasmic Announcement (COMIC HOTMiLK Koime Vol. 55) [English] [skibidibenki] [Digital],[南田U助] 淫欲人妻オホ声宣言 (コミックホットミルク濃いめ vol.55) [英訳] [DL版],Inyoku Hitodzuma Ohogoe Sengen | Horny Milf's Orgasmic Announcement,"english, translated",minamida usuke,,manga,,,"milf, big breasts, cheating, nakadashi, drunk, blowjob, big penis, sole female, sole male, beauty mark, makeup, eye-covering bang",25,2025-12-02 11:07:50,2025-12-02 11:07:50,2025-12-03 14:02:08
612960,[MANA] Yixuan4 (Zenless Zone Zero) [Chinese] [Decensored],,Yixuan4,chinese,mana | remana,,doujinshi,zenless zone zero,yixuan,"big breasts, uncensored",10,2025-12-02 11:08:44,2025-12-02 11:08:44,2025-12-03 14:02:08
612961,Onichichi Harem,おにちちハーレム,Onichichi Harem,"english, translated",momiyama,,doujinshi,,,"big breasts, group, huge breasts, demon girl, dark skin, lactation, ponytail, horns, eye-covering bang, rough translation",190,2025-12-02 11:20:26,2025-12-02 11:20:26,2025-12-03 14:02:09
612962,[Asuhar] Hitozuma datte Dakaretai,[アスハー] 人妻だって抱かれたい,Hitozuma datte Dakaretai,japanese,,,doujinshi,original,,"milf, big breasts, bbw, netorare, cheating, nakadashi, huge breasts, blowjob face, hairy, bunny girl, stockings, lingerie, fingering, blowjob, collar, sole female, sole male, missing cover, beauty mark, gloves",43,2025-12-02 11:23:14,2025-12-02 11:23:14,2025-12-03 14:02:09
612963,[みつのほ] あの時の約束を果たせぬまま無理やり襲われる日,[みつのほ] あの時の約束を果たせぬまま無理やり襲われる日,あの時の約束を果たせぬまま無理やり襲われる日,japanese,ariku,mitsunoho,doujinshi,,,,50,2025-12-02 11:26:59,2025-12-02 11:26:59,2025-12-03 14:02:10
612964,[Hiroyoshi Kira] Taking a Hot Tanned Chicks Virginity Vol.1-4 [English] [Decensored] [Ongoing],,Taking a Hot Tanned Chicks Virginity Vol.1-4,"english, translated",kira hiroyoshi,,manga,,,"maid, big breasts, swimsuit, uncensored, story arc, bikini, exhibitionism, full color, multi-work series, gyaru, sole male",293,2025-12-02 11:46:00,2025-12-02 11:46:00,2025-12-03 14:02:11
612965,[Hissatsuwaza (Hissatsukun)] Homeless Mura - homelessness village IV [Chinese] [SEXJK个人汉化] [Digital],[ひっさつわざ (ひっさつくん)] ホームレス村IV [中国翻訳] [DL版],Homeless Mura - homelessness village IV,"translated, chinese",hissatsukun,hissatsuwaza,doujinshi,,,"group, multi-work series, rape, ponytail",36,2025-12-02 11:48:28,2025-12-02 11:48:28,2025-12-03 14:02:11
612966,[Hissatsuwaza (Hissatsukun)] Onsen Ryokan III [Chinese] [SEXJK个人汉化] [Digital],[ひっさつわざ (ひっさつくん)] 温泉旅姦III [中国翻訳] [DL版],Onsen Ryokan III,"translated, chinese",hissatsukun,hissatsuwaza,doujinshi,,,,35,2025-12-02 11:50:51,2025-12-02 11:50:51,2025-12-03 14:02:12
612967,[KeinV] Multinational Investigation Team: Inazuma (Genshin Impact),[KeinV] 多国合同調査チーム·稲妻 (原神),Multinational Investigation Team: Inazuma,"english, translated",maskwolf | keinv,,doujinshi,genshin impact,"aether, keqing, ganyu, yae miko","big breasts, netorare",10,2025-12-02 11:51:44,2025-12-02 11:51:44,2025-12-03 14:02:12
612968,[Dejavu (Kazuna Kei)] LoveHo Jouzu no Mada Takagi-san (Karakai Jouzu no Takagi-san) [DL版],[でjaぶ (計奈恵)] ラブホ上手のまだ高☆さん (からかい上手の高木さん) [DL版],LoveHo Jouzu no Mada Takagi-san,japanese,kazuneko | kazuna kei,dejavu,doujinshi,karakai jouzu no takagi-san,"takagi, nishikata","sole female, sole male",23,2025-12-02 11:53:19,2025-12-02 11:53:19,2025-12-03 14:02:13
612969,[Ten+Aku (MiU)] Chiru Communication 4 (オリジナル) [DL版],[てん+あく (みU)] チルこみゅにけ～しょん4 (オリジナル) [DL版],Chiru Communication 4,japanese,miu,ten plus aku,doujinshi,,,"big breasts, tentacles, sole female",20,2025-12-02 11:54:40,2025-12-02 11:54:40,2025-12-03 14:02:14
612970,"[Tentoumushi no Samba (Jouta, Nanahoshi Tento)] Ei-kun to Okki na Asoko de Torotoro Gekiai Ecchi [Digital]",[てんとうむしのサンバ (茸太、七保志天十)] 英くんとおっきなアソコでとろとろ激愛えっち (オリジナル) [DL版],Ei-kun to Okki na Asoko de Torotoro Gekiai Ecchi,japanese,nanahoshi tento,,doujinshi,,,,96,2025-12-02 12:00:50,2025-12-02 12:00:50,2025-12-03 14:02:14
612971,"[Tentoumushi no Samba (Jouta, Nanahoshi Tento)] Ei-kun to Haramu Made Dekiai Kozukuri Kiroku [Digital]",[てんとうむしのサンバ (茸太、七保志天十)] 英くんと孕むまで溺愛子作り記録 (オリジナル) [DL版],Ei-kun to Haramu Made Dekiai Kozukuri Kiroku,japanese,nanahoshi tento,,doujinshi,,,,91,2025-12-02 12:06:35,2025-12-02 12:06:35,2025-12-03 14:02:15
612972,"[Studio N.BALL (Haritama Hiroki)] Choroi, Joushi Soushuuhen [Digital]",[スタジオN.BALL (針玉ヒロキ)] チョロい、上司 総集編 (オリジナル) [DL版],"Choroi, Joushi Soushuuhen",japanese,haritama hiroki,studio n.ball,doujinshi,,,"big breasts, story arc, anal, soushuuhen",108,2025-12-02 12:13:02,2025-12-02 12:13:02,2025-12-03 14:02:15
612973,[Misaki (Mochioji)] Nin ki Seiso-kei Joyuu no Ura no Kao wa Chou Sex Suki! Tabou de Osaerareta Seiyoku ga Bakuhatsu shite Kyokon Manager to Gakuya de H shichau Hanashi [Chinese],[三崎 (もちおじ)] 人気清楚系女優の裏の顔は超セックス好き!多忙で抑えられた性欲が爆発して巨根マネージャーと楽屋でHしちゃう話 [中国翻訳],Nin ki Seiso-kei Joyuu no Ura no Kao wa Chou Sex Suki! Tabou de Osaerareta Seiyoku ga Bakuhatsu shite Kyokon Manager to Gakuya de H shichau Hanashi,"translated, chinese",mochioji,misaki,doujinshi,,,"big breasts, extraneous ads",51,2025-12-02 12:16:28,2025-12-02 12:16:28,2025-12-03 14:02:16
612974,[Maimu-Maimu] Yarasete Kureru Kanojo no Ane Yuri (33) | 願意讓我上的女友的姐姐由理（33） [Chinese],[舞六まいむ] ヤラせてくれる彼女の姉ユリ（33） [中国翻訳],Yarasete Kureru Kanojo no Ane Yuri| 願意讓我上的女友的姐姐由理（33）,"translated, chinese",maimu-maimu,,doujinshi,,,"squirting, milf, kissing, big breasts, unusual pupils, cheating, nakadashi, ahegao, full color, drunk, sole female, ponytail, eye-covering bang, nipple stimulation",50,2025-12-02 12:19:48,2025-12-02 12:19:48,2025-12-03 14:02:16
612975,[Momomomo Hakushaku] NE SB Pai Choi Invasion,モモモーモー伯爵 - NE SB パイちょむ襲来,NE SB Pai Choi Invasion,japanese,momomomo hakushaku,,doujinshi,,"shirogane noel, oozora subaru","futanari, big breasts",54,2025-12-02 12:23:14,2025-12-02 12:23:14,2025-12-03 14:02:17
612976,[Inoue Kiyoshirou] Houshi-iin no Oshigoto Plus | 奉仕委員的強插性活・PLUS [Chinese] [Decensored] [Digital],[胃之上奇嘉郎] 奉仕委員のおしごと・ぷらす [中国翻訳] [無修正] [DL版],Houshi-iin no Oshigoto Plus | 奉仕委員的強插性活・PLUS,"translated, chinese",inoue kiyoshirou,,manga,,,"big breasts, schoolboy uniform, group, glasses, uncensored, schoolgirl uniform, coach, nakadashi, anal, tanlines, tankoubon, leotard, teacher, school swimsuit, blowjob, anal intercourse, exposed clothing",381,2025-12-02 12:47:42,2025-12-02 12:47:42,2025-12-03 14:02:18
612977,[Bubuzuke] Enkou Sedai [Chinese] [Decensored] [Digital],[ぶぶづけ] 援交世代 [中国翻訳] [無修正] [DL版],Enkou Sedai,"translated, chinese",bubuzuke,,manga,,,"handjob, milf, kissing, gymshorts, group, uncensored, cheating, schoolgirl uniform, prostitution, nakadashi, anal, blowjob face, bodystocking, ffm threesome, femdom, hairy, defloration, assjob, tankoubon, stockings, pantyhose, rimjob, paizuri, bloomers, dilf, blowjob, bbm, beauty mark, anal intercourse, nipple stimulation",221,2025-12-02 13:02:27,2025-12-02 13:02:27,2025-12-03 14:02:19
612978,[inono] Ane o Utta ... | 被出賣的姊姊… [Chinese] [Decensored] [Digital],[inono] 姉を売った… [中国翻訳] [無修正] [DL版],Ane o Utta ... | 被出賣的姊姊…,"translated, chinese",inono | suzuki shigeru,,manga,,,"big breasts, group, uncensored, blowjob, shotacon, deepthroat",205,2025-12-02 13:40:54,2025-12-02 13:40:54,2025-12-03 14:02:19
612979,[Pan to Butterfly. (Tokei Usagi)] Konyoku-zuki no Sukebe Joshi ni Seitsuu Saserarechau Ohanashi [Chinese] [甜族星人赞助汉化],[パンとバタフライ。 (とけーうさぎ)] 混浴好きのスケベ女子に精通させられちゃうお話 [中国翻訳],Konyoku-zuki no Sukebe Joshi ni Seitsuu Saserarechau Ohanashi,"translated, chinese",tokei usagi,pan to butterfly.,doujinshi,,,"nakadashi, dark skin, lolicon, exhibitionism, x-ray, defloration, full color, mosaic censorship, impregnation, shotacon, hidden sex, sentou",43,2025-12-02 13:49:20,2025-12-02 13:49:20,2025-12-03 14:02:20
612980,[Unitoshiki] Kinpatsu Chounyuu Gal ni Gyaku DeliHeal Atsukai Sarete Iru Ore no Hanashi丨關於我被金髮長乳辣妹當作外送茶的故事 [Chinese] [悅文社] [Digital],[ウニトシキ] 金髪長乳ギャルに逆デリヘル扱いされている俺の話 [中国翻訳] [DL版],Kinpatsu Chounyuu Gal ni Gyaku DeliHeal Atsukai Sarete Iru Ore no Hanashi丨關於我被金髮長乳辣妹當作外送茶的故事,"translated, chinese",uni toshiki,,doujinshi,,,"sweating, big breasts, unusual pupils, glasses, condom, facesitting, nakadashi, multi-work series, gyaru, sole female, sole male, beauty mark",30,2025-12-02 13:51:21,2025-12-02 13:51:21,2025-12-03 14:02:20
612981,[Noshi-ya] Fairy-zoku no Onee-chan wa Boku no Senyou Onaho Yousei [English],[ノシ屋] フェアリー族のお姉ちゃんは僕の専用オナホ妖精 [英訳],Fairychan wa Boku no Senyou Onaho Yousei,"english, translated",,,doujinshi,,,"wings, masturbation, x-ray, minigirl, rape, large insertions, blackmail, blowjob, fairy, stomach deformation, sole male, cumflation, domination loss, rough translation",47,2025-12-02 13:54:16,2025-12-02 13:54:16,2025-12-03 14:02:21
612982,(C105) [Kuro Queen (Misaka12003)] Star RailMaid 2 (Honkai Star Rail) (English),(C105) [Kuro Queen (ミサカ12003)] Star Rail:Maid2 (崩壊:スターレイル) [英訳],Star RailMaid 2,"english, translated",misaka12003,,doujinshi,honkai star rail,"robin, kafka, caelus, ruan mei, feixiao, lingsha","maid, nakadashi, blowjob",14,2025-12-02 13:55:31,2025-12-02 13:55:31,2025-12-03 14:02:21
612983,Murasakiu Kokoro-chan ni Waisetsuna Koto o suru Irasuto Manga (Kimi to Idol PreCure),紫雨こころちゃんにわいせつなことをするイラストまんが (キミとアイドルプリキュア♪ ),Murasakiu Kokoro-chan ni Waisetsuna Koto o suru Irasuto Manga,japanese,,,doujinshi,kimi to idol precure,cure kyun kyun | kokoro shigure,"kissing, sleeping, artistcg, armpit licking, smell, blowjob, bbm, sole female, sole male",68,2025-12-02 14:00:02,2025-12-02 14:00:02,2025-12-03 14:02:22
612984,[ミルクセーキ] うちに住みついたこわエロ天使,[ミルクセーキ] うちに住みついたこわエロ天使,うちに住みついたこわエロ天使,japanese,milkshake,,doujinshi,original,,"lolicon, mosaic censorship, sole female, sole male",10,2025-12-02 14:02:17,2025-12-02 14:02:17,2025-12-03 14:02:23
612985,[ミルクセーキ] うちに住みついたこわエロ天使 [無修正],[ミルクセーキ] うちに住みついたこわエロ天使 [無修正],うちに住みついたこわエロ天使,japanese,milkshake,,doujinshi,original,,"uncensored, lolicon, sole female, sole male",10,2025-12-02 14:03:52,2025-12-02 14:03:52,2025-12-03 14:02:23
