ID,EN_TITLE,JP_TITLE,CLEAN_TITLE,LANGUAGE,ARTIST,GROUP_NAME,CATEGORY,PARODY,CHARACTER,TAGS,PAGES,UPLOAD_DATE,FORMATTED_DATE,SCRAPED_DATE
565727,[Ikinuki.] Hikō ni hashitta oshiego no shitsuke ke kata,[イキヌキ。] 非行に走った教え子の躾け方,Hikō ni hashitta oshiego no shitsuke ke kata,japanese,ikinuki.,,doujinshi,,,"big breasts, group, sole male",46,2025-04-01 22:01:25,2025-04-01 22:01:25,2025-04-02 05:12:24
565728,(Tales Link 29) [Kashitsuki (Momoko)] Tenshi no Ori (Tales of Symphonia),(テイルズリンク 29) [菓子つき (桃子)] 天使の檻 (テイルズ オブ シンフォニア),Tenshi no Ori,japanese,momoko,kashitsuki,doujinshi,tales of symphonia,"mithos yggdrasill, genis sage","anal, males only, yaoi, shotacon, anal intercourse",29,2025-04-01 22:08:03,2025-04-01 22:08:03,2025-04-02 05:12:25
565729,[Chiroru]Lingerie Angel (idolish 7 ),,Lingerie Angel,japanese,,chiroru,doujinshi,,,lingerie,25,2025-04-01 22:10:09,2025-04-01 22:10:09,2025-04-02 05:12:26
565730,[Sora Paprika] Kareshi ja kikenai seiso kanojo no Oho koe,[ソーラーぱぷりか] 彼氏じゃ聞けない清楚彼女のオホ声,Kareshi ja kikenai seiso kanojo no Oho koe,japanese,,sora paprika,doujinshi,original,,"big breasts, netorare, schoolgirl uniform, sole female",56,2025-04-01 22:14:53,2025-04-01 22:14:53,2025-04-02 05:12:27
565731,[Dekamatsu] On'na tomodachi no uwaki kokuhaku,[デカマツ] 女友達の浮気告白,On'na tomodachi no uwaki kokuhaku,japanese,,,doujinshi,original,,"big breasts, netorare, cheating, blowjob",68,2025-04-01 22:20:36,2025-04-01 22:20:36,2025-04-02 05:12:28
565732,[kazum] Futon no nakami wa kāsandesu,[kazum] 布団の中身は母さんです,Futon no nakami wa kāsandesu,japanese,kazum,kazum,doujinshi,,,"milf, mother, incest",83,2025-04-01 22:27:59,2025-04-01 22:27:59,2025-04-02 05:12:28
565733,[Neko Samurai] Alicia-san NTR [English] [Fated Circle],[猫サム雷] アリシアさんNTR,Alicia-san NTR,"english, translated",neko samurai,,doujinshi,original,,"big breasts, nun, netorare, huge breasts, paizuri, blowjob, big penis, bbm, sole female, sole male, no penetration, focus paizuri",6,2025-04-01 22:28:47,2025-04-01 22:28:47,2025-04-02 05:12:29
565734,緑子がお供します,,緑子がお供します,japanese,pinta,ayashii bochi,doujinshi,fate grand order,"ushiwakamaru, gudao | ritsuka fujimaru","schoolgirl uniform, sole female, sole male, ponytail, very long hair",20,2025-04-01 22:30:32,2025-04-01 22:30:32,2025-04-02 05:12:30
565735,[NanokaH] Hentai kyonyū no yūtōsei to nōpan danshi no Tanaka-kun,[なのかえいち] 変態巨乳の優等生とノーパン男子の田中クン,Hentai kyonyū no yūtōsei to nōpan danshi no Tanaka-kun,japanese,,nanokah,doujinshi,,,"big breasts, schoolgirl uniform, sole female, sole male",61,2025-04-01 22:35:55,2025-04-01 22:35:55,2025-04-02 05:12:31
565736,牛若丸と暮らすだけ,,牛若丸と暮らすだけ,japanese,pinta,ayashii bochi,doujinshi,fate grand order,"ushiwakamaru, gudao | ritsuka fujimaru","sole female, sole male, ponytail, very long hair",19,2025-04-01 22:37:33,2025-04-01 22:37:33,2025-04-02 05:12:32
565737,[Takaman] Takao (Kantai Collection -KanColle-) [English],[高饅] 高雄 (艦隊これくしょん -艦これ-) [英訳],Takao,"english, translated",takaman,,doujinshi,kantai collection,"takao, teitoku","maid, squirting, sweating, big breasts, garter belt, nakadashi, blowjob face, stockings, blowjob, big penis, deepthroat, sole female, sole male",4,2025-04-01 22:38:11,2025-04-01 22:38:11,2025-04-02 05:12:33
565738,[ARCHF (Riki)] XXXSO DL [Digital],[ARCHF (利木)] XXXSO DL [DL版],XXXSO DL,japanese,riki,archf,doujinshi,,,"big breasts, mmf threesome, group, mind control, mosaic censorship, blowjob, shotacon, sole female",35,2025-04-01 22:45:49,2025-04-01 22:45:49,2025-04-02 05:12:33
565739,[ご飯大盛り]ヒロインを手に入れたいので洗脳悪堕ちさせる事にしました [Digital],[ご飯大盛り]ヒロインを手に入れたいので洗脳悪堕ちさせる事にしました [DL],ヒロインを手に入れたいので洗脳悪堕ちさせる事にしました,japanese,,,doujinshi,original,,"futanari, corruption, strap-on, netorare, bondage, yuri, x-ray, mind control, mosaic censorship, yandere, sole male, sole dickgirl, penis enlargement, dickgirl on female, futanarization",191,2025-04-01 22:59:42,2025-04-01 22:59:42,2025-04-02 05:12:34
565740,[Milk Dipper] 催●体験パーティー〜あおいちゃんはさからえない〜 [Digital],[Milk Dipper] 催●体験パーティー〜あおいちゃんはさからえない〜 [DL],催●体験パーティー〜あおいちゃんはさからえない〜,japanese,,milk dipper,doujinshi,,,"schoolgirl uniform, nakadashi, mind control, mosaic censorship, blowjob, sole female",61,2025-04-01 23:04:38,2025-04-01 23:04:38,2025-04-02 05:12:35
565741,[Nemuneko] Tsuma no Imouto2,[寝夢猫] 妻の妹2,Tsuma no Imouto2,japanese,,nemuneko,doujinshi,original,,"inseki, big breasts, nakadashi, multi-work series, incest, stockings, paizuri, mosaic censorship, sister, sole female, sole male",75,2025-04-01 23:10:28,2025-04-01 23:10:28,2025-04-02 05:12:36
565742,[Kongari Oven] Anokoha kāten no mukō. Hoken-shitsu de onahokoki sa reru boku.,[こんがりオーブン] あの子はカーテンの向こう。保健室でオナホコキされる僕。,Anokoha kāten no mukō. Hoken-shitsu de onahokoki sa reru boku.,japanese,kongari oven,,doujinshi,,,netorare,16,2025-04-01 23:12:04,2025-04-01 23:12:04,2025-04-02 05:12:37
565743,[Corumdum] FGO ga Eroge datta Baai no Paper Moon | Paper Moon if FGO was an Eroge (Fate/Grand Order) [English] [The Blavatsky Project],[こらんだむ] FGOがエロゲだった場合のペーパームーン (Fate/Grand Order) [英訳],FGO ga Eroge datta Baai no Paper Moon | Paper Moon if FGO was an Eroge,"english, translated",corundum,,doujinshi,fate grand order,"sion eltnam atlasia, gudao | ritsuka fujimaru, kama","group, nakadashi, ffm threesome, bikini, lolicon, mosaic censorship, blowjob, sole male, ponytail",11,2025-04-01 23:14:33,2025-04-01 23:14:33,2025-04-02 05:12:37
565744,one piece fav,,one piece fav,japanese,,,doujinshi,one piece,nami,imageset,28,2025-04-01 23:16:49,2025-04-01 23:16:49,2025-04-02 05:12:38
565747,[Kongari Oven] [BSS] tonari kara kikoeru ano ko no etchina sekkyaku,[こんがりオーブン] 【BSS】隣から聞こえるあの子のえっちな接客,tonari kara kikoeru ano ko no etchina sekkyaku,japanese,kongari oven,,doujinshi,,,"netorare, mosaic censorship",34,2025-04-01 23:26:42,2025-04-01 23:26:42,2025-04-02 05:12:40
565748,[Kongari Oven] Kanojo no netorare-banashi o kikasa renagara yokujō aori sasayaki dekoki,[こんがりオーブン] 彼女の寝取られ話を聞かされながら欲情煽り囁き手コキ,Kanojo no netorare-banashi o kikasa renagara yokujō aori sasayaki dekoki,japanese,kongari oven,,doujinshi,,,"netorare, mosaic censorship",48,2025-04-01 23:30:38,2025-04-01 23:30:38,2025-04-02 05:12:41
565749,[Kongari Oven] [NTR] kanojo ga aitsuno-sei shori ni tsukawa re teru hazu ga nai,[こんがりオーブン] 【NTR】彼女がアイツの性処理に使われてるはずがない,kanojo ga aitsuno-sei shori ni tsukawa re teru hazu ga nai,japanese,kongari oven,,doujinshi,,,"netorare, mosaic censorship",46,2025-04-01 23:34:25,2025-04-01 23:34:25,2025-04-02 05:12:41
565750,[Jimpu6]March 7th;Tingyun;Silver Wolf;Jingliu;Sparkle;Feixiao;The Herta;Rappa (Honkai: Star Rail) [Chinese],,March 7th;Tingyun;Silver Wolf;Jingliu;Sparkle;Feixiao;The Herta;Rappa,"translated, chinese",,,doujinshi,honkai star rail,,"full color, rough translation",17,2025-04-01 23:36:07,2025-04-01 23:36:07,2025-04-02 05:12:42
565751,[Kongari Oven] [BSS] fūzoku jō ni natte ita akogare nōnēsan ni (hoka no kyaku to no taiken-dan o) mimimoto de sasayaka renagara dekoki sa re chau hanashi,[こんがりオーブン] 【BSS】風俗嬢になっていた憧れのお姉さんに（他の客との体験談を）耳元で囁かれながら手コキされちゃう話,fūzoku jō ni natte ita akogare nōnēsan nimimimoto de sasayaka renagara dekoki sa re chau hanashi,japanese,kongari oven,,doujinshi,,,"big breasts, mosaic censorship",48,2025-04-01 23:40:07,2025-04-01 23:40:07,2025-04-02 05:12:43
