ID,EN_TITLE,JP_TITLE,CLEAN_TITLE,LANGUAGE,ARTIST,GROUP_NAME,CATEGORY,PARODY,CHARACTER,TAGS,PAGES,UPLOAD_DATE,FORMATTED_DATE,SCRAPED_DATE
587727,[Sebire] 無口だけど愛情表現が激しいデカ乳の幼なじみ [Digital],[せびれ] 無口だけど愛情表現が激しいデカ乳の幼なじみ [DL版],無口だけど愛情表現が激しいデカ乳の幼なじみ,japanese,,sebire,doujinshi,,,"big breasts, x-ray, full color, mosaic censorship, sole female",73,2025-08-03 06:24:10,2025-08-03 06:24:10,2025-08-04 14:01:35
587728,[on]尾张在NTRplay中的对象是前男友[个人机翻][chinese],寝取らせプレイの相手が元彼だった,尾张在NTRplay中的对象是前男友,"translated, chinese",,,doujinshi,,,"misc, rough translation",25,2025-08-03 06:25:43,2025-08-03 06:25:43,2025-08-04 14:01:36
587729,[on]尾张在NTR play中的对象是前男友[个人机翻][chinese],寝取らせプレイの相手が元彼だった,尾张在NTR play中的对象是前男友,"translated, chinese",,,doujinshi,,,"misc, rough translation",25,2025-08-03 06:27:07,2025-08-03 06:27:07,2025-08-04 14:01:37
587730,"[Ajisaidenden (Kawakami Rokkaku, Takanashi Rei)] Kiyoshimo to Issho ni Vacances Shiyo! (Kantai Collection -KanColle-) [Digital]",[アジサイデンデン (川上六角、小鳥遊レイ)] 清霜といっしょにバカンスしよ! (艦隊これくしょん -艦これ-) [DL版],Kiyoshimo to Issho ni Vacances Shiyo!,japanese,"kawakami rokkaku, takanashi rei",ajisaidenden,doujinshi,kantai collection,,full color,44,2025-08-03 06:30:18,2025-08-03 06:30:18,2025-08-04 14:01:37
587731,[Pink Sakuhin Okiba (Pink Taro)] Osananajimi ga Mama to Yatte Imasu 13 CHINESE（Cannon个人翻译）,(ピンク☆太郎)] 幼なじみがママとヤっています 13 中文 （Cannon个人翻译）,Osananajimi ga Mama to Yatte Imasu 13 CHINESE（Cannon个人翻译）,"translated, chinese",pink taro,pink sakuhin okiba,manga,,,,70,2025-08-03 07:04:17,2025-08-03 07:04:17,2025-08-04 14:01:38
587732,[Aoba Momiji] 会社のマドンナ的存在と一夜限りの関係になる… [Digital],[青葉もみじ] 会社のマドンナ的存在と一夜限りの関係になる… [DL版],会社のマドンナ的存在と一夜限りの関係になる…,japanese,,,doujinshi,,,full censorship,52,2025-08-03 07:07:22,2025-08-03 07:07:22,2025-08-04 14:01:39
587733,[千ノ桃工房] キギキタン〜第四王女は快楽がお好き〜 [Digital],[千ノ桃工房] キギキタン〜第四王女は快楽がお好き〜 [DL版],キギキタン〜第四王女は快楽がお好き〜,japanese,,,doujinshi,,,mosaic censorship,63,2025-08-03 07:11:06,2025-08-03 07:11:06,2025-08-04 14:01:40
587734,[013] 蔚藍檔案路人角色本 - 三一綜合學園篇 (Blue Archive) [Decensored],,蔚藍檔案路人角色本 - 三一綜合學園篇,chinese,013,,doujinshi,blue archive,jtf mob,"uncensored, eye-covering bang, halo",24,2025-08-03 07:12:35,2025-08-03 07:12:35,2025-08-04 14:01:41
587735,[手裏剣オブザイヤー] 白い48の空間ー距離感の縮め方がエグいギャルのひみつー [Digital],[手裏剣オブザイヤー] 白い48の空間ー距離感の縮め方がエグいギャルのひみつー [DL版],白い48の空間ー距離感の縮め方がエグいギャルのひみつー,japanese,aramaki shake,,doujinshi,,,,54,2025-08-03 07:15:47,2025-08-03 07:15:47,2025-08-04 14:01:42
587736,[on]尾张在NTRplay中的对象是前男友2[个人机翻][chinese],寝取らせプレイの相手が元彼だった,尾张在NTRplay中的对象是前男友2,"translated, chinese",on fan,,doujinshi,,,"misc, rough translation",28,2025-08-03 07:17:36,2025-08-03 07:17:36,2025-08-04 14:01:43
587737,[Rat Squeak] Funny Bunny (ongoing),,Funny Bunny,english,rat squeak,,doujinshi,original,,"catboy, uncensored, bunny boy, anal, crossdressing, males only, yaoi, pantyhose, tomgirl, blowjob, kemonomimi, anal intercourse",8,2025-08-03 07:18:14,2025-08-03 07:18:14,2025-08-04 14:01:43
587738,[Muchi Maro] Etsuran Chuui!!! Ki o Tsukete! (Seitokai ni mo Ana wa Aru!),[むちまろ] 閲覧注意！！！気を付けて！(生徒会にも穴はある!),Etsuran Chuui!!! Ki o Tsukete!,japanese,muchi maro,,doujinshi,seitokai ni mo ana wa aru,komaro michinoko,"big breasts, mmf threesome, group, schoolgirl uniform, ryona, sleeping, low bestiality, rape, sole female",14,2025-08-03 07:19:10,2025-08-03 07:19:10,2025-08-04 14:01:44
587739,[手裏剣オブザイヤー] この間まで処女だったS妹におにいちんち〇をお仕置きされる [Digital],[手裏剣オブザイヤー] この間まで処女だったS妹におにいちんち〇をお仕置きされる [DL版],この間まで処女だったS妹におにいちんち〇をお仕置きされる,japanese,aramaki shake,,doujinshi,,,,36,2025-08-03 07:21:21,2025-08-03 07:21:21,2025-08-04 14:01:45
587740,[Z-CHO] 悪魔のような女教師にぶっかけリベンジ [Digital],[Z超] 悪魔のような女教師にぶっかけリベンジ [DL版],悪魔のような女教師にぶっかけリベンジ,japanese,zecchou,,doujinshi,,,,48,2025-08-03 07:24:16,2025-08-03 07:24:16,2025-08-04 14:01:45
587741,(SCC24/REDBLUE) [Sera(anna)]Tony&Gilver REMIX [Tony x Gilver](Devil May Cry) [Chinese],(SCC24/REDBLUE) [Sera(安奈)]Tony&Gilver REMIX [トニギル](デビルメイクライ) [中国翻訳],Tony&Gilver REMIX,"translated, chinese",anna,,doujinshi,devil may cry,"vergil, dante","twins, brother, males only, incest, yaoi",213,2025-08-03 07:36:06,2025-08-03 07:36:06,2025-08-04 14:01:46
587742,[Killout (Sayakappa)] 敗戦国ノ王女〜肉穴奴●の刻印〜 [Digital],[Killout (さやかっぱ)] 敗戦国ノ王女〜肉穴奴●の刻印〜 [DL版],敗戦国ノ王女〜肉穴奴●の刻印〜,japanese,,,doujinshi,,,big breasts,88,2025-08-03 07:42:06,2025-08-03 07:42:06,2025-08-04 14:01:47
587743,[Miura Koudai] Ganbatte Hataraitetara Kusodeka Gal ga Kitan daga?[Chinese][IA的个人AI汉化],[三浦鋼大] 頑張って働いてたら くそでかギャルが来たんだが？,Ganbatte Hataraitetara Kusodeka Gal ga Kitan daga?,"translated, chinese",,miura koudai,doujinshi,original,,"big breasts, emotionless sex, blowjob face, x-ray, big areolae, tall girl, sole male, rough translation",54,2025-08-03 07:45:44,2025-08-03 07:45:44,2025-08-04 14:01:48
587744,[Roselia69181] 汉库克1+2 [AI Generated],[Roselia69181] 汉库克1+2 [AI Generated],汉库克1+2,"japanese, english",,,doujinshi,,,"big breasts, misc, ai generated",47,2025-08-03 08:02:57,2025-08-03 08:02:57,2025-08-04 14:01:49
587745,(Houraigekisen! Yo-i! 23Senme!) [Imitation Moon (Narumi Yuu)] Soukou Kuubo Taihou Shokushu-zeme ni Otsu (Kantai Collection -KanColle-) [Chinese] [AI汉化],(砲雷撃戦!よーい!二十三戦目!) [Imitation Moon (成海優)] 装甲空母大鳳触手攻めに堕つ (艦隊これくしょん -艦これ-) [中国翻訳],Soukou Kuubo Taihou Shokushu-zeme ni Otsu,"translated, chinese",narumi yuu,imitation moon,doujinshi,kantai collection,taihou,"living clothes, orgasm denial, tentacles, sole female, nipple piercing",22,2025-08-03 08:04:35,2025-08-03 08:04:35,2025-08-04 14:01:50
587746,[GaryLin]FF44_Oi&Atlanta Maid Cafe,,FF44_Oi&Atlanta Maid Cafe,"japanese, chinese",,,doujinshi,kantai collection,,,26,2025-08-03 08:06:12,2025-08-03 08:06:12,2025-08-04 14:01:51
587747,"[Master of Tea & Chaos Studio (Sencha Bashira, Mugicha Bashira)] Yosei Shoukan 3-goushitsu Lacy ~Kasshoku Hada Elf o Shimei Shita Dotei Orc~ 1 | 精灵妓院 3号技师蕾西～指名了褐色肌肤精灵的处男兽人先生～ 1  [Chinese] [白杨汉化组]",[茶の魔王 (煎茶柱、麥茶柱)] 妖精娼館 3号室レイシー 〜褐色肌エルフを指名した童貞オーク〜 1 [中国翻訳],Yosei Shoukan 3-goushitsu Lacy1 | 精灵妓院 3号技师蕾西～指名了褐色肌肤精灵的处男兽人先生～ 1,"translated, chinese",sencha bashira,,doujinshi,original,,"elf, big breasts, orc, nakadashi, dark skin, footjob, blowjob, big penis, sole male, mouth mask",55,2025-08-03 08:09:28,2025-08-03 08:09:28,2025-08-04 14:01:51
587748,[Roselia69181] 钉崎野蔷薇 [AI GENERATED],[Roselia69181] 钉崎野蔷薇 [AI GENERATED],钉崎野蔷薇,"japanese, english",,,doujinshi,jujutsu kaisen,nobara kugisaki,"big breasts, mmf threesome, group, huge breasts, dark skin, misc, sole female, ai generated",73,2025-08-03 08:13:36,2025-08-03 08:13:36,2025-08-04 14:01:52
587749,[Alfre-Tori] コスサーのTS改変アプリ② [狼姫个人汉化],[あるふれっ鸟]コスサーのTS改変アプリ② [中国翻訳],コスサーのTS改変アプリ②,"translated, chinese",alfre-tori,,doujinshi,,,"futanari, big breasts, chastity belt, ahegao, anal, feminization, gender change, dickgirl on female",24,2025-08-03 08:15:08,2025-08-03 08:15:08,2025-08-04 14:01:53
587750,[Inoue Yoshihisa] Sennyuu! Inbaku Onna Sousakan Final File (COMIC AUN 2025-2) [Chinese] [BLUE氪个人翻译] [Digital],[井上よしひさ] 潜入!淫縛女捜査官 Final File（COMIC 阿吽 2025年2月号）[中国翻訳] [DL版],Sennyuu! Inbaku Onna Sousakan Final File,"translated, chinese",inoue yoshihisa,,manga,,,"gag, bondage, rape",32,2025-08-03 08:17:10,2025-08-03 08:17:10,2025-08-04 14:01:54
587751,[Yukimaruya (Yukimuramaru)] Kouyuubutsu Shoujo 4 [Ongoing],公有物少女4,Kouyuubutsu Shoujo 4,"translated, chinese",yukimuramaru,,doujinshi,original,,"anal, sex toys, bondage",22,2025-08-03 08:18:34,2025-08-03 08:18:34,2025-08-04 14:01:54
587752,[on]尾张在NTR play中的对象是前男友3[个人机翻][chinese],寝取らせプレイの相手が元彼だった3,尾张在NTR play中的对象是前男友3,"translated, chinese",on,,doujinshi,azur lane,owari,"big breasts, collar, sole female, sole male, horns, rough translation",25,2025-08-03 08:20:05,2025-08-03 08:20:05,2025-08-04 14:01:55
587753,关于雌堕的梦-中篇,Dream of  femenization,关于雌堕的梦-中篇,"japanese, chinese",yioyituyu,,doujinshi,original,,"chastity belt, piercing, shemale, feminization, gender change, nipple piercing",10,2025-08-03 08:20:50,2025-08-03 08:20:50,2025-08-04 14:01:56
587754,[1000mm] ReBirthday [阳头个人汉化][进行中],[1000mm] ReBirthday [阳头个人汉化][进行中],ReBirthday,"translated, chinese",,,doujinshi,,,"mother, incest, daughter",12,2025-08-03 08:21:40,2025-08-03 08:21:40,2025-08-04 14:01:56
587755,[Syunichi Kansuu (Syunichi)] Koushi Kondou Namahame Koubi | 假公济私无套性行为 (Blue Archive) [Chinese] [白杨汉化组] [Decensored] [Digital],[しゅにち関数 (しゅにち)] 公私混同生ハメ交尾 (ブルーアーカイブ) [中国翻訳] [無修正] [DL版],Koushi Kondou Namahame Koubi | 假公济私无套性行为,"translated, chinese",syunichi,syunichi kansuu,doujinshi,blue archive,"sensei, aoi oki","big breasts, ahegao, big areolae, impregnation, sole female, sole male, beauty mark, gloves, halo",36,2025-08-03 08:23:57,2025-08-03 08:23:57,2025-08-04 14:01:57
587756,[Gadget Koubou (A-10)] Nikubou Aigan Kedamono Rape (Puella Magi Madoka Magica) [Chinese] [不咕鸟汉化组] [Digital],[ガジェット工房 (A-10)] 肉棒哀願けだものレイプ (魔法少女まどか☆マギカ) [中国翻訳] [DL版],Nikubou Aigan Kedamono Rape,"translated, chinese",a-10,gadget,doujinshi,puella magi madoka magica,"homura akemi, mami tomoe",,64,2025-08-03 08:28:04,2025-08-03 08:28:04,2025-08-04 14:01:58
587757,(C106) [Aokihoshi (Zen Shiro)] Guren sanran (Goddess of Victory_Nikke)[386歪汉化],(C106) [蒼き星 (全白)] 紅蓮燦爛 (勝利の女神:NIKKE)[386歪汉化],Guren sanran,"translated, chinese",akaiguppy,aokihoshi,doujinshi,goddess of victory nikke,"scarlet, shikikan","big breasts, bodysuit, mosaic censorship, blowjob, sole female, sole male, rough translation",34,2025-08-03 09:02:29,2025-08-03 09:02:29,2025-08-04 14:01:58
587758,[Ikamatsu] Koshitsu no Hito,[烏賊松] 個室のヒト,Koshitsu no Hito,japanese,ikamatsu,,manga,,,"masturbation, mosaic censorship, voyeurism, sole female, sole male",12,2025-08-03 09:03:19,2025-08-03 09:03:19,2025-08-04 14:01:59
587759,[Ikamatsu] Aibu House,[烏賊松] 愛撫ハウス,Aibu House,japanese,ikamatsu,,manga,,,"fingering, mosaic censorship, chikan, sole female, sole male, no penetration, forced exposure, nipple stimulation",12,2025-08-03 09:04:04,2025-08-03 09:04:04,2025-08-04 14:02:00
587760,Miki to Iori to Tanetsuke Shouryokou 2-haku 3-kka,,Miki to Iori to Tanetsuke Shouryokou 2kka,"english, translated",noji,,doujinshi,,"miki hoshii, iori minase","impregnation, watermarked, rough translation",26,2025-08-03 09:05:48,2025-08-03 09:05:48,2025-08-04 14:02:01
587761,[Straw] Yumi no Ryuugaku | 由美的留学生活 [Chinese] [Ongoing],[ストロー] 由美の留学 [中国翻訳] [進行中],Yumi no Ryuugaku | 由美的留学生活,"translated, chinese",straw,,doujinshi,original,,"bdsm, kissing, big breasts, corruption, piercing, netorare, story arc, cheating, prostitution, condom, moral degeneration, dark skin, full color, drugs, stockings, gokkun, mosaic censorship, hotpants, impregnation, blowjob, muscle, big penis, makeup, large tattoo, painted nails",122,2025-08-03 10:07:40,2025-08-03 10:07:40,2025-08-04 14:02:02
587762,[Zea Lark] Futanari Hasumi-san vs Muttsuri Maso Mesu Ako-chan Manga (Blue Archive) [English],[ゼア・ラーク] ふたなりハスミさんvsむっつりマゾ雌アコちゃん まんが (ブルーアーカイブ) [英訳],Futanari Hasumichan Manga,"english, translated",zea lark,,doujinshi,blue archive,"hasumi hanekawa, ako amau","futanari, wings, big breasts, humiliation, nakadashi, huge breasts, shemale, full color, big penis, sole dickgirl, halo, dickgirl on female, futanarization",28,2025-08-03 10:09:27,2025-08-03 10:09:27,2025-08-04 14:02:03
587763,[Missified] Bitchy Ashley Chapter 1.5 [AI Generated][Ongoing],,Bitchy Ashley Chapter 1.5,english,,,manga,pokemon | pocket monsters,"misty, ash ketchum, jenny","transformation, big breasts, corruption, story arc, sex toys, femdom, mtf threesome, shemale, misc, full color, lingerie, feminization, makeup, comic, gender change, ai generated, high heels",19,2025-08-03 10:10:44,2025-08-03 10:10:44,2025-08-04 14:02:03
587764,[Pontaro] Uso to honne no kousaten (COMIC ExE 52) [Chinese] [橘猫汉化组] [Digital],[ぽんたろ] 嘘と本音の交差点 (コミック ExE 52) [中国翻訳],Uso to honne no kousaten,"translated, chinese",pontaro,,doujinshi,,,"big breasts, schoolboy uniform, full censorship, schoolgirl uniform, mind control, sole female, sole male",33,2025-08-03 10:12:51,2025-08-03 10:12:51,2025-08-04 14:02:04
587765,【pcrow】悠哲(浅羽悠真X哲)《绝区零》【男男菊花香汉化】【chinese】,【pcrow】悠哲(浅羽悠真X哲)《绝区零》,【pcrow】悠哲《绝区零》【男男菊花香汉化】【chinese】,chinese,pcrow,,doujinshi,zenless zone zero,harumasa asaba,yaoi,17,2025-08-03 10:14:06,2025-08-03 10:14:06,2025-08-04 14:02:05
587766,[Draw2] Game no Shouhai de Tachiuke o Kimeru Hanashi 5 | 以游戏胜负决定攻受的故事5 [Chinese],,Game no Shouhai de Tachiuke o Kimeru Hanashi 5 | 以游戏胜负决定攻受的故事5,"translated, chinese",draw2,d-raw 2 | draw two,manga,,,"nakadashi, anal, males only, yaoi, mosaic censorship, muscle, hidden sex, mesuiki, anal intercourse",7,2025-08-03 10:14:44,2025-08-03 10:14:44,2025-08-04 14:02:06
587767,【pcrow】分身的诱惑(崩坏星穹铁道厄穹）【男男菊花香汉化【chinese】,【pcrow】分身的诱惑(崩坏星穹铁道厄穹）【男男菊花香汉化【chinese】,【pcrow】分身的诱惑(崩坏星穹铁道厄穹）【男男菊花香汉化【chinese】,"translated, chinese",,,doujinshi,honkai star rail,,yaoi,15,2025-08-03 11:01:23,2025-08-03 11:01:23,2025-08-04 14:02:07
587768,[AI Generated]1231 小医仙,,1231 小医仙,japanese,,,doujinshi,,,"misc, ai generated",59,2025-08-03 11:05:13,2025-08-03 11:05:13,2025-08-04 14:02:08
587769,[Doemutan] 〇□Gakuen Yakyuu-bu ~Manatsu no Gasshuku-chuu ni Tanezuke Sareru Joshi Manager-tachi~ 6 [Chinese] [Digital],[どえむたん] 〇□学園野球部～真夏の合宿中に種付けされる女子マネージャーたち～6 [中国翻訳] [DL版],〇□Gakuen Yakyuuchuu ni Tanezuke Sareru Joshi Manager-tachi~ 6,"translated, chinese",doemutan,,doujinshi,,,"group, netorare, multi-work series, rough translation",27,2025-08-03 11:06:56,2025-08-03 11:06:56,2025-08-04 14:02:09
587770,[桃汁庭園 (桃雲)] マモノノヘヤ 〜6年ぶりに再会したら引きこもりニートになっていた親友のお姉さんに迫られて精液を搾り取られる話〜 [白杨汉化组][無修正][鄰居toby去碼][DL版],[桃汁庭園 (桃雲)] マモノノヘヤ 〜6年ぶりに再会したら引きこもりニートになっていた親友のお姉さんに迫られて精液を搾り取られる話〜[DL版],マモノノヘヤ 〜6年ぶりに再会したら引きこもりニートになっていた親友のお姉さんに迫られて精液を搾り取られる話〜,"translated, chinese",momokumo,momojiru teien,doujinshi,original,,"virginity, big breasts, uncensored, big ass, nakadashi, femdom, x-ray, paizuri, inverted nipples, blowjob, sole female, sole male, hidden sex, very long hair, eye-covering bang",41,2025-08-03 11:09:39,2025-08-03 11:09:39,2025-08-04 14:02:10
587771,[Shibainu Nisei] Dorei kibou Inoue Oyako-hen | 奴隶愿望 井上母女篇 [Chinese] [Bismuth个人汉化],[シバイーヌ二世] 奴隷志望 井上母娘編 [中国翻訳] [Bismuth个人汉化],Dorei kibou Inoue Oyako-hen | 奴隶愿望 井上母女篇,"translated, chinese",,,doujinshi,original,,"squirting, bdsm, kissing, gag, strap-on, piercing, cunnilingus, group, glasses, masturbation, urination, nakadashi, ahegao, anal, sex toys, ffm threesome, bondage, harem, mother, latex, whip, multi-work series, incest, stockings, mind break, daughter, blowjob, tribadism, blindfold, collar, shibari, slave, bisexual, oyakodon, leash, gloves, petplay, anal intercourse, nipple piercing",109,2025-08-03 12:06:47,2025-08-03 12:06:47,2025-08-04 14:02:11
587772,"[Jorori] Sakyutto! (""Kimi ga Suki."") [Chinese] [不可视汉化 & dsew个人重嵌] [Decensored]",[じょろり] 団長、お願いします! (「君が好き。」) [中国翻訳] [無修正],Sakyutto!,"translated, chinese",jorori,,manga,,,"squirting, sweating, big breasts, mmf threesome, group, uncensored, masturbation, urination, harem, hairy, defloration, smell, blowjob, gloves",26,2025-08-03 12:08:30,2025-08-03 12:08:30,2025-08-04 14:02:13
587773,"[Jorori] Koiseyo Otome (""Kimi ga Suki."") [Chinese] [不可视汉化 & dsew个人重嵌] [Decensored]",[じょろり] 恋せよ処女 (「君が好き。」) [中国翻訳] [無修正],Koiseyo Otome,"translated, chinese",jorori,,manga,,,"sweating, glasses, uncensored, condom, hairy, defloration, blowjob, sole female, sole male, ponytail",26,2025-08-03 12:10:13,2025-08-03 12:10:13,2025-08-04 14:02:14
587774,"[Jorori] Danchou, Onegaishimasu!  (""Kimi ga Suki."") [Chinese] [不可视汉化 & dsew个人重嵌] [Decensored]",[じょろり] さきゅっと! (「君が好き。」) [中国翻訳] [無修正],"Danchou, Onegaishimasu!","translated, chinese",jorori,,manga,,,"kissing, big breasts, swimsuit, unusual pupils, group, glasses, uncensored, nakadashi, ffm threesome, bondage, x-ray, stockings, rimjob, school swimsuit, blowjob, deepthroat, sole male",26,2025-08-03 12:12:07,2025-08-03 12:12:07,2025-08-04 14:02:15
587775,[Mado fu mura (Madofu)] Futanari seijo shasei kinshirei,[まどーふ村 (魔豆腐)] ふたなり聖女 射精禁止令,Futanari seijo shasei kinshirei,japanese,madofu,,doujinshi,,,"futanari, nun",72,2025-08-03 12:16:27,2025-08-03 12:16:27,2025-08-04 14:02:17
587776,[Kamaboko Koubou (Kamaboko)] 性活指導委員の搾精記録っ（はーと）[Digital],[カマボコ工房 (釜ボコ)] 性活指導委員の搾精記録っ（はーと）[DL版],性活指導委員の搾精記録っ（はーと）,japanese,kamaboko,kamaboko koubou,doujinshi,original,,"big breasts, schoolboy uniform, schoolgirl uniform, blowjob face, blowjob, sole female",88,2025-08-03 12:22:00,2025-08-03 12:22:00,2025-08-04 14:02:18
587777,[洋葱 | 洋蔥 & 大秋]  上班不要太认真 | 上班不要太認真 | 摸鱼生存指南 | 摸魚生存指南 1-6 [Chinese] [Ongoing],,上班不要太认真 | 上班不要太認真 | 摸鱼生存指南 | 摸魚生存指南 1-6,"translated, chinese",,,manga,,,webtoon,162,2025-08-03 12:33:05,2025-08-03 12:33:05,2025-08-04 14:02:19
587778,[Tiramisu Tart (Kazuhiro)] Gyaku Bunny Cast no Tare Chichi Deka Nyuurin ni Hasamaretai,[てぃらみすたると (一弘)] 逆バニーキャストの垂れ乳デカ乳輪に挟まれたい,Gyaku Bunny Cast no Tare Chichi Deka Nyuurin ni Hasamaretai,"english, translated",kazuhiro,tiramisu tart,doujinshi,original,,"big breasts, group, nakadashi, ffm threesome, bunny girl, stockings, paizuri, inverted nipples, kemonomimi",57,2025-08-03 12:36:38,2025-08-03 12:36:38,2025-08-04 14:02:19
587779,[Asaki Blog Branch Office (Asaki Takayuki)] 女騎士ラーエルと金貨の代償 [Digital],[朝木blog出張所 (朝木貴行)] 女騎士ラーエルと金貨の代償 [DL版],女騎士ラーエルと金貨の代償,japanese,asaki takayuki,asaki blog branch office,doujinshi,,,bondage,26,2025-08-03 12:38:21,2025-08-03 12:38:21,2025-08-04 14:02:20
587780,[C104][白魚京][Chinese]澄闪遭水月触手强制○卵植入漫画 (XueHuKING个人自购AI汉化自嵌),[C104][白魚京]スージーちゃんがミヅキ触手で強○植卵される漫画,澄闪遭水月触手强制○卵植入漫画,"translated, chinese",shirauokei,shirokujichu,doujinshi,arknights,"mizuki, goldenglow","bondage, rape, tentacles, rough translation",19,2025-08-03 12:39:39,2025-08-03 12:39:39,2025-08-04 14:02:21
587781,[mdo-h] XS! [Digital],[無道叡智] えっくすえす！[DL版],XS!,japanese,mdo-h,,manga,,,"lolicon, tankoubon",198,2025-08-03 13:15:24,2025-08-03 13:15:24,2025-08-04 14:02:23
587782,[mdo-h] Ecchi no Switch - H-Switch [Digital],[無道叡智] えっちのスイッチ[DL版],Ecchi no SwitchSwitch,japanese,mdo-h,,manga,,,"group, glasses, schoolgirl uniform, urination, anal, niece, harem, lolicon, tanlines, tankoubon, stockings, eyepatch, sister, twintails",194,2025-08-03 13:51:22,2025-08-03 13:51:22,2025-08-04 14:02:24
587783,[mdo-h] Otome Magic Orchestra [Digital],[無道叡智] オトメマジックオーケストラ [DL版],Otome Magic Orchestra,japanese,mdo-h,,manga,,,"group, anal, sex toys, bondage, bikini, lolicon, defloration, incest, double penetration, tankoubon, stockings, chinese dress, apron, sister, catgirl",238,2025-08-03 14:35:26,2025-08-03 14:35:26,2025-08-04 14:02:25
587784,[mdo-h] Kotona Taste [Digital],[無道叡智] ことなていすと [DL版],Kotona Taste,japanese,mdo-h,,manga,,,"handjob, kissing, cunnilingus, mmf threesome, group, breast feeding, nakadashi, sex toys, bikini, lolicon, defloration, incest, tanlines, tankoubon, stockings, fingering, sister, school swimsuit, blowjob",192,2025-08-03 15:10:38,2025-08-03 15:10:38,2025-08-04 14:02:26
587785,[mdo-h] School Complex [Digital],[無道叡智] すくーるこんぷれっくす [DL版],School Complex,japanese,mdo-h,,manga,,,"swimsuit, glasses, urination, anal, bondage, sleeping, bikini, lolicon, footjob, defloration, incest, tanlines, tankoubon, stockings, cheerleader, sister, teacher, shotacon, kodomo doushi, classroom",188,2025-08-03 15:46:25,2025-08-03 15:46:25,2025-08-04 14:02:27
587786,[mdo-h] Deviloli -Devil Lolita- [Digital],[無道叡智] デビロリ -Devil Lolita- [DL版],Deviloli,japanese,mdo-h,,manga,,,"group, glasses, anal, demon girl, lolicon, incest, tankoubon, angel, stockings, pantyhose, sister, daughter, fox girl",184,2025-08-03 16:21:54,2025-08-03 16:21:54,2025-08-04 14:02:28
587787,[mdo-h] Hadairo Kibun [Digital],[無道叡智] はだいろきぶん [DL版],Hadairo Kibun,japanese,mdo-h,,manga,,,"bdsm, swimsuit, armpit sex, group, anal, sex toys, bondage, bikini, lolicon, incest, tankoubon, stockings, rimjob, fingering, sister, tomboy, christmas, collar, anal intercourse",203,2025-08-03 16:58:28,2025-08-03 16:58:28,2025-08-04 14:02:29
587788,[mdo-h] Loli-Cha Love [Digital],[無道叡智] ろりちゃらぶ [DL版],Loli-Cha Love,japanese,mdo-h,,manga,,,"swimsuit, mmf threesome, group, glasses, nakadashi, anal, sex toys, dark skin, bikini, lolicon, incest, tanlines, tankoubon, stockings, cheerleader, sister, teacher, ponytail, twintails",190,2025-08-03 17:34:06,2025-08-03 17:34:06,2025-08-04 14:02:30
587789,[Mdo-h] Lolita Record -Seichou Kiroku- [Digital],[無道叡智] ロリレコ -性徴記録- [DL版],Lolita Record,japanese,mdo-h,,manga,,,"swimsuit, group, glasses, urination, anal, sex toys, ffm threesome, lolicon, incest, tanlines, tankoubon, stockings, sister, tomboy",190,2025-08-03 18:09:40,2025-08-03 18:09:40,2025-08-04 14:02:30
587790,[mdo-h] Haeteru Watashi to Tsuiteru Kanojo [Digital],[無道叡智] 生えてるワタシとツいてる彼女 [DL版],Haeteru Watashi to Tsuiteru Kanojo,japanese,mdo-h,,manga,,,"futanari, nakadashi, lolicon, tankoubon, stockings, big penis, dickgirl on dickgirl, anal intercourse",209,2025-08-03 18:49:43,2025-08-03 18:49:43,2025-08-04 14:02:32
587791,[Chonmage Teikoku (Magekichi)] Chuunen Kyoushi ni Netorareta Osananajimi [Digital],[丁髷帝国 (まげきち)] 中年教師に寝取られた幼なじみ [DL版],Chuunen Kyoushi ni Netorareta Osananajimi,japanese,magekichi,chonmage teikoku,doujinshi,original,,"kissing, netorare, schoolgirl uniform, nakadashi, x-ray, defloration, stockings, small breasts, mosaic censorship, rape, teacher, dilf, blackmail, sole female, sole male, twintails",18,2025-08-03 18:51:06,2025-08-03 18:51:06,2025-08-04 14:02:33
