ID,EN_TITLE,JP_TITLE,CLEAN_TITLE,LANGUAGE,ARTIST,GROUP_NAME,CATEGORY,PARODY,CHARACTER,TAGS,PAGES,UPLOAD_DATE,FORMATTED_DATE,SCRAPED_DATE
634021,[Yajirushi Key (Hoshina Meito)] Seidorei Tsuki Jiko Bukken ~Oharai Shippai Shichatta Reinou Shoujo wa Zecchou Jigoku ni Torawareru!?~ | 性奴灵附体直播事故~不慎驱魔失败的灵能少女将永世被囚于高潮地狱之中!?~ [Chinese] [白杨汉化组] [Digital],[矢印キー (星名めいと)] 性奴霊付き事故物件〜お祓い失敗しちゃった霊能少女は絶頂地獄に囚われる!?〜 [中国翻訳] [DL版],Seidorei Tsuki Jiko Bukken| 性奴灵附体直播事故,"translated, chinese",hoshina meito,yajirushi key,doujinshi,,,"mmf threesome, group, anal, ghost, full color, double penetration, pantyhose, mosaic censorship, rape, sole female, anal intercourse, gang rape",45,2026-03-02 12:08:33,2026-03-02 12:08:33,2026-03-03 14:02:56
634022,[Netorare-san] The Thug Hashira [AI Generated],,The Thug Hashira,"translated, chinese",,,doujinshi,,,"misc, rough translation, ai generated",27,2026-03-02 12:10:20,2026-03-02 12:10:20,2026-03-03 14:02:57
634023,[Ichigo no Monogatari (Pueichigo)] Kogareru Omoi no Kouryakuhoo | 萤火灼心的攻略方式 (Honkai: Star Rail) [Chinese] [白杨汉化组] [Digital],[いちごのものがたり (ぷぇいちご)] 焦がれる想いの攻略法 (崩壊:スターレイル) [中国翻訳] [DL版],Kogareru Omoi no Kouryakuhoo | 萤火灼心的攻略方式,"translated, chinese",pueichigo,ichigo no monogatari,doujinshi,honkai star rail,"caelus, silver wolf, firefly",group,36,2026-03-02 12:12:35,2026-03-02 12:12:35,2026-03-03 14:02:57
634024,[Chonmage Teikoku (Magekichi)] Sukidatta Hito to Musubareta no ni Shiranai Ojisan-tachi ni Okasareru Hanashi [Chinese],[丁髷帝国 (まげきち)] 好きだった人と結ばれたのに知らないおじさん達に犯される話 [中国翻訳],Sukidatta Hito to Musubareta no ni Shiranai Ojisan-tachi ni Okasareru Hanashi,"translated, chinese",magekichi,chonmage teikoku,doujinshi,,,"netorare, rough translation",30,2026-03-02 12:14:38,2026-03-02 12:14:38,2026-03-03 14:02:58
634025,Maid 2 (籠絡令嬢メイド堕ち续作） patreon更新中,,Maid 2 (籠絡令嬢メイド堕ち续作） patreon更新中,chinese,fujiyama,,doujinshi,,,stockings,56,2026-03-02 12:17:57,2026-03-02 12:17:57,2026-03-03 14:02:59
634026,[Erupusai2] Yoru Burning H (Chainsaw Man) [English],ヨル・バーニング・Ｈ,Yoru Burning H,"english, translated",,,doujinshi,chainsaw man,"denji, yoru","scar, blowjob, sole female, sole male, rough translation",10,2026-03-02 12:18:49,2026-03-02 12:18:49,2026-03-03 14:03:01
634027,[バクシーシAT] 落日の母 [中字]（扉宇机翻自用）,[バクシーシAT] 落日の母 [中国翻訳] [DL版],落日の母（扉宇机翻自用）,"translated, chinese",at | baksheesh at,,manga,,,"maid, milf, pregnant, netorare, infantilism, ahegao, anal, sex toys, mother, incest, double penetration, bunny girl, tankoubon, lactation, chinese dress, paizuri, blowjob, shotacon, anal intercourse, rough translation",194,2026-03-02 13:36:26,2026-03-02 13:36:26,2026-03-03 14:03:02
634028,A story about being possessed by a pure female teacher,清楚系の女教師に憑依してみた話,A story about being possessed by a pure female teacher,japanese,papicolo,,doujinshi,,,"big breasts, glasses, body swap, possession, teacher",10,2026-03-02 13:37:20,2026-03-02 13:37:20,2026-03-03 14:03:03
634029,[Paatapo] Namaiki Shota Kyousei Renzoku Sakusei Jigoku [Chinese] [Digital],[ぱーたぽ] 生意気ショタ強制連続搾精じごく [中国翻訳] [DL版],Namaiki Shota Kyousei Renzoku Sakusei Jigoku,"translated, chinese",,patapo,doujinshi,,,"handjob, bdsm, chastity belt, urethra insertion, group, enema, electric shocks, prostate massage, anal, sex toys, bondage, speculum, males only, drugs, yaoi, orgasm denial, rape, shotacon, multiple orgasms",42,2026-03-02 13:45:02,2026-03-02 13:45:02,2026-03-03 14:03:04
634030,[Manguri Cannon (BANG-YOU)] Dekachin Ojisan vs Headmistress Tsukasa (English),[Manguri Cannon (BANG-YOU)] 学園長つかさ vs デカチンおじさん (English),Dekachin Ojisan vs Headmistress Tsukasa,"japanese, english, translated",bang-you | didori,manguri cannon,doujinshi,,,"glasses, sole female, pixie cut",24,2026-03-02 13:46:33,2026-03-02 13:46:33,2026-03-03 14:03:05
634031,Sugar Daddy Undercover Agent!,,Sugar Daddy Undercover Agent!,"english, translated",,,doujinshi,,,"muscle, gender change, rough translation",4,2026-03-02 13:47:01,2026-03-02 13:47:01,2026-03-03 14:03:06
634032,[Nakaura Tomoki] Ueno-kun wa Kaihatsu-zumi Dai 68 wa | Ueno-kun Has Been Developed Chapter 68 [English],[中浦トモキ] 上野くんは開発済み 第68話 [英訳],Uenozumi Dai 68 wa | Ueno-kun Has Been Developed Chapter 68,"english, translated",nakaura,,manga,,,glasses,17,2026-03-02 13:48:05,2026-03-02 13:48:05,2026-03-03 14:03:07
634033,[Kaki no Tane] ダシテ イレテ ダシテ,[かきのたね] ダシテ イレテ ダシテ,ダシテ イレテ ダシテ,japanese,kaki no tane,,doujinshi,,,"scat, big breasts, masturbation, enema, solo action, inflation, prolapse, smell, gaping, sole female, anal prolapse",46,2026-03-02 13:51:00,2026-03-02 13:51:00,2026-03-03 14:03:08
634034,[Chinjao Girl. (Kozakura Kumaneko)] Doka-gui aneki wa ore no ana [Chinese],[チンジャオ娘。 (小桜クマネコ)] ドカ食い姉貴は俺の穴 [中国翻訳],Doka-gui aneki wa ore no ana,"translated, chinese",kozakura kumaneko,chinjao girl.,doujinshi,,,"bbw, incest, sister, sole female, sole male, rough translation",68,2026-03-02 13:55:04,2026-03-02 13:55:04,2026-03-03 14:03:09
634035,(FF45) [KS' Works (KS)] MONOCHROME AFFECTION (Blue Archive) [Chinese] [Decensored],(FF45) [KS' Works (KS)] MONOCHROME AFFECTION (ブルーアーカイブ) [中国語] [無修正],MONOCHROME AFFECTION,chinese,ks,ks works,doujinshi,blue archive,kayoko onikata,"uncensored, full color, sole female, sole male, halo",26,2026-03-02 13:56:52,2026-03-02 13:56:52,2026-03-03 14:03:10
634036,[Woomochichi] Bea & Mr. Mime (Pokemon)[个人机翻],,Bea & Mr. Mime,"translated, chinese",woomochichi,,doujinshi,pokemon | pocket monsters,bea,"squirting, big breasts, ahegao, exhibitionism, fingering, shared senses, rape, big clit, sole female, sole male, clit stimulation, rough translation",5,2026-03-02 13:57:23,2026-03-02 13:57:23,2026-03-03 14:03:11
634037,[Murasaki Nyanko Bar (Vae)] Chabatake Vae no TS Tanpenshuu [Chinese] [MTL],[むらさきにゃんこバー] 茶畑ヴァエのTS短篇集[中国翻訳],Chabatake Vae no TS Tanpenshuu,"translated, chinese",vae,murasaki nyanko bar,doujinshi,original,,"transformation, big breasts, dark skin, bunny girl, stockings, leotard, tentacles, crotch tattoo, gender change, rough translation",89,2026-03-02 14:02:28,2026-03-02 14:02:28,2026-03-03 14:03:11
634038,[LBL] Loli Baba Okaa-san wa Oshi ni Yowai 5 | 萝莉老太婆继母小姐十分易推倒5 [Chinese] [零食汉化组&無修loli重嵌][无修正][55P],[LBL] ロリババお義母さんは押しに弱い5 [中国翻訳][零食汉化组&無修loli重嵌][无修正][55P],Loli Baba Okaa-san wa Oshi ni Yowai 5 | 萝莉老太婆继母小姐十分易推倒5,"translated, chinese",lbl,,doujinshi,,,"kissing, leg lock, uncensored, nakadashi, ahegao, blowjob face, mother, lolicon, multi-work series, inflation, blowjob, big penis, stomach deformation, deepthroat, tail, cumflation",55,2026-03-02 14:13:11,2026-03-02 14:13:11,2026-03-03 14:03:13
634039,[Room Guarder (Tokinobutt)] Bijutsu Model-bu no Komagawa-san 3 | The Art Model Club's Komagawa-san 3 [English] [Digital],[Room Guarder (ときのぶっと)] 美術モデル部の高麗川さん 3 [英訳] [DL版],Bijutsu Modelsan 3 | The Art Model Club's Komagawa-san 3,"english, translated",tokinobutt | misaki tokinobu,room guarder,doujinshi,,,"schoolgirl uniform, tracksuit, exhibitionism, multi-work series, stockings, small breasts, nudity only, clothed male nude female, classroom",20,2026-03-02 14:14:36,2026-03-02 14:14:36,2026-03-03 14:03:14
634040,"[Woomochichi] Introducing! Gallar's new Pokemon, Ona'nah![个人机翻]",,"Introducing! Gallar's new Pokemon, Ona'nah!","translated, chinese",woomochichi,,doujinshi,pokemon | pocket monsters,"sonia, gloria","squirting, big breasts, wormhole, onahole, glasses, big ass, nakadashi, ahegao, inflation, shared senses, rape, big penis, stomach deformation, ponytail, clothed female nude male, cumflation, mesuiki, rough translation",18,2026-03-02 14:15:52,2026-03-02 14:15:52,2026-03-03 14:03:15
634041,(C105) [Closet (Kanopan)] Nioi tatsu Akuma no Kyousei Sakushu 2 [Chinese],(C105) [くろーぜっと (かのぱん)] 匂い立つ悪魔の嬌精搾取2 [中国翻訳],Nioi tatsu Akuma no Kyousei Sakushu 2,"translated, chinese",kanopan,,doujinshi,,,"big breasts, nakadashi, femdom, demon girl, multi-work series, gyaru, sole female, sole male, tail, extraneous ads",33,2026-03-02 14:18:04,2026-03-02 14:18:04,2026-03-03 14:03:16
634042,(Booket 8) [Yuubinya (Yagi Yuta)] Rebound,(ブーケット8) [郵便屋 (八木裕太)] リバウンド,Rebound,japanese,yagi yuta,yuubinya,doujinshi,,,"males only, yaoi, shotacon",27,2026-03-02 14:23:02,2026-03-02 14:23:02,2026-03-03 14:03:17
634043,[JKぱすた、ゆめのおすなば (倉田むと、ゆめ)] 人格排泄!!お嬢様JK鬼アクメ,,人格排泄!!お嬢様JK鬼アクメ,"translated, chinese",kurata muto | mutou kura,,doujinshi,,,"corruption, enema, schoolgirl uniform, nakadashi, moral degeneration, anal, mind control, double penetration, stockings, possession, mind break, rape, anal intercourse, personality excretion",36,2026-03-02 14:25:30,2026-03-02 14:25:30,2026-03-03 14:03:18
634044,(C95) [K+W+Ziggurat (sasachinn)] Monster Student!! 1 Jikanme | Monster Student!! 1st Period [English] [The Blavatsky Project],(C95) [K+W+Ziggurat (ささちん)] Monster Student!! 1時間目 [英訳],Monster Student!! 1 Jikanme | Monster Student!! 1st Period,"english, translated",sasachinn,"k plus w, ziggurat",doujinshi,,,"twins, layer cake, group, glasses, schoolgirl uniform, nakadashi, ffm threesome, femdom, dark skin, pantyhose, teacher, blowjob, sole male, twintails, clothed female nude male, shimaidon",28,2026-03-02 14:27:29,2026-03-02 14:27:29,2026-03-03 14:03:18
634045,[Kanimura Ebio] Konna Sekai de Nani Sun no!? | 在这种世界还能干嘛!?  [Chinese] [oo2oo个人去码+重嵌] [Digital] [Decensored] [Ongoing],[かに村えびお] こんな世界でナニすんの!? [中国翻訳] [DL版] [無修正] [進行中],Konna Sekai de Nani Sun no!? | 在这种世界还能干嘛!?,"translated, chinese",kanimura ebio,,manga,,,"elf, inseki, glasses, uncensored, mother, dark skin, incest, tankoubon, kemonomimi, tail",140,2026-03-02 14:36:26,2026-03-02 14:36:26,2026-03-03 14:03:19
634046,[JKぱすた (倉田むと)] 人格排泄!!鬼アクメ 総集編描きおろし漫画,,人格排泄!!鬼アクメ 総集編描きおろし漫画,"translated, chinese",kurata muto | mutou kura,,doujinshi,,,"corruption, mmf threesome, enema, nakadashi, moral degeneration, anal, yuri, mind control, double penetration, stockings, possession, anal intercourse, personality excretion",21,2026-03-02 14:37:59,2026-03-02 14:37:59,2026-03-03 14:03:21
634047,[Demi (Shiwo)] Zutto Zutto Issho ni Ite. Kako Hen [Digital][中国翻訳],[Demi (シヲ)] ずっとずっといっしょにいて。過去編 [DL版],Zutto Zutto Issho ni Ite. Kako Hen,"translated, chinese",,,doujinshi,,,,44,2026-03-02 14:40:39,2026-03-02 14:40:39,2026-03-03 14:03:21
634048,[Muchipanya (Muchipan)] Kimi ga Inai to Ikite Ikenai (Gakuen IDOLM@STER) [Chinese] [Digital],[むちぱん屋 (むちぱん)] 君がいないと生きていけない (学園アイドルマスター) [中国翻訳] [DL版],Kimi ga Inai to Ikite Ikenai,"translated, chinese",muchipan,muchipanya,doujinshi,the idolmaster,misuzu hataya,"sole female, sole male, extraneous ads",34,2026-03-02 14:42:41,2026-03-02 14:42:41,2026-03-03 14:03:22
634049,[Takoniwa (Ushita)] 200705_Doremi no Eromanga Junbigou (Ojamajo Doremi),[タコニワ (うしタ)] 200705_どれみのエロまんが準備号 (おジャ魔女どれみ),200705_Doremi no Eromanga Junbigou,japanese,ushita,takoniwa,doujinshi,ojamajo doremi | magical doremi,doremi harukaze,"maid, swimsuit, ahegao, anal, thigh high boots, bikini, lolicon, mosaic censorship, sole female, sole male, hair buns, crying",8,2026-03-02 14:44:36,2026-03-02 14:44:36,2026-03-03 14:03:23
634050,ゆりメイト! 1巻,ゆりメイト! 1巻,ゆりメイト! 1巻,japanese,,,doujinshi,,,"females only, yuri",208,2026-03-02 14:56:19,2026-03-02 14:56:19,2026-03-03 14:03:24
634051,ゆりメイト! 2巻,ゆりメイト! 2巻,ゆりメイト! 2巻,japanese,,,doujinshi,,,"females only, yuri",181,2026-03-02 15:06:52,2026-03-02 15:06:52,2026-03-03 14:03:25
634052,眷属は鬼に首ったけ！,眷属は鬼に首ったけ！,眷属は鬼に首ったけ！,japanese,natane tsuyu,anko strawberry,doujinshi,touhou project,"suika ibuki, miyoi okunoda",,28,2026-03-02 15:08:49,2026-03-02 15:08:49,2026-03-03 14:03:26
634053,[MadBull] 朴熙珠下士 （个人汉化）,,朴熙珠下士 （个人汉化）,"translated, chinese",madbull,,doujinshi,,,rough translation,12,2026-03-02 15:10:19,2026-03-02 15:10:19,2026-03-03 14:03:28
634054,強化警察#4 美琴、おちんぽ隊員お披露目アクメショー。 後編,強化警察#4 美琴、おちんぽ隊員お披露目アクメショー。 後編,強化警察#4 美琴、おちんぽ隊員お披露目アクメショー。 後編,japanese,sevengar,,doujinshi,original,,"big breasts, group, big ass, nakadashi, ahegao, blowjob face, bondage, multi-work series, stockings, mosaic censorship, blowjob, sole female, gloves, exposed clothing, high heels",13,2026-03-02 15:11:18,2026-03-02 15:11:18,2026-03-03 14:03:28
634055,[Shiopan] Imouto no Kareshi ni Taberarechau Hanashi [Chinese],[塩パン] 妹の彼氏に食べられちゃうハナシ [中国翻訳],Imouto no Kareshi ni Taberarechau Hanashi,"translated, chinese",,,doujinshi,,,rough translation,45,2026-03-02 15:13:59,2026-03-02 15:13:59,2026-03-03 14:03:29
634056,[MadBull] 传说中的配种大叔 （个人汉化）,,传说中的配种大叔 （个人汉化）,"translated, chinese",madbull,,doujinshi,,,rough translation,15,2026-03-02 15:15:00,2026-03-02 15:15:00,2026-03-03 14:03:30
634057,[Misaki (Kayanoi Ino)] NTR Seito Shidou [Chinese],[三崎 (茅乃井いの)] NTR生徒指導 [中国翻訳],NTR Seito Shidou,"translated, chinese",,,doujinshi,,,rough translation,38,2026-03-02 15:17:24,2026-03-02 15:17:24,2026-03-03 14:03:31
634058,[八百万★社中] D.H ダンナニヒミツ 〜石原さゆみ 32歳の場合〜 夏の浴衣の思惑 [Chinese],[八百万★社中] D.H ダンナニヒミツ 〜石原さゆみ 32歳の場合〜 夏の浴衣の思惑 [中国翻訳],D.H ダンナニヒミツ 〜石原さゆみ 32歳の場合〜 夏の浴衣の思惑,"translated, chinese",,,doujinshi,,,rough translation,63,2026-03-02 15:21:24,2026-03-02 15:21:24,2026-03-03 14:03:32
634059,[Yuriko Club] Kawaisugiru Tomodachi no Okaasan to Kossori Tsukiacchatta Hanashi [Chinese],[ゆりこくらぶ] 可愛すぎる友達のお母さんとこっそり付き合っちゃった話 [中国翻訳],Kawaisugiru Tomodachi no Okaasan to Kossori Tsukiacchatta Hanashi,"translated, chinese",,,doujinshi,,,rough translation,79,2026-03-02 15:25:58,2026-03-02 15:25:58,2026-03-03 14:03:33
634060,"[Daiba Chaya] I'M NOT A BACKSEATER. I'M THE SUPERVISOR! (Fuwawa Abyssgard, Mococo Abyssgard) [Textless] [Digital]",[台場茶屋 (だい)] I'M NOT A BACKSEATER. I'M THE SUPERVISOR! (フワワ・アビスガード、モココ・アビスガード) [英訳][DL版],I'M NOT A BACKSEATER. I'M THE SUPERVISOR!,japanese,dai,,doujinshi,hololive,"fuwawa abyssgard, mococo abyssgard","twins, dog girl, vtuber",24,2026-03-02 15:27:38,2026-03-02 15:27:38,2026-03-03 14:03:34
634061,[Woomochichi] Iruru Lost the Game (Miss Kobayashi's Dragon Maid) [个人机翻],,Iruru Lost the Game,"translated, chinese",woomochichi,,doujinshi,kobayashi-san-chi no maid dragon,ilulu,"big breasts, big nipples, netorare, big ass, nakadashi, ahegao, huge breasts, big balls, big areolae, huge penis, stockings, big clit, muscle, big penis, sole female, sole male, bald, twintails, horns, very long hair, rough translation",11,2026-03-02 15:28:22,2026-03-02 15:28:22,2026-03-03 14:03:35
634062,禁断行為～義母に中出し,禁断行為～義母に中出し,禁断行為～義母に中出し,"translated, chinese",misaki yukihiro,,manga,,,rough translation,34,2026-03-02 15:30:27,2026-03-02 15:30:27,2026-03-03 14:03:36
634063,[Kuro Lili no Heya (lilish)] Seidorei-chan wa Shujin o Aorichirakashite Oshioki saretai [Chinese],[黒りりの部屋 (lilish)] 性奴隷ちゃんは主人を煽り散らかしてお仕置きされたい [中国翻訳],Seidorei-chan wa Shujin o Aorichirakashite Oshioki saretai,"translated, chinese",lilish,kuro lili no heya,doujinshi,,,"gag, sex toys, bondage, collar, shibari, sole female, rough translation",26,2026-03-02 15:32:06,2026-03-02 15:32:06,2026-03-03 14:03:37
634064,[Eternal snow (Suno)] Wansumoa・agein (ONE PIECE),[Eternal snow (スノ)] ワンスモア・アゲイン (ONE PIECE),Wansumoa・agein,japanese,,,doujinshi,one piece,"trafalgar law, corazon | donquixote rosinante","males only, yaoi",90,2026-03-02 15:37:41,2026-03-02 15:37:41,2026-03-03 14:03:38
634065,[Resoman Manga Koubou] A story about a single mom who ended up trying to get pregnant with her son [English],[リゾマン漫画工房] 息子と妊活しちゃったシンママの話,A story about a single mom who ended up trying to get pregnant with her son,"english, translated",,resoman manga koubou,doujinshi,,,"nakadashi, mother, x-ray, incest, impregnation, shotacon, sole female, sole male, rough translation",42,2026-03-02 15:45:19,2026-03-02 15:45:19,2026-03-03 14:03:39
634066,[Yomichi Ten] Shuuchaku-kei Idol no Sex wa Ai ga Omo Sugiru ~03-04 | 执着系爱豆做爱时的爱太过沉重~03-04话 [Chinese] [橄榄汉化组],[夜道てん] 執着系アイドルのセックスは愛が重すぎる [中国翻訳],Shuuchaku04 | 执着系爱豆做爱时的爱太过沉重~03-04话,"translated, chinese",yomichi ten,,doujinshi,original,,scanmark,62,2026-03-02 15:48:58,2026-03-02 15:48:58,2026-03-03 14:03:40
634067,[Rizoman Manga Studio] Making a baby with my mom at the public bath [English],[リゾマン漫画工房] 銭湯でママと子作りしてます,Making a baby with my mom at the public bath,"english, translated",,resoman manga koubou,doujinshi,,,"big breasts, mother, incest, shotacon, sole female, sole male, rough translation",42,2026-03-02 15:56:50,2026-03-02 15:56:50,2026-03-03 14:03:41
634068,[Usagi Mishima hisu i] Miyoshi-chan to Taichi-kun｜ 三好与太一[Chinese] [橄榄汉化组],[兎三島ひすい] 三好ちゃんと太一くん,Miyoshikun｜ 三好与太一,"translated, chinese",,,doujinshi,,,,33,2026-03-02 15:58:56,2026-03-02 15:58:56,2026-03-03 14:03:43
634069,[Yoshida soboro] Mukashi no oshi ni gachi koi geki jū shūchaku sa re teta｜ 昔日本命大动真情 病态纠缠向我袭来 [Chinese] [橄榄汉化组],[吉田そぼろ] 昔の推しにガチ恋激重執着されてた,Mukashi no oshi ni gachi koi geki jū shūchaku sa re teta｜ 昔日本命大动真情 病态纠缠向我袭来,"translated, chinese",,,doujinshi,,,,77,2026-03-02 16:04:02,2026-03-02 16:04:02,2026-03-03 14:03:43
634070,"[Niki Ui (Shizuka Kei)] Summer Vacation: My Aunt and I's [Sexual Life Experiment] ~It's Okay to Have a Baby, So Just Do Your Best~",[弐城宇井 (静珪)] 夏休み 伯母さんとボクの【 性 活 験 習 】～赤ちゃん出来ちゃってもいいから、頑張ってごらん～,Summer Vacation: My Aunt and I's,"english, translated",shizu kei,nishiro ui,doujinshi,,,"pregnant, mother, full color, incest, aunt, shotacon, sole male, old lady, rough translation",57,2026-03-02 16:15:12,2026-03-02 16:15:12,2026-03-03 14:03:45
634071,(C107) [Mutou Koucha] Smart Glasses no Love Assist App o Tsukatte Zecchou Count Ecchi,(C107) [無糖紅茶] スマートグラスのラブアシストアプリを使って絶頂カウントえっち,Smart Glasses no Love Assist App o Tsukatte Zecchou Count Ecchi,japanese,mutou koucha,,doujinshi,,,"nakadashi, stockings, sole female, sole male",26,2026-03-02 16:16:58,2026-03-02 16:16:58,2026-03-03 14:03:46
634072,[Corundum] Jousha Manner ga Saiaku no Shupogaki Tomo ni Nekketsu Shidou Suru Sensei (Blue Archive) [Chinese] [無邪気漢化組],[こらんだむ] 乗車マナーが最悪のシュポガキ共に熱血指導する先生 (ブルーアーカイブ) [中国翻訳],Jousha Manner ga Saiaku no Shupogaki Tomo ni Nekketsu Shidou Suru Sensei,"translated, chinese",corundum,,doujinshi,blue archive,"sensei, hikari tachibana, nozomi tachibana, aoba utsumi","twins, group, ffm threesome, lolicon, mosaic censorship, sole male, tail, shimaidon, halo",6,2026-03-02 16:18:29,2026-03-02 16:18:29,2026-03-03 14:03:46
634073,[MK]学園ダイヤリーPremium 1-7 [chinese],,学園ダイヤリーPremium 1-7,"translated, chinese",mk,,doujinshi,original,,"big breasts, group, schoolgirl uniform, nakadashi, ffm threesome, full color, incest, bunny girl, stockings, pantyhose, apron, gokkun, sister, sole female",32,2026-03-02 16:20:44,2026-03-02 16:20:44,2026-03-03 14:03:47
634074,[Kuchita Inugoya (Inu Chikushou)] Nanjo-kun ga Haru to Shichau Hon. (IDOLM@STER CINDERELLA GIRLS) [Chinese] [Digital],[朽ちた犬小屋 (犬畜生)] 南条くん♂が晴としちゃう本。 (アイドルマスター シンデレラガールズ) [中国翻訳] [DL版],Nanjo-kun ga Haru to Shichau Hon.,"translated, chinese",inu chikushou,kuchita inugoya,doujinshi,the idolmaster,"haru yuuki, hikaru nanjo","lolicon, tomboy, shotacon, sole female, sole male, gender change, rough translation, kodomo doushi, kodomo only",41,2026-03-02 16:28:28,2026-03-02 16:28:28,2026-03-03 14:03:48
634075,[Omochi Kiwi] My eldest son and his educational mother [English MTL],[おもちキウイ] 長男と教育ママ,My eldest son and his educational mother,"english, translated",,,doujinshi,,,"milf, big breasts, bbw, glasses, cheating, mother, full color, multi-work series, incest, tall girl, old lady, rough translation",73,2026-03-02 16:32:47,2026-03-02 16:32:47,2026-03-03 14:03:49
634076,[Kuriame Kururu] 钢铁大陆作战结束后的当晚 (Blue Archive) [Chinese] [AB哥个人汉化],[栗飴くるる] リオとヒマリに搾られる (ブルーアーカイブ) [中国翻訳],钢铁大陆作战结束后的当晚,"translated, chinese",kuriame kururu,,manga,blue archive,"sensei, himari akeboshi, rio tsukatsuki",latex,12,2026-03-02 16:33:45,2026-03-02 16:33:45,2026-03-03 14:03:50
634077,猫耳お姉さんと逆バニーでにゃんにゃん,猫耳お姉さんと逆バニーでにゃんにゃん,猫耳お姉さんと逆バニーでにゃんにゃん,japanese,nokoppa,ennui,doujinshi,,,"big breasts, bunny girl, catgirl, sole female, sole male, kemonomimi, tail",26,2026-03-02 16:35:30,2026-03-02 16:35:30,2026-03-03 14:03:51
634078,佑美羽とろとろ大輪の花.zip,佑美羽とろとろ大輪の花.zip,佑美羽とろとろ大輪の花.zip,japanese,hakuto cake,grand tiramisu,doujinshi,dracu-riot,miu yarai,"big breasts, sole female, sole male, very long hair",26,2026-03-02 16:37:18,2026-03-02 16:37:18,2026-03-03 14:03:52
634079,サキュバスパチェさんに絞られる,サキュバスパチェさんに絞られる,サキュバスパチェさんに絞られる,japanese,yukiusagi.,yuki-iro,doujinshi,touhou project,patchouli knowledge,"wings, big breasts, nakadashi, demon girl, sole female, sole male, horns, tail",17,2026-03-02 16:38:39,2026-03-02 16:38:39,2026-03-03 14:03:53
634080,[らーめん] リクエスト絵「枕営業でスポンサーとボテ腹セックスするアイドル」(学園アイドルマスター),[らーめん] リクエスト絵「枕営業でスポンサーとボテ腹セックスするアイドル」(学園アイドルマスター),リクエスト絵「枕営業でスポンサーとボテ腹セックスするアイドル」,japanese,ra-men,,doujinshi,the idolmaster,,"sweating, big breasts, pregnant, lactation, bbm, sole male",6,2026-03-02 16:39:17,2026-03-02 16:39:17,2026-03-03 14:03:53
634081,[John K. Pe-ta] Cosplay Yankee Onihara-san | Full Hole! Trust Maiden Ch. 4 (Zenryoku Ana Musume) [English] [Wrecking Army] [Decensored],[ジョン・K・ペー太] コスプレヤンキー鬼原さん (全力穴娘) [英訳],Cosplay Yankee Onihara-san | Full Hole! Trust Maiden Ch. 4,"english, translated",john k. pe-ta,,manga,,,"group, uncensored, nakadashi, ahegao, anal, hairy, cosplaying, x-ray, double penetration, gyaru, gaping, mind break, large insertions, stomach deformation, fisting, sole female, anal intercourse",25,2026-03-02 16:41:18,2026-03-02 16:41:18,2026-03-03 14:03:54
634082,[Metsubushi] Deco x Deco | Decoration x Decorative [English] [ConTL] [Digital],[メツブシ] デコ×デコ [英訳] [DL版],Deco x Deco | Decoration x Decorative,"english, translated",metsubushi,,manga,,,"maid, business suit, squirting, bdsm, kissing, virginity, big breasts, nun, garter belt, unusual pupils, cunnilingus, witch, schoolboy uniform, glasses, masturbation, schoolgirl uniform, breast feeding, nakadashi, ahegao, sex toys, dog girl, femdom, bondage, cosplaying, x-ray, defloration, multi-work series, drugs, bunny girl, tankoubon, big areolae, stockings, gyaru, paizuri, fingering, filming, teacher, muscle, big penis, collar, kunoichi, shibari, sole female, sole male, tail plug, kemonomimi, harness, twintails, fishnets, leash, tail, sarashi, gloves, domination loss, petplay, mouth mask, stirrup legwear, eye-covering bang, multiple orgasms, clit stimulation, crying, nipple stimulation, detached sleeves",273,2026-03-02 16:58:01,2026-03-02 16:58:01,2026-03-03 14:03:55
