ID,EN_TITLE,JP_TITLE,CLEAN_TITLE,LANGUAGE,ARTIST,GROUP_NAME,CATEGORY,PARODY,CHARACTER,TAGS,PAGES,UPLOAD_DATE,FORMATTED_DATE,SCRAPED_DATE
633764,[Genkai Hatsudensho (Nakamo)] Onna Gal Joushi to Furin suru Hanashi 5,[限界発電所 (那鴨)] 女ギャル上司と不倫する話 5,Onna Gal Joushi to Furin suru Hanashi 5,japanese,nakamo,genkai hatsudensho,doujinshi,,,"business suit, kissing, big breasts, cunnilingus, story arc, big ass, cheating, nakadashi, dark skin, multi-work series, gyaru, fingering, blowjob, sole female, sole male, very long hair, eye-covering bang",74,2026-03-01 15:51:01,2026-03-01 15:51:01,2026-03-02 14:04:41
633765,【无糖汉化组】性感开发诊疗所~无感辣妹在乳头开发和迷蒙表情中高潮迭起~[こしばすこ],性感開発クリニック〜感じないギャルが乳首責めでトロ顔でイキ狂うまで〜[こしばすこ],【无糖汉化组】性感开发诊疗所,"translated, chinese",,kuroshiba suko,manga,,,"squirting, big breasts, females only, schoolgirl uniform, tailjob, ahegao, femdom, oil, demon girl, yuri, gyaru, fingering, collar, horns, tail, eye-covering bang, doujinshi, nipple stimulation",58,2026-03-01 15:54:40,2026-03-01 15:54:40,2026-03-02 14:04:42
633766,[thirty8ght] サオリ人格排泄 (ブルーアーカイブ),[38] サオリ人格排泄 (ブルーアーカイブ),サオリ人格排泄,japanese,38 | thirty8ght,,doujinshi,blue archive,saori joumae,"rape, personality excretion",38,2026-03-01 15:57:10,2026-03-01 15:57:10,2026-03-02 14:04:43
633767,[越山弱衰] ソロカプホ,[越山弱衰] ソロカプホ,ソロカプホ,japanese,etuzan jakusui,,doujinshi,,,"sole female, sole male, eye-covering bang",24,2026-03-01 16:02:07,2026-03-01 16:02:07,2026-03-02 14:04:44
633768,[越山弱衰] 居候おばさん,[越山弱衰] 居候おばさん,居候おばさん,japanese,etuzan jakusui,,doujinshi,,,"sole female, sole male",15,2026-03-01 16:03:12,2026-03-01 16:03:12,2026-03-02 14:04:46
633769,[Kurogane Kenn] Tae-chan to Jimiko-san 3 [Chinese] [Script7810] [Digital],[玄鉄絢] たえちゃんとじみこさん 3 [中国翻訳] [DL版],Taesan 3,"translated, chinese",kurogane kenn,,doujinshi,original,,"kissing, cunnilingus, group, females only, story arc, mother, hairy, yuri, multi-work series, incest, tankoubon, fingering, daughter, oyakodon, fff threesome, manga",60,2026-03-01 16:06:59,2026-03-01 16:06:59,2026-03-02 14:04:47
633770,[越山弱衰] 真逆な幼馴染,[越山弱衰] 真逆な幼馴染,真逆な幼馴染,japanese,etuzan jakusui,,doujinshi,,,"schoolgirl uniform, sole female, sole male",20,2026-03-01 16:08:23,2026-03-01 16:08:23,2026-03-02 14:04:48
633771,[MadBull] 雌性朋友2 （个人汉化）,,雌性朋友2 （个人汉化）,"translated, chinese",madbull,,doujinshi,,,"big breasts, rough translation",12,2026-03-01 16:09:18,2026-03-01 16:09:18,2026-03-02 14:04:49
633772,[越山弱衰] 幼馴ビッチ,[越山弱衰] 幼馴ビッチ,幼馴ビッチ,japanese,etuzan jakusui,,doujinshi,,,"sole female, sole male",15,2026-03-01 16:10:19,2026-03-01 16:10:19,2026-03-02 14:04:50
633773,[Shoujo Rakugakichuu (Himajin no Izu)] Udonge no Hatsujouki [English] [Team Rabu2],[少女落描中 (暇人のいず)] うどんげの発情期 [英訳],Udonge no Hatsujouki,"english, translated",himajin no izu,,doujinshi,touhou project,reisen udongein inaba,"bunny girl, bald",4,2026-03-01 16:10:48,2026-03-01 16:10:48,2026-03-02 14:04:51
633774,[越山弱衰] 売り子に来たのはおばさんでした,[越山弱衰] 売り子に来たのはおばさんでした,売り子に来たのはおばさんでした,japanese,etuzan jakusui,,doujinshi,,,"big breasts, glasses, sole female, sole male",19,2026-03-01 16:12:06,2026-03-01 16:12:06,2026-03-02 14:04:54
633775,[Dynamite moca] Tokunou! Otokonoko Milk [Digital] [Chinese],[ダイナマイトmoca] 特濃! 男の娘ミルク [DL版] [中国翻訳],Tokunou! Otokonoko Milk,"translated, chinese",dynamite moca,,manga,,,"anal, sex toys, tankoubon, tomgirl, rough translation",201,2026-03-01 16:24:33,2026-03-01 16:24:33,2026-03-02 14:04:55
633776,[Kikuo Sound Works (Kikuo)] Boku wa Onee-san ga Hoshii/我想要一个姐姐 [Chinese][频寸个人汉化],[Kikuo Sound Works (きくお)] 僕はお姉さんがほしい [中文翻譯] [DL版],Boku wa Onee-san ga Hoshii/我想要一个姐姐,"japanese, translated, chinese",kikuo,kikuo sound works,doujinshi,,,,127,2026-03-01 16:31:51,2026-03-01 16:31:51,2026-03-02 14:04:56
633777,[indigo ya] tesuto no tensuu ga agaru nara ona ho ni mo natte kureru gouri teki na o kaa sann [Chinese],[インディゴ屋] テストの点数が上がるならオナホにもなってくれる合理的なお母さん [中国翻訳],tesuto no tensuu ga agaru nara ona ho ni mo natte kureru gouri teki na o kaa sann,"translated, chinese",,,doujinshi,,,"squirting, milf, big breasts, spanking, glasses, big ass, nakadashi, mother, incest, shotacon, sole female, sole male, nipple stimulation",26,2026-03-01 16:37:01,2026-03-01 16:37:01,2026-03-02 14:04:58
633778,"[Namaribou Nayonayo] Ichiou, Share House no Kanrinin Nandesu ga... [Chinese]",[五味滓太郎 (鉛棒なよなよ)] 一応、シェアハウスの管理人なんですが・・・1 [中国翻訳],"Ichiou, Share House no Kanrinin Nandesu ga...","translated, chinese",namaribou nayonayo,,doujinshi,,,"full color, rough translation",42,2026-03-01 16:39:41,2026-03-01 16:39:41,2026-03-02 14:04:59
633779,[indigo ya] tesuto no tensuu ga agaru nara ona ho ni mo natte kureru gouri teki na o kaa sann,[インディゴ屋] テストの点数が上がるならオナホにもなってくれる合理的なお母さん,tesuto no tensuu ga agaru nara ona ho ni mo natte kureru gouri teki na o kaa sann,japanese,,,doujinshi,,,"milf, big breasts, glasses, big ass, nakadashi, mother, incest, shotacon, sole female, sole male",26,2026-03-01 16:44:43,2026-03-01 16:44:43,2026-03-02 14:05:00
633780,"[Namaribou Nayonayo] Ichiou, Share House no Kanrinin Nandesu ga... Ch. 2 [Chinese]",[五味滓太郎 (鉛棒なよなよ)] 一応、シェアハウスの管理人なんですが・・・2 [中国翻訳],"Ichiou, Share House no Kanrinin Nandesu ga... Ch. 2","translated, chinese",namaribou nayonayo,,doujinshi,,,"full color, multi-work series, rough translation",40,2026-03-01 16:47:04,2026-03-01 16:47:04,2026-03-02 14:05:02
633781,"[Namaribou Nayonayo] Ichiou, Share House no Kanrinin Nandesu ga... Ch. 3 [Chinese]",[五味滓太郎 (鉛棒なよなよ)] 一応、シェアハウスの管理人なんですが・・・3 [中国翻訳],"Ichiou, Share House no Kanrinin Nandesu ga... Ch. 3","translated, chinese",namaribou nayonayo,,doujinshi,,,"full color, multi-work series, rough translation",40,2026-03-01 16:49:38,2026-03-01 16:49:38,2026-03-02 14:05:06
633782,"[Namaribou Nayonayo] Ichiou, Share House no Kanrinin Nandesu ga... Ch. 4 [Chinese]",[五味滓太郎 (鉛棒なよなよ)] 一応、シェアハウスの管理人なんですが・・・最終話 [中国翻訳],"Ichiou, Share House no Kanrinin Nandesu ga... Ch. 4","translated, chinese",namaribou nayonayo,,doujinshi,,,"full color, multi-work series, rough translation",38,2026-03-01 16:51:56,2026-03-01 16:51:56,2026-03-02 14:05:06
633783,[HBO (Henkuma)] Ongaeshi no Jikan desu | 现在是报恩时间 [Chinese] [白杨汉化组] [Digital],[HBO (変熊)] 恩返しの時間です [中国翻訳] [DL版],Ongaeshi no Jikan desu | 现在是报恩时间,"translated, chinese",henkuma,hbo,doujinshi,,,"squirting, kissing, big breasts, cunnilingus, group, schoolgirl uniform, nakadashi, ahegao, ffm threesome, x-ray, tall girl, blowjob, big penis, stomach deformation, sole male, beauty mark",36,2026-03-01 16:54:19,2026-03-01 16:54:19,2026-03-02 14:05:11
633784,Mama Tomo Harem ch 3( incomplete) AI,[Maimu-Maimu] Mama Tomo Harem,Mama Tomo Harem ch 3AI,"english, translated",maimu-maimu,,manga,,,"milf, big breasts, incomplete, rough translation",6,2026-03-01 16:55:07,2026-03-01 16:55:07,2026-03-02 14:05:13
633785,[某国大統領] 気付いた時には手遅れだった教師陣,,気付いた時には手遅れだった教師陣,japanese,boukoku daitouryou,,doujinshi,,,yuri,9,2026-03-01 16:56:00,2026-03-01 16:56:00,2026-03-02 14:05:13
633786,出来收货的巨乳大姐姐实在太过于色情了 [Chinese] [白杨汉化组] [Digital],,出来收货的巨乳大姐姐实在太过于色情了,"translated, chinese",,seika kairaku shoten,doujinshi,,,"kissing, big breasts, big ass, nakadashi, x-ray, paizuri, fingering, blowjob, muscle, sole female, sole male, nipple stimulation",65,2026-03-01 17:00:00,2026-03-01 17:00:00,2026-03-02 14:05:14
633787,[Aian] Onoko to. [Digital] [Chinese],[あいあん] おのこと。 [DL版] [中国翻訳],Onoko to.,"translated, chinese",aian,,manga,,,"anal, sex toys, shemale, tankoubon, tomgirl, rough translation",259,2026-03-01 17:14:54,2026-03-01 17:14:54,2026-03-02 14:05:15
633788,[Gibachan] Chichi Fuufu no Yoru ~Ochame na Okusan no Amaama Bakunyuu Gohoushi~ [Chinese] [甜族星人赞助汉化],[ぎばちゃん] 乳・夫婦ノ夜〜お茶目な奥さんの甘々爆乳ご奉仕〜 [中国翻訳],Chichi Fuufu no Yoru,"translated, chinese",gibachan,,doujinshi,,,"milf, big breasts, glasses, multi-work series, cowgirl, paizuri, beauty mark",181,2026-03-01 17:26:01,2026-03-01 17:26:01,2026-03-02 14:05:15
633789,[Hiro潶] 《~英霊百足蹂躙~ 远坂之女》,,《远坂之女》,chinese,hiroki00,,doujinshi,fate stay night,rin tosaka,"sole female, twintails",22,2026-03-01 17:27:42,2026-03-01 17:27:42,2026-03-02 14:05:16
633792,[Nigiri Usagi] Seito ni Juusho ga Baretanda ga Owatta Kamoshiren 1-15,[にぎりうさぎ] 生徒に住所がバレたんだが終わったかもしれん 1-15,Seito ni Juusho ga Baretanda ga Owatta Kamoshiren 1-15,japanese,nigiri usagi,,doujinshi,original,,"handjob, kissing, group, glasses, prostate massage, schoolgirl uniform, facesitting, nakadashi, ahegao, blowjob face, ffm threesome, femdom, harem, x-ray, big areolae, gyaru, teacher, dilf, blowjob, blindfold, deepthroat, sole male, twintails, clothed female nude male, nipple stimulation",128,2026-03-01 17:48:12,2026-03-01 17:48:12,2026-03-02 14:05:22
633793,[Agata] Hadaka Gurashi Ch. 1-17 [Digital],[アガタ] はだかぐらし 第1-17話,Hadaka Gurashi Ch. 1-17,japanese,agata,,manga,,,"squirting, milf, virginity, big breasts, body painting, cunnilingus, group, full censorship, glasses, story arc, urination, nakadashi, sex toys, ffm threesome, femdom, bondage, harem, hairy, dark skin, lolicon, exhibitionism, x-ray, defloration, tanlines, rimjob, small breasts, teacher, blowjob, bandaid, shotacon, sole male, oyakodon, twintails, shimaidon, very long hair, nudism, kodomo doushi, classroom",513,2026-03-01 19:24:15,2026-03-01 19:24:15,2026-03-02 14:05:24
633794,[zetto] SinfulLust #02 [French][Akroda],,SinfulLust #02,"japanese, translated",,,doujinshi,,,"big breasts, old man, sole female, ponytail",123,2026-03-01 19:31:45,2026-03-01 19:31:45,2026-03-02 14:05:25
633795,[ハミルタン] ナミロビ〇眠フェラ漫画 (ワンピース),[ハミルタン] ナミロビ〇眠フェラ漫画 (ワンピース),ナミロビ〇眠フェラ漫画,japanese,hamiltan,,doujinshi,one piece,"nami, nico robin","big breasts, mind control, blowjob, focus blowjob",12,2026-03-01 19:32:37,2026-03-01 19:32:37,2026-03-02 14:05:26
633796,[XTER] 3P Nont x Nush x Nina [English],[XTER] 3P Nont x Nush x Nina [English],3P Nont x Nush x Nina,"english, translated",xter,,doujinshi,,,"big breasts, group, ffm threesome, rough translation",16,2026-03-01 19:33:47,2026-03-01 19:33:47,2026-03-02 14:05:27
633797,xXxBATxXx IMILF Hasshaku-sama & Sadako [AI Generated],,xXxBATxXx IMILF Hasshaku-sama & Sadako,japanese,,,doujinshi,the ring,"sadako yamamura, hasshaku-sama","big breasts, big ass, huge breasts, misc, very long hair, eye-covering bang, painted nails, ai generated",64,2026-03-01 19:37:41,2026-03-01 19:37:41,2026-03-02 14:05:28
633798,[Amanatsu (Delta)] Naisho no Hanatsumi [Chinese] [柠檬茶汉化组] [Digital],[あまなつ (デルタ)] ナイショのおはなつみ [中国翻訳] [DL版],Naisho no Hanatsumi,"translated, chinese",delta,amanatsu,doujinshi,,,"urination, omorashi",28,2026-03-01 19:39:34,2026-03-01 19:39:34,2026-03-02 14:05:28
633799,[うるしうろろ] ぱこぱこボーイッシュちゃん,[うるしうろろ] ぱこぱこボーイッシュちゃん,ぱこぱこボーイッシュちゃん,japanese,urushi uroro,,doujinshi,,,"glasses, lolicon, dilf, bbm, sole female, sole male",10,2026-03-01 19:41:29,2026-03-01 19:41:29,2026-03-02 14:05:30
633800,Ultra Heroine: Absolute Desperation,ウルトラヒロイン絶体絶命,Ultra Heroine: Absolute Desperation,"translated, chinese",co,,doujinshi,ultraman,,"big breasts, ahegao, ryona, bondage, bodysuit, rough translation",74,2026-03-01 19:45:36,2026-03-01 19:45:36,2026-03-02 14:05:30
633801,[Hayashida Toranosuke] Hamerare Otokonoko [Digital] [Chinese],[林田虎之助] ハメられ男の娘 [DL版] [中国翻訳],Hamerare Otokonoko,"translated, chinese",hayashida toranosuke,,manga,,,"anal, sex toys, tankoubon, tomgirl, rough translation",197,2026-03-01 19:57:25,2026-03-01 19:57:25,2026-03-02 14:05:31
633802,[Akai Yoru] Jiyoudama [Digital] [Chinese],[紅威ヨル] じょうだま [DL版] [中国翻訳],Jiyoudama,"translated, chinese",akai yoru,,manga,,,"anal, crossdressing, tankoubon, yaoi, tomgirl, rough translation",190,2026-03-01 20:08:56,2026-03-01 20:08:56,2026-03-02 14:05:32
633803,[Pakupaku] Lewd Exosister Book (Yu-Gi-Oh! OCG) [Digital],[パクパク] エクソシスター・スケベブック (遊戯王OCG) [DL版],Lewd Exosister Book,japanese,,,doujinshi,yu-gi-oh,,"big breasts, ponytail, very long hair",22,2026-03-01 20:10:30,2026-03-01 20:10:30,2026-03-02 14:05:33
633804,[Minazuki Mikka] ko tumami 1「 up syu・ kuzu mura」,[水無月三日] 個撮 1「うp主・クズ村」,ko tumami 1「 up syu・ kuzu mura」,japanese,minazuki mikka,,doujinshi,,,"milf, full color",33,2026-03-01 20:12:38,2026-03-01 20:12:38,2026-03-02 14:05:34
633805,[Minazuki Mikka] ko tumami2「 up syu・ kuzu mura」,[水無月三日] 個撮2「うp主・クズ村」,ko tumami2「 up syu・ kuzu mura」,japanese,minazuki mikka,,doujinshi,,,"milf, full color",31,2026-03-01 20:14:33,2026-03-01 20:14:33,2026-03-02 14:05:36
633806,[うるしうろろ] みるくちゃん グレースケール,[うるしうろろ] みるくちゃん グレースケール,みるくちゃん グレースケール,japanese,urushi uroro,,doujinshi,,,"stockings, cowgirl, collar, bbm, sole female, sole male, kemonomimi, horns, gloves",7,2026-03-01 20:15:14,2026-03-01 20:15:14,2026-03-02 14:05:37
633807,"[Macaron Sugar] Doutei Daisuki Jogakusei-chan, Zetsurin Doutei ni Haiboku suru -Fourth Happiness- [Chinese][AI渣翻]",[まかろんシュガー] 童貞大好き女学生ちゃん、絶倫童貞に敗北する―Fourth Happiness― [中国翻訳],Doutei Daisuki JogakuseiFourth Happiness-,"translated, chinese",,macaron sugar,doujinshi,,,"leg lock, big breasts, pregnant, nakadashi, multi-work series, mosaic censorship, impregnation, sole female, sole male, very long hair, rough translation",63,2026-03-01 20:19:03,2026-03-01 20:19:03,2026-03-02 14:05:38
633808,[Hisai Hikou] Jibun Igai Jyoushiki ga Kaihen Sareta Kyoushitsu de Bucket ni Oshikko Saserareru Hon,[久井避航] 自分以外常識が改変された教室でバケツにおしっこさせられる本,Jibun Igai Jyoushiki ga Kaihen Sareta Kyoushitsu de Bucket ni Oshikko Saserareru Hon,"translated, chinese",hisai hikou,,doujinshi,,,"exhibitionism, rough translation",49,2026-03-01 20:21:58,2026-03-01 20:21:58,2026-03-02 14:05:39
633809,[Studio Macaron (Moeyama P-Man)] Houkago ni Ochita Haha - SmaPho ni Nokosareta Kiroku  | Fallen mother after school [Engslish] [toidaden],[studioマカロン (萌山ぴーまん)] 放課後に堕ちた母 スマホに残された記録 [中国翻訳],Houkago ni Ochita Haha - SmaPho ni Nokosareta Kiroku  | Fallen mother after school,"english, translated",moeyama p-man,studio macaron,doujinshi,,,"milf, big breasts, glasses, netorare, story arc, hairy, mosaic censorship, teacher, blackmail",91,2026-03-01 20:27:19,2026-03-01 20:27:19,2026-03-02 14:05:40
633810,(UNLIMITED EX 14) [rtam (Aoi)] Yoru wa Nakenashi (OMORI),(UNLIMITED EX 14) [rtam (青い)] 夜はなけなし (OMORI),Yoru wa Nakenashi,japanese,aoi,rtam,doujinshi,omori,"basil, sunny","anal, sleeping, males only, yaoi, shotacon, anal intercourse, kodomo doushi, kodomo only",30,2026-03-01 20:33:07,2026-03-01 20:33:07,2026-03-02 14:05:44
633811,[CELLULOID-ACME (Chiba Toshirou)] Toppin Parari no Puu (Reiwa no Dara-san) [Digital] [Chinese] [黑锅汉化组],[CELLULOID-ACME (チバトシロウ)] とっぴんぱらりのぷう (令和のダラさん) [中国翻訳] [DL版],Toppin Parari no Puu,"translated, chinese",chiba toshirou,celluloid-acme,doujinshi,reiwa no dara-san,,"sweating, big breasts, monster girl, nakadashi, snake, long tongue, tomgirl, sole female, sole male, closed eyes",32,2026-03-01 20:35:11,2026-03-01 20:35:11,2026-03-02 14:05:45
633812,"[Rouka] ""Nee... Onii-san shimasen ka"" | ""Hey… wanna do it, Onii-san"" [English] [Aishi21]",[ろうか] 「ねぇ…お兄さんしませんか」[英訳],"""Nee... Oniisan""","english, translated",rouka,,doujinshi,,,"kissing, big breasts, swimsuit, group, masturbation, pasties, nakadashi, huge breasts, sex toys, blowjob face, ffm threesome, x-ray, multi-work series, bunny girl, stockings, paizuri, blowjob, muscle, sole male, beauty mark, gloves, shimaidon, very long hair, multimouth blowjob",105,2026-03-01 20:41:04,2026-03-01 20:41:04,2026-03-02 14:05:46
633813,[laliberte] Paradise [Chinese] [老w个人汉化],[laliberte] Paradise [中国翻訳],Paradise,"translated, chinese",laliberte,,doujinshi,original,,"squirting, milf, sweating, big breasts, swimsuit, humiliation, group, netorare, uncensored, story arc, masturbation, schoolgirl uniform, nakadashi, moral degeneration, ahegao, anal, blowjob face, ffm threesome, hairy, dark skin, bikini, x-ray, gyaru-oh, defloration, full color, wrestling, big areolae, paizuri, ball sucking, rape, blackmail, tomboy, inverted nipples, blowjob, muscle, big penis, beauty mark, small penis, multimouth blowjob, anal intercourse, nipple stimulation, beach",192,2026-03-01 20:52:08,2026-03-01 20:52:08,2026-03-02 14:05:48
633814,[TSFのF (神楽くるみ)]TS现实改写~沦落为新人角色扮演风俗女郎♀的警察♂~[WPSX润色],[TSFのF (神楽くるみ)]TS現実改変 ～新人コスプレ風俗嬢♀に堕ちる警察官♂～ [中国翻訳],TS现实改写,"translated, chinese",kagura kurumi,tsf no f,doujinshi,,,"big breasts, yuri, mind control, policewoman, full color, policeman, paizuri, mosaic censorship, bisexual, gender morph, gender change, rough translation",37,2026-03-01 20:55:45,2026-03-01 20:55:45,2026-03-02 14:05:50
633815,[Chae] Tonari no obasan ga bakamitai ni shiko reru. [Chinese] [AI Translated],[ちゃえ] 隣のおばさんがバカみたいにシコれる。 [中国翻訳] [機翻潤色],Tonari no obasan ga bakamitai ni shiko reru.,"translated, chinese",,chae,doujinshi,original,,"milf, sweating, kissing, big breasts, swimsuit, bbw, group, netorare, story arc, big ass, cheating, condom, nakadashi, ahegao, huge breasts, tall man, blowjob face, ffm threesome, harem, dark skin, bikini, x-ray, gyaru-oh, huge penis, stockings, drunk, gyaru, filming, rape, blowjob, muscle, big penis, stomach deformation, deepthroat, sole male, very long hair, multimouth blowjob, multiple orgasms, big muscles, rough translation",288,2026-03-01 21:12:31,2026-03-01 21:12:31,2026-03-02 14:05:51
633816,"[P&I (Mel EX, Satsukimasu)] [Sad News] Popular streamer gets so absorbed in VR that they end up having their nipples revealed lol",[P&I (さつきます)] 【悲報】人気ライバーさん VRに夢中で乳首解禁させられるw,Popular streamer gets so absorbed in VR that they end up having their nipples revealed lol,"english, translated",,,doujinshi,,,"big breasts, twintails, no penetration, rough translation",42,2026-03-01 21:15:08,2026-03-01 21:15:08,2026-03-02 14:05:53
633817,[うるしうろろ] 幻の非合法風俗通り,[うるしうろろ] 幻の非合法風俗通り,幻の非合法風俗通り,japanese,urushi uroro,,doujinshi,,,"stockings, kemonomimi, gloves",8,2026-03-01 21:16:44,2026-03-01 21:16:44,2026-03-02 14:05:54
633818,[Donguri Ageru (Korisu)] Omakase Kudasai! Iruma-sama (Mairimashita! Iruma-kun),[どんぐりあげる (こりす)] お任せ下さいっ！イルマさま (魔入りました！入間くん),Omakase Kudasai! Iruma-sama,japanese,korisu,donguri ageru,doujinshi,mairimashita iruma-kun,"iruma suzuki, alice asmodeus","males only, yaoi, shotacon",23,2026-03-01 21:21:11,2026-03-01 21:21:11,2026-03-02 14:05:55
633819,[Zenshuu Bougyo (Sin Iti)] Elmo-gou no Saoyaku ga Tarinai no de Chinchin o Hayasare Kyouyuu Zaisan ni Sareta Sextance no Hanashi (Dolls' Frontline) [Chinese] [圣辇航空汉化] [Digital],[ゼンシュウボウギョ (ミナミ・シン)] エルモ号の竿役が足りないのでチ○チ○を生やされ共有財産にされたセクスタンスの話 (ドールズフロントライン) [中国翻訳] [DL版],Elmo-gou no Saoyaku ga Tarinai no de Chinchin o Hayasare Kyouyuu Zaisan ni Sareta Sextance no Hanashi,"translated, chinese",sin iti,zenshuu bougyo,doujinshi,girls frontline,ots-14,"onahole, group, glasses, shemale, dark skin, blowjob, sole male, dickgirl on female",39,2026-03-01 21:23:40,2026-03-01 21:23:40,2026-03-02 14:05:56
633820,[うるしうろろ] 褐色⬜︎リインタビュー,[うるしうろろ] 褐色⬜︎リインタビュー,褐色⬜︎リインタビュー,japanese,urushi uroro,,doujinshi,,,"sweating, kissing, unusual pupils, glasses, nakadashi, hairy, lolicon, gyaru, bbm, sole female, sole male, bald",6,2026-03-01 21:24:59,2026-03-01 21:24:59,2026-03-02 14:05:57
633821,【青豆腐+朝凪+煌野一人】异能少女欠损第三季（企划阶段）,【青豆腐+朝凪+煌野一人】异能少女欠损第三季（企划阶段）,【青豆腐+朝凪+煌野一人】异能少女欠损第三季（企划阶段）,"japanese, translated, chinese","asanagi, neromashin, fan no hitori | kazunto","fatalpulse, ijou nouryoku kenkyuukaihatsu kikou",doujinshi,original,,"big breasts, piercing, pregnant, amputee, snuff, huge breasts, drugs, blood, guro, leotard, hotpants, ponytail, hanging, nipple piercing",38,2026-03-01 21:27:11,2026-03-01 21:27:11,2026-03-02 14:05:58
633822,异能者少女欠损合同本1（含角色补全）+2+3（企划阶段）+同人二创,异能者少女欠损合同本1（含角色补全）+2+3（企划阶段）+同人二创,异能者少女欠损合同本1（含角色补全）+2+3（企划阶段）+同人二创,"japanese, translated, chinese","shindol, nanashi, obui, mochi, atage, potion, asanagi, neromashin, accio, fan no hitori | kazunto","fatalpulse, ijou nouryoku kenkyuukaihatsu kikou",doujinshi,original,,"forniphilia, big breasts, gag, torture, piercing, pregnant, amputee, snuff, body modification, bestiality, ahegao, huge breasts, anal, syringe, asphyxiation, bondage, brain fuck, lolicon, nipple fuck, latex, footjob, drugs, blood, ear fuck, pantyhose, human cattle, guro, mind break, rape, leotard, hotpants, collar, stomach deformation, slave, beauty mark, kemonomimi, ponytail, goudoushi, crying, vaginal birth, nipple piercing, property tag",330,2026-03-01 22:28:32,2026-03-01 22:28:32,2026-03-02 14:05:59
633823,(C107) [OVing (Obui)] Paihame  Nakayoshi Zenpen,(C107) [OVing (おぶい)]  パイハメなかよし 前編,Paihame  Nakayoshi Zenpen,japanese,obui,oving,doujinshi,,,"big breasts, huge breasts, lolicon, nipple fuck, oppai loli, rape, dilf, sole male",42,2026-03-01 22:37:02,2026-03-01 22:37:02,2026-03-02 14:05:59
633824,[うるしうろろ] メス小鬼に絶頂4の刑！&ミニ総括とおまけ,[うるしうろろ] メス小鬼に絶頂4の刑！&ミニ総括とおまけ,メス小鬼に絶頂4の刑！&ミニ総括とおまけ,japanese,urushi uroro,,doujinshi,,,"oni, monster girl, bbm, stomach deformation, sole female, bald, horns",8,2026-03-01 22:37:46,2026-03-01 22:37:46,2026-03-02 14:06:00
633825,[Mugieru Koubo (Yuu.)] Uraaka Gozaru (Kazama Iroha) [Chinese] [Digital],[ムギエル工房 (悠。)] ウラアカござる (風真いろは) [中国翻訳] [DL版],Uraaka Gozaru,"translated, chinese",yuu,,doujinshi,hololive,kazama iroha,"sole female, sole male, vtuber, extraneous ads",30,2026-03-01 22:40:11,2026-03-01 22:40:11,2026-03-02 14:06:01
633826,[Yashiro Plus. (Sakon Subaru)] Bishokuka no Himegoto 4 | 美食家的隱秘私情4 (Blue Archive) [Chinese] [Digital],[ヤシロPlus。 (左近昴)] 美食家の秘め事 4 (ブルーアーカイブ) [中国翻訳] [DL版],Bishokuka no Himegoto 4 | 美食家的隱秘私情4,"translated, chinese",sakon subaru,yashiro plus.,doujinshi,blue archive,"sensei, akari wanibuchi","big breasts, multi-work series, sole female, sole male, horns, extraneous ads, halo",29,2026-03-01 22:42:07,2026-03-01 22:42:07,2026-03-02 14:06:02
633827,[Mint no Chicchai Oana (Mint Muzzlini)] NTR Jigo Houkoku 2 After [Chinese],[ミントのちっちゃいお穴 (ミント・ムッツリーニ)] NTR事後報告2 after [中国翻訳],NTR Jigo Houkoku 2 After,"translated, chinese",,mint no chicchai oana,doujinshi,original,,"twintails, extraneous ads",141,2026-03-01 22:50:05,2026-03-01 22:50:05,2026-03-02 14:06:03
