ID,EN_TITLE,JP_TITLE,CLEAN_TITLE,LANGUAGE,ARTIST,GROUP_NAME,CATEGORY,PARODY,CHARACTER,TAGS,PAGES,UPLOAD_DATE,FORMATTED_DATE,SCRAPED_DATE
633513,[multiplication (3x3)] Piper-san Nemurisugi!! (Zenless Zone Zero) [Chinese] [Digital],[multiplication (3×3)] パイパーさん眠りすぎ!! (ゼンレスゾーンゼロ) [中国翻訳] [DL版],Piper-san Nemurisugi!!,"translated, chinese",3x3,multiplication,doujinshi,zenless zone zero,piper wheel,"sleeping, lolicon, extraneous ads",29,2026-03-01 00:03:01,2026-03-01 00:03:01,2026-03-02 14:00:12
633514,"[EX Production (EX Alnam)] Yotta Futari ga One Night de Stress Hassan suru Hanashi (Ichijou Ririka, Yukihana Lamy) [Chinese] [Digital]",[EXプロダクション (EXアルナム)] 酔った二人がワンナイトでストレス発散する話 (一条莉々華、雪花ラミィ) [中国翻訳] [DL版],Yotta Futari ga One Night de Stress Hassan suru Hanashi,"translated, chinese",ex alnam,,doujinshi,hololive,"yukihana lamy, ichijou ririka","elf, vtuber, very long hair, extraneous ads",24,2026-03-01 00:04:35,2026-03-01 00:04:35,2026-03-02 14:00:14
633515,[Ameyama Denshin]  Uraniwa-ke Renai Shinkouchuu Ch. 5   (ANGEL Club 2026-02) [Chinese] [Digital],[雨山電信] 裏庭家恋愛進行中 第5話 (ANGEL倶楽部 2026年2月号) [中国翻訳] [DL版],Uraniwa-ke Renai Shinkouchuu Ch. 5,"translated, chinese",ameyama denshin,,doujinshi,original,,"big breasts, extraneous ads",23,2026-03-01 00:06:06,2026-03-01 00:06:06,2026-03-02 14:00:15
633516,[Baksheesh AT] Zoku Oyako no Koibito - Mother and Daughter's Lover (ANGEL Club 2026-02) [Chinese] [Digital],[バクシーシAT] ぞく♥母娘の恋人 (ANGEL倶楽部 2026年2月号) [中国翻訳] [DL版],Zoku Oyako no Koibito - Mother and Daughter's Lover,"translated, chinese",at,,manga,,,"milf, big breasts, group, full censorship, breast feeding, dog girl, ffm threesome, lactation, stockings, collar, sole male, oyakodon, kemonomimi, tail, gloves, extraneous ads",25,2026-03-01 00:07:46,2026-03-01 00:07:46,2026-03-02 14:00:16
633517,[AERODOG (inu)] H na Ouji-sama wa Dame desuka? (Gakuen IDOLM@STER) [Chinese] [Digital],[AERODOG (inu)] Hな王子様はダメですか？ (学園アイドルマスター) [中国翻訳] [DL版],H na Ouji-sama wa Dame desuka?,"translated, chinese",inu,aerodog,doujinshi,the idolmaster,"producer, mao arimura","sole female, sole male, extraneous ads",29,2026-03-01 00:09:39,2026-03-01 00:09:39,2026-03-02 14:00:17
633518,[So-matou (So-ma)] Gakkou de FanSe - Fan service at school (Kimi to Idol PreCure) [Chinese] [Digital],[そーま党 (そーま)] 学校でファンサ♡ (キミとアイドルプリキュア♪) [中国翻訳] [DL版],Gakkou de FanSe - Fan service at school,"translated, chinese",so-ma,so-matou,doujinshi,kimi to idol precure,"cure zukyoon, cure kiss","group, extraneous ads",29,2026-03-01 00:11:29,2026-03-01 00:11:29,2026-03-02 14:00:19
633519,[Pentacle (Shimipan)] Shikatanaku Kaa-chan to Sex Shimasu 7 [Digital],[ペンタクル (しみぱん)] 仕方なく母ちゃんとセックスします7 [DL版],Shikatanaku Kaa-chan to Sex Shimasu 7,japanese,shimipan,pentacle,doujinshi,original,,"milf, big breasts, big ass, nakadashi, huge breasts, mother, hairy, x-ray, full color, multi-work series, incest, filming, mosaic censorship, blowjob, big penis, sole male, pixie cut, netorase",55,2026-03-01 00:14:58,2026-03-01 00:14:58,2026-03-02 14:00:20
633520,[Izumo Gasshuukoku (Momomo Gasshuukoku)] Futanari Ojousama-chan ~Senzoku Maid-san ni Shasei no Otetsudai o Shite Moraimasu!~,[いづも合衆国 (ももも合衆国)] ふたなりお嬢様ちゃん ♥♥専属メイドさんに♥♥ ♥射精のお手伝いをしてもらいます♥,Futanari Ojousamasan ni Shasei no Otetsudai o Shite Moraimasu!~,japanese,momomo gasshuukoku,,doujinshi,original,,"maid, futanari, kissing, big breasts, group, ahegao, full color, stockings, paizuri, gloves, dickgirl on female",30,2026-03-01 00:16:56,2026-03-01 00:16:56,2026-03-02 14:00:21
633521,"[Studio N.Ball (Haritama Hiroki)] Motto, Choroi, Joushi [Chinese] [Digital]",[スタジオN.BALL (針玉ヒロキ)] もっと、チョロい、上司 [中国翻訳] [DL版],"Motto, Choroi, Joushi","translated, chinese",haritama hiroki,studio n.ball,doujinshi,original,,"big breasts, anal, dark skin, mosaic censorship, sole female, sole male, rough translation",58,2026-03-01 00:20:24,2026-03-01 00:20:24,2026-03-02 14:00:22
633522,[Re:Set] Danjon de Onnanoko ni Naru no wa Dame Desu ka? | Is it Bad to be a Girl in a Dungeon?,[Re:Set]ダンジョンで女の子になるのはだめですか?,Danjon de Onnanoko ni Naru no wa Dame Desu ka? | Is it Bad to be a Girl in a Dungeon?,"english, translated",,re set,doujinshi,original,,"piercing, netorare, masturbation, shimapan, nakadashi, ahegao, anal, sex toys, dark skin, lolicon, exhibitionism, x-ray, leotard, hotpants, gender bender, blindfold, slave, sole female, tail plug, facial hair, gender morph, rough translation",134,2026-03-01 00:44:49,2026-03-01 00:44:49,2026-03-02 14:00:22
633523,(C84) [Rotary Engine (Kannazuki Motofumi)] HIGHSCHOOL OF THE DATE (Date A Live) [English] [UVW] [Decensored],(C84) [ろ～たり～Engine (神無月元史)] HIGHSCHOOL OF THE DATE (デート・ア・ライブ) [英訳] [無修正],HIGHSCHOOL OF THE DATE,"english, translated",kannazuki motofumi,rotary engine,doujinshi,date a live,"kotori itsuka, shido itsuka, tohka yatogami, yoshino himekawa","inseki, group, uncensored, femdom, harem, lolicon, defloration, incest, stockings, sister, sole male",37,2026-03-01 00:52:11,2026-03-01 00:52:11,2026-03-02 14:00:23
633524,[Rossaku Kobo (Rossaku)] Nakayoshi ha Kaitakusha no Heya de (Honkai: Star Rail) [Digital],[ろっさく工房 (六作)] なかよしは開拓者の部屋で (崩壊:スターレイル) [DL版],Nakayoshi ha Kaitakusha no Heya de,japanese,rosaku,rosaku koubou,doujinshi,honkai star rail,"caelus, silver wolf, firefly","sweating, kissing, big breasts, unusual pupils, cunnilingus, group, schoolgirl uniform, nakadashi, ffm threesome, x-ray, multiple paizuri, stockings, small breasts, paizuri, fingering, blowjob, big penis, sole male, bisexual, ponytail, drill hair, multimouth blowjob",22,2026-03-01 00:53:47,2026-03-01 00:53:47,2026-03-02 14:00:25
633526,[Xren]  Hanekawa Hasumi wa  Gaman Dekinai (Blue Archive),[Xレン] 羽川ハスミは我慢できない (ブルーアーカイブ),Hanekawa Hasumi wa  Gaman Dekinai,japanese,xren,,doujinshi,blue archive,hasumi hanekawa,"wings, big breasts, x-ray, sole female, sole male, ponytail, very long hair, halo",8,2026-03-01 00:59:03,2026-03-01 00:59:03,2026-03-02 14:00:27
633527,僕はママのペット,僕はママのペット,僕はママのペット,japanese,,,doujinshi,original,,"milf, big breasts, femdom, stockings",34,2026-03-01 01:01:04,2026-03-01 01:01:04,2026-03-02 14:00:28
633528,[比宮じょーず] カノエが先生と入れ替わったタイミングで、エリとエッチすることになった話,[比宮じょーず] カノエが先生と入れ替わったタイミングで、エリとエッチすることになった話,カノエが先生と入れ替わったタイミングで、エリとエッチすることになった話,japanese,himiya zyo-zu,,doujinshi,blue archive,"sensei, eri shirao","big breasts, witch, sole female, sole male",5,2026-03-01 01:01:29,2026-03-01 01:01:29,2026-03-02 14:00:28
633529,[Doraias Kazuyo] All because I took him in..♥ [English],[ドライアス一世] 預かったばっかりに…♥,All because I took him in..♥,"english, translated",doraias kazuyo,,doujinshi,original,,"inseki, milf, big breasts, goblin, netorare, cheating, nakadashi, huge breasts, scanmark, mother, x-ray, full color, mosaic censorship, shotacon, sole female, sole male, low incest, smalldom",6,2026-03-01 01:03:18,2026-03-01 01:03:18,2026-03-02 14:00:29
633530,[Pentacle (Shimipan)] Shikatanaku Kaa-chan to Sex Shimasu 7 - I Have No Choice But to Have Sex with My Mother 7 [English][DarklordMTLs],,Shikatanaku KaaI Have No Choice But to Have Sex with My Mother 7,"english, translated",shimipan,pentacle,doujinshi,original,,"milf, big breasts, big ass, nakadashi, huge breasts, mother, hairy, x-ray, full color, multi-work series, incest, mosaic censorship, impregnation, blowjob, big penis, sole female, pixie cut, rough translation, netorase",58,2026-03-01 01:07:09,2026-03-01 01:07:09,2026-03-02 14:00:30
633531,[Shakunetsu Gorilla no Modoshi Jiru (Tempura Dozaemon)] Tsureshon de Mebaeru Ryou Omoi ~Tada no Otonari-san Datta Onnanoko to Ecchi Shichau made no Ohanashi~ [English] [Digital],[灼熱ゴリラの戻し汁 (天ぷら土左衛門)] 連れションで芽生える両想い♡〜ただのお隣さんだった女の子とエッチしちゃうまでのお話〜  [英訳] [DL版],Tsureshon de Mebaeru Ryou Omoi,"english, translated",tempura dozaemon,,doujinshi,original,,"masturbation, urination, sole female, sole male",54,2026-03-01 01:10:26,2026-03-01 01:10:26,2026-03-02 14:00:31
633532,[Ana Futatsu (Wenajii)] The Two Sea Sacrifices (Touhou Project) [Digital][English][MTL],[穴ふたつ (ヱナジー)] 海贄の二人 (東方Project) [DL版],The Two Sea Sacrifices,"english, translated",wenajii,ana futatsu,doujinshi,touhou project,"renko usami, maribel han","big breasts, rough translation",38,2026-03-01 01:12:51,2026-03-01 01:12:51,2026-03-02 14:00:32
633533,[Minna Shindoi (Shindoro Mondoro)] Meitei Sakanabito (Kaizoku no Noroi) [Digital],[みんなしんどい (新泥もんどろー)] 酩酊さかなびと (海賊の呪い)  [DL版],Meitei Sakanabito,japanese,shindoro mondoro,minna shindoi,doujinshi,shantae,,giantess,18,2026-03-01 01:14:03,2026-03-01 01:14:03,2026-03-02 14:00:33
633534,"[Kaoinshou Zero] Senpai, Kyou mo Funde Agemasu ne",[顔印象零] 先輩、今日も踏んであげますね,"Senpai, Kyou mo Funde Agemasu ne",japanese,,kaoinshou zero,doujinshi,original,,"schoolgirl uniform, femdom, foot licking, footjob, sole female, sole male, clothed female nude male, no penetration",53,2026-03-01 01:17:24,2026-03-01 01:17:24,2026-03-02 14:00:33
633535,でかでかご奉仕ボディーガード,,でかでかご奉仕ボディーガード,japanese,taisho,,doujinshi,original,,"muscle, shotacon",12,2026-03-01 01:18:24,2026-03-01 01:18:24,2026-03-02 14:00:35
633536,(TRC Only Live 2025 Nov. 03) [Tansan Suisou (Souda)] Shounen Struggle (Inazuma Eleven),(TRCオンリーライブ2025 Nov.03) [炭酸水槽 (そーだ)] 少年ストラグル (イナズマイレブン),Shounen Struggle,japanese,souda,tansan suisou,doujinshi,inazuma eleven,"hiroto kiyama, ichirouta kazemaru","males only, yaoi, tomgirl, shotacon",46,2026-03-01 01:27:10,2026-03-01 01:27:10,2026-03-02 14:00:38
633537,"[Hirekatsu] Musuko wa, Watashi to Nama deshitai!? -Musuko to Watashi no Tokubetsu na Kankei- | My Son Was with Me. My Son and I Have a Special Relationship.  [English]",[ヒレカツ] 息子は、私と生でしたい!?ッ -息子と私の特別な関係- [英訳],"Musuko wa, Watashi to Nama deshitai!?| My Son Was with Me. My Son and I Have a Special Relationship.","english, translated",hirekatsu,,doujinshi,original,,"milf, shotacon, rough translation",93,2026-03-01 01:32:33,2026-03-01 01:32:33,2026-03-02 14:00:38
633538,Chiya-chan's All-Humanity Wholehearted Poop Service,,ChiyaHumanity Wholehearted Poop Service,"english, translated",,,doujinshi,original,,"scat, farting, snuff, femdom, exhibitionism, smell, giantess, no penetration, very long hair, rough translation",8,2026-03-01 01:33:19,2026-03-01 01:33:19,2026-03-02 14:00:40
633539,[Himeno Mikan] Toki o Kakeru Lolicon [Ongoing],[姫野蜜柑] 時をかけるロリコン [進行中],Toki o Kakeru Lolicon,japanese,himeno mikan,,doujinshi,original,,"kissing, cunnilingus, glasses, story arc, breast feeding, grandmother, nakadashi, mother, lolicon, x-ray, defloration, incest, stockings, fingering, leotard, voyeurism, bloomers, daughter, blowjob, sole male, ponytail, twintails, mouth mask, nipple stimulation",161,2026-03-01 02:01:13,2026-03-01 02:01:13,2026-03-02 14:00:41
633540,[Goma] Futanari Amu x Natsumi Manga (Summon Night),[ゴマ] ふたなりアム×ナツミ漫画 (サモンナイト),Futanari Amu x Natsumi Manga,japanese,goma,,doujinshi,summon night,,"futanari, nakadashi, big penis, stomach deformation, dickgirl on dickgirl, dickgirls only, full-packaged futanari",10,2026-03-01 02:02:05,2026-03-01 02:02:05,2026-03-02 14:00:42
633541,[Goma] Ball-ka Sareta Yae-chan ga Moteasobareru Manga (Ganbare Goemon),[ゴマ] ボール化されたヤエちゃんが弄ばれる漫画 (がんばれゴエモン),Ballchan ga Moteasobareru Manga,japanese,goma,,doujinshi,ganbare goemon,yae,"big breasts, kunoichi, sole female, fishnets",12,2026-03-01 02:02:54,2026-03-01 02:02:54,2026-03-02 14:00:46
633542,[Goma] Nuigurumi kara Ningen-ka shita Ame-chan to Ecchi suru Manga (Needy Girl OVERDOSE),[ゴマ] ぬいぐるみから人間化したあめちゃんとエッチする漫画 (Needy Girl OVERDOSE),Nuigurumi kara Ningenchan to Ecchi suru Manga,japanese,goma,,doujinshi,needy streamer overload,ame-chan,"nakadashi, x-ray, shotacon, sole female, sole male, twintails, eye-covering bang",16,2026-03-01 02:06:06,2026-03-01 02:06:06,2026-03-02 14:00:47
633543,[鴨野ハシゴ] スリーズブーケの性接待 (ラブライブ! 蓮ノ空女学院スクールアイドルクラブ),[鴨野ハシゴ] スリーズブーケの性接待 (ラブライブ! 蓮ノ空女学院スクールアイドルクラブ),スリーズブーケの性接待,japanese,zuikou kou,,doujinshi,love live hasunosora jogakuin school idol club,,"group, harem, drugs, sole male",11,2026-03-01 02:06:57,2026-03-01 02:06:57,2026-03-02 14:00:48
633544,[中村くまりん] ウタハのエッチな漫画 (ブルーアーカイブ),[中村くまりん] ウタハのエッチな漫画 (ブルーアーカイブ),ウタハのエッチな漫画,japanese,nakamura kumarin,,doujinshi,blue archive,utaha shiraishi,"handjob, full censorship, sole female, sole male, bald, no penetration, nipple stimulation, halo",4,2026-03-01 02:07:20,2026-03-01 02:07:20,2026-03-02 14:00:49
633545,[中村くまりん] アコのエッチな漫画 (ブルーアーカイブ),[中村くまりん] アコのエッチな漫画 (ブルーアーカイブ),アコのエッチな漫画,japanese,nakamura kumarin,,doujinshi,blue archive,ako amau,"x-ray, full color, sole female, sole male, halo",4,2026-03-01 02:07:47,2026-03-01 02:07:47,2026-03-02 14:00:50
633546,[Random] Taima Senshi Afuta- Da-kusaido | Exorcist Warrior After Darkside [English] [Digital] (Pangean),[蘭田夢] 対魔戦士アフターダークサイド [英訳] [DL版],Taima Senshi Afutakusaido | Exorcist Warrior After Darkside,"english, translated",random,,manga,,,"squirting, futanari, kissing, big breasts, corruption, cunnilingus, magical girl, group, females only, nakadashi, femdom, bondage, demon girl, foot licking, yuri, fft threesome, armpit licking, mind break, rape, chikan, sole dickgirl, gloves, fff threesome",12,2026-03-01 02:08:36,2026-03-01 02:08:36,2026-03-02 14:00:51
633547,[Kumajiro] Musume to! Shachuhaku | In the Camper with my Daughter (Otona Ni Nacchau...) [Digital] [English],[くまじろ] 娘と！車中泊 (オトナになっちゃう…) [DL版],Musume to! Shachuhaku | In the Camper with my Daughter,"english, translated",kumajiro,,manga,,,"uncensored, lolicon, incest, daughter, sole male",16,2026-03-01 02:12:03,2026-03-01 02:12:03,2026-03-02 14:00:52
633548,[Hatome Honpo (Hatome)] Maryokugire de Miugoki ga Torenai Mahou Shoujo Aite ni Makeru Wake ga Nai daro!,[はとめ本舗 (はとめ)] 魔力切れで身動きが取れない魔法少女相手に負ける訳がないだろ!,Maryokugire de Miugoki ga Torenai Mahou Shoujo Aite ni Makeru Wake ga Nai daro!,japanese,hatome,hatome honpo,doujinshi,original,,"magical girl, nakadashi, bondage, lolicon, x-ray, blowjob, blindfold, sole female, sole male",30,2026-03-01 02:17:22,2026-03-01 02:17:22,2026-03-02 14:00:53
633549,[はとめ] パチュリーが穴にはまって触手に種付けされちゃう漫画 (東方Project),[はとめ] パチュリーが穴にはまって触手に種付けされちゃう漫画 (東方Project),パチュリーが穴にはまって触手に種付けされちゃう漫画,japanese,hatome,,doujinshi,touhou project,patchouli knowledge,"bondage, x-ray, stuck in wall, tentacles, sole female",11,2026-03-01 02:18:17,2026-03-01 02:18:17,2026-03-02 14:00:53
633550,[Helios] Shikijo Lecture (COMIC Anthurium 2025-12) [Chinese] [山嵐个人汉化] [Digital],[へりおす] 色情レクチャー (COMIC アンスリウム 2025年12月号) [中国翻訳] [DL版],Shikijo Lecture,"translated, chinese",helios,,manga,,,"full censorship, nakadashi, x-ray, blowjob, sole female, sole male",24,2026-03-01 02:19:50,2026-03-01 02:19:50,2026-03-02 14:00:55
633551,[Rabbit's Foot (maze)] Mido+Momo Sukebe Book (Blue Archive) [Digital],[ラビッツフット (maze)] ミドモモスケベブック (ブルーアーカイブ) [DL版],Mido+Momo Sukebe Book,japanese,maze,rabbits foot,doujinshi,blue archive,"midori saiba, momoi saiba, sensei","group, ffm threesome, lolicon, stockings, sole male, kemonomimi, tail, halo",21,2026-03-01 02:21:12,2026-03-01 02:21:12,2026-03-02 14:00:56
633552,[Mobumomumomu] Succubus ni Maketa Shota Yuusha | Hero loses to a succubus [English] [BranWagon],[モブモムモム] サキュバスに負けたショタ勇者 [英訳],Succubus ni Maketa Shota Yuusha | Hero loses to a succubus,"english, translated",,,doujinshi,original,,"nakadashi, femdom, demon girl, full color, mosaic censorship, sole female, sole male, eye-covering bang",17,2026-03-01 02:22:17,2026-03-01 02:22:17,2026-03-02 14:00:56
633553,The Young Lady's (♂) Sex Education,[ゼロイチサン (013)] お嬢様(♂)の性教育 [DL版],The Young Lady'sSex Education,"english, translated",013,,doujinshi,original,,"masturbation, prostate massage, anal, crossdressing, males only, yaoi, tomgirl, shotacon, very long hair, rough translation",37,2026-03-01 02:29:42,2026-03-01 02:29:42,2026-03-02 14:00:57
633554,[Mendakoya-san] Asuna to Hitasura Sukebe suru Hon (Blue Archive),[メンダコ屋さん] アスナとひたすらスケベする本 (ブルーアーカイブ),Asuna to Hitasura Sukebe suru Hon,japanese,,,doujinshi,blue archive,"asuna ichinose, sensei","big breasts, pregnant, unusual pupils, nakadashi, ahegao, bunny girl, lactation, cowgirl, paizuri, impregnation, blowjob, sole female, sole male, halo",27,2026-03-01 02:31:28,2026-03-01 02:31:28,2026-03-02 14:00:58
633555,[Sanbunteki Majority-ya] Otaku no Onna Tomodachi to Issen Koeta Hanashi,[散文的マジョリティや] オタクの女友達と一線越えた話,Otaku no Onna Tomodachi to Issen Koeta Hanashi,japanese,,,doujinshi,original,,"blowjob, sole female, sole male, pixie cut",36,2026-03-01 02:33:40,2026-03-01 02:33:40,2026-03-02 14:00:59
633556,[カンパチオレンジ (かんぱちいも)] 優等生な義姉のオナニーを目撃しちゃった話,[カンパチオレンジ (かんぱちいも)] 優等生な義姉のオナニーを目撃しちゃった話,優等生な義姉のオナニーを目撃しちゃった話,japanese,,,doujinshi,original,,"handjob, inseki, kissing, big breasts, masturbation, nakadashi, hairy, incest, sister, sole female, sole male",52,2026-03-01 02:36:54,2026-03-01 02:36:54,2026-03-02 14:00:59
633557,[クルマヤ公道] ずっと離さないでね。-オナホな無感情幼馴染と純愛に堕ちるまで- 書き下ろし単品販売,[クルマヤ公道] ずっと離さないでね。-オナホな無感情幼馴染と純愛に堕ちるまで- 書き下ろし単品販売,ずっと離さないでね。書き下ろし単品販売,japanese,,kurumaya koudou,doujinshi,original,,"small breasts, sole female, sole male",12,2026-03-01 02:37:49,2026-03-01 02:37:49,2026-03-02 14:01:00
633558,[のらくらり。 (ねむ)] メスネコ！ランホアちゃん,[のらくらり。 (ねむ)] メスネコ！ランホアちゃん,メスネコ！ランホアちゃん,japanese,nemu,norakurari.,doujinshi,original,,"big breasts, nakadashi, ahegao, muscle, catgirl, sole female, sole male, kemonomimi, tail",19,2026-03-01 02:39:00,2026-03-01 02:39:00,2026-03-02 14:01:02
633559,[カンパチオレンジ (かんぱちいも)] 初めてデリヘルを呼んだら元同級生が来た話,[カンパチオレンジ (かんぱちいも)] 初めてデリヘルを呼んだら元同級生が来た話,初めてデリヘルを呼んだら元同級生が来た話,japanese,,,doujinshi,original,,"big breasts, prostitution, sole female, sole male, pixie cut",58,2026-03-01 02:42:26,2026-03-01 02:42:26,2026-03-02 14:01:04
633560,[弩助平百合帝国 (スズオ)] 無表情お姉さんにオナサポしてもらう話,[弩助平百合帝国 (スズオ)] 無表情お姉さんにオナサポしてもらう話,無表情お姉さんにオナサポしてもらう話,japanese,,,doujinshi,original,,"females only, sex toys, yuri, fingering, nipple stimulation",28,2026-03-01 02:44:21,2026-03-01 02:44:21,2026-03-02 14:01:05
633561,[Mendakoya-san] Motto Motto Tanoshimou! (Blue Archive),[メンダコ屋さん] もっともっと楽しもう！ (ブルーアーカイブ),Motto Motto Tanoshimou!,japanese,,,doujinshi,blue archive,"asuna ichinose, sensei","big breasts, bunny girl, sole female, sole male, halo",37,2026-03-01 02:46:44,2026-03-01 02:46:44,2026-03-02 14:01:06
633562,"[Macaron Sugar] Doutei Daisuki Jogakusei-chan, Zetsurin Doutei ni Haiboku suru -Fourth Happiness-",[まかろんシュガー] 童貞大好き女学生ちゃん、絶倫童貞に敗北する―Fourth Happiness―,Doutei Daisuki JogakuseiFourth Happiness-,japanese,,macaron sugar,doujinshi,original,,"squirting, big breasts, pregnant, nakadashi, ahegao, anal, multi-work series, mosaic censorship, blowjob, sole female, sole male",63,2026-03-01 02:50:27,2026-03-01 02:50:27,2026-03-02 14:01:07
633563,[有幻草原] いびつなキミへのレクイエム,[有幻草原] いびつなキミへのレクイエム,いびつなキミへのレクイエム,japanese,,yuugen sougen,doujinshi,original,,"thigh high boots, leotard, sole female, clothed female nude male, pixie cut, gloves",39,2026-03-01 02:52:48,2026-03-01 02:52:48,2026-03-02 14:01:08
633564,[SSR] マキマの性欲処理方法 (チェンソーマン),[SSR] マキマの性欲処理方法 (チェンソーマン),マキマの性欲処理方法,japanese,,,doujinshi,chainsaw man,makima,"group, nakadashi, harem, sole female",21,2026-03-01 02:54:17,2026-03-01 02:54:17,2026-03-02 14:01:09
633565,[菩提じゅん] 俺の部屋に入り浸ってるチョロそうなギャル●●をハメる。2,[菩提じゅん] 俺の部屋に入り浸ってるチョロそうなギャル●●をハメる。2,俺の部屋に入り浸ってるチョロそうなギャル●●をハメる。2,japanese,,,doujinshi,original,,"big breasts, hairy, full color, tanlines, gyaru, sole female, sole male",28,2026-03-01 02:56:09,2026-03-01 02:56:09,2026-03-02 14:01:10
633566,[ぱすとG (かまとりぽかり)] 愛妻を元彼に寝取らせ ［総集編］,[ぱすとG (かまとりぽかり)] 愛妻を元彼に寝取らせ ［総集編］,愛妻を元彼に寝取らせ ［総集編］,japanese,kamatori pokari,past gadget,doujinshi,,,"big breasts, netorare, condom, nakadashi, filming, mosaic censorship, sole female, soushuuhen, netorase",206,2026-03-01 03:08:32,2026-03-01 03:08:32,2026-03-02 14:01:11
633567,[ミコテン屋] 先輩の女になっていいですか？,[ミコテン屋] 先輩の女になっていいですか？,先輩の女になっていいですか？,japanese,,,doujinshi,,,"big breasts, netorare, schoolgirl uniform, blowjob",43,2026-03-01 03:11:23,2026-03-01 03:11:23,2026-03-02 14:01:12
633568,[焼酎MAC (ほずみけんじ)] 対魔忍孕み堕ち (対魔忍ユキカゼ),[焼酎MAC (ほずみけんじ)] 対魔忍孕み堕ち (対魔忍ユキカゼ),対魔忍孕み堕ち,japanese,hozumi kenji,shouchuu mac,doujinshi,taimanin rpg,,"kissing, big breasts, pregnant, breast feeding, lactation, blowjob, big penis, twintails",291,2026-03-01 03:27:50,2026-03-01 03:27:50,2026-03-02 14:01:15
633569,[ホルモン食堂 (アリマセカイ)] ぼくとお姉さんのヒミツ遊び5,[ホルモン食堂 (アリマセカイ)] ぼくとお姉さんのヒミツ遊び5,ぼくとお姉さんのヒミツ遊び5,japanese,arima sekai,,doujinshi,,,big breasts,85,2026-03-01 03:33:10,2026-03-01 03:33:10,2026-03-02 14:01:18
633570,[Difference] Lazy older sister VS intruder,【差分】ぐーたらお姉ちゃんVS侵入者,Lazy older sister VS intruder,japanese,,difference,doujinshi,,,"squirting, sex toys, bondage, multiple orgasms, clit stimulation",34,2026-03-01 03:35:21,2026-03-01 03:35:21,2026-03-02 14:01:19
633571,[R1kyu (R1kyu)] Chounyuu kinpatsu sensei to chinshota,[R1級 (あーるいっきゅう)] 超乳金髪先生と巨チンシ〇タ,Chounyuu kinpatsu sensei to chinshota,japanese,r1kyuu,,doujinshi,pokemon | pocket monsters,briar,"milf, big ass, nakadashi, huge breasts, blowjob, big penis, stomach deformation, sole female, sole male, bald, gigantic breasts, pixie cut, cumflation",21,2026-03-01 03:36:51,2026-03-01 03:36:51,2026-03-02 14:01:19
633572,[Doraias Kazuyo] I just couldn't say no to him..♥ [English],,I just couldn't say no to him..♥,"english, translated",doraias kazuyo,,doujinshi,,,"big breasts, netorare, cheating, nakadashi, huge breasts, big penis, sole female, sole male, smalldom",5,2026-03-01 03:37:28,2026-03-01 03:37:28,2026-03-02 14:01:20
