ID,EN_TITLE,JP_TITLE,CLEAN_TITLE,LANGUAGE,ARTIST,GROUP_NAME,CATEGORY,PARODY,CHARACTER,TAGS,PAGES,UPLOAD_DATE,FORMATTED_DATE,SCRAPED_DATE
634333,[Tanioku no Kaeru (Ameno Kaeru)] Namaiki Mesugaki VS Yasaoji,[谷奥の蛙 (飴音かえる)] 生意気メスガキVSやさおじ,Namaiki Mesugaki VS Yasaoji,japanese,ameno kaeru,tanioku no kaeru,doujinshi,,,,28,2026-03-03 22:15:53,2026-03-03 22:15:53,2026-03-04 14:02:25
634334,[Angelic Feather (Land Sale)] Flan-chan to H na Omamagoto (Touhou Project) [Digital],[天使の羽 (蘭戸せる)] フランちゃんとHなおままごと (東方Project) [Digital],Flan-chan to H na Omamagoto,japanese,,,doujinshi,touhou project,flandre scarlet,,22,2026-03-03 22:17:52,2026-03-03 22:17:52,2026-03-04 14:02:26
634335,[Ankoman] Rin Tohsaka in the gym storage room with Shinji (Fate/stay night) [English],[あんこまん] 遠坂凛、慎二と体育倉庫で…❤ (Fate/stay night),Rin Tohsaka in the gym storage room with Shinji,"english, translated",,,doujinshi,fate stay night,"shinji matou, rin tosaka","big breasts, twintails",13,2026-03-03 22:18:51,2026-03-03 22:18:51,2026-03-04 14:02:26
634336,[Angelic Feather (Land Sale)] Flan-chan no Ero Trap Dungeon HARDCORE TAIL (Touhou Project) [Digital],[天使の羽 (蘭戸せる)] フランちゃんのエロトラップダンジョンHARDCORE TAIL (東方Project) [DL版],Flan-chan no Ero Trap Dungeon HARDCORE TAIL,japanese,land sale,angelic feather,doujinshi,touhou project,flandre scarlet,,22,2026-03-03 22:20:26,2026-03-03 22:20:26,2026-03-04 14:02:27
634337,[Angelic Feather (Land Sale)] Imouto-tachi ga H Sugiru! (Touhou Project) [Digital],[天使の羽 (蘭戸せる)] 妹たちがHすぎるッ! (東方Project) [DL版],Imouto-tachi ga H Sugiru!,japanese,land sale,angelic feather,doujinshi,touhou project,"flandre scarlet, koishi komeiji",,22,2026-03-03 22:22:03,2026-03-03 22:22:03,2026-03-04 14:02:28
634338,[Angelic Feather (Land Sale)] Oppai Monde yo Onii-sama! (Touhou Project) [Digital],[天使の羽 (蘭戸せる)] おっぱい揉んでよお兄様っ! (東方Project) [Digital],Oppai Monde yo Onii-sama!,japanese,land sale,angelic feather,doujinshi,touhou project,flandre scarlet,,21,2026-03-03 22:23:34,2026-03-03 22:23:34,2026-03-04 14:02:28
634339,(Kakasasu Sai 2025) [Sankaku Irony (Furoa)] Kuufuku no Okyaku-sama (Naruto),(カカサス祭2025) [さんかくアイロニー (ふろあ)] 空腹のおきゃくさま (NARUTO -ナルト-),Kuufuku no Okyaku-sama,japanese,furoa,sankaku irony,doujinshi,naruto,"sasuke uchiha, kakashi hatake","anal, males only, yaoi, shotacon, tail, anal intercourse, detached sleeves",28,2026-03-03 23:05:24,2026-03-03 23:05:24,2026-03-04 14:02:29
634340,(C94) [Chelsea lip (Minato Yoshihiro)] Majo no Nokoriga | The Witch's Lingering Scent (Re:Zero kara Hajimeru Isekai Seikatsu) [English] [Thennos scans] [proyectoanimeh] [Colorized],(C94) [Chelsea lip (湊良弘)] 魔女ノ残り香 (Re:ゼロから始める異世界生活) [英訳] [カラー化],Majo no Nokoriga | The Witch's Lingering Scent,"english, translated",minato yoshihiro,chelsea lip,doujinshi,re zero kara hajimeru isekai seikatsu,"emilia, lucas","elf, virginity, big breasts, cunnilingus, full censorship, nakadashi, ahegao, defloration, full color, multi-work series, blowjob, deepthroat, sole female, sole male, very long hair",28,2026-03-03 23:07:15,2026-03-03 23:07:15,2026-03-04 14:02:30
634341,(C105) [Potato Salad (Himekuri)] SUMEBA MIYAKO! Vol. 3 | If you live in Miyako! 2 [English],(C105) [ぽてとさらだ (ヒめくり)] 住めばミヤコ! Vol.3,SUMEBA MIYAKO! Vol. 3 | If you live in Miyako! 2,"english, translated","kurisu, himekuri",potato salad,doujinshi,,,"futanari, big breasts, urethra insertion, schoolgirl uniform, nakadashi, multi-work series, stockings, possession",36,2026-03-04 00:02:48,2026-03-04 00:02:48,2026-03-05 14:00:08
634342,(C94) [Chelsea lip (Minato Yoshihiro)] Majo no Nokoriga | The Witch's Lingering Scent (Re:Zero kara Hajimeru Isekai Seikatsu) [English] [Thennos scans] [proyectoanimeh] [Colorized],(C94) [Chelsea lip (湊良弘)] 魔女ノ残り香 (Re:ゼロから始める異世界生活) [英訳] [カラー化],Majo no Nokoriga | The Witch's Lingering Scent,"english, translated",minato yoshihiro,chelsea lip,doujinshi,re zero kara hajimeru isekai seikatsu,"emilia, lucas","elf, virginity, big breasts, cunnilingus, full censorship, masturbation, nakadashi, ahegao, thigh high boots, x-ray, defloration, full color, multi-work series, blowjob, shotacon, deepthroat, sole female, sole male, very long hair",28,2026-03-04 00:08:11,2026-03-04 00:08:11,2026-03-05 14:00:09
634343,(C82) [Dai 6 Kichi (Kichirock)] Aokoi ~Alice no Hanashi~ | Aokoi ~Alice's Tale~ (Mahou Tsukai no Yoru),(C82) [第6基地 (キチロク)] 青恋〜有珠のはなし〜 (魔法使いの夜),Aokoi| Aokoi,"english, translated",kichirock,dai 6 kichi,doujinshi,mahou tsukai no yoru | witch on the holy night,alice kuonji,,9,2026-03-04 00:08:53,2026-03-04 00:08:53,2026-03-05 14:00:10
634344,[HoneyRoad (Bee Doushi)] ALISA -Donyoku na Ou no Wana- [Chinese] [MTL] [Digital],[HoneyRoad (Bee導師)] アリサ -貪欲な王の罠- [中国翻訳] [DL版],ALISA,"translated, chinese",bee doushi,honeyroad,doujinshi,,,"nakadashi, drugs, rape, dilf, bbm, sole female, sole male, rough translation",22,2026-03-04 00:10:18,2026-03-04 00:10:18,2026-03-05 14:00:10
634345,[Higehurai] Boku no Daisuki na Kaa-san to Omou Zonbun Sex Dekiru Hi 5,[Higehurai] Boku no Daisuki na Kaa-san to Omou Zonbun Sex Dekiru Hi 5,Boku no Daisuki na Kaa-san to Omou Zonbun Sex Dekiru Hi 5,"japanese, english",,higehurai,doujinshi,,,blowjob,38,2026-03-04 01:02:35,2026-03-04 01:02:35,2026-03-05 14:00:11
634346,[Yuna] Asa Okitara Imouto ga Hadaka Apron Sugata datta node Hamete Mita | I Woke Up to my Naked Apron Sister and Tried Fucking Her Ch. 1-18 [English] [1 2 Translations],[由那] 朝起きたら妹が裸エプロン姿だったのでハメてみた 第1-18話 [英訳],Asa Okitara Imouto ga Hadaka Apron Sugata datta node Hamete Mita | I Woke Up to my Naked Apron Sister and Tried Fucking Her Ch. 1-18,"english, translated",yuna,,manga,,,"squirting, sweating, swimsuit, cunnilingus, story arc, masturbation, schoolgirl uniform, condom, nakadashi, anal, sex toys, sleeping, kimono, solo action, x-ray, defloration, incest, apron, drunk, paizuri, fingering, sister, blowjob, sole male, ponytail, hidden sex, anal intercourse",439,2026-03-04 01:27:04,2026-03-04 01:27:04,2026-03-05 14:00:12
634347,[Technician] Jimi Kyonyuu Manager Netorareru [Chinese] [伴晚洲汉化] [Digital],[テクニシャン] 地味巨乳マネージャー寝取られる [中国翻訳] [DL版],Jimi Kyonyuu Manager Netorareru,"translated, chinese",,technician,doujinshi,,,"big breasts, netorare, schoolgirl uniform, condom, gyaru-oh, stockings, blackmail, sole female, twintails",45,2026-03-04 01:29:57,2026-03-04 01:29:57,2026-03-05 14:00:12
634348,"[Takamarikka] Hajimete no Kanojo, Senpai ni NTRre Kairaku ni Shizumu [Chinese] [伴晚洲汉化] [Digital]",[たかまりっか] 初めての彼女、先輩にNTRれ快楽に沈む [中国翻訳] [DL版],"Hajimete no Kanojo, Senpai ni NTRre Kairaku ni Shizumu","translated, chinese",takamarikka,takamarikka,doujinshi,,,"big breasts, netorare, schoolgirl uniform, sole female",52,2026-03-04 01:33:01,2026-03-04 01:33:01,2026-03-05 14:00:13
634349,(C107) [TearDrop (tsuina)] D Dungeon for adult lv. 9 (To Heart),,D Dungeon for adult lv. 9,japanese,tsuina,tear drop,doujinshi,to heart,tomoko hoshina,"big breasts, mmf threesome, glasses, full color, multi-work series, fingering, rape, sole female, ponytail, nipple stimulation",25,2026-03-04 01:34:41,2026-03-04 01:34:41,2026-03-05 14:00:14
634350,[F.W.ZHolic (FAN)] Mating Policy with Dominant Races [Digital] [English],[F.W.ZHolic (FAN)] 優性種族との交配政策 [DL版],Mating Policy with Dominant Races,"english, translated",fan,f.w.zholic,doujinshi,original,,"cum swap, sweating, kissing, big breasts, chastity belt, double anal, piercing, pregnant, mmf threesome, foot insertion, dark nipples, group, glasses, netorare, pasties, nakadashi, ahegao, huge breasts, freckles, anal, tall man, hairy, dark skin, pubic stubble, double penetration, big areolae, lactation, stockings, pantyhose, rimjob, paizuri, gaping, blowjob, muscle, big penis, stomach deformation, fisting, bisexual, bald, beauty mark, ponytail, twintails, fishnets, anal intercourse, exposed clothing, rough translation, nipple piercing",40,2026-03-04 01:37:11,2026-03-04 01:37:11,2026-03-05 14:00:14
634351,[yasaka] Joutei Denka (Uma Musume Pretty Derby),[yasaka] 女帝殿下 (ウマ娘 プリティーダービー),Joutei Denka,japanese,,,doujinshi,uma musume pretty derby,"air groove, fine motion","big breasts, mmf threesome, group, uncensored, nakadashi, rape, horse girl, kemonomimi",135,2026-03-04 01:45:15,2026-03-04 01:45:15,2026-03-05 14:00:15
634352,[Taishou Romanesque (Toono Suika)] Kanojo ga Kami o Someta Wake ~Kataomoi no Seiso Kurokami Ojou-sama ga Boku no Shiranai Tokoro de Otoko no Aji o Oboeru Hanashi~ | The Real Reason She Changed Her Hair [English] [Team Rabu2] [Digital],[大正ロマネスク (遠野すいか)] 彼女が髪を染めた訳 ~片思いの清楚黒髪お嬢様が僕の知らない所でオトコの味を覚える話~ [英訳] [DL版],Kanojo ga Kami o Someta Wake| The Real Reason She Changed Her Hair,"english, translated",toono suika,taishou romanesque,doujinshi,,,"big breasts, piercing, netorare, moral degeneration, hairy, dark skin, drugs, gyaru, blackmail, muscle, sunglasses, collar, sole female, sole male, bald",52,2026-03-04 02:03:21,2026-03-04 02:03:21,2026-03-05 14:00:15
634353,(C67) [Kotori Jimusho (Sakura Bunchou)] Song of Farewell | chanson de I'adieu (Sailor Moon) (VGT13) (English),(C67) [小鳥事務所 (桜文鳥)] chanson de I'adieu (セーラームーン),Song of Farewell | chanson de I'adieu,"english, translated",sakura bunchou,kotori jimusho,doujinshi,sailor moon | bishoujo senshi sailor moon,"shingo tsukino, sailor moon | usagi tsukino, sailor mercury | ami mizuno","handjob, transformation, magical girl, anal, brother, thigh high boots, footjob, incest, bukkake, sister, blowjob, sole male, twintails, clothed female nude male, apparel bukkake, rough translation",66,2026-03-04 02:07:27,2026-03-04 02:07:27,2026-03-05 14:00:16
634354,对雌 蛛俐篇,,对雌 蛛俐篇,"japanese, chinese",,,doujinshi,,,webtoon,15,2026-03-04 02:08:42,2026-03-04 02:08:42,2026-03-05 14:00:16
634355,[テフル] チン比べmrt (にじさんじ),[テフル] チン比べmrt (にじさんじ),チン比べmrt,japanese,,,doujinshi,nijisanji,kuramochi meruto,"big breasts, dark skin, vtuber",7,2026-03-04 02:09:19,2026-03-04 02:09:19,2026-03-05 14:00:17
634356,[テフル] スポンサー接待dr-n (にじさんじ),[テフル] スポンサー接待dr-n (にじさんじ),スポンサー接待dr-n,japanese,,,doujinshi,nijisanji,higuchi kaede,"big breasts, dark skin, x-ray, sole female, sole male, vtuber",7,2026-03-04 02:09:53,2026-03-04 02:09:53,2026-03-05 14:00:17
634357,[テフル] 女子〇生d-r様 (にじさんじ),[テフル] 女子〇生d-r様 (にじさんじ),女子〇生d-r様,japanese,,,doujinshi,nijisanji,dola,"big breasts, schoolgirl uniform, dark skin, collar, sole female, sole male, horns, vtuber, painted nails",7,2026-03-04 02:10:26,2026-03-04 02:10:26,2026-03-05 14:00:18
634358,[テフル] 配信後のlzrr (にじさんじ),[テフル] 配信後のlzrr (にじさんじ),配信後のlzrr,japanese,,,doujinshi,nijisanji,"lize helesta, suzuhara lulu","big breasts, dark skin, stockings, collar, sole male, vtuber",9,2026-03-04 02:11:05,2026-03-04 02:11:05,2026-03-05 14:00:18
634359,[テフル] ほし〇れんず (にじさんじ),[テフル] ほし〇れんず (にじさんじ),ほし〇れんず,japanese,,,doujinshi,nijisanji,"hoshikawa sara, furen e lustario","big breasts, dark skin, collar, sole male, heterochromia, vtuber",7,2026-03-04 02:11:43,2026-03-04 02:11:43,2026-03-05 14:00:18
634360,[テフル] 搾り取られる千夏 (ゼンレスゾーンゼロ),[テフル] 搾り取られる千夏 (ゼンレスゾーンゼロ),搾り取られる千夏,japanese,,,doujinshi,zenless zone zero,"evelyn chevalier, sunna",big breasts,9,2026-03-04 02:12:22,2026-03-04 02:12:22,2026-03-05 14:00:19
634361,[テフル] マゾdr-n (にじさんじ),[テフル] マゾdr-n (にじさんじ),マゾdr-n,japanese,,,doujinshi,nijisanji,higuchi kaede,"big breasts, sex toys, dark skin, stockings, collar, sole female, sole male, bald, vtuber",5,2026-03-04 02:12:50,2026-03-04 02:12:50,2026-03-05 14:00:20
634362,[テフル] エレンのブチギレオナニー (ゼンレスゾーンゼロ),[テフル] エレンのブチギレオナニー (ゼンレスゾーンゼロ),エレンのブチギレオナニー,japanese,,,doujinshi,zenless zone zero,ellen joe,"sex toys, pantyhose, collar, beauty mark",7,2026-03-04 02:13:25,2026-03-04 02:13:25,2026-03-05 14:00:21
634363,[テフル] ハメ潰しskn (結城さくな),[テフル] ハメ潰しskn (結城さくな),ハメ潰しskn,japanese,,,doujinshi,,yuuki sakuna,"squirting, big breasts, unusual pupils, dark skin, full color, first person perspective, catgirl, sole female, vtuber, bite mark",7,2026-03-04 03:00:51,2026-03-04 03:00:51,2026-03-05 14:00:21
634364,[テフル] 敗北claさん (にじさんじ),[テフル] 敗北claさん (にじさんじ),敗北claさん,japanese,,,doujinshi,nijisanji,sister claire,"big breasts, dark skin, x-ray, sole female, sole male, vtuber, gloves",7,2026-03-04 03:01:24,2026-03-04 03:01:24,2026-03-05 14:00:22
634365,Melonbooks Sexy Girls Collection 2020 Spring,,Melonbooks Sexy Girls Collection 2020 Spring,japanese,,,doujinshi,,,"swimsuit, artbook, bloomers",54,2026-03-04 03:04:45,2026-03-04 03:04:45,2026-03-05 14:00:22
634366,[Okina] Hina-chan Choukyou Nikki [Ongoing],[OKINA] 陽菜ちゃん調教日記 [進行中],Hina-chan Choukyou Nikki,japanese,okina,,doujinshi,original,,"kissing, chastity belt, gag, torture, cunnilingus, vomit, enema, urination, nakadashi, anal, sex toys, bondage, wooden horse, dark skin, lolicon, x-ray, full color, orgasm denial, gaping, rape, blowjob, collar, shibari, deepthroat, slave, sole female, sole male, tail plug, twintails, leash, petplay, focus anal, anal intercourse, crying, confinement",87,2026-03-04 03:20:11,2026-03-04 03:20:11,2026-03-05 14:00:23
634367,[Aomi Dream Maker (Initsuki Ringo)] Batsu Game Josou [English] [mysterymeat3],[あおみどりーむめーかー (いにつき林檎)] バツゲーム女装 [英訳],Batsu Game Josou,"english, translated",initsuki ringo,aomi dream maker,doujinshi,,,"schoolgirl uniform, anal, crossdressing, x-ray, males only, yaoi, tomgirl, shotacon, feminization, anal intercourse",22,2026-03-04 03:24:35,2026-03-04 03:24:35,2026-03-05 14:00:23
634368,[Imitation Moon (Narumi Yuu)] Higan no Hana-dachi wa Youen ni Sakihokoru (Lycoris Recoil) [TextRemoved],[Imitation Moon (成海優)] 彼岸の華達は妖艶に咲き誇る (リコリス・リコイル),Higan no Hana-dachi wa Youen ni Sakihokoru,japanese,narumi yuu,imitation moon,doujinshi,lycoris recoil,"chisato nishikigi, takina inoue","big breasts, corruption, piercing, machine, latex, mind control, multi-work series, bodysuit, rape, crotch tattoo, gloves",28,2026-03-04 04:02:17,2026-03-04 04:02:17,2026-03-05 14:00:24
634369,[テフル] 寝取られリリス (Fate/Grand Order),[テフル] 寝取られリリス (Fate/Grand Order),寝取られリリス,japanese,,,doujinshi,fate grand order,lilith,"big breasts, demon girl, dark skin, collar, sole female, sole male, crotch tattoo, twintails, horns",7,2026-03-04 04:02:53,2026-03-04 04:02:53,2026-03-05 14:00:24
634370,[テフル] 寝取られレディ・アヴァロン (Fate/Grand Order),[テフル] 寝取られレディ・アヴァロン (Fate/Grand Order),寝取られレディ・アヴァロン,japanese,,,doujinshi,fate grand order,merlin prototype,"big breasts, dark skin, collar, sole female, sole male, fishnets",9,2026-03-04 04:03:30,2026-03-04 04:03:30,2026-03-05 14:00:25
634371,[テフル] チン負けdr-n (にじさんじ),[テフル] チン負けdr-n (にじさんじ),チン負けdr-n,japanese,,,doujinshi,nijisanji,higuchi kaede,"big breasts, dark skin, sole female, sole male, ponytail, vtuber",7,2026-03-04 04:04:07,2026-03-04 04:04:07,2026-03-05 14:00:26
634372,[テフル] 寝取られ邪ンヌ (Fate/Grand Order),[テフル] 寝取られ邪ンヌ (Fate/Grand Order),寝取られ邪ンヌ,japanese,,,doujinshi,fate grand order,"jeanne darc, jeanne alter","big breasts, dark skin, stockings, collar, sole female, sole male",13,2026-03-04 04:05:04,2026-03-04 04:05:04,2026-03-05 14:00:27
634373,[テフル] おもちゃのお師匠様 (ゼンレスゾーンゼロ),[テフル] おもちゃのお師匠様 (ゼンレスゾーンゼロ),おもちゃのお師匠様,japanese,,,doujinshi,zenless zone zero,yixuan,"big breasts, unusual pupils, blowjob, collar, sole female, sole male, shaved head, gloves",7,2026-03-04 04:05:42,2026-03-04 04:05:42,2026-03-05 14:00:27
634374,[Seika Kairaku Shoten (Kuchiba Koki)] Hyouten no Kishi Alicia ~Seigi no Hime Kishi ga Maou no Utsuwa ni Somari Ochiru Toki kara~ [Digital] [English],[聖華快楽書店 (朽葉コキ)] 憑転の騎士アリシア〜正義の姫騎士が魔王の器に染まり堕ちる時から〜 [DL版],Hyouten no Kishi Alicia,"english, translated",,seika kairaku shoten,doujinshi,,,"big breasts, corruption, netorare, masturbation, possession, crotch tattoo",39,2026-03-04 04:08:03,2026-03-04 04:08:03,2026-03-05 14:00:28
634375,[テフル] チアnyi (にじさんじ),[テフル] チアnyi (にじさんじ),チアnyi,japanese,,,doujinshi,nijisanji,nui sociere,"big breasts, swimsuit, unusual pupils, dark skin, sole female, sole male, bald, ponytail, vtuber",7,2026-03-04 04:08:40,2026-03-04 04:08:40,2026-03-05 14:00:29
634376,[テフル] 表と裏 (にじさんじ),[テフル] 表と裏 (にじさんじ),表と裏,japanese,,,doujinshi,nijisanji,higuchi kaede,"kissing, big breasts, unusual pupils, schoolgirl uniform, dark skin, sole female, sole male, bald, ponytail, vtuber",7,2026-03-04 04:09:08,2026-03-04 04:09:08,2026-03-05 14:00:29
634377,[テフル] 体外式アクメrcちゃん (にじさんじ),[テフル] 体外式アクメrcちゃん (にじさんじ),体外式アクメrcちゃん,japanese,,,doujinshi,nijisanji,kaburaki roco,"big breasts, unusual pupils, dark skin, collar, first person perspective, sole female, sole male, vtuber, hair buns",7,2026-03-04 04:09:43,2026-03-04 04:09:43,2026-03-05 14:00:30
634378,[テフル] チン堕ちhskw (にじさんじ),[テフル] チン堕ちhskw (にじさんじ),チン堕ちhskw,japanese,,,doujinshi,nijisanji,hoshikawa sara,"big breasts, unusual pupils, dark skin, collar, sole female, sole male, heterochromia, ponytail, vtuber",9,2026-03-04 04:10:24,2026-03-04 04:10:24,2026-03-05 14:00:30
634379,[テフル] ふたなりシスター,[テフル] ふたなりシスター,ふたなりシスター,japanese,,,doujinshi,,,"futanari, big breasts, nun, x-ray, sole dickgirl, dickgirl on female",7,2026-03-04 04:11:01,2026-03-04 04:11:01,2026-03-05 14:00:31
634380,[テフル] おマ〇コ処刑10秒前 (にじさんじ),[テフル] おマ〇コ処刑10秒前 (にじさんじ),おマ〇コ処刑10秒前,japanese,,,doujinshi,nijisanji,shiina yuika,"squirting, big breasts, schoolgirl uniform, dark skin, fingering, sole female, sole male, vtuber",5,2026-03-04 04:11:28,2026-03-04 04:11:28,2026-03-05 14:00:31
634381,[Oroboy] My Older Sister Is Having Sex with My Friend,[オロボーイ] 姉が友達とヤる,My Older Sister Is Having Sex with My Friend,"english, translated",,oroboy,doujinshi,,,"sweating, big breasts, nakadashi, hairy, full color, tanlines, filming, mosaic censorship, sister, voyeurism, sole female, beauty mark, rough translation, netorase",22,2026-03-04 04:12:55,2026-03-04 04:12:55,2026-03-05 14:00:32
634382,[Oh Chang & Soul Escape] 欢迎登录匿名乐园 | 匿名圈套 | Anonymous 7 1-10 [End] [Chinese],[Oh Chang & Soul Escape] 欢迎登录匿名乐园 | 匿名圈套 | 歡迎登錄匿名樂園 | 匿名圈套 | 익명7 1-10 [完结] [中文],欢迎登录匿名乐园 | 匿名圈套 | Anonymous 7 1-10,"translated, chinese",,,manga,,,webtoon,207,2026-03-04 04:27:38,2026-03-04 04:27:38,2026-03-05 14:00:32
634383,[Mustard Teikoku (Europia)] The story of how I ended up living with my mom in a four-and-a-half tatami room 1. [WaterKujo] [English],[マスタード帝国 (ゆーろぴあ)] 四畳半の俺の部屋で母ちゃんと住むことになった話 1,The story of how I ended up living with my mom in a foura-half tatami room 1.,"english, translated",,europia,doujinshi,,,"milf, kissing, big breasts, cheating, breast feeding, condom, ahegao, mother, incest, drunk, paizuri, sole female, sole male, beauty mark, hair buns",58,2026-03-04 04:31:12,2026-03-04 04:31:12,2026-03-05 14:00:33
634384,"[Ankoman] Saber, Botebara Bloomer de Shinji to… (Fate/stay night) [Chinese] [黎欧出资汉化]",(あんこまん)] セイバー、ボテ腹ブルマで慎二と…❤ (Fate/stay night) [中国翻訳],"Saber, Botebara Bloomer de Shinji to…","translated, chinese",ankoman,,doujinshi,fate stay night,saber | arturia pendragon,"big breasts, pregnant, ahegao, huge breasts, lactation, stockings, big penis, sole female, sole male",19,2026-03-04 04:32:30,2026-03-04 04:32:30,2026-03-05 14:00:34
634385,[アキカン] ゆるふわママに甘えたい [DL版][紅必登個漢],[アキカン] ゆるふわママに甘えたい [中国翻訳],ゆるふわママに甘えたい,"translated, chinese",akikan,akikan,doujinshi,,,"inseki, milf, kissing, big breasts, big ass, cheating, breast feeding, ahegao, blowjob face, mother, hairy, incest, big areolae, lingerie, fingering, mosaic censorship, blowjob, sole male, beauty mark, closed eyes, thick eyebrows, nipple stimulation",64,2026-03-04 04:36:15,2026-03-04 04:36:15,2026-03-05 14:00:34
634386,[テフル] 反応の違い (にじさんじ),[テフル] 反応の違い (にじさんじ),反応の違い,japanese,,,doujinshi,nijisanji,hoshikawa sara,"big breasts, unusual pupils, dark skin, sole female, heterochromia, vtuber",5,2026-03-04 05:00:53,2026-03-04 05:00:53,2026-03-05 14:00:35
634387,[テフル] 接待エレン (ゼンレスゾーンゼロ),[テフル] 接待エレン (ゼンレスゾーンゼロ),接待エレン,japanese,,,doujinshi,zenless zone zero,ellen joe,"unusual pupils, collar, sole female, sole male, shaved head, beauty mark, tail, gloves, shark girl",7,2026-03-04 05:01:25,2026-03-04 05:01:25,2026-03-05 14:00:35
634388,[テフル] ソンヒと紗栄子,[テフル] ソンヒと紗栄子,ソンヒと紗栄子,japanese,,,doujinshi,,,"maid, big breasts, unusual pupils, dark skin, sole male, exposed clothing",7,2026-03-04 05:01:56,2026-03-04 05:01:56,2026-03-05 14:00:36
634389,[テフル] ザコメスビビアン (ゼンレスゾーンゼロ),[テフル] ザコメスビビアン (ゼンレスゾーンゼロ),ザコメスビビアン,japanese,,,doujinshi,zenless zone zero,vivian banshee,"kissing, big breasts, unusual pupils, pantyhose, sole female, sole male, beauty mark",7,2026-03-04 05:02:35,2026-03-04 05:02:35,2026-03-05 14:00:36
634390,[テフル] 新衣装d-r様 (にじさんじ),[テフル] 新衣装d-r様 (にじさんじ),新衣装d-r様,japanese,,,doujinshi,nijisanji,dola,"big breasts, unusual pupils, dark skin, x-ray, paizuri, sole female, sole male, clothed paizuri, horns, vtuber",7,2026-03-04 05:03:08,2026-03-04 05:03:08,2026-03-05 14:00:37
634391,[テフル] 反応の違い (にじさんじ),[テフル] 反応の違い (にじさんじ),反応の違い,japanese,,,doujinshi,nijisanji,furen e lustario,"big breasts, unusual pupils, dark skin, sole female, vtuber",5,2026-03-04 05:03:36,2026-03-04 05:03:36,2026-03-05 14:00:37
634392,[テフル] メス堕ちrucoちゃん (にじさんじ),[テフル] メス堕ちrucoちゃん (にじさんじ),メス堕ちrucoちゃん,japanese,,,doujinshi,nijisanji,suzuki masaru,"unusual pupils, schoolgirl uniform, collar, sole female, sole male, twintails, clothed female nude male, vtuber",9,2026-03-04 05:04:18,2026-03-04 05:04:18,2026-03-05 14:00:38
634393,[テフル] 四天王 (にじさんじ),[テフル] 四天王 (にじさんじ),四天王,japanese,,,doujinshi,nijisanji,"higuchi kaede, dola, nui sociere, furen e lustario","big breasts, unusual pupils, group, rimjob, sole male, shaved head, ponytail, vtuber",7,2026-03-04 05:04:52,2026-03-04 05:04:52,2026-03-05 14:00:38
634394,[テフル] 人妻エーテル,[テフル] 人妻エーテル,人妻エーテル,japanese,,,doujinshi,,,"big breasts, unusual pupils, dark skin, sole female, sole male",11,2026-03-04 05:05:40,2026-03-04 05:05:40,2026-03-05 14:00:39
634395,[テフル] 敗北彦斎ちゃん (Fate/Grand Order),[テフル] 敗北彦斎ちゃん (Fate/Grand Order),敗北彦斎ちゃん,japanese,,,doujinshi,fate grand order,,"big breasts, unusual pupils, mmf threesome, group, dark skin, double penetration, sole female",9,2026-03-04 05:06:26,2026-03-04 05:06:26,2026-03-05 14:00:39
634396,[テフル] 同じクラスの子 (にじさんじ),[テフル] 同じクラスの子 (にじさんじ),同じクラスの子,japanese,,,doujinshi,nijisanji,furen e lustario,"big breasts, unusual pupils, schoolgirl uniform, dark skin, x-ray, pantyhose, sole female, sole male, vtuber",7,2026-03-04 05:07:02,2026-03-04 05:07:02,2026-03-05 14:00:40
634397,(C58) [Motchie Kingdom (Motchie)] CRAZY D act 2 (Mister Ajikko) [Chinese],(C58) [もっちー王国 (もっちー)] CRAZY D act 2 (ミスター味っ子) [中国翻訳],CRAZY D act 2,"translated, chinese",motchie,motchie kingdom,doujinshi,mister ajikko,noriko ajiyoshi,"milf, big breasts, mother, incest",50,2026-03-04 05:10:03,2026-03-04 05:10:03,2026-03-05 14:00:41
